,FacilityID,DepartmentID,Cost Center,Product,Start Date,End Date,Amount,Unit,Edit Date,User,Duplicate,Total Count,Unique Edit Date Count,Duplicate Edit Date Count,Edit Date Aggregated,Unique User Count,Duplicate User Count
0,Tucson AZ,DefaultDept,Aircraft Maintenance,5070 - SIFCO Process Solution Cadmium LHE,1/31/2020 12:00,1/31/2020 12:00,0.264172051,gal,8/27/2020 18:05,adminbomed,1,1,1,0,{'2020-08-27 18:05:55': 1},1,0
1,Tucson AZ,DefaultDept,Aircraft Maintenance,5070 - SIFCO Process Solution Cadmium LHE,3/5/2020 12:00,3/5/2020 12:00,0.264172051,gal,8/27/2020 18:05,adminbomed,1,1,1,0,{'2020-08-27 18:05:46': 1},1,0
2,Wichita KS,DefaultDept,(PL) Painting Ops-Bldg 5D (GLOBAL) EU-NEWAEROPB11,Blend: F63TXA 4892-8716 - V66V29 (6:1),5/18/2020 0:00,5/18/2020 0:00,0.0546875,gal,8/25/2020 12:21,Kamiander,1,1,1,0,{'2020-08-25 12:21:38': 1},1,0
3,Wichita KS,DefaultDept,(PL) Painting Ops-Bldg 5D (GLOBAL) EU-NEWAEROPB11,Blend: ISC 909R - ISB 910R - (1:1),5/8/2020 0:00,5/8/2020 0:00,0.002113376,gal,8/25/2020 13:02,Kamiander,1,1,1,0,{'2020-08-25 13:02:36': 1},1,0
4,Wichita KS,DefaultDept,(PL) Painting Ops-Bldg 5D (GLOBAL) EU-NEWAEROPB11,Blend: ISC 909R - ISB 910R - (1:1),5/28/2020 0:00,5/28/2020 0:00,0.026417205,gal,8/25/2020 13:06,Kamiander,1,1,1,0,{'2020-08-25 13:06:25': 1},1,0
5,Wichita KS,DefaultDept,(PL) Painting Ops-Bldg 5D (GLOBAL) EU-NEWAEROPB11,Blend: ISC 909R - ISB 910R - (1:1),5/30/2020 0:00,5/30/2020 0:00,0.026417205,gal,8/25/2020 13:07,Kamiander,1,1,1,0,{'2020-08-25 13:07:49': 1},1,0
6,Wichita KS,DefaultDept,(PL) Painting Ops-Bldg 5D (GLOBAL) EU-NEWAEROPB11,Blend: ISC 909R - ISB 910R - (1:1),6/2/2020 0:00,6/2/2020 0:00,0.026417205,gal,8/25/2020 13:17,Kamiander,1,1,1,0,{'2020-08-25 13:17:00': 1},1,0
7,Wichita KS,DefaultDept,(PL) Painting Ops-Bldg 5D (GLOBAL) EU-NEWAEROPB11,Blend: ISC 909R - ISB 910R - (1:1),10/23/2020 11:30,10/23/2020 11:30,0.026417205,gal,1/6/2021 10:05,dlyon,1,1,1,0,{'2021-01-06 10:05:12': 1},1,0
8,Wichita KS,DefaultDept,(PL) Painting Ops-Bldg 5D (GLOBAL) EU-NEWAEROPB11,Blend: ISC 909R - ISB 910R - (1:1),11/3/2020 11:30,11/3/2020 11:30,0.026417205,gal,1/6/2021 10:19,dlyon,1,1,1,0,{'2021-01-06 10:19:23': 1},1,0
9,Wichita KS,DefaultDept,(PL) Painting Ops-Bldg 5D (GLOBAL) EU-NEWAEROPB11,Blend: ISC 909R - ISB 910R - (1:1),11/23/2020 9:30,11/23/2020 9:30,0.026417205,gal,1/6/2021 10:39,dlyon,1,1,1,0,{'2021-01-06 10:39:29': 1},1,0
10,Wichita KS,DefaultDept,(PL) Painting Ops-Bldg 5D (GLOBAL) EU-NEWAEROPB11,Blend: ISC 909R - ISB 910R - (1:1),12/2/2020 11:30,12/2/2020 11:30,0.026417205,gal,1/6/2021 10:52,dlyon,1,1,1,0,{'2021-01-06 10:52:15': 1},1,0
11,Wichita KS,DefaultDept,(PL) Painting Ops-Bldg 5D (GLOBAL) EU-NEWAEROPB11,Blend: PST-917 - PSC-507 - RED-937 - PCC-901 (1:.02:.05:.02),9/25/2019 9:00,9/25/2019 9:00,0.345537043,gal,1/13/2020 13:45,adminbomgb,1,1,1,0,{'2020-01-13 13:45:06': 1},1,0
12,Wichita KS,DefaultDept,(PL) Painting Ops-Bldg 5D (GLOBAL) EU-NEWAEROPB11,Blend: PST-917 - PSC-507 - RED-937 - PCC-901 (1:.02:.05:.02),10/7/2019 9:00,10/7/2019 9:00,0.057589507,gal,1/13/2020 13:54,adminbomgb,1,1,1,0,{'2020-01-13 13:54:16': 1},1,0
13,Wichita KS,DefaultDept,(PL) Painting Ops-Bldg 5D (GLOBAL) EU-NEWAEROPB11,Blend: PST-917 - PSC-507 - RED-937 - PCC-901 (1:.02:.05:.02),10/21/2019 9:00,10/21/2019 9:00,0.057589507,gal,1/13/2020 14:19,adminbomgb,1,1,1,0,{'2020-01-13 14:19:54': 1},1,0
14,Wichita KS,DefaultDept,(PL) Painting Ops-Bldg 5D (GLOBAL) EU-NEWAEROPB11,Blend: PST-917 - PSC-507 - RED-937 - PCC-901 (1:.02:.05:.02),10/24/2019 9:00,10/24/2019 9:00,0.057589507,gal,1/13/2020 14:24,adminbomgb,1,1,1,0,{'2020-01-13 14:24:01': 1},1,0
15,Wichita KS,DefaultDept,(PL) Painting Ops-Bldg 5D (GLOBAL) EU-NEWAEROPB11,Blend: PST-917 - PSC-507 - RED-937 - PCC-901 (1:.02:.05:.02),11/18/2019 9:00,11/18/2019 9:00,0.057589507,gal,1/13/2020 14:31,adminbomgb,1,1,1,0,{'2020-01-13 14:31:45': 1},1,0
16,Wichita KS,DefaultDept,(PL) Painting Ops-Bldg 5D (GLOBAL) EU-NEWAEROPB11,Blend: PST-917 - PSC-507 - RED-937 - PCC-901 (1:.02:.05:.02),11/27/2019 11:00,11/27/2019 11:00,0.057589507,gal,1/13/2020 14:39,adminbomgb,1,1,1,0,{'2020-01-13 14:39:16': 1},1,0
17,Wichita KS,DefaultDept,(PL) Painting Ops-Bldg 5D (GLOBAL) EU-NEWAEROPB11,Blend: PST-917 - PSC-507 - RED-937 - PCC-901 (1:.02:.05:.02),12/4/2019 9:00,12/4/2019 9:00,0.057589507,gal,1/13/2020 14:46,adminbomgb,1,1,1,0,{'2020-01-13 14:46:06': 1},1,0
18,Wichita KS,DefaultDept,(PL) Painting Ops-Bldg 5D (GLOBAL) EU-NEWAEROPB11,Blend: PST-917 - PSC-507 - RED-937 - PCC-901 (1:.02:.05:.02),12/16/2019 11:00,12/16/2019 11:00,0.057589507,gal,1/13/2020 15:03,adminbomgb,1,1,1,0,{'2020-01-13 15:03:12': 1},1,0
19,Wichita KS,DefaultDept,(PL) Painting Ops-Bldg 5D (GLOBAL) EU-NEWAEROPB11,Blend: PST-917 - PSC-507 - RED-937 - PCC-901 (1:.02:.05:.02),12/20/2019 11:00,12/20/2019 11:00,0.057589507,gal,1/13/2020 15:06,adminbomgb,1,1,1,0,{'2020-01-13 15:06:56': 1},1,0
20,Wichita KS,DefaultDept,(PL) Painting Ops-Bldg 5D (GLOBAL) EU-NEWAEROPB11,Blend: PST-917 - PSC-507 - RED-937 - PCC-901 (1:.02:.05:.02),12/23/2019 11:00,12/23/2019 11:00,0.057589507,gal,1/13/2020 15:10,adminbomgb,1,1,1,0,{'2020-01-13 15:10:23': 1},1,0
21,Wichita KS,DefaultDept,(PL) Painting Ops-Bldg 5D (GLOBAL) EU-NEWAEROPB11,Blend: PST-917 - PSC-507 - RED-937 - PCC-901 (1:.02:.05:.02),2/11/2020 16:58,2/11/2020 16:58,0.028794754,gal,5/7/2020 16:58,adminbomry,1,1,1,0,{'2020-05-07 16:58:49': 1},1,0
22,Wichita KS,DefaultDept,(PL) Painting Ops-Bldg 5D (GLOBAL) EU-NEWAEROPB11,Blend: PST-917 - PSC-507 - RED-937 - PCC-901 (1:.02:.05:.02),2/14/2020 17:02,2/14/2020 17:02,0.057589507,gal,5/7/2020 17:03,adminbomry,1,1,1,0,{'2020-05-07 17:03:29': 1},1,0
23,Wichita KS,DefaultDept,(PL) Painting Ops-Bldg 5D (GLOBAL) EU-NEWAEROPB11,Blend: PST-917 - PSC-507 - RED-937 - PCC-901 (1:.02:.05:.02),2/17/2020 17:15,2/17/2020 17:15,0.028794754,gal,5/7/2020 17:16,adminbomry,1,1,1,0,{'2020-05-07 17:16:27': 1},1,0
24,Wichita KS,DefaultDept,(PL) Painting Ops-Bldg 5D (GLOBAL) EU-NEWAEROPB11,Blend: PST-917 - PSC-507 - RED-937 - PCC-901 (1:.02:.05:.02),2/19/2020 17:20,2/19/2020 17:20,0.028794754,gal,5/7/2020 17:19,adminbomry,1,1,1,0,{'2020-05-07 17:19:51': 1},1,0
25,Wichita KS,DefaultDept,(PL) Painting Ops-Bldg 5D (GLOBAL) EU-NEWAEROPB11,Blend: PST-917 - PSC-507 - RED-937 - PCC-901 (1:.02:.05:.02),3/5/2020 1:50,3/5/2020 1:50,0.028794754,gal,8/19/2020 1:50,userbomry,1,1,1,0,{'2020-08-19 01:50:33': 1},1,0
26,Wichita KS,DefaultDept,(PL) Painting Ops-Bldg 5D (GLOBAL) EU-NEWAEROPB11,Blend: PST-917 - PSC-507 - RED-937 - PCC-901 (1:.02:.05:.02),3/8/2020 1:53,3/8/2020 1:53,0.575895071,gal,8/19/2020 1:53,userbomry,1,1,1,0,{'2020-08-19 01:53:53': 1},1,0
27,Wichita KS,DefaultDept,(PL) Painting Ops-Bldg 5D (GLOBAL) EU-NEWAEROPB11,Blend: PST-917 - PSC-507 - RED-937 - PCC-901 (1:.02:.05:.02),3/17/2020 1:56,3/17/2020 1:56,0.057589507,gal,8/19/2020 1:56,userbomry,1,1,1,0,{'2020-08-19 01:56:29': 1},1,0
28,Wichita KS,DefaultDept,(PL) Painting Ops-Bldg 5D (GLOBAL) EU-NEWAEROPB11,Blend: PST-917 - PSC-507 - RED-937 - PCC-901 (1:.02:.05:.02),3/27/2020 1:59,3/27/2020 1:59,0.028794754,gal,8/19/2020 1:58,userbomry,1,1,1,0,{'2020-08-19 01:58:55': 1},1,0
29,Wichita KS,DefaultDept,(PL) Painting Ops-Bldg 5D (GLOBAL) EU-NEWAEROPB11,Blend: PST-917 - PSC-507 - RED-937 - PCC-901 (1:.02:.05:.02),4/3/2020 0:00,4/3/2020 0:00,0.057589507,gal,6/9/2020 14:36,Kamiander,1,1,1,0,{'2020-06-09 14:36:07': 1},1,0
30,Wichita KS,DefaultDept,(PL) Painting Ops-Bldg 5D (GLOBAL) EU-NEWAEROPB11,Blend: PST-917 - PSC-507 - RED-937 - PCC-901 (1:.02:.05:.02),4/14/2020 0:00,4/14/2020 0:00,0.345537043,gal,6/9/2020 14:54,Kamiander,1,1,1,0,{'2020-06-09 14:54:31': 1},1,0
31,Wichita KS,DefaultDept,(PL) Painting Ops-Bldg 5D (GLOBAL) EU-NEWAEROPB11,Blend: PST-917 - PSC-507 - RED-937 - PCC-901 (1:.02:.05:.02),4/17/2020 0:00,4/17/2020 0:00,0.086384261,gal,6/9/2020 14:58,Kamiander,1,1,1,0,{'2020-06-09 14:58:25': 1},1,0
32,Wichita KS,DefaultDept,(PL) Painting Ops-Bldg 5D (GLOBAL) EU-NEWAEROPB11,Blend: PST-917 - PSC-507 - RED-937 - PCC-901 (1:.02:.05:.02),4/23/2020 0:00,4/23/2020 0:00,0.086384261,gal,6/9/2020 15:01,Kamiander,1,1,1,0,{'2020-06-09 15:01:35': 1},1,0
33,Wichita KS,DefaultDept,(PL) Painting Ops-Bldg 5D (GLOBAL) EU-NEWAEROPB11,Blend: PST-917 - PSC-507 - RED-937 - PCC-901 (1:.02:.05:.02),4/27/2020 0:00,4/27/2020 0:00,0.086384261,gal,6/9/2020 15:04,Kamiander,1,1,1,0,{'2020-06-09 15:04:43': 1},1,0
34,Wichita KS,DefaultDept,(PL) Painting Ops-Bldg 5D (GLOBAL) EU-NEWAEROPB11,Blend: PST-917 - PSC-507 - RED-937 - PCC-901 (1:.02:.05:.02),5/5/2020 0:00,5/5/2020 0:00,0.057589507,gal,6/19/2020 9:01,Kamiander,1,1,1,0,{'2020-06-19 09:01:58': 1},1,0
35,Wichita KS,DefaultDept,(PL) Painting Ops-Bldg 5D (GLOBAL) EU-NEWAEROPB11,Blend: PST-917 - PSC-507 - RED-937 - PCC-901 (1:.02:.05:.02),5/8/2020 0:00,5/8/2020 0:00,2.18,gal,6/19/2020 9:03,Kamiander,1,1,1,0,{'2020-06-19 09:03:41': 1},1,0
36,Wichita KS,DefaultDept,(PL) Painting Ops-Bldg 5D (GLOBAL) EU-NEWAEROPB11,Blend: PST-917 - PSC-507 - RED-937 - PCC-901 (1:.02:.05:.02),5/28/2020 0:00,5/28/2020 0:00,0.115179014,gal,6/19/2020 9:06,Kamiander,1,1,1,0,{'2020-06-19 09:06:05': 1},1,0
37,Wichita KS,DefaultDept,(PL) Painting Ops-Bldg 5D (GLOBAL) EU-NEWAEROPB11,Blend: PST-917 - PSC-507 - RED-937 - PCC-901 (1:.02:.05:.02),5/30/2020 0:00,5/30/2020 0:00,0.115179014,gal,6/19/2020 9:07,Kamiander,1,1,1,0,{'2020-06-19 09:07:39': 1},1,0
38,Wichita KS,DefaultDept,(PL) Painting Ops-Bldg 5D (GLOBAL) EU-NEWAEROPB11,Blend: PST-917 - PSC-507 - RED-937 - PCC-901 (1:.02:.05:.02),6/2/2020 0:00,6/2/2020 0:00,0.115179014,gal,7/27/2020 16:41,Kamiander,1,1,1,0,{'2020-07-27 16:41:07': 1},1,0
39,Wichita KS,DefaultDept,(PL) Painting Ops-Bldg 5D (GLOBAL) EU-NEWAEROPB11,Blend: PST-917 - PSC-507 - RED-937 - PCC-901 (1:.02:.05:.02),10/23/2020 11:30,10/23/2020 11:30,0.115179014,gal,1/6/2021 9:56,dlyon,1,1,1,0,{'2021-01-06 09:56:48': 1},1,0
40,Wichita KS,DefaultDept,(PL) Painting Ops-Bldg 5D (GLOBAL) EU-NEWAEROPB11,Blend: PST-917 - PSC-507 - RED-937 - PCC-901 (1:.02:.05:.02),10/27/2020 11:30,10/27/2020 11:30,0.115179014,gal,1/6/2021 10:12,dlyon,1,1,1,0,{'2021-01-06 10:12:35': 1},1,0
41,Wichita KS,DefaultDept,(PL) Painting Ops-Bldg 5D (GLOBAL) EU-NEWAEROPB11,Blend: PST-917 - PSC-507 - RED-937 - PCC-901 (1:.02:.05:.02),11/3/2020 11:30,11/3/2020 11:30,0.115179014,gal,1/6/2021 10:16,dlyon,1,1,1,0,{'2021-01-06 10:16:02': 1},1,0
42,Wichita KS,DefaultDept,(PL) Painting Ops-Bldg 5D (GLOBAL) EU-NEWAEROPB11,Blend: PST-917 - PSC-507 - RED-937 - PCC-901 (1:.02:.05:.02),11/6/2020 11:30,11/6/2020 11:30,0.115179014,gal,1/6/2021 10:21,dlyon,1,1,1,0,{'2021-01-06 10:21:20': 1},1,0
43,Wichita KS,DefaultDept,(PL) Painting Ops-Bldg 5D (GLOBAL) EU-NEWAEROPB11,Blend: PST-917 - PSC-507 - RED-937 - PCC-901 (1:.02:.05:.02),11/9/2020 11:30,11/9/2020 11:30,0.115179014,gal,1/6/2021 10:23,dlyon,1,1,1,0,{'2021-01-06 10:23:25': 1},1,0
44,Wichita KS,DefaultDept,(PL) Painting Ops-Bldg 5D (GLOBAL) EU-NEWAEROPB11,Blend: PST-917 - PSC-507 - RED-937 - PCC-901 (1:.02:.05:.02),11/23/2020 9:30,11/23/2020 9:30,0.115179014,gal,1/6/2021 10:38,dlyon,1,1,1,0,{'2021-01-06 10:38:00': 1},1,0
45,Wichita KS,DefaultDept,(PL) Painting Ops-Bldg 5D (GLOBAL) EU-NEWAEROPB11,Blend: PST-917 - PSC-507 - RED-937 - PCC-901 (1:.02:.05:.02),12/2/2020 11:30,12/2/2020 11:30,0.115179014,gal,1/6/2021 10:49,dlyon,1,1,1,0,{'2021-01-06 10:49:53': 1},1,0
46,Wichita KS,DefaultDept,(PL) Painting Ops-Bldg 5D (GLOBAL) EU-NEWAEROPB11,Blend: PST-917 - PSC-507 - RED-937 - PCC-901 (1:.02:.05:.02),12/8/2020 9:30,12/8/2020 9:30,0.057589507,gal,1/6/2021 10:54,dlyon,1,1,1,0,{'2021-01-06 10:54:20': 1},1,0
47,Wichita KS,DefaultDept,(PL) Painting Ops-Bldg 5D (GLOBAL) EU-NEWAEROPB11,Blend: UST-920 - USC-902 - RED-913 (2:1:0.3),1/22/2020 13:00,1/22/2020 13:00,0.130765165,gal,8/18/2020 18:15,adminbomjs,1,1,1,0,{'2020-08-18 18:15:09': 1},1,0
48,Wichita KS,DefaultDept,(PL) Painting Ops-Bldg 5D (GLOBAL) EU-NEWAEROPB11,Blend: UST-920 - USC-902 - RED-913 (2:1:0.3),1/24/2020 10:00,1/24/2020 10:00,0.130765165,gal,8/28/2020 10:37,bomamanda,1,1,1,0,{'2020-08-28 10:37:40': 1},1,0
49,Wichita KS,DefaultDept,(PL) Painting Ops-Bldg 5D (GLOBAL) EU-NEWAEROPB11,F63TXW2765- N381 60258 - 6:1,4/6/2020 0:00,4/6/2020 0:00,0.02734375,gal,7/31/2020 12:20,Kamiander,1,1,1,0,{'2020-07-31 12:20:46': 1},1,0
50,Wichita KS,DefaultDept,(PL) Painting Ops-Bldg 5D (GLOBAL) EU-NEWAEROPB11,ISC-909R,10/7/2019 9:00,10/7/2019 9:00,0.000528344,gal,1/13/2020 13:52,adminbomgb,1,1,1,0,{'2020-01-13 13:52:38': 1},1,0
51,Wichita KS,DefaultDept,(PL) Painting Ops-Bldg 5D (GLOBAL) EU-NEWAEROPB11,ISC-909R,10/21/2019 9:00,10/21/2019 9:00,0.000528344,gal,1/13/2020 13:57,adminbomgb,1,1,1,0,{'2020-01-13 13:57:44': 1},1,0
52,Wichita KS,DefaultDept,(PL) Painting Ops-Bldg 5D (GLOBAL) EU-NEWAEROPB11,ISC-909R,12/20/2019 11:00,12/20/2019 11:00,0.000528344,gal,1/13/2020 15:04,adminbomgb,1,1,1,0,{'2020-01-13 15:04:30': 1},1,0
53,Wichita KS,DefaultDept,(PL) Painting Ops-Bldg 5D (GLOBAL) EU-NEWAEROPB11,ISC-909R,2/11/2020 16:59,2/11/2020 16:59,0.000528344,gal,5/7/2020 17:01,adminbomry,1,1,1,0,{'2020-05-07 17:01:27': 1},1,0
54,Wichita KS,DefaultDept,(PL) Painting Ops-Bldg 5D (GLOBAL) EU-NEWAEROPB11,ISC-909R,2/17/2020 17:18,2/17/2020 17:18,0.000528344,gal,5/7/2020 17:17,adminbomry,1,1,1,0,{'2020-05-07 17:17:59': 1},1,0
55,Wichita KS,DefaultDept,(PL) Painting Ops-Bldg 5D (GLOBAL) EU-NEWAEROPB11,ISC-909R,3/5/2020 1:52,3/5/2020 1:52,0.000528344,gal,8/19/2020 1:52,userbomry,1,1,1,0,{'2020-08-19 01:52:14': 1},1,0
56,Wichita KS,DefaultDept,(PL) Painting Ops-Bldg 5D (GLOBAL) EU-NEWAEROPB11,ISC-909R,3/8/2020 1:55,3/8/2020 1:55,0.010566882,gal,8/19/2020 1:55,userbomry,1,1,1,0,{'2020-08-19 01:55:07': 1},1,0
57,Wichita KS,DefaultDept,(PL) Painting Ops-Bldg 5D (GLOBAL) EU-NEWAEROPB11,ISC-909R,3/17/2020 1:57,3/17/2020 1:57,0.001056688,gal,8/19/2020 1:57,userbomry,1,1,1,0,{'2020-08-19 01:57:34': 1},1,0
58,Wichita KS,DefaultDept,(PL) Painting Ops-Bldg 5D (GLOBAL) EU-NEWAEROPB11,ISC-909R,4/3/2020 0:00,4/3/2020 0:00,0.001056688,gal,6/9/2020 14:38,Kamiander,1,1,1,0,{'2020-06-09 14:38:21': 1},1,0
59,Wichita KS,DefaultDept,(PL) Painting Ops-Bldg 5D (GLOBAL) EU-NEWAEROPB11,ISC-909R,4/14/2020 0:00,4/14/2020 0:00,0.001056688,gal,6/9/2020 14:56,Kamiander,1,1,1,0,{'2020-06-09 14:56:15': 1},1,0
60,Wichita KS,DefaultDept,(PL) Painting Ops-Bldg 5D (GLOBAL) EU-NEWAEROPB11,ISC-909R,4/17/2020 0:00,4/17/2020 0:00,0.001056688,gal,6/9/2020 14:59,Kamiander,1,1,1,0,{'2020-06-09 14:59:50': 1},1,0
61,Wichita KS,DefaultDept,(PL) Painting Ops-Bldg 5D (GLOBAL) EU-NEWAEROPB11,ISC-909R,4/23/2020 0:00,4/23/2020 0:00,0.001056688,gal,6/9/2020 15:02,Kamiander,1,1,1,0,{'2020-06-09 15:02:55': 1},1,0
62,Wichita KS,DefaultDept,(PL) Painting Ops-Bldg 5D (GLOBAL) EU-NEWAEROPB11,ISC-909R,4/27/2020 0:00,4/27/2020 0:00,0.001056688,gal,6/9/2020 15:06,Kamiander,1,1,1,0,{'2020-06-09 15:06:04': 1},1,0
63,Wichita KS,DefaultDept,(PL) Painting Ops-Bldg 5D (GLOBAL) EU-NEWAEROPB11,ISC-909R,5/5/2020 0:00,5/5/2020 0:00,0.001056688,gal,6/19/2020 9:09,Kamiander,1,1,1,0,{'2020-06-19 09:09:07': 1},1,0
64,Wichita KS,DefaultDept,(PL) Painting Ops-Bldg 5D (GLOBAL) EU-NEWAEROPB11,RED 15 ml USC 50 ml UST 100 ml,6/5/2020 0:00,6/5/2020 0:00,0.043588388,gal,8/25/2020 13:24,Kamiander,1,1,1,0,{'2020-08-25 13:24:48': 1},1,0
65,Wichita KS,DefaultDept,(PL) Painting Ops-Bldg 5D (GLOBAL) EU-NEWAEROPB11,RED 15 ml USC 50 ml UST 100 ml,6/8/2020 0:00,6/8/2020 0:00,0.043588388,gal,8/25/2020 13:27,Kamiander,1,1,1,0,{'2020-08-25 13:27:33': 1},1,0
66,Wichita KS,DefaultDept,(PL) Painting Ops-Bldg 5D (GLOBAL) EU-NEWAEROPB11,RED 15 ml USC 50 ml UST 100 ml,6/9/2020 0:00,6/9/2020 0:00,0.043588388,gal,8/25/2020 13:29,Kamiander,1,1,1,0,{'2020-08-25 13:29:21': 1},1,0
67,Wichita KS,DefaultDept,(PL) Painting Ops-Bldg 5D (GLOBAL) EU-NEWAEROPB11,RED 15 ml USC 50 ml UST 100 ml,6/18/2020 0:00,6/18/2020 0:00,0.217941942,gal,8/25/2020 13:31,Kamiander,1,1,1,0,{'2020-08-25 13:31:55': 1},1,0
68,Wichita KS,DefaultDept,(PL) Painting Ops-Bldg 5D (GLOBAL) EU-NEWAEROPB11,RED 15 ml USC 50 ml UST 100 ml,6/19/2020 0:00,6/19/2020 0:00,0.217941942,gal,8/25/2020 13:33,Kamiander,1,1,1,0,{'2020-08-25 13:33:36': 1},1,0
69,Wichita KS,DefaultDept,(PL) Painting Ops-Bldg 5D (GLOBAL) EU-NEWAEROPB11,RED 15 ml USC 50 ml UST 100 ml,6/23/2020 0:00,6/23/2020 0:00,0.217941942,gal,8/25/2020 13:35,Kamiander,1,1,1,0,{'2020-08-25 13:35:21': 1},1,0
70,Wichita KS,DefaultDept,(PL) Painting Ops-Bldg 5D (GLOBAL) EU-NEWAEROPB11,RED 15 ml USC 50 ml UST 100 ml,7/10/2020 0:00,7/10/2020 0:00,0.217941942,gal,8/26/2020 12:33,Kamiander,1,1,1,0,{'2020-08-26 12:33:23': 1},1,0
71,Wichita KS,DefaultDept,(PL) Painting Ops-Bldg 5D (GLOBAL) EU-NEWAEROPB11,RED 15 ml USC 50 ml UST 100 ml,7/14/2020 0:00,7/14/2020 0:00,0.217941942,gal,8/26/2020 12:35,Kamiander,1,1,1,0,{'2020-08-26 12:35:39': 1},1,0
72,Wichita KS,DefaultDept,(PL) Painting Ops-Bldg 5D (GLOBAL) EU-NEWAEROPB11,RED 15 ml USC 50 ml UST 100 ml,7/30/2020 0:00,7/30/2020 0:00,0.043588388,gal,8/26/2020 12:38,Kamiander,1,1,1,0,{'2020-08-26 12:38:57': 1},1,0
73,Wichita KS,DefaultDept,(PL) Painting Ops-Bldg 5D (GLOBAL) EU-NEWAEROPB11,"UST-920, USC-902, Red-913 (2:1:.15)",8/11/2020 0:00,8/11/2020 0:00,0.043588388,gal,9/24/2020 11:09,Kamiander,1,1,1,0,{'2020-09-24 11:09:27': 1},1,0
74,Wichita KS,DefaultDept,(PL) Painting Ops-Bldg 5D (GLOBAL) EU-NEWAEROPB11,"UST-920, USC-902, Red-913 (2:1:.15)",9/4/2020 11:30,9/4/2020 11:30,0.043588388,gal,10/27/2020 14:59,dlyon,1,1,1,0,{'2020-10-27 14:59:54': 1},1,0
75,Wichita KS,DefaultDept,(PL) Painting Ops-Bldg 5D (GLOBAL) EU-NEWAEROPB11,"UST-920, USC-902, Red-913 (2:1:.15)",9/9/2020 9:30,9/9/2020 9:30,0.130765165,gal,10/27/2020 14:59,dlyon,1,1,1,0,{'2020-10-27 14:59:00': 1},1,0
76,Wichita KS,DefaultDept,(PL) Painting Ops-Bldg 5D (GLOBAL) EU-NEWAEROPB11,"UST-920, USC-902, Red-913 (2:1:.15)",9/11/2020 9:30,9/11/2020 9:30,0.174353554,gal,10/27/2020 15:04,dlyon,1,1,1,0,{'2020-10-27 15:04:00': 1},1,0
77,Wichita KS,DefaultDept,(PL) Painting Ops-Bldg 5D (GLOBAL) EU-NEWAEROPB11,"UST-920, USC-902, Red-913 (2:1:.15)",11/11/2020 9:30,11/11/2020 9:30,0.087176777,gal,1/6/2021 10:25,dlyon,1,1,1,0,{'2021-01-06 10:25:26': 1},1,0
78,Wichita KS,DefaultDept,(PL) Painting Ops-Bldg 5D (GLOBAL) EU-NEWAEROPB11,"UST-920, USC-902, Red-913 (2:1:.15)",11/12/2020 11:30,11/12/2020 11:30,0.087176777,gal,1/6/2021 10:29,dlyon,1,1,1,0,{'2021-01-06 10:29:02': 1},1,0
79,Wichita KS,DefaultDept,(PL) Painting Ops-Bldg 5D (GLOBAL) EU-NEWAEROPB11,"UST-920, USC-902, Red-913 (2:1:.15)",11/13/2020 11:30,11/13/2020 11:30,0.087176777,gal,1/6/2021 10:33,dlyon,1,1,1,0,{'2021-01-06 10:33:06': 1},1,0
80,Wichita KS,DefaultDept,(PL) Painting Ops-Bldg 5D (GLOBAL) EU-NEWAEROPB11,"UST-920, USC-902, Red-913 (2:1:.15)",11/16/2020 9:30,11/16/2020 9:30,0.087176777,gal,1/6/2021 10:34,dlyon,1,1,1,0,{'2021-01-06 10:34:37': 1},1,0
81,Wichita KS,DefaultDept,(PL) Painting Ops-Bldg 5D (GLOBAL) EU-NEWAEROPB11,"UST-920, USC-902, Red-913 (2:1:.15)",11/18/2020 9:30,11/18/2020 9:30,0.087176777,gal,1/6/2021 10:36,dlyon,1,1,1,0,{'2021-01-06 10:36:21': 1},1,0
82,Wichita KS,DefaultDept,(PL) Painting Ops-Bldg 5D (GLOBAL) EU-NEWAEROPB11,"UST-920, USC-902, Red-913 (2:1:.15)",11/24/2020 9:30,11/24/2020 9:30,0.087176777,gal,1/6/2021 10:42,dlyon,1,1,1,0,{'2021-01-06 10:42:04': 1},1,0
83,Wichita KS,DefaultDept,(PL) Painting Ops-Bldg 5D (GLOBAL) EU-NEWAEROPB11,"UST-920, USC-902, Red-913 (2:1:.15)",11/25/2020 9:30,11/25/2020 9:30,0.087176777,gal,1/6/2021 10:43,dlyon,1,1,1,0,{'2021-01-06 10:43:40': 1},1,0
84,Wichita KS,DefaultDept,(PL) Painting Ops-Bldg 5D (GLOBAL) EU-NEWAEROPB11,V66V27  1 l F63TXA4892  6 l,5/14/2020 0:00,5/14/2020 0:00,0.0546875,gal,8/25/2020 12:19,Kamiander,1,1,1,0,{'2020-08-25 12:19:40': 1},1,0
85,Wichita KS,DefaultDept,(PL) Painting Ops-Bldg 5D (GLOBAL) EU-NEWAEROPB11,V66V27  1 l F63TXH0785 6 l_old,6/15/2020 0:00,6/15/2020 0:00,0.02734375,gal,8/25/2020 12:27,Kamiander,1,1,1,0,{'2020-08-25 12:27:39': 1},1,0
86,Wichita KS,DefaultDept,(PL) Painting Ops-Bldg 5D (GLOBAL) EU-NEWAEROPB11,V66V27  1 l F63TXH9445  6 l,4/7/2020 0:00,4/7/2020 0:00,0.02734375,gal,8/25/2020 12:02,Kamiander,1,1,1,0,{'2020-08-25 12:02:00': 1},1,0
87,Wichita KS,DefaultDept,(PL)Painting Ops-Bldg 14 North EU-NEWAEROPB3,8000 IM965 - CA 8800Z Activator- 8800CT4 THINNER,7/31/2019 10:58,7/31/2019 10:58,0.03125,gal,7/31/2019 10:58,jcameron,1,1,1,0,{'2019-07-31 10:58:59': 1},1,0
88,Wichita KS,DefaultDept,(PL)Painting Ops-Bldg 14 North EU-NEWAEROPB3,8800 I1050 (2oz) - CA 8800Z Activator (1oz) - 8800CT4 THINNER (1.5oz),1/29/2019 9:53,1/29/2019 9:53,0.06640625,gal,1/29/2019 9:53,adminbommg,1,1,1,0,{'2019-01-29 09:53:45': 1},1,0
89,Wichita KS,DefaultDept,(PL)Painting Ops-Bldg 14 North EU-NEWAEROPB3,8800 I1050 - CA 8800Z Activator- 8800CT THINNER,10/24/2019 12:00,10/24/2019 12:00,13.5,gal,12/19/2019 16:04,adminbomry,1,1,1,0,{'2019-12-19 16:04:12': 1},1,0
90,Wichita KS,DefaultDept,(PL)Painting Ops-Bldg 14 North EU-NEWAEROPB3,8800 I1050 - CA 8800Z Activator- 8800CT THINNER,10/28/2019 12:00,10/28/2019 12:00,2.5,gal,12/19/2019 16:04,adminbomry,1,1,1,0,{'2019-12-19 16:04:12': 1},1,0
91,Wichita KS,DefaultDept,(PL)Painting Ops-Bldg 14 North EU-NEWAEROPB3,8800 I1050 - CA 8800Z Activator- 8800CT THINNER - 1800CX THINNER,1/18/2019 10:39,1/18/2019 10:39,15.75,gal,1/18/2019 10:39,jcameron,1,1,1,0,{'2019-01-18 10:39:39': 1},1,0
92,Wichita KS,DefaultDept,(PL)Painting Ops-Bldg 14 North EU-NEWAEROPB3,8800 I1050 - CA 8800Z Activator- 8800CT THINNER - 1800CX THINNER,1/18/2019 11:49,1/18/2019 11:49,2.15,gal,1/29/2019 10:36,adminbommg,1,1,1,0,{'2019-01-29 10:36:53': 1},1,0
93,Wichita KS,DefaultDept,(PL)Painting Ops-Bldg 14 North EU-NEWAEROPB3,8800 I1050 - CA 8800Z Activator- 8800CT THINNER - 1800CX THINNER,3/4/2019 15:44,3/4/2019 15:44,13.5,gal,7/5/2019 13:44,adminbomgb,1,1,1,0,{'2019-07-05 13:44:50': 1},1,0
94,Wichita KS,DefaultDept,(PL)Painting Ops-Bldg 14 North EU-NEWAEROPB3,8800 I1050 - CA 8800Z Activator- 8800CT THINNER - 1800CX THINNER,4/4/2019 11:18,4/4/2019 11:18,13.5,gal,4/4/2019 11:18,jcameron,1,1,1,0,{'2019-04-04 11:18:58': 1},1,0
95,Wichita KS,DefaultDept,(PL)Painting Ops-Bldg 14 North EU-NEWAEROPB3,8800 I1050 - CA 8800Z Activator- 8800CT THINNER - 1800CX THINNER,5/7/2019 8:49,5/7/2019 8:49,13.5,gal,5/7/2019 8:49,jcameron,1,1,1,0,{'2019-05-07 08:49:34': 1},1,0
96,Wichita KS,DefaultDept,(PL)Painting Ops-Bldg 14 North EU-NEWAEROPB3,8800 I1050 - CA 8800Z Activator- 8800CT THINNER - 1800CX THINNER,5/29/2019 16:03,5/29/2019 16:03,13.5,gal,5/29/2019 16:03,jcameron,1,1,1,0,{'2019-05-29 16:03:19': 1},1,0
97,Wichita KS,DefaultDept,(PL)Painting Ops-Bldg 14 North EU-NEWAEROPB3,8800 I1050 - CA 8800Z Activator- 8800CT THINNER - 1800CX THINNER,7/31/2019 10:55,7/31/2019 10:55,12.75,gal,7/31/2019 10:55,jcameron,1,1,1,0,{'2019-07-31 10:55:22': 1},1,0
98,Wichita KS,DefaultDept,(PL)Painting Ops-Bldg 14 North EU-NEWAEROPB3,8800 I1050 - CA 8800Z Activator- 8800CT THINNER - 1800CX THINNER,8/5/2019 5:35,8/5/2019 5:35,12.75,gal,9/9/2019 9:54,jcameron,1,1,1,0,{'2019-09-09 09:54:53': 1},1,0
99,Wichita KS,DefaultDept,(PL)Painting Ops-Bldg 14 North EU-NEWAEROPB3,8800 I1050 - CA 8800Z Activator- 8800CT THINNER - 1800CX THINNER,8/28/2019 7:00,8/28/2019 7:00,13.5,gal,9/9/2019 10:08,jcameron,1,1,1,0,{'2019-09-09 10:08:13': 1},1,0
100,Wichita KS,DefaultDept,(PL)Painting Ops-Bldg 14 North EU-NEWAEROPB3,8800 I3017 - CA 8800Z Activator- 8800CT3 THINNER with KICKER,5/20/2020 0:00,5/20/2020 0:00,1.125,gal,8/19/2020 13:05,Kamiander,1,1,1,0,{'2020-08-19 13:05:36': 1},1,0
101,Wichita KS,DefaultDept,(PL)Painting Ops-Bldg 14 North EU-NEWAEROPB3,8800/I1050 2 oz - 8800Z ACTIVATOR 1 oz - 8800CT4 Reducer  1 oz - 1800CX THINNER  .25 oz,9/30/2019 9:00,9/30/2019 9:00,0.0625,gal,9/30/2019 11:49,jcameron,1,1,1,0,{'2019-09-30 11:49:55': 1},1,0
102,Wichita KS,DefaultDept,(PL)Painting Ops-Bldg 14 North EU-NEWAEROPB3,8800/I2014 Base  2 gal; CA 8800Z ACTIVATOR  1 gal; 8800CT3 THINNER 1 gal; 1800CX THINNER  1 qrt,5/29/2019 16:14,5/29/2019 16:14,0.1015625,gal,5/29/2019 16:14,jcameron,1,1,1,0,{'2019-05-29 16:14:25': 1},1,0
103,Wichita KS,DefaultDept,(PL)Painting Ops-Bldg 14 North EU-NEWAEROPB3,9W015B Base (3oz) - 80X042CAT Activator (1oz) - CA1805CX EX SLV Thinner (0.2oz),7/31/2019 11:38,7/31/2019 11:38,24,gal,7/31/2019 11:38,jcameron,1,1,1,0,{'2019-07-31 11:38:24': 1},1,0
104,Wichita KS,DefaultDept,(PL)Painting Ops-Bldg 14 North EU-NEWAEROPB3,9W015B Base - 80X042CAT Activator - CA1805CX EX SLV Thinner,2/4/2019 10:53,2/4/2019 10:53,20.75,gal,7/10/2019 9:06,adminbomgb,1,1,1,0,{'2019-07-10 09:06:15': 1},1,0
105,Wichita KS,DefaultDept,(PL)Painting Ops-Bldg 14 North EU-NEWAEROPB3,9W015B Base - 80X042CAT Activator - CA1805CX EX SLV Thinner,3/4/2019 16:12,3/4/2019 16:12,18,gal,7/5/2019 13:44,adminbomgb,1,1,1,0,{'2019-07-05 13:44:50': 1},1,0
106,Wichita KS,DefaultDept,(PL)Painting Ops-Bldg 14 North EU-NEWAEROPB3,9W015B Base - 80X042CAT Activator - CA1805CX EX SLV Thinner,4/4/2019 11:47,4/4/2019 11:47,21,gal,4/4/2019 11:47,jcameron,1,1,1,0,{'2019-04-04 11:47:30': 1},1,0
107,Wichita KS,DefaultDept,(PL)Painting Ops-Bldg 14 North EU-NEWAEROPB3,9W015B Base - 80X042CAT Activator - CA1805CX EX SLV Thinner,5/7/2019 8:45,5/7/2019 8:45,21,gal,5/7/2019 8:45,jcameron,1,1,1,0,{'2019-05-07 08:45:01': 1},1,0
108,Wichita KS,DefaultDept,(PL)Painting Ops-Bldg 14 North EU-NEWAEROPB3,9W015B Base - 80X042CAT Activator - CA1805CX EX SLV Thinner,5/29/2019 16:01,5/29/2019 16:01,19.5,gal,5/29/2019 16:01,jcameron,1,1,1,0,{'2019-05-29 16:01:30': 1},1,0
109,Wichita KS,DefaultDept,(PL)Painting Ops-Bldg 14 North EU-NEWAEROPB3,9W015B Base - 80X042CAT Activator - CA1805CX EX SLV Thinner,9/24/2019 11:30,9/24/2019 11:30,22.5,gal,9/30/2019 11:40,jcameron,1,1,1,0,{'2019-09-30 11:40:41': 1},1,0
110,Wichita KS,DefaultDept,(PL)Painting Ops-Bldg 14 North EU-NEWAEROPB3,9W015B Base - 80X042CAT Activator - CA1805CX EX SLV Thinner,10/17/2019 12:00,10/17/2019 12:00,21,gal,12/19/2019 16:04,adminbomry,1,1,1,0,{'2019-12-19 16:04:12': 1},1,0
111,Wichita KS,DefaultDept,(PL)Painting Ops-Bldg 14 North EU-NEWAEROPB3,B701 BASE COMPONENT - 8800Z ACTIVATOR - CT4 Reducer - CA1800CX THINNER,5/20/2020 0:00,5/20/2020 0:00,1.125,gal,6/22/2020 10:11,Kamiander,1,1,1,0,{'2020-06-22 10:11:15': 1},1,0
112,Wichita KS,DefaultDept,(PL)Painting Ops-Bldg 14 North EU-NEWAEROPB3,B900 (2QT) - 8800Z (1QT) - F THINNER (1 QT) - F4 THINNER (18oz),1/18/2019 11:01,1/18/2019 11:01,0.10546875,gal,1/29/2019 10:41,adminbommg,1,1,1,0,{'2019-01-29 10:41:53': 1},1,0
113,Wichita KS,DefaultDept,(PL)Painting Ops-Bldg 14 North EU-NEWAEROPB3,B900 (2QT) - 8800Z (1QT) - F THINNER (1 QT) - F4 THINNER (18oz),1/18/2019 12:01,1/18/2019 12:01,2.18,gal,1/18/2019 12:01,jcameron,1,1,1,0,{'2019-01-18 12:01:43': 1},1,0
114,Wichita KS,DefaultDept,(PL)Painting Ops-Bldg 14 North EU-NEWAEROPB3,B900 (2QT) - 8800Z (1QT) - F THINNER (1 QT) - F4 THINNER (18oz),1/18/2019 13:10,1/18/2019 13:10,2.72,gal,1/29/2019 10:37,adminbommg,1,1,1,0,{'2019-01-29 10:37:59': 1},1,0
115,Wichita KS,DefaultDept,(PL)Painting Ops-Bldg 14 North EU-NEWAEROPB3,B900 (2QT) - 8800Z (1QT) - F THINNER (1 QT) - F4 THINNER (18oz),1/18/2019 13:20,1/18/2019 13:20,0.140625,gal,1/29/2019 10:39,adminbommg,1,1,1,0,{'2019-01-29 10:39:27': 1},1,0
116,Wichita KS,DefaultDept,(PL)Painting Ops-Bldg 14 North EU-NEWAEROPB3,B900 (2QT) - 8800Z (1QT) - F THINNER (1 QT) - F4 THINNER (18oz),4/4/2019 11:26,4/4/2019 11:26,0.10546875,gal,4/4/2019 11:26,jcameron,1,1,1,0,{'2019-04-04 11:26:51': 1},1,0
117,Wichita KS,DefaultDept,(PL)Painting Ops-Bldg 14 North EU-NEWAEROPB3,B900 (2QT) - 8800Z (1QT) - F THINNER (1 QT) - F4 THINNER (18oz),4/4/2019 11:31,4/4/2019 11:31,4.5,gal,4/4/2019 11:31,jcameron,1,1,1,0,{'2019-04-04 11:31:54': 1},1,0
118,Wichita KS,DefaultDept,(PL)Painting Ops-Bldg 14 North EU-NEWAEROPB3,B900 (2QT) - 8800Z (1QT) - F THINNER (1 QT) - F4 THINNER (18oz),5/29/2019 16:17,5/29/2019 16:17,0.1015625,gal,5/29/2019 16:17,jcameron,1,1,1,0,{'2019-05-29 16:17:22': 1},1,0
119,Wichita KS,DefaultDept,(PL)Painting Ops-Bldg 14 North EU-NEWAEROPB3,B900 (2QT) - 8800Z (1QT) - F THINNER (1 QT) - F4 THINNER (18oz),5/29/2019 16:21,5/29/2019 16:21,1.125,gal,5/29/2019 16:21,jcameron,1,1,1,0,{'2019-05-29 16:21:16': 1},1,0
120,Wichita KS,DefaultDept,(PL)Painting Ops-Bldg 14 North EU-NEWAEROPB3,BAPAINT-WH-42 (PG-6-W207)  MATTERHORN WHITE,4/1/2020 0:00,4/1/2020 0:00,12,gal,6/10/2020 13:29,Kamiander,1,1,1,0,{'2020-06-10 13:29:30': 1},1,0
121,Wichita KS,DefaultDept,(PL)Painting Ops-Bldg 14 North EU-NEWAEROPB3,BLEND: 09W015B - 80X042 - 1805CX (3:1:0.25),7/26/2019 9:30,7/26/2019 9:30,23.625,gal,8/21/2019 15:41,adminbomgb,1,1,1,0,{'2019-08-21 15:41:25': 1},1,0
122,Wichita KS,DefaultDept,(PL)Painting Ops-Bldg 14 North EU-NEWAEROPB3,BLEND: 09W015B - 80X042 - 1805CX (3:1:0.25),8/20/2019 11:30,8/20/2019 11:30,21,gal,9/17/2019 10:15,adminbomgb,1,1,1,0,{'2019-09-17 10:15:13': 1},1,0
123,Wichita KS,DefaultDept,(PL)Painting Ops-Bldg 14 North EU-NEWAEROPB3,BLEND: 09W015B - 80X042 - 1805CX (3:1:0.25),9/20/2019 11:30,9/20/2019 11:30,24,gal,9/9/2019 10:05,jcameron,1,1,1,0,{'2019-09-09 10:05:40': 1},1,0
124,Wichita KS,DefaultDept,(PL)Painting Ops-Bldg 14 North EU-NEWAEROPB3,BLEND: 09W015B - 80X042 - 1805CX (3:1:0.25),9/24/2019 11:30,9/24/2019 11:30,22.5,gal,10/15/2019 9:41,adminbomgb,1,1,1,0,{'2019-10-15 09:41:30': 1},1,0
125,Wichita KS,DefaultDept,(PL)Painting Ops-Bldg 14 North EU-NEWAEROPB3,BLEND: 09W015B - 80X042 - 1805CX (3:1:0.25),10/17/2019 12:00,10/17/2019 12:00,21.25,gal,12/19/2019 16:04,adminbomry,1,1,1,0,{'2019-12-19 16:04:12': 1},1,0
126,Wichita KS,DefaultDept,(PL)Painting Ops-Bldg 14 North EU-NEWAEROPB3,BLEND: 09W015B - 80X042 - 1805CX (3:1:0.25),11/14/2019 13:49,11/14/2019 13:49,21,gal,1/22/2020 14:51,Kamiander,1,1,1,0,{'2020-01-22 14:51:26': 1},1,0
127,Wichita KS,DefaultDept,(PL)Painting Ops-Bldg 14 North EU-NEWAEROPB3,BLEND: 09W015B - 80X042 - 1805CX (3:1:0.25),1/7/2020 12:00,1/7/2020 12:00,19.6875,gal,5/22/2020 11:07,adminbomjs,1,1,1,0,{'2020-05-22 11:07:00': 1},1,0
128,Wichita KS,DefaultDept,(PL)Painting Ops-Bldg 14 North EU-NEWAEROPB3,BLEND: 09W015B - 80X042 - 1805CX (3:1:0.25),2/3/2020 0:21,2/3/2020 0:21,26,gal,8/19/2020 0:21,userbomry,1,1,1,0,{'2020-08-19 00:21:45': 1},1,0
129,Wichita KS,DefaultDept,(PL)Painting Ops-Bldg 14 North EU-NEWAEROPB3,BLEND: 09W015B - 80X042 - 1805CX (3:1:0.25),3/18/2020 0:28,3/18/2020 0:28,19.75,gal,8/19/2020 0:28,userbomry,1,1,1,0,{'2020-08-19 00:28:24': 1},1,0
130,Wichita KS,DefaultDept,(PL)Painting Ops-Bldg 14 North EU-NEWAEROPB3,BLEND: 09W015B - 80X042 - 1805CX (3:1:0.25),4/22/2020 0:00,4/22/2020 0:00,20,gal,6/10/2020 14:15,Kamiander,1,1,1,0,{'2020-06-10 14:15:25': 1},1,0
131,Wichita KS,DefaultDept,(PL)Painting Ops-Bldg 14 North EU-NEWAEROPB3,BLEND: 09W015B - 80X042 - 1805CX (3:1:0.25),5/27/2020 0:00,5/27/2020 0:00,23,gal,6/22/2020 10:08,Kamiander,1,1,1,0,{'2020-06-22 10:08:55': 1},1,0
132,Wichita KS,DefaultDept,(PL)Painting Ops-Bldg 14 North EU-NEWAEROPB3,BLEND: 09W015B - 80X042 - 1805CX (3:1:0.25),6/30/2020 0:00,6/30/2020 0:00,24,gal,7/20/2020 9:49,Kamiander,1,1,1,0,{'2020-07-20 09:49:00': 1},1,0
133,Wichita KS,DefaultDept,(PL)Painting Ops-Bldg 14 North EU-NEWAEROPB3,BLEND: 09W015B - 80X042 - 1805CX (3:1:0.25),7/30/2020 0:00,7/30/2020 0:00,2.125,gal,8/27/2020 10:18,Kamiander,1,1,1,0,{'2020-08-27 10:18:07': 1},1,0
134,Wichita KS,DefaultDept,(PL)Painting Ops-Bldg 14 North EU-NEWAEROPB3,BLEND: 09W015B - 80X042 - 1805CX (3:1:0.25),8/4/2020 0:00,8/4/2020 0:00,21,gal,10/12/2020 11:48,Kamiander,1,1,1,0,{'2020-10-12 11:48:35': 1},1,0
135,Wichita KS,DefaultDept,(PL)Painting Ops-Bldg 14 North EU-NEWAEROPB3,BLEND: 09W015B - 80X042 - 1805CX (3:1:0.25),8/25/2020 0:00,8/25/2020 0:00,24,gal,10/12/2020 11:51,Kamiander,1,1,1,0,{'2020-10-12 11:51:08': 1},1,0
136,Wichita KS,DefaultDept,(PL)Painting Ops-Bldg 14 North EU-NEWAEROPB3,BLEND: 09W015B - 80X042 - 1805CX (3:1:0.25),10/3/2020 5:30,10/3/2020 5:30,24,gal,12/18/2020 15:03,dlyon,1,1,1,0,{'2020-12-18 15:03:23': 1},1,0
137,Wichita KS,DefaultDept,(PL)Painting Ops-Bldg 14 North EU-NEWAEROPB3,BLEND: 09W015B - 80X042 - 1805CX (3:1:0.25),10/27/2020 10:00,10/27/2020 10:00,24,gal,12/18/2020 15:27,dlyon,1,1,1,0,{'2020-12-18 15:27:24': 1},1,0
138,Wichita KS,DefaultDept,(PL)Painting Ops-Bldg 14 North EU-NEWAEROPB3,BLEND: 09W015B - 80X042 - 1805CX (4-1-1),7/18/2019 13:42,7/18/2019 13:42,20.75,gal,7/18/2019 13:46,adminbomgb,1,1,1,0,{'2019-07-18 13:46:08': 1},1,0
139,Wichita KS,DefaultDept,(PL)Painting Ops-Bldg 14 North EU-NEWAEROPB3,BLEND: 09W015B - 80X042 - 1805CX (4-1-1),7/18/2019 13:59,7/18/2019 13:59,18,gal,7/18/2019 13:59,adminbomgb,1,1,1,0,{'2019-07-18 13:59:19': 1},1,0
140,Wichita KS,DefaultDept,(PL)Painting Ops-Bldg 14 North EU-NEWAEROPB3,BLEND: 09W015B - 80X042 - 1805CX (4-1-1),7/19/2019 15:23,7/19/2019 15:23,24,gal,7/19/2019 15:23,adminbomgb,1,1,1,0,{'2019-07-19 15:23:27': 1},1,0
141,Wichita KS,DefaultDept,(PL)Painting Ops-Bldg 14 North EU-NEWAEROPB3,BLEND: 09W015B - 80X042 - 1805CX (4-1-1),7/19/2019 15:46,7/19/2019 15:46,22,gal,7/19/2019 15:46,adminbomgb,1,1,1,0,{'2019-07-19 15:46:12': 1},1,0
142,Wichita KS,DefaultDept,(PL)Painting Ops-Bldg 14 North EU-NEWAEROPB3,BLEND: 1050 - 8800Z - 8800CT2 - 1800CX (2-1-1-0.5),7/9/2019 9:00,7/9/2019 9:00,12.75,gal,8/21/2019 15:30,adminbomgb,1,1,1,0,{'2019-08-21 15:30:13': 1},1,0
143,Wichita KS,DefaultDept,(PL)Painting Ops-Bldg 14 North EU-NEWAEROPB3,BLEND: 1050 - 8800Z - 8800CT2 - 1800CX (2-1-1-0.5),7/18/2019 11:18,7/18/2019 11:18,15.75,gal,7/18/2019 11:18,adminbomgb,1,1,1,0,{'2019-07-18 11:18:36': 1},1,0
144,Wichita KS,DefaultDept,(PL)Painting Ops-Bldg 14 North EU-NEWAEROPB3,BLEND: 1050 - 8800Z - 8800CT2 - 1800CX (2-1-1-0.5),7/18/2019 13:49,7/18/2019 13:49,13.5,gal,7/18/2019 13:49,adminbomgb,1,1,1,0,{'2019-07-18 13:49:28': 1},1,0
145,Wichita KS,DefaultDept,(PL)Painting Ops-Bldg 14 North EU-NEWAEROPB3,BLEND: 1050 - 8800Z - 8800CT2 - 1800CX (2-1-1-0.5),7/19/2019 15:28,7/19/2019 15:28,13.5,gal,7/19/2019 15:28,adminbomgb,1,1,1,0,{'2019-07-19 15:28:22': 1},1,0
146,Wichita KS,DefaultDept,(PL)Painting Ops-Bldg 14 North EU-NEWAEROPB3,BLEND: 1050 - 8800Z - 8800CT2 - 1800CX (2-1-1-0.5),8/28/2019 7:00,8/28/2019 7:00,13.5,gal,9/17/2019 10:16,adminbomgb,1,1,1,0,{'2019-09-17 10:16:53': 1},1,0
147,Wichita KS,DefaultDept,(PL)Painting Ops-Bldg 14 North EU-NEWAEROPB3,BLEND: 7755A - 7755BE (1-1),7/18/2019 13:28,7/18/2019 13:28,7,gal,7/18/2019 13:28,adminbomgb,1,1,1,0,{'2019-07-18 13:28:20': 1},1,0
148,Wichita KS,DefaultDept,(PL)Painting Ops-Bldg 14 North EU-NEWAEROPB3,BLEND: 7755A - 7755BE (1-1),7/18/2019 13:56,7/18/2019 13:56,6,gal,7/18/2019 13:56,adminbomgb,1,1,1,0,{'2019-07-18 13:56:18': 1},1,0
149,Wichita KS,DefaultDept,(PL)Painting Ops-Bldg 14 North EU-NEWAEROPB3,BLEND: 7755A - 7755BE (1-1),7/19/2019 15:20,7/19/2019 15:20,6,gal,7/19/2019 15:20,adminbomgb,1,1,1,0,{'2019-07-19 15:20:25': 1},1,0
150,Wichita KS,DefaultDept,(PL)Painting Ops-Bldg 14 North EU-NEWAEROPB3,BLEND: 7755A - 7755BE (1-1),7/26/2019 5:00,7/26/2019 5:00,1.585031865,gal,8/21/2019 15:34,adminbomgb,1,1,1,0,{'2019-08-21 15:34:35': 1},1,0
151,Wichita KS,DefaultDept,(PL)Painting Ops-Bldg 14 North EU-NEWAEROPB3,BLEND: 7755A - 7755BE (1-1),8/20/2019 8:00,8/20/2019 8:00,6,gal,9/17/2019 10:12,adminbomgb,1,1,1,0,{'2019-09-17 10:12:12': 1},1,0
152,Wichita KS,DefaultDept,(PL)Painting Ops-Bldg 14 North EU-NEWAEROPB3,BLEND: 7755A - 7755BE (1-1),9/24/2019 9:00,9/24/2019 9:00,6,gal,10/15/2019 9:38,adminbomgb,1,1,1,0,{'2019-10-15 09:38:37': 1},1,0
153,Wichita KS,DefaultDept,(PL)Painting Ops-Bldg 14 North EU-NEWAEROPB3,BLEND: 7755A - 7755BE (1-1),10/17/2019 12:00,10/17/2019 12:00,6,gal,12/19/2019 16:04,adminbomry,1,1,1,0,{'2019-12-19 16:04:12': 1},1,0
154,Wichita KS,DefaultDept,(PL)Painting Ops-Bldg 14 North EU-NEWAEROPB3,BLEND: 7755A - 7755BE (1-1),11/14/2019 13:46,11/14/2019 13:46,6,gal,1/22/2020 14:47,Kamiander,1,1,1,0,{'2020-01-22 14:47:20': 1},1,0
155,Wichita KS,DefaultDept,(PL)Painting Ops-Bldg 14 North EU-NEWAEROPB3,BLEND: 7755A - 7755BE (1-1),1/7/2020 6:30,1/7/2020 6:30,6,gal,4/29/2020 9:23,adminbomjs,1,1,1,0,{'2020-04-29 09:23:20': 1},1,0
156,Wichita KS,DefaultDept,(PL)Painting Ops-Bldg 14 North EU-NEWAEROPB3,BLEND: 7755A - 7755BE (1-1),2/3/2020 10:43,2/3/2020 10:43,7,gal,5/7/2020 10:44,adminbomry,1,1,1,0,{'2020-05-07 10:44:39': 1},1,0
157,Wichita KS,DefaultDept,(PL)Painting Ops-Bldg 14 North EU-NEWAEROPB3,BLEND: 7755A - 7755BE (1-1),3/18/2020 0:25,3/18/2020 0:25,9,gal,8/19/2020 0:25,userbomry,1,1,1,0,{'2020-08-19 00:25:52': 1},1,0
158,Wichita KS,DefaultDept,(PL)Painting Ops-Bldg 14 North EU-NEWAEROPB3,BLEND: 7755A - 7755BE (1-1),4/22/2020 0:00,4/22/2020 0:00,6,gal,6/10/2020 13:46,Kamiander,1,1,1,0,{'2020-06-10 13:46:01': 1},1,0
159,Wichita KS,DefaultDept,(PL)Painting Ops-Bldg 14 North EU-NEWAEROPB3,BLEND: 7755A - 7755BE (1-1),5/27/2020 0:00,5/27/2020 0:00,6,gal,6/22/2020 10:06,Kamiander,1,1,1,0,{'2020-06-22 10:06:23': 1},1,0
160,Wichita KS,DefaultDept,(PL)Painting Ops-Bldg 14 North EU-NEWAEROPB3,BLEND: 7755A - 7755BE (1-1),6/30/2020 0:00,6/30/2020 0:00,6,gal,7/20/2020 9:38,Kamiander,1,1,1,0,{'2020-07-20 09:38:49': 1},1,0
161,Wichita KS,DefaultDept,(PL)Painting Ops-Bldg 14 North EU-NEWAEROPB3,BLEND: 7755A - 7755BE (1-1),7/30/2020 0:00,7/30/2020 0:00,1,gal,8/27/2020 10:10,Kamiander,1,1,1,0,{'2020-08-27 10:10:43': 1},1,0
162,Wichita KS,DefaultDept,(PL)Painting Ops-Bldg 14 North EU-NEWAEROPB3,BLEND: 7755A - 7755BE (1-1),8/4/2020 0:00,8/4/2020 0:00,6,gal,10/12/2020 11:41,Kamiander,1,1,1,0,{'2020-10-12 11:41:48': 1},1,0
163,Wichita KS,DefaultDept,(PL)Painting Ops-Bldg 14 North EU-NEWAEROPB3,BLEND: 7755A - 7755BE (1-1),8/25/2020 0:00,8/25/2020 0:00,6,gal,10/12/2020 11:45,Kamiander,1,1,1,0,{'2020-10-12 11:45:50': 1},1,0
164,Wichita KS,DefaultDept,(PL)Painting Ops-Bldg 14 North EU-NEWAEROPB3,BLEND: 7755A - 7755BE (1-1),10/2/2020 12:00,10/2/2020 12:00,4,gal,12/18/2020 15:00,dlyon,1,1,1,0,{'2020-12-18 15:00:32': 1},1,0
165,Wichita KS,DefaultDept,(PL)Painting Ops-Bldg 14 North EU-NEWAEROPB3,BLEND: 7755A - 7755BE (1-1),10/27/2020 7:00,10/27/2020 7:00,4,gal,12/18/2020 15:25,dlyon,1,1,1,0,{'2020-12-18 15:25:10': 1},1,0
166,Wichita KS,DefaultDept,(PL)Painting Ops-Bldg 14 North EU-NEWAEROPB3,BLEND: B900 - 8800Z - 8800F - 8800F4 (2-1-1-0.25),7/18/2019 11:53,7/18/2019 11:53,2.21875,gal,7/18/2019 11:57,adminbomgb,1,1,1,0,{'2019-07-18 11:57:29': 1},1,0
167,Wichita KS,DefaultDept,(PL)Painting Ops-Bldg 14 North EU-NEWAEROPB3,BLEND: B900 - 8800Z - 8800F - 8800F4 (2-1-1-0.25),7/18/2019 13:16,7/18/2019 13:16,2.22,gal,7/18/2019 13:16,adminbomgb,1,1,1,0,{'2019-07-18 13:16:36': 1},1,0
168,Wichita KS,DefaultDept,(PL)Painting Ops-Bldg 14 North EU-NEWAEROPB3,BLEND: B900 - 8800Z - 8800F - 8800F4 (2-1-1-0.25),7/19/2019 16:23,7/19/2019 16:23,0.1015625,gal,7/19/2019 16:23,adminbomgb,1,1,1,0,{'2019-07-19 16:23:19': 1},1,0
169,Wichita KS,DefaultDept,(PL)Painting Ops-Bldg 14 North EU-NEWAEROPB3,BLEND: B900 - 8800Z - 8800F - 8800F4 (2-1-1-0.25),7/19/2019 16:29,7/19/2019 16:29,1.14,gal,7/19/2019 16:29,adminbomgb,1,1,1,0,{'2019-07-19 16:29:25': 1},1,0
170,Wichita KS,DefaultDept,(PL)Painting Ops-Bldg 14 North EU-NEWAEROPB3,BLEND: B900 - 8800Z - 8800F - 8800F4 (2-1-1-0.25),4/9/2020 0:00,4/9/2020 0:00,1.125,gal,6/10/2020 13:44,Kamiander,1,1,1,0,{'2020-06-10 13:44:14': 1},1,0
171,Wichita KS,DefaultDept,(PL)Painting Ops-Bldg 14 North EU-NEWAEROPB3,BLEND: B900 - 8800Z - 8800F - 8800F4 (2-1-1-0.25),7/15/2020 0:00,7/15/2020 0:00,1.140625,gal,8/27/2020 9:43,Kamiander,1,1,1,0,{'2020-08-27 09:43:27': 1},1,0
172,Wichita KS,DefaultDept,(PL)Painting Ops-Bldg 14 North EU-NEWAEROPB3,BLEND: B900 - 8800Z - 8800F - 8800F4 (2-1-1-0.5),7/18/2019 11:41,7/18/2019 11:41,0.10546875,gal,7/18/2019 11:41,adminbomgb,1,1,1,0,{'2019-07-18 11:41:33': 1},1,0
173,Wichita KS,DefaultDept,(PL)Painting Ops-Bldg 14 North EU-NEWAEROPB3,BLEND: B900 - 8800Z - 8800F - 8800F4 (2-1-1-0.5),7/18/2019 13:21,7/18/2019 13:21,0.140625,gal,7/18/2019 13:22,adminbomgb,1,1,1,0,{'2019-07-18 13:22:40': 1},1,0
174,Wichita KS,DefaultDept,(PL)Painting Ops-Bldg 14 North EU-NEWAEROPB3,BLEND: B900 - 8800Z - 8800F - 8800F4 (2-1-1-0.5),7/18/2019 13:54,7/18/2019 13:54,0.0703125,gal,7/18/2019 13:54,adminbomgb,1,1,1,0,{'2019-07-18 13:54:24': 1},1,0
175,Wichita KS,DefaultDept,(PL)Painting Ops-Bldg 14 North EU-NEWAEROPB3,BLEND: B900 - 8800Z - 8800F - 8800F4 (2-1-1-0.5),7/18/2019 14:15,7/18/2019 14:15,1.14,gal,7/18/2019 14:15,adminbomgb,1,1,1,0,{'2019-07-18 14:15:44': 1},1,0
176,Wichita KS,DefaultDept,(PL)Painting Ops-Bldg 14 North EU-NEWAEROPB3,BLEND: B900 - 8800Z - 8800F - 8800F4 (2-1-1-0.5),7/22/2019 8:13,7/22/2019 8:13,1.125,gal,7/22/2019 8:20,adminbomgb,1,1,1,0,{'2019-07-22 08:20:51': 1},1,0
177,Wichita KS,DefaultDept,(PL)Painting Ops-Bldg 14 North EU-NEWAEROPB3,BLEND: B900 - 8800Z - 8800F - 8800F4 (2-1-1-0.5),7/22/2019 8:19,7/22/2019 8:19,1.125,gal,7/22/2019 8:19,adminbomgb,1,1,1,0,{'2019-07-22 08:19:09': 1},1,0
178,Wichita KS,DefaultDept,(PL)Painting Ops-Bldg 14 North EU-NEWAEROPB3,BLEND: B900 - 8800Z - 8800F - 8800F4 (2-1-1-0.5),10/28/2019 12:00,10/28/2019 12:00,0.066406,gal,12/19/2019 16:04,adminbomry,1,1,1,0,{'2019-12-19 16:04:12': 1},1,0
179,Wichita KS,DefaultDept,(PL)Painting Ops-Bldg 14 North EU-NEWAEROPB3,BLEND: B900 - 8800Z - 8800F - 8800F4 (2-1-1-0.5),11/4/2019 13:32,11/4/2019 13:32,1.125,gal,1/22/2020 14:33,Kamiander,1,1,1,0,{'2020-01-22 14:33:34': 1},1,0
180,Wichita KS,DefaultDept,(PL)Painting Ops-Bldg 14 North EU-NEWAEROPB3,BLEND: B900 - 8800Z - 8800F - 8800F4 (2-1-1-0.5),11/5/2019 12:46,11/5/2019 12:46,1.125,gal,1/22/2020 13:47,Kamiander,1,1,1,0,{'2020-01-22 13:47:23': 1},1,0
181,Wichita KS,DefaultDept,(PL)Painting Ops-Bldg 14 North EU-NEWAEROPB3,BLEND: B900 - 8800Z - 8800F - 8800F4 (2-1-1-0.5),11/25/2019 14:23,11/25/2019 14:23,1.125,gal,1/22/2020 15:24,Kamiander,1,1,1,0,{'2020-01-22 15:24:19': 1},1,0
182,Wichita KS,DefaultDept,(PL)Painting Ops-Bldg 14 North EU-NEWAEROPB3,BLEND: B900 - 8800Z - 8800F - 8800F4 (2-1-1-0.5),11/26/2019 14:33,11/26/2019 14:33,0.03515625,gal,1/22/2020 15:34,Kamiander,1,1,1,0,{'2020-01-22 15:34:17': 1},1,0
183,Wichita KS,DefaultDept,(PL)Painting Ops-Bldg 14 North EU-NEWAEROPB3,BLEND: B900 - 8800Z - 8800F - 8800F4 (2-1-1-0.5),2/16/2020 12:07,2/16/2020 12:07,1.046875,gal,5/7/2020 12:13,adminbomry,1,1,1,0,{'2020-05-07 12:13:35': 1},1,0
184,Wichita KS,DefaultDept,(PL)Painting Ops-Bldg 14 North EU-NEWAEROPB3,BLEND: B900 - 8800Z - 8800F - 8800F4 (2-1-1-0.5),4/9/2020 0:00,4/9/2020 0:00,0.15625,gal,6/10/2020 13:38,Kamiander,1,1,1,0,{'2020-06-10 13:38:38': 1},1,0
185,Wichita KS,DefaultDept,(PL)Painting Ops-Bldg 14 North EU-NEWAEROPB3,BLEND: B900 - 8800Z - 8800F - 8800F4 (2-1-1-0.5),5/20/2020 0:00,5/20/2020 0:00,1.0625,gal,6/22/2020 10:01,Kamiander,1,1,1,0,{'2020-06-22 10:01:47': 1},1,0
186,Wichita KS,DefaultDept,(PL)Painting Ops-Bldg 14 North EU-NEWAEROPB3,BLEND: B900 - 8800Z - 8800F - 8800F4 (2-1-1-0.5),9/16/2020 9:30,9/16/2020 9:30,1.140625,gal,12/18/2020 14:17,dlyon,1,1,1,0,{'2020-12-18 14:17:31': 1},1,0
187,Wichita KS,DefaultDept,(PL)Painting Ops-Bldg 14 North EU-NEWAEROPB3,BLEND: B900 - 8800Z - 8800F - 8800F4 (2-1-1-0.5),9/17/2020 11:30,9/17/2020 11:30,2.25,gal,12/18/2020 14:22,dlyon,1,1,1,0,{'2020-12-18 14:22:20': 1},1,0
188,Wichita KS,DefaultDept,(PL)Painting Ops-Bldg 14 North EU-NEWAEROPB3,BLEND: B900 - 8800Z - 8800F - 8800F4 (2-1-1-0.5),10/16/2020 9:00,10/16/2020 9:00,1.140625,gal,12/18/2020 15:16,dlyon,1,1,1,0,{'2020-12-18 15:16:56': 1},1,0
189,Wichita KS,DefaultDept,(PL)Painting Ops-Bldg 14 North EU-NEWAEROPB3,BLEND: B900 - 8800Z - 8800F - 8800F4 (2-1-1-0.5),10/18/2020 9:00,10/18/2020 9:00,0.640625,gal,12/18/2020 15:23,dlyon,1,1,1,0,{'2020-12-18 15:23:35': 1},1,0
190,Wichita KS,DefaultDept,(PL)Painting Ops-Bldg 14 North EU-NEWAEROPB3,BLEND: B900 - 8800Z - 8800F - 8800F4 (2-1-1-0.5),11/7/2020 10:00,11/7/2020 10:00,1.125,gal,12/21/2020 8:52,dlyon,1,1,1,0,{'2020-12-21 08:52:33': 1},1,0
191,Wichita KS,DefaultDept,(PL)Painting Ops-Bldg 14 North EU-NEWAEROPB3,BLEND: B900 - 8800Z - 8800F - 8800F4 (2-1-1-0.5),11/8/2020 8:00,11/8/2020 8:00,0.5625,gal,12/21/2020 9:04,dlyon,1,1,1,0,{'2020-12-21 09:04:34': 1},1,0
192,Wichita KS,DefaultDept,(PL)Painting Ops-Bldg 14 North EU-NEWAEROPB3,BLEND: I1050 - 8800Z - 8800CT2 - 1800CX (2-1-1-0.25),7/18/2019 11:46,7/18/2019 11:46,2.15,gal,7/18/2019 11:54,adminbomgb,1,1,1,0,{'2019-07-18 11:54:06': 1},1,0
193,Wichita KS,DefaultDept,(PL)Painting Ops-Bldg 14 North EU-NEWAEROPB3,BLEND: I1050 - 8800Z - 8800CT2 - 1800CX (2-1-1-0.25),7/19/2019 15:50,7/19/2019 15:50,13.5,gal,7/19/2019 15:50,adminbomgb,1,1,1,0,{'2019-07-19 15:50:12': 1},1,0
194,Wichita KS,DefaultDept,(PL)Painting Ops-Bldg 14 North EU-NEWAEROPB3,BLEND: I1050 - 8800Z - 8800CT2 - 1800CX (2-1-1-0.25),8/5/2019 5:35,8/5/2019 5:35,12.75,gal,9/17/2019 10:10,adminbomgb,1,1,1,0,{'2019-09-17 10:10:33': 1},1,0
195,Wichita KS,DefaultDept,(PL)Painting Ops-Bldg 14 North EU-NEWAEROPB3,BLEND: I1050 - 8800Z - 8800CT3 (2-1-1.25),7/18/2019 13:45,7/18/2019 13:45,0.09765625,gal,7/18/2019 13:45,adminbomgb,1,1,1,0,{'2019-07-18 13:45:33': 1},1,0
196,Wichita KS,DefaultDept,(PL)Painting Ops-Bldg 14 North EU-NEWAEROPB3,BLEND: I1050 - 8800Z - 8800CT3 (2-1-1.25),7/19/2019 15:26,7/19/2019 15:26,0.28125,gal,7/19/2019 15:26,adminbomgb,1,1,1,0,{'2019-07-19 15:26:16': 1},1,0
197,Wichita KS,DefaultDept,(PL)Painting Ops-Bldg 14 North EU-NEWAEROPB3,BLEND: I1050 - 8800Z - 8800CT4 - 1800CX (2-1-1-0.25),9/25/2019 9:00,9/25/2019 9:00,0.1328125,gal,10/15/2019 9:43,adminbomgb,1,1,1,0,{'2019-10-15 09:43:17': 1},1,0
198,Wichita KS,DefaultDept,(PL)Painting Ops-Bldg 14 North EU-NEWAEROPB3,BLEND: I2014 - 8800Z - 8800CT2 - 1800CX (2-1-1-0.5),7/18/2019 11:23,7/18/2019 11:23,0.10546875,gal,7/18/2019 11:23,adminbomgb,1,1,1,0,{'2019-07-18 11:23:21': 1},1,0
199,Wichita KS,DefaultDept,(PL)Painting Ops-Bldg 14 North EU-NEWAEROPB3,BLEND: I2014 - 8800Z - 8800CT2 - 1800CX (2-1-1-0.5),7/18/2019 14:20,7/18/2019 14:20,1.14,gal,7/18/2019 14:20,adminbomgb,1,1,1,0,{'2019-07-18 14:20:01': 1},1,0
200,Wichita KS,DefaultDept,(PL)Painting Ops-Bldg 14 North EU-NEWAEROPB3,BLEND: I2014 - 8800Z - 8800CT3 (2-1-1.5),7/18/2019 13:52,7/18/2019 13:52,0.06640625,gal,7/18/2019 13:52,adminbomgb,1,1,1,0,{'2019-07-18 13:52:25': 1},1,0
201,Wichita KS,DefaultDept,(PL)Painting Ops-Bldg 14 North EU-NEWAEROPB3,BLEND: I2014 - 8800Z - 8800CT3 (2-1-1.5),7/18/2019 14:07,7/18/2019 14:07,0.10546875,gal,7/18/2019 14:07,adminbomgb,1,1,1,0,{'2019-07-18 14:07:35': 1},1,0
202,Wichita KS,DefaultDept,(PL)Painting Ops-Bldg 14 North EU-NEWAEROPB3,BLEND: I2014 - 8800Z - 8800CT3 (2-1-1.5),10/28/2019 12:00,10/28/2019 12:00,0.074219,gal,12/19/2019 16:04,adminbomry,1,1,1,0,{'2019-12-19 16:04:12': 1},1,0
203,Wichita KS,DefaultDept,(PL)Painting Ops-Bldg 14 North EU-NEWAEROPB3,BLEND: I2706 - 8800Z - 8800CT3 - 1800CX (2-1-1-0.5),7/18/2019 14:13,7/18/2019 14:13,1.14,gal,7/18/2019 14:13,adminbomgb,1,1,1,0,{'2019-07-18 14:13:31': 1},1,0
204,Wichita KS,DefaultDept,(PL)Painting Ops-Bldg 14 North EU-NEWAEROPB3,BLEND: IM299 - 8800Z - 8800CT3 - 1800CX (2-1-1-0.25),7/18/2019 13:13,7/18/2019 13:13,2.22,gal,7/18/2019 13:13,adminbomgb,1,1,1,0,{'2019-07-18 13:13:35': 1},1,0
205,Wichita KS,DefaultDept,(PL)Painting Ops-Bldg 14 North EU-NEWAEROPB3,BLEND: IM6076 - 8800Z - 8800CT3 - 1800CX (2-1-1-0.25),7/18/2019 11:50,7/18/2019 11:50,2.21875,gal,7/18/2019 11:57,adminbomgb,1,1,1,0,{'2019-07-18 11:57:04': 1},1,0
206,Wichita KS,DefaultDept,(PL)Painting Ops-Bldg 14 North EU-NEWAEROPB3,BLEND: IM6076 - 8800Z - 8800CT3 - 1800CX (2-1-1-0.5),7/18/2019 13:19,7/18/2019 13:19,0.140625,gal,7/18/2019 13:19,adminbomgb,1,1,1,0,{'2019-07-18 13:19:38': 1},1,0
207,Wichita KS,DefaultDept,(PL)Painting Ops-Bldg 14 North EU-NEWAEROPB3,BLEND: IM9092 - 8800Z - 8800CT3 - 1800CX (2-1-1-0.5),7/18/2019 14:17,7/18/2019 14:17,1.14,gal,7/18/2019 14:17,adminbomgb,1,1,1,0,{'2019-07-18 14:17:57': 1},1,0
208,Wichita KS,DefaultDept,(PL)Painting Ops-Bldg 14 North EU-NEWAEROPB3,Blend: 9008 I5323 Base - CA8800Z - CA8800CT3 - 1800CX - (2:1:1:.5),7/15/2020 11:30,7/15/2020 11:30,1.125,gal,12/30/2020 13:56,dlyon,1,1,1,0,{'2020-12-30 13:56:11': 1},1,0
209,Wichita KS,DefaultDept,(PL)Painting Ops-Bldg 14 North EU-NEWAEROPB3,Blend: B701 - 8800Z - 8800CT3 (2:1:1.5),10/28/2019 12:00,10/28/2019 12:00,0.070313,gal,12/19/2019 16:04,adminbomry,1,1,1,0,{'2019-12-19 16:04:12': 1},1,0
210,Wichita KS,DefaultDept,(PL)Painting Ops-Bldg 14 North EU-NEWAEROPB3,Blend: B900 - 8800Z - 8800F (2:1:1),2/17/2020 12:37,2/17/2020 12:37,12,gal,5/7/2020 12:46,adminbomry,1,1,1,0,{'2020-05-07 12:46:33': 1},1,0
211,Wichita KS,DefaultDept,(PL)Painting Ops-Bldg 14 North EU-NEWAEROPB3,Blend: B900 - 8800Z - 8800F (2:1:1),4/7/2020 0:00,4/7/2020 0:00,12,gal,6/10/2020 13:32,Kamiander,1,1,1,0,{'2020-06-10 13:32:48': 1},1,0
212,Wichita KS,DefaultDept,(PL)Painting Ops-Bldg 14 North EU-NEWAEROPB3,Blend: B900 - 8800Z - 8800F (2:1:1),6/5/2020 0:00,6/5/2020 0:00,8,gal,7/20/2020 9:32,Kamiander,1,1,1,0,{'2020-07-20 09:32:50': 1},1,0
213,Wichita KS,DefaultDept,(PL)Painting Ops-Bldg 14 North EU-NEWAEROPB3,Blend: B900 - 8800Z - 8800F (2:1:1),6/8/2020 0:00,6/8/2020 0:00,8,gal,7/20/2020 9:36,Kamiander,1,1,1,0,{'2020-07-20 09:36:54': 1},1,0
214,Wichita KS,DefaultDept,(PL)Painting Ops-Bldg 14 North EU-NEWAEROPB3,Blend: B900 - 8800Z - 8800F (2:1:1.5),2/21/2020 13:49,2/21/2020 13:49,10.25,gal,5/7/2020 13:49,adminbomry,1,1,1,0,{'2020-05-07 13:49:51': 1},1,0
215,Wichita KS,DefaultDept,(PL)Painting Ops-Bldg 14 North EU-NEWAEROPB3,Blend: B900 - 8800Z - 8800F4 (2:1:1),7/12/2019 6:45,7/12/2019 6:45,0.1875,gal,8/21/2019 15:55,adminbomgb,1,1,1,0,{'2019-08-21 15:55:27': 1},1,0
216,Wichita KS,DefaultDept,(PL)Painting Ops-Bldg 14 North EU-NEWAEROPB3,Blend: B900 - 8800Z - 8800F4 (2:1:1),7/15/2019 8:45,7/15/2019 8:45,0.1875,gal,8/21/2019 15:59,adminbomgb,1,1,1,0,{'2019-08-21 15:59:49': 1},1,0
217,Wichita KS,DefaultDept,(PL)Painting Ops-Bldg 14 North EU-NEWAEROPB3,Blend: B900 - 8800Z - 8800F4 (2:1:1),7/17/2019 7:30,7/17/2019 7:30,0.1875,gal,8/21/2019 15:58,adminbomgb,1,1,1,0,{'2019-08-21 15:58:16': 1},1,0
218,Wichita KS,DefaultDept,(PL)Painting Ops-Bldg 14 North EU-NEWAEROPB3,Blend: CA 8000 IM911 - CA 8800Z - CA 8800CT3 - 1800CX - (2:1:1:.5),9/16/2020 6:00,9/16/2020 6:00,1.140625,gal,12/18/2020 14:15,dlyon,1,1,1,0,{'2020-12-18 14:15:20': 1},1,0
219,Wichita KS,DefaultDept,(PL)Painting Ops-Bldg 14 North EU-NEWAEROPB3,Blend: CA 8000/IM215 (2 Qt) -CA 8800Z Activator (1 Qt) - 8800CT3 THINNER (1.5 Qt),11/4/2019 0:00,11/4/2019 0:00,1.125,gal,1/22/2020 14:02,adminbomry,1,1,1,0,{'2020-01-22 14:02:56': 1},1,0
220,Wichita KS,DefaultDept,(PL)Painting Ops-Bldg 14 North EU-NEWAEROPB3,Blend: CA8000 IM923 - CA8800Z - CA8800CT3 - 1800CX - (2:1:1:.5),9/17/2020 8:00,9/17/2020 8:00,2.25,gal,12/18/2020 14:19,dlyon,1,1,1,0,{'2020-12-18 14:19:56': 1},1,0
221,Wichita KS,DefaultDept,(PL)Painting Ops-Bldg 14 North EU-NEWAEROPB3,Blend: CA8800 I4099 - CA8800Z - CA8800CT3 - 1800CX - (2:1:1:.5),11/7/2020 7:00,11/7/2020 7:00,1.125,gal,12/21/2020 8:48,dlyon,1,1,1,0,{'2020-12-21 08:48:39': 1},1,0
222,Wichita KS,DefaultDept,(PL)Painting Ops-Bldg 14 North EU-NEWAEROPB3,Blend: CA8800 I4099 - CA8800Z - CA8800CT4 - 1800CX - (2:1:1:.5),10/16/2020 6:15,10/16/2020 6:15,1.140625,gal,12/18/2020 15:08,dlyon,1,1,1,0,{'2020-12-18 15:08:32': 1},1,0
223,Wichita KS,DefaultDept,(PL)Painting Ops-Bldg 14 North EU-NEWAEROPB3,Blend: CA8800 I6509 - CA8800Z - CA8800CT3 - 1800CX - (2:1:1:.5),10/18/2020 6:00,10/18/2020 6:00,0.625,gal,12/18/2020 15:20,dlyon,1,1,1,0,{'2020-12-18 15:20:14': 1},1,0
224,Wichita KS,DefaultDept,(PL)Painting Ops-Bldg 14 North EU-NEWAEROPB3,Blend: CA8800 I6509 - CA8800Z - CA8800CT3 - 1800CX - (2:1:1:.5),11/8/2020 6:30,11/8/2020 6:30,0.59375,gal,12/21/2020 9:02,dlyon,1,1,1,0,{'2020-12-21 09:02:01': 1},1,0
225,Wichita KS,DefaultDept,(PL)Painting Ops-Bldg 14 North EU-NEWAEROPB3,Blend: CA8800/I1050 - CA8800Z - CA8800CT3 (2-1-1),2/4/2019 10:56,2/4/2019 10:56,0.097656,gal,7/10/2019 9:06,adminbomgb,1,1,1,0,{'2019-07-10 09:06:15': 1},1,0
226,Wichita KS,DefaultDept,(PL)Painting Ops-Bldg 14 North EU-NEWAEROPB3,Blend: CA8800/I1050 - CA8800Z - CA8800CT3 (2-1-1),5/7/2019 8:47,5/7/2019 8:47,0.25,gal,5/7/2019 8:47,jcameron,1,1,1,0,{'2019-05-07 08:47:49': 1},1,0
227,Wichita KS,DefaultDept,(PL)Painting Ops-Bldg 14 North EU-NEWAEROPB3,Blend: CA8800/IM965 - 8800Z - 8800CT4 (2:1:1),7/11/2019 10:30,7/11/2019 10:30,0.03125,gal,8/21/2019 15:32,adminbomgb,1,1,1,0,{'2019-08-21 15:32:05': 1},1,0
228,Wichita KS,DefaultDept,(PL)Painting Ops-Bldg 14 North EU-NEWAEROPB3,Blend: I1050 - 8800Z - 8800CT (2:1:1.5),10/24/2019 12:00,10/24/2019 12:00,13.5,gal,12/19/2019 16:04,adminbomry,1,1,1,0,{'2019-12-19 16:04:12': 1},1,0
229,Wichita KS,DefaultDept,(PL)Painting Ops-Bldg 14 North EU-NEWAEROPB3,Blend: I1050 - 8800Z - 8800CT (2:1:1.5),10/28/2019 12:00,10/28/2019 12:00,2,gal,12/19/2019 16:04,adminbomry,1,1,1,0,{'2019-12-19 16:04:12': 1},1,0
230,Wichita KS,DefaultDept,(PL)Painting Ops-Bldg 14 North EU-NEWAEROPB3,Blend: I1050 - 8800Z - 8800CT - 1800CX (2:1:1:0.5),6/4/2020 0:00,6/4/2020 0:00,18,gal,7/20/2020 9:27,Kamiander,1,1,1,0,{'2020-07-20 09:27:54': 1},1,0
231,Wichita KS,DefaultDept,(PL)Painting Ops-Bldg 14 North EU-NEWAEROPB3,Blend: I1050 - 8800Z - 8800CT - 1800CX (2:1:1:0.5),7/9/2020 0:00,7/9/2020 0:00,18,gal,8/27/2020 9:36,Kamiander,1,1,1,0,{'2020-08-27 09:36:14': 1},1,0
232,Wichita KS,DefaultDept,(PL)Painting Ops-Bldg 14 North EU-NEWAEROPB3,Blend: I1050 - 8800Z - 8800CT - 1800CX (2:1:1:0.5),8/10/2020 0:00,8/10/2020 0:00,13.5,gal,10/12/2020 11:44,Kamiander,1,1,1,0,{'2020-10-12 11:44:19': 1},1,0
233,Wichita KS,DefaultDept,(PL)Painting Ops-Bldg 14 North EU-NEWAEROPB3,Blend: I1050 - 8800Z - 8800CT - 1800CX (2:1:1:0.5),9/1/2020 9:00,9/1/2020 9:00,9,gal,12/18/2020 14:11,dlyon,1,1,1,0,{'2020-12-18 14:11:57': 1},1,0
234,Wichita KS,DefaultDept,(PL)Painting Ops-Bldg 14 North EU-NEWAEROPB3,Blend: I1050 - 8800Z - 8800CT - 1800CX (2:1:1:0.5),10/12/2020 9:00,10/12/2020 9:00,18,gal,12/18/2020 15:05,dlyon,1,1,1,0,{'2020-12-18 15:05:41': 1},1,0
235,Wichita KS,DefaultDept,(PL)Painting Ops-Bldg 14 North EU-NEWAEROPB3,Blend: I1050 - 8800Z - 8800CT - 1800CX (2:1:1:0.5),11/2/2020 10:00,11/2/2020 10:00,18,gal,12/18/2020 15:38,dlyon,1,1,1,0,{'2020-12-18 15:38:13': 1},1,0
236,Wichita KS,DefaultDept,(PL)Painting Ops-Bldg 14 North EU-NEWAEROPB3,Blend: I2014 - 8800Z - 8800CT3 - 1800CX (2:1:1:0.25),7/19/2019 16:20,7/19/2019 16:20,0.1015625,gal,7/19/2019 16:20,adminbomgb,1,1,1,0,{'2019-07-19 16:20:52': 1},1,0
237,Wichita KS,DefaultDept,(PL)Painting Ops-Bldg 14 North EU-NEWAEROPB3,Blend: I2029 - 8800Z - 8800CT3 - 1800CX (2:1:1:0.5),7/22/2019 8:16,7/22/2019 8:16,1.14,gal,7/22/2019 8:16,adminbomgb,1,1,1,0,{'2019-07-22 08:16:08': 1},1,0
238,Wichita KS,DefaultDept,(PL)Painting Ops-Bldg 14 North EU-NEWAEROPB3,Blend: I2029 - 8800Z - 8800CT3 - 1800CX (2:1:1:0.5),7/15/2020 0:00,7/15/2020 0:00,1.125,gal,8/27/2020 9:39,Kamiander,1,1,1,0,{'2020-08-27 09:39:43': 1},1,0
239,Wichita KS,DefaultDept,(PL)Painting Ops-Bldg 14 North EU-NEWAEROPB3,Blend: I3220 - 8800Z - 8800CT3 - 1800CX (2:1:1:0.25),7/19/2019 16:31,7/19/2019 16:31,1.14,gal,7/19/2019 16:31,adminbomgb,1,1,1,0,{'2019-07-19 16:31:42': 1},1,0
240,Wichita KS,DefaultDept,(PL)Painting Ops-Bldg 14 North EU-NEWAEROPB3,Blend: I6032 - 8800Z - 8800CT3 - 1800CX (2:1:1:0.25),7/19/2019 16:26,7/19/2019 16:26,1.14,gal,7/19/2019 16:26,adminbomgb,1,1,1,0,{'2019-07-19 16:26:35': 1},1,0
241,Wichita KS,DefaultDept,(PL)Painting Ops-Bldg 14 North EU-NEWAEROPB3,Blend: IM6033 - 8800Z - 8800CT3 - 1800CX (2:1:1:0.5),7/22/2019 8:11,7/22/2019 8:11,1.14,gal,7/22/2019 8:11,adminbomgb,1,1,1,0,{'2019-07-22 08:11:25': 1},1,0
242,Wichita KS,DefaultDept,(PL)Painting Ops-Bldg 14 North EU-NEWAEROPB3,Blend: IM747 - 8800Z - 8800CT (2:1:1),7/17/2019 5:30,7/17/2019 5:30,0.1875,gal,8/21/2019 15:46,adminbomgb,1,1,1,0,{'2019-08-21 15:46:30': 1},1,0
243,Wichita KS,DefaultDept,(PL)Painting Ops-Bldg 14 North EU-NEWAEROPB3,Blend: IM750 - 8800Z - 8800CT (2:1:1),7/12/2019 7:30,7/12/2019 7:30,0.1875,gal,8/21/2019 15:49,adminbomgb,1,1,1,0,{'2019-08-21 15:49:53': 1},1,0
244,Wichita KS,DefaultDept,(PL)Painting Ops-Bldg 14 North EU-NEWAEROPB3,Blend: IM911 - 8800Z - 8800CT (2:1:1),7/15/2019 8:16,7/15/2019 8:16,0.1875,gal,8/21/2019 15:51,adminbomgb,1,1,1,0,{'2019-08-21 15:51:59': 1},1,0
245,Wichita KS,DefaultDept,(PL)Painting Ops-Bldg 14 North EU-NEWAEROPB3,Blend: PG-6-MB23 - PH-19 - SC-5 (2:1:1),1/21/2020 18:00,1/21/2020 18:00,1,gal,5/22/2020 12:06,adminbomjs,1,1,1,0,{'2020-05-22 12:06:42': 1},1,0
246,Wichita KS,DefaultDept,(PL)Painting Ops-Bldg 14 North EU-NEWAEROPB3,Blend: PG-6-MB23 - PH-19 - SC-5 (2:1:1),2/16/2020 12:31,2/16/2020 12:31,1,gal,5/7/2020 12:32,adminbomry,1,1,1,0,{'2020-05-07 12:32:28': 1},1,0
247,Wichita KS,DefaultDept,(PL)Painting Ops-Bldg 14 North EU-NEWAEROPB3,Blend: PG-6-MB23 - PH-19 - SC-5 (2:1:1),4/9/2020 0:00,4/9/2020 0:00,1,gal,6/10/2020 13:40,Kamiander,1,1,1,0,{'2020-06-10 13:40:52': 1},1,0
248,Wichita KS,DefaultDept,(PL)Painting Ops-Bldg 14 North EU-NEWAEROPB3,Blend: PG-6-MC26 - PH-19 - SC-5 (2:1:1),1/20/2020 8:00,1/20/2020 8:00,1,gal,5/22/2020 12:08,adminbomjs,1,1,1,0,{'2020-05-22 12:08:21': 1},1,0
249,Wichita KS,DefaultDept,(PL)Painting Ops-Bldg 14 North EU-NEWAEROPB3,Blend: PG-6-MC26 - PH-19 - SC-5 (2:1:1),2/16/2020 11:56,2/16/2020 11:56,1,gal,5/7/2020 12:03,adminbomry,1,1,1,0,{'2020-05-07 12:03:05': 1},1,0
250,Wichita KS,DefaultDept,(PL)Painting Ops-Bldg 14 North EU-NEWAEROPB3,Blend: PG-6-MC26 - PH-19 - SC-5 (2:1:1),4/9/2020 0:00,4/9/2020 0:00,1,gal,6/10/2020 13:36,Kamiander,1,1,1,0,{'2020-06-10 13:36:01': 1},1,0
251,Wichita KS,DefaultDept,(PL)Painting Ops-Bldg 14 North EU-NEWAEROPB3,CA 7755A Base - CA7755BE Slow Activator,2/4/2019 10:46,2/4/2019 10:46,7,gal,7/10/2019 9:06,adminbomgb,1,1,1,0,{'2019-07-10 09:06:15': 1},1,0
252,Wichita KS,DefaultDept,(PL)Painting Ops-Bldg 14 North EU-NEWAEROPB3,CA 7755A Base - CA7755BE Slow Activator,3/4/2019 16:09,3/4/2019 16:09,6,gal,7/5/2019 13:44,adminbomgb,1,1,1,0,{'2019-07-05 13:44:50': 1},1,0
253,Wichita KS,DefaultDept,(PL)Painting Ops-Bldg 14 North EU-NEWAEROPB3,CA 7755A Base - CA7755BE Slow Activator,4/4/2019 11:45,4/4/2019 11:45,6,gal,4/4/2019 11:45,jcameron,1,1,1,0,{'2019-04-04 11:45:04': 1},1,0
254,Wichita KS,DefaultDept,(PL)Painting Ops-Bldg 14 North EU-NEWAEROPB3,CA 7755A Base - CA7755BE Slow Activator,5/7/2019 8:01,5/7/2019 8:01,6,gal,5/7/2019 8:01,jcameron,1,1,1,0,{'2019-05-07 08:01:10': 1},1,0
255,Wichita KS,DefaultDept,(PL)Painting Ops-Bldg 14 North EU-NEWAEROPB3,CA 7755A Base - CA7755BE Slow Activator,5/29/2019 15:59,5/29/2019 15:59,6,gal,5/29/2019 15:59,jcameron,1,1,1,0,{'2019-05-29 15:59:35': 1},1,0
256,Wichita KS,DefaultDept,(PL)Painting Ops-Bldg 14 North EU-NEWAEROPB3,CA 7755A Base - CA7755BE Slow Activator,7/31/2019 11:04,7/31/2019 11:04,6,gal,7/31/2019 11:04,jcameron,1,1,1,0,{'2019-07-31 11:04:48': 1},1,0
257,Wichita KS,DefaultDept,(PL)Painting Ops-Bldg 14 North EU-NEWAEROPB3,CA 7755A Base - CA7755BE Slow Activator,8/20/2019 8:00,8/20/2019 8:00,6,gal,9/9/2019 9:58,jcameron,1,1,1,0,{'2019-09-09 09:58:54': 1},1,0
258,Wichita KS,DefaultDept,(PL)Painting Ops-Bldg 14 North EU-NEWAEROPB3,CA 7755A Base - CA7755BE Slow Activator,9/24/2019 9:00,9/24/2019 9:00,6,gal,9/30/2019 11:23,jcameron,1,1,1,0,{'2019-09-30 11:23:36': 1},1,0
259,Wichita KS,DefaultDept,(PL)Painting Ops-Bldg 14 North EU-NEWAEROPB3,CA 7755A Base - CA7755BE Slow Activator,10/17/2019 12:00,10/17/2019 12:00,6,gal,12/19/2019 16:04,adminbomry,1,1,1,0,{'2019-12-19 16:04:12': 1},1,0
260,Wichita KS,DefaultDept,(PL)Painting Ops-Bldg 14 North EU-NEWAEROPB3,CA 8000 B701 BASE COMPONENT (4oz) - 8800Z (2oz) - 8800CT2 (2.5oz),10/28/2019 12:00,10/28/2019 12:00,0.070313,gal,12/19/2019 16:04,adminbomry,1,1,1,0,{'2019-12-19 16:04:12': 1},1,0
261,Wichita KS,DefaultDept,(PL)Painting Ops-Bldg 14 North EU-NEWAEROPB3,CA 8000 IM6066 Base - CA 8800Z Activator - CA 8800CT2 Thinner,1/29/2019 11:30,1/29/2019 11:30,2.25,gal,1/29/2019 11:30,adminbommg,1,1,1,0,{'2019-01-29 11:30:42': 1},1,0
262,Wichita KS,DefaultDept,(PL)Painting Ops-Bldg 14 North EU-NEWAEROPB3,CA 8000/B701 BASE - CA 8800Z ACTIVATOR - CA 8800CT2 & CA1800CX THINNER Blend,1/28/2019 17:21,1/28/2019 17:21,1.14,gal,1/28/2019 17:21,adminbommg,1,1,1,0,{'2019-01-28 17:21:06': 1},1,0
263,Wichita KS,DefaultDept,(PL)Painting Ops-Bldg 14 North EU-NEWAEROPB3,CA 8000/IM9092 Base - CA 8800Z Activator - CA 8800CT2 & CA1800CX Thinner Blend,1/28/2019 17:28,1/28/2019 17:28,1.625,gal,1/28/2019 17:28,adminbommg,1,1,1,0,{'2019-01-28 17:28:10': 1},1,0
264,Wichita KS,DefaultDept,(PL)Painting Ops-Bldg 14 North EU-NEWAEROPB3,CA 8000/IM9092 Base - CA 8800Z Activator - CA 8800CT2 & CA1800CX Thinner Blend,4/4/2019 11:34,4/4/2019 11:34,4.5,gal,4/4/2019 11:34,jcameron,1,1,1,0,{'2019-04-04 11:34:22': 1},1,0
265,Wichita KS,DefaultDept,(PL)Painting Ops-Bldg 14 North EU-NEWAEROPB3,CA 8800 B900 Base(2QT) - CA 8800 Activator(1QT)  - 8800F THINNER(1.5QT),1/23/2020 6:00,1/23/2020 6:00,9,gal,4/30/2020 17:08,adminbomjs,1,1,1,0,{'2020-04-30 17:08:53': 1},1,0
266,Wichita KS,DefaultDept,(PL)Painting Ops-Bldg 14 North EU-NEWAEROPB3,CA 8800 B900 Base(2QT) - CA 8800 Activator(1QT)  - 8800F THINNER(1.5QT),1/25/2020 7:30,1/25/2020 7:30,13.5,gal,4/30/2020 17:13,adminbomjs,1,1,1,0,{'2020-04-30 17:13:25': 1},1,0
267,Wichita KS,DefaultDept,(PL)Painting Ops-Bldg 14 North EU-NEWAEROPB3,CA 8800 B900 Base(8oz) - CA 8800Z Activator (4oz)  - 8800F THINNER (4oz) - 8800F4 THINNER (.5oz),4/4/2019 11:39,4/4/2019 11:39,4.5,gal,4/4/2019 11:39,jcameron,1,1,1,0,{'2019-04-04 11:39:43': 1},1,0
268,Wichita KS,DefaultDept,(PL)Painting Ops-Bldg 14 North EU-NEWAEROPB3,CA 8800 B900 Base(8oz) - CA 8800Z Activator (4oz)  - 8800F THINNER (4oz) - 8800F4 THINNER (.5oz),7/9/2019 15:11,7/9/2019 15:11,1.125,gal,7/9/2019 15:11,jcameron,1,1,1,0,{'2019-07-09 15:11:29': 1},1,0
269,Wichita KS,DefaultDept,(PL)Painting Ops-Bldg 14 North EU-NEWAEROPB3,CA 8800 B900 Base(8oz) - CA 8800Z Activator (4oz)  - 8800F THINNER (4oz) - 8800F4 THINNER (.5oz),7/31/2019 11:17,7/31/2019 11:17,0.1875,gal,7/31/2019 11:17,jcameron,1,1,1,0,{'2019-07-31 11:17:45': 1},1,0
270,Wichita KS,DefaultDept,(PL)Painting Ops-Bldg 14 North EU-NEWAEROPB3,CA 8800 B900 Base(8oz) - CA 8800Z Activator (4oz)  - 8800F THINNER (4oz) - 8800F4 THINNER (.5oz),7/31/2019 11:27,7/31/2019 11:27,0.1875,gal,7/31/2019 11:27,jcameron,1,1,1,0,{'2019-07-31 11:27:15': 1},1,0
271,Wichita KS,DefaultDept,(PL)Painting Ops-Bldg 14 North EU-NEWAEROPB3,CA 8800 B900 Base(8oz) - CA 8800Z Activator (4oz)  - 8800F THINNER (4oz) - 8800F4 THINNER (.5oz),10/28/2019 12:00,10/28/2019 12:00,0.066406,gal,12/19/2019 16:04,adminbomry,1,1,1,0,{'2019-12-19 16:04:12': 1},1,0
272,Wichita KS,DefaultDept,(PL)Painting Ops-Bldg 14 North EU-NEWAEROPB3,CA 8800/I1050 Base Component - CA 8800Z Activator - CA 8800CT2/CA1800CX Thinner Blend,1/28/2019 16:53,1/28/2019 16:53,4.5,gal,1/28/2019 16:53,adminbommg,1,1,1,0,{'2019-01-28 16:53:09': 1},1,0
273,Wichita KS,DefaultDept,(PL)Painting Ops-Bldg 14 North EU-NEWAEROPB3,CA 8800/I1050 Base Component - CA 8800Z Activator - CA 8800CT2/CA1800CX Thinner Blend,4/29/2020 0:00,4/29/2020 0:00,18,gal,6/10/2020 14:20,Kamiander,1,1,1,0,{'2020-06-10 14:20:10': 1},1,0
274,Wichita KS,DefaultDept,(PL)Painting Ops-Bldg 14 North EU-NEWAEROPB3,CA 8800/I2014-CA 8800Z Activator - 8800CT2 THINNER CA1800CX THINNER  2 qrt,1/18/2019 10:48,1/18/2019 10:48,0.10546875,gal,1/29/2019 10:40,adminbommg,1,1,1,0,{'2019-01-29 10:40:03': 1},1,0
275,Wichita KS,DefaultDept,(PL)Painting Ops-Bldg 14 North EU-NEWAEROPB3,CA 8800/I2014-CA 8800Z Activator - 8800CT3 THINNER,3/4/2019 15:51,3/4/2019 15:51,0.066406,gal,7/5/2019 13:44,adminbomgb,1,1,1,0,{'2019-07-05 13:44:50': 1},1,0
276,Wichita KS,DefaultDept,(PL)Painting Ops-Bldg 14 North EU-NEWAEROPB3,CA 8800/I2014-CA 8800Z Activator - 8800CT3 THINNER,4/4/2019 11:21,4/4/2019 11:21,0.10546875,gal,4/4/2019 11:21,jcameron,1,1,1,0,{'2019-04-04 11:21:16': 1},1,0
277,Wichita KS,DefaultDept,(PL)Painting Ops-Bldg 14 North EU-NEWAEROPB3,CA 8800/I2706 - CA 8800Z Activator - CA 8800CT2&CA1800CX THINNER Blend,1/28/2019 17:08,1/28/2019 17:08,1.125,gal,1/28/2019 17:08,adminbommg,1,1,1,0,{'2019-01-28 17:08:55': 1},1,0
278,Wichita KS,DefaultDept,(PL)Painting Ops-Bldg 14 North EU-NEWAEROPB3,CA 8800/I2706 - CA 8800Z Activator - CA 8800CT2&CA1800CX THINNER Blend,4/4/2019 11:29,4/4/2019 11:29,4.5,gal,4/4/2019 11:29,jcameron,1,1,1,0,{'2019-04-04 11:29:56': 1},1,0
279,Wichita KS,DefaultDept,(PL)Painting Ops-Bldg 14 North EU-NEWAEROPB3,CA 8800/I6032 Base - CA 8800Z Activator - CA 8800CT3 Thinner with Kicker,5/29/2019 16:19,5/29/2019 16:19,1.125,gal,5/29/2019 16:19,jcameron,1,1,1,0,{'2019-05-29 16:19:36': 1},1,0
280,Wichita KS,DefaultDept,(PL)Painting Ops-Bldg 14 North EU-NEWAEROPB3,CA 8800/I6691 Base - CA 8800Z Activator - CA 8800CT4/CA1800CX Thinner Blend,1/28/2019 16:40,1/28/2019 16:40,0.140625,gal,1/28/2019 16:40,adminbommg,1,1,1,0,{'2019-01-28 16:40:36': 1},1,0
281,Wichita KS,DefaultDept,(PL)Painting Ops-Bldg 14 North EU-NEWAEROPB3,CA 8800/IM908 - CA 8800Z Activator - 8800CT3 THINNER 2:1:.5,11/5/2019 13:40,11/5/2019 13:40,0.875,gal,1/22/2020 14:41,Kamiander,1,1,1,0,{'2020-01-22 14:41:49': 1},1,0
282,Wichita KS,DefaultDept,(PL)Painting Ops-Bldg 14 North EU-NEWAEROPB3,CA8800 I3220 Base - CA8800Z Activator - CA88CT Reducer,5/29/2019 16:22,5/29/2019 16:22,1.125,gal,5/29/2019 16:22,jcameron,1,1,1,0,{'2019-05-29 16:22:55': 1},1,0
283,Wichita KS,DefaultDept,(PL)Painting Ops-Bldg 14 North EU-NEWAEROPB3,IM0299  2 gal - 8800Z ACTIVATOR 1 gal - 8000F 1 gal - 8800F4 THINNER .25 gal,1/18/2019 12:08,1/18/2019 12:08,2.72,gal,1/29/2019 10:37,adminbommg,1,1,1,0,{'2019-01-29 10:37:24': 1},1,0
284,Wichita KS,DefaultDept,(PL)Painting Ops-Bldg 14 North EU-NEWAEROPB3,IM0750 BASE COMPONENT  12 oz;  8800Z ACTIVATOR  6 oz;  8000CT3 THINNER  6 oz,7/31/2019 11:56,7/31/2019 11:56,0.1875,gal,7/31/2019 11:56,jcameron,1,1,1,0,{'2019-07-31 11:56:10': 1},1,0
285,Wichita KS,DefaultDept,(PL)Painting Ops-Bldg 14 North EU-NEWAEROPB3,IM0911 BASE COMPONENT 12 oz;  8800Z ACTIVATOR 6 oz;  8000CT3 THINNER  6 oz,7/31/2019 12:01,7/31/2019 12:01,0.1875,gal,7/31/2019 12:01,jcameron,1,1,1,0,{'2019-07-31 12:01:08': 1},1,0
286,Wichita KS,DefaultDept,(PL)Painting Ops-Bldg 14 North EU-NEWAEROPB3,IM6076  2 qrt - 8800Z ACTIVATOR 1 qrt - 8800CT3 THINNER 1 qrt - CA1800CX THINNER  .25 qrt,1/18/2019 11:57,1/18/2019 11:57,2.18,gal,1/18/2019 11:57,jcameron,1,1,1,0,{'2019-01-18 11:57:39': 1},1,0
287,Wichita KS,DefaultDept,(PL)Painting Ops-Bldg 14 North EU-NEWAEROPB3,IM6076  2 qrt - 8800Z ACTIVATOR 1 qrt - 8800CT3 THINNER 1 qrt - CA1800CX THINNER  .25 qrt,1/18/2019 13:16,1/18/2019 13:16,0.140625,gal,1/29/2019 10:38,adminbommg,1,1,1,0,{'2019-01-29 10:38:47': 1},1,0
288,Wichita KS,DefaultDept,(PL)Painting Ops-Bldg 14 North EU-NEWAEROPB3,IM747 BASE COMPONENT  12 oz;  8800Z ACTIVATOR  6 oz;  8800CT3 THINNER  6 oz,7/31/2019 11:49,7/31/2019 11:49,0.1875,gal,7/31/2019 11:49,jcameron,1,1,1,0,{'2019-07-31 11:49:52': 1},1,0
289,Wichita KS,DefaultDept,(PL)Painting Ops-Bldg 14 North EU-NEWAEROPB3,IM9092 - 8800Z - 8800CT3 - 2:1:1,11/5/2019 13:36,11/5/2019 13:36,1,gal,1/24/2020 17:00,adminbomry,1,1,1,0,{'2020-01-24 17:00:29': 1},1,0
290,Wichita KS,DefaultDept,(PL)Painting Ops-Bldg 14 North EU-NEWAEROPB3,Im255 - 8800z - 8800ct -1800cx (2:1:1:.5),6/8/2020 0:00,6/8/2020 0:00,9,gal,7/20/2020 10:39,Kamiander,1,1,1,0,{'2020-07-20 10:39:22': 1},1,0
291,Wichita KS,DefaultDept,(PL)Painting Ops-Bldg 14 North EU-NEWAEROPB3,Im906 - 8800z - 8800ct - 1800cx (2:1:1:.5),6/5/2020 0:00,6/5/2020 0:00,9,gal,7/20/2020 10:34,Kamiander,1,1,1,0,{'2020-07-20 10:34:32': 1},1,0
292,Wichita KS,DefaultDept,(PL)Painting Ops-Bldg 14 North EU-NEWAEROPB3,PG-6-BK9-PH-19- SC-10 BLEND (2:1:1),11/26/2019 14:31,11/26/2019 14:31,0.03125,gal,1/24/2020 16:58,adminbomry,1,1,1,0,{'2020-01-24 16:58:26': 1},1,0
293,Wichita KS,DefaultDept,(PL)Painting Ops-Bldg 14 North EU-NEWAEROPB3,PG-6-MC26-PH-19- SC-10 BLEND (2:1:1),11/25/2019 14:25,11/25/2019 14:25,1,gal,1/22/2020 15:26,Kamiander,1,1,1,0,{'2020-01-22 15:26:00': 1},1,0
294,Wichita KS,DefaultDept,(PL)Painting Ops-Bldg 14 North EU-NEWAEROPB3,PG-6-W207-PH-19- SC-10 BLEND (2:1:1),11/20/2019 14:11,11/20/2019 14:11,12,gal,1/22/2020 15:12,Kamiander,1,1,1,0,{'2020-01-22 15:12:16': 1},1,0
295,Wichita KS,DefaultDept,(PL)Painting Ops-Bldg 14 North EU-NEWAEROPB3,PG-6-W207-PH-19- SC-10 BLEND (2:1:1),11/20/2019 14:21,11/20/2019 14:21,1,gal,1/22/2020 15:21,Kamiander,1,1,1,0,{'2020-01-22 15:21:49': 1},1,0
296,Wichita KS,DefaultDept,(PL)Painting Ops-Bldg 14 North EU-NEWAEROPB3,PG-6-W207-PH-19- SC-10 BLEND (2:1:1),1/12/2020 9:00,1/12/2020 9:00,16,gal,5/22/2020 11:16,adminbomjs,1,1,1,0,{'2020-05-22 11:16:31': 1},1,0
297,Wichita KS,DefaultDept,(PL)Painting Ops-Bldg 14 North EU-NEWAEROPB3,PG-6-W207-PH-19- SC-10 BLEND (2:1:1),2/8/2020 11:10,2/8/2020 11:10,12,gal,5/7/2020 11:15,adminbomry,1,1,1,0,{'2020-05-07 11:15:10': 1},1,0
298,Wichita KS,DefaultDept,(PL)Painting Ops-Bldg 14 North EU-NEWAEROPB3,i2029 2 qrt - 8800Z ACTIVATOR 1 qrt - 8800CT3 THINNER 1 qrt - 1800CX THINNER  .5 qrt,7/9/2019 15:17,7/9/2019 15:17,1.125,gal,7/9/2019 15:17,jcameron,1,1,1,0,{'2019-07-09 15:17:28': 1},1,0
299,Wichita KS,DefaultDept,(PL)Painting Ops-Bldg 14 North EU-NEWAEROPB3,i6033 2 qrt - 8800Z ACTIVATOR 1 qrt - 8800CT3 THINNER 1 qrt - 1800CX THINNER  .5 qrt,7/9/2019 15:06,7/9/2019 15:06,1.125,gal,7/9/2019 15:06,jcameron,1,1,1,0,{'2019-07-09 15:06:30': 1},1,0
300,Wichita KS,DefaultDept,(PL)Painting Ops-Bldg 14 South EU-NEWAEROPB4,8800 B00701- CA 8800Z Activator- 8800CT2 THINNER,11/10/2019 14:08,11/10/2019 14:08,0.5,gal,1/23/2020 15:08,Kamiander,1,1,1,0,{'2020-01-23 15:08:50': 1},1,0
301,Wichita KS,DefaultDept,(PL)Painting Ops-Bldg 14 South EU-NEWAEROPB4,8800 I1050 - CA 8800Z Activator- 8800CT THINNER,11/19/2019 14:15,11/19/2019 14:15,1,gal,1/23/2020 15:16,Kamiander,1,1,1,0,{'2020-01-23 15:16:38': 1},1,0
302,Wichita KS,DefaultDept,(PL)Painting Ops-Bldg 14 South EU-NEWAEROPB4,8800 I1050 - CA 8800Z Activator- 8800CT THINNER,6/3/2020 0:00,6/3/2020 0:00,0.5,gal,7/20/2020 10:42,Kamiander,1,1,1,0,{'2020-07-20 10:42:26': 1},1,0
303,Wichita KS,DefaultDept,(PL)Painting Ops-Bldg 14 South EU-NEWAEROPB4,8800 I1050 - CA 8800Z Activator- 8800CT THINNER,6/9/2020 0:00,6/9/2020 0:00,0.5,gal,7/20/2020 10:54,Kamiander,1,1,1,0,{'2020-07-20 10:54:08': 1},1,0
304,Wichita KS,DefaultDept,(PL)Painting Ops-Bldg 14 South EU-NEWAEROPB4,8800 I1050 - CA 8800Z Activator- 8800CT THINNER,9/25/2020 14:00,9/25/2020 14:00,0.75,gal,10/27/2020 15:40,dlyon,1,1,1,0,{'2020-10-27 15:40:59': 1},1,0
305,Wichita KS,DefaultDept,(PL)Painting Ops-Bldg 14 South EU-NEWAEROPB4,8800 I1050 - CA 8800Z Activator- 8800CT2 THINNER,11/13/2019 14:21,11/13/2019 14:21,1,gal,1/23/2020 15:22,Kamiander,1,1,1,0,{'2020-01-23 15:22:20': 1},1,0
306,Wichita KS,DefaultDept,(PL)Painting Ops-Bldg 14 South EU-NEWAEROPB4,8800 I1050 - CA 8800Z Activator- 8800CT2 THINNER,11/14/2019 14:13,11/14/2019 14:13,0.5,gal,1/23/2020 15:14,Kamiander,1,1,1,0,{'2020-01-23 15:14:01': 1},1,0
307,Wichita KS,DefaultDept,(PL)Painting Ops-Bldg 14 South EU-NEWAEROPB4,8800 I1050 - CA 8800Z Activator- 8800CT2 THINNER,8/6/2020 0:00,8/6/2020 0:00,0.25,gal,10/12/2020 12:17,Kamiander,1,1,1,0,{'2020-10-12 12:17:27': 1},1,0
308,Wichita KS,DefaultDept,(PL)Painting Ops-Bldg 14 South EU-NEWAEROPB4,BLEND: B900 - 8800Z - 8800F - 8800F4 (2-1-1-0.5),8/1/2019 6:00,8/1/2019 6:00,16.5,gal,9/20/2019 15:54,adminbomgb,1,1,1,0,{'2019-09-20 15:54:25': 1},1,0
309,Wichita KS,DefaultDept,(PL)Painting Ops-Bldg 14 South EU-NEWAEROPB4,BLEND: B900 - 8800Z - 8800F - 8800F4 (2-1-1-0.5),8/3/2019 7:00,8/3/2019 7:00,1,gal,9/20/2019 16:01,adminbomgb,1,1,1,0,{'2019-09-20 16:01:31': 1},1,0
310,Wichita KS,DefaultDept,(PL)Painting Ops-Bldg 14 South EU-NEWAEROPB4,Blend: 1025 - 8800Z - 8800CT (2:1:1),10/1/2019 12:00,10/1/2019 12:00,24,gal,12/19/2019 16:04,adminbomry,1,1,1,0,{'2019-12-19 16:04:12': 1},1,0
311,Wichita KS,DefaultDept,(PL)Painting Ops-Bldg 14 South EU-NEWAEROPB4,Blend: 1025 - 8800Z - 8800CT (2:1:1),10/7/2019 12:00,10/7/2019 12:00,4,gal,12/19/2019 16:04,adminbomry,1,1,1,0,{'2019-12-19 16:04:12': 1},1,0
312,Wichita KS,DefaultDept,(PL)Painting Ops-Bldg 14 South EU-NEWAEROPB4,Blend: 1050 - 8800Z - 8800CT2 (2:1:1),10/15/2019 12:00,10/15/2019 12:00,0.25,gal,12/19/2019 16:04,adminbomry,1,1,1,0,{'2019-12-19 16:04:12': 1},1,0
313,Wichita KS,DefaultDept,(PL)Painting Ops-Bldg 14 South EU-NEWAEROPB4,Blend: 1050 - 8800Z - 8800CT2 (2:1:1),2/24/2020 12:00,2/24/2020 12:00,1,gal,8/26/2020 14:06,adminbomjs,1,1,1,0,{'2020-08-26 14:06:50': 1},1,0
314,Wichita KS,DefaultDept,(PL)Painting Ops-Bldg 14 South EU-NEWAEROPB4,Blend: 1050 - 8800Z - 8800CT2 (2:1:1),3/19/2020 10:53,3/19/2020 10:53,3,gal,5/14/2020 10:53,adminbomry,1,1,1,0,{'2020-05-14 10:53:17': 1},1,0
315,Wichita KS,DefaultDept,(PL)Painting Ops-Bldg 14 South EU-NEWAEROPB4,Blend: 1050 - 8800Z - 8800CT2 (2:1:1),9/16/2020 14:50,9/16/2020 14:50,0.75,gal,10/28/2020 16:33,dlyon,1,1,1,0,{'2020-10-28 16:33:13': 1},1,0
316,Wichita KS,DefaultDept,(PL)Painting Ops-Bldg 14 South EU-NEWAEROPB4,Blend: 1050 - 8800Z - 8800CT2 (2:1:1),11/20/2020 13:00,11/20/2020 13:00,1.5,gal,12/21/2020 12:13,dlyon,1,1,1,0,{'2020-12-21 12:13:05': 1},1,0
317,Wichita KS,DefaultDept,(PL)Painting Ops-Bldg 14 South EU-NEWAEROPB4,Blend: 1050 - 8800Z - CT-1 (2:1:1),3/17/2020 0:55,3/17/2020 0:55,3,gal,8/19/2020 0:54,userbomry,1,1,1,0,{'2020-08-19 00:54:48': 1},1,0
318,Wichita KS,DefaultDept,(PL)Painting Ops-Bldg 14 South EU-NEWAEROPB4,Blend: 1050 - 8800Z - CT-1 (2:1:1),5/5/2020 0:00,5/5/2020 0:00,12,gal,6/19/2020 16:53,Kamiander,1,1,1,0,{'2020-06-19 16:53:08': 1},1,0
319,Wichita KS,DefaultDept,(PL)Painting Ops-Bldg 14 South EU-NEWAEROPB4,Blend: 1050 - 8800Z - CT-1 (2:1:1),5/11/2020 0:00,5/11/2020 0:00,27,gal,6/19/2020 16:56,Kamiander,1,1,1,0,{'2020-06-19 16:56:03': 1},1,0
320,Wichita KS,DefaultDept,(PL)Painting Ops-Bldg 14 South EU-NEWAEROPB4,Blend: 1050 - 8800Z - CT-1 (2:1:1),5/14/2020 0:00,5/14/2020 0:00,27,gal,6/19/2020 16:58,Kamiander,1,1,1,0,{'2020-06-19 16:58:03': 1},1,0
321,Wichita KS,DefaultDept,(PL)Painting Ops-Bldg 14 South EU-NEWAEROPB4,Blend: 1050 - 8800Z - CT-1 (2:1:1),6/9/2020 0:00,6/9/2020 0:00,1,gal,7/28/2020 14:43,Kamiander,1,1,1,0,{'2020-07-28 14:43:51': 1},1,0
322,Wichita KS,DefaultDept,(PL)Painting Ops-Bldg 14 South EU-NEWAEROPB4,Blend: 1050 - 8800Z - CT-1 (2:1:1),6/10/2020 0:00,6/10/2020 0:00,1,gal,7/28/2020 14:45,Kamiander,1,1,1,0,{'2020-07-28 14:45:20': 1},1,0
323,Wichita KS,DefaultDept,(PL)Painting Ops-Bldg 14 South EU-NEWAEROPB4,Blend: 1050 - 8800Z - CT-1 (2:1:1),6/11/2020 0:00,6/11/2020 0:00,0.5,gal,7/28/2020 14:47,Kamiander,1,1,1,0,{'2020-07-28 14:47:07': 1},1,0
324,Wichita KS,DefaultDept,(PL)Painting Ops-Bldg 14 South EU-NEWAEROPB4,Blend: 1050 - 8800Z - CT-1 (2:1:1),7/21/2020 0:00,7/21/2020 0:00,8.5,gal,8/26/2020 16:53,Kamiander,1,1,1,0,{'2020-08-26 16:53:57': 1},1,0
325,Wichita KS,DefaultDept,(PL)Painting Ops-Bldg 14 South EU-NEWAEROPB4,Blend: 1050 - 8800Z - CT-1 (2:1:1),8/24/2020 11:00,8/24/2020 11:00,2,gal,12/30/2020 15:02,dlyon,1,1,1,0,{'2020-12-30 15:02:06': 1},1,0
326,Wichita KS,DefaultDept,(PL)Painting Ops-Bldg 14 South EU-NEWAEROPB4,Blend: 2014 - 8800Z - 8800CT (2:1:1),7/26/2019 9:09,7/26/2019 9:09,0.25,gal,7/26/2019 9:09,adminbomgb,1,1,1,0,{'2019-07-26 09:09:12': 1},1,0
327,Wichita KS,DefaultDept,(PL)Painting Ops-Bldg 14 South EU-NEWAEROPB4,Blend: 4275 - 8800Z - 8800CT (2:1:1),7/26/2019 9:11,7/26/2019 9:11,0.5,gal,7/26/2019 9:11,adminbomgb,1,1,1,0,{'2019-07-26 09:11:09': 1},1,0
328,Wichita KS,DefaultDept,(PL)Painting Ops-Bldg 14 South EU-NEWAEROPB4,Blend: 6136 - 8800Z - 8800CT (2:1:1),7/26/2019 9:05,7/26/2019 9:05,0.5,gal,7/26/2019 9:05,adminbomgb,1,1,1,0,{'2019-07-26 09:05:37': 1},1,0
329,Wichita KS,DefaultDept,(PL)Painting Ops-Bldg 14 South EU-NEWAEROPB4,Blend: 8800 i3195 - 8800Z - 8800CT1 (2:1:1),2/18/2020 14:00,2/18/2020 14:00,0.5,gal,8/26/2020 13:48,adminbomjs,1,1,1,0,{'2020-08-26 13:48:05': 1},1,0
330,Wichita KS,DefaultDept,(PL)Painting Ops-Bldg 14 South EU-NEWAEROPB4,Blend: 8800/1050 - 8800Z - 8800CT - 8800CTR (2:1:1:.5),8/29/2020 0:00,8/29/2020 0:00,12.25,gal,10/12/2020 12:31,Kamiander,1,1,1,0,{'2020-10-12 12:31:59': 1},1,0
331,Wichita KS,DefaultDept,(PL)Painting Ops-Bldg 14 South EU-NEWAEROPB4,Blend: A00244 - CM0840081 - CM0830H18,3/10/2020 12:30,3/10/2020 12:30,1,gal,8/26/2020 15:00,adminbomjs,1,1,1,0,{'2020-08-26 15:00:45': 1},1,0
332,Wichita KS,DefaultDept,(PL)Painting Ops-Bldg 14 South EU-NEWAEROPB4,Blend: A0747210J9458 - CM0830H18 - CM0830081 (3:1:0.5),11/9/2019 0:00,11/9/2019 0:00,0.5,gal,1/27/2020 17:13,adminbomry,1,1,1,0,{'2020-01-27 17:13:22': 1},1,0
333,Wichita KS,DefaultDept,(PL)Painting Ops-Bldg 14 South EU-NEWAEROPB4,Blend: B900 - 8800Z - 8800F (2:1:1),7/19/2019 9:00,7/19/2019 9:00,16,gal,8/21/2019 16:47,adminbomgb,1,1,1,0,{'2019-08-21 16:47:12': 1},1,0
334,Wichita KS,DefaultDept,(PL)Painting Ops-Bldg 14 South EU-NEWAEROPB4,Blend: B900 - 8800Z - 8800F (2:1:1),7/26/2019 8:46,7/26/2019 8:46,1,gal,7/26/2019 8:46,adminbomgb,1,1,1,0,{'2019-07-26 08:46:58': 1},1,0
335,Wichita KS,DefaultDept,(PL)Painting Ops-Bldg 14 South EU-NEWAEROPB4,Blend: B900 - 8800Z - 8800F (2:1:1),7/26/2019 9:07,7/26/2019 9:07,0.5,gal,7/26/2019 9:07,adminbomgb,1,1,1,0,{'2019-07-26 09:07:33': 1},1,0
336,Wichita KS,DefaultDept,(PL)Painting Ops-Bldg 14 South EU-NEWAEROPB4,Blend: B900 - 8800Z - 8800F (2:1:1),8/19/2019 6:00,8/19/2019 6:00,5,gal,9/20/2019 16:05,adminbomgb,1,1,1,0,{'2019-09-20 16:05:16': 1},1,0
337,Wichita KS,DefaultDept,(PL)Painting Ops-Bldg 14 South EU-NEWAEROPB4,Blend: B900 - 8800Z - 8800F (2:1:1),10/5/2019 12:00,10/5/2019 12:00,1,gal,12/19/2019 16:04,adminbomry,1,1,1,0,{'2019-12-19 16:04:12': 1},1,0
338,Wichita KS,DefaultDept,(PL)Painting Ops-Bldg 14 South EU-NEWAEROPB4,Blend: B900 - 8800Z - 8800F (2:1:1),10/6/2019 12:00,10/6/2019 12:00,1,gal,12/19/2019 16:04,adminbomry,1,1,1,0,{'2019-12-19 16:04:12': 1},1,0
339,Wichita KS,DefaultDept,(PL)Painting Ops-Bldg 14 South EU-NEWAEROPB4,Blend: B900 - 8800Z - 8800F (2:1:1),10/21/2019 12:00,10/21/2019 12:00,0.5,gal,12/19/2019 16:04,adminbomry,1,1,1,0,{'2019-12-19 16:04:12': 1},1,0
340,Wichita KS,DefaultDept,(PL)Painting Ops-Bldg 14 South EU-NEWAEROPB4,Blend: B900 - 8800Z - 8800F (2:1:1),10/31/2019 12:00,10/31/2019 12:00,5,gal,12/19/2019 16:04,adminbomry,1,1,1,0,{'2019-12-19 16:04:12': 1},1,0
341,Wichita KS,DefaultDept,(PL)Painting Ops-Bldg 14 South EU-NEWAEROPB4,Blend: B900 - 8800Z - 8800F (2:1:1),11/9/2019 14:04,11/9/2019 14:04,0.5,gal,1/27/2020 16:40,adminbomry,1,1,1,0,{'2020-01-27 16:40:35': 1},1,0
342,Wichita KS,DefaultDept,(PL)Painting Ops-Bldg 14 South EU-NEWAEROPB4,Blend: B900 - 8800Z - 8800F (2:1:1),11/10/2019 14:11,11/10/2019 14:11,0.5,gal,1/27/2020 16:42,adminbomry,1,1,1,0,{'2020-01-27 16:42:05': 1},1,0
343,Wichita KS,DefaultDept,(PL)Painting Ops-Bldg 14 South EU-NEWAEROPB4,Blend: B900 - 8800Z - 8800F (2:1:1),2/6/2020 17:34,2/6/2020 17:34,4,gal,5/7/2020 17:34,adminbomry,1,1,1,0,{'2020-05-07 17:34:40': 1},1,0
344,Wichita KS,DefaultDept,(PL)Painting Ops-Bldg 14 South EU-NEWAEROPB4,Blend: B900 - 8800Z - 8800F (2:1:1),3/10/2020 1:17,3/10/2020 1:17,1,gal,8/19/2020 1:18,userbomry,1,1,1,0,{'2020-08-19 01:18:03': 1},1,0
345,Wichita KS,DefaultDept,(PL)Painting Ops-Bldg 14 South EU-NEWAEROPB4,Blend: B900 - 8800Z - 8800F (2:1:1),5/31/2020 0:00,5/31/2020 0:00,0.375,gal,6/19/2020 17:08,Kamiander,1,1,1,0,{'2020-06-19 17:08:28': 1},1,0
346,Wichita KS,DefaultDept,(PL)Painting Ops-Bldg 14 South EU-NEWAEROPB4,Blend: B900 - 8800Z - 8800F (2:1:1),6/11/2020 0:00,6/11/2020 0:00,3,gal,7/28/2020 14:51,Kamiander,1,1,1,0,{'2020-07-28 14:51:41': 1},1,0
347,Wichita KS,DefaultDept,(PL)Painting Ops-Bldg 14 South EU-NEWAEROPB4,Blend: B900 - 8800Z - 8800F (2:1:1),8/6/2020 0:00,8/6/2020 0:00,1,gal,10/12/2020 12:14,Kamiander,1,1,1,0,{'2020-10-12 12:14:06': 1},1,0
348,Wichita KS,DefaultDept,(PL)Painting Ops-Bldg 14 South EU-NEWAEROPB4,Blend: B900 - 8800Z - 8800F (2:1:1),8/12/2020 0:00,8/12/2020 0:00,0.25,gal,10/12/2020 12:20,Kamiander,1,1,1,0,{'2020-10-12 12:20:23': 1},1,0
349,Wichita KS,DefaultDept,(PL)Painting Ops-Bldg 14 South EU-NEWAEROPB4,Blend: B900 - 8800Z - 8800F (2:1:1),9/4/2020 12:00,9/4/2020 12:00,0.5,gal,12/30/2020 15:17,dlyon,1,1,1,0,{'2020-12-30 15:17:54': 1},1,0
350,Wichita KS,DefaultDept,(PL)Painting Ops-Bldg 14 South EU-NEWAEROPB4,Blend: B900 - 8800Z - 8800F (2:1:1),9/10/2020 12:00,9/10/2020 12:00,0.75,gal,10/28/2020 10:22,dlyon,1,1,1,0,{'2020-10-28 10:22:26': 1},1,0
351,Wichita KS,DefaultDept,(PL)Painting Ops-Bldg 14 South EU-NEWAEROPB4,Blend: B900 - 8800Z - 8800F (2:1:1),9/11/2020 13:30,9/11/2020 13:30,0.5,gal,10/28/2020 16:22,dlyon,1,1,1,0,{'2020-10-28 16:22:33': 1},1,0
352,Wichita KS,DefaultDept,(PL)Painting Ops-Bldg 14 South EU-NEWAEROPB4,Blend: B900 - 8800Z - 8800F (2:1:1),10/19/2020 12:00,10/19/2020 12:00,3,gal,12/21/2020 10:43,dlyon,1,1,1,0,{'2020-12-21 10:43:34': 1},1,0
353,Wichita KS,DefaultDept,(PL)Painting Ops-Bldg 14 South EU-NEWAEROPB4,Blend: CA 8000/IM608 Base - CA8800Z Activator - CA8800CT3 Thinner - (2:1:1),8/5/2020 7:00,8/5/2020 7:00,0.5,gal,11/4/2020 10:48,dlyon,1,1,1,0,{'2020-11-04 10:48:51': 1},1,0
354,Wichita KS,DefaultDept,(PL)Painting Ops-Bldg 14 South EU-NEWAEROPB4,Blend: CA 8000/IM612 Base - CA8800Z Activator - CA8800CT3 Thinner - (2:1:1),8/6/2020 7:00,8/6/2020 7:00,1,gal,11/4/2020 11:15,dlyon,1,1,1,0,{'2020-11-04 11:15:55': 1},1,0
355,Wichita KS,DefaultDept,(PL)Painting Ops-Bldg 14 South EU-NEWAEROPB4,Blend: CA 8800 I1008 - 8800Z - 8800CT (2:1:1),7/23/2020 0:00,7/23/2020 0:00,1,gal,8/27/2020 9:14,Kamiander,1,1,1,0,{'2020-08-27 09:14:13': 1},1,0
356,Wichita KS,DefaultDept,(PL)Painting Ops-Bldg 14 South EU-NEWAEROPB4,Blend: CA 8800 I1008 - 8800Z - 8800CT (2:1:1),7/24/2020 0:00,7/24/2020 0:00,0.5,gal,8/27/2020 9:15,Kamiander,1,1,1,0,{'2020-08-27 09:15:49': 1},1,0
357,Wichita KS,DefaultDept,(PL)Painting Ops-Bldg 14 South EU-NEWAEROPB4,Blend: CA 8800 I1008 - 8800Z - 8800CT (2:1:1),7/27/2020 0:00,7/27/2020 0:00,1,gal,8/27/2020 9:18,Kamiander,1,1,1,0,{'2020-08-27 09:18:19': 1},1,0
358,Wichita KS,DefaultDept,(PL)Painting Ops-Bldg 14 South EU-NEWAEROPB4,Blend: CA 8800 I1008 - 8800Z - 8800CT (2:1:1),8/4/2020 9:00,8/4/2020 9:00,1,gal,12/30/2020 14:31,dlyon,1,1,1,0,{'2020-12-30 14:31:55': 1},1,0
359,Wichita KS,DefaultDept,(PL)Painting Ops-Bldg 14 South EU-NEWAEROPB4,Blend: CA 8800 I1008 - 8800Z - 8800CT (2:1:1),8/6/2020 13:30,8/6/2020 13:30,0.5,gal,12/30/2020 14:33,dlyon,1,1,1,0,{'2020-12-30 14:33:54': 1},1,0
360,Wichita KS,DefaultDept,(PL)Painting Ops-Bldg 14 South EU-NEWAEROPB4,Blend: CA 8800 I1008 - 8800Z - 8800CT (2:1:1),10/15/2020 11:30,10/15/2020 11:30,1,gal,12/21/2020 11:13,dlyon,1,1,1,0,{'2020-12-21 11:13:33': 1},1,0
361,Wichita KS,DefaultDept,(PL)Painting Ops-Bldg 14 South EU-NEWAEROPB4,Blend: CA 8800 I1008 - 8800Z - 8800CT (2:1:1),11/2/2020 13:00,11/2/2020 13:00,2.25,gal,12/21/2020 11:51,dlyon,1,1,1,0,{'2020-12-21 11:51:31': 1},1,0
362,Wichita KS,DefaultDept,(PL)Painting Ops-Bldg 14 South EU-NEWAEROPB4,Blend: CA 8800 IM902 - CA8800Z - CA8800CT3 - (2:1:1),9/11/2020 12:30,9/11/2020 12:30,0.5,gal,12/30/2020 15:34,dlyon,1,1,1,0,{'2020-12-30 15:34:49': 1},1,0
363,Wichita KS,DefaultDept,(PL)Painting Ops-Bldg 14 South EU-NEWAEROPB4,Blend: CA 8800 P186C - CA8800Z - CA8800CT3 - (2:1:1),10/19/2020 10:45,10/19/2020 10:45,1,gal,12/21/2020 10:41,dlyon,1,1,1,0,{'2020-12-21 10:41:37': 1},1,0
364,Wichita KS,DefaultDept,(PL)Painting Ops-Bldg 14 South EU-NEWAEROPB4,Blend: CA 8800/I1050 - 8800Z - 8800CT2 (2:1:1),12/3/2020 8:00,12/3/2020 8:00,0.1875,gal,1/6/2021 12:15,dlyon,1,1,1,0,{'2021-01-06 12:15:40': 1},1,0
365,Wichita KS,DefaultDept,(PL)Painting Ops-Bldg 14 South EU-NEWAEROPB4,Blend: CA 8800/I1050 - 8800Z - 8800CT2 (2:1:1),12/15/2020 10:05,12/15/2020 10:05,0.09375,gal,1/6/2021 12:45,dlyon,1,1,1,0,{'2021-01-06 12:45:39': 1},1,0
366,Wichita KS,DefaultDept,(PL)Painting Ops-Bldg 14 South EU-NEWAEROPB4,Blend: CA8000/IN902 - 8800Z - 8800CT3 (2:1:1),8/5/2020 0:00,8/5/2020 0:00,0.75,gal,10/12/2020 12:15,Kamiander,1,1,1,0,{'2020-10-12 12:15:10': 1},1,0
367,Wichita KS,DefaultDept,(PL)Painting Ops-Bldg 14 South EU-NEWAEROPB4,Blend: CA8800 I1008 - CA8800CT - 1800CX - (2:1:1.5),8/11/2020 7:15,8/11/2020 7:15,0.25,gal,12/30/2020 14:51,dlyon,1,1,1,0,{'2020-12-30 14:51:36': 1},1,0
368,Wichita KS,DefaultDept,(PL)Painting Ops-Bldg 14 South EU-NEWAEROPB4,Blend: CA8800 I1008 - CA8800CT - 1800CX - (2:1:1.5),8/13/2020 12:05,8/13/2020 12:05,0.25,gal,12/30/2020 14:54,dlyon,1,1,1,0,{'2020-12-30 14:54:30': 1},1,0
369,Wichita KS,DefaultDept,(PL)Painting Ops-Bldg 14 South EU-NEWAEROPB4,Blend: CA8800 I1008 - CA8800Z -  CA8800CT2 - (2:1:1),11/4/2020 13:30,11/4/2020 13:30,2.25,gal,12/21/2020 12:03,dlyon,1,1,1,0,{'2020-12-21 12:03:26': 1},1,0
370,Wichita KS,DefaultDept,(PL)Painting Ops-Bldg 14 South EU-NEWAEROPB4,Blend: CA8800 I1008 - CA8800Z -  CA8800CT2 - (2:1:1),11/19/2020 13:00,11/19/2020 13:00,0.75,gal,12/21/2020 12:11,dlyon,1,1,1,0,{'2020-12-21 12:11:16': 1},1,0
371,Wichita KS,DefaultDept,(PL)Painting Ops-Bldg 14 South EU-NEWAEROPB4,Blend: CA8800 I1008 - CA8800Z -  CA8800CT2 - (2:1:1),12/17/2020 12:45,12/17/2020 12:45,1.5,gal,1/6/2021 12:50,dlyon,1,1,1,0,{'2021-01-06 12:50:20': 1},1,0
372,Wichita KS,DefaultDept,(PL)Painting Ops-Bldg 14 South EU-NEWAEROPB4,Blend: CA8800 I1008 - CA8800Z -  CA8800CT2 - (2:1:1),12/21/2020 9:00,12/21/2020 9:00,0.5,gal,1/6/2021 12:42,dlyon,1,1,1,0,{'2021-01-06 12:42:21': 1},1,0
373,Wichita KS,DefaultDept,(PL)Painting Ops-Bldg 14 South EU-NEWAEROPB4,Blend: CA8800 I3018 - CA8800Z - CA8800CT2 - (2:1:1),9/4/2020 7:00,9/4/2020 7:00,0.5,gal,12/30/2020 15:14,dlyon,1,1,1,0,{'2020-12-30 15:14:58': 1},1,0
374,Wichita KS,DefaultDept,(PL)Painting Ops-Bldg 14 South EU-NEWAEROPB4,Blend: CA8800/B701 Base - CA8800Z Activator - CA8800CT2 Thinner - (2:1:1),9/4/2020 7:00,9/4/2020 7:00,0.25,gal,10/28/2020 16:18,dlyon,1,1,1,0,{'2020-10-28 16:18:58': 1},1,0
375,Wichita KS,DefaultDept,(PL)Painting Ops-Bldg 14 South EU-NEWAEROPB4,Blend: CA8800/B701 Base - CA8800Z Activator - CA8800CT2 Thinner - (2:1:1),9/11/2020 6:00,9/11/2020 6:00,0.5,gal,10/28/2020 16:15,dlyon,1,1,1,0,{'2020-10-28 16:15:22': 1},1,0
376,Wichita KS,DefaultDept,(PL)Painting Ops-Bldg 14 South EU-NEWAEROPB4,Blend: CA8800/I1050 - CA8800Z - CA8800CT3 (2-1-1),11/15/2019 13:00,11/15/2019 13:00,0.5,gal,1/27/2020 9:00,Kamiander,1,1,1,0,{'2020-01-27 09:00:27': 1},1,0
377,Wichita KS,DefaultDept,(PL)Painting Ops-Bldg 14 South EU-NEWAEROPB4,Blend: CA8800/I1050 - CA8800Z - CA8800CT3 (2-1-1),11/21/2019 11:00,11/21/2019 11:00,0.5,gal,1/27/2020 9:02,Kamiander,1,1,1,0,{'2020-01-27 09:02:27': 1},1,0
378,Wichita KS,DefaultDept,(PL)Painting Ops-Bldg 14 South EU-NEWAEROPB4,Blend: CA8800/I1050 - CA8800Z - CA8800CT3 (2-1-1),2/19/2020 17:37,2/19/2020 17:37,0.25,gal,5/7/2020 17:39,adminbomry,1,1,1,0,{'2020-05-07 17:39:27': 1},1,0
379,Wichita KS,DefaultDept,(PL)Painting Ops-Bldg 14 South EU-NEWAEROPB4,Blend: CA8800/I1050 - CA8800Z - CA8800CT3 (2-1-1),3/26/2020 1:05,3/26/2020 1:05,0.75,gal,8/19/2020 1:04,userbomry,1,1,1,0,{'2020-08-19 01:04:53': 1},1,0
380,Wichita KS,DefaultDept,(PL)Painting Ops-Bldg 14 South EU-NEWAEROPB4,Blend: CA8800/I1050 - CA8800Z - CA8800CT3 (2-1-1),8/26/2020 0:00,8/26/2020 0:00,0.25,gal,10/12/2020 12:22,Kamiander,1,1,1,0,{'2020-10-12 12:22:36': 1},1,0
381,Wichita KS,DefaultDept,(PL)Painting Ops-Bldg 14 South EU-NEWAEROPB4,Blend: CA8800/I1050 - CA8800Z - CA8800CT3 (2-1-1),8/31/2020 0:00,8/31/2020 0:00,0.0625,gal,10/12/2020 12:24,Kamiander,1,1,1,0,{'2020-10-12 12:24:57': 1},1,0
382,Wichita KS,DefaultDept,(PL)Painting Ops-Bldg 14 South EU-NEWAEROPB4,Blend: CM0483928 - CM0120828 (4:1),7/15/2019 8:15,7/15/2019 8:15,8,gal,8/21/2019 16:39,adminbomgb,1,1,1,0,{'2019-08-21 16:39:08': 1},1,0
383,Wichita KS,DefaultDept,(PL)Painting Ops-Bldg 14 South EU-NEWAEROPB4,Blend: CM0483928 - CM0120828 (4:1),7/26/2019 8:17,7/26/2019 8:17,6,gal,7/26/2019 8:17,adminbomgb,1,1,1,0,{'2019-07-26 08:17:25': 1},1,0
384,Wichita KS,DefaultDept,(PL)Painting Ops-Bldg 14 South EU-NEWAEROPB4,Blend: CM0483928 - CM0120828 (4:1),7/26/2019 8:41,7/26/2019 8:41,0.5,gal,7/26/2019 8:41,adminbomgb,1,1,1,0,{'2019-07-26 08:41:45': 1},1,0
385,Wichita KS,DefaultDept,(PL)Painting Ops-Bldg 14 South EU-NEWAEROPB4,Blend: CM0483928 - CM0120828 (4:1),7/26/2019 9:15,7/26/2019 9:15,8,gal,7/26/2019 9:15,adminbomgb,1,1,1,0,{'2019-07-26 09:15:50': 1},1,0
386,Wichita KS,DefaultDept,(PL)Painting Ops-Bldg 14 South EU-NEWAEROPB4,Blend: CM0483928 - CM0120828 (4:1),7/26/2019 9:45,7/26/2019 9:45,0.25,gal,7/26/2019 9:45,adminbomgb,1,1,1,0,{'2019-07-26 09:45:46': 1},1,0
387,Wichita KS,DefaultDept,(PL)Painting Ops-Bldg 14 South EU-NEWAEROPB4,Blend: CM0483928 - CM0120828 (4:1),7/26/2019 10:26,7/26/2019 10:26,0.875,gal,7/26/2019 10:26,adminbomgb,1,1,1,0,{'2019-07-26 10:26:39': 1},1,0
388,Wichita KS,DefaultDept,(PL)Painting Ops-Bldg 14 South EU-NEWAEROPB4,Blend: CM0483928 - CM0120828 (4:1),7/26/2019 10:28,7/26/2019 10:28,0.75,gal,7/26/2019 10:28,adminbomgb,1,1,1,0,{'2019-07-26 10:28:40': 1},1,0
389,Wichita KS,DefaultDept,(PL)Painting Ops-Bldg 14 South EU-NEWAEROPB4,Blend: CM0483928 - CM0120828 (4:1),8/22/2019 8:00,8/22/2019 8:00,7,gal,9/20/2019 16:08,adminbomgb,1,1,1,0,{'2019-09-20 16:08:29': 1},1,0
390,Wichita KS,DefaultDept,(PL)Painting Ops-Bldg 14 South EU-NEWAEROPB4,Blend: CM0483928 - CM0120828 (4:1),10/2/2019 12:00,10/2/2019 12:00,0.25,gal,12/19/2019 16:04,adminbomry,1,1,1,0,{'2019-12-19 16:04:12': 1},1,0
391,Wichita KS,DefaultDept,(PL)Painting Ops-Bldg 14 South EU-NEWAEROPB4,Blend: CM0483928 - CM0120828 (4:1),10/8/2019 12:00,10/8/2019 12:00,0.75,gal,12/19/2019 16:04,adminbomry,1,1,1,0,{'2019-12-19 16:04:12': 1},1,0
392,Wichita KS,DefaultDept,(PL)Painting Ops-Bldg 14 South EU-NEWAEROPB4,Blend: CM0483928 - CM0120828 (4:1),11/7/2019 14:20,11/7/2019 14:20,0.25,gal,1/23/2020 15:20,Kamiander,1,1,1,0,{'2020-01-23 15:20:41': 1},1,0
393,Wichita KS,DefaultDept,(PL)Painting Ops-Bldg 14 South EU-NEWAEROPB4,Blend: CM0483928 - CM0120828 (4:1),1/22/2020 14:00,1/22/2020 14:00,0.25,gal,8/26/2020 11:49,adminbomjs,1,1,1,0,{'2020-08-26 11:49:51': 1},1,0
394,Wichita KS,DefaultDept,(PL)Painting Ops-Bldg 14 South EU-NEWAEROPB4,Blend: CM0483928 - CM0120828 (4:1),3/25/2020 1:02,3/25/2020 1:02,0.5,gal,8/19/2020 1:02,userbomry,1,1,1,0,{'2020-08-19 01:02:03': 1},1,0
395,Wichita KS,DefaultDept,(PL)Painting Ops-Bldg 14 South EU-NEWAEROPB4,Blend: CM0483928 - CM0120828 (4:1),3/25/2020 10:00,3/25/2020 10:00,0.0546875,gal,8/26/2020 17:37,adminbomjs,1,1,1,0,{'2020-08-26 17:37:47': 1},1,0
396,Wichita KS,DefaultDept,(PL)Painting Ops-Bldg 14 South EU-NEWAEROPB4,Blend: CM0483928 - CM0120828 (4:1),5/5/2020 0:00,5/5/2020 0:00,4,gal,6/19/2020 16:48,Kamiander,1,1,1,0,{'2020-06-19 16:48:57': 1},1,0
397,Wichita KS,DefaultDept,(PL)Painting Ops-Bldg 14 South EU-NEWAEROPB4,Blend: CM0483928 - CM0120828 (4:1),5/11/2020 0:00,5/11/2020 0:00,16,gal,6/19/2020 16:50,Kamiander,1,1,1,0,{'2020-06-19 16:50:46': 1},1,0
398,Wichita KS,DefaultDept,(PL)Painting Ops-Bldg 14 South EU-NEWAEROPB4,Blend: CM0483928 - CM0120828 (4:1),6/8/2020 0:00,6/8/2020 0:00,0.5,gal,7/20/2020 10:50,Kamiander,1,1,1,0,{'2020-07-20 10:50:56': 1},1,0
399,Wichita KS,DefaultDept,(PL)Painting Ops-Bldg 14 South EU-NEWAEROPB4,Blend: CM0483928 - CM0120828 (4:1),8/13/2020 11:00,8/13/2020 11:00,1,gal,11/4/2020 12:13,dlyon,1,1,1,0,{'2020-11-04 12:13:07': 1},1,0
400,Wichita KS,DefaultDept,(PL)Painting Ops-Bldg 14 South EU-NEWAEROPB4,Blend: CM0483928 - CM0120828 (4:1),12/3/2020 13:00,12/3/2020 13:00,0.25,gal,1/6/2021 12:36,dlyon,1,1,1,0,{'2021-01-06 12:36:24': 1},1,0
401,Wichita KS,DefaultDept,(PL)Painting Ops-Bldg 14 South EU-NEWAEROPB4,Blend: CM0483928 - CM0120828 - CM0110944 - (4:1:0.5),8/29/2020 9:00,8/29/2020 9:00,5.25,gal,11/4/2020 12:52,dlyon,1,1,1,0,{'2020-11-04 12:52:38': 1},1,0
402,Wichita KS,DefaultDept,(PL)Painting Ops-Bldg 14 South EU-NEWAEROPB4,Blend: CM0483928 - CM0120828 - CM0110944 - (4:1:1),9/16/2020 14:45,9/16/2020 14:45,0.6875,gal,10/28/2020 16:28,dlyon,1,1,1,0,{'2020-10-28 16:28:19': 1},1,0
403,Wichita KS,DefaultDept,(PL)Painting Ops-Bldg 14 South EU-NEWAEROPB4,Blend: CM0483928 - CM0120828 - CM0110944 - (4:1:1),9/24/2020 10:00,9/24/2020 10:00,0.75,gal,10/27/2020 15:36,dlyon,1,1,1,0,{'2020-10-27 15:36:25': 1},1,0
404,Wichita KS,DefaultDept,(PL)Painting Ops-Bldg 14 South EU-NEWAEROPB4,Blend: CM0483928 - CM0120828 - CM0110944 - (4:1:1),10/13/2020 14:00,10/13/2020 14:00,3,gal,12/21/2020 11:11,dlyon,1,1,1,0,{'2020-12-21 11:11:25': 1},1,0
405,Wichita KS,DefaultDept,(PL)Painting Ops-Bldg 14 South EU-NEWAEROPB4,Blend: CM0483928 - CM0120828 - CM0110944 - (4:1:1),10/13/2020 21:00,10/13/2020 21:00,0.28125,gal,12/21/2020 11:18,dlyon,1,1,1,0,{'2020-12-21 11:18:24': 1},1,0
406,Wichita KS,DefaultDept,(PL)Painting Ops-Bldg 14 South EU-NEWAEROPB4,Blend: CM0483928 - CM0120828 - CM0110944 - (4:1:1),10/18/2020 8:30,10/18/2020 8:30,1.5,gal,12/21/2020 11:21,dlyon,1,1,1,0,{'2020-12-21 11:21:04': 1},1,0
407,Wichita KS,DefaultDept,(PL)Painting Ops-Bldg 14 South EU-NEWAEROPB4,Blend: CM0483928 - CM0120828 - CM0110944 - (4:1:1),10/20/2020 15:00,10/20/2020 15:00,1.5,gal,12/21/2020 10:45,dlyon,1,1,1,0,{'2020-12-21 10:45:55': 1},1,0
408,Wichita KS,DefaultDept,(PL)Painting Ops-Bldg 14 South EU-NEWAEROPB4,Blend: CM0483928 - CM0120828 - CM0110944 - (4:1:1),11/4/2020 13:00,11/4/2020 13:00,0.75,gal,12/21/2020 11:53,dlyon,1,1,1,0,{'2020-12-21 11:53:46': 1},1,0
409,Wichita KS,DefaultDept,(PL)Painting Ops-Bldg 14 South EU-NEWAEROPB4,Blend: CM0483928 - CM0120828 - CM0110944 - (4:1:1),11/16/2020 12:20,11/16/2020 12:20,0.75,gal,12/21/2020 12:07,dlyon,1,1,1,0,{'2020-12-21 12:07:59': 1},1,0
410,Wichita KS,DefaultDept,(PL)Painting Ops-Bldg 14 South EU-NEWAEROPB4,Blend: CM0483928 - CM0120828 - CM0110944 - (4:1:1),12/16/2020 11:00,12/16/2020 11:00,0.75,gal,1/6/2021 12:47,dlyon,1,1,1,0,{'2021-01-06 12:47:54': 1},1,0
411,Wichita KS,DefaultDept,(PL)Painting Ops-Bldg 14 South EU-NEWAEROPB4,Blend: CM0483928 - CM0120828 - CM0110944 - (4:1:1),12/18/2020 14:00,12/18/2020 14:00,1.5,gal,1/6/2021 14:32,userbomba,1,1,1,0,{'2021-01-06 14:32:07': 1},1,0
412,Wichita KS,DefaultDept,(PL)Painting Ops-Bldg 14 South EU-NEWAEROPB4,Blend: CM0840102 - CM0840081 - CM0840A03 (2:1:1),11/8/2019 0:00,11/8/2019 0:00,1,gal,1/27/2020 17:09,adminbomry,1,1,1,0,{'2020-01-27 17:09:38': 1},1,0
413,Wichita KS,DefaultDept,(PL)Painting Ops-Bldg 14 South EU-NEWAEROPB4,Blend: CM0840103 - CM0840081 - CM0110093 (2:1:1),3/24/2020 1:47,3/24/2020 1:47,0.21875,gal,8/19/2020 1:46,userbomry,1,1,1,0,{'2020-08-19 01:46:50': 1},1,0
414,Wichita KS,DefaultDept,(PL)Painting Ops-Bldg 14 South EU-NEWAEROPB4,Blend: CM0840103 - CM0840081 - CM0840A03 (2:1:1),3/11/2020 12:45,3/11/2020 12:45,0.25,gal,8/26/2020 18:28,adminbomjs,1,1,1,0,{'2020-08-26 18:28:55': 1},1,0
415,Wichita KS,DefaultDept,(PL)Painting Ops-Bldg 14 South EU-NEWAEROPB4,Blend: ECL-G-46 - PC-233 - TR-109 (2:1:1),10/24/2019 12:00,10/24/2019 12:00,0.5,gal,12/19/2019 16:04,adminbomry,1,1,1,0,{'2019-12-19 16:04:12': 1},1,0
416,Wichita KS,DefaultDept,(PL)Painting Ops-Bldg 14 South EU-NEWAEROPB4,Blend: G10254 - PC-242 - A4950 AC139 (1:1:0.125),3/16/2020 10:00,3/16/2020 10:00,2.125,gal,8/26/2020 19:54,adminbomjs,1,1,1,0,{'2020-08-26 19:54:32': 1},1,0
417,Wichita KS,DefaultDept,(PL)Painting Ops-Bldg 14 South EU-NEWAEROPB4,Blend: G5007 - PC-242 - A4950 (1:1:0.125),3/17/2020 10:00,3/17/2020 10:00,0.1875,gal,8/26/2020 19:56,adminbomjs,1,1,1,0,{'2020-08-26 19:56:22': 1},1,0
418,Wichita KS,DefaultDept,(PL)Painting Ops-Bldg 14 South EU-NEWAEROPB4,Blend: I1024 - 8800Z - 8800CT (2:1:1),7/26/2019 10:19,7/26/2019 10:19,0.5,gal,7/26/2019 10:19,adminbomgb,1,1,1,0,{'2019-07-26 10:19:54': 1},1,0
419,Wichita KS,DefaultDept,(PL)Painting Ops-Bldg 14 South EU-NEWAEROPB4,Blend: I1050 - 8800Z - 8800CT (2:1:1),7/15/2019 11:30,7/15/2019 11:30,10,gal,8/21/2019 16:40,adminbomgb,1,1,1,0,{'2019-08-21 16:40:33': 1},1,0
420,Wichita KS,DefaultDept,(PL)Painting Ops-Bldg 14 South EU-NEWAEROPB4,Blend: I1050 - 8800Z - 8800CT (2:1:1),7/19/2019 4:30,7/19/2019 4:30,16,gal,8/21/2019 16:42,adminbomgb,1,1,1,0,{'2019-08-21 16:42:26': 1},1,0
421,Wichita KS,DefaultDept,(PL)Painting Ops-Bldg 14 South EU-NEWAEROPB4,Blend: I1050 - 8800Z - 8800CT (2:1:1),7/26/2019 8:19,7/26/2019 8:19,12,gal,7/26/2019 8:19,adminbomgb,1,1,1,0,{'2019-07-26 08:19:25': 1},1,0
422,Wichita KS,DefaultDept,(PL)Painting Ops-Bldg 14 South EU-NEWAEROPB4,Blend: I1050 - 8800Z - 8800CT (2:1:1),7/26/2019 8:23,7/26/2019 8:23,2,gal,7/26/2019 8:23,adminbomgb,1,1,1,0,{'2019-07-26 08:23:16': 1},1,0
423,Wichita KS,DefaultDept,(PL)Painting Ops-Bldg 14 South EU-NEWAEROPB4,Blend: I1050 - 8800Z - 8800CT (2:1:1),7/26/2019 8:33,7/26/2019 8:33,0.25,gal,7/26/2019 8:33,adminbomgb,1,1,1,0,{'2019-07-26 08:33:04': 1},1,0
424,Wichita KS,DefaultDept,(PL)Painting Ops-Bldg 14 South EU-NEWAEROPB4,Blend: I1050 - 8800Z - 8800CT (2:1:1),7/26/2019 9:17,7/26/2019 9:17,16,gal,7/26/2019 9:17,adminbomgb,1,1,1,0,{'2019-07-26 09:17:33': 1},1,0
425,Wichita KS,DefaultDept,(PL)Painting Ops-Bldg 14 South EU-NEWAEROPB4,Blend: I1050 - 8800Z - 8800CT (2:1:1),7/26/2019 9:38,7/26/2019 9:38,1.5,gal,7/26/2019 9:38,adminbomgb,1,1,1,0,{'2019-07-26 09:38:18': 1},1,0
426,Wichita KS,DefaultDept,(PL)Painting Ops-Bldg 14 South EU-NEWAEROPB4,Blend: I1050 - 8800Z - 8800CT (2:1:1),7/26/2019 9:39,7/26/2019 9:39,0.5,gal,7/26/2019 9:39,adminbomgb,1,1,1,0,{'2019-07-26 09:39:53': 1},1,0
427,Wichita KS,DefaultDept,(PL)Painting Ops-Bldg 14 South EU-NEWAEROPB4,Blend: I1050 - 8800Z - 8800CT (2:1:1),7/26/2019 10:00,7/26/2019 10:00,1,gal,7/26/2019 10:00,adminbomgb,1,1,1,0,{'2019-07-26 10:00:54': 1},1,0
428,Wichita KS,DefaultDept,(PL)Painting Ops-Bldg 14 South EU-NEWAEROPB4,Blend: I1050 - 8800Z - 8800CT (2:1:1),7/26/2019 10:11,7/26/2019 10:11,0.25,gal,7/26/2019 10:11,adminbomgb,1,1,1,0,{'2019-07-26 10:11:43': 1},1,0
429,Wichita KS,DefaultDept,(PL)Painting Ops-Bldg 14 South EU-NEWAEROPB4,Blend: I1050 - 8800Z - 8800CT (2:1:1),7/26/2019 10:22,7/26/2019 10:22,0.625,gal,7/26/2019 10:22,adminbomgb,1,1,1,0,{'2019-07-26 10:22:40': 1},1,0
430,Wichita KS,DefaultDept,(PL)Painting Ops-Bldg 14 South EU-NEWAEROPB4,Blend: I1050 - 8800Z - 8800CT (2:1:1),7/29/2019 9:00,7/29/2019 9:00,2,gal,8/21/2019 16:50,adminbomgb,1,1,1,0,{'2019-08-21 16:50:59': 1},1,0
431,Wichita KS,DefaultDept,(PL)Painting Ops-Bldg 14 South EU-NEWAEROPB4,Blend: I1050 - 8800Z - 8800CT (2:1:1),8/29/2019 10:00,8/29/2019 10:00,6,gal,9/20/2019 16:12,adminbomgb,1,1,1,0,{'2019-09-20 16:12:25': 1},1,0
432,Wichita KS,DefaultDept,(PL)Painting Ops-Bldg 14 South EU-NEWAEROPB4,Blend: I1050 - 8800Z - 8800CT (2:1:1),8/29/2019 14:30,8/29/2019 14:30,2,gal,9/20/2019 16:35,adminbomgb,1,1,1,0,{'2019-09-20 16:35:08': 1},1,0
433,Wichita KS,DefaultDept,(PL)Painting Ops-Bldg 14 South EU-NEWAEROPB4,Blend: I1050 - 8800Z - 8800CT (2:1:1),9/11/2019 10:30,9/11/2019 10:30,0.5,gal,10/15/2019 10:05,adminbomgb,1,1,1,0,{'2019-10-15 10:05:27': 1},1,0
434,Wichita KS,DefaultDept,(PL)Painting Ops-Bldg 14 South EU-NEWAEROPB4,Blend: I1050 - 8800Z - 8800CT (2:1:1),9/18/2019 10:00,9/18/2019 10:00,0.25,gal,10/15/2019 10:07,adminbomgb,1,1,1,0,{'2019-10-15 10:07:09': 1},1,0
435,Wichita KS,DefaultDept,(PL)Painting Ops-Bldg 14 South EU-NEWAEROPB4,Blend: I1050 - 8800Z - 8800CT (2:1:1),9/26/2019 7:00,9/26/2019 7:00,10,gal,10/15/2019 10:08,adminbomgb,1,1,1,0,{'2019-10-15 10:08:45': 1},1,0
436,Wichita KS,DefaultDept,(PL)Painting Ops-Bldg 14 South EU-NEWAEROPB4,Blend: I1050 - 8800Z - 8800CT (2:1:1),10/11/2019 12:00,10/11/2019 12:00,1,gal,12/19/2019 16:04,adminbomry,1,1,1,0,{'2019-12-19 16:04:12': 1},1,0
437,Wichita KS,DefaultDept,(PL)Painting Ops-Bldg 14 South EU-NEWAEROPB4,Blend: I1050 - 8800Z - 8800CT (2:1:1),10/16/2019 12:00,10/16/2019 12:00,4,gal,12/19/2019 16:04,adminbomry,1,1,1,0,{'2019-12-19 16:04:12': 1},1,0
438,Wichita KS,DefaultDept,(PL)Painting Ops-Bldg 14 South EU-NEWAEROPB4,Blend: I1050 - 8800Z - 8800CT (2:1:1),10/24/2019 12:00,10/24/2019 12:00,1,gal,12/19/2019 16:04,adminbomry,1,1,1,0,{'2019-12-19 16:04:12': 1},1,0
439,Wichita KS,DefaultDept,(PL)Painting Ops-Bldg 14 South EU-NEWAEROPB4,Blend: I1050 - 8800Z - 8800CT (2:1:1),11/27/2019 14:26,11/27/2019 14:26,0.25,gal,1/27/2020 16:43,adminbomry,1,1,1,0,{'2020-01-27 16:43:27': 1},1,0
440,Wichita KS,DefaultDept,(PL)Painting Ops-Bldg 14 South EU-NEWAEROPB4,Blend: I1050 - 8800Z - 8800CT (2:1:1),2/10/2020 19:16,2/10/2020 19:16,0.5,gal,5/8/2020 19:16,adminbomry,1,1,1,0,{'2020-05-08 19:16:01': 1},1,0
441,Wichita KS,DefaultDept,(PL)Painting Ops-Bldg 14 South EU-NEWAEROPB4,Blend: I1050 - 8800Z - 8800CT (2:1:1),2/13/2020 11:00,2/13/2020 11:00,0.75,gal,8/26/2020 14:01,adminbomjs,1,1,1,0,{'2020-08-26 14:01:29': 1},1,0
442,Wichita KS,DefaultDept,(PL)Painting Ops-Bldg 14 South EU-NEWAEROPB4,Blend: I1050 - 8800Z - 8800CT (2:1:1),2/21/2020 19:14,2/21/2020 19:14,1.5,gal,5/8/2020 19:13,adminbomry,1,1,1,0,{'2020-05-08 19:13:55': 1},1,0
443,Wichita KS,DefaultDept,(PL)Painting Ops-Bldg 14 South EU-NEWAEROPB4,Blend: I1050 - 8800Z - 8800CT (2:1:1),3/14/2020 10:46,3/14/2020 10:46,0.21875,gal,5/14/2020 10:45,adminbomry,1,1,1,0,{'2020-05-14 10:45:51': 1},1,0
444,Wichita KS,DefaultDept,(PL)Painting Ops-Bldg 14 South EU-NEWAEROPB4,Blend: I1050 - 8800Z - 8800CT (2:1:1),3/25/2020 1:00,3/25/2020 1:00,0.1640625,gal,8/19/2020 0:59,userbomry,1,1,1,0,{'2020-08-19 00:59:54': 1},1,0
445,Wichita KS,DefaultDept,(PL)Painting Ops-Bldg 14 South EU-NEWAEROPB4,Blend: I1050 - 8800Z - 8800CT (2:1:1),9/1/2020 5:30,9/1/2020 5:30,33,gal,10/27/2020 16:27,dlyon,1,1,1,0,{'2020-10-27 16:27:37': 1},1,0
446,Wichita KS,DefaultDept,(PL)Painting Ops-Bldg 14 South EU-NEWAEROPB4,Blend: I1050 - 8800Z - 8800CT (2:1:1),9/2/2020 14:00,9/2/2020 14:00,2,gal,10/27/2020 16:30,dlyon,1,1,1,0,{'2020-10-27 16:30:13': 1},1,0
447,Wichita KS,DefaultDept,(PL)Painting Ops-Bldg 14 South EU-NEWAEROPB4,Blend: I1050 - 8800Z - 8800CT (2:1:1),9/3/2020 9:00,9/3/2020 9:00,10,gal,10/28/2020 10:05,dlyon,1,1,1,0,{'2020-10-28 10:05:35': 1},1,0
448,Wichita KS,DefaultDept,(PL)Painting Ops-Bldg 14 South EU-NEWAEROPB4,Blend: I1050 - 8800Z - 8800CT (2:1:1),10/14/2020 11:15,10/14/2020 11:15,3,gal,12/21/2020 10:39,dlyon,1,1,1,0,{'2020-12-21 10:39:23': 1},1,0
449,Wichita KS,DefaultDept,(PL)Painting Ops-Bldg 14 South EU-NEWAEROPB4,Blend: I1050 - 8800Z - 8800CT (2:1:1),10/21/2020 12:00,10/21/2020 12:00,1,gal,12/21/2020 10:59,dlyon,1,1,1,0,{'2020-12-21 10:59:07': 1},1,0
450,Wichita KS,DefaultDept,(PL)Painting Ops-Bldg 14 South EU-NEWAEROPB4,Blend: I1050 - 8800Z - 8800CT - 1800CX (2:1:1:0.5),7/31/2019 6:00,7/31/2019 6:00,16.5,gal,9/20/2019 15:51,adminbomgb,1,1,1,0,{'2019-09-20 15:51:24': 1},1,0
451,Wichita KS,DefaultDept,(PL)Painting Ops-Bldg 14 South EU-NEWAEROPB4,Blend: I1050 - 8800Z - 8800CT - 1800CX (2:1:1:0.5),8/25/2020 16:42,8/25/2020 16:42,12,gal,11/4/2020 12:18,dlyon,1,1,1,0,{'2020-11-04 12:18:41': 1},1,0
452,Wichita KS,DefaultDept,(PL)Painting Ops-Bldg 14 South EU-NEWAEROPB4,Blend: I2029 - 8800Z - 8800CT (2:1:1),7/26/2019 10:13,7/26/2019 10:13,0.25,gal,7/26/2019 10:13,adminbomgb,1,1,1,0,{'2019-07-26 10:13:50': 1},1,0
453,Wichita KS,DefaultDept,(PL)Painting Ops-Bldg 14 South EU-NEWAEROPB4,Blend: I6032- 8800Z - 8800CT (2:1:1),7/26/2019 9:22,7/26/2019 9:22,0.25,gal,7/26/2019 9:22,adminbomgb,1,1,1,0,{'2019-07-26 09:22:14': 1},1,0
454,Wichita KS,DefaultDept,(PL)Painting Ops-Bldg 14 South EU-NEWAEROPB4,Blend: I6032- 8800Z - 8800CT (2:1:1),7/26/2019 9:27,7/26/2019 9:27,0.5,gal,7/26/2019 9:27,adminbomgb,1,1,1,0,{'2019-07-26 09:27:01': 1},1,0
455,Wichita KS,DefaultDept,(PL)Painting Ops-Bldg 14 South EU-NEWAEROPB4,Blend: I6032- 8800Z - 8800CT (2:1:1),8/13/2020 13:00,8/13/2020 13:00,1.5,gal,11/4/2020 11:43,dlyon,1,1,1,0,{'2020-11-04 11:43:35': 1},1,0
456,Wichita KS,DefaultDept,(PL)Painting Ops-Bldg 14 South EU-NEWAEROPB4,Blend: I6049- 8800Z - 8800CT (2:1:1),7/26/2019 9:23,7/26/2019 9:23,0.25,gal,7/26/2019 9:23,adminbomgb,1,1,1,0,{'2019-07-26 09:23:42': 1},1,0
457,Wichita KS,DefaultDept,(PL)Painting Ops-Bldg 14 South EU-NEWAEROPB4,Blend: IM404 - 8000B - 8000C (2:1:1),8/3/2019 7:00,8/3/2019 7:00,0.5,gal,9/20/2019 15:58,adminbomgb,1,1,1,0,{'2019-09-20 15:58:11': 1},1,0
458,Wichita KS,DefaultDept,(PL)Painting Ops-Bldg 14 South EU-NEWAEROPB4,Blend: IM616 - 8000B - 8000C (2:1:1),7/26/2019 8:25,7/26/2019 8:25,1,gal,7/26/2019 8:25,adminbomgb,1,1,1,0,{'2019-07-26 08:25:20': 1},1,0
459,Wichita KS,DefaultDept,(PL)Painting Ops-Bldg 14 South EU-NEWAEROPB4,Blend: IM641 - 8000B - 8000C (2:1:1),7/26/2019 8:27,7/26/2019 8:27,1,gal,7/26/2019 8:27,adminbomgb,1,1,1,0,{'2019-07-26 08:27:04': 1},1,0
460,Wichita KS,DefaultDept,(PL)Painting Ops-Bldg 14 South EU-NEWAEROPB4,Blend: IM908 - 8800Z - 8800CT3 (2:1:1),10/21/2019 12:00,10/21/2019 12:00,0.25,gal,12/19/2019 16:04,adminbomry,1,1,1,0,{'2019-12-19 16:04:12': 1},1,0
461,Wichita KS,DefaultDept,(PL)Painting Ops-Bldg 14 South EU-NEWAEROPB4,Blend: IM912 - 8800Z - 8800CT (2:1:1),10/6/2019 12:00,10/6/2019 12:00,1,gal,12/19/2019 16:04,adminbomry,1,1,1,0,{'2019-12-19 16:04:12': 1},1,0
462,Wichita KS,DefaultDept,(PL)Painting Ops-Bldg 14 South EU-NEWAEROPB4,Blend: IM914 - 8000B - 8000C (2:1:1),7/26/2019 10:03,7/26/2019 10:03,0.25,gal,7/26/2019 10:03,adminbomgb,1,1,1,0,{'2019-07-26 10:03:04': 1},1,0
463,Wichita KS,DefaultDept,(PL)Painting Ops-Bldg 14 South EU-NEWAEROPB4,Blend: IM922 - 8000B - 8000C (2:1:1),7/23/2019 8:00,7/23/2019 8:00,1,gal,8/21/2019 16:49,adminbomgb,1,1,1,0,{'2019-08-21 16:49:14': 1},1,0
464,Wichita KS,DefaultDept,(PL)Painting Ops-Bldg 14 South EU-NEWAEROPB4,Blend: IM922 - 8000B - 8000C (2:1:1),8/2/2019 7:00,8/2/2019 7:00,0.5,gal,9/20/2019 15:56,adminbomgb,1,1,1,0,{'2019-09-20 15:56:49': 1},1,0
465,Wichita KS,DefaultDept,(PL)Painting Ops-Bldg 14 South EU-NEWAEROPB4,Blend: P7543C - PH-19 - SC-5 (2:1:1),8/13/2019 7:00,8/13/2019 7:00,5,gal,9/20/2019 16:03,adminbomgb,1,1,1,0,{'2019-09-20 16:03:56': 1},1,0
466,Wichita KS,DefaultDept,(PL)Painting Ops-Bldg 14 South EU-NEWAEROPB4,Blend: P7543C - PH-19 - SC-5 (2:1:1),8/22/2019 10:00,8/22/2019 10:00,9,gal,9/20/2019 16:11,adminbomgb,1,1,1,0,{'2019-09-20 16:11:04': 1},1,0
467,Wichita KS,DefaultDept,(PL)Painting Ops-Bldg 14 South EU-NEWAEROPB4,Blend: PG-6-MR6 - PH-19 - SC-5 (2:1:1),10/14/2019 12:00,10/14/2019 12:00,0.5,gal,12/19/2019 16:04,adminbomry,1,1,1,0,{'2019-12-19 16:04:12': 1},1,0
468,Wichita KS,DefaultDept,(PL)Painting Ops-Bldg 14 South EU-NEWAEROPB4,Blend: PG-6-W207 - PH-19 - SC-5 - (2:1:1),8/10/2020 8:00,8/10/2020 8:00,0.25,gal,12/30/2020 14:37,dlyon,1,1,1,0,{'2020-12-30 14:37:09': 1},1,0
469,Wichita KS,DefaultDept,(PL)Painting Ops-Bldg 14 South EU-NEWAEROPB4,Blend: PG-99 W207 - PH-19 - SC-5 (2:1:1),3/17/2020 1:23,3/17/2020 1:23,1,gal,8/19/2020 1:23,userbomry,1,1,1,0,{'2020-08-19 01:23:35': 1},1,0
470,Wichita KS,DefaultDept,(PL)Painting Ops-Bldg 14 South EU-NEWAEROPB4,Blend: PG-99 W207 - PH-19 - SC-5 (2:1:1),3/26/2020 1:06,3/26/2020 1:06,6,gal,8/19/2020 1:06,userbomry,1,1,1,0,{'2020-08-19 01:06:10': 1},1,0
471,Wichita KS,DefaultDept,(PL)Painting Ops-Bldg 14 South EU-NEWAEROPB4,Blend: PG-99 W207 - PH-19 - SC-5 (2:1:1),12/7/2020 12:30,12/7/2020 12:30,0.25,gal,1/6/2021 12:38,dlyon,1,1,1,0,{'2021-01-06 12:38:35': 1},1,0
472,Wichita KS,DefaultDept,(PL)Painting Ops-Bldg 14 South EU-NEWAEROPB4,Blend: PG-99-G315 - PH-19 - SC-5 (2:1:1),2/6/2020 19:30,2/6/2020 19:30,5,gal,8/26/2020 13:13,adminbomjs,1,1,1,0,{'2020-08-26 13:13:29': 1},1,0
473,Wichita KS,DefaultDept,(PL)Painting Ops-Bldg 14 South EU-NEWAEROPB4,Blend: SP350 Blend (8:1:1),5/23/2019 13:30,5/23/2019 13:30,0.25,gal,9/20/2019 15:12,adminbomgb,1,1,1,0,{'2019-09-20 15:12:58': 1},1,0
474,Wichita KS,DefaultDept,(PL)Painting Ops-Bldg 14 South EU-NEWAEROPB4,Blend: SP350 Blend (8:1:1),5/30/2019 11:00,5/30/2019 11:00,0.25,gal,9/20/2019 15:14,adminbomgb,1,1,1,0,{'2019-09-20 15:14:37': 1},1,0
475,Wichita KS,DefaultDept,(PL)Painting Ops-Bldg 14 South EU-NEWAEROPB4,Blend: SP350 Blend (8:1:1),6/21/2019 0:00,6/21/2019 0:00,0.25,gal,9/20/2019 15:04,adminbomgb,1,1,1,0,{'2019-09-20 15:04:57': 1},1,0
476,Wichita KS,DefaultDept,(PL)Painting Ops-Bldg 14 South EU-NEWAEROPB4,Blend: SP350 Blend (8:1:1),7/15/2019 9:30,7/15/2019 9:30,0.25,gal,9/20/2019 15:36,adminbomgb,1,1,1,0,{'2019-09-20 15:36:19': 1},1,0
477,Wichita KS,DefaultDept,(PL)Painting Ops-Bldg 14 South EU-NEWAEROPB4,Blend: SP350 Blend (8:1:1),8/1/2019 12:30,8/1/2019 12:30,0.25,gal,9/20/2019 16:38,adminbomgb,1,1,1,0,{'2019-09-20 16:38:34': 1},1,0
478,Wichita KS,DefaultDept,(PL)Painting Ops-Bldg 14 South EU-NEWAEROPB4,Blend: SP350 Blend (8:1:1),8/2/2019 11:00,8/2/2019 11:00,0.25,gal,9/20/2019 16:40,adminbomgb,1,1,1,0,{'2019-09-20 16:40:52': 1},1,0
479,Wichita KS,DefaultDept,(PL)Painting Ops-Bldg 14 South EU-NEWAEROPB4,Blend: SP350 Blend (8:1:1),8/15/2019 13:45,8/15/2019 13:45,0.25,gal,9/20/2019 16:43,adminbomgb,1,1,1,0,{'2019-09-20 16:43:30': 1},1,0
480,Wichita KS,DefaultDept,(PL)Painting Ops-Bldg 14 South EU-NEWAEROPB4,Blend: SP350 Blend (8:1:1),8/29/2019 13:00,8/29/2019 13:00,0.25,gal,9/20/2019 16:32,adminbomgb,1,1,1,0,{'2019-09-20 16:32:45': 1},1,0
481,Wichita KS,DefaultDept,(PL)Painting Ops-Bldg 14 South EU-NEWAEROPB4,Blend: SP350 Blend (8:1:1),9/15/2019 10:50,9/15/2019 10:50,0.25,gal,10/15/2019 10:15,adminbomgb,1,1,1,0,{'2019-10-15 10:15:11': 1},1,0
482,Wichita KS,DefaultDept,(PL)Painting Ops-Bldg 14 South EU-NEWAEROPB4,Blend: SP350 Blend (8:1:1),9/16/2019 14:30,9/16/2019 14:30,0.25,gal,10/15/2019 10:19,adminbomgb,1,1,1,0,{'2019-10-15 10:19:11': 1},1,0
483,Wichita KS,DefaultDept,(PL)Painting Ops-Bldg 14 South EU-NEWAEROPB4,Blend: SP350 Blend (8:1:1),9/23/2019 13:30,9/23/2019 13:30,0.25,gal,10/15/2019 10:21,adminbomgb,1,1,1,0,{'2019-10-15 10:21:34': 1},1,0
484,Wichita KS,DefaultDept,(PL)Painting Ops-Bldg 14 South EU-NEWAEROPB4,Blend: SP350 Blend (8:1:1),10/3/2019 12:00,10/3/2019 12:00,0.5,gal,12/19/2019 16:04,adminbomry,1,1,1,0,{'2019-12-19 16:04:12': 1},1,0
485,Wichita KS,DefaultDept,(PL)Painting Ops-Bldg 14 South EU-NEWAEROPB4,Blend: SP350 Blend (8:1:1),3/13/2020 10:31,3/13/2020 10:31,0.25,gal,5/14/2020 12:57,adminbomry,1,1,1,0,{'2020-05-14 12:57:19': 1},1,0
486,Wichita KS,DefaultDept,(PL)Painting Ops-Bldg 14 South EU-NEWAEROPB4,Blend: SP350 Blend (8:1:1),3/25/2020 1:25,3/25/2020 1:25,0.25,gal,8/19/2020 1:25,userbomry,1,1,1,0,{'2020-08-19 01:25:20': 1},1,0
487,Wichita KS,DefaultDept,(PL)Painting Ops-Bldg 14 South EU-NEWAEROPB4,Blend: SP350 Blend (8:1:1),5/10/2020 0:00,5/10/2020 0:00,0.078125,gal,6/19/2020 16:59,Kamiander,1,1,1,0,{'2020-06-19 16:59:59': 1},1,0
488,Wichita KS,DefaultDept,(PL)Painting Ops-Bldg 14 South EU-NEWAEROPB4,Blend: SP350 Blend (8:1:1),6/3/2020 0:00,6/3/2020 0:00,0.0625,gal,7/20/2020 10:43,Kamiander,1,1,1,0,{'2020-07-20 10:43:50': 1},1,0
489,Wichita KS,DefaultDept,(PL)Painting Ops-Bldg 14 South EU-NEWAEROPB4,Blend: SP350 Blend (8:1:1),7/16/2020 0:00,7/16/2020 0:00,0.109375,gal,8/27/2020 9:30,Kamiander,1,1,1,0,{'2020-08-27 09:30:00': 1},1,0
490,Wichita KS,DefaultDept,(PL)Painting Ops-Bldg 14 South EU-NEWAEROPB4,Blend: SP350 Blend (8:1:1),7/17/2020 0:00,7/17/2020 0:00,0.109375,gal,8/27/2020 9:31,Kamiander,1,1,1,0,{'2020-08-27 09:31:25': 1},1,0
491,Wichita KS,DefaultDept,(PL)Painting Ops-Bldg 14 South EU-NEWAEROPB4,Blend: SP350 Blend (8:1:1),8/10/2020 10:00,8/10/2020 10:00,0.25,gal,11/4/2020 11:40,dlyon,1,1,1,0,{'2020-11-04 11:40:25': 1},1,0
492,Wichita KS,DefaultDept,(PL)Painting Ops-Bldg 14 South EU-NEWAEROPB4,Blend: SP350 Blend (8:1:1),8/14/2020 6:00,8/14/2020 6:00,0.25,gal,12/30/2020 14:58,dlyon,1,1,1,0,{'2020-12-30 14:58:50': 1},1,0
493,Wichita KS,DefaultDept,(PL)Painting Ops-Bldg 14 South EU-NEWAEROPB4,Blend: SP350 Blend (8:1:1),9/2/2020 6:30,9/2/2020 6:30,0.25,gal,10/27/2020 15:17,dlyon,1,1,1,0,{'2020-10-27 15:17:59': 1},1,0
494,Wichita KS,DefaultDept,(PL)Painting Ops-Bldg 14 South EU-NEWAEROPB4,Blend: SP350 Blend (8:1:1),9/26/2020 9:00,9/26/2020 9:00,0.75,gal,10/27/2020 15:53,dlyon,1,1,1,0,{'2020-10-27 15:53:03': 1},1,0
495,Wichita KS,DefaultDept,(PL)Painting Ops-Bldg 14 South EU-NEWAEROPB4,Blend: W207 - 8800Z - 8800CT (2:1:1),7/26/2019 8:38,7/26/2019 8:38,8,gal,7/26/2019 8:38,adminbomgb,1,1,1,0,{'2019-07-26 08:38:40': 1},1,0
496,Wichita KS,DefaultDept,(PL)Painting Ops-Bldg 14 South EU-NEWAEROPB4,Blend: W207 - 8800Z - 8800CT (2:1:1),7/26/2019 9:02,7/26/2019 9:02,5,gal,7/26/2019 9:02,adminbomgb,1,1,1,0,{'2019-07-26 09:02:30': 1},1,0
497,Wichita KS,DefaultDept,(PL)Painting Ops-Bldg 14 South EU-NEWAEROPB4,Blend: W207 - 8800Z - 8800CT (2:1:1),7/26/2019 9:36,7/26/2019 9:36,2.5,gal,7/26/2019 9:36,adminbomgb,1,1,1,0,{'2019-07-26 09:36:12': 1},1,0
498,Wichita KS,DefaultDept,(PL)Painting Ops-Bldg 14 South EU-NEWAEROPB4,Blend: XS420 Blend (3:1:1),5/30/2019 13:00,5/30/2019 13:00,0.25,gal,9/20/2019 15:28,adminbomgb,1,1,1,0,{'2019-09-20 15:28:48': 1},1,0
499,Wichita KS,DefaultDept,(PL)Painting Ops-Bldg 14 South EU-NEWAEROPB4,Blend: XS420 Blend (3:1:1),6/7/2019 14:00,6/7/2019 14:00,0.25,gal,9/20/2019 15:30,adminbomgb,1,1,1,0,{'2019-09-20 15:30:22': 1},1,0
500,Wichita KS,DefaultDept,(PL)Painting Ops-Bldg 14 South EU-NEWAEROPB4,Blend: XS420 Blend (3:1:1),6/18/2019 12:45,6/18/2019 12:45,0.25,gal,9/20/2019 15:32,adminbomgb,1,1,1,0,{'2019-09-20 15:32:10': 1},1,0
501,Wichita KS,DefaultDept,(PL)Painting Ops-Bldg 14 South EU-NEWAEROPB4,Blend: XS420 Blend (3:1:1),6/21/2019 12:45,6/21/2019 12:45,0.25,gal,9/20/2019 15:05,adminbomgb,1,1,1,0,{'2019-09-20 15:05:26': 1},1,0
502,Wichita KS,DefaultDept,(PL)Painting Ops-Bldg 14 South EU-NEWAEROPB4,Blend: XS420 Blend (3:1:1),7/31/2019 13:30,7/31/2019 13:30,0.25,gal,9/20/2019 16:37,adminbomgb,1,1,1,0,{'2019-09-20 16:37:28': 1},1,0
503,Wichita KS,DefaultDept,(PL)Painting Ops-Bldg 14 South EU-NEWAEROPB4,Blend: XS420 Blend (3:1:1),8/1/2019 13:30,8/1/2019 13:30,0.25,gal,9/20/2019 16:39,adminbomgb,1,1,1,0,{'2019-09-20 16:39:48': 1},1,0
504,Wichita KS,DefaultDept,(PL)Painting Ops-Bldg 14 South EU-NEWAEROPB4,Blend: XS420 Blend (3:1:1),8/2/2019 13:00,8/2/2019 13:00,0.25,gal,9/20/2019 16:41,adminbomgb,1,1,1,0,{'2019-09-20 16:41:51': 1},1,0
505,Wichita KS,DefaultDept,(PL)Painting Ops-Bldg 14 South EU-NEWAEROPB4,Blend: XS420 Blend (3:1:1),8/29/2019 14:30,8/29/2019 14:30,0.25,gal,9/20/2019 16:33,adminbomgb,1,1,1,0,{'2019-09-20 16:33:51': 1},1,0
506,Wichita KS,DefaultDept,(PL)Painting Ops-Bldg 14 South EU-NEWAEROPB4,Blend: XS420 Blend (3:1:1),9/15/2019 9:30,9/15/2019 9:30,0.25,gal,10/15/2019 10:16,adminbomgb,1,1,1,0,{'2019-10-15 10:16:23': 1},1,0
507,Wichita KS,DefaultDept,(PL)Painting Ops-Bldg 14 South EU-NEWAEROPB4,Blend: XS420 Blend (3:1:1),9/17/2019 8:00,9/17/2019 8:00,0.25,gal,10/15/2019 10:20,adminbomgb,1,1,1,0,{'2019-10-15 10:20:23': 1},1,0
508,Wichita KS,DefaultDept,(PL)Painting Ops-Bldg 14 South EU-NEWAEROPB4,Blend: XS420 Blend (3:1:1),9/23/2019 20:00,9/23/2019 20:00,0.25,gal,10/15/2019 10:22,adminbomgb,1,1,1,0,{'2019-10-15 10:22:43': 1},1,0
509,Wichita KS,DefaultDept,(PL)Painting Ops-Bldg 14 South EU-NEWAEROPB4,Blend: XS420 Blend (3:1:1),10/3/2019 12:00,10/3/2019 12:00,0.5,gal,12/19/2019 16:04,adminbomry,1,1,1,0,{'2019-12-19 16:04:12': 1},1,0
510,Wichita KS,DefaultDept,(PL)Painting Ops-Bldg 14 South EU-NEWAEROPB4,Blend: XS420 Blend (3:1:1),10/21/2019 12:00,10/21/2019 12:00,0.25,gal,12/19/2019 16:04,adminbomry,1,1,1,0,{'2019-12-19 16:04:12': 1},1,0
511,Wichita KS,DefaultDept,(PL)Painting Ops-Bldg 14 South EU-NEWAEROPB4,Blend: XS420 Blend (3:1:1),3/2/2020 17:30,3/2/2020 17:30,0.25,gal,8/26/2020 19:03,adminbomjs,1,1,1,0,{'2020-08-26 19:03:48': 1},1,0
512,Wichita KS,DefaultDept,(PL)Painting Ops-Bldg 14 South EU-NEWAEROPB4,Blend: XS420 Blend (3:1:1),5/11/2020 0:00,5/11/2020 0:00,0.15625,gal,6/19/2020 17:02,Kamiander,1,1,1,0,{'2020-06-19 17:02:21': 1},1,0
513,Wichita KS,DefaultDept,(PL)Painting Ops-Bldg 14 South EU-NEWAEROPB4,Blend: XS420 Blend (3:1:1),6/4/2020 0:00,6/4/2020 0:00,0.15625,gal,7/20/2020 10:55,Kamiander,1,1,1,0,{'2020-07-20 10:55:50': 1},1,0
514,Wichita KS,DefaultDept,(PL)Painting Ops-Bldg 14 South EU-NEWAEROPB4,Blend: XS420 Blend (3:1:1),7/13/2020 0:00,7/13/2020 0:00,0.0859375,gal,8/27/2020 9:25,Kamiander,1,1,1,0,{'2020-08-27 09:25:15': 1},1,0
515,Wichita KS,DefaultDept,(PL)Painting Ops-Bldg 14 South EU-NEWAEROPB4,Blend: XS420 Blend (3:1:1),7/16/2020 0:00,7/16/2020 0:00,0.109375,gal,8/27/2020 9:27,Kamiander,1,1,1,0,{'2020-08-27 09:27:00': 1},1,0
516,Wichita KS,DefaultDept,(PL)Painting Ops-Bldg 14 South EU-NEWAEROPB4,Blend: XS420 Blend (3:1:1),7/17/2020 0:00,7/17/2020 0:00,0.109375,gal,8/27/2020 9:28,Kamiander,1,1,1,0,{'2020-08-27 09:28:29': 1},1,0
517,Wichita KS,DefaultDept,(PL)Painting Ops-Bldg 14 South EU-NEWAEROPB4,Blend: XS420 Blend (3:1:1),8/10/2020 5:00,8/10/2020 5:00,0.25,gal,12/30/2020 14:35,dlyon,1,1,1,0,{'2020-12-30 14:35:26': 1},1,0
518,Wichita KS,DefaultDept,(PL)Painting Ops-Bldg 14 South EU-NEWAEROPB4,Blend: XS420 Blend (3:1:1),8/11/2020 5:30,8/11/2020 5:30,0.09375,gal,12/30/2020 14:38,dlyon,1,1,1,0,{'2020-12-30 14:38:37': 1},1,0
519,Wichita KS,DefaultDept,(PL)Painting Ops-Bldg 14 South EU-NEWAEROPB4,Blend: XS420 Blend (3:1:1),8/14/2020 9:00,8/14/2020 9:00,0.25,gal,12/30/2020 15:00,dlyon,1,1,1,0,{'2020-12-30 15:00:33': 1},1,0
520,Wichita KS,DefaultDept,(PL)Painting Ops-Bldg 14 South EU-NEWAEROPB4,Blend: XS420 Blend (3:1:1),9/2/2020 9:30,9/2/2020 9:30,0.25,gal,10/27/2020 15:23,dlyon,1,1,1,0,{'2020-10-27 15:23:31': 1},1,0
521,Wichita KS,DefaultDept,(PL)Painting Ops-Bldg 14 South EU-NEWAEROPB4,Blend: XS420 Blend (3:1:1),9/27/2020 6:00,9/27/2020 6:00,0.75,gal,10/27/2020 15:54,dlyon,1,1,1,0,{'2020-10-27 15:54:57': 1},1,0
522,Wichita KS,DefaultDept,(PL)Painting Ops-Bldg 14 South EU-NEWAEROPB4,CA 8000/IM215-CA 8800Z Activator - 8800CT3 THINNER,9/10/2020 12:00,9/10/2020 12:00,0.75,gal,10/28/2020 10:17,dlyon,1,1,1,0,{'2020-10-28 10:17:54': 1},1,0
523,Wichita KS,DefaultDept,(PL)Painting Ops-Bldg 14 South EU-NEWAEROPB4,CA8800 I2881 - CA8800Z - CA8800CT2 (2:1:1),11/17/2020 12:00,11/17/2020 12:00,1.5,gal,12/21/2020 12:09,dlyon,1,1,1,0,{'2020-12-21 12:09:40': 1},1,0
524,Wichita KS,DefaultDept,(PL)Painting Ops-Bldg 14 South EU-NEWAEROPB4,CM0483928 - CM0120828 - CM0110944,2/4/2020 11:05,2/4/2020 11:05,0.25,gal,8/26/2020 12:01,adminbomjs,1,1,1,0,{'2020-08-26 12:01:23': 1},1,0
525,Wichita KS,DefaultDept,(PL)Painting Ops-Bldg 14 South EU-NEWAEROPB4,CM0483928 - CM0120828 - CM0110944,3/3/2020 19:00,3/3/2020 19:00,6,gal,8/26/2020 14:22,adminbomjs,1,1,1,0,{'2020-08-26 14:22:38': 1},1,0
526,Wichita KS,DefaultDept,(PL)Painting Ops-Bldg 14 South EU-NEWAEROPB4,CM0483928 - CM0120828 - CM0110944,3/3/2020 23:54,3/3/2020 23:54,0.5,gal,8/26/2020 14:19,adminbomjs,1,1,1,0,{'2020-08-26 14:19:44': 1},1,0
527,Wichita KS,DefaultDept,(PL)Painting Ops-Bldg 14 South EU-NEWAEROPB4,CM0483928 - CM0120828 - CM0110944,3/14/2020 1:20,3/14/2020 1:20,1,gal,8/26/2020 18:33,adminbomjs,1,1,1,0,{'2020-08-26 18:33:09': 1},1,0
528,Wichita KS,DefaultDept,(PL)Painting Ops-Bldg 14 South EU-NEWAEROPB4,CM0483928 - CM0120828 - CM0110944,3/31/2020 14:00,3/31/2020 14:00,1.5,gal,8/26/2020 14:48,adminbomjs,1,1,1,0,{'2020-08-26 14:48:24': 1},1,0
529,Wichita KS,DefaultDept,(PL)Painting Ops-Bldg 15 Booth EU-NEWAEROPB1,Blend: 10P30-8 - EC-284 (1:1),8/12/2020 0:00,8/12/2020 0:00,0.015625,gal,10/15/2020 10:58,Kamiander,1,1,1,0,{'2020-10-15 10:58:50': 1},1,0
530,Wichita KS,DefaultDept,(PL)Painting Ops-Bldg 15 Booth EU-NEWAEROPB1,Blend: 10P30-8 - EC-284 (1:1),9/13/2020 0:00,9/13/2020 0:00,0.015625,gal,10/15/2020 11:01,Kamiander,1,1,1,0,{'2020-10-15 11:01:31': 1},1,0
531,Wichita KS,DefaultDept,(PL)Painting Ops-Bldg 15 Booth EU-NEWAEROPB1,Blend: 10P30-8 - EC-284 (1:1),9/22/2020 13:40,9/22/2020 13:40,0.015625,gal,11/4/2020 13:08,dlyon,1,1,1,0,{'2020-11-04 13:08:49': 1},1,0
532,Wichita KS,DefaultDept,(PL)Painting Ops-Bldg 7 DownstairEU NEWAEROPB10,8800 I1050 - CA 8800Z Activator- 8800CT2 THINNER,8/5/2020 0:00,8/5/2020 0:00,0.1875,gal,9/24/2020 11:33,Kamiander,1,1,1,0,{'2020-09-24 11:33:05': 1},1,0
533,Wichita KS,DefaultDept,(PL)Painting Ops-Bldg 7 DownstairEU NEWAEROPB10,8800 I1050 - CA 8800Z Activator- 8800CT2 THINNER,8/7/2020 0:00,8/7/2020 0:00,0.1875,gal,10/7/2020 14:58,adminbomry,1,1,1,0,{'2020-10-07 14:58:35': 1},1,0
534,Wichita KS,DefaultDept,(PL)Painting Ops-Bldg 7 DownstairEU NEWAEROPB10,8800 I1050 - CA 8800Z Activator- 8800CT2 THINNER,8/13/2020 0:00,8/13/2020 0:00,0.1875,gal,9/24/2020 11:36,Kamiander,1,1,1,0,{'2020-09-24 11:36:05': 1},1,0
535,Wichita KS,DefaultDept,(PL)Painting Ops-Bldg 7 DownstairEU NEWAEROPB10,8800 I1050 - CA 8800Z Activator- 8800CT2 THINNER,8/21/2020 0:00,8/21/2020 0:00,0.125,gal,9/24/2020 11:37,Kamiander,1,1,1,0,{'2020-09-24 11:37:28': 1},1,0
536,Wichita KS,DefaultDept,(PL)Painting Ops-Bldg 7 DownstairEU NEWAEROPB10,8800 I1050 - CA 8800Z Activator- 8800CT2 THINNER,8/24/2020 0:00,8/24/2020 0:00,0.1875,gal,9/24/2020 11:44,Kamiander,1,1,1,0,{'2020-09-24 11:44:18': 1},1,0
537,Wichita KS,DefaultDept,(PL)Painting Ops-Bldg 7 DownstairEU NEWAEROPB10,Blend: 1050 - 8800Z - 8800CT2 (2:1:1),5/7/2020 0:00,5/7/2020 0:00,0.125,gal,6/19/2020 9:42,Kamiander,1,1,1,0,{'2020-06-19 09:42:36': 1},1,0
538,Wichita KS,DefaultDept,(PL)Painting Ops-Bldg 7 DownstairEU NEWAEROPB10,Blend: 1050 - 8800Z - 8800CT2 (2:1:1),5/21/2020 0:00,5/21/2020 0:00,0.25,gal,6/19/2020 9:40,Kamiander,1,1,1,0,{'2020-06-19 09:40:59': 1},1,0
539,Wichita KS,DefaultDept,(PL)Painting Ops-Bldg 7 DownstairEU NEWAEROPB10,Blend: 1050 - 8800Z - 8800CT2 (2:1:1),5/22/2020 0:00,5/22/2020 0:00,0.125,gal,6/19/2020 9:32,Kamiander,1,1,1,0,{'2020-06-19 09:32:10': 1},1,0
540,Wichita KS,DefaultDept,(PL)Painting Ops-Bldg 7 DownstairEU NEWAEROPB10,Blend: 1050 - 8800Z - 8800CT2 (2:1:1),5/27/2020 0:00,5/27/2020 0:00,0.0625,gal,6/19/2020 9:30,Kamiander,1,1,1,0,{'2020-06-19 09:30:14': 1},1,0
541,Wichita KS,DefaultDept,(PL)Painting Ops-Bldg 7 DownstairEU NEWAEROPB10,Blend: 1050 - 8800Z - 8800CT2 (2:1:1),9/2/2020 0:00,9/2/2020 0:00,0.09375,gal,10/14/2020 9:53,Kamiander,1,1,1,0,{'2020-10-14 09:53:12': 1},1,0
542,Wichita KS,DefaultDept,(PL)Painting Ops-Bldg 7 DownstairEU NEWAEROPB10,Blend: 1050 - 8800Z - 8800CT2 (2:1:1),9/24/2020 0:00,9/24/2020 0:00,0.25,gal,10/14/2020 9:56,Kamiander,1,1,1,0,{'2020-10-14 09:56:10': 1},1,0
543,Wichita KS,DefaultDept,(PL)Painting Ops-Bldg 7 DownstairEU NEWAEROPB10,Blend: 1050 - 8800Z - 8800CT2 (2:1:1),10/19/2020 10:15,10/19/2020 10:15,0.125,gal,12/18/2020 8:38,dlyon,1,1,1,0,{'2020-12-18 08:38:32': 1},1,0
544,Wichita KS,DefaultDept,(PL)Painting Ops-Bldg 7 DownstairEU NEWAEROPB10,Blend: 1050 - 8800Z - 8800CT2 (2:1:1),10/22/2020 9:30,10/22/2020 9:30,0.1875,gal,12/18/2020 8:51,dlyon,1,1,1,0,{'2020-12-18 08:51:00': 1},1,0
545,Wichita KS,DefaultDept,(PL)Painting Ops-Bldg 7 DownstairEU NEWAEROPB10,Blend: 1050 - 8800Z - 8800CT2 (2:1:1),10/28/2020 8:35,10/28/2020 8:35,0.1875,gal,12/18/2020 8:48,dlyon,1,1,1,0,{'2020-12-18 08:48:41': 1},1,0
546,Wichita KS,DefaultDept,(PL)Painting Ops-Bldg 7 DownstairEU NEWAEROPB10,Blend: 1050 - 8800Z - 8800CT2 (2:1:1),11/3/2020 9:15,11/3/2020 9:15,0.1875,gal,12/18/2020 9:10,dlyon,1,1,1,0,{'2020-12-18 09:10:34': 1},1,0
547,Wichita KS,DefaultDept,(PL)Painting Ops-Bldg 7 DownstairEU NEWAEROPB10,Blend: 10P30-5 - TR-115 Reducer - EC-275 (3-1-0.5),1/28/2019 15:49,1/28/2019 15:49,0.03515625,gal,1/28/2019 15:49,adminbomcr,1,1,1,0,{'2019-01-28 15:49:58': 1},1,0
548,Wichita KS,DefaultDept,(PL)Painting Ops-Bldg 7 DownstairEU NEWAEROPB10,Blend: 10P8-10NF - EC-283 (1:1),9/17/2019 16:30,9/17/2019 16:30,0.0234375,gal,10/15/2019 14:32,adminbomgb,1,1,1,0,{'2019-10-15 14:32:15': 1},1,0
549,Wichita KS,DefaultDept,(PL)Painting Ops-Bldg 7 DownstairEU NEWAEROPB10,Blend: 10P8-10NF - EC-283 (1:1),5/7/2020 0:00,5/7/2020 0:00,0.0625,gal,6/19/2020 9:25,Kamiander,1,1,1,0,{'2020-06-19 09:25:16': 1},1,0
550,Wichita KS,DefaultDept,(PL)Painting Ops-Bldg 7 DownstairEU NEWAEROPB10,Blend: 10P8-10NF - EC-283 (1:1)_old,1/24/2019 15:36,1/24/2019 15:36,0.046875,gal,1/24/2019 15:36,adminbomna,1,1,1,0,{'2019-01-24 15:36:05': 1},1,0
551,Wichita KS,DefaultDept,(PL)Painting Ops-Bldg 7 DownstairEU NEWAEROPB10,Blend: 10P8-10NF - EC-283 (1:1)_old,1/24/2019 15:44,1/24/2019 15:44,0.03125,gal,1/24/2019 15:44,adminbomna,1,1,1,0,{'2019-01-24 15:44:55': 1},1,0
552,Wichita KS,DefaultDept,(PL)Painting Ops-Bldg 7 DownstairEU NEWAEROPB10,Blend: 10P8-10NF - EC-283 (1:1)_old,1/24/2019 15:53,1/24/2019 15:53,0.125,gal,1/24/2019 15:53,adminbomna,1,1,1,0,{'2019-01-24 15:53:49': 1},1,0
553,Wichita KS,DefaultDept,(PL)Painting Ops-Bldg 7 DownstairEU NEWAEROPB10,Blend: 10P8-10NF - EC-283 (1:1)_old,1/28/2019 9:32,1/28/2019 9:32,0.125,gal,1/28/2019 9:32,adminbomsn,1,1,1,0,{'2019-01-28 09:32:58': 1},1,0
554,Wichita KS,DefaultDept,(PL)Painting Ops-Bldg 7 DownstairEU NEWAEROPB10,Blend: 10P8-10NF - EC-283 (1:1)_old,1/28/2019 11:55,1/28/2019 11:55,0.015625,gal,1/28/2019 11:55,adminbomcr,1,1,1,0,{'2019-01-28 11:55:23': 1},1,0
555,Wichita KS,DefaultDept,(PL)Painting Ops-Bldg 7 DownstairEU NEWAEROPB10,Blend: 10P8-10NF - EC-283 (1:1)_old,1/28/2019 12:57,1/28/2019 12:57,0.0625,gal,1/28/2019 12:57,adminbomcr,1,1,1,0,{'2019-01-28 12:57:33': 1},1,0
556,Wichita KS,DefaultDept,(PL)Painting Ops-Bldg 7 DownstairEU NEWAEROPB10,Blend: 10P8-10NF - EC-283 (1:1)_old,7/24/2019 10:15,7/24/2019 10:15,0.1875,gal,8/21/2019 11:32,adminbomgb,1,1,1,0,{'2019-08-21 11:32:55': 1},1,0
557,Wichita KS,DefaultDept,(PL)Painting Ops-Bldg 7 DownstairEU NEWAEROPB10,Blend: 10P8-10NF - EC-283 (1:1)_old,7/26/2019 5:00,7/26/2019 5:00,0.0625,gal,8/21/2019 11:36,adminbomgb,1,1,1,0,{'2019-08-21 11:36:47': 1},1,0
558,Wichita KS,DefaultDept,(PL)Painting Ops-Bldg 7 DownstairEU NEWAEROPB10,Blend: 10P8-10NF - EC-283 (1:1)_old,7/29/2019 22:00,7/29/2019 22:00,0.125,gal,8/21/2019 11:42,adminbomgb,1,1,1,0,{'2019-08-21 11:42:01': 1},1,0
559,Wichita KS,DefaultDept,(PL)Painting Ops-Bldg 7 DownstairEU NEWAEROPB10,Blend: 10P8-10NF - EC-283 (1:1)_old,6/29/2020 0:00,6/29/2020 0:00,0.0625,gal,7/27/2020 17:03,Kamiander,1,1,1,0,{'2020-07-27 17:03:51': 1},1,0
560,Wichita KS,DefaultDept,(PL)Painting Ops-Bldg 7 DownstairEU NEWAEROPB10,Blend: 10P8-10NF - EC-283 (1:1)_old,8/4/2020 0:00,8/4/2020 0:00,0.03125,gal,10/12/2020 9:22,Kamiander,1,1,1,0,{'2020-10-12 09:22:47': 1},1,0
561,Wichita KS,DefaultDept,(PL)Painting Ops-Bldg 7 DownstairEU NEWAEROPB10,Blend: 10P8-10NF - EC-283 (1:1)_old,8/4/2020 0:00,8/4/2020 0:00,0.15625,gal,10/12/2020 9:25,Kamiander,1,1,1,0,{'2020-10-12 09:25:51': 1},1,0
562,Wichita KS,DefaultDept,(PL)Painting Ops-Bldg 7 DownstairEU NEWAEROPB10,Blend: 10P8-10NF - EC-283 (1:1)_old,8/12/2020 0:00,8/12/2020 0:00,0.1875,gal,10/12/2020 9:27,Kamiander,1,1,1,0,{'2020-10-12 09:27:13': 1},1,0
563,Wichita KS,DefaultDept,(PL)Painting Ops-Bldg 7 DownstairEU NEWAEROPB10,Blend: 10P8-10NF - EC-283 (1:1)_old,8/20/2020 0:00,8/20/2020 0:00,0.125,gal,10/12/2020 9:28,Kamiander,1,1,1,0,{'2020-10-12 09:28:38': 1},1,0
564,Wichita KS,DefaultDept,(PL)Painting Ops-Bldg 7 DownstairEU NEWAEROPB10,Blend: 10P8-10NF - EC-283 (1:1)_old,8/25/2020 0:00,8/25/2020 0:00,0.125,gal,10/12/2020 9:30,Kamiander,1,1,1,0,{'2020-10-12 09:30:20': 1},1,0
565,Wichita KS,DefaultDept,(PL)Painting Ops-Bldg 7 DownstairEU NEWAEROPB10,Blend: 10P8-10NF - EC-283 (1:1)_old,9/1/2020 0:00,9/1/2020 0:00,0.09375,gal,10/14/2020 9:51,Kamiander,1,1,1,0,{'2020-10-14 09:51:07': 1},1,0
566,Wichita KS,DefaultDept,(PL)Painting Ops-Bldg 7 DownstairEU NEWAEROPB10,Blend: 10P8-10NF - EC-283 (1:1)_old,9/23/2020 0:00,9/23/2020 0:00,0.1875,gal,10/14/2020 9:54,Kamiander,1,1,1,0,{'2020-10-14 09:54:34': 1},1,0
567,Wichita KS,DefaultDept,(PL)Painting Ops-Bldg 7 DownstairEU NEWAEROPB10,Blend: 10P8-10NF - EC-283 (1:1)_old,10/16/2020 13:00,10/16/2020 13:00,0.125,gal,12/18/2020 8:30,dlyon,1,1,1,0,{'2020-12-18 08:30:08': 1},1,0
568,Wichita KS,DefaultDept,(PL)Painting Ops-Bldg 7 DownstairEU NEWAEROPB10,Blend: 10P8-10NF - EC-283 (1:1)_old,10/21/2020 9:15,10/21/2020 9:15,0.25,gal,12/18/2020 8:42,dlyon,1,1,1,0,{'2020-12-18 08:42:13': 1},1,0
569,Wichita KS,DefaultDept,(PL)Painting Ops-Bldg 7 DownstairEU NEWAEROPB10,Blend: 10P8-10NF - EC-283 (1:1)_old,10/27/2020 11:00,10/27/2020 11:00,0.1875,gal,12/18/2020 8:46,dlyon,1,1,1,0,{'2020-12-18 08:46:37': 1},1,0
570,Wichita KS,DefaultDept,(PL)Painting Ops-Bldg 7 DownstairEU NEWAEROPB10,Blend: 10P8-10NF - EC-283 (1:1)_old,11/2/2020 8:00,11/2/2020 8:00,0.1875,gal,12/18/2020 9:08,dlyon,1,1,1,0,{'2020-12-18 09:08:05': 1},1,0
571,Wichita KS,DefaultDept,(PL)Painting Ops-Bldg 7 DownstairEU NEWAEROPB10,Blend: 10P8-10NF - EC-283 (1:1)_old,11/10/2020 7:30,11/10/2020 7:30,0.09375,gal,12/18/2020 9:12,dlyon,1,1,1,0,{'2020-12-18 09:12:35': 1},1,0
572,Wichita KS,DefaultDept,(PL)Painting Ops-Bldg 7 DownstairEU NEWAEROPB10,Blend: A02188 - CM0830081 - CM0830H18 (3:1:3/8),9/16/2019 7:45,9/16/2019 7:45,0.037109375,gal,10/15/2019 14:45,adminbomgb,1,1,1,0,{'2019-10-15 14:45:34': 1},1,0
573,Wichita KS,DefaultDept,(PL)Painting Ops-Bldg 7 DownstairEU NEWAEROPB10,Blend: A02188 - CM0830081 - CM0830H18 (3:1:3/8),9/20/2019 7:45,9/20/2019 7:45,0.037109375,gal,10/15/2019 14:49,adminbomgb,1,1,1,0,{'2019-10-15 14:49:02': 1},1,0
574,Wichita KS,DefaultDept,(PL)Painting Ops-Bldg 7 DownstairEU NEWAEROPB10,Blend: CA8800 - CA8800CT2 - CA8800Z (2:1:1),7/19/2019 11:52,7/19/2019 11:52,0.03125,gal,7/19/2019 11:56,adminbomgb,1,1,1,0,{'2019-07-19 11:56:20': 1},1,0
575,Wichita KS,DefaultDept,(PL)Painting Ops-Bldg 7 DownstairEU NEWAEROPB10,Blend: CA8800 - CA8800CT2 - CA8800Z (2:1:1),7/19/2019 11:55,7/19/2019 11:55,0.015625,gal,7/19/2019 11:55,adminbomgb,1,1,1,0,{'2019-07-19 11:55:26': 1},1,0
576,Wichita KS,DefaultDept,(PL)Painting Ops-Bldg 7 DownstairEU NEWAEROPB10,Blend: CA8800 - CA8800CT2 - CA8800Z (2:1:1),10/31/2019 12:00,10/31/2019 12:00,0.25,gal,12/19/2019 16:04,adminbomry,1,1,1,0,{'2019-12-19 16:04:12': 1},1,0
577,Wichita KS,DefaultDept,(PL)Painting Ops-Bldg 7 DownstairEU NEWAEROPB10,Blend: CA8800 - CA8800CT2 - CA8800Z (2:1:1),6/17/2020 0:00,6/17/2020 0:00,0.21875,gal,7/27/2020 17:01,Kamiander,1,1,1,0,{'2020-07-27 17:01:44': 1},1,0
578,Wichita KS,DefaultDept,(PL)Painting Ops-Bldg 7 DownstairEU NEWAEROPB10,Blend: CA8800/F16473 - CA8800Z - CA8800CT2 (2-1-1),1/24/2019 16:16,1/24/2019 16:16,0.375,gal,1/24/2019 16:16,adminbomna,1,1,1,0,{'2019-01-24 16:16:51': 1},1,0
579,Wichita KS,DefaultDept,(PL)Painting Ops-Bldg 7 DownstairEU NEWAEROPB10,Blend: CA8800/F16473 - CA8800Z - CA8800CT2 (2-1-1),1/24/2019 16:39,1/24/2019 16:39,0.25,gal,1/24/2019 16:39,adminbomsn,1,1,1,0,{'2019-01-24 16:39:04': 1},1,0
580,Wichita KS,DefaultDept,(PL)Painting Ops-Bldg 7 DownstairEU NEWAEROPB10,Blend: CA8800/F16473 - CA8800Z - CA8800CT2 (2-1-1),7/19/2019 13:30,7/19/2019 13:30,0.125,gal,7/19/2019 13:30,adminbomgb,1,1,1,0,{'2019-07-19 13:30:06': 1},1,0
581,Wichita KS,DefaultDept,(PL)Painting Ops-Bldg 7 DownstairEU NEWAEROPB10,Blend: CA8800/F16473 - CA8800Z - CA8800CT2 (2-1-1),7/19/2019 13:32,7/19/2019 13:32,0.0625,gal,7/19/2019 13:32,adminbomgb,1,1,1,0,{'2019-07-19 13:32:00': 1},1,0
582,Wichita KS,DefaultDept,(PL)Painting Ops-Bldg 7 DownstairEU NEWAEROPB10,Blend: CA8800/F16473 - CA8800Z - CA8800CT2 (2-1-1),7/19/2019 13:43,7/19/2019 13:43,0.03125,gal,7/19/2019 13:43,adminbomgb,1,1,1,0,{'2019-07-19 13:43:24': 1},1,0
583,Wichita KS,DefaultDept,(PL)Painting Ops-Bldg 7 DownstairEU NEWAEROPB10,Blend: CA8800/F16473 - CA8800Z - CA8800CT2 (2-1-1),8/7/2019 23:00,8/7/2019 23:00,0.125,gal,9/17/2019 9:55,adminbomgb,1,1,1,0,{'2019-09-17 09:55:11': 1},1,0
584,Wichita KS,DefaultDept,(PL)Painting Ops-Bldg 7 DownstairEU NEWAEROPB10,Blend: CA8800/F16473 - CA8800Z - CA8800CT2 (2-1-1),8/16/2019 8:00,8/16/2019 8:00,0.125,gal,9/17/2019 9:59,adminbomgb,1,1,1,0,{'2019-09-17 09:59:38': 1},1,0
585,Wichita KS,DefaultDept,(PL)Painting Ops-Bldg 7 DownstairEU NEWAEROPB10,Blend: CA8800/F16473 - CA8800Z - CA8800CT2 (2-1-1),6/29/2020 0:00,6/29/2020 0:00,0.25,gal,7/27/2020 17:05,Kamiander,1,1,1,0,{'2020-07-27 17:05:39': 1},1,0
586,Wichita KS,DefaultDept,(PL)Painting Ops-Bldg 7 DownstairEU NEWAEROPB10,Blend: CA8800/I1050 - CA8800Z - CA8800CT2 (2-1-1),1/24/2019 15:08,1/24/2019 15:08,0.0625,gal,1/24/2019 15:08,adminbomna,1,1,1,0,{'2019-01-24 15:08:26': 1},1,0
587,Wichita KS,DefaultDept,(PL)Painting Ops-Bldg 7 DownstairEU NEWAEROPB10,Blend: CA8800/I1050 - CA8800Z - CA8800CT2 (2-1-1),7/18/2019 23:00,7/18/2019 23:00,0.25,gal,8/21/2019 11:23,adminbomgb,1,1,1,0,{'2019-08-21 11:23:12': 1},1,0
588,Wichita KS,DefaultDept,(PL)Painting Ops-Bldg 7 DownstairEU NEWAEROPB10,Blend: CA8800/I1050 - CA8800Z - CA8800CT2 (2-1-1),7/19/2019 11:50,7/19/2019 11:50,0.25,gal,7/19/2019 11:53,adminbomgb,1,1,1,0,{'2019-07-19 11:53:09': 1},1,0
589,Wichita KS,DefaultDept,(PL)Painting Ops-Bldg 7 DownstairEU NEWAEROPB10,Blend: CA8800/I1050 - CA8800Z - CA8800CT2 (2-1-1),7/19/2019 13:46,7/19/2019 13:46,0.0625,gal,7/19/2019 13:46,adminbomgb,1,1,1,0,{'2019-07-19 13:46:50': 1},1,0
590,Wichita KS,DefaultDept,(PL)Painting Ops-Bldg 7 DownstairEU NEWAEROPB10,Blend: CA8800/I1050 - CA8800Z - CA8800CT2 (2-1-1),7/19/2019 13:49,7/19/2019 13:49,0.125,gal,7/19/2019 13:49,adminbomgb,1,1,1,0,{'2019-07-19 13:49:04': 1},1,0
591,Wichita KS,DefaultDept,(PL)Painting Ops-Bldg 7 DownstairEU NEWAEROPB10,Blend: CA8800/I1050 - CA8800Z - CA8800CT2 (2-1-1),7/19/2019 14:02,7/19/2019 14:02,0.03125,gal,7/19/2019 14:02,adminbomgb,1,1,1,0,{'2019-07-19 14:02:02': 1},1,0
592,Wichita KS,DefaultDept,(PL)Painting Ops-Bldg 7 DownstairEU NEWAEROPB10,Blend: CA8800/I1050 - CA8800Z - CA8800CT2 (2-1-1),7/19/2019 14:07,7/19/2019 14:07,0.703125,gal,7/19/2019 14:07,adminbomgb,1,1,1,0,{'2019-07-19 14:07:30': 1},1,0
593,Wichita KS,DefaultDept,(PL)Painting Ops-Bldg 7 DownstairEU NEWAEROPB10,Blend: CA8800/I1050 - CA8800Z - CA8800CT2 (2-1-1),7/19/2019 14:13,7/19/2019 14:13,0.25,gal,7/19/2019 14:13,adminbomgb,1,1,1,0,{'2019-07-19 14:13:53': 1},1,0
594,Wichita KS,DefaultDept,(PL)Painting Ops-Bldg 7 DownstairEU NEWAEROPB10,Blend: CA8800/I1050 - CA8800Z - CA8800CT2 (2-1-1),8/2/2019 13:30,8/2/2019 13:30,0.0625,gal,9/17/2019 9:52,adminbomgb,1,1,1,0,{'2019-09-17 09:52:47': 1},1,0
595,Wichita KS,DefaultDept,(PL)Painting Ops-Bldg 7 DownstairEU NEWAEROPB10,Blend: CA8800/I1050 - CA8800Z - CA8800CT2 (2-1-1),8/23/2019 21:00,8/23/2019 21:00,0.15625,gal,9/17/2019 10:00,adminbomgb,1,1,1,0,{'2019-09-17 10:00:56': 1},1,0
596,Wichita KS,DefaultDept,(PL)Painting Ops-Bldg 7 DownstairEU NEWAEROPB10,Blend: CA8800/I1050 - CA8800Z - CA8800CT2 (2-1-1),8/27/2019 8:00,8/27/2019 8:00,0.125,gal,9/17/2019 10:02,adminbomgb,1,1,1,0,{'2019-09-17 10:02:28': 1},1,0
597,Wichita KS,DefaultDept,(PL)Painting Ops-Bldg 7 DownstairEU NEWAEROPB10,Blend: CA8800/I1050 - CA8800Z - CA8800CT2 (2-1-1),1/14/2020 22:00,1/14/2020 22:00,0.125,gal,4/28/2020 16:11,adminbomjs,1,1,1,0,{'2020-04-28 16:11:37': 1},1,0
598,Wichita KS,DefaultDept,(PL)Painting Ops-Bldg 7 DownstairEU NEWAEROPB10,Blend: CA8800/I1050 - CA8800Z - CA8800CT2 (2-1-1),1/26/2020 18:00,1/26/2020 18:00,0.125,gal,4/28/2020 16:15,adminbomjs,1,1,1,0,{'2020-04-28 16:15:31': 1},1,0
599,Wichita KS,DefaultDept,(PL)Painting Ops-Bldg 7 DownstairEU NEWAEROPB10,Blend: CA8800/I1050 - CA8800Z - CA8800CT3 (2-1-1),1/24/2019 16:53,1/24/2019 16:53,0.03125,gal,1/24/2019 16:53,adminbomsn,1,1,1,0,{'2019-01-24 16:53:05': 1},1,0
600,Wichita KS,DefaultDept,(PL)Painting Ops-Bldg 7 DownstairEU NEWAEROPB10,Blend: CA8800/I1050 - CA8800Z - CA8800CT3 (2-1-1),1/28/2019 13:13,1/28/2019 13:13,0.0625,gal,1/28/2019 13:13,adminbomcr,1,1,1,0,{'2019-01-28 13:13:44': 1},1,0
601,Wichita KS,DefaultDept,(PL)Painting Ops-Bldg 7 DownstairEU NEWAEROPB10,Blend: CM0830080 - CM0830081 - CM0830H18 (3-1-0.375),7/19/2019 13:16,7/19/2019 13:16,0.034179688,gal,7/19/2019 13:16,adminbomgb,1,1,1,0,{'2019-07-19 13:16:05': 1},1,0
602,Wichita KS,DefaultDept,(PL)Painting Ops-Bldg 7 DownstairEU NEWAEROPB10,Blend: CM0830080 - CM0830081 - CM0830H18 - CM0110944 (3-1-0.5-0.5),7/26/2019 12:00,7/26/2019 12:00,0.078125,gal,8/21/2019 11:40,adminbomgb,1,1,1,0,{'2019-08-21 11:40:10': 1},1,0
603,Wichita KS,DefaultDept,(PL)Painting Ops-Bldg 7 DownstairEU NEWAEROPB10,Blend: CM0830080 - CM0830081 - CM0830H18 - CM0110944 (3-1-0.5-0.5),7/29/2019 22:00,7/29/2019 22:00,0.078125,gal,8/21/2019 11:46,adminbomgb,1,1,1,0,{'2019-08-21 11:46:17': 1},1,0
604,Wichita KS,DefaultDept,(PL)Painting Ops-Bldg 7 DownstairEU NEWAEROPB10,Blend: CM0830080 - CM0830081 - CM0830H18 - CM0110944 (3-1-0.5-0.5),8/4/2020 0:00,8/4/2020 0:00,0.078125,gal,9/24/2020 11:30,Kamiander,1,1,1,0,{'2020-09-24 11:30:59': 1},1,0
605,Wichita KS,DefaultDept,(PL)Painting Ops-Bldg 7 DownstairEU NEWAEROPB10,Blend: CM0830080 - CM0830081 - CM0830H18 - CM0110944 (3:1:1/2:1/2),9/17/2019 20:30,9/17/2019 20:30,0.0234375,gal,10/15/2019 14:38,adminbomgb,1,1,1,0,{'2019-10-15 14:38:58': 1},1,0
606,Wichita KS,DefaultDept,(PL)Painting Ops-Bldg 7 DownstairEU NEWAEROPB10,Blend: CM0830081 - CM0110944 - CM0840103 - (2:1:1),11/11/2020 7:15,11/11/2020 7:15,0.0625,gal,12/18/2020 9:42,dlyon,1,1,1,0,{'2020-12-18 09:42:24': 1},1,0
607,Wichita KS,DefaultDept,(PL)Painting Ops-Bldg 7 DownstairEU NEWAEROPB10,Blend: M06025 - CM0830991 - CM0110944 - CM0830081 - (4:1:2:1),9/17/2019 18:30,9/17/2019 18:30,0.03125,gal,10/15/2019 14:35,adminbomgb,1,1,1,0,{'2019-10-15 14:35:29': 1},1,0
608,Wichita KS,DefaultDept,(PL)Painting Ops-Bldg 7 DownstairEU NEWAEROPB10,Blend: M06025 - CM0830991 - CM0110944 - CM0830081 - (4:1:2:1),8/4/2020 0:00,8/4/2020 0:00,0.0625,gal,9/24/2020 11:23,Kamiander,1,1,1,0,{'2020-09-24 11:23:39': 1},1,0
609,Wichita KS,DefaultDept,(PL)Painting Ops-Bldg 7 DownstairEU NEWAEROPB10,Blend: M06025 1750465 - CM0830991 - CM0830081 - CM0110944 (2:2:1:1),7/19/2019 13:59,7/19/2019 13:59,0.046875,gal,7/19/2019 13:59,adminbomgb,1,1,1,0,{'2019-07-19 13:59:43': 1},1,0
610,Wichita KS,DefaultDept,(PL)Painting Ops-Bldg 7 DownstairEU NEWAEROPB10,Blend: M06025 1750465 - CM0830991 - CM0830081 - CM0110944 (4-2-1-1),7/19/2019 13:12,7/19/2019 13:12,0.0625,gal,7/19/2019 13:12,adminbomgb,1,1,1,0,{'2019-07-19 13:12:42': 1},1,0
611,Wichita KS,DefaultDept,(PL)Painting Ops-Bldg 7 DownstairEU NEWAEROPB10,Blend: M06025 1750465 - CM0830991 - CM0830081 - CM0110944 (4-2-1-1),7/24/2019 13:20,7/24/2019 13:20,0.1875,gal,8/21/2019 11:34,adminbomgb,1,1,1,0,{'2019-08-21 11:34:36': 1},1,0
612,Wichita KS,DefaultDept,(PL)Painting Ops-Bldg 7 DownstairEU NEWAEROPB10,Blend: M06025 1750465 - CM0830991 - CM0830081 - CM0110944 (4-2-1-1),7/26/2019 7:00,7/26/2019 7:00,0.0625,gal,8/21/2019 11:38,adminbomgb,1,1,1,0,{'2019-08-21 11:38:26': 1},1,0
613,Wichita KS,DefaultDept,(PL)Painting Ops-Bldg 7 DownstairEU NEWAEROPB10,Blend: M06025 1750465 - CM0830991 - CM0830081 - CM0110944 (4-2-1-1),7/29/2019 22:00,7/29/2019 22:00,0.125,gal,8/21/2019 11:44,adminbomgb,1,1,1,0,{'2019-08-21 11:44:10': 1},1,0
614,Wichita KS,DefaultDept,(PL)Painting Ops-Bldg 7 DownstairEU NEWAEROPB10,Blend: N381-9217 - CM0830081 - CM0830H18 (3-1-0.375),1/28/2019 9:25,1/28/2019 9:25,0.0234375,gal,1/28/2019 9:25,adminbomsn,1,1,1,0,{'2019-01-28 09:25:46': 1},1,0
615,Wichita KS,DefaultDept,(PL)Painting Ops-Bldg 7 DownstairEU NEWAEROPB10,Blend: N381-9217 - CM0830081 - CM0830H18 (3-1-0.375),1/28/2019 10:15,1/28/2019 10:15,0.01953125,gal,1/28/2019 10:15,adminbomcr,1,1,1,0,{'2019-01-28 10:15:07': 1},1,0
616,Wichita KS,DefaultDept,(PL)Painting Ops-Bldg 7 DownstairEU NEWAEROPB10,CA 8000 IM6066 Base - CA 8800Z Activator - CA 8800CT2 Thinner,1/25/2019 8:34,1/25/2019 8:34,0.046875,gal,1/25/2019 8:34,adminbomcr,1,1,1,0,{'2019-01-25 08:34:34': 1},1,0
617,Wichita KS,DefaultDept,(PL)Painting Ops-Bldg 7 DownstairEU NEWAEROPB10,CA 8800/F16473 Base Component - CA 8800Z Activator - CA 8800CT2 Thinner Blend,1/28/2019 9:25,1/28/2019 9:25,0.0625,gal,1/28/2019 9:25,adminbomcr,1,1,1,0,{'2019-01-28 09:25:43': 1},1,0
618,Wichita KS,DefaultDept,(PL)Painting Ops-Bldg 7 DownstairEU NEWAEROPB10,CA 8800/F16473 Base Component - CA 8800Z Activator - CA 8800CT2 Thinner Blend,1/28/2019 13:04,1/28/2019 13:04,0.078125,gal,1/28/2019 13:04,adminbomcr,1,1,1,0,{'2019-01-28 13:04:38': 1},1,0
619,Wichita KS,DefaultDept,(PL)Painting Ops-Bldg 7 DownstairEU NEWAEROPB10,CA 8800/F16473 Base Component - CA 8800Z Activator - CA 8800CT2 Thinner Blend,1/28/2019 13:22,1/28/2019 13:22,0.125,gal,1/28/2019 13:23,adminbomcr,1,1,1,0,{'2019-01-28 13:23:02': 1},1,0
620,Wichita KS,DefaultDept,(PL)Painting Ops-Bldg 7 DownstairEU NEWAEROPB10,CA 8800/F16473 Base Component - CA 8800Z Activator - CA 8800CT3 Thinner Blend,1/24/2019 16:36,1/24/2019 16:36,0.125,gal,1/24/2019 16:36,adminbomna,1,1,1,0,{'2019-01-24 16:36:49': 1},1,0
621,Wichita KS,DefaultDept,(PL)Painting Ops-Bldg 7 DownstairEU NEWAEROPB10,CA 8800/F16473 Base Component - CA 8800Z Activator - CA 8800CT3 Thinner Blend,1/25/2019 8:43,1/25/2019 8:43,0.1875,gal,1/25/2019 8:43,adminbomcr,1,1,1,0,{'2019-01-25 08:43:32': 1},1,0
622,Wichita KS,DefaultDept,(PL)Painting Ops-Bldg 7 DownstairEU NEWAEROPB10,CA 8800/I1010 BASE COMPONENT - CA 8800Z Activator - CA 8800CT2,1/25/2019 8:39,1/25/2019 8:39,0.046875,gal,1/25/2019 8:39,adminbomcr,1,1,1,0,{'2019-01-25 08:39:38': 1},1,0
623,Wichita KS,DefaultDept,(PL)Painting Ops-Bldg 7 DownstairEU NEWAEROPB10,CA8800 I2922 Gloss Gray - CA 8800Z Activator - 8800CT2 THINNER,5/14/2020 0:00,5/14/2020 0:00,0.09375,gal,6/19/2020 13:32,Kamiander,1,1,1,0,{'2020-06-19 13:32:32': 1},1,0
624,Wichita KS,DefaultDept,(PL)Painting Ops-Bldg 7 DownstairEU NEWAEROPB10,CA8800 I2922 Gloss Gray - CA 8800Z Activator - 8800CT2 THINNER,5/15/2020 0:00,5/15/2020 0:00,0.046875,gal,6/19/2020 13:34,Kamiander,1,1,1,0,{'2020-06-19 13:34:31': 1},1,0
625,Wichita KS,DefaultDept,(PL)Painting Ops-Bldg 7 TR Shop Booth EU-AEROPB,17875 White Base - CM0830081 Hardener - CM0830H18 Activator - CM0110944 Reducer Blend,1/25/2019 16:26,1/25/2019 16:26,0.038085938,gal,1/25/2019 16:26,adminbomna,1,1,1,0,{'2019-01-25 16:26:47': 1},1,0
626,Wichita KS,DefaultDept,(PL)Painting Ops-Bldg 7 TR Shop Booth EU-AEROPB,17875 White Base - CM0830H18 Activator - CM0830081 Hardener Blend,1/28/2019 12:03,1/28/2019 12:03,0.0078125,gal,1/28/2019 12:04,adminbomna,1,1,1,0,{'2019-01-28 12:04:02': 1},1,0
627,Wichita KS,DefaultDept,(PL)Painting Ops-Bldg 7 TR Shop Booth EU-AEROPB,17875 White Base - CM0830H18 Activator - CM0830081 Hardener Blend,1/28/2019 13:34,1/28/2019 13:34,0.0234375,gal,1/28/2019 13:34,adminbommg,1,1,1,0,{'2019-01-28 13:34:25': 1},1,0
628,Wichita KS,DefaultDept,(PL)Painting Ops-Bldg 7 TR Shop Booth EU-AEROPB,8800 I1050 - CA 8800Z Activator- 8800CT THINNER,5/11/2020 0:00,5/11/2020 0:00,0.0625,gal,8/25/2020 10:17,Kamiander,1,1,1,0,{'2020-08-25 10:17:17': 1},1,0
629,Wichita KS,DefaultDept,(PL)Painting Ops-Bldg 7 TR Shop Booth EU-AEROPB,8800 I1050 - CA 8800Z Activator- 8800CT THINNER,5/20/2020 0:00,5/20/2020 0:00,0.09375,gal,8/25/2020 10:22,Kamiander,1,1,1,0,{'2020-08-25 10:22:56': 1},1,0
630,Wichita KS,DefaultDept,(PL)Painting Ops-Bldg 7 TR Shop Booth EU-AEROPB,8800 I1050 - CA 8800Z Activator- 8800CT2 THINNER,6/6/2020 0:00,6/6/2020 0:00,0.125,gal,8/25/2020 10:25,Kamiander,1,1,1,0,{'2020-08-25 10:25:57': 1},1,0
631,Wichita KS,DefaultDept,(PL)Painting Ops-Bldg 7 TR Shop Booth EU-AEROPB,8800 I1050 - CA 8800Z Activator- 8800CT2 THINNER,6/8/2020 0:00,6/8/2020 0:00,0.125,gal,8/25/2020 10:27,Kamiander,1,1,1,0,{'2020-08-25 10:27:16': 1},1,0
632,Wichita KS,DefaultDept,(PL)Painting Ops-Bldg 7 TR Shop Booth EU-AEROPB,8800 I1050 - CA 8800Z Activator- 8800CT2 THINNER,6/9/2020 0:00,6/9/2020 0:00,0.125,gal,8/25/2020 10:28,Kamiander,1,1,1,0,{'2020-08-25 10:28:39': 1},1,0
633,Wichita KS,DefaultDept,(PL)Painting Ops-Bldg 7 TR Shop Booth EU-AEROPB,8800 I1050 - CA 8800Z Activator- 8800CT2 THINNER,6/30/2020 0:00,6/30/2020 0:00,0.046875,gal,8/25/2020 10:30,Kamiander,1,1,1,0,{'2020-08-25 10:30:05': 1},1,0
634,Wichita KS,DefaultDept,(PL)Painting Ops-Bldg 7 TR Shop Booth EU-AEROPB,A01955/17038 - CM0830081 - CM0830H18 - CM0110944 ( 3:1:3/8:1),5/15/2020 0:00,5/15/2020 0:00,0.041992188,gal,7/20/2020 14:47,Kamiander,1,1,1,0,{'2020-07-20 14:47:15': 1},1,0
635,Wichita KS,DefaultDept,(PL)Painting Ops-Bldg 7 TR Shop Booth EU-AEROPB,A01955/17038 - CM0830081 - CM0830H18 - CM0110944 ( 3:1:3/8:1),5/29/2020 0:00,5/29/2020 0:00,0.020996094,gal,7/20/2020 14:43,Kamiander,1,1,1,0,{'2020-07-20 14:43:20': 1},1,0
636,Wichita KS,DefaultDept,(PL)Painting Ops-Bldg 7 TR Shop Booth EU-AEROPB,A01955/17038 - CM0830081 - CM0830H18 - CM0110944 ( 3:1:3/8:1),6/22/2020 0:00,6/22/2020 0:00,0.041992188,gal,8/11/2020 11:09,Kamiander,1,1,1,0,{'2020-08-11 11:09:40': 1},1,0
637,Wichita KS,DefaultDept,(PL)Painting Ops-Bldg 7 TR Shop Booth EU-AEROPB,A01955/17038 - CM0830081 - CM0830H18 - CM0110944 ( 3:1:3/8:1),8/21/2020 0:00,8/21/2020 0:00,0.041992188,gal,10/12/2020 10:57,Kamiander,1,1,1,0,{'2020-10-12 10:57:57': 1},1,0
638,Wichita KS,DefaultDept,(PL)Painting Ops-Bldg 7 TR Shop Booth EU-AEROPB,ACRY GLO CM0830080(3oz) - CM0830081 Hardener(1oz) - CM0830H18 Activator(1oz) Blend,1/28/2019 17:23,1/28/2019 17:23,0.03125,gal,1/28/2019 17:23,adminbomcr,1,1,1,0,{'2019-01-28 17:23:05': 1},1,0
639,Wichita KS,DefaultDept,(PL)Painting Ops-Bldg 7 TR Shop Booth EU-AEROPB,Blend: 1050 - 8800Z - 8800CT2 (2:1:1),4/23/2020 0:00,4/23/2020 0:00,0.03125,gal,6/10/2020 10:19,Kamiander,1,1,1,0,{'2020-06-10 10:19:50': 1},1,0
640,Wichita KS,DefaultDept,(PL)Painting Ops-Bldg 7 TR Shop Booth EU-AEROPB,Blend: 1050 - 8800Z - 8800CT2 (2:1:1),6/2/2020 0:00,6/2/2020 0:00,0.09375,gal,7/28/2020 15:17,Kamiander,1,1,1,0,{'2020-07-28 15:17:03': 1},1,0
641,Wichita KS,DefaultDept,(PL)Painting Ops-Bldg 7 TR Shop Booth EU-AEROPB,Blend: 1050 - 8800Z - 8800CT2 (2:1:1),8/28/2020 0:00,8/28/2020 0:00,0.09375,gal,10/12/2020 10:45,Kamiander,1,1,1,0,{'2020-10-12 10:45:04': 1},1,0
642,Wichita KS,DefaultDept,(PL)Painting Ops-Bldg 7 TR Shop Booth EU-AEROPB,Blend: 1050 - 8800Z - 8800CT2 (2:1:1),9/16/2020 0:00,9/16/2020 0:00,0.0625,gal,10/14/2020 10:40,Kamiander,1,1,1,0,{'2020-10-14 10:40:32': 1},1,0
643,Wichita KS,DefaultDept,(PL)Painting Ops-Bldg 7 TR Shop Booth EU-AEROPB,Blend: 1050 - 8800Z - CT-1 (2:1:1),4/1/2020 0:00,4/1/2020 0:00,0.0390625,gal,6/10/2020 9:54,Kamiander,1,1,1,0,{'2020-06-10 09:54:35': 1},1,0
644,Wichita KS,DefaultDept,(PL)Painting Ops-Bldg 7 TR Shop Booth EU-AEROPB,Blend: 1050 - 8800Z - CT-1 (2:1:1),4/9/2020 0:00,4/9/2020 0:00,0.0390625,gal,6/10/2020 9:59,Kamiander,1,1,1,0,{'2020-06-10 09:59:53': 1},1,0
645,Wichita KS,DefaultDept,(PL)Painting Ops-Bldg 7 TR Shop Booth EU-AEROPB,Blend: 1050 - 8800Z - CT-1 (2:1:1),4/24/2020 0:00,4/24/2020 0:00,0.0390625,gal,6/10/2020 10:09,Kamiander,1,1,1,0,{'2020-06-10 10:09:55': 1},1,0
646,Wichita KS,DefaultDept,(PL)Painting Ops-Bldg 7 TR Shop Booth EU-AEROPB,Blend: 1050 - 8800Z - CT-1 (2:1:1),4/27/2020 0:00,4/27/2020 0:00,0.0390625,gal,6/10/2020 10:11,Kamiander,1,1,1,0,{'2020-06-10 10:11:21': 1},1,0
647,Wichita KS,DefaultDept,(PL)Painting Ops-Bldg 7 TR Shop Booth EU-AEROPB,Blend: 1050 - 8800Z - CT-1 (2:1:1),4/30/2020 0:00,4/30/2020 0:00,0.0390625,gal,6/10/2020 10:13,Kamiander,1,1,1,0,{'2020-06-10 10:13:58': 1},1,0
648,Wichita KS,DefaultDept,(PL)Painting Ops-Bldg 7 TR Shop Booth EU-AEROPB,Blend: 1050 - 8800Z - CT-1 (2:1:1),6/2/2020 0:00,6/2/2020 0:00,0.0390625,gal,6/10/2020 9:58,Kamiander,1,1,1,0,{'2020-06-10 09:58:21': 1},1,0
649,Wichita KS,DefaultDept,(PL)Painting Ops-Bldg 7 TR Shop Booth EU-AEROPB,Blend: 1050 - 8800Z - CT-1 (2:1:1),6/11/2020 0:00,6/11/2020 0:00,0.0625,gal,6/10/2020 10:05,Kamiander,1,1,1,0,{'2020-06-10 10:05:19': 1},1,0
650,Wichita KS,DefaultDept,(PL)Painting Ops-Bldg 7 TR Shop Booth EU-AEROPB,Blend: 10P30-5 - TR-115 Reducer - EC-275 (3-1-0.5),1/25/2019 11:59,1/25/2019 11:59,0.03515625,gal,1/25/2019 11:59,adminbomna,1,1,1,0,{'2019-01-25 11:59:08': 1},1,0
651,Wichita KS,DefaultDept,(PL)Painting Ops-Bldg 7 TR Shop Booth EU-AEROPB,Blend: 10P30-8 - EC-284 (1:1),9/14/2020 0:00,9/14/2020 0:00,0.015625,gal,10/15/2020 11:04,Kamiander,1,1,1,0,{'2020-10-15 11:04:00': 1},1,0
652,Wichita KS,DefaultDept,(PL)Painting Ops-Bldg 7 TR Shop Booth EU-AEROPB,Blend: 10P8-10NF - EC-283 (1:1),8/2/2019 9:30,8/2/2019 9:30,0.125,gal,9/17/2019 15:21,adminbomgb,1,1,1,0,{'2019-09-17 15:21:46': 1},1,0
653,Wichita KS,DefaultDept,(PL)Painting Ops-Bldg 7 TR Shop Booth EU-AEROPB,Blend: 10P8-10NF - EC-283 (1:1),8/2/2019 16:30,8/2/2019 16:30,0.0625,gal,9/17/2019 16:27,adminbomgb,1,1,1,0,{'2019-09-17 16:27:11': 1},1,0
654,Wichita KS,DefaultDept,(PL)Painting Ops-Bldg 7 TR Shop Booth EU-AEROPB,Blend: 10P8-10NF - EC-283 (1:1),8/5/2019 15:30,8/5/2019 15:30,0.125,gal,9/17/2019 16:28,adminbomgb,1,1,1,0,{'2019-09-17 16:28:18': 1},1,0
655,Wichita KS,DefaultDept,(PL)Painting Ops-Bldg 7 TR Shop Booth EU-AEROPB,Blend: 10P8-10NF - EC-283 (1:1),8/9/2019 18:00,8/9/2019 18:00,0.0625,gal,9/17/2019 16:51,adminbomgb,1,1,1,0,{'2019-09-17 16:51:52': 1},1,0
656,Wichita KS,DefaultDept,(PL)Painting Ops-Bldg 7 TR Shop Booth EU-AEROPB,Blend: 10P8-10NF - EC-283 (1:1),8/14/2019 17:00,8/14/2019 17:00,0.03125,gal,9/17/2019 16:55,adminbomgb,1,1,1,0,{'2019-09-17 16:55:58': 1},1,0
657,Wichita KS,DefaultDept,(PL)Painting Ops-Bldg 7 TR Shop Booth EU-AEROPB,Blend: 10P8-10NF - EC-283 (1:1),8/15/2019 5:00,8/15/2019 5:00,0.0625,gal,9/18/2019 8:42,adminbomgb,1,1,1,0,{'2019-09-18 08:42:12': 1},1,0
658,Wichita KS,DefaultDept,(PL)Painting Ops-Bldg 7 TR Shop Booth EU-AEROPB,Blend: 10P8-10NF - EC-283 (1:1),8/20/2019 7:00,8/20/2019 7:00,0.0625,gal,9/18/2019 8:47,adminbomgb,1,1,1,0,{'2019-09-18 08:47:48': 1},1,0
659,Wichita KS,DefaultDept,(PL)Painting Ops-Bldg 7 TR Shop Booth EU-AEROPB,Blend: 10P8-10NF - EC-283 (1:1),8/21/2019 8:00,8/21/2019 8:00,0.125,gal,9/18/2019 8:53,adminbomgb,1,1,1,0,{'2019-09-18 08:53:18': 1},1,0
660,Wichita KS,DefaultDept,(PL)Painting Ops-Bldg 7 TR Shop Booth EU-AEROPB,Blend: 10P8-10NF - EC-283 (1:1),8/21/2019 16:45,8/21/2019 16:45,0.015625,gal,9/18/2019 8:56,adminbomgb,1,1,1,0,{'2019-09-18 08:56:02': 1},1,0
661,Wichita KS,DefaultDept,(PL)Painting Ops-Bldg 7 TR Shop Booth EU-AEROPB,Blend: 10P8-10NF - EC-283 (1:1),8/26/2019 7:00,8/26/2019 7:00,0.0625,gal,9/18/2019 8:58,adminbomgb,1,1,1,0,{'2019-09-18 08:58:52': 1},1,0
662,Wichita KS,DefaultDept,(PL)Painting Ops-Bldg 7 TR Shop Booth EU-AEROPB,Blend: 10P8-10NF - EC-283 (1:1),8/28/2019 16:30,8/28/2019 16:30,0.125,gal,9/18/2019 9:03,adminbomgb,1,1,1,0,{'2019-09-18 09:03:03': 1},1,0
663,Wichita KS,DefaultDept,(PL)Painting Ops-Bldg 7 TR Shop Booth EU-AEROPB,Blend: 10P8-10NF - EC-283 (1:1),8/29/2019 16:00,8/29/2019 16:00,0.1875,gal,9/18/2019 9:06,adminbomgb,1,1,1,0,{'2019-09-18 09:06:57': 1},1,0
664,Wichita KS,DefaultDept,(PL)Painting Ops-Bldg 7 TR Shop Booth EU-AEROPB,Blend: 10P8-10NF - EC-283 (1:1),9/3/2019 12:00,9/3/2019 12:00,0.0625,gal,10/15/2019 10:57,adminbomgb,1,1,1,0,{'2019-10-15 10:57:07': 1},1,0
665,Wichita KS,DefaultDept,(PL)Painting Ops-Bldg 7 TR Shop Booth EU-AEROPB,Blend: 10P8-10NF - EC-283 (1:1),9/4/2019 16:00,9/4/2019 16:00,0.25,gal,10/15/2019 13:11,adminbomgb,1,1,1,0,{'2019-10-15 13:11:46': 1},1,0
666,Wichita KS,DefaultDept,(PL)Painting Ops-Bldg 7 TR Shop Booth EU-AEROPB,Blend: 10P8-10NF - EC-283 (1:1),9/6/2019 7:00,9/6/2019 7:00,0.03125,gal,10/15/2019 13:34,adminbomgb,1,1,1,0,{'2019-10-15 13:34:51': 1},1,0
667,Wichita KS,DefaultDept,(PL)Painting Ops-Bldg 7 TR Shop Booth EU-AEROPB,Blend: 10P8-10NF - EC-283 (1:1),9/6/2019 16:00,9/6/2019 16:00,0.25,gal,10/15/2019 13:37,adminbomgb,1,1,1,0,{'2019-10-15 13:37:11': 1},1,0
668,Wichita KS,DefaultDept,(PL)Painting Ops-Bldg 7 TR Shop Booth EU-AEROPB,Blend: 10P8-10NF - EC-283 (1:1),9/9/2019 17:00,9/9/2019 17:00,0.0625,gal,10/15/2019 13:47,adminbomgb,1,1,1,0,{'2019-10-15 13:47:08': 1},1,0
669,Wichita KS,DefaultDept,(PL)Painting Ops-Bldg 7 TR Shop Booth EU-AEROPB,Blend: 10P8-10NF - EC-283 (1:1),9/11/2019 13:21,9/11/2019 13:21,0.03125,gal,10/15/2019 13:51,adminbomgb,1,1,1,0,{'2019-10-15 13:51:58': 1},1,0
670,Wichita KS,DefaultDept,(PL)Painting Ops-Bldg 7 TR Shop Booth EU-AEROPB,Blend: 10P8-10NF - EC-283 (1:1),9/11/2019 13:21,9/11/2019 13:21,0.25,gal,10/15/2019 13:48,adminbomgb,1,1,1,0,{'2019-10-15 13:48:56': 1},1,0
671,Wichita KS,DefaultDept,(PL)Painting Ops-Bldg 7 TR Shop Booth EU-AEROPB,Blend: 10P8-10NF - EC-283 (1:1),9/16/2019 8:30,9/16/2019 8:30,0.03125,gal,10/15/2019 14:18,adminbomgb,1,1,1,0,{'2019-10-15 14:18:33': 1},1,0
672,Wichita KS,DefaultDept,(PL)Painting Ops-Bldg 7 TR Shop Booth EU-AEROPB,Blend: 10P8-10NF - EC-283 (1:1),9/28/2019 7:00,9/28/2019 7:00,0.125,gal,10/15/2019 14:22,adminbomgb,1,1,1,0,{'2019-10-15 14:22:19': 1},1,0
673,Wichita KS,DefaultDept,(PL)Painting Ops-Bldg 7 TR Shop Booth EU-AEROPB,Blend: 10P8-10NF - EC-283 (1:1),10/1/2019 12:00,10/1/2019 12:00,0.1875,gal,12/19/2019 16:04,adminbomry,1,1,1,0,{'2019-12-19 16:04:12': 1},1,0
674,Wichita KS,DefaultDept,(PL)Painting Ops-Bldg 7 TR Shop Booth EU-AEROPB,Blend: 10P8-10NF - EC-283 (1:1),10/3/2019 12:00,10/3/2019 12:00,0.125,gal,12/19/2019 16:04,adminbomry,1,1,1,0,{'2019-12-19 16:04:12': 1},1,0
675,Wichita KS,DefaultDept,(PL)Painting Ops-Bldg 7 TR Shop Booth EU-AEROPB,Blend: 10P8-10NF - EC-283 (1:1),10/4/2019 12:00,10/4/2019 12:00,0.1875,gal,12/19/2019 16:04,adminbomry,1,1,1,0,{'2019-12-19 16:04:12': 1},1,0
676,Wichita KS,DefaultDept,(PL)Painting Ops-Bldg 7 TR Shop Booth EU-AEROPB,Blend: 10P8-10NF - EC-283 (1:1),10/8/2019 12:00,10/8/2019 12:00,0.03125,gal,12/19/2019 16:04,adminbomry,1,1,1,0,{'2019-12-19 16:04:12': 1},1,0
677,Wichita KS,DefaultDept,(PL)Painting Ops-Bldg 7 TR Shop Booth EU-AEROPB,Blend: 10P8-10NF - EC-283 (1:1),10/14/2019 12:00,10/14/2019 12:00,0.0625,gal,12/19/2019 16:04,adminbomry,1,1,1,0,{'2019-12-19 16:04:12': 1},1,0
678,Wichita KS,DefaultDept,(PL)Painting Ops-Bldg 7 TR Shop Booth EU-AEROPB,Blend: 10P8-10NF - EC-283 (1:1),10/15/2019 12:00,10/15/2019 12:00,0.0625,gal,12/19/2019 16:04,adminbomry,1,1,1,0,{'2019-12-19 16:04:12': 1},1,0
679,Wichita KS,DefaultDept,(PL)Painting Ops-Bldg 7 TR Shop Booth EU-AEROPB,Blend: 10P8-10NF - EC-283 (1:1),10/17/2019 12:00,10/17/2019 12:00,0.125,gal,12/19/2019 16:04,adminbomry,1,1,1,0,{'2019-12-19 16:04:12': 1},1,0
680,Wichita KS,DefaultDept,(PL)Painting Ops-Bldg 7 TR Shop Booth EU-AEROPB,Blend: 10P8-10NF - EC-283 (1:1),10/28/2019 12:00,10/28/2019 12:00,0.0625,gal,12/19/2019 16:04,adminbomry,1,1,1,0,{'2019-12-19 16:04:12': 1},1,0
681,Wichita KS,DefaultDept,(PL)Painting Ops-Bldg 7 TR Shop Booth EU-AEROPB,Blend: 10P8-10NF - EC-283 (1:1),10/30/2019 12:00,10/30/2019 12:00,0.25,gal,12/19/2019 16:04,adminbomry,1,1,1,0,{'2019-12-19 16:04:12': 1},1,0
682,Wichita KS,DefaultDept,(PL)Painting Ops-Bldg 7 TR Shop Booth EU-AEROPB,Blend: 10P8-10NF - EC-283 (1:1),10/31/2019 12:00,10/31/2019 12:00,0.0625,gal,12/19/2019 16:04,adminbomry,1,1,1,0,{'2019-12-19 16:04:12': 1},1,0
683,Wichita KS,DefaultDept,(PL)Painting Ops-Bldg 7 TR Shop Booth EU-AEROPB,Blend: 10P8-10NF - EC-283 (1:1),11/12/2019 13:00,11/12/2019 13:00,0.0625,gal,1/13/2020 15:23,adminbomgb,1,1,1,0,{'2020-01-13 15:23:10': 1},1,0
684,Wichita KS,DefaultDept,(PL)Painting Ops-Bldg 7 TR Shop Booth EU-AEROPB,Blend: 10P8-10NF - EC-283 (1:1),11/19/2019 15:30,11/19/2019 15:30,0.0625,gal,1/13/2020 15:30,adminbomgb,1,1,1,0,{'2020-01-13 15:30:17': 1},1,0
685,Wichita KS,DefaultDept,(PL)Painting Ops-Bldg 7 TR Shop Booth EU-AEROPB,Blend: 10P8-10NF - EC-283 (1:1),11/20/2019 0:00,11/20/2019 0:00,0.0625,gal,1/27/2020 15:39,adminbomed,1,1,1,0,{'2020-01-27 15:39:29': 1},1,0
686,Wichita KS,DefaultDept,(PL)Painting Ops-Bldg 7 TR Shop Booth EU-AEROPB,Blend: 10P8-10NF - EC-283 (1:1),11/20/2019 6:42,11/20/2019 6:42,0.0625,gal,1/13/2020 15:50,adminbomgb,1,1,1,0,{'2020-01-13 15:50:04': 1},1,0
687,Wichita KS,DefaultDept,(PL)Painting Ops-Bldg 7 TR Shop Booth EU-AEROPB,Blend: 10P8-10NF - EC-283 (1:1),11/22/2019 0:00,11/22/2019 0:00,0.03125,gal,1/27/2020 15:38,adminbomed,1,1,1,0,{'2020-01-27 15:38:13': 1},1,0
688,Wichita KS,DefaultDept,(PL)Painting Ops-Bldg 7 TR Shop Booth EU-AEROPB,Blend: 10P8-10NF - EC-283 (1:1),11/22/2019 0:00,11/22/2019 0:00,0.1875,gal,1/27/2020 15:38,adminbomed,1,1,1,0,{'2020-01-27 15:38:53': 1},1,0
689,Wichita KS,DefaultDept,(PL)Painting Ops-Bldg 7 TR Shop Booth EU-AEROPB,Blend: 10P8-10NF - EC-283 (1:1),11/22/2019 6:42,11/22/2019 6:42,0.03125,gal,1/13/2020 16:16,adminbomgb,1,1,1,0,{'2020-01-13 16:16:14': 1},1,0
690,Wichita KS,DefaultDept,(PL)Painting Ops-Bldg 7 TR Shop Booth EU-AEROPB,Blend: 10P8-10NF - EC-283 (1:1),11/22/2019 17:00,11/22/2019 17:00,0.1875,gal,1/13/2020 16:17,adminbomgb,1,1,1,0,{'2020-01-13 16:17:29': 1},1,0
691,Wichita KS,DefaultDept,(PL)Painting Ops-Bldg 7 TR Shop Booth EU-AEROPB,Blend: 10P8-10NF - EC-283 (1:1),12/10/2019 8:00,12/10/2019 8:00,0.1875,gal,1/13/2020 16:23,adminbomgb,1,1,1,0,{'2020-01-13 16:23:28': 1},1,0
692,Wichita KS,DefaultDept,(PL)Painting Ops-Bldg 7 TR Shop Booth EU-AEROPB,Blend: 10P8-10NF - EC-283 (1:1),12/10/2019 10:00,12/10/2019 10:00,0.09375,gal,1/13/2020 16:28,adminbomgb,1,1,1,0,{'2020-01-13 16:28:41': 1},1,0
693,Wichita KS,DefaultDept,(PL)Painting Ops-Bldg 7 TR Shop Booth EU-AEROPB,Blend: 10P8-10NF - EC-283 (1:1),12/12/2019 22:00,12/12/2019 22:00,0.09375,gal,1/13/2020 16:31,adminbomgb,1,1,1,0,{'2020-01-13 16:31:19': 1},1,0
694,Wichita KS,DefaultDept,(PL)Painting Ops-Bldg 7 TR Shop Booth EU-AEROPB,Blend: 10P8-10NF - EC-283 (1:1),12/18/2019 9:00,12/18/2019 9:00,0.09375,gal,1/13/2020 16:36,adminbomgb,1,1,1,0,{'2020-01-13 16:36:53': 1},1,0
695,Wichita KS,DefaultDept,(PL)Painting Ops-Bldg 7 TR Shop Booth EU-AEROPB,Blend: 10P8-10NF - EC-283 (1:1),12/19/2019 9:00,12/19/2019 9:00,0.09375,gal,1/13/2020 16:40,adminbomgb,1,1,1,0,{'2020-01-13 16:40:20': 1},1,0
696,Wichita KS,DefaultDept,(PL)Painting Ops-Bldg 7 TR Shop Booth EU-AEROPB,Blend: 10P8-10NF - EC-283 (1:1),1/9/2020 10:00,1/9/2020 10:00,0.0625,gal,4/28/2020 16:23,adminbomjs,1,1,1,0,{'2020-04-28 16:23:41': 1},1,0
697,Wichita KS,DefaultDept,(PL)Painting Ops-Bldg 7 TR Shop Booth EU-AEROPB,Blend: 10P8-10NF - EC-283 (1:1),1/19/2020 10:00,1/19/2020 10:00,0.09375,gal,4/28/2020 16:35,adminbomjs,1,1,1,0,{'2020-04-28 16:35:17': 1},1,0
698,Wichita KS,DefaultDept,(PL)Painting Ops-Bldg 7 TR Shop Booth EU-AEROPB,Blend: 10P8-10NF - EC-283 (1:1),1/23/2020 12:00,1/23/2020 12:00,0.09375,gal,4/28/2020 16:40,adminbomjs,1,1,1,0,{'2020-04-28 16:40:18': 1},1,0
699,Wichita KS,DefaultDept,(PL)Painting Ops-Bldg 7 TR Shop Booth EU-AEROPB,Blend: 10P8-10NF - EC-283 (1:1),1/27/2020 7:00,1/27/2020 7:00,0.03125,gal,4/28/2020 16:49,adminbomjs,1,1,1,0,{'2020-04-28 16:49:30': 1},1,0
700,Wichita KS,DefaultDept,(PL)Painting Ops-Bldg 7 TR Shop Booth EU-AEROPB,Blend: 10P8-10NF - EC-283 (1:1),2/7/2020 14:55,2/7/2020 14:55,0.1875,gal,5/7/2020 14:56,adminbomry,1,1,1,0,{'2020-05-07 14:56:23': 1},1,0
701,Wichita KS,DefaultDept,(PL)Painting Ops-Bldg 7 TR Shop Booth EU-AEROPB,Blend: 10P8-10NF - EC-283 (1:1),2/12/2020 15:14,2/12/2020 15:14,0.0625,gal,5/7/2020 15:14,adminbomry,1,1,1,0,{'2020-05-07 15:14:36': 1},1,0
702,Wichita KS,DefaultDept,(PL)Painting Ops-Bldg 7 TR Shop Booth EU-AEROPB,Blend: 10P8-10NF - EC-283 (1:1),2/20/2020 16:38,2/20/2020 16:38,0.1875,gal,5/7/2020 16:39,adminbomry,1,1,1,0,{'2020-05-07 16:39:20': 1},1,0
703,Wichita KS,DefaultDept,(PL)Painting Ops-Bldg 7 TR Shop Booth EU-AEROPB,Blend: 10P8-10NF - EC-283 (1:1),2/21/2020 16:09,2/21/2020 16:09,0.0625,gal,5/7/2020 16:17,adminbomry,1,1,1,0,{'2020-05-07 16:17:28': 1},1,0
704,Wichita KS,DefaultDept,(PL)Painting Ops-Bldg 7 TR Shop Booth EU-AEROPB,Blend: 10P8-10NF - EC-283 (1:1),2/21/2020 16:47,2/21/2020 16:47,0.1875,gal,5/7/2020 16:47,adminbomry,1,1,1,0,{'2020-05-07 16:47:26': 1},1,0
705,Wichita KS,DefaultDept,(PL)Painting Ops-Bldg 7 TR Shop Booth EU-AEROPB,Blend: 10P8-10NF - EC-283 (1:1),3/5/2020 18:56,3/5/2020 18:56,0.1875,gal,5/13/2020 18:56,adminbomry,1,1,1,0,{'2020-05-13 18:56:50': 1},1,0
706,Wichita KS,DefaultDept,(PL)Painting Ops-Bldg 7 TR Shop Booth EU-AEROPB,Blend: 10P8-10NF - EC-283 (1:1),3/5/2020 18:58,3/5/2020 18:58,0.09375,gal,5/13/2020 18:58,adminbomry,1,1,1,0,{'2020-05-13 18:58:40': 1},1,0
707,Wichita KS,DefaultDept,(PL)Painting Ops-Bldg 7 TR Shop Booth EU-AEROPB,Blend: 10P8-10NF - EC-283 (1:1),4/1/2020 0:00,4/1/2020 0:00,0.0625,gal,6/9/2020 15:41,Kamiander,1,1,1,0,{'2020-06-09 15:41:37': 1},1,0
708,Wichita KS,DefaultDept,(PL)Painting Ops-Bldg 7 TR Shop Booth EU-AEROPB,Blend: 10P8-10NF - EC-283 (1:1),4/2/2020 0:00,4/2/2020 0:00,0.0625,gal,6/9/2020 15:50,Kamiander,1,1,1,0,{'2020-06-09 15:50:28': 1},1,0
709,Wichita KS,DefaultDept,(PL)Painting Ops-Bldg 7 TR Shop Booth EU-AEROPB,Blend: 10P8-10NF - EC-283 (1:1),4/8/2020 0:00,4/8/2020 0:00,0.09375,gal,6/9/2020 15:52,Kamiander,1,1,1,0,{'2020-06-09 15:52:35': 1},1,0
710,Wichita KS,DefaultDept,(PL)Painting Ops-Bldg 7 TR Shop Booth EU-AEROPB,Blend: 10P8-10NF - EC-283 (1:1),4/9/2020 0:00,4/9/2020 0:00,0.0625,gal,6/9/2020 16:10,Kamiander,1,1,1,0,{'2020-06-09 16:10:42': 1},1,0
711,Wichita KS,DefaultDept,(PL)Painting Ops-Bldg 7 TR Shop Booth EU-AEROPB,Blend: 10P8-10NF - EC-283 (1:1),4/9/2020 0:00,4/9/2020 0:00,0.09375,gal,6/9/2020 16:13,Kamiander,1,1,1,0,{'2020-06-09 16:13:10': 1},1,0
712,Wichita KS,DefaultDept,(PL)Painting Ops-Bldg 7 TR Shop Booth EU-AEROPB,Blend: 10P8-10NF - EC-283 (1:1),4/11/2020 0:00,4/11/2020 0:00,0.09375,gal,6/9/2020 16:21,Kamiander,1,1,1,0,{'2020-06-09 16:21:28': 1},1,0
713,Wichita KS,DefaultDept,(PL)Painting Ops-Bldg 7 TR Shop Booth EU-AEROPB,Blend: 10P8-10NF - EC-283 (1:1),4/15/2020 0:00,4/15/2020 0:00,0.09375,gal,6/9/2020 16:23,Kamiander,1,1,1,0,{'2020-06-09 16:23:24': 1},1,0
714,Wichita KS,DefaultDept,(PL)Painting Ops-Bldg 7 TR Shop Booth EU-AEROPB,Blend: 10P8-10NF - EC-283 (1:1),4/23/2020 0:00,4/23/2020 0:00,0.09375,gal,6/9/2020 16:26,Kamiander,1,1,1,0,{'2020-06-09 16:26:21': 1},1,0
715,Wichita KS,DefaultDept,(PL)Painting Ops-Bldg 7 TR Shop Booth EU-AEROPB,Blend: 10P8-10NF - EC-283 (1:1),4/24/2020 0:00,4/24/2020 0:00,0.0625,gal,6/9/2020 16:27,Kamiander,1,1,1,0,{'2020-06-09 16:27:48': 1},1,0
716,Wichita KS,DefaultDept,(PL)Painting Ops-Bldg 7 TR Shop Booth EU-AEROPB,Blend: 10P8-10NF - EC-283 (1:1),4/27/2020 0:00,4/27/2020 0:00,0.0625,gal,6/9/2020 16:29,Kamiander,1,1,1,0,{'2020-06-09 16:29:14': 1},1,0
717,Wichita KS,DefaultDept,(PL)Painting Ops-Bldg 7 TR Shop Booth EU-AEROPB,Blend: 10P8-10NF - EC-283 (1:1),4/30/2020 0:00,4/30/2020 0:00,0.0625,gal,6/9/2020 16:39,Kamiander,1,1,1,0,{'2020-06-09 16:39:35': 1},1,0
718,Wichita KS,DefaultDept,(PL)Painting Ops-Bldg 7 TR Shop Booth EU-AEROPB,Blend: 10P8-10NF - EC-283 (1:1),5/1/2020 0:00,5/1/2020 0:00,0.078125,gal,6/19/2020 13:38,Kamiander,1,1,1,0,{'2020-06-19 13:38:46': 1},1,0
719,Wichita KS,DefaultDept,(PL)Painting Ops-Bldg 7 TR Shop Booth EU-AEROPB,Blend: 10P8-10NF - EC-283 (1:1),5/5/2020 0:00,5/5/2020 0:00,0.078125,gal,6/19/2020 13:40,Kamiander,1,1,1,0,{'2020-06-19 13:40:08': 1},1,0
720,Wichita KS,DefaultDept,(PL)Painting Ops-Bldg 7 TR Shop Booth EU-AEROPB,Blend: 10P8-10NF - EC-283 (1:1),5/6/2020 0:00,5/6/2020 0:00,0.125,gal,6/19/2020 13:43,Kamiander,1,1,1,0,{'2020-06-19 13:43:23': 1},1,0
721,Wichita KS,DefaultDept,(PL)Painting Ops-Bldg 7 TR Shop Booth EU-AEROPB,Blend: 10P8-10NF - EC-283 (1:1),5/11/2020 0:00,5/11/2020 0:00,0.09375,gal,6/19/2020 13:46,Kamiander,1,1,1,0,{'2020-06-19 13:46:01': 1},1,0
722,Wichita KS,DefaultDept,(PL)Painting Ops-Bldg 7 TR Shop Booth EU-AEROPB,Blend: 10P8-10NF - EC-283 (1:1),5/12/2020 0:00,5/12/2020 0:00,0.078125,gal,6/19/2020 13:47,Kamiander,1,1,1,0,{'2020-06-19 13:47:27': 1},1,0
723,Wichita KS,DefaultDept,(PL)Painting Ops-Bldg 7 TR Shop Booth EU-AEROPB,Blend: 10P8-10NF - EC-283 (1:1),5/13/2020 0:00,5/13/2020 0:00,0.125,gal,6/19/2020 13:48,Kamiander,1,1,1,0,{'2020-06-19 13:48:32': 1},1,0
724,Wichita KS,DefaultDept,(PL)Painting Ops-Bldg 7 TR Shop Booth EU-AEROPB,Blend: 10P8-10NF - EC-283 (1:1),5/15/2020 0:00,5/15/2020 0:00,0.1875,gal,6/19/2020 13:50,Kamiander,1,1,1,0,{'2020-06-19 13:50:16': 1},1,0
725,Wichita KS,DefaultDept,(PL)Painting Ops-Bldg 7 TR Shop Booth EU-AEROPB,Blend: 10P8-10NF - EC-283 (1:1),5/17/2020 0:00,5/17/2020 0:00,0.09375,gal,6/19/2020 13:51,Kamiander,1,1,1,0,{'2020-06-19 13:51:31': 1},1,0
726,Wichita KS,DefaultDept,(PL)Painting Ops-Bldg 7 TR Shop Booth EU-AEROPB,Blend: 10P8-10NF - EC-283 (1:1),5/18/2020 0:00,5/18/2020 0:00,0.0625,gal,6/19/2020 13:52,Kamiander,1,1,1,0,{'2020-06-19 13:52:52': 1},1,0
727,Wichita KS,DefaultDept,(PL)Painting Ops-Bldg 7 TR Shop Booth EU-AEROPB,Blend: 10P8-10NF - EC-283 (1:1),5/19/2020 0:00,5/19/2020 0:00,0.0625,gal,6/19/2020 13:56,Kamiander,1,1,1,0,{'2020-06-19 13:56:00': 1},1,0
728,Wichita KS,DefaultDept,(PL)Painting Ops-Bldg 7 TR Shop Booth EU-AEROPB,Blend: 10P8-10NF - EC-283 (1:1),5/20/2020 0:00,5/20/2020 0:00,0.0625,gal,6/19/2020 13:57,Kamiander,1,1,1,0,{'2020-06-19 13:57:17': 1},1,0
729,Wichita KS,DefaultDept,(PL)Painting Ops-Bldg 7 TR Shop Booth EU-AEROPB,Blend: 10P8-10NF - EC-283 (1:1),5/21/2020 0:00,5/21/2020 0:00,0.0625,gal,6/19/2020 13:58,Kamiander,1,1,1,0,{'2020-06-19 13:58:29': 1},1,0
730,Wichita KS,DefaultDept,(PL)Painting Ops-Bldg 7 TR Shop Booth EU-AEROPB,Blend: 10P8-10NF - EC-283 (1:1),5/29/2020 0:00,5/29/2020 0:00,0.125,gal,6/19/2020 14:01,Kamiander,1,1,1,0,{'2020-06-19 14:01:00': 1},1,0
731,Wichita KS,DefaultDept,(PL)Painting Ops-Bldg 7 TR Shop Booth EU-AEROPB,Blend: 10P8-10NF - EC-283 (1:1)_old,1/25/2019 10:44,1/25/2019 10:44,0.0625,gal,1/25/2019 10:44,adminbomsn,1,1,1,0,{'2019-01-25 10:44:42': 1},1,0
732,Wichita KS,DefaultDept,(PL)Painting Ops-Bldg 7 TR Shop Booth EU-AEROPB,Blend: 10P8-10NF - EC-283 (1:1)_old,1/25/2019 11:24,1/25/2019 11:24,0.125,gal,1/25/2019 11:24,adminbomsn,1,1,1,0,{'2019-01-25 11:24:35': 1},1,0
733,Wichita KS,DefaultDept,(PL)Painting Ops-Bldg 7 TR Shop Booth EU-AEROPB,Blend: 10P8-10NF - EC-283 (1:1)_old,1/25/2019 12:47,1/25/2019 12:47,0.03125,gal,1/25/2019 12:47,adminbomna,1,1,1,0,{'2019-01-25 12:47:03': 1},1,0
734,Wichita KS,DefaultDept,(PL)Painting Ops-Bldg 7 TR Shop Booth EU-AEROPB,Blend: 10P8-10NF - EC-283 (1:1)_old,1/25/2019 13:00,1/25/2019 13:00,0.015625,gal,1/25/2019 13:01,adminbomcb,1,1,1,0,{'2019-01-25 13:01:00': 1},1,0
735,Wichita KS,DefaultDept,(PL)Painting Ops-Bldg 7 TR Shop Booth EU-AEROPB,Blend: 10P8-10NF - EC-283 (1:1)_old,1/25/2019 14:16,1/25/2019 14:16,0.046875,gal,1/25/2019 14:16,adminbomcb,1,1,1,0,{'2019-01-25 14:16:57': 1},1,0
736,Wichita KS,DefaultDept,(PL)Painting Ops-Bldg 7 TR Shop Booth EU-AEROPB,Blend: 10P8-10NF - EC-283 (1:1)_old,1/25/2019 14:59,1/25/2019 14:59,0.0078125,gal,1/25/2019 14:59,adminbomsn,1,1,1,0,{'2019-01-25 14:59:30': 1},1,0
737,Wichita KS,DefaultDept,(PL)Painting Ops-Bldg 7 TR Shop Booth EU-AEROPB,Blend: 10P8-10NF - EC-283 (1:1)_old,1/28/2019 9:35,1/28/2019 9:35,0.0078125,gal,1/28/2019 9:35,adminbomsn,1,1,1,0,{'2019-01-28 09:35:09': 1},1,0
738,Wichita KS,DefaultDept,(PL)Painting Ops-Bldg 7 TR Shop Booth EU-AEROPB,Blend: 10P8-10NF - EC-283 (1:1)_old,1/28/2019 10:21,1/28/2019 10:21,0.0625,gal,1/28/2019 10:21,adminbomcb,1,1,1,0,{'2019-01-28 10:21:18': 1},1,0
739,Wichita KS,DefaultDept,(PL)Painting Ops-Bldg 7 TR Shop Booth EU-AEROPB,Blend: 10P8-10NF - EC-283 (1:1)_old,1/28/2019 10:30,1/28/2019 10:30,0.03125,gal,1/28/2019 10:30,adminbomcb,1,1,1,0,{'2019-01-28 10:30:39': 1},1,0
740,Wichita KS,DefaultDept,(PL)Painting Ops-Bldg 7 TR Shop Booth EU-AEROPB,Blend: 10P8-10NF - EC-283 (1:1)_old,1/28/2019 10:53,1/28/2019 10:53,0.125,gal,1/28/2019 10:53,adminbomna,1,1,1,0,{'2019-01-28 10:53:14': 1},1,0
741,Wichita KS,DefaultDept,(PL)Painting Ops-Bldg 7 TR Shop Booth EU-AEROPB,Blend: 10P8-10NF - EC-283 (1:1)_old,1/28/2019 13:17,1/28/2019 13:17,0.015625,gal,1/28/2019 13:17,adminbomcb,1,1,1,0,{'2019-01-28 13:17:53': 1},1,0
742,Wichita KS,DefaultDept,(PL)Painting Ops-Bldg 7 TR Shop Booth EU-AEROPB,Blend: 10P8-10NF - EC-283 (1:1)_old,1/28/2019 13:40,1/28/2019 13:40,0.0234375,gal,1/28/2019 13:40,adminbommg,1,1,1,0,{'2019-01-28 13:40:10': 1},1,0
743,Wichita KS,DefaultDept,(PL)Painting Ops-Bldg 7 TR Shop Booth EU-AEROPB,Blend: 10P8-10NF - EC-283 (1:1)_old,1/28/2019 14:08,1/28/2019 14:08,0.5,gal,1/28/2019 14:08,adminbommg,1,1,1,0,{'2019-01-28 14:08:26': 1},1,0
744,Wichita KS,DefaultDept,(PL)Painting Ops-Bldg 7 TR Shop Booth EU-AEROPB,Blend: 10P8-10NF - EC-283 (1:1)_old,1/29/2019 11:18,1/29/2019 11:18,0.0625,gal,1/29/2019 11:18,adminbomna,1,1,1,0,{'2019-01-29 11:18:20': 1},1,0
745,Wichita KS,DefaultDept,(PL)Painting Ops-Bldg 7 TR Shop Booth EU-AEROPB,Blend: 10P8-10NF - EC-283 (1:1)_old,1/29/2019 14:27,1/29/2019 14:27,0.0078125,gal,1/29/2019 14:27,adminbommg,1,1,1,0,{'2019-01-29 14:27:26': 1},1,0
746,Wichita KS,DefaultDept,(PL)Painting Ops-Bldg 7 TR Shop Booth EU-AEROPB,Blend: 10P8-10NF - EC-283 (1:1)_old,1/29/2019 14:45,1/29/2019 14:45,0.03125,gal,1/29/2019 14:45,adminbommg,1,1,1,0,{'2019-01-29 14:45:59': 1},1,0
747,Wichita KS,DefaultDept,(PL)Painting Ops-Bldg 7 TR Shop Booth EU-AEROPB,Blend: 10P8-10NF - EC-283 (1:1)_old,7/3/2019 8:00,7/3/2019 8:00,0.125,gal,8/20/2019 16:50,adminbomgb,1,1,1,0,{'2019-08-20 16:50:13': 1},1,0
748,Wichita KS,DefaultDept,(PL)Painting Ops-Bldg 7 TR Shop Booth EU-AEROPB,Blend: 10P8-10NF - EC-283 (1:1)_old,7/8/2019 10:30,7/8/2019 10:30,0.0625,gal,8/21/2019 8:16,adminbomgb,1,1,1,0,{'2019-08-21 08:16:51': 1},1,0
749,Wichita KS,DefaultDept,(PL)Painting Ops-Bldg 7 TR Shop Booth EU-AEROPB,Blend: 10P8-10NF - EC-283 (1:1)_old,7/9/2019 8:00,7/9/2019 8:00,0.3125,gal,8/21/2019 8:18,adminbomgb,1,1,1,0,{'2019-08-21 08:18:43': 1},1,0
750,Wichita KS,DefaultDept,(PL)Painting Ops-Bldg 7 TR Shop Booth EU-AEROPB,Blend: 10P8-10NF - EC-283 (1:1)_old,7/9/2019 10:00,7/9/2019 10:00,0.046875,gal,8/21/2019 8:20,adminbomgb,1,1,1,0,{'2019-08-21 08:20:05': 1},1,0
751,Wichita KS,DefaultDept,(PL)Painting Ops-Bldg 7 TR Shop Booth EU-AEROPB,Blend: 10P8-10NF - EC-283 (1:1)_old,7/11/2019 7:30,7/11/2019 7:30,0.125,gal,8/21/2019 10:29,adminbomgb,1,1,1,0,{'2019-08-21 10:29:18': 1},1,0
752,Wichita KS,DefaultDept,(PL)Painting Ops-Bldg 7 TR Shop Booth EU-AEROPB,Blend: 10P8-10NF - EC-283 (1:1)_old,7/12/2019 9:30,7/12/2019 9:30,0.0625,gal,8/21/2019 10:40,adminbomgb,1,1,1,0,{'2019-08-21 10:40:19': 1},1,0
753,Wichita KS,DefaultDept,(PL)Painting Ops-Bldg 7 TR Shop Booth EU-AEROPB,Blend: 10P8-10NF - EC-283 (1:1)_old,7/15/2019 9:30,7/15/2019 9:30,0.0625,gal,8/21/2019 10:48,adminbomgb,1,1,1,0,{'2019-08-21 10:48:01': 1},1,0
754,Wichita KS,DefaultDept,(PL)Painting Ops-Bldg 7 TR Shop Booth EU-AEROPB,Blend: 10P8-10NF - EC-283 (1:1)_old,7/17/2019 10:51,7/17/2019 10:51,0.09375,gal,7/17/2019 10:51,adminbommg,1,1,1,0,{'2019-07-17 10:51:41': 1},1,0
755,Wichita KS,DefaultDept,(PL)Painting Ops-Bldg 7 TR Shop Booth EU-AEROPB,Blend: 10P8-10NF - EC-283 (1:1)_old,7/18/2019 13:48,7/18/2019 13:48,0.03125,gal,7/18/2019 13:48,adminbommg,1,1,1,0,{'2019-07-18 13:48:56': 1},1,0
756,Wichita KS,DefaultDept,(PL)Painting Ops-Bldg 7 TR Shop Booth EU-AEROPB,Blend: 10P8-10NF - EC-283 (1:1)_old,7/18/2019 13:51,7/18/2019 13:51,0.125,gal,7/18/2019 13:51,adminbommg,1,1,1,0,{'2019-07-18 13:51:55': 1},1,0
757,Wichita KS,DefaultDept,(PL)Painting Ops-Bldg 7 TR Shop Booth EU-AEROPB,Blend: 10P8-10NF - EC-283 (1:1)_old,7/18/2019 14:25,7/18/2019 14:25,0.0625,gal,7/18/2019 14:25,adminbommg,1,1,1,0,{'2019-07-18 14:25:57': 1},1,0
758,Wichita KS,DefaultDept,(PL)Painting Ops-Bldg 7 TR Shop Booth EU-AEROPB,Blend: 10P8-10NF - EC-283 (1:1)_old,7/18/2019 15:02,7/18/2019 15:02,0.046875,gal,7/18/2019 15:02,adminbommg,1,1,1,0,{'2019-07-18 15:02:16': 1},1,0
759,Wichita KS,DefaultDept,(PL)Painting Ops-Bldg 7 TR Shop Booth EU-AEROPB,Blend: 10P8-10NF - EC-283 (1:1)_old,7/19/2019 9:00,7/19/2019 9:00,0.0625,gal,8/21/2019 10:55,adminbomgb,1,1,1,0,{'2019-08-21 10:55:06': 1},1,0
760,Wichita KS,DefaultDept,(PL)Painting Ops-Bldg 7 TR Shop Booth EU-AEROPB,Blend: 10P8-10NF - EC-283 (1:1)_old,7/22/2019 15:31,7/22/2019 15:31,0.015625,gal,7/22/2019 15:31,adminbommg,1,1,1,0,{'2019-07-22 15:31:35': 1},1,0
761,Wichita KS,DefaultDept,(PL)Painting Ops-Bldg 7 TR Shop Booth EU-AEROPB,Blend: 10P8-10NF - EC-283 (1:1)_old,7/22/2019 15:33,7/22/2019 15:33,0.03125,gal,7/22/2019 15:33,adminbommg,1,1,1,0,{'2019-07-22 15:33:58': 1},1,0
762,Wichita KS,DefaultDept,(PL)Painting Ops-Bldg 7 TR Shop Booth EU-AEROPB,Blend: 10P8-10NF - EC-283 (1:1)_old,7/22/2019 15:52,7/22/2019 15:52,0.1875,gal,7/22/2019 15:52,adminbommg,1,1,1,0,{'2019-07-22 15:52:24': 1},1,0
763,Wichita KS,DefaultDept,(PL)Painting Ops-Bldg 7 TR Shop Booth EU-AEROPB,Blend: 10P8-10NF - EC-283 (1:1)_old,7/22/2019 16:09,7/22/2019 16:09,0.0625,gal,7/22/2019 16:09,adminbommg,1,1,1,0,{'2019-07-22 16:09:20': 1},1,0
764,Wichita KS,DefaultDept,(PL)Painting Ops-Bldg 7 TR Shop Booth EU-AEROPB,Blend: 10P8-10NF - EC-283 (1:1)_old,7/22/2019 16:19,7/22/2019 16:19,0.09375,gal,7/22/2019 16:19,adminbommg,1,1,1,0,{'2019-07-22 16:19:20': 1},1,0
765,Wichita KS,DefaultDept,(PL)Painting Ops-Bldg 7 TR Shop Booth EU-AEROPB,Blend: 10P8-10NF - EC-283 (1:1)_old,7/22/2019 16:26,7/22/2019 16:26,0.046875,gal,7/22/2019 16:26,adminbommg,1,1,1,0,{'2019-07-22 16:26:02': 1},1,0
766,Wichita KS,DefaultDept,(PL)Painting Ops-Bldg 7 TR Shop Booth EU-AEROPB,Blend: 10P8-10NF - EC-283 (1:1)_old,7/22/2019 16:31,7/22/2019 16:31,0.125,gal,7/22/2019 16:31,adminbommg,1,1,1,0,{'2019-07-22 16:31:30': 1},1,0
767,Wichita KS,DefaultDept,(PL)Painting Ops-Bldg 7 TR Shop Booth EU-AEROPB,Blend: 10P8-10NF - EC-283 (1:1)_old,7/23/2019 9:22,7/23/2019 9:22,0.0625,gal,7/23/2019 9:22,adminbommg,1,1,1,0,{'2019-07-23 09:22:40': 1},1,0
768,Wichita KS,DefaultDept,(PL)Painting Ops-Bldg 7 TR Shop Booth EU-AEROPB,Blend: 10P8-10NF - EC-283 (1:1)_old,7/23/2019 9:29,7/23/2019 9:29,0.046875,gal,7/23/2019 9:29,adminbommg,1,1,1,0,{'2019-07-23 09:29:02': 1},1,0
769,Wichita KS,DefaultDept,(PL)Painting Ops-Bldg 7 TR Shop Booth EU-AEROPB,Blend: 10P8-10NF - EC-283 (1:1)_old,7/23/2019 9:50,7/23/2019 9:50,0.125,gal,7/23/2019 9:50,adminbommg,1,1,1,0,{'2019-07-23 09:50:23': 1},1,0
770,Wichita KS,DefaultDept,(PL)Painting Ops-Bldg 7 TR Shop Booth EU-AEROPB,Blend: 10P8-10NF - EC-283 (1:1)_old,7/23/2019 13:29,7/23/2019 13:29,0.03125,gal,7/23/2019 13:31,adminbommg,1,1,1,0,{'2019-07-23 13:31:06': 1},1,0
771,Wichita KS,DefaultDept,(PL)Painting Ops-Bldg 7 TR Shop Booth EU-AEROPB,Blend: 10P8-10NF - EC-283 (1:1)_old,7/23/2019 13:32,7/23/2019 13:32,0.03125,gal,7/23/2019 13:32,adminbommg,1,1,1,0,{'2019-07-23 13:32:40': 1},1,0
772,Wichita KS,DefaultDept,(PL)Painting Ops-Bldg 7 TR Shop Booth EU-AEROPB,Blend: 10P8-10NF - EC-283 (1:1)_old,7/23/2019 13:52,7/23/2019 13:52,0.25,gal,7/23/2019 13:52,adminbommg,1,1,1,0,{'2019-07-23 13:52:01': 1},1,0
773,Wichita KS,DefaultDept,(PL)Painting Ops-Bldg 7 TR Shop Booth EU-AEROPB,Blend: 10P8-10NF - EC-283 (1:1)_old,7/23/2019 14:10,7/23/2019 14:10,0.0390625,gal,7/23/2019 14:10,adminbommg,1,1,1,0,{'2019-07-23 14:10:02': 1},1,0
774,Wichita KS,DefaultDept,(PL)Painting Ops-Bldg 7 TR Shop Booth EU-AEROPB,Blend: 10P8-10NF - EC-283 (1:1)_old,7/23/2019 14:22,7/23/2019 14:22,0.00390625,gal,7/23/2019 14:22,adminbommg,1,1,1,0,{'2019-07-23 14:22:23': 1},1,0
775,Wichita KS,DefaultDept,(PL)Painting Ops-Bldg 7 TR Shop Booth EU-AEROPB,Blend: 10P8-10NF - EC-283 (1:1)_old,7/26/2019 11:21,7/26/2019 11:21,0.03125,gal,7/26/2019 11:26,adminbomgb,1,1,1,0,{'2019-07-26 11:26:37': 1},1,0
776,Wichita KS,DefaultDept,(PL)Painting Ops-Bldg 7 TR Shop Booth EU-AEROPB,Blend: 10P8-10NF - EC-283 (1:1)_old,7/26/2019 11:33,7/26/2019 11:33,0.046875,gal,7/26/2019 11:33,adminbomgb,1,1,1,0,{'2019-07-26 11:33:57': 1},1,0
777,Wichita KS,DefaultDept,(PL)Painting Ops-Bldg 7 TR Shop Booth EU-AEROPB,Blend: 10P8-10NF - EC-283 (1:1)_old,7/26/2019 13:38,7/26/2019 13:38,0.0625,gal,7/26/2019 13:38,adminbomgb,1,1,1,0,{'2019-07-26 13:38:40': 1},1,0
778,Wichita KS,DefaultDept,(PL)Painting Ops-Bldg 7 TR Shop Booth EU-AEROPB,Blend: 10P8-10NF - EC-283 (1:1)_old,7/26/2019 13:47,7/26/2019 13:47,0.1875,gal,7/26/2019 13:47,adminbomgb,1,1,1,0,{'2019-07-26 13:47:30': 1},1,0
779,Wichita KS,DefaultDept,(PL)Painting Ops-Bldg 7 TR Shop Booth EU-AEROPB,Blend: 10P8-10NF - EC-283 (1:1)_old,7/26/2019 14:02,7/26/2019 14:02,0.015625,gal,7/26/2019 14:02,adminbomgb,1,1,1,0,{'2019-07-26 14:02:47': 1},1,0
780,Wichita KS,DefaultDept,(PL)Painting Ops-Bldg 7 TR Shop Booth EU-AEROPB,Blend: 10P8-10NF - EC-283 (1:1)_old,7/26/2019 14:31,7/26/2019 14:31,0.09375,gal,7/26/2019 14:31,adminbomgb,1,1,1,0,{'2019-07-26 14:31:38': 1},1,0
781,Wichita KS,DefaultDept,(PL)Painting Ops-Bldg 7 TR Shop Booth EU-AEROPB,Blend: 10P8-10NF - EC-283 (1:1)_old,7/26/2019 15:10,7/26/2019 15:10,0.125,gal,7/26/2019 15:10,adminbomgb,1,1,1,0,{'2019-07-26 15:10:30': 1},1,0
782,Wichita KS,DefaultDept,(PL)Painting Ops-Bldg 7 TR Shop Booth EU-AEROPB,Blend: 10P8-10NF - EC-283 (1:1)_old,7/26/2019 16:16,7/26/2019 16:16,0.375,gal,7/26/2019 16:16,adminbomgb,1,1,1,0,{'2019-07-26 16:16:33': 1},1,0
783,Wichita KS,DefaultDept,(PL)Painting Ops-Bldg 7 TR Shop Booth EU-AEROPB,Blend: 10P8-10NF - EC-283 (1:1)_old,7/26/2019 16:41,7/26/2019 16:41,0.03125,gal,7/26/2019 16:58,adminbomgb,1,1,1,0,{'2019-07-26 16:58:34': 1},1,0
784,Wichita KS,DefaultDept,(PL)Painting Ops-Bldg 7 TR Shop Booth EU-AEROPB,Blend: 10P8-10NF - EC-283 (1:1)_old,7/29/2019 8:13,7/29/2019 8:13,0.0625,gal,7/29/2019 8:13,adminbomgb,1,1,1,0,{'2019-07-29 08:13:25': 1},1,0
785,Wichita KS,DefaultDept,(PL)Painting Ops-Bldg 7 TR Shop Booth EU-AEROPB,Blend: 10P8-10NF - EC-283 (1:1)_old,7/29/2019 8:16,7/29/2019 8:16,0.1875,gal,7/29/2019 8:16,adminbomgb,1,1,1,0,{'2019-07-29 08:16:19': 1},1,0
786,Wichita KS,DefaultDept,(PL)Painting Ops-Bldg 7 TR Shop Booth EU-AEROPB,Blend: 10P8-10NF - EC-283 (1:1)_old,4/18/2020 0:00,4/18/2020 0:00,0.09375,gal,6/9/2020 16:25,Kamiander,1,1,1,0,{'2020-06-09 16:25:00': 1},1,0
787,Wichita KS,DefaultDept,(PL)Painting Ops-Bldg 7 TR Shop Booth EU-AEROPB,Blend: 10P8-10NF - EC-283 (1:1)_old,6/1/2020 0:00,6/1/2020 0:00,0.0625,gal,7/28/2020 15:04,Kamiander,1,1,1,0,{'2020-07-28 15:04:02': 1},1,0
788,Wichita KS,DefaultDept,(PL)Painting Ops-Bldg 7 TR Shop Booth EU-AEROPB,Blend: 10P8-10NF - EC-283 (1:1)_old,6/2/2020 0:00,6/2/2020 0:00,0.0625,gal,7/28/2020 15:12,Kamiander,1,1,1,0,{'2020-07-28 15:12:34': 1},1,0
789,Wichita KS,DefaultDept,(PL)Painting Ops-Bldg 7 TR Shop Booth EU-AEROPB,Blend: 10P8-10NF - EC-283 (1:1)_old,6/4/2020 0:00,6/4/2020 0:00,0.0625,gal,7/28/2020 15:18,Kamiander,1,1,1,0,{'2020-07-28 15:18:40': 1},1,0
790,Wichita KS,DefaultDept,(PL)Painting Ops-Bldg 7 TR Shop Booth EU-AEROPB,Blend: 10P8-10NF - EC-283 (1:1)_old,6/6/2020 0:00,6/6/2020 0:00,0.046875,gal,7/28/2020 15:23,Kamiander,1,1,1,0,{'2020-07-28 15:23:43': 1},1,0
791,Wichita KS,DefaultDept,(PL)Painting Ops-Bldg 7 TR Shop Booth EU-AEROPB,Blend: 10P8-10NF - EC-283 (1:1)_old,6/8/2020 0:00,6/8/2020 0:00,0.0625,gal,7/28/2020 15:33,Kamiander,1,1,1,0,{'2020-07-28 15:33:18': 1},1,0
792,Wichita KS,DefaultDept,(PL)Painting Ops-Bldg 7 TR Shop Booth EU-AEROPB,Blend: 10P8-10NF - EC-283 (1:1)_old,6/9/2020 0:00,6/9/2020 0:00,0.0625,gal,7/28/2020 15:34,Kamiander,1,1,1,0,{'2020-07-28 15:34:44': 1},1,0
793,Wichita KS,DefaultDept,(PL)Painting Ops-Bldg 7 TR Shop Booth EU-AEROPB,Blend: 10P8-10NF - EC-283 (1:1)_old,6/9/2020 0:00,6/9/2020 0:00,0.09375,gal,7/28/2020 16:02,Kamiander,1,1,1,0,{'2020-07-28 16:02:34': 1},1,0
794,Wichita KS,DefaultDept,(PL)Painting Ops-Bldg 7 TR Shop Booth EU-AEROPB,Blend: 10P8-10NF - EC-283 (1:1)_old,6/12/2020 0:00,6/12/2020 0:00,0.09375,gal,7/28/2020 16:04,Kamiander,1,1,1,0,{'2020-07-28 16:04:10': 1},1,0
795,Wichita KS,DefaultDept,(PL)Painting Ops-Bldg 7 TR Shop Booth EU-AEROPB,Blend: 10P8-10NF - EC-283 (1:1)_old,6/18/2020 0:00,6/18/2020 0:00,0.09375,gal,7/28/2020 16:05,Kamiander,1,1,1,0,{'2020-07-28 16:05:25': 1},1,0
796,Wichita KS,DefaultDept,(PL)Painting Ops-Bldg 7 TR Shop Booth EU-AEROPB,Blend: 10P8-10NF - EC-283 (1:1)_old,6/25/2020 0:00,6/25/2020 0:00,0.046875,gal,7/28/2020 16:06,Kamiander,1,1,1,0,{'2020-07-28 16:06:46': 1},1,0
797,Wichita KS,DefaultDept,(PL)Painting Ops-Bldg 7 TR Shop Booth EU-AEROPB,Blend: 10P8-10NF - EC-283 (1:1)_old,6/25/2020 0:00,6/25/2020 0:00,0.09375,gal,8/11/2020 10:43,Kamiander,1,1,1,0,{'2020-08-11 10:43:14': 1},1,0
798,Wichita KS,DefaultDept,(PL)Painting Ops-Bldg 7 TR Shop Booth EU-AEROPB,Blend: 10P8-10NF - EC-283 (1:1)_old,6/27/2020 0:00,6/27/2020 0:00,0.1875,gal,8/11/2020 10:44,Kamiander,1,1,1,0,{'2020-08-11 10:44:39': 1},1,0
799,Wichita KS,DefaultDept,(PL)Painting Ops-Bldg 7 TR Shop Booth EU-AEROPB,Blend: 10P8-10NF - EC-283 (1:1)_old,6/28/2020 0:00,6/28/2020 0:00,0.1875,gal,8/11/2020 10:45,Kamiander,1,1,1,0,{'2020-08-11 10:45:58': 1},1,0
800,Wichita KS,DefaultDept,(PL)Painting Ops-Bldg 7 TR Shop Booth EU-AEROPB,Blend: 10P8-10NF - EC-283 (1:1)_old,6/30/2020 0:00,6/30/2020 0:00,0.0625,gal,8/11/2020 10:47,Kamiander,1,1,1,0,{'2020-08-11 10:47:20': 1},1,0
801,Wichita KS,DefaultDept,(PL)Painting Ops-Bldg 7 TR Shop Booth EU-AEROPB,Blend: 10P8-10NF - EC-283 (1:1)_old,7/9/2020 0:00,7/9/2020 0:00,0.0625,gal,8/26/2020 14:19,Kamiander,1,1,1,0,{'2020-08-26 14:19:27': 1},1,0
802,Wichita KS,DefaultDept,(PL)Painting Ops-Bldg 7 TR Shop Booth EU-AEROPB,Blend: 10P8-10NF - EC-283 (1:1)_old,7/11/2020 0:00,7/11/2020 0:00,0.25,gal,8/26/2020 14:21,Kamiander,1,1,1,0,{'2020-08-26 14:21:31': 1},1,0
803,Wichita KS,DefaultDept,(PL)Painting Ops-Bldg 7 TR Shop Booth EU-AEROPB,Blend: 10P8-10NF - EC-283 (1:1)_old,7/14/2020 0:00,7/14/2020 0:00,0.25,gal,8/26/2020 14:23,Kamiander,1,1,1,0,{'2020-08-26 14:23:15': 1},1,0
804,Wichita KS,DefaultDept,(PL)Painting Ops-Bldg 7 TR Shop Booth EU-AEROPB,Blend: 10P8-10NF - EC-283 (1:1)_old,7/17/2020 0:00,7/17/2020 0:00,0.125,gal,8/26/2020 14:25,Kamiander,1,1,1,0,{'2020-08-26 14:25:42': 1},1,0
805,Wichita KS,DefaultDept,(PL)Painting Ops-Bldg 7 TR Shop Booth EU-AEROPB,Blend: 10P8-10NF - EC-283 (1:1)_old,7/18/2020 0:00,7/18/2020 0:00,0.0625,gal,8/26/2020 14:31,Kamiander,1,1,1,0,{'2020-08-26 14:31:19': 1},1,0
806,Wichita KS,DefaultDept,(PL)Painting Ops-Bldg 7 TR Shop Booth EU-AEROPB,Blend: 10P8-10NF - EC-283 (1:1)_old,7/18/2020 0:00,7/18/2020 0:00,0.125,gal,8/26/2020 14:29,Kamiander,1,1,1,0,{'2020-08-26 14:29:27': 1},1,0
807,Wichita KS,DefaultDept,(PL)Painting Ops-Bldg 7 TR Shop Booth EU-AEROPB,Blend: 10P8-10NF - EC-283 (1:1)_old,7/24/2020 0:00,7/24/2020 0:00,0.09375,gal,8/26/2020 14:33,Kamiander,1,1,1,0,{'2020-08-26 14:33:25': 1},1,0
808,Wichita KS,DefaultDept,(PL)Painting Ops-Bldg 7 TR Shop Booth EU-AEROPB,Blend: 10P8-10NF - EC-283 (1:1)_old,8/2/2020 0:00,8/2/2020 0:00,0.09375,gal,9/30/2020 10:17,kamiander,1,1,1,0,{'2020-09-30 10:17:48': 1},1,0
809,Wichita KS,DefaultDept,(PL)Painting Ops-Bldg 7 TR Shop Booth EU-AEROPB,Blend: 10P8-10NF - EC-283 (1:1)_old,8/4/2020 0:00,8/4/2020 0:00,0.09375,gal,10/12/2020 9:33,Kamiander,1,1,1,0,{'2020-10-12 09:33:40': 1},1,0
810,Wichita KS,DefaultDept,(PL)Painting Ops-Bldg 7 TR Shop Booth EU-AEROPB,Blend: 10P8-10NF - EC-283 (1:1)_old,8/5/2020 0:00,8/5/2020 0:00,0.09375,gal,10/12/2020 9:35,Kamiander,1,1,1,0,{'2020-10-12 09:35:07': 1},1,0
811,Wichita KS,DefaultDept,(PL)Painting Ops-Bldg 7 TR Shop Booth EU-AEROPB,Blend: 10P8-10NF - EC-283 (1:1)_old,8/6/2020 0:00,8/6/2020 0:00,0.1875,gal,10/12/2020 9:36,Kamiander,1,1,1,0,{'2020-10-12 09:36:39': 1},1,0
812,Wichita KS,DefaultDept,(PL)Painting Ops-Bldg 7 TR Shop Booth EU-AEROPB,Blend: 10P8-10NF - EC-283 (1:1)_old,8/7/2020 0:00,8/7/2020 0:00,0.1875,gal,10/12/2020 9:38,Kamiander,1,1,1,0,{'2020-10-12 09:38:04': 1},1,0
813,Wichita KS,DefaultDept,(PL)Painting Ops-Bldg 7 TR Shop Booth EU-AEROPB,Blend: 10P8-10NF - EC-283 (1:1)_old,8/9/2020 0:00,8/9/2020 0:00,0.046875,gal,10/12/2020 9:39,Kamiander,1,1,1,0,{'2020-10-12 09:39:51': 1},1,0
814,Wichita KS,DefaultDept,(PL)Painting Ops-Bldg 7 TR Shop Booth EU-AEROPB,Blend: 10P8-10NF - EC-283 (1:1)_old,8/9/2020 0:00,8/9/2020 0:00,0.09375,gal,10/12/2020 9:41,Kamiander,1,1,1,0,{'2020-10-12 09:41:11': 1},1,0
815,Wichita KS,DefaultDept,(PL)Painting Ops-Bldg 7 TR Shop Booth EU-AEROPB,Blend: 10P8-10NF - EC-283 (1:1)_old,8/10/2020 0:00,8/10/2020 0:00,0.0625,gal,10/12/2020 9:42,Kamiander,1,1,1,0,{'2020-10-12 09:42:34': 1},1,0
816,Wichita KS,DefaultDept,(PL)Painting Ops-Bldg 7 TR Shop Booth EU-AEROPB,Blend: 10P8-10NF - EC-283 (1:1)_old,8/12/2020 0:00,8/12/2020 0:00,0.0625,gal,10/12/2020 9:46,Kamiander,1,1,1,0,{'2020-10-12 09:46:37': 1},1,0
817,Wichita KS,DefaultDept,(PL)Painting Ops-Bldg 7 TR Shop Booth EU-AEROPB,Blend: 10P8-10NF - EC-283 (1:1)_old,8/13/2020 0:00,8/13/2020 0:00,0.0625,gal,10/12/2020 9:48,Kamiander,1,1,1,0,{'2020-10-12 09:48:09': 1},1,0
818,Wichita KS,DefaultDept,(PL)Painting Ops-Bldg 7 TR Shop Booth EU-AEROPB,Blend: 10P8-10NF - EC-283 (1:1)_old,8/14/2020 0:00,8/14/2020 0:00,0.0625,gal,10/12/2020 9:49,Kamiander,1,1,1,0,{'2020-10-12 09:49:48': 1},1,0
819,Wichita KS,DefaultDept,(PL)Painting Ops-Bldg 7 TR Shop Booth EU-AEROPB,Blend: 10P8-10NF - EC-283 (1:1)_old,8/14/2020 0:00,8/14/2020 0:00,0.1875,gal,10/12/2020 9:52,Kamiander,1,1,1,0,{'2020-10-12 09:52:09': 1},1,0
820,Wichita KS,DefaultDept,(PL)Painting Ops-Bldg 7 TR Shop Booth EU-AEROPB,Blend: 10P8-10NF - EC-283 (1:1)_old,8/16/2020 0:00,8/16/2020 0:00,0.046875,gal,10/12/2020 9:53,Kamiander,1,1,1,0,{'2020-10-12 09:53:36': 1},1,0
821,Wichita KS,DefaultDept,(PL)Painting Ops-Bldg 7 TR Shop Booth EU-AEROPB,Blend: 10P8-10NF - EC-283 (1:1)_old,8/18/2020 0:00,8/18/2020 0:00,0.09375,gal,10/12/2020 9:55,Kamiander,1,1,1,0,{'2020-10-12 09:55:06': 1},1,0
822,Wichita KS,DefaultDept,(PL)Painting Ops-Bldg 7 TR Shop Booth EU-AEROPB,Blend: 10P8-10NF - EC-283 (1:1)_old,8/22/2020 0:00,8/22/2020 0:00,0.03125,gal,10/12/2020 9:56,Kamiander,1,1,1,0,{'2020-10-12 09:56:26': 1},1,0
823,Wichita KS,DefaultDept,(PL)Painting Ops-Bldg 7 TR Shop Booth EU-AEROPB,Blend: 10P8-10NF - EC-283 (1:1)_old,8/22/2020 0:00,8/22/2020 0:00,0.09375,gal,10/12/2020 9:57,Kamiander,1,1,1,0,{'2020-10-12 09:57:44': 1},1,0
824,Wichita KS,DefaultDept,(PL)Painting Ops-Bldg 7 TR Shop Booth EU-AEROPB,Blend: 10P8-10NF - EC-283 (1:1)_old,8/23/2020 0:00,8/23/2020 0:00,0.09375,gal,10/12/2020 9:59,Kamiander,1,1,1,0,{'2020-10-12 09:59:12': 1},1,0
825,Wichita KS,DefaultDept,(PL)Painting Ops-Bldg 7 TR Shop Booth EU-AEROPB,Blend: 10P8-10NF - EC-283 (1:1)_old,8/26/2020 0:00,8/26/2020 0:00,0.09375,gal,10/12/2020 10:00,Kamiander,1,1,1,0,{'2020-10-12 10:00:35': 1},1,0
826,Wichita KS,DefaultDept,(PL)Painting Ops-Bldg 7 TR Shop Booth EU-AEROPB,Blend: 10P8-10NF - EC-283 (1:1)_old,8/28/2020 0:00,8/28/2020 0:00,0.09375,gal,10/12/2020 10:02,Kamiander,1,1,1,0,{'2020-10-12 10:02:33': 1},1,0
827,Wichita KS,DefaultDept,(PL)Painting Ops-Bldg 7 TR Shop Booth EU-AEROPB,Blend: 10P8-10NF - EC-283 (1:1)_old,9/1/2020 0:00,9/1/2020 0:00,0.09375,gal,10/14/2020 9:58,Kamiander,1,1,1,0,{'2020-10-14 09:58:18': 1},1,0
828,Wichita KS,DefaultDept,(PL)Painting Ops-Bldg 7 TR Shop Booth EU-AEROPB,Blend: 10P8-10NF - EC-283 (1:1)_old,9/3/2020 0:00,9/3/2020 0:00,0.0234375,gal,10/14/2020 9:59,Kamiander,1,1,1,0,{'2020-10-14 09:59:49': 1},1,0
829,Wichita KS,DefaultDept,(PL)Painting Ops-Bldg 7 TR Shop Booth EU-AEROPB,Blend: 10P8-10NF - EC-283 (1:1)_old,9/3/2020 0:00,9/3/2020 0:00,0.25,gal,10/14/2020 10:01,Kamiander,1,1,1,0,{'2020-10-14 10:01:09': 1},1,0
830,Wichita KS,DefaultDept,(PL)Painting Ops-Bldg 7 TR Shop Booth EU-AEROPB,Blend: 10P8-10NF - EC-283 (1:1)_old,9/16/2020 0:00,9/16/2020 0:00,0.0625,gal,10/14/2020 10:02,Kamiander,1,1,1,0,{'2020-10-14 10:02:29': 1},1,0
831,Wichita KS,DefaultDept,(PL)Painting Ops-Bldg 7 TR Shop Booth EU-AEROPB,Blend: 10P8-10NF - EC-283 (1:1)_old,9/17/2020 0:00,9/17/2020 0:00,0.046875,gal,10/14/2020 10:03,Kamiander,1,1,1,0,{'2020-10-14 10:03:47': 1},1,0
832,Wichita KS,DefaultDept,(PL)Painting Ops-Bldg 7 TR Shop Booth EU-AEROPB,Blend: 10P8-10NF - EC-283 (1:1)_old,9/26/2020 0:00,9/26/2020 0:00,0.1875,gal,10/14/2020 10:05,Kamiander,1,1,1,0,{'2020-10-14 10:05:07': 1},1,0
833,Wichita KS,DefaultDept,(PL)Painting Ops-Bldg 7 TR Shop Booth EU-AEROPB,Blend: 10P8-10NF - EC-283 (1:1)_old,9/28/2020 0:00,9/28/2020 0:00,0.125,gal,10/14/2020 10:06,Kamiander,1,1,1,0,{'2020-10-14 10:06:29': 1},1,0
834,Wichita KS,DefaultDept,(PL)Painting Ops-Bldg 7 TR Shop Booth EU-AEROPB,Blend: 10P8-10NF - EC-283 (1:1)_old,9/29/2020 0:00,9/29/2020 0:00,0.125,gal,10/14/2020 10:08,Kamiander,1,1,1,0,{'2020-10-14 10:08:39': 1},1,0
835,Wichita KS,DefaultDept,(PL)Painting Ops-Bldg 7 TR Shop Booth EU-AEROPB,Blend: 10P8-10NF - EC-283 (1:1)_old,9/30/2020 0:00,9/30/2020 0:00,0.125,gal,10/14/2020 10:10,Kamiander,1,1,1,0,{'2020-10-14 10:10:02': 1},1,0
836,Wichita KS,DefaultDept,(PL)Painting Ops-Bldg 7 TR Shop Booth EU-AEROPB,Blend: 10P8-10NF - EC-283 (1:1)_old,10/2/2020 7:00,10/2/2020 7:00,0.125,gal,12/18/2020 10:21,dlyon,1,1,1,0,{'2020-12-18 10:21:34': 1},1,0
837,Wichita KS,DefaultDept,(PL)Painting Ops-Bldg 7 TR Shop Booth EU-AEROPB,Blend: 10P8-10NF - EC-283 (1:1)_old,10/5/2020 22:00,10/5/2020 22:00,0.125,gal,12/18/2020 10:38,dlyon,1,1,1,0,{'2020-12-18 10:38:28': 1},1,0
838,Wichita KS,DefaultDept,(PL)Painting Ops-Bldg 7 TR Shop Booth EU-AEROPB,Blend: 10P8-10NF - EC-283 (1:1)_old,10/7/2020 9:00,10/7/2020 9:00,0.0625,gal,12/18/2020 10:51,dlyon,1,1,1,0,{'2020-12-18 10:51:25': 1},1,0
839,Wichita KS,DefaultDept,(PL)Painting Ops-Bldg 7 TR Shop Booth EU-AEROPB,Blend: 10P8-10NF - EC-283 (1:1)_old,10/8/2020 17:00,10/8/2020 17:00,0.03125,gal,12/18/2020 11:01,dlyon,1,1,1,0,{'2020-12-18 11:01:44': 1},1,0
840,Wichita KS,DefaultDept,(PL)Painting Ops-Bldg 7 TR Shop Booth EU-AEROPB,Blend: 10P8-10NF - EC-283 (1:1)_old,10/12/2020 22:00,10/12/2020 22:00,0.125,gal,12/18/2020 11:08,dlyon,1,1,1,0,{'2020-12-18 11:08:46': 1},1,0
841,Wichita KS,DefaultDept,(PL)Painting Ops-Bldg 7 TR Shop Booth EU-AEROPB,Blend: 10P8-10NF - EC-283 (1:1)_old,10/19/2020 16:00,10/19/2020 16:00,0.3125,gal,12/18/2020 11:15,dlyon,1,1,1,0,{'2020-12-18 11:15:04': 1},1,0
842,Wichita KS,DefaultDept,(PL)Painting Ops-Bldg 7 TR Shop Booth EU-AEROPB,Blend: 10P8-10NF - EC-283 (1:1)_old,10/20/2020 17:45,10/20/2020 17:45,0.109375,gal,12/18/2020 11:21,dlyon,1,1,1,0,{'2020-12-18 11:21:28': 1},1,0
843,Wichita KS,DefaultDept,(PL)Painting Ops-Bldg 7 TR Shop Booth EU-AEROPB,Blend: 10P8-10NF - EC-283 (1:1)_old,10/20/2020 22:00,10/20/2020 22:00,0.125,gal,12/18/2020 11:37,dlyon,1,1,1,0,{'2020-12-18 11:37:29': 1},1,0
844,Wichita KS,DefaultDept,(PL)Painting Ops-Bldg 7 TR Shop Booth EU-AEROPB,Blend: 10P8-10NF - EC-283 (1:1)_old,10/27/2020 6:00,10/27/2020 6:00,0.0625,gal,12/18/2020 11:43,dlyon,1,1,1,0,{'2020-12-18 11:43:13': 1},1,0
845,Wichita KS,DefaultDept,(PL)Painting Ops-Bldg 7 TR Shop Booth EU-AEROPB,Blend: 10P8-10NF - EC-283 (1:1)_old,10/27/2020 22:00,10/27/2020 22:00,0.125,gal,12/18/2020 11:48,dlyon,1,1,1,0,{'2020-12-18 11:48:40': 1},1,0
846,Wichita KS,DefaultDept,(PL)Painting Ops-Bldg 7 TR Shop Booth EU-AEROPB,Blend: 10P8-10NF - EC-283 (1:1)_old,10/29/2020 22:00,10/29/2020 22:00,0.125,gal,12/18/2020 11:54,dlyon,1,1,1,0,{'2020-12-18 11:54:02': 1},1,0
847,Wichita KS,DefaultDept,(PL)Painting Ops-Bldg 7 TR Shop Booth EU-AEROPB,Blend: 10P8-10NF - EC-283 (1:1)_old,11/3/2020 16:00,11/3/2020 16:00,0.03125,gal,12/18/2020 12:25,dlyon,1,1,1,0,{'2020-12-18 12:25:11': 1},1,0
848,Wichita KS,DefaultDept,(PL)Painting Ops-Bldg 7 TR Shop Booth EU-AEROPB,Blend: 10P8-10NF - EC-283 (1:1)_old,11/6/2020 7:00,11/6/2020 7:00,0.03125,gal,12/18/2020 12:32,dlyon,1,1,1,0,{'2020-12-18 12:32:57': 1},1,0
849,Wichita KS,DefaultDept,(PL)Painting Ops-Bldg 7 TR Shop Booth EU-AEROPB,Blend: 10P8-10NF - EC-283 (1:1)_old,11/14/2020 22:00,11/14/2020 22:00,0.125,gal,12/18/2020 12:50,dlyon,1,1,1,0,{'2020-12-18 12:50:31': 1},1,0
850,Wichita KS,DefaultDept,(PL)Painting Ops-Bldg 7 TR Shop Booth EU-AEROPB,Blend: 10P8-10NF - EC-283 (1:1)_old,11/18/2020 22:00,11/18/2020 22:00,0.125,gal,12/18/2020 12:56,dlyon,1,1,1,0,{'2020-12-18 12:56:54': 1},1,0
851,Wichita KS,DefaultDept,(PL)Painting Ops-Bldg 7 TR Shop Booth EU-AEROPB,Blend: 10P8-10NF - EC-283 (1:1)_old,11/21/2020 12:30,11/21/2020 12:30,0.15625,gal,12/18/2020 13:02,dlyon,1,1,1,0,{'2020-12-18 13:02:44': 1},1,0
852,Wichita KS,DefaultDept,(PL)Painting Ops-Bldg 7 TR Shop Booth EU-AEROPB,Blend: 10P8-10NF - EC-283 (1:1)_old,11/25/2020 5:30,11/25/2020 5:30,0.125,gal,12/18/2020 13:19,dlyon,1,1,1,0,{'2020-12-18 13:19:22': 1},1,0
853,Wichita KS,DefaultDept,(PL)Painting Ops-Bldg 7 TR Shop Booth EU-AEROPB,Blend: 10P8-10NF - EC-283 (1:1)_old,11/27/2020 18:30,11/27/2020 18:30,0.1875,gal,12/18/2020 13:12,dlyon,1,1,1,0,{'2020-12-18 13:12:25': 1},1,0
854,Wichita KS,DefaultDept,(PL)Painting Ops-Bldg 7 TR Shop Booth EU-AEROPB,Blend: A02188 - CM0830081 - CM0830H18 (3:1:3/8),8/19/2019 21:00,8/19/2019 21:00,0.034179688,gal,9/18/2019 8:52,adminbomgb,1,1,1,0,{'2019-09-18 08:52:12': 1},1,0
855,Wichita KS,DefaultDept,(PL)Painting Ops-Bldg 7 TR Shop Booth EU-AEROPB,Blend: A02188 - CM0830081 - CM0830H18 (3:1:3/8),9/3/2019 9:20,9/3/2019 9:20,0.034179688,gal,10/15/2019 13:32,adminbomgb,1,1,1,0,{'2019-10-15 13:32:05': 1},1,0
856,Wichita KS,DefaultDept,(PL)Painting Ops-Bldg 7 TR Shop Booth EU-AEROPB,Blend: CA 8800/I1050 - 8800Z - 8800CT2 (2:1:1),9/19/2019 7:00,9/19/2019 7:00,0.03125,gal,10/15/2019 14:21,adminbomgb,1,1,1,0,{'2019-10-15 14:21:11': 1},1,0
857,Wichita KS,DefaultDept,(PL)Painting Ops-Bldg 7 TR Shop Booth EU-AEROPB,Blend: CA 8800/I1050 - 8800Z - 8800CT2 (2:1:1),9/28/2019 7:00,9/28/2019 7:00,0.125,gal,10/15/2019 14:23,adminbomgb,1,1,1,0,{'2019-10-15 14:23:33': 1},1,0
858,Wichita KS,DefaultDept,(PL)Painting Ops-Bldg 7 TR Shop Booth EU-AEROPB,Blend: CA 8800/I1050 - 8800Z - 8800CT2 (2:1:1),10/3/2019 12:00,10/3/2019 12:00,0.125,gal,12/19/2019 16:04,adminbomry,1,1,1,0,{'2019-12-19 16:04:12': 1},1,0
859,Wichita KS,DefaultDept,(PL)Painting Ops-Bldg 7 TR Shop Booth EU-AEROPB,Blend: CA 8800/I1050 - 8800Z - 8800CT2 (2:1:1),10/14/2019 12:00,10/14/2019 12:00,0.0625,gal,12/19/2019 16:04,adminbomry,1,1,1,0,{'2019-12-19 16:04:12': 1},1,0
860,Wichita KS,DefaultDept,(PL)Painting Ops-Bldg 7 TR Shop Booth EU-AEROPB,Blend: CA 8800/I1050 - 8800Z - 8800CT2 (2:1:1),11/20/2019 6:42,11/20/2019 6:42,0.0625,gal,1/13/2020 15:59,adminbomgb,1,1,1,0,{'2020-01-13 15:59:55': 1},1,0
861,Wichita KS,DefaultDept,(PL)Painting Ops-Bldg 7 TR Shop Booth EU-AEROPB,Blend: CA 8800/I1050 - 8800Z - 8800CT2 (2:1:1),11/20/2019 10:00,11/20/2019 10:00,0.25,gal,1/13/2020 16:29,adminbomgb,1,1,1,0,{'2020-01-13 16:29:56': 1},1,0
862,Wichita KS,DefaultDept,(PL)Painting Ops-Bldg 7 TR Shop Booth EU-AEROPB,Blend: CA 8800/I1050 - 8800Z - 8800CT2 (2:1:1),12/18/2019 10:00,12/18/2019 10:00,0.0625,gal,1/13/2020 16:38,adminbomgb,1,1,1,0,{'2020-01-13 16:38:15': 1},1,0
863,Wichita KS,DefaultDept,(PL)Painting Ops-Bldg 7 TR Shop Booth EU-AEROPB,Blend: CA 8800/I1050 - 8800Z - 8800CT2 (2:1:1),12/19/2019 10:00,12/19/2019 10:00,0.0625,gal,1/13/2020 16:42,adminbomgb,1,1,1,0,{'2020-01-13 16:42:04': 1},1,0
864,Wichita KS,DefaultDept,(PL)Painting Ops-Bldg 7 TR Shop Booth EU-AEROPB,Blend: CA 8800/I1050 - 8800Z - 8800CT2 (2:1:1),1/9/2020 10:00,1/9/2020 10:00,0.03125,gal,4/28/2020 16:30,adminbomjs,1,1,1,0,{'2020-04-28 16:30:16': 1},1,0
865,Wichita KS,DefaultDept,(PL)Painting Ops-Bldg 7 TR Shop Booth EU-AEROPB,Blend: CA 8800/I1050 - 8800Z - 8800CT2 (2:1:1),1/23/2020 13:00,1/23/2020 13:00,0.0625,gal,4/28/2020 16:46,adminbomjs,1,1,1,0,{'2020-04-28 16:46:15': 1},1,0
866,Wichita KS,DefaultDept,(PL)Painting Ops-Bldg 7 TR Shop Booth EU-AEROPB,Blend: CA 8800/I1050 - 8800Z - 8800CT2 (2:1:1),1/27/2020 7:00,1/27/2020 7:00,0.0625,gal,4/28/2020 16:52,adminbomjs,1,1,1,0,{'2020-04-28 16:52:25': 1},1,0
867,Wichita KS,DefaultDept,(PL)Painting Ops-Bldg 7 TR Shop Booth EU-AEROPB,Blend: CA 8800/I1050 - 8800Z - 8800CT2 (2:1:1),2/21/2020 16:36,2/21/2020 16:36,0.03125,gal,5/7/2020 16:37,adminbomry,1,1,1,0,{'2020-05-07 16:37:10': 1},1,0
868,Wichita KS,DefaultDept,(PL)Painting Ops-Bldg 7 TR Shop Booth EU-AEROPB,Blend: CA 8800/I1050 - 8800Z - 8800CT2 (2:1:1),2/24/2020 16:52,2/24/2020 16:52,0.1875,gal,5/7/2020 16:53,adminbomry,1,1,1,0,{'2020-05-07 16:53:16': 1},1,0
869,Wichita KS,DefaultDept,(PL)Painting Ops-Bldg 7 TR Shop Booth EU-AEROPB,Blend: CA 8800/I1050 - 8800Z - 8800CT2 (2:1:1),8/9/2020 0:00,8/9/2020 0:00,0.125,gal,10/12/2020 10:53,Kamiander,1,1,1,0,{'2020-10-12 10:53:07': 1},1,0
870,Wichita KS,DefaultDept,(PL)Painting Ops-Bldg 7 TR Shop Booth EU-AEROPB,Blend: CA 8800/I1050 - 8800Z - 8800CT2 (2:1:1),8/10/2020 0:00,8/10/2020 0:00,0.09375,gal,10/12/2020 10:51,Kamiander,1,1,1,0,{'2020-10-12 10:51:39': 1},1,0
871,Wichita KS,DefaultDept,(PL)Painting Ops-Bldg 7 TR Shop Booth EU-AEROPB,Blend: CA 8800/I1050 - 8800Z - 8800CT2 (2:1:1),8/11/2020 0:00,8/11/2020 0:00,0.0625,gal,10/12/2020 10:50,Kamiander,1,1,1,0,{'2020-10-12 10:50:10': 1},1,0
872,Wichita KS,DefaultDept,(PL)Painting Ops-Bldg 7 TR Shop Booth EU-AEROPB,Blend: CA 8800/I1050 - 8800Z - 8800CT2 (2:1:1),8/23/2020 0:00,8/23/2020 0:00,0.125,gal,10/12/2020 10:48,Kamiander,1,1,1,0,{'2020-10-12 10:48:24': 1},1,0
873,Wichita KS,DefaultDept,(PL)Painting Ops-Bldg 7 TR Shop Booth EU-AEROPB,Blend: CA8800 - CA8800CT2 - CA8800Z (2:1:1),11/20/2019 0:00,11/20/2019 0:00,0.0625,gal,1/27/2020 11:03,adminbomry,1,1,1,0,{'2020-01-27 11:03:15': 1},1,0
874,Wichita KS,DefaultDept,(PL)Painting Ops-Bldg 7 TR Shop Booth EU-AEROPB,Blend: CA8800 - CA8800CT2 - CA8800Z (2:1:1),2/12/2020 15:16,2/12/2020 15:16,0.03125,gal,5/7/2020 15:16,adminbomry,1,1,1,0,{'2020-05-07 15:16:58': 1},1,0
875,Wichita KS,DefaultDept,(PL)Painting Ops-Bldg 7 TR Shop Booth EU-AEROPB,Blend: CA8800 - CA8800CT2 - CA8800Z (2:1:1),4/11/2020 0:00,4/11/2020 0:00,0.0390625,gal,6/10/2020 10:03,Kamiander,1,1,1,0,{'2020-06-10 10:03:28': 1},1,0
876,Wichita KS,DefaultDept,(PL)Painting Ops-Bldg 7 TR Shop Booth EU-AEROPB,Blend: CA8800 - CA8800CT2 - CA8800Z (2:1:1),6/1/2020 0:00,6/1/2020 0:00,0.09375,gal,7/28/2020 15:05,Kamiander,1,1,1,0,{'2020-07-28 15:05:52': 1},1,0
877,Wichita KS,DefaultDept,(PL)Painting Ops-Bldg 7 TR Shop Booth EU-AEROPB,Blend: CA8800 F16473 - 8800CT2 - 8800Z (2:1:1),8/9/2019 18:30,8/9/2019 18:30,0.09375,gal,9/17/2019 16:54,adminbomgb,1,1,1,0,{'2019-09-17 16:54:13': 1},1,0
878,Wichita KS,DefaultDept,(PL)Painting Ops-Bldg 7 TR Shop Booth EU-AEROPB,Blend: CA8800 F16473 - 8800CT2 - 8800Z (2:1:1),8/15/2019 5:00,8/15/2019 5:00,0.125,gal,9/18/2019 8:43,adminbomgb,1,1,1,0,{'2019-09-18 08:43:33': 1},1,0
879,Wichita KS,DefaultDept,(PL)Painting Ops-Bldg 7 TR Shop Booth EU-AEROPB,Blend: CA8800 F16473 - 8800CT2 - 8800Z (2:1:1),8/21/2019 1:00,8/21/2019 1:00,0.0625,gal,9/18/2019 8:54,adminbomgb,1,1,1,0,{'2019-09-18 08:54:43': 1},1,0
880,Wichita KS,DefaultDept,(PL)Painting Ops-Bldg 7 TR Shop Booth EU-AEROPB,Blend: CA8800 F16473 - 8800CT2 - 8800Z (2:1:1),10/14/2019 12:00,10/14/2019 12:00,0.03125,gal,12/19/2019 16:04,adminbomry,1,1,1,0,{'2019-12-19 16:04:12': 1},1,0
881,Wichita KS,DefaultDept,(PL)Painting Ops-Bldg 7 TR Shop Booth EU-AEROPB,Blend: CA8800 F16473 - 8800CT2 - 8800Z (2:1:1),10/30/2019 12:00,10/30/2019 12:00,0.125,gal,12/19/2019 16:04,adminbomry,1,1,1,0,{'2019-12-19 16:04:12': 1},1,0
882,Wichita KS,DefaultDept,(PL)Painting Ops-Bldg 7 TR Shop Booth EU-AEROPB,Blend: CA8800 F16473 - 8800CT2 - 8800Z (2:1:1),10/31/2019 12:00,10/31/2019 12:00,0.0625,gal,12/19/2019 16:04,adminbomry,1,1,1,0,{'2019-12-19 16:04:12': 1},1,0
883,Wichita KS,DefaultDept,(PL)Painting Ops-Bldg 7 TR Shop Booth EU-AEROPB,Blend: CA8800/F16473 - CA8800Z - CA8800CT2 (2-1-1),1/25/2019 15:23,1/25/2019 15:23,0.0625,gal,1/25/2019 15:23,adminbomna,1,1,1,0,{'2019-01-25 15:23:24': 1},1,0
884,Wichita KS,DefaultDept,(PL)Painting Ops-Bldg 7 TR Shop Booth EU-AEROPB,Blend: CA8800/F16473 - CA8800Z - CA8800CT2 (2-1-1),1/25/2019 16:32,1/25/2019 16:32,0.25,gal,1/25/2019 16:33,adminbomcb,1,1,1,0,{'2019-01-25 16:33:00': 1},1,0
885,Wichita KS,DefaultDept,(PL)Painting Ops-Bldg 7 TR Shop Booth EU-AEROPB,Blend: CA8800/F16473 - CA8800Z - CA8800CT2 (2-1-1),1/28/2019 10:24,1/28/2019 10:24,0.0625,gal,1/28/2019 10:24,adminbomcb,1,1,1,0,{'2019-01-28 10:24:35': 1},1,0
886,Wichita KS,DefaultDept,(PL)Painting Ops-Bldg 7 TR Shop Booth EU-AEROPB,Blend: CA8800/F16473 - CA8800Z - CA8800CT2 (2-1-1),1/28/2019 10:44,1/28/2019 10:44,0.09375,gal,1/28/2019 10:44,adminbomcb,1,1,1,0,{'2019-01-28 10:44:49': 1},1,0
887,Wichita KS,DefaultDept,(PL)Painting Ops-Bldg 7 TR Shop Booth EU-AEROPB,Blend: CA8800/F16473 - CA8800Z - CA8800CT2 (2-1-1),1/28/2019 14:34,1/28/2019 14:34,0.125,gal,1/28/2019 14:34,adminbommg,1,1,1,0,{'2019-01-28 14:34:28': 1},1,0
888,Wichita KS,DefaultDept,(PL)Painting Ops-Bldg 7 TR Shop Booth EU-AEROPB,Blend: CA8800/F16473 - CA8800Z - CA8800CT2 (2-1-1),1/29/2019 14:19,1/29/2019 14:19,0.0625,gal,1/29/2019 14:19,adminbommg,1,1,1,0,{'2019-01-29 14:19:39': 1},1,0
889,Wichita KS,DefaultDept,(PL)Painting Ops-Bldg 7 TR Shop Booth EU-AEROPB,Blend: CA8800/F16473 - CA8800Z - CA8800CT2 (2-1-1),7/3/2019 9:30,7/3/2019 9:30,0.125,gal,8/20/2019 16:56,adminbomgb,1,1,1,0,{'2019-08-20 16:56:11': 1},1,0
890,Wichita KS,DefaultDept,(PL)Painting Ops-Bldg 7 TR Shop Booth EU-AEROPB,Blend: CA8800/F16473 - CA8800Z - CA8800CT2 (2-1-1),7/18/2019 14:28,7/18/2019 14:28,0.0625,gal,7/18/2019 14:28,adminbommg,1,1,1,0,{'2019-07-18 14:28:30': 1},1,0
891,Wichita KS,DefaultDept,(PL)Painting Ops-Bldg 7 TR Shop Booth EU-AEROPB,Blend: CA8800/F16473 - CA8800Z - CA8800CT2 (2-1-1),7/26/2019 11:50,7/26/2019 11:50,0.0625,gal,7/26/2019 11:50,adminbomgb,1,1,1,0,{'2019-07-26 11:50:35': 1},1,0
892,Wichita KS,DefaultDept,(PL)Painting Ops-Bldg 7 TR Shop Booth EU-AEROPB,Blend: CA8800/F16473 - CA8800Z - CA8800CT2 (2-1-1),7/26/2019 11:53,7/26/2019 11:53,0.125,gal,7/26/2019 11:53,adminbomgb,1,1,1,0,{'2019-07-26 11:53:31': 1},1,0
893,Wichita KS,DefaultDept,(PL)Painting Ops-Bldg 7 TR Shop Booth EU-AEROPB,Blend: CA8800/F16473 - CA8800Z - CA8800CT2 (2-1-1),1/19/2020 10:00,1/19/2020 10:00,0.09375,gal,8/18/2020 18:18,adminbomjs,1,1,1,0,{'2020-08-18 18:18:10': 1},1,0
894,Wichita KS,DefaultDept,(PL)Painting Ops-Bldg 7 TR Shop Booth EU-AEROPB,Blend: CA8800/F16473 - CA8800Z - CA8800CT2 (3-1-1),7/18/2019 15:16,7/18/2019 15:16,0.03125,gal,7/18/2019 15:16,adminbommg,1,1,1,0,{'2019-07-18 15:16:06': 1},1,0
895,Wichita KS,DefaultDept,(PL)Painting Ops-Bldg 7 TR Shop Booth EU-AEROPB,Blend: CA8800/I1050 - CA8800Z - CA8800CT2 (2-1-1),1/25/2019 14:23,1/25/2019 14:23,0.125,gal,1/25/2019 14:23,adminbomna,1,1,1,0,{'2019-01-25 14:23:21': 1},1,0
896,Wichita KS,DefaultDept,(PL)Painting Ops-Bldg 7 TR Shop Booth EU-AEROPB,Blend: CA8800/I1050 - CA8800Z - CA8800CT2 (2-1-1),1/28/2019 13:38,1/28/2019 13:38,0.03125,gal,1/28/2019 13:38,adminbomcb,1,1,1,0,{'2019-01-28 13:38:39': 1},1,0
897,Wichita KS,DefaultDept,(PL)Painting Ops-Bldg 7 TR Shop Booth EU-AEROPB,Blend: CA8800/I1050 - CA8800Z - CA8800CT2 (2-1-1),1/28/2019 14:27,1/28/2019 14:27,0.0625,gal,1/28/2019 14:27,adminbommg,1,1,1,0,{'2019-01-28 14:27:10': 1},1,0
898,Wichita KS,DefaultDept,(PL)Painting Ops-Bldg 7 TR Shop Booth EU-AEROPB,Blend: CA8800/I1050 - CA8800Z - CA8800CT2 (2-1-1),1/29/2019 14:19,1/29/2019 14:19,0.03125,gal,1/29/2019 14:20,adminbommg,1,1,1,0,{'2019-01-29 14:20:04': 1},1,0
899,Wichita KS,DefaultDept,(PL)Painting Ops-Bldg 7 TR Shop Booth EU-AEROPB,Blend: CA8800/I1050 - CA8800Z - CA8800CT2 (2-1-1),7/18/2019 13:35,7/18/2019 13:35,0.25,gal,7/18/2019 13:35,adminbommg,1,1,1,0,{'2019-07-18 13:35:18': 1},1,0
900,Wichita KS,DefaultDept,(PL)Painting Ops-Bldg 7 TR Shop Booth EU-AEROPB,Blend: CA8800/I1050 - CA8800Z - CA8800CT2 (2-1-1),7/18/2019 13:41,7/18/2019 13:41,0.0625,gal,7/18/2019 13:41,adminbommg,1,1,1,0,{'2019-07-18 13:41:55': 1},1,0
901,Wichita KS,DefaultDept,(PL)Painting Ops-Bldg 7 TR Shop Booth EU-AEROPB,Blend: CA8800/I1050 - CA8800Z - CA8800CT2 (2-1-1),7/18/2019 13:54,7/18/2019 13:54,0.125,gal,7/18/2019 13:54,adminbommg,1,1,1,0,{'2019-07-18 13:54:48': 1},1,0
902,Wichita KS,DefaultDept,(PL)Painting Ops-Bldg 7 TR Shop Booth EU-AEROPB,Blend: CA8800/I1050 - CA8800Z - CA8800CT2 (2-1-1),7/18/2019 14:59,7/18/2019 14:59,0.03125,gal,7/18/2019 14:59,adminbommg,1,1,1,0,{'2019-07-18 14:59:18': 1},1,0
903,Wichita KS,DefaultDept,(PL)Painting Ops-Bldg 7 TR Shop Booth EU-AEROPB,Blend: CA8800/I1050 - CA8800Z - CA8800CT2 (2-1-1),7/22/2019 16:17,7/22/2019 16:17,0.03125,gal,7/22/2019 16:17,adminbommg,1,1,1,0,{'2019-07-22 16:17:01': 1},1,0
904,Wichita KS,DefaultDept,(PL)Painting Ops-Bldg 7 TR Shop Booth EU-AEROPB,Blend: CA8800/I1050 - CA8800Z - CA8800CT2 (2-1-1),7/26/2019 13:26,7/26/2019 13:26,0.375,gal,7/26/2019 13:26,adminbomgb,1,1,1,0,{'2019-07-26 13:26:50': 1},1,0
905,Wichita KS,DefaultDept,(PL)Painting Ops-Bldg 7 TR Shop Booth EU-AEROPB,Blend: CA8800/I1050 - CA8800Z - CA8800CT2 (2-1-1),7/26/2019 14:07,7/26/2019 14:07,0.125,gal,7/26/2019 14:07,adminbomgb,1,1,1,0,{'2019-07-26 14:07:34': 1},1,0
906,Wichita KS,DefaultDept,(PL)Painting Ops-Bldg 7 TR Shop Booth EU-AEROPB,Blend: CA8800/I1050 - CA8800Z - CA8800CT2 (2-1-1),7/26/2019 14:09,7/26/2019 14:09,0.0625,gal,7/26/2019 14:09,adminbomgb,1,1,1,0,{'2019-07-26 14:09:25': 1},1,0
907,Wichita KS,DefaultDept,(PL)Painting Ops-Bldg 7 TR Shop Booth EU-AEROPB,Blend: CA8800/I1050 - CA8800Z - CA8800CT2 (2-1-1),7/26/2019 14:50,7/26/2019 14:50,0.25,gal,7/26/2019 14:50,adminbomgb,1,1,1,0,{'2019-07-26 14:50:46': 1},1,0
908,Wichita KS,DefaultDept,(PL)Painting Ops-Bldg 7 TR Shop Booth EU-AEROPB,Blend: CA8800/I1050 - CA8800Z - CA8800CT2 (2-1-1),7/26/2019 15:57,7/26/2019 15:57,0.09375,gal,7/26/2019 15:57,adminbomgb,1,1,1,0,{'2019-07-26 15:57:49': 1},1,0
909,Wichita KS,DefaultDept,(PL)Painting Ops-Bldg 7 TR Shop Booth EU-AEROPB,Blend: CA8800/I1050 - CA8800Z - CA8800CT2 (2-1-1),11/4/2020 10:00,11/4/2020 10:00,0.046875,gal,12/18/2020 12:31,dlyon,1,1,1,0,{'2020-12-18 12:31:32': 1},1,0
910,Wichita KS,DefaultDept,(PL)Painting Ops-Bldg 7 TR Shop Booth EU-AEROPB,Blend: CA8800/I1050 - CA8800Z - CA8800CT2 (2-1-1),11/6/2020 7:00,11/6/2020 7:00,0.0625,gal,12/18/2020 12:42,dlyon,1,1,1,0,{'2020-12-18 12:42:45': 1},1,0
911,Wichita KS,DefaultDept,(PL)Painting Ops-Bldg 7 TR Shop Booth EU-AEROPB,Blend: CA8800/I1050 - CA8800Z - CA8800CT3 (2-1-1),1/25/2019 10:37,1/25/2019 10:37,0.0625,gal,1/25/2019 10:37,adminbomsn,1,1,1,0,{'2019-01-25 10:37:53': 1},1,0
912,Wichita KS,DefaultDept,(PL)Painting Ops-Bldg 7 TR Shop Booth EU-AEROPB,Blend: CA8800/I1050 - CA8800Z - CA8800CT3 (2-1-1),1/25/2019 15:49,1/25/2019 15:49,0.03125,gal,1/25/2019 15:49,adminbomna,1,1,1,0,{'2019-01-25 15:49:41': 1},1,0
913,Wichita KS,DefaultDept,(PL)Painting Ops-Bldg 7 TR Shop Booth EU-AEROPB,Blend: CA8800/I1050 - CA8800Z - CA8800CT3 (2-1-1),1/28/2019 10:49,1/28/2019 10:49,0.03125,gal,1/28/2019 10:50,adminbomcb,1,1,1,0,{'2019-01-28 10:50:04': 1},1,0
914,Wichita KS,DefaultDept,(PL)Painting Ops-Bldg 7 TR Shop Booth EU-AEROPB,Blend: CM0830080 - CM0830081 (3-1),1/25/2019 14:03,1/25/2019 14:03,0.0078125,gal,1/25/2019 14:03,adminbomcb,1,1,1,0,{'2019-01-25 14:03:42': 1},1,0
915,Wichita KS,DefaultDept,(PL)Painting Ops-Bldg 7 TR Shop Booth EU-AEROPB,Blend: CM0830080 - CM0830081 (3-1),7/26/2019 13:34,7/26/2019 13:34,0.03125,gal,7/26/2019 13:34,adminbomgb,1,1,1,0,{'2019-07-26 13:34:33': 1},1,0
916,Wichita KS,DefaultDept,(PL)Painting Ops-Bldg 7 TR Shop Booth EU-AEROPB,Blend: CM0830080 - CM0830081 (4-1),7/22/2019 15:00,7/22/2019 15:00,0.078125,gal,7/22/2019 15:00,adminbommg,1,1,1,0,{'2019-07-22 15:00:13': 1},1,0
917,Wichita KS,DefaultDept,(PL)Painting Ops-Bldg 7 TR Shop Booth EU-AEROPB,Blend: CM0830080 - CM0830081 - CM0830991 - CM0110944 (2-1-2-1),7/26/2019 16:57,7/26/2019 16:57,0.046875,gal,7/26/2019 16:57,adminbomgb,1,1,1,0,{'2019-07-26 16:57:00': 1},1,0
918,Wichita KS,DefaultDept,(PL)Painting Ops-Bldg 7 TR Shop Booth EU-AEROPB,Blend: CM0830080 - CM0830081 - CM0830991 - CM0110944 (3-1-0.5-0.5),1/25/2019 14:51,1/25/2019 14:51,0.09375,gal,1/25/2019 14:51,adminbomcr,1,1,1,0,{'2019-01-25 14:51:57': 1},1,0
919,Wichita KS,DefaultDept,(PL)Painting Ops-Bldg 7 TR Shop Booth EU-AEROPB,Blend: CM0830080 - CM0830081 - CM0830991 - CM0110944 (3-1-0.5-0.5),7/18/2019 16:43,7/18/2019 16:43,0.0390625,gal,7/18/2019 16:43,adminbommg,1,1,1,0,{'2019-07-18 16:43:40': 1},1,0
920,Wichita KS,DefaultDept,(PL)Painting Ops-Bldg 7 TR Shop Booth EU-AEROPB,Blend: CM0830080 - CM0830081 - CM0830991 - CM0110944 (3-1-0.5-0.5),7/22/2019 15:58,7/22/2019 15:58,0.2578125,gal,7/22/2019 15:58,adminbommg,1,1,1,0,{'2019-07-22 15:58:08': 1},1,0
921,Wichita KS,DefaultDept,(PL)Painting Ops-Bldg 7 TR Shop Booth EU-AEROPB,Blend: CM0830080 - CM0830081 - CM0830991 - CM0110944 (3-1-0.5-0.5),11/20/2019 0:00,11/20/2019 0:00,0.0390625,gal,1/27/2020 13:15,adminbomry,1,1,1,0,{'2020-01-27 13:15:09': 1},1,0
922,Wichita KS,DefaultDept,(PL)Painting Ops-Bldg 7 TR Shop Booth EU-AEROPB,Blend: CM0830080 - CM0830081 - CM0830991 - CM0110944 (3-1-0.5-0.5),6/1/2020 0:00,6/1/2020 0:00,0.09375,gal,8/25/2020 10:52,Kamiander,1,1,1,0,{'2020-08-25 10:52:52': 1},1,0
923,Wichita KS,DefaultDept,(PL)Painting Ops-Bldg 7 TR Shop Booth EU-AEROPB,Blend: CM0830080 - CM0830081 - CM0830991 - CM0110944 (3-1-1-0.5),7/26/2019 15:45,7/26/2019 15:45,0.0859375,gal,7/26/2019 15:45,adminbomgb,1,1,1,0,{'2019-07-26 15:45:01': 1},1,0
924,Wichita KS,DefaultDept,(PL)Painting Ops-Bldg 7 TR Shop Booth EU-AEROPB,Blend: CM0830080 - CM0830081 - CM0830H18 (3-1-0.375),1/25/2019 12:43,1/25/2019 12:43,0.034179688,gal,1/25/2019 12:43,adminbomsn,1,1,1,0,{'2019-01-25 12:43:30': 1},1,0
925,Wichita KS,DefaultDept,(PL)Painting Ops-Bldg 7 TR Shop Booth EU-AEROPB,Blend: CM0830080 - CM0830081 - CM0830H18 (3-1-0.375),1/25/2019 14:06,1/25/2019 14:06,0.03125,gal,1/25/2019 14:06,adminbomna,1,1,1,0,{'2019-01-25 14:06:42': 1},1,0
926,Wichita KS,DefaultDept,(PL)Painting Ops-Bldg 7 TR Shop Booth EU-AEROPB,Blend: CM0830080 - CM0830081 - CM0830H18 (3-1-0.375),1/25/2019 15:41,1/25/2019 15:41,0.140625,gal,1/25/2019 15:41,adminbomcb,1,1,1,0,{'2019-01-25 15:41:54': 1},1,0
927,Wichita KS,DefaultDept,(PL)Painting Ops-Bldg 7 TR Shop Booth EU-AEROPB,Blend: CM0830080 - CM0830081 - CM0830H18 (3-1-0.375),1/29/2019 14:33,1/29/2019 14:33,0.034179688,gal,1/29/2019 14:33,adminbomcb,1,1,1,0,{'2019-01-29 14:33:47': 1},1,0
928,Wichita KS,DefaultDept,(PL)Painting Ops-Bldg 7 TR Shop Booth EU-AEROPB,Blend: CM0830080 - CM0830081 - CM0830H18 (3-1-0.375),1/29/2019 15:20,1/29/2019 15:20,0.073242188,gal,1/29/2019 15:21,adminbomsn,1,1,1,0,{'2019-01-29 15:21:02': 1},1,0
929,Wichita KS,DefaultDept,(PL)Painting Ops-Bldg 7 TR Shop Booth EU-AEROPB,Blend: CM0830080 - CM0830081 - CM0830H18 (3-1-0.375),7/18/2019 13:30,7/18/2019 13:30,0.026367188,gal,7/18/2019 13:30,adminbommg,1,1,1,0,{'2019-07-18 13:30:02': 1},1,0
930,Wichita KS,DefaultDept,(PL)Painting Ops-Bldg 7 TR Shop Booth EU-AEROPB,Blend: CM0830080 - CM0830081 - CM0830H18 (3-1-0.375),7/22/2019 15:06,7/22/2019 15:06,0.034179688,gal,7/22/2019 15:06,adminbommg,1,1,1,0,{'2019-07-22 15:06:13': 1},1,0
931,Wichita KS,DefaultDept,(PL)Painting Ops-Bldg 7 TR Shop Booth EU-AEROPB,Blend: CM0830080 - CM0830081 - CM0830H18 (3-1-0.375),7/23/2019 14:20,7/23/2019 14:20,0.034179688,gal,7/23/2019 14:20,adminbommg,1,1,1,0,{'2019-07-23 14:20:42': 1},1,0
932,Wichita KS,DefaultDept,(PL)Painting Ops-Bldg 7 TR Shop Booth EU-AEROPB,Blend: CM0830080 - CM0830081 - CM0830H18 (3-1-0.375),7/26/2019 11:42,7/26/2019 11:42,0.034179688,gal,7/26/2019 11:42,adminbomgb,1,1,1,0,{'2019-07-26 11:42:39': 1},1,0
933,Wichita KS,DefaultDept,(PL)Painting Ops-Bldg 7 TR Shop Booth EU-AEROPB,Blend: CM0830080 - CM0830081 - CM0830H18 (3-1-0.5),1/25/2019 14:37,1/25/2019 14:37,0.03515625,gal,1/25/2019 14:37,adminbomna,1,1,1,0,{'2019-01-25 14:37:21': 1},1,0
934,Wichita KS,DefaultDept,(PL)Painting Ops-Bldg 7 TR Shop Booth EU-AEROPB,Blend: CM0830080 - CM0830081 - CM0830H18 (3-1-0.5),1/25/2019 16:47,1/25/2019 16:47,0.02734375,gal,1/25/2019 16:47,adminbomcr,1,1,1,0,{'2019-01-25 16:47:22': 1},1,0
935,Wichita KS,DefaultDept,(PL)Painting Ops-Bldg 7 TR Shop Booth EU-AEROPB,Blend: CM0830080 - CM0830081 - CM0830H18 (3-1-0.5),7/23/2019 9:27,7/23/2019 9:27,0.0703125,gal,7/23/2019 9:27,adminbommg,1,1,1,0,{'2019-07-23 09:27:19': 1},1,0
936,Wichita KS,DefaultDept,(PL)Painting Ops-Bldg 7 TR Shop Booth EU-AEROPB,Blend: CM0830080 - CM0830081 - CM0830H18 (3-1-0.5),7/26/2019 16:40,7/26/2019 16:40,0.2109375,gal,7/26/2019 16:40,adminbomgb,1,1,1,0,{'2019-07-26 16:40:04': 1},1,0
937,Wichita KS,DefaultDept,(PL)Painting Ops-Bldg 7 TR Shop Booth EU-AEROPB,Blend: CM0830080 - CM0830081 - CM0830H18 (3-1-0.5),6/9/2020 0:00,6/9/2020 0:00,0.0859375,gal,8/11/2020 10:57,Kamiander,1,1,1,0,{'2020-08-11 10:57:47': 1},1,0
938,Wichita KS,DefaultDept,(PL)Painting Ops-Bldg 7 TR Shop Booth EU-AEROPB,Blend: CM0830080 - CM0830081 - CM0830H18 (3:1:3/8),8/26/2019 10:00,8/26/2019 10:00,0.034179688,gal,9/18/2019 9:01,adminbomgb,1,1,1,0,{'2019-09-18 09:01:46': 1},1,0
939,Wichita KS,DefaultDept,(PL)Painting Ops-Bldg 7 TR Shop Booth EU-AEROPB,Blend: CM0830080 - CM0830081 - CM0830H18 (3:1:3/8),11/12/2019 14:30,11/12/2019 14:30,0.034179688,gal,1/13/2020 15:28,adminbomgb,1,1,1,0,{'2020-01-13 15:28:43': 1},1,0
940,Wichita KS,DefaultDept,(PL)Painting Ops-Bldg 7 TR Shop Booth EU-AEROPB,Blend: CM0830080 - CM0830081 - CM0830H18 (3:1:3/8),11/20/2019 6:42,11/20/2019 6:42,0.034179688,gal,1/13/2020 15:42,adminbomgb,1,1,1,0,{'2020-01-13 15:42:08': 1},1,0
941,Wichita KS,DefaultDept,(PL)Painting Ops-Bldg 7 TR Shop Booth EU-AEROPB,Blend: CM0830080 - CM0830081 - CM0830H18 - CM0110944 (3-1-0.5-0.5),7/3/2019 22:00,7/3/2019 22:00,0.0625,gal,8/21/2019 8:14,adminbomgb,1,1,1,0,{'2019-08-21 08:14:06': 1},1,0
942,Wichita KS,DefaultDept,(PL)Painting Ops-Bldg 7 TR Shop Booth EU-AEROPB,Blend: CM0830080 - CM0830081 - CM0830H18 - CM0110944 (3-1-0.5-0.5),7/9/2019 12:00,7/9/2019 12:00,0.19921875,gal,8/21/2019 8:28,adminbomgb,1,1,1,0,{'2019-08-21 08:28:05': 1},1,0
943,Wichita KS,DefaultDept,(PL)Painting Ops-Bldg 7 TR Shop Booth EU-AEROPB,Blend: CM0830080 - CM0830081 - CM0830H18 - CM0110944 (3-1-0.5-0.5),7/11/2019 12:30,7/11/2019 12:30,0.0390625,gal,8/21/2019 10:34,adminbomgb,1,1,1,0,{'2019-08-21 10:34:18': 1},1,0
944,Wichita KS,DefaultDept,(PL)Painting Ops-Bldg 7 TR Shop Booth EU-AEROPB,Blend: CM0830080 - CM0830081 - CM0830H18 - CM0110944 (3-1-0.5-0.5),7/16/2019 13:30,7/16/2019 13:30,0.0390625,gal,8/21/2019 10:53,adminbomgb,1,1,1,0,{'2019-08-21 10:53:25': 1},1,0
945,Wichita KS,DefaultDept,(PL)Painting Ops-Bldg 7 TR Shop Booth EU-AEROPB,Blend: CM0830080 - CM0830081 - CM0830H18 - CM0110944 (3-1-0.5-0.5),7/19/2019 12:00,7/19/2019 12:00,0.0390625,gal,8/21/2019 11:08,adminbomgb,1,1,1,0,{'2019-08-21 11:08:52': 1},1,0
946,Wichita KS,DefaultDept,(PL)Painting Ops-Bldg 7 TR Shop Booth EU-AEROPB,Blend: CM0830080 - CM0830081 - CM0830H18 - CM0110944 (3-1-0.5-0.5),7/20/2019 11:00,7/20/2019 11:00,0.0390625,gal,8/21/2019 11:13,adminbomgb,1,1,1,0,{'2019-08-21 11:13:22': 1},1,0
947,Wichita KS,DefaultDept,(PL)Painting Ops-Bldg 7 TR Shop Booth EU-AEROPB,Blend: CM0830080 - CM0830081 - CM0830H18 - CM0110944 (3-1-0.5-0.5),7/23/2019 13:25,7/23/2019 13:25,0.15625,gal,7/23/2019 13:25,adminbommg,1,1,1,0,{'2019-07-23 13:25:01': 1},1,0
948,Wichita KS,DefaultDept,(PL)Painting Ops-Bldg 7 TR Shop Booth EU-AEROPB,Blend: CM0830080 - CM0830081 - CM0830H18 - CM0110944 (3-1-0.5-0.5),7/23/2019 13:37,7/23/2019 13:37,0.0390625,gal,7/23/2019 13:40,adminbommg,1,1,1,0,{'2019-07-23 13:40:12': 1},1,0
949,Wichita KS,DefaultDept,(PL)Painting Ops-Bldg 7 TR Shop Booth EU-AEROPB,Blend: CM0830080 - CM0830081 - CM0830H18 - CM0110944 (3-1-0.5-0.5),7/23/2019 13:46,7/23/2019 13:46,0.0390625,gal,7/23/2019 13:46,adminbommg,1,1,1,0,{'2019-07-23 13:46:35': 1},1,0
950,Wichita KS,DefaultDept,(PL)Painting Ops-Bldg 7 TR Shop Booth EU-AEROPB,Blend: CM0830080 - CM0830081 - CM0830H18 - CM0110944 (3-1-0.5-0.5),7/26/2019 11:30,7/26/2019 11:30,0.0390625,gal,7/26/2019 11:30,adminbomgb,1,1,1,0,{'2019-07-26 11:30:40': 1},1,0
951,Wichita KS,DefaultDept,(PL)Painting Ops-Bldg 7 TR Shop Booth EU-AEROPB,Blend: CM0830080 - CM0830081 - CM0830H18 - CM0110944 (3-1-0.5-0.5),11/20/2019 0:00,11/20/2019 0:00,0.0390625,gal,1/27/2020 13:23,adminbomry,1,1,1,0,{'2020-01-27 13:23:49': 1},1,0
952,Wichita KS,DefaultDept,(PL)Painting Ops-Bldg 7 TR Shop Booth EU-AEROPB,Blend: CM0830080 - CM0830081 - CM0830H18 - CM0110944 (3:1:1/2:1),8/29/2019 21:00,8/29/2019 21:00,0.115625,gal,9/18/2019 9:10,adminbomgb,1,1,1,0,{'2019-09-18 09:10:52': 1},1,0
953,Wichita KS,DefaultDept,(PL)Painting Ops-Bldg 7 TR Shop Booth EU-AEROPB,Blend: CM0830080 - CM0830081 - CM0830H18 - CM0110944 (3:1:1/2:1),9/11/2019 20:00,9/11/2019 20:00,0.028125,gal,10/15/2019 14:17,adminbomgb,1,1,1,0,{'2019-10-15 14:17:08': 1},1,0
954,Wichita KS,DefaultDept,(PL)Painting Ops-Bldg 7 TR Shop Booth EU-AEROPB,Blend: CM0830080 - CM0830081 - CM0830H18 - CM0110944 (3:1:1/2:1),10/1/2019 12:00,10/1/2019 12:00,0.171875,gal,12/19/2019 16:04,adminbomry,1,1,1,0,{'2019-12-19 16:04:12': 1},1,0
955,Wichita KS,DefaultDept,(PL)Painting Ops-Bldg 7 TR Shop Booth EU-AEROPB,Blend: CM0830080 - CM0830081 - CM0830H18 - CM0110944 (3:1:1/2:1),10/4/2019 12:00,10/4/2019 12:00,0.171875,gal,12/19/2019 16:04,adminbomry,1,1,1,0,{'2019-12-19 16:04:12': 1},1,0
956,Wichita KS,DefaultDept,(PL)Painting Ops-Bldg 7 TR Shop Booth EU-AEROPB,Blend: CM0830080 - CM0830081 - CM0830H18 - CM0110944 (3:1:1/2:1),10/17/2019 12:00,10/17/2019 12:00,0.171875,gal,12/19/2019 16:04,adminbomry,1,1,1,0,{'2019-12-19 16:04:12': 1},1,0
957,Wichita KS,DefaultDept,(PL)Painting Ops-Bldg 7 TR Shop Booth EU-AEROPB,Blend: CM0830080 - CM0830081 - CM0830H18 - CM0110944 (3:1:1/2:1),10/28/2019 12:00,10/28/2019 12:00,0.171875,gal,12/19/2019 16:04,adminbomry,1,1,1,0,{'2019-12-19 16:04:12': 1},1,0
958,Wichita KS,DefaultDept,(PL)Painting Ops-Bldg 7 TR Shop Booth EU-AEROPB,Blend: CM0830080 - CM0830081 - CM0830H18 - CM0110944 (3:1:1/2:1),6/27/2020 0:00,6/27/2020 0:00,0.16640625,gal,8/11/2020 11:12,Kamiander,1,1,1,0,{'2020-08-11 11:12:58': 1},1,0
959,Wichita KS,DefaultDept,(PL)Painting Ops-Bldg 7 TR Shop Booth EU-AEROPB,Blend: CM0830080 - CM0830081 - CM0830H18 - CM0110944 (3:1:1/2:1),6/28/2020 0:00,6/28/2020 0:00,0.16640625,gal,8/11/2020 11:15,Kamiander,1,1,1,0,{'2020-08-11 11:15:26': 1},1,0
960,Wichita KS,DefaultDept,(PL)Painting Ops-Bldg 7 TR Shop Booth EU-AEROPB,Blend: CM0830080 - CM0830081 - CM0830H18 - CM0110944 (3:1:1/2:1/2),8/5/2019 22:00,8/5/2019 22:00,0.029296875,gal,9/17/2019 16:42,adminbomgb,1,1,1,0,{'2019-09-17 16:42:40': 1},1,0
961,Wichita KS,DefaultDept,(PL)Painting Ops-Bldg 7 TR Shop Booth EU-AEROPB,Blend: CM0830080 - CM0830081 - CM0830H18 - CM0110944 (3:1:1/2:1/2),8/14/2019 20:00,8/14/2019 20:00,0.0234375,gal,9/18/2019 8:40,adminbomgb,1,1,1,0,{'2019-09-18 08:40:47': 1},1,0
962,Wichita KS,DefaultDept,(PL)Painting Ops-Bldg 7 TR Shop Booth EU-AEROPB,Blend: CM0830080 - CM0830081 - CM0830H18 - CM0110944 (3:1:1/2:1/2),8/28/2019 22:30,8/28/2019 22:30,0.0234375,gal,9/18/2019 9:05,adminbomgb,1,1,1,0,{'2019-09-18 09:05:53': 1},1,0
963,Wichita KS,DefaultDept,(PL)Painting Ops-Bldg 7 TR Shop Booth EU-AEROPB,Blend: CM0830080 - CM0830081 - CM0830H18 - CM0110944 (3:1:1/2:1/2),9/6/2019 20:00,9/6/2019 20:00,0.0234375,gal,10/15/2019 13:46,adminbomgb,1,1,1,0,{'2019-10-15 13:46:01': 1},1,0
964,Wichita KS,DefaultDept,(PL)Painting Ops-Bldg 7 TR Shop Booth EU-AEROPB,Blend: CM0830080 - CM0830081 - CM0830H18 - CM0110944 (3:1:1/2:1/2),11/20/2019 6:42,11/20/2019 6:42,0.0390625,gal,1/13/2020 15:55,adminbomgb,1,1,1,0,{'2020-01-13 15:55:48': 1},1,0
965,Wichita KS,DefaultDept,(PL)Painting Ops-Bldg 7 TR Shop Booth EU-AEROPB,Blend: CM0830080 - CM0830081 - CM0830H18 - CM0110944 (3:1:1/2:1/2),12/12/2019 22:00,12/12/2019 22:00,0.15625,gal,1/13/2020 16:35,adminbomgb,1,1,1,0,{'2020-01-13 16:35:17': 1},1,0
966,Wichita KS,DefaultDept,(PL)Painting Ops-Bldg 7 TR Shop Booth EU-AEROPB,Blend: CM0830080 - CM0830081 - CM0830H18 - CM0110944 (3:1:1/2:1/2),3/5/2020 18:39,3/5/2020 18:39,0.109375,gal,5/13/2020 18:40,adminbomry,1,1,1,0,{'2020-05-13 18:40:43': 1},1,0
967,Wichita KS,DefaultDept,(PL)Painting Ops-Bldg 7 TR Shop Booth EU-AEROPB,Blend: CM0830080 - CM0830081 - CM0830H18 - CM0110944 (3:1:1/2:1/2),4/8/2020 0:00,4/8/2020 0:00,0.15625,gal,6/9/2020 16:08,Kamiander,1,1,1,0,{'2020-06-09 16:08:49': 1},1,0
968,Wichita KS,DefaultDept,(PL)Painting Ops-Bldg 7 TR Shop Booth EU-AEROPB,Blend: CM0830080 - CM0830081 - CM0830H18 - CM0110944 (3:1:1/2:1/2),4/9/2020 0:00,4/9/2020 0:00,0.15625,gal,6/10/2020 10:22,Kamiander,1,1,1,0,{'2020-06-10 10:22:59': 1},1,0
969,Wichita KS,DefaultDept,(PL)Painting Ops-Bldg 7 TR Shop Booth EU-AEROPB,Blend: CM0830080 - CM0830081 - CM0830H18 - CM0110944 (3:1:1/2:1/2),4/11/2020 0:00,4/11/2020 0:00,0.15625,gal,6/10/2020 10:24,Kamiander,1,1,1,0,{'2020-06-10 10:24:37': 1},1,0
970,Wichita KS,DefaultDept,(PL)Painting Ops-Bldg 7 TR Shop Booth EU-AEROPB,Blend: CM0830080 - CM0830081 - CM0830H18 - CM0110944 (3:1:1/2:1/2),4/15/2020 0:00,4/15/2020 0:00,0.15625,gal,6/10/2020 10:26,Kamiander,1,1,1,0,{'2020-06-10 10:26:07': 1},1,0
971,Wichita KS,DefaultDept,(PL)Painting Ops-Bldg 7 TR Shop Booth EU-AEROPB,Blend: CM0830080 - CM0830081 - CM0830H18 - CM0110944 (3:1:1/2:1/2),4/18/2020 0:00,4/18/2020 0:00,0.15625,gal,6/10/2020 10:28,Kamiander,1,1,1,0,{'2020-06-10 10:28:13': 1},1,0
972,Wichita KS,DefaultDept,(PL)Painting Ops-Bldg 7 TR Shop Booth EU-AEROPB,Blend: CM0830080 - CM0830081 - CM0830H18 - CM0110944 (3:1:1/2:1/2),4/23/2020 0:00,4/23/2020 0:00,0.15625,gal,6/10/2020 10:30,Kamiander,1,1,1,0,{'2020-06-10 10:30:50': 1},1,0
973,Wichita KS,DefaultDept,(PL)Painting Ops-Bldg 7 TR Shop Booth EU-AEROPB,Blend: CM0830080 - CM0830081 - CM0830H18 - CM0110944 (3:1:1/2:1/2),5/18/2020 0:00,5/18/2020 0:00,0.0390625,gal,6/19/2020 14:27,Kamiander,1,1,1,0,{'2020-06-19 14:27:00': 1},1,0
974,Wichita KS,DefaultDept,(PL)Painting Ops-Bldg 7 TR Shop Booth EU-AEROPB,Blend: CM0830080 - CM0830081 - CM0830H18 - CM0110944 (3:1:1/2:1/2),5/19/2020 0:00,5/19/2020 0:00,0.15625,gal,6/22/2020 10:19,Kamiander,1,1,1,0,{'2020-06-22 10:19:16': 1},1,0
975,Wichita KS,DefaultDept,(PL)Painting Ops-Bldg 7 TR Shop Booth EU-AEROPB,Blend: CM0830080 - CM0830081 - CM0830H18 - CM0110944 (3:1:1/2:1/2),5/21/2020 0:00,5/21/2020 0:00,0.0390625,gal,6/19/2020 14:25,Kamiander,1,1,1,0,{'2020-06-19 14:25:01': 1},1,0
976,Wichita KS,DefaultDept,(PL)Painting Ops-Bldg 7 TR Shop Booth EU-AEROPB,Blend: CM0830080 - CM0830081 - CM0830H18 - CM0110944 (3:1:1/2:1/2),5/30/2020 0:00,5/30/2020 0:00,0.0859375,gal,6/19/2020 14:21,Kamiander,1,1,1,0,{'2020-06-19 14:21:24': 1},1,0
977,Wichita KS,DefaultDept,(PL)Painting Ops-Bldg 7 TR Shop Booth EU-AEROPB,Blend: CM0830080 - CM0830081 - CM0830H18 - CM0110944 (3:1:1/2:1/2),6/18/2020 0:00,6/18/2020 0:00,0.09375,gal,8/11/2020 11:04,Kamiander,1,1,1,0,{'2020-08-11 11:04:14': 1},1,0
978,Wichita KS,DefaultDept,(PL)Painting Ops-Bldg 7 TR Shop Booth EU-AEROPB,Blend: CM0830080 - CM0830081 - CM0830H18 - CM0110944 (3:1:1/2:1/2),6/25/2020 0:00,6/25/2020 0:00,0.09375,gal,8/11/2020 11:07,Kamiander,1,1,1,0,{'2020-08-11 11:07:22': 1},1,0
979,Wichita KS,DefaultDept,(PL)Painting Ops-Bldg 7 TR Shop Booth EU-AEROPB,Blend: CM0830080 - CM0830081 - CM0830H18 - CM0110944 (3:1:1/2:1/2),7/17/2020 0:00,7/17/2020 0:00,0.15625,gal,8/26/2020 16:02,Kamiander,1,1,1,0,{'2020-08-26 16:02:35': 1},1,0
980,Wichita KS,DefaultDept,(PL)Painting Ops-Bldg 7 TR Shop Booth EU-AEROPB,Blend: CM0830080 - CM0830081 - CM0830H18 - CM0110944 (3:1:1/2:1/2),7/18/2020 0:00,7/18/2020 0:00,0.0546875,gal,8/26/2020 15:58,Kamiander,1,1,1,0,{'2020-08-26 15:58:26': 1},1,0
981,Wichita KS,DefaultDept,(PL)Painting Ops-Bldg 7 TR Shop Booth EU-AEROPB,Blend: CM0830080 - CM0830081 - CM0830H18 - CM0110944 (3:1:1/2:1/2),7/18/2020 0:00,7/18/2020 0:00,0.15625,gal,8/26/2020 16:00,Kamiander,1,1,1,0,{'2020-08-26 16:00:29': 1},1,0
982,Wichita KS,DefaultDept,(PL)Painting Ops-Bldg 7 TR Shop Booth EU-AEROPB,Blend: CM0830080 - CM0830081 - CM0830H18 - CM0110944 (3:1:1/2:1/2),7/19/2020 0:00,7/19/2020 0:00,0.02734375,gal,8/26/2020 15:56,Kamiander,1,1,1,0,{'2020-08-26 15:56:47': 1},1,0
983,Wichita KS,DefaultDept,(PL)Painting Ops-Bldg 7 TR Shop Booth EU-AEROPB,Blend: CM0830080 - CM0830081 - CM0830H18 - CM0110944 (3:1:1/2:1/2),7/24/2020 0:00,7/24/2020 0:00,0.0546875,gal,8/26/2020 15:52,Kamiander,1,1,1,0,{'2020-08-26 15:52:24': 1},1,0
984,Wichita KS,DefaultDept,(PL)Painting Ops-Bldg 7 TR Shop Booth EU-AEROPB,Blend: CM0830080 - CM0830081 - CM0830H18 - CM0110944 (3:1:1/2:1/2),7/29/2020 0:00,7/29/2020 0:00,0.0546875,gal,8/26/2020 15:49,Kamiander,1,1,1,0,{'2020-08-26 15:49:57': 1},1,0
985,Wichita KS,DefaultDept,(PL)Painting Ops-Bldg 7 TR Shop Booth EU-AEROPB,Blend: CM0830080 - CM0830081 - CM0830H18 - CM0110944 (3:1:1/2:1/2),7/29/2020 0:00,7/29/2020 0:00,0.078125,gal,8/26/2020 15:47,Kamiander,1,1,1,0,{'2020-08-26 15:47:57': 1},1,0
986,Wichita KS,DefaultDept,(PL)Painting Ops-Bldg 7 TR Shop Booth EU-AEROPB,Blend: CM0830080 - CM0830081 - CM0830H18 - CM0110944 (3:1:1/2:1/2),8/3/2020 0:00,8/3/2020 0:00,0.09375,gal,10/12/2020 11:09,Kamiander,1,1,1,0,{'2020-10-12 11:09:40': 1},1,0
987,Wichita KS,DefaultDept,(PL)Painting Ops-Bldg 7 TR Shop Booth EU-AEROPB,Blend: CM0830080 - CM0830081 - CM0830H18 - CM0110944 (3:1:1/2:1/2),8/4/2020 0:00,8/4/2020 0:00,0.09375,gal,10/12/2020 11:11,Kamiander,1,1,1,0,{'2020-10-12 11:11:13': 1},1,0
988,Wichita KS,DefaultDept,(PL)Painting Ops-Bldg 7 TR Shop Booth EU-AEROPB,Blend: CM0830080 - CM0830081 - CM0830H18 - CM0110944 (3:1:1/2:1/2),8/5/2020 0:00,8/5/2020 0:00,0.09375,gal,10/12/2020 11:12,Kamiander,1,1,1,0,{'2020-10-12 11:12:53': 1},1,0
989,Wichita KS,DefaultDept,(PL)Painting Ops-Bldg 7 TR Shop Booth EU-AEROPB,Blend: CM0830080 - CM0830081 - CM0830H18 - CM0110944 (3:1:1/2:1/2),8/6/2020 0:00,8/6/2020 0:00,0.03125,gal,10/12/2020 11:16,Kamiander,1,1,1,0,{'2020-10-12 11:16:02': 1},1,0
990,Wichita KS,DefaultDept,(PL)Painting Ops-Bldg 7 TR Shop Booth EU-AEROPB,Blend: CM0830080 - CM0830081 - CM0830H18 - CM0110944 (3:1:1/2:1/2),8/12/2020 0:00,8/12/2020 0:00,0.0390625,gal,10/12/2020 11:17,Kamiander,1,1,1,0,{'2020-10-12 11:17:53': 1},1,0
991,Wichita KS,DefaultDept,(PL)Painting Ops-Bldg 7 TR Shop Booth EU-AEROPB,Blend: CM0830080 - CM0830081 - CM0830H18 - CM0110944 (3:1:1/2:1/2),8/13/2020 0:00,8/13/2020 0:00,0.0390625,gal,10/12/2020 11:20,Kamiander,1,1,1,0,{'2020-10-12 11:20:07': 1},1,0
992,Wichita KS,DefaultDept,(PL)Painting Ops-Bldg 7 TR Shop Booth EU-AEROPB,Blend: CM0830080 - CM0830081 - CM0830H18 - CM0110944 (3:1:1/2:1/2),8/14/2020 0:00,8/14/2020 0:00,0.0390625,gal,10/12/2020 11:22,Kamiander,1,1,1,0,{'2020-10-12 11:22:39': 1},1,0
993,Wichita KS,DefaultDept,(PL)Painting Ops-Bldg 7 TR Shop Booth EU-AEROPB,Blend: CM0830080 - CM0830081 - CM0830H18 - CM0110944 (3:1:1/2:1/2),8/16/2020 0:00,8/16/2020 0:00,0.0390625,gal,10/12/2020 11:24,Kamiander,1,1,1,0,{'2020-10-12 11:24:47': 1},1,0
994,Wichita KS,DefaultDept,(PL)Painting Ops-Bldg 7 TR Shop Booth EU-AEROPB,Blend: CM0830080 - CM0830081 - CM0830H18 - CM0110944 (3:1:1/2:1/2),8/18/2020 0:00,8/18/2020 0:00,0.09375,gal,10/12/2020 11:26,Kamiander,1,1,1,0,{'2020-10-12 11:26:31': 1},1,0
995,Wichita KS,DefaultDept,(PL)Painting Ops-Bldg 7 TR Shop Booth EU-AEROPB,Blend: CM0830080 - CM0830081 - CM0830H18 - CM0110944 (3:1:1/2:1/2),8/22/2020 0:00,8/22/2020 0:00,0.09375,gal,10/12/2020 11:04,Kamiander,1,1,1,0,{'2020-10-12 11:04:32': 1},1,0
996,Wichita KS,DefaultDept,(PL)Painting Ops-Bldg 7 TR Shop Booth EU-AEROPB,Blend: CM0830080 - CM0830081 - CM0830H18 - CM0110944 (3:1:1/2:1/2),8/26/2020 0:00,8/26/2020 0:00,0.09375,gal,10/12/2020 11:00,Kamiander,1,1,1,0,{'2020-10-12 11:00:54': 1},1,0
997,Wichita KS,DefaultDept,(PL)Painting Ops-Bldg 7 TR Shop Booth EU-AEROPB,Blend: CM0830080 - CM0830081 - CM0830H18 - CM0110944 (3:1:1/2:1/2),9/17/2020 0:00,9/17/2020 0:00,0.0390625,gal,10/15/2020 10:29,Kamiander,1,1,1,0,{'2020-10-15 10:29:14': 1},1,0
998,Wichita KS,DefaultDept,(PL)Painting Ops-Bldg 7 TR Shop Booth EU-AEROPB,Blend: CM0830080 - CM0830081 - CM0830H18 - CM0110944 (3:1:1/2:1/2),9/23/2020 0:00,9/23/2020 0:00,0.15625,gal,10/15/2020 10:31,Kamiander,1,1,1,0,{'2020-10-15 10:31:14': 1},1,0
999,Wichita KS,DefaultDept,(PL)Painting Ops-Bldg 7 TR Shop Booth EU-AEROPB,Blend: CM0830080 - CM0830081 - CM0830H18 - CM0110944 (3:1:1/2:1/2),9/28/2020 0:00,9/28/2020 0:00,0.15625,gal,10/15/2020 10:34,Kamiander,1,1,1,0,{'2020-10-15 10:34:54': 1},1,0
1000,Wichita KS,DefaultDept,(PL)Painting Ops-Bldg 7 TR Shop Booth EU-AEROPB,Blend: CM0830080 - CM0830081 - CM0830H18 - CM0110944 (3:1:1/2:1/2),9/29/2020 0:00,9/29/2020 0:00,0.15625,gal,10/15/2020 10:36,Kamiander,1,1,1,0,{'2020-10-15 10:36:20': 1},1,0
1001,Wichita KS,DefaultDept,(PL)Painting Ops-Bldg 7 TR Shop Booth EU-AEROPB,Blend: CM0830080 - CM0830081 - CM0830H18 - CM0110944 (3:1:1/2:1/2),9/30/2020 0:00,9/30/2020 0:00,0.15625,gal,10/15/2020 10:39,Kamiander,1,1,1,0,{'2020-10-15 10:39:40': 1},1,0
1002,Wichita KS,DefaultDept,(PL)Painting Ops-Bldg 7 TR Shop Booth EU-AEROPB,Blend: CM0830080 - CM0830081 - CM0830H18 - CM0110944 (3:1:1/2:1/2),10/2/2020 7:00,10/2/2020 7:00,0.15625,gal,12/18/2020 10:28,dlyon,1,1,1,0,{'2020-12-18 10:28:55': 1},1,0
1003,Wichita KS,DefaultDept,(PL)Painting Ops-Bldg 7 TR Shop Booth EU-AEROPB,Blend: CM0830080 - CM0830081 - CM0830H18 - CM0110944 (3:1:1/2:1/2),10/5/2020 22:00,10/5/2020 22:00,0.15625,gal,12/18/2020 10:43,dlyon,1,1,1,0,{'2020-12-18 10:43:48': 1},1,0
1004,Wichita KS,DefaultDept,(PL)Painting Ops-Bldg 7 TR Shop Booth EU-AEROPB,Blend: CM0830080 - CM0830081 - CM0830H18 - CM0110944 (3:1:1/2:1/2),10/7/2020 9:00,10/7/2020 9:00,0.078125,gal,12/18/2020 10:56,dlyon,1,1,1,0,{'2020-12-18 10:56:09': 1},1,0
1005,Wichita KS,DefaultDept,(PL)Painting Ops-Bldg 7 TR Shop Booth EU-AEROPB,Blend: CM0830080 - CM0830081 - CM0830H18 - CM0110944 (3:1:1/2:1/2),10/27/2020 6:00,10/27/2020 6:00,0.0390625,gal,12/18/2020 11:47,dlyon,1,1,1,0,{'2020-12-18 11:47:01': 1},1,0
1006,Wichita KS,DefaultDept,(PL)Painting Ops-Bldg 7 TR Shop Booth EU-AEROPB,Blend: CM0830080 - CM0830081 - CM0830H18 - CM0110944 (3:1:1/2:1/2),11/11/2020 21:00,11/11/2020 21:00,0.0390625,gal,12/18/2020 12:48,dlyon,1,1,1,0,{'2020-12-18 12:48:56': 1},1,0
1007,Wichita KS,DefaultDept,(PL)Painting Ops-Bldg 7 TR Shop Booth EU-AEROPB,Blend: CM0830080 - CM0830081 - CM0830H18 - CM0110944 (3:1:3/8:1),9/6/2019 21:45,9/6/2019 21:45,0.1703125,gal,10/15/2019 13:43,adminbomgb,1,1,1,0,{'2019-10-15 13:43:04': 1},1,0
1008,Wichita KS,DefaultDept,(PL)Painting Ops-Bldg 7 TR Shop Booth EU-AEROPB,Blend: CM0830080 - CM0830081 - CM0830H18 - CM0110944 (3:1:3/8:1),11/19/2019 21:00,11/19/2019 21:00,0.16796875,gal,1/13/2020 15:37,adminbomgb,1,1,1,0,{'2020-01-13 15:37:39': 1},1,0
1009,Wichita KS,DefaultDept,(PL)Painting Ops-Bldg 7 TR Shop Booth EU-AEROPB,Blend: CM0830080 - CM0830081 - CM0830H18 - CM0110944 (3:1:3/8:1),11/25/2019 21:00,11/25/2019 21:00,0.18359375,gal,1/13/2020 16:21,adminbomgb,1,1,1,0,{'2020-01-13 16:21:27': 1},1,0
1010,Wichita KS,DefaultDept,(PL)Painting Ops-Bldg 7 TR Shop Booth EU-AEROPB,Blend: CM0830080 - CM0830081 - CM0830H18 - CM0110944 (3:1:3/8:1),12/10/2019 8:00,12/10/2019 8:00,0.18359375,gal,1/13/2020 16:26,adminbomgb,1,1,1,0,{'2020-01-13 16:26:54': 1},1,0
1011,Wichita KS,DefaultDept,(PL)Painting Ops-Bldg 7 TR Shop Booth EU-AEROPB,Blend: CM0830080 - CM0830081 - CM0830H18 - CM0110944 (3:1:3/8:1),2/7/2020 15:10,2/7/2020 15:10,0.081054688,gal,5/7/2020 15:12,adminbomry,1,1,1,0,{'2020-05-07 15:12:01': 1},1,0
1012,Wichita KS,DefaultDept,(PL)Painting Ops-Bldg 7 TR Shop Booth EU-AEROPB,Blend: CM0830080 - CM0830081 - CM0830H18 - CM0110944 (3:1:3/8:1),2/20/2020 16:44,2/20/2020 16:44,0.081054688,gal,5/7/2020 16:45,adminbomry,1,1,1,0,{'2020-05-07 16:45:42': 1},1,0
1013,Wichita KS,DefaultDept,(PL)Painting Ops-Bldg 7 TR Shop Booth EU-AEROPB,Blend: CM0830080 - CM0830081 - CM0830H18 - CM0110944 (3:1:3/8:1),2/21/2020 16:51,2/21/2020 16:51,0.165625,gal,5/7/2020 16:51,adminbomry,1,1,1,0,{'2020-05-07 16:51:56': 1},1,0
1014,Wichita KS,DefaultDept,(PL)Painting Ops-Bldg 7 TR Shop Booth EU-AEROPB,Blend: CM0830080 - CM0830081 - CM0830H18 - CM0110944 (3:1:3/8:1),5/13/2020 0:00,5/13/2020 0:00,0.083984375,gal,6/19/2020 14:40,Kamiander,1,1,1,0,{'2020-06-19 14:40:30': 1},1,0
1015,Wichita KS,DefaultDept,(PL)Painting Ops-Bldg 7 TR Shop Booth EU-AEROPB,Blend: CM0830080 - CM0830081 - CM0830H18 - CM0110944 (3:1:3/8:1/2),9/3/2019 14:00,9/3/2019 14:00,0.038085938,gal,10/15/2019 13:08,adminbomgb,1,1,1,0,{'2019-10-15 13:08:08': 1},1,0
1016,Wichita KS,DefaultDept,(PL)Painting Ops-Bldg 7 TR Shop Booth EU-AEROPB,Blend: CM0830080 - CM0830081 - CM0830H18 - CM0110944 (3:1:3/8:1/2),5/1/2020 0:00,5/1/2020 0:00,0.076171875,gal,6/19/2020 14:29,Kamiander,1,1,1,0,{'2020-06-19 14:29:42': 1},1,0
1017,Wichita KS,DefaultDept,(PL)Painting Ops-Bldg 7 TR Shop Booth EU-AEROPB,Blend: CM0830080 - CM0830081 - CM0830H18 - CM0110944 (3:1:3/8:1/2),5/5/2020 0:00,5/5/2020 0:00,0.076171875,gal,6/19/2020 14:33,Kamiander,1,1,1,0,{'2020-06-19 14:33:07': 1},1,0
1018,Wichita KS,DefaultDept,(PL)Painting Ops-Bldg 7 TR Shop Booth EU-AEROPB,Blend: CM0830080 - CM0830081 - CM0830H18 - CM0110944 (3:1:3/8:1/2),5/6/2020 0:00,5/6/2020 0:00,0.109375,gal,6/19/2020 14:34,Kamiander,1,1,1,0,{'2020-06-19 14:34:37': 1},1,0
1019,Wichita KS,DefaultDept,(PL)Painting Ops-Bldg 7 TR Shop Booth EU-AEROPB,Blend: CM0830080 - CM0830081 - CM0830H18 - CM0110944 (3:1:3/8:1/2),5/12/2020 0:00,5/12/2020 0:00,0.076171875,gal,6/19/2020 14:36,Kamiander,1,1,1,0,{'2020-06-19 14:36:29': 1},1,0
1020,Wichita KS,DefaultDept,(PL)Painting Ops-Bldg 7 TR Shop Booth EU-AEROPB,Blend: CM0830080 - CM0830081 - CM0830H18 - CM0110944 (3:1:3/8:1/2),10/8/2020 21:00,10/8/2020 21:00,0.03015625,gal,12/18/2020 11:07,dlyon,1,1,1,0,{'2020-12-18 11:07:13': 1},1,0
1021,Wichita KS,DefaultDept,(PL)Painting Ops-Bldg 7 TR Shop Booth EU-AEROPB,Blend: CM0830080 - CM0830081 - CM0830H18 - CM0110944 (3:1:3/8:1/2),10/12/2020 22:00,10/12/2020 22:00,0.15625,gal,12/18/2020 11:13,dlyon,1,1,1,0,{'2020-12-18 11:13:24': 1},1,0
1022,Wichita KS,DefaultDept,(PL)Painting Ops-Bldg 7 TR Shop Booth EU-AEROPB,Blend: CM0830080 - CM0830081 - CM0830H18 - CM0110944 (3:1:3/8:1/2),10/19/2020 20:00,10/19/2020 20:00,0.15625,gal,12/18/2020 11:19,dlyon,1,1,1,0,{'2020-12-18 11:19:56': 1},1,0
1023,Wichita KS,DefaultDept,(PL)Painting Ops-Bldg 7 TR Shop Booth EU-AEROPB,Blend: CM0830080 - CM0830081 - CM0830H18 - CM0110944 (3:1:3/8:1/2),10/20/2020 21:30,10/20/2020 21:30,0.061171875,gal,12/18/2020 11:35,dlyon,1,1,1,0,{'2020-12-18 11:35:50': 1},1,0
1024,Wichita KS,DefaultDept,(PL)Painting Ops-Bldg 7 TR Shop Booth EU-AEROPB,Blend: CM0830080 - CM0830081 - CM0830H18 - CM0110944 (3:1:3/8:1/2),10/20/2020 22:00,10/20/2020 22:00,0.15625,gal,12/18/2020 11:41,dlyon,1,1,1,0,{'2020-12-18 11:41:42': 1},1,0
1025,Wichita KS,DefaultDept,(PL)Painting Ops-Bldg 7 TR Shop Booth EU-AEROPB,Blend: CM0830080 - CM0830081 - CM0830H18 - CM0110944 (3:1:3/8:1/2),10/27/2020 22:00,10/27/2020 22:00,0.140625,gal,12/18/2020 11:52,dlyon,1,1,1,0,{'2020-12-18 11:52:29': 1},1,0
1026,Wichita KS,DefaultDept,(PL)Painting Ops-Bldg 7 TR Shop Booth EU-AEROPB,Blend: CM0830080 - CM0830081 - CM0830H18 - CM0110944 (3:1:3/8:1/2),10/29/2020 22:00,10/29/2020 22:00,0.15625,gal,12/18/2020 11:57,dlyon,1,1,1,0,{'2020-12-18 11:57:54': 1},1,0
1027,Wichita KS,DefaultDept,(PL)Painting Ops-Bldg 7 TR Shop Booth EU-AEROPB,Blend: CM0830080 - CM0830081 - CM0830H18 - CM0110944 (3:1:3/8:1/2),11/3/2020 20:00,11/3/2020 20:00,0.03125,gal,12/18/2020 12:29,dlyon,1,1,1,0,{'2020-12-18 12:29:29': 1},1,0
1028,Wichita KS,DefaultDept,(PL)Painting Ops-Bldg 7 TR Shop Booth EU-AEROPB,Blend: CM0830080 - CM0830081 - CM0830H18 - CM0110944 (3:1:3/8:1/2),11/14/2020 22:00,11/14/2020 22:00,0.15625,gal,12/18/2020 12:55,dlyon,1,1,1,0,{'2020-12-18 12:55:06': 1},1,0
1029,Wichita KS,DefaultDept,(PL)Painting Ops-Bldg 7 TR Shop Booth EU-AEROPB,Blend: CM0830080 - CM0830081 - CM0830H18 - CM0110944 (3:1:3/8:1/2),11/18/2020 22:00,11/18/2020 22:00,0.15625,gal,12/18/2020 13:01,dlyon,1,1,1,0,{'2020-12-18 13:01:07': 1},1,0
1030,Wichita KS,DefaultDept,(PL)Painting Ops-Bldg 7 TR Shop Booth EU-AEROPB,Blend: CM0830080 - CM0830081 - CM0830H18 - CM0110944 (3:1:3/8:1/2),11/21/2020 18:00,11/21/2020 18:00,0.15078125,gal,12/18/2020 13:07,dlyon,1,1,1,0,{'2020-12-18 13:07:22': 1},1,0
1031,Wichita KS,DefaultDept,(PL)Painting Ops-Bldg 7 TR Shop Booth EU-AEROPB,Blend: CM0830080 - CM0830081 - CM0830H18 - CM0110944 (3:1:3/8:1/2),11/25/2020 12:30,11/25/2020 12:30,0.125,gal,12/18/2020 13:32,dlyon,1,1,1,0,{'2020-12-18 13:32:30': 1},1,0
1032,Wichita KS,DefaultDept,(PL)Painting Ops-Bldg 7 TR Shop Booth EU-AEROPB,Blend: CM0830080 - CM0830081 - CM0830H18 - CM0110944 (3:1:3/8:1/2),11/28/2020 12:30,11/28/2020 12:30,0.15078125,gal,12/18/2020 13:17,dlyon,1,1,1,0,{'2020-12-18 13:17:24': 1},1,0
1033,Wichita KS,DefaultDept,(PL)Painting Ops-Bldg 7 TR Shop Booth EU-AEROPB,Blend: CM0830080 - CM0830081 - CM0830H18 - CM0110944 (4-1-2-1),7/22/2019 15:43,7/22/2019 15:43,0.03125,gal,7/22/2019 15:43,adminbommg,1,1,1,0,{'2019-07-22 15:43:19': 1},1,0
1034,Wichita KS,DefaultDept,(PL)Painting Ops-Bldg 7 TR Shop Booth EU-AEROPB,Blend: CM0830080 - CM0830081 - CM0830H18 - CM0110944 (4:1:0.2:0.8),8/5/2019 19:45,8/5/2019 19:45,0.104296875,gal,9/17/2019 16:35,adminbomgb,1,1,1,0,{'2019-09-17 16:35:29': 1},1,0
1035,Wichita KS,DefaultDept,(PL)Painting Ops-Bldg 7 TR Shop Booth EU-AEROPB,Blend: I1050 - 8800Z - 8800CT - 1800CX (2:1:1:0.5),4/23/2020 0:00,4/23/2020 0:00,0.0625,gal,6/10/2020 10:07,Kamiander,1,1,1,0,{'2020-06-10 10:07:21': 1},1,0
1036,Wichita KS,DefaultDept,(PL)Painting Ops-Bldg 7 TR Shop Booth EU-AEROPB,Blend: M06025 - CM0830081 - CM0830991 - CM0110944 (4:2:1:1),9/17/2020 0:00,9/17/2020 0:00,0.0625,gal,10/14/2020 10:28,Kamiander,1,1,1,0,{'2020-10-14 10:28:36': 1},1,0
1037,Wichita KS,DefaultDept,(PL)Painting Ops-Bldg 7 TR Shop Booth EU-AEROPB,Blend: M06025 - CM0830081 - CM0830991 - CM0110944 (4:2:1:1),10/7/2020 9:00,10/7/2020 9:00,0.109375,gal,12/18/2020 10:53,dlyon,1,1,1,0,{'2020-12-18 10:53:56': 1},1,0
1038,Wichita KS,DefaultDept,(PL)Painting Ops-Bldg 7 TR Shop Booth EU-AEROPB,Blend: M06025 - CM0830081 - CM0830991 - CM0110944 (4:2:1:1),10/27/2020 6:00,10/27/2020 6:00,0.0625,gal,12/18/2020 11:45,dlyon,1,1,1,0,{'2020-12-18 11:45:10': 1},1,0
1039,Wichita KS,DefaultDept,(PL)Painting Ops-Bldg 7 TR Shop Booth EU-AEROPB,Blend: M06025 - CM0830081 - CM0830991 - CM0110944 (4:2:1:1),11/11/2020 18:00,11/11/2020 18:00,0.0625,gal,12/18/2020 12:46,dlyon,1,1,1,0,{'2020-12-18 12:46:42': 1},1,0
1040,Wichita KS,DefaultDept,(PL)Painting Ops-Bldg 7 TR Shop Booth EU-AEROPB,Blend: M06025 - CM0830081 - CM0830991 - CM0110944 (4:2:1:1.5),6/27/2020 0:00,6/27/2020 0:00,0.265625,gal,8/25/2020 10:46,Kamiander,1,1,1,0,{'2020-08-25 10:46:57': 1},1,0
1041,Wichita KS,DefaultDept,(PL)Painting Ops-Bldg 7 TR Shop Booth EU-AEROPB,Blend: M06025 - CM0830081 - CM0830991 - CM0110944 (4:2:1:1.5),6/28/2020 0:00,6/28/2020 0:00,0.265625,gal,8/26/2020 16:40,Kamiander,1,1,1,0,{'2020-08-26 16:40:02': 1},1,0
1042,Wichita KS,DefaultDept,(PL)Painting Ops-Bldg 7 TR Shop Booth EU-AEROPB,Blend: M06025 - CM0830081 - CM0830991 - CM0110944 (4:2:1:1.5),7/11/2020 0:00,7/11/2020 0:00,0.265625,gal,8/26/2020 15:24,Kamiander,1,1,1,0,{'2020-08-26 15:24:49': 1},1,0
1043,Wichita KS,DefaultDept,(PL)Painting Ops-Bldg 7 TR Shop Booth EU-AEROPB,Blend: M06025 - CM0830081 - CM0830991 - CM0110944 (4:2:1:1.5),7/14/2020 0:00,7/14/2020 0:00,0.265625,gal,8/26/2020 15:27,Kamiander,1,1,1,0,{'2020-08-26 15:27:36': 1},1,0
1044,Wichita KS,DefaultDept,(PL)Painting Ops-Bldg 7 TR Shop Booth EU-AEROPB,Blend: M06025 - CM0830081 - CM0830991 - CM0110944 (4:2:1:1.5),7/17/2020 0:00,7/17/2020 0:00,0.25,gal,8/26/2020 15:29,Kamiander,1,1,1,0,{'2020-08-26 15:29:33': 1},1,0
1045,Wichita KS,DefaultDept,(PL)Painting Ops-Bldg 7 TR Shop Booth EU-AEROPB,Blend: M06025 - CM0830081 - CM0830991 - CM0110944 (4:2:1:1.5),7/18/2020 0:00,7/18/2020 0:00,0.125,gal,8/26/2020 15:33,Kamiander,1,1,1,0,{'2020-08-26 15:33:53': 1},1,0
1046,Wichita KS,DefaultDept,(PL)Painting Ops-Bldg 7 TR Shop Booth EU-AEROPB,Blend: M06025 - CM0830081 - CM0830991 - CM0110944 (4:2:1:1.5),7/18/2020 0:00,7/18/2020 0:00,0.25,gal,8/26/2020 15:31,Kamiander,1,1,1,0,{'2020-08-26 15:31:16': 1},1,0
1047,Wichita KS,DefaultDept,(PL)Painting Ops-Bldg 7 TR Shop Booth EU-AEROPB,Blend: M06025 - CM0830081 - CM0830991 - CM0110944 (4:2:1:1.5),7/19/2020 0:00,7/19/2020 0:00,0.0625,gal,8/26/2020 15:35,Kamiander,1,1,1,0,{'2020-08-26 15:35:55': 1},1,0
1048,Wichita KS,DefaultDept,(PL)Painting Ops-Bldg 7 TR Shop Booth EU-AEROPB,Blend: M06025 - CM0830081 - CM0830991 - CM0110944 (4:2:1:1.5),7/24/2020 0:00,7/24/2020 0:00,0.125,gal,8/26/2020 15:37,Kamiander,1,1,1,0,{'2020-08-26 15:37:46': 1},1,0
1049,Wichita KS,DefaultDept,(PL)Painting Ops-Bldg 7 TR Shop Booth EU-AEROPB,Blend: M06025 - CM0830081 - CM0830991 - CM0110944 (4:2:1:1.5),7/29/2020 0:00,7/29/2020 0:00,0.125,gal,8/26/2020 15:41,Kamiander,1,1,1,0,{'2020-08-26 15:41:32': 1},1,0
1050,Wichita KS,DefaultDept,(PL)Painting Ops-Bldg 7 TR Shop Booth EU-AEROPB,Blend: M06025 - CM0830081 - CM0830991 - CM0110944 (4:2:1:1.5),8/7/2020 0:00,8/7/2020 0:00,0.265625,gal,10/12/2020 10:23,Kamiander,1,1,1,0,{'2020-10-12 10:23:44': 1},1,0
1051,Wichita KS,DefaultDept,(PL)Painting Ops-Bldg 7 TR Shop Booth EU-AEROPB,Blend: M06025 - CM0830081 - CM0830991 - CM0110944 (4:2:1:1.5),8/14/2020 0:00,8/14/2020 0:00,0.265625,gal,10/12/2020 10:32,Kamiander,1,1,1,0,{'2020-10-12 10:32:55': 1},1,0
1052,Wichita KS,DefaultDept,(PL)Painting Ops-Bldg 7 TR Shop Booth EU-AEROPB,Blend: M06025 - CM0830081 - CM0830991 - CM0110944 (4:2:1:1.5),9/1/2020 0:00,9/1/2020 0:00,0.173828125,gal,10/14/2020 10:15,Kamiander,1,1,1,0,{'2020-10-14 10:15:41': 1},1,0
1053,Wichita KS,DefaultDept,(PL)Painting Ops-Bldg 7 TR Shop Booth EU-AEROPB,Blend: M06025 - CM0830081 - CM0830991 - CM0110944 (4:2:1:1.5),9/3/2020 0:00,9/3/2020 0:00,0.033203125,gal,10/14/2020 10:17,Kamiander,1,1,1,0,{'2020-10-14 10:17:21': 1},1,0
1054,Wichita KS,DefaultDept,(PL)Painting Ops-Bldg 7 TR Shop Booth EU-AEROPB,Blend: M06025 - CM0830081 - CM0830991 - CM0110944 (4:2:1:1.5),9/3/2020 0:00,9/3/2020 0:00,0.265625,gal,10/14/2020 10:18,Kamiander,1,1,1,0,{'2020-10-14 10:18:57': 1},1,0
1055,Wichita KS,DefaultDept,(PL)Painting Ops-Bldg 7 TR Shop Booth EU-AEROPB,Blend: M06025 - CM0830081 - CM0830991 - CM0110944 (4:2:1:1.5),9/26/2020 0:00,9/26/2020 0:00,0.265625,gal,10/14/2020 10:32,Kamiander,1,1,1,0,{'2020-10-14 10:32:38': 1},1,0
1056,Wichita KS,DefaultDept,(PL)Painting Ops-Bldg 7 TR Shop Booth EU-AEROPB,Blend: M06025 - CM0830081 - CM0830991 - CM0110944 (4:2:1:1.5),9/28/2020 0:00,9/28/2020 0:00,0.265625,gal,10/14/2020 10:34,Kamiander,1,1,1,0,{'2020-10-14 10:34:20': 1},1,0
1057,Wichita KS,DefaultDept,(PL)Painting Ops-Bldg 7 TR Shop Booth EU-AEROPB,Blend: M06025 - CM0830081 - CM0830991 - CM0110944 (4:2:1:1.5),9/29/2020 0:00,9/29/2020 0:00,0.265625,gal,10/14/2020 10:35,Kamiander,1,1,1,0,{'2020-10-14 10:35:52': 1},1,0
1058,Wichita KS,DefaultDept,(PL)Painting Ops-Bldg 7 TR Shop Booth EU-AEROPB,Blend: M06025 - CM0830081 - CM0830991 - CM0110944 (4:2:1:1.5),9/30/2020 0:00,9/30/2020 0:00,0.265625,gal,10/14/2020 10:37,Kamiander,1,1,1,0,{'2020-10-14 10:37:18': 1},1,0
1059,Wichita KS,DefaultDept,(PL)Painting Ops-Bldg 7 TR Shop Booth EU-AEROPB,Blend: M06025 - CM0830081 - CM0830991 - CM0110944 (4:2:1:1.5),10/2/2020 7:00,10/2/2020 7:00,0.265625,gal,12/18/2020 10:25,dlyon,1,1,1,0,{'2020-12-18 10:25:29': 1},1,0
1060,Wichita KS,DefaultDept,(PL)Painting Ops-Bldg 7 TR Shop Booth EU-AEROPB,Blend: M06025 - CM0830081 - CM0830991 - CM0110944 (4:2:1:1.5),10/5/2020 22:00,10/5/2020 22:00,0.265625,gal,12/18/2020 10:41,dlyon,1,1,1,0,{'2020-12-18 10:41:00': 1},1,0
1061,Wichita KS,DefaultDept,(PL)Painting Ops-Bldg 7 TR Shop Booth EU-AEROPB,Blend: M06025 - CM0830081 - CM0830991 - CM0110944 (4:2:1:1.5),10/8/2020 17:40,10/8/2020 17:40,0.06640625,gal,12/18/2020 11:04,dlyon,1,1,1,0,{'2020-12-18 11:04:23': 1},1,0
1062,Wichita KS,DefaultDept,(PL)Painting Ops-Bldg 7 TR Shop Booth EU-AEROPB,Blend: M06025 - CM0830081 - CM0830991 - CM0110944 (4:2:1:1.5),10/12/2020 22:00,10/12/2020 22:00,0.265625,gal,12/18/2020 11:11,dlyon,1,1,1,0,{'2020-12-18 11:11:10': 1},1,0
1063,Wichita KS,DefaultDept,(PL)Painting Ops-Bldg 7 TR Shop Booth EU-AEROPB,Blend: M06025 - CM0830081 - CM0830991 - CM0110944 (4:2:1:1.5),10/19/2020 17:00,10/19/2020 17:00,0.53125,gal,12/18/2020 11:17,dlyon,1,1,1,0,{'2020-12-18 11:17:45': 1},1,0
1064,Wichita KS,DefaultDept,(PL)Painting Ops-Bldg 7 TR Shop Booth EU-AEROPB,Blend: M06025 - CM0830081 - CM0830991 - CM0110944 (4:2:1:1.5),10/20/2020 18:30,10/20/2020 18:30,0.116484375,gal,12/18/2020 11:23,dlyon,1,1,1,0,{'2020-12-18 11:23:53': 1},1,0
1065,Wichita KS,DefaultDept,(PL)Painting Ops-Bldg 7 TR Shop Booth EU-AEROPB,Blend: M06025 - CM0830081 - CM0830991 - CM0110944 (4:2:1:1.5),10/20/2020 22:00,10/20/2020 22:00,0.265625,gal,12/18/2020 11:39,dlyon,1,1,1,0,{'2020-12-18 11:39:41': 1},1,0
1066,Wichita KS,DefaultDept,(PL)Painting Ops-Bldg 7 TR Shop Booth EU-AEROPB,Blend: M06025 - CM0830081 - CM0830991 - CM0110944 (4:2:1:1.5),10/27/2020 22:00,10/27/2020 22:00,0.265625,gal,12/18/2020 11:50,dlyon,1,1,1,0,{'2020-12-18 11:50:43': 1},1,0
1067,Wichita KS,DefaultDept,(PL)Painting Ops-Bldg 7 TR Shop Booth EU-AEROPB,Blend: M06025 - CM0830081 - CM0830991 - CM0110944 (4:2:1:1.5),10/29/2020 22:00,10/29/2020 22:00,0.265625,gal,12/18/2020 11:56,dlyon,1,1,1,0,{'2020-12-18 11:56:02': 1},1,0
1068,Wichita KS,DefaultDept,(PL)Painting Ops-Bldg 7 TR Shop Booth EU-AEROPB,Blend: M06025 - CM0830081 - CM0830991 - CM0110944 (4:2:1:1.5),11/3/2020 16:30,11/3/2020 16:30,0.03515625,gal,12/18/2020 12:27,dlyon,1,1,1,0,{'2020-12-18 12:27:12': 1},1,0
1069,Wichita KS,DefaultDept,(PL)Painting Ops-Bldg 7 TR Shop Booth EU-AEROPB,Blend: M06025 - CM0830081 - CM0830991 - CM0110944 (4:2:1:1.5),11/14/2020 22:00,11/14/2020 22:00,0.265625,gal,12/18/2020 12:52,dlyon,1,1,1,0,{'2020-12-18 12:52:46': 1},1,0
1070,Wichita KS,DefaultDept,(PL)Painting Ops-Bldg 7 TR Shop Booth EU-AEROPB,Blend: M06025 - CM0830081 - CM0830991 - CM0110944 (4:2:1:1.5),11/18/2020 22:00,11/18/2020 22:00,0.265625,gal,12/18/2020 12:58,dlyon,1,1,1,0,{'2020-12-18 12:58:59': 1},1,0
1071,Wichita KS,DefaultDept,(PL)Painting Ops-Bldg 7 TR Shop Booth EU-AEROPB,Blend: M06025 - CM0830081 - CM0830991 - CM0110944 (4:2:1:1.5),11/21/2020 13:30,11/21/2020 13:30,0.265625,gal,12/18/2020 13:04,dlyon,1,1,1,0,{'2020-12-18 13:04:45': 1},1,0
1072,Wichita KS,DefaultDept,(PL)Painting Ops-Bldg 7 TR Shop Booth EU-AEROPB,Blend: M06025 - CM0830081 - CM0830991 - CM0110944 (4:2:1:1.5),11/25/2020 6:00,11/25/2020 6:00,0.375,gal,12/18/2020 13:30,dlyon,1,1,1,0,{'2020-12-18 13:30:43': 1},1,0
1073,Wichita KS,DefaultDept,(PL)Painting Ops-Bldg 7 TR Shop Booth EU-AEROPB,Blend: M06025 - CM0830081 - CM0830991 - CM0110944 (4:2:1:1.5),11/27/2020 18:00,11/27/2020 18:00,0.33203125,gal,12/18/2020 13:15,dlyon,1,1,1,0,{'2020-12-18 13:15:05': 1},1,0
1074,Wichita KS,DefaultDept,(PL)Painting Ops-Bldg 7 TR Shop Booth EU-AEROPB,Blend: M06025 - CM0830081 - CM0830991 - CM0110944 (4:2:2:2),8/5/2019 20:00,8/5/2019 20:00,0.046875,gal,9/17/2019 16:36,adminbomgb,1,1,1,0,{'2019-09-17 16:36:47': 1},1,0
1075,Wichita KS,DefaultDept,(PL)Painting Ops-Bldg 7 TR Shop Booth EU-AEROPB,Blend: M06025 - CM0830991 - CM0110944 - CM0830081 - (4:1:2:1),8/2/2019 12:30,8/2/2019 12:30,0.25,gal,9/17/2019 16:24,adminbomgb,1,1,1,0,{'2019-09-17 16:24:45': 1},1,0
1076,Wichita KS,DefaultDept,(PL)Painting Ops-Bldg 7 TR Shop Booth EU-AEROPB,Blend: M06025 - CM0830991 - CM0110944 - CM0830081 - (4:1:2:1),8/5/2019 16:30,8/5/2019 16:30,0.0625,gal,9/17/2019 16:30,adminbomgb,1,1,1,0,{'2019-09-17 16:30:02': 1},1,0
1077,Wichita KS,DefaultDept,(PL)Painting Ops-Bldg 7 TR Shop Booth EU-AEROPB,Blend: M06025 - CM0830991 - CM0110944 - CM0830081 - (4:1:2:1),8/6/2019 1:00,8/6/2019 1:00,0.015625,gal,9/17/2019 16:47,adminbomgb,1,1,1,0,{'2019-09-17 16:47:56': 1},1,0
1078,Wichita KS,DefaultDept,(PL)Painting Ops-Bldg 7 TR Shop Booth EU-AEROPB,Blend: M06025 - CM0830991 - CM0110944 - CM0830081 - (4:1:2:1),8/14/2019 17:00,8/14/2019 17:00,0.03125,gal,9/18/2019 8:39,adminbomgb,1,1,1,0,{'2019-09-18 08:39:14': 1},1,0
1079,Wichita KS,DefaultDept,(PL)Painting Ops-Bldg 7 TR Shop Booth EU-AEROPB,Blend: M06025 - CM0830991 - CM0110944 - CM0830081 - (4:1:2:1),8/20/2019 7:00,8/20/2019 7:00,0.125,gal,9/18/2019 8:49,adminbomgb,1,1,1,0,{'2019-09-18 08:49:18': 1},1,0
1080,Wichita KS,DefaultDept,(PL)Painting Ops-Bldg 7 TR Shop Booth EU-AEROPB,Blend: M06025 - CM0830991 - CM0110944 - CM0830081 - (4:1:2:1),8/21/2019 18:00,8/21/2019 18:00,0.03125,gal,9/18/2019 8:57,adminbomgb,1,1,1,0,{'2019-09-18 08:57:44': 1},1,0
1081,Wichita KS,DefaultDept,(PL)Painting Ops-Bldg 7 TR Shop Booth EU-AEROPB,Blend: M06025 - CM0830991 - CM0110944 - CM0830081 - (4:1:2:1),8/26/2019 7:00,8/26/2019 7:00,0.0625,gal,9/18/2019 9:00,adminbomgb,1,1,1,0,{'2019-09-18 09:00:17': 1},1,0
1082,Wichita KS,DefaultDept,(PL)Painting Ops-Bldg 7 TR Shop Booth EU-AEROPB,Blend: M06025 - CM0830991 - CM0110944 - CM0830081 - (4:1:2:1),8/28/2019 20:00,8/28/2019 20:00,0.03125,gal,9/18/2019 9:04,adminbomgb,1,1,1,0,{'2019-09-18 09:04:21': 1},1,0
1083,Wichita KS,DefaultDept,(PL)Painting Ops-Bldg 7 TR Shop Booth EU-AEROPB,Blend: M06025 - CM0830991 - CM0110944 - CM0830081 - (4:1:2:1),8/29/2019 17:00,8/29/2019 17:00,0.25,gal,9/18/2019 9:08,adminbomgb,1,1,1,0,{'2019-09-18 09:08:27': 1},1,0
1084,Wichita KS,DefaultDept,(PL)Painting Ops-Bldg 7 TR Shop Booth EU-AEROPB,Blend: M06025 - CM0830991 - CM0110944 - CM0830081 - (4:1:2:1),9/3/2019 12:30,9/3/2019 12:30,0.125,gal,10/15/2019 13:06,adminbomgb,1,1,1,0,{'2019-10-15 13:06:23': 1},1,0
1085,Wichita KS,DefaultDept,(PL)Painting Ops-Bldg 7 TR Shop Booth EU-AEROPB,Blend: M06025 - CM0830991 - CM0110944 - CM0830081 - (4:1:2:1),9/4/2019 18:00,9/4/2019 18:00,0.125,gal,10/15/2019 13:13,adminbomgb,1,1,1,0,{'2019-10-15 13:13:23': 1},1,0
1086,Wichita KS,DefaultDept,(PL)Painting Ops-Bldg 7 TR Shop Booth EU-AEROPB,Blend: M06025 - CM0830991 - CM0110944 - CM0830081 - (4:1:2:1),9/6/2019 15:30,9/6/2019 15:30,0.03125,gal,10/15/2019 13:44,adminbomgb,1,1,1,0,{'2019-10-15 13:44:31': 1},1,0
1087,Wichita KS,DefaultDept,(PL)Painting Ops-Bldg 7 TR Shop Booth EU-AEROPB,Blend: M06025 - CM0830991 - CM0110944 - CM0830081 - (4:1:2:1),9/6/2019 18:00,9/6/2019 18:00,0.234375,gal,10/15/2019 13:39,adminbomgb,1,1,1,0,{'2019-10-15 13:39:39': 1},1,0
1088,Wichita KS,DefaultDept,(PL)Painting Ops-Bldg 7 TR Shop Booth EU-AEROPB,Blend: M06025 - CM0830991 - CM0110944 - CM0830081 - (4:1:2:1),9/11/2019 13:21,9/11/2019 13:21,0.03125,gal,10/15/2019 13:54,adminbomgb,1,1,1,0,{'2019-10-15 13:54:42': 1},1,0
1089,Wichita KS,DefaultDept,(PL)Painting Ops-Bldg 7 TR Shop Booth EU-AEROPB,Blend: M06025 - CM0830991 - CM0110944 - CM0830081 - (4:1:2:1),9/11/2019 13:21,9/11/2019 13:21,0.125,gal,10/15/2019 13:50,adminbomgb,1,1,1,0,{'2019-10-15 13:50:15': 1},1,0
1090,Wichita KS,DefaultDept,(PL)Painting Ops-Bldg 7 TR Shop Booth EU-AEROPB,Blend: M06025 - CM0830991 - CM0110944 - CM0830081 - (4:1:2:1),9/16/2019 8:30,9/16/2019 8:30,0.0625,gal,10/15/2019 14:20,adminbomgb,1,1,1,0,{'2019-10-15 14:20:03': 1},1,0
1091,Wichita KS,DefaultDept,(PL)Painting Ops-Bldg 7 TR Shop Booth EU-AEROPB,Blend: M06025 - CM0830991 - CM0110944 - CM0830081 - (4:1:2:1),10/1/2019 12:00,10/1/2019 12:00,0.28125,gal,12/19/2019 16:04,adminbomry,1,1,1,0,{'2019-12-19 16:04:12': 1},1,0
1092,Wichita KS,DefaultDept,(PL)Painting Ops-Bldg 7 TR Shop Booth EU-AEROPB,Blend: M06025 - CM0830991 - CM0110944 - CM0830081 - (4:1:2:1),10/4/2019 12:00,10/4/2019 12:00,0.28125,gal,12/19/2019 16:04,adminbomry,1,1,1,0,{'2019-12-19 16:04:12': 1},1,0
1093,Wichita KS,DefaultDept,(PL)Painting Ops-Bldg 7 TR Shop Booth EU-AEROPB,Blend: M06025 - CM0830991 - CM0110944 - CM0830081 - (4:1:2:1),10/8/2019 12:00,10/8/2019 12:00,0.011719,gal,12/19/2019 16:04,adminbomry,1,1,1,0,{'2019-12-19 16:04:12': 1},1,0
1094,Wichita KS,DefaultDept,(PL)Painting Ops-Bldg 7 TR Shop Booth EU-AEROPB,Blend: M06025 - CM0830991 - CM0110944 - CM0830081 - (4:1:2:1),10/17/2019 12:00,10/17/2019 12:00,0.28125,gal,12/19/2019 16:04,adminbomry,1,1,1,0,{'2019-12-19 16:04:12': 1},1,0
1095,Wichita KS,DefaultDept,(PL)Painting Ops-Bldg 7 TR Shop Booth EU-AEROPB,Blend: M06025 - CM0830991 - CM0110944 - CM0830081 - (4:1:2:1),10/28/2019 12:00,10/28/2019 12:00,0.125,gal,12/19/2019 16:04,adminbomry,1,1,1,0,{'2019-12-19 16:04:12': 1},1,0
1096,Wichita KS,DefaultDept,(PL)Painting Ops-Bldg 7 TR Shop Booth EU-AEROPB,Blend: M06025 - CM0830991 - CM0110944 - CM0830081 - (4:1:2:1),11/12/2019 13:30,11/12/2019 13:30,0.0625,gal,1/13/2020 15:25,adminbomgb,1,1,1,0,{'2020-01-13 15:25:58': 1},1,0
1097,Wichita KS,DefaultDept,(PL)Painting Ops-Bldg 7 TR Shop Booth EU-AEROPB,Blend: M06025 - CM0830991 - CM0110944 - CM0830081 - (4:1:2:1),11/19/2019 16:30,11/19/2019 16:30,0.1875,gal,1/13/2020 15:32,adminbomgb,1,1,1,0,{'2020-01-13 15:32:52': 1},1,0
1098,Wichita KS,DefaultDept,(PL)Painting Ops-Bldg 7 TR Shop Booth EU-AEROPB,Blend: M06025 - CM0830991 - CM0110944 - CM0830081 - (4:1:2:1),11/20/2019 6:42,11/20/2019 6:42,0.0625,gal,1/13/2020 15:40,adminbomgb,1,1,1,0,{'2020-01-13 15:40:11': 1},1,0
1099,Wichita KS,DefaultDept,(PL)Painting Ops-Bldg 7 TR Shop Booth EU-AEROPB,Blend: M06025 - CM0830991 - CM0110944 - CM0830081 - (4:1:2:1),11/25/2019 18:00,11/25/2019 18:00,0.125,gal,1/13/2020 16:19,adminbomgb,1,1,1,0,{'2020-01-13 16:19:03': 1},1,0
1100,Wichita KS,DefaultDept,(PL)Painting Ops-Bldg 7 TR Shop Booth EU-AEROPB,Blend: M06025 - CM0830991 - CM0110944 - CM0830081 - (4:1:2:1),12/10/2019 8:00,12/10/2019 8:00,0.125,gal,1/13/2020 16:25,adminbomgb,1,1,1,0,{'2020-01-13 16:25:16': 1},1,0
1101,Wichita KS,DefaultDept,(PL)Painting Ops-Bldg 7 TR Shop Booth EU-AEROPB,Blend: M06025 - CM0830991 - CM0110944 - CM0830081 - (4:1:2:1),12/12/2019 22:00,12/12/2019 22:00,0.125,gal,1/13/2020 16:32,adminbomgb,1,1,1,0,{'2020-01-13 16:32:37': 1},1,0
1102,Wichita KS,DefaultDept,(PL)Painting Ops-Bldg 7 TR Shop Booth EU-AEROPB,Blend: M06025 - CM0830991 - CM0110944 - CM0830081 - (4:1:2:1),3/5/2020 18:31,3/5/2020 18:31,0.125,gal,5/13/2020 18:33,adminbomry,1,1,1,0,{'2020-05-13 18:33:13': 1},1,0
1103,Wichita KS,DefaultDept,(PL)Painting Ops-Bldg 7 TR Shop Booth EU-AEROPB,Blend: M06025 - CM0830991 - CM0110944 - CM0830081 - (4:1:2:1),4/9/2020 0:00,4/9/2020 0:00,0.125,gal,6/9/2020 16:18,Kamiander,1,1,1,0,{'2020-06-09 16:18:55': 1},1,0
1104,Wichita KS,DefaultDept,(PL)Painting Ops-Bldg 7 TR Shop Booth EU-AEROPB,Blend: M06025 - CM0830991 - CM0110944 - CM0830081 - (4:1:2:1),4/11/2020 0:00,4/11/2020 0:00,0.125,gal,6/10/2020 9:10,Kamiander,1,1,1,0,{'2020-06-10 09:10:49': 1},1,0
1105,Wichita KS,DefaultDept,(PL)Painting Ops-Bldg 7 TR Shop Booth EU-AEROPB,Blend: M06025 - CM0830991 - CM0110944 - CM0830081 - (4:1:2:1),4/15/2020 0:00,4/15/2020 0:00,0.125,gal,6/10/2020 9:15,Kamiander,1,1,1,0,{'2020-06-10 09:15:04': 1},1,0
1106,Wichita KS,DefaultDept,(PL)Painting Ops-Bldg 7 TR Shop Booth EU-AEROPB,Blend: M06025 - CM0830991 - CM0110944 - CM0830081 - (4:1:2:1),4/23/2020 0:00,4/23/2020 0:00,0.125,gal,6/10/2020 9:26,Kamiander,1,1,1,0,{'2020-06-10 09:26:10': 1},1,0
1107,Wichita KS,DefaultDept,(PL)Painting Ops-Bldg 7 TR Shop Booth EU-AEROPB,Blend: M06025 - CM0830991 - CM0110944 - CM0830081 - (4:1:2:1),5/1/2020 0:00,5/1/2020 0:00,0.125,gal,6/19/2020 14:04,Kamiander,1,1,1,0,{'2020-06-19 14:04:39': 1},1,0
1108,Wichita KS,DefaultDept,(PL)Painting Ops-Bldg 7 TR Shop Booth EU-AEROPB,Blend: M06025 - CM0830991 - CM0110944 - CM0830081 - (4:1:2:1),5/5/2020 0:00,5/5/2020 0:00,0.125,gal,6/19/2020 14:06,Kamiander,1,1,1,0,{'2020-06-19 14:06:03': 1},1,0
1109,Wichita KS,DefaultDept,(PL)Painting Ops-Bldg 7 TR Shop Booth EU-AEROPB,Blend: M06025 - CM0830991 - CM0110944 - CM0830081 - (4:1:2:1),5/6/2020 0:00,5/6/2020 0:00,0.1875,gal,6/19/2020 14:07,Kamiander,1,1,1,0,{'2020-06-19 14:07:52': 1},1,0
1110,Wichita KS,DefaultDept,(PL)Painting Ops-Bldg 7 TR Shop Booth EU-AEROPB,Blend: M06025 - CM0830991 - CM0110944 - CM0830081 - (4:1:2:1),5/12/2020 0:00,5/12/2020 0:00,0.125,gal,6/19/2020 14:09,Kamiander,1,1,1,0,{'2020-06-19 14:09:23': 1},1,0
1111,Wichita KS,DefaultDept,(PL)Painting Ops-Bldg 7 TR Shop Booth EU-AEROPB,Blend: M06025 - CM0830991 - CM0110944 - CM0830081 - (4:1:2:1),5/13/2020 0:00,5/13/2020 0:00,0.125,gal,6/19/2020 14:11,Kamiander,1,1,1,0,{'2020-06-19 14:11:05': 1},1,0
1112,Wichita KS,DefaultDept,(PL)Painting Ops-Bldg 7 TR Shop Booth EU-AEROPB,Blend: M06025 - CM0830991 - CM0110944 - CM0830081 - (4:1:2:1),5/18/2020 0:00,5/18/2020 0:00,0.0625,gal,7/20/2020 14:00,Kamiander,1,1,1,0,{'2020-07-20 14:00:13': 1},1,0
1113,Wichita KS,DefaultDept,(PL)Painting Ops-Bldg 7 TR Shop Booth EU-AEROPB,Blend: M06025 - CM0830991 - CM0110944 - CM0830081 - (4:1:2:1),5/19/2020 0:00,5/19/2020 0:00,0.25,gal,6/19/2020 14:14,Kamiander,1,1,1,0,{'2020-06-19 14:14:23': 1},1,0
1114,Wichita KS,DefaultDept,(PL)Painting Ops-Bldg 7 TR Shop Booth EU-AEROPB,Blend: M06025 - CM0830991 - CM0110944 - CM0830081 - (4:1:2:1),5/21/2020 0:00,5/21/2020 0:00,0.125,gal,6/19/2020 14:15,Kamiander,1,1,1,0,{'2020-06-19 14:15:48': 1},1,0
1115,Wichita KS,DefaultDept,(PL)Painting Ops-Bldg 7 TR Shop Booth EU-AEROPB,Blend: M06025 - CM0830991 - CM0110944 - CM0830081 - (4:1:2:1),5/29/2020 0:00,5/29/2020 0:00,0.2265625,gal,6/19/2020 14:18,Kamiander,1,1,1,0,{'2020-06-19 14:18:21': 1},1,0
1116,Wichita KS,DefaultDept,(PL)Painting Ops-Bldg 7 TR Shop Booth EU-AEROPB,Blend: M06025 - CM0830991 - CM0110944 - CM0830081 - (4:1:2:1),6/1/2020 0:00,6/1/2020 0:00,0.125,gal,7/28/2020 15:10,Kamiander,1,1,1,0,{'2020-07-28 15:10:53': 1},1,0
1117,Wichita KS,DefaultDept,(PL)Painting Ops-Bldg 7 TR Shop Booth EU-AEROPB,Blend: M06025 - CM0830991 - CM0110944 - CM0830081 - (4:1:2:1),6/18/2020 0:00,6/18/2020 0:00,0.125,gal,6/10/2020 9:24,Kamiander,1,1,1,0,{'2020-06-10 09:24:03': 1},1,0
1118,Wichita KS,DefaultDept,(PL)Painting Ops-Bldg 7 TR Shop Booth EU-AEROPB,Blend: M06025 - CM0830991 - CM0110944 - CM0830081 - (4:1:2:1),8/3/2020 0:00,8/3/2020 0:00,0.125,gal,9/30/2020 10:27,kamiander,1,1,1,0,{'2020-09-30 10:27:07': 1},1,0
1119,Wichita KS,DefaultDept,(PL)Painting Ops-Bldg 7 TR Shop Booth EU-AEROPB,Blend: M06025 - CM0830991 - CM0110944 - CM0830081 - (4:1:2:1),8/4/2020 0:00,8/4/2020 0:00,0.125,gal,10/12/2020 10:08,Kamiander,1,1,1,0,{'2020-10-12 10:08:07': 1},1,0
1120,Wichita KS,DefaultDept,(PL)Painting Ops-Bldg 7 TR Shop Booth EU-AEROPB,Blend: M06025 - CM0830991 - CM0110944 - CM0830081 - (4:1:2:1),8/5/2020 0:00,8/5/2020 0:00,0.125,gal,10/12/2020 10:09,Kamiander,1,1,1,0,{'2020-10-12 10:09:58': 1},1,0
1121,Wichita KS,DefaultDept,(PL)Painting Ops-Bldg 7 TR Shop Booth EU-AEROPB,Blend: M06025 - CM0830991 - CM0110944 - CM0830081 - (4:1:2:1),8/9/2020 0:00,8/9/2020 0:00,0.0625,gal,10/12/2020 10:25,Kamiander,1,1,1,0,{'2020-10-12 10:25:38': 1},1,0
1122,Wichita KS,DefaultDept,(PL)Painting Ops-Bldg 7 TR Shop Booth EU-AEROPB,Blend: M06025 - CM0830991 - CM0110944 - CM0830081 - (4:1:2:1),8/12/2020 0:00,8/12/2020 0:00,0.0625,gal,10/12/2020 10:27,Kamiander,1,1,1,0,{'2020-10-12 10:27:31': 1},1,0
1123,Wichita KS,DefaultDept,(PL)Painting Ops-Bldg 7 TR Shop Booth EU-AEROPB,Blend: M06025 - CM0830991 - CM0110944 - CM0830081 - (4:1:2:1),8/13/2020 0:00,8/13/2020 0:00,0.0625,gal,10/12/2020 10:29,Kamiander,1,1,1,0,{'2020-10-12 10:29:12': 1},1,0
1124,Wichita KS,DefaultDept,(PL)Painting Ops-Bldg 7 TR Shop Booth EU-AEROPB,Blend: M06025 - CM0830991 - CM0110944 - CM0830081 - (4:1:2:1),8/14/2020 0:00,8/14/2020 0:00,0.0625,gal,10/12/2020 10:31,Kamiander,1,1,1,0,{'2020-10-12 10:31:02': 1},1,0
1125,Wichita KS,DefaultDept,(PL)Painting Ops-Bldg 7 TR Shop Booth EU-AEROPB,Blend: M06025 - CM0830991 - CM0110944 - CM0830081 - (4:1:2:1),8/16/2020 0:00,8/16/2020 0:00,0.0625,gal,10/12/2020 10:34,Kamiander,1,1,1,0,{'2020-10-12 10:34:39': 1},1,0
1126,Wichita KS,DefaultDept,(PL)Painting Ops-Bldg 7 TR Shop Booth EU-AEROPB,Blend: M06025 - CM0830991 - CM0110944 - CM0830081 - (4:1:2:1),8/18/2020 0:00,8/18/2020 0:00,0.125,gal,10/12/2020 10:36,Kamiander,1,1,1,0,{'2020-10-12 10:36:37': 1},1,0
1127,Wichita KS,DefaultDept,(PL)Painting Ops-Bldg 7 TR Shop Booth EU-AEROPB,Blend: M06025 - CM0830991 - CM0110944 - CM0830081 - (4:1:2:1),8/22/2020 0:00,8/22/2020 0:00,0.0859375,gal,10/12/2020 10:38,Kamiander,1,1,1,0,{'2020-10-12 10:38:37': 1},1,0
1128,Wichita KS,DefaultDept,(PL)Painting Ops-Bldg 7 TR Shop Booth EU-AEROPB,Blend: M06025 - CM0830991 - CM0110944 - CM0830081 - (4:1:2:1),8/22/2020 0:00,8/22/2020 0:00,0.125,gal,10/12/2020 10:40,Kamiander,1,1,1,0,{'2020-10-12 10:40:12': 1},1,0
1129,Wichita KS,DefaultDept,(PL)Painting Ops-Bldg 7 TR Shop Booth EU-AEROPB,Blend: M06025 - CM0830991 - CM0110944 - CM0830081 - (4:1:2:1),8/26/2020 0:00,8/26/2020 0:00,0.125,gal,10/12/2020 10:42,Kamiander,1,1,1,0,{'2020-10-12 10:42:33': 1},1,0
1130,Wichita KS,DefaultDept,(PL)Painting Ops-Bldg 7 TR Shop Booth EU-AEROPB,Blend: M06025 1750465 - CM0830991 - CM0830081 - CM0110944 (2-2-1-1),7/26/2019 16:55,7/26/2019 16:55,0.046875,gal,7/26/2019 16:55,adminbomgb,1,1,1,0,{'2019-07-26 16:55:44': 1},1,0
1131,Wichita KS,DefaultDept,(PL)Painting Ops-Bldg 7 TR Shop Booth EU-AEROPB,Blend: M06025 1750465 - CM0830991 - CM0830081 - CM0110944 (4-2-1-1),1/25/2019 12:32,1/25/2019 12:32,0.125,gal,1/25/2019 12:32,adminbomsn,1,1,1,0,{'2019-01-25 12:32:09': 1},1,0
1132,Wichita KS,DefaultDept,(PL)Painting Ops-Bldg 7 TR Shop Booth EU-AEROPB,Blend: M06025 1750465 - CM0830991 - CM0830081 - CM0110944 (4-2-1-1),1/25/2019 12:37,1/25/2019 12:37,0.0625,gal,1/25/2019 12:37,adminbomsn,1,1,1,0,{'2019-01-25 12:37:14': 1},1,0
1133,Wichita KS,DefaultDept,(PL)Painting Ops-Bldg 7 TR Shop Booth EU-AEROPB,Blend: M06025 1750465 - CM0830991 - CM0830081 - CM0110944 (4-2-1-1),1/25/2019 12:59,1/25/2019 12:59,0.03125,gal,1/25/2019 12:59,adminbomna,1,1,1,0,{'2019-01-25 12:59:56': 1},1,0
1134,Wichita KS,DefaultDept,(PL)Painting Ops-Bldg 7 TR Shop Booth EU-AEROPB,Blend: M06025 1750465 - CM0830991 - CM0830081 - CM0110944 (4-2-1-1),1/25/2019 14:15,1/25/2019 14:15,0.25,gal,1/25/2019 14:15,adminbomsn,1,1,1,0,{'2019-01-25 14:15:17': 1},1,0
1135,Wichita KS,DefaultDept,(PL)Painting Ops-Bldg 7 TR Shop Booth EU-AEROPB,Blend: M06025 1750465 - CM0830991 - CM0830081 - CM0110944 (4-2-1-1),1/25/2019 14:32,1/25/2019 14:32,0.1875,gal,1/25/2019 14:32,adminbomsn,1,1,1,0,{'2019-01-25 14:32:14': 1},1,0
1136,Wichita KS,DefaultDept,(PL)Painting Ops-Bldg 7 TR Shop Booth EU-AEROPB,Blend: M06025 1750465 - CM0830991 - CM0830081 - CM0110944 (4-2-1-1),1/25/2019 14:32,1/25/2019 14:32,0.0625,gal,1/25/2019 14:32,adminbomna,1,1,1,0,{'2019-01-25 14:32:30': 1},1,0
1137,Wichita KS,DefaultDept,(PL)Painting Ops-Bldg 7 TR Shop Booth EU-AEROPB,Blend: M06025 1750465 - CM0830991 - CM0830081 - CM0110944 (4-2-1-1),1/25/2019 14:50,1/25/2019 14:50,0.0390625,gal,1/25/2019 14:50,adminbomcb,1,1,1,0,{'2019-01-25 14:50:25': 1},1,0
1138,Wichita KS,DefaultDept,(PL)Painting Ops-Bldg 7 TR Shop Booth EU-AEROPB,Blend: M06025 1750465 - CM0830991 - CM0830081 - CM0110944 (4-2-1-1),1/25/2019 15:34,1/25/2019 15:34,0.09375,gal,1/25/2019 15:35,adminbomcr,1,1,1,0,{'2019-01-25 15:35:02': 1},1,0
1139,Wichita KS,DefaultDept,(PL)Painting Ops-Bldg 7 TR Shop Booth EU-AEROPB,Blend: M06025 1750465 - CM0830991 - CM0830081 - CM0110944 (4-2-1-1),1/25/2019 16:15,1/25/2019 16:15,0.01171875,gal,1/25/2019 16:15,adminbomsn,1,1,1,0,{'2019-01-25 16:15:41': 1},1,0
1140,Wichita KS,DefaultDept,(PL)Painting Ops-Bldg 7 TR Shop Booth EU-AEROPB,Blend: M06025 1750465 - CM0830991 - CM0830081 - CM0110944 (4-2-1-1),1/28/2019 10:02,1/28/2019 10:02,0.125,gal,1/28/2019 10:02,adminbomcb,1,1,1,0,{'2019-01-28 10:02:25': 1},1,0
1141,Wichita KS,DefaultDept,(PL)Painting Ops-Bldg 7 TR Shop Booth EU-AEROPB,Blend: M06025 1750465 - CM0830991 - CM0830081 - CM0110944 (4-2-1-1),1/28/2019 10:10,1/28/2019 10:10,0.125,gal,1/28/2019 10:10,adminbomcb,1,1,1,0,{'2019-01-28 10:10:44': 1},1,0
1142,Wichita KS,DefaultDept,(PL)Painting Ops-Bldg 7 TR Shop Booth EU-AEROPB,Blend: M06025 1750465 - CM0830991 - CM0830081 - CM0110944 (4-2-1-1),1/28/2019 13:51,1/28/2019 13:51,0.03125,gal,1/28/2019 13:51,adminbomcb,1,1,1,0,{'2019-01-28 13:51:53': 1},1,0
1143,Wichita KS,DefaultDept,(PL)Painting Ops-Bldg 7 TR Shop Booth EU-AEROPB,Blend: M06025 1750465 - CM0830991 - CM0830081 - CM0110944 (4-2-1-1),1/28/2019 14:14,1/28/2019 14:14,0.0625,gal,1/28/2019 14:14,adminbomcb,1,1,1,0,{'2019-01-28 14:14:29': 1},1,0
1144,Wichita KS,DefaultDept,(PL)Painting Ops-Bldg 7 TR Shop Booth EU-AEROPB,Blend: M06025 1750465 - CM0830991 - CM0830081 - CM0110944 (4-2-1-1),1/28/2019 17:16,1/28/2019 17:16,0.125,gal,3/24/2020 16:26,adminbomry,1,1,1,0,{'2020-03-24 16:26:00': 1},1,0
1145,Wichita KS,DefaultDept,(PL)Painting Ops-Bldg 7 TR Shop Booth EU-AEROPB,Blend: M06025 1750465 - CM0830991 - CM0830081 - CM0110944 (4-2-1-1),1/29/2019 11:09,1/29/2019 11:09,0.125,gal,1/29/2019 11:09,adminbomna,1,1,1,0,{'2019-01-29 11:09:17': 1},1,0
1146,Wichita KS,DefaultDept,(PL)Painting Ops-Bldg 7 TR Shop Booth EU-AEROPB,Blend: M06025 1750465 - CM0830991 - CM0830081 - CM0110944 (4-2-1-1),7/3/2019 22:00,7/3/2019 22:00,0.125,gal,8/20/2019 16:59,adminbomgb,1,1,1,0,{'2019-08-20 16:59:17': 1},1,0
1147,Wichita KS,DefaultDept,(PL)Painting Ops-Bldg 7 TR Shop Booth EU-AEROPB,Blend: M06025 1750465 - CM0830991 - CM0830081 - CM0110944 (4-2-1-1),7/9/2019 9:30,7/9/2019 9:30,0.09375,gal,8/21/2019 8:23,adminbomgb,1,1,1,0,{'2019-08-21 08:23:29': 1},1,0
1148,Wichita KS,DefaultDept,(PL)Painting Ops-Bldg 7 TR Shop Booth EU-AEROPB,Blend: M06025 1750465 - CM0830991 - CM0830081 - CM0110944 (4-2-1-1),7/11/2019 9:30,7/11/2019 9:30,0.125,gal,8/21/2019 10:32,adminbomgb,1,1,1,0,{'2019-08-21 10:32:07': 1},1,0
1149,Wichita KS,DefaultDept,(PL)Painting Ops-Bldg 7 TR Shop Booth EU-AEROPB,Blend: M06025 1750465 - CM0830991 - CM0830081 - CM0110944 (4-2-1-1),7/13/2019 16:42,7/13/2019 16:42,0.109375,gal,8/21/2019 10:46,adminbomgb,1,1,1,0,{'2019-08-21 10:46:17': 1},1,0
1150,Wichita KS,DefaultDept,(PL)Painting Ops-Bldg 7 TR Shop Booth EU-AEROPB,Blend: M06025 1750465 - CM0830991 - CM0830081 - CM0110944 (4-2-1-1),7/16/2019 12:00,7/16/2019 12:00,0.0625,gal,8/21/2019 10:50,adminbomgb,1,1,1,0,{'2019-08-21 10:50:20': 1},1,0
1151,Wichita KS,DefaultDept,(PL)Painting Ops-Bldg 7 TR Shop Booth EU-AEROPB,Blend: M06025 1750465 - CM0830991 - CM0830081 - CM0110944 (4-2-1-1),7/17/2019 11:35,7/17/2019 11:35,0.09375,gal,7/17/2019 11:35,adminbommg,1,1,1,0,{'2019-07-17 11:35:37': 1},1,0
1152,Wichita KS,DefaultDept,(PL)Painting Ops-Bldg 7 TR Shop Booth EU-AEROPB,Blend: M06025 1750465 - CM0830991 - CM0830081 - CM0110944 (4-2-1-1),7/18/2019 14:32,7/18/2019 14:32,0.125,gal,7/18/2019 14:32,adminbommg,1,1,1,0,{'2019-07-18 14:32:26': 1},1,0
1153,Wichita KS,DefaultDept,(PL)Painting Ops-Bldg 7 TR Shop Booth EU-AEROPB,Blend: M06025 1750465 - CM0830991 - CM0830081 - CM0110944 (4-2-1-1),7/18/2019 16:39,7/18/2019 16:39,0.0546875,gal,7/18/2019 16:39,adminbommg,1,1,1,0,{'2019-07-18 16:39:13': 1},1,0
1154,Wichita KS,DefaultDept,(PL)Painting Ops-Bldg 7 TR Shop Booth EU-AEROPB,Blend: M06025 1750465 - CM0830991 - CM0830081 - CM0110944 (4-2-1-1),7/19/2019 10:00,7/19/2019 10:00,0.0625,gal,8/21/2019 10:57,adminbomgb,1,1,1,0,{'2019-08-21 10:57:40': 1},1,0
1155,Wichita KS,DefaultDept,(PL)Painting Ops-Bldg 7 TR Shop Booth EU-AEROPB,Blend: M06025 1750465 - CM0830991 - CM0830081 - CM0110944 (4-2-1-1),7/20/2019 9:00,7/20/2019 9:00,0.0625,gal,8/21/2019 11:11,adminbomgb,1,1,1,0,{'2019-08-21 11:11:27': 1},1,0
1156,Wichita KS,DefaultDept,(PL)Painting Ops-Bldg 7 TR Shop Booth EU-AEROPB,Blend: M06025 1750465 - CM0830991 - CM0830081 - CM0110944 (4-2-1-1),7/22/2019 14:37,7/22/2019 14:37,0.1875,gal,7/22/2019 14:37,adminbommg,1,1,1,0,{'2019-07-22 14:37:19': 1},1,0
1157,Wichita KS,DefaultDept,(PL)Painting Ops-Bldg 7 TR Shop Booth EU-AEROPB,Blend: M06025 1750465 - CM0830991 - CM0830081 - CM0110944 (4-2-1-1),7/22/2019 14:43,7/22/2019 14:43,0.21875,gal,7/22/2019 14:43,adminbommg,1,1,1,0,{'2019-07-22 14:43:10': 1},1,0
1158,Wichita KS,DefaultDept,(PL)Painting Ops-Bldg 7 TR Shop Booth EU-AEROPB,Blend: M06025 1750465 - CM0830991 - CM0830081 - CM0110944 (4-2-1-1),7/22/2019 15:09,7/22/2019 15:09,0.109375,gal,7/22/2019 15:09,adminbommg,1,1,1,0,{'2019-07-22 15:09:36': 1},1,0
1159,Wichita KS,DefaultDept,(PL)Painting Ops-Bldg 7 TR Shop Booth EU-AEROPB,Blend: M06025 1750465 - CM0830991 - CM0830081 - CM0110944 (4-2-1-1),7/22/2019 15:25,7/22/2019 15:25,0.25,gal,7/22/2019 15:25,adminbommg,1,1,1,0,{'2019-07-22 15:25:06': 1},1,0
1160,Wichita KS,DefaultDept,(PL)Painting Ops-Bldg 7 TR Shop Booth EU-AEROPB,Blend: M06025 1750465 - CM0830991 - CM0830081 - CM0110944 (4-2-1-1),7/22/2019 15:48,7/22/2019 15:48,0.0625,gal,7/22/2019 15:48,adminbommg,1,1,1,0,{'2019-07-22 15:48:46': 1},1,0
1161,Wichita KS,DefaultDept,(PL)Painting Ops-Bldg 7 TR Shop Booth EU-AEROPB,Blend: M06025 1750465 - CM0830991 - CM0830081 - CM0110944 (4-2-1-1),7/22/2019 15:55,7/22/2019 15:55,0.375,gal,7/22/2019 15:55,adminbommg,1,1,1,0,{'2019-07-22 15:55:43': 1},1,0
1162,Wichita KS,DefaultDept,(PL)Painting Ops-Bldg 7 TR Shop Booth EU-AEROPB,Blend: M06025 1750465 - CM0830991 - CM0830081 - CM0110944 (4-2-1-1),7/23/2019 9:25,7/23/2019 9:25,0.0625,gal,7/23/2019 9:25,adminbommg,1,1,1,0,{'2019-07-23 09:25:01': 1},1,0
1163,Wichita KS,DefaultDept,(PL)Painting Ops-Bldg 7 TR Shop Booth EU-AEROPB,Blend: M06025 1750465 - CM0830991 - CM0830081 - CM0110944 (4-2-1-1),7/23/2019 9:42,7/23/2019 9:42,0.125,gal,7/23/2019 9:42,adminbommg,1,1,1,0,{'2019-07-23 09:42:42': 1},1,0
1164,Wichita KS,DefaultDept,(PL)Painting Ops-Bldg 7 TR Shop Booth EU-AEROPB,Blend: M06025 1750465 - CM0830991 - CM0830081 - CM0110944 (4-2-1-1),7/23/2019 9:48,7/23/2019 9:48,0.09375,gal,7/23/2019 9:48,adminbommg,1,1,1,0,{'2019-07-23 09:48:44': 1},1,0
1165,Wichita KS,DefaultDept,(PL)Painting Ops-Bldg 7 TR Shop Booth EU-AEROPB,Blend: M06025 1750465 - CM0830991 - CM0830081 - CM0110944 (4-2-1-1),7/23/2019 14:01,7/23/2019 14:01,0.25,gal,7/23/2019 14:01,adminbommg,1,1,1,0,{'2019-07-23 14:01:31': 1},1,0
1166,Wichita KS,DefaultDept,(PL)Painting Ops-Bldg 7 TR Shop Booth EU-AEROPB,Blend: M06025 1750465 - CM0830991 - CM0830081 - CM0110944 (4-2-1-1),7/23/2019 18:00,7/23/2019 18:00,0.0625,gal,8/21/2019 11:18,adminbomgb,1,1,1,0,{'2019-08-21 11:18:45': 1},1,0
1167,Wichita KS,DefaultDept,(PL)Painting Ops-Bldg 7 TR Shop Booth EU-AEROPB,Blend: M06025 1750465 - CM0830991 - CM0830081 - CM0110944 (4-2-1-1),7/26/2019 11:24,7/26/2019 11:24,0.0625,gal,7/26/2019 11:26,adminbomgb,1,1,1,0,{'2019-07-26 11:26:59': 1},1,0
1168,Wichita KS,DefaultDept,(PL)Painting Ops-Bldg 7 TR Shop Booth EU-AEROPB,Blend: M06025 1750465 - CM0830991 - CM0830081 - CM0110944 (4-2-1-1),7/26/2019 11:36,7/26/2019 11:36,0.0625,gal,7/26/2019 11:36,adminbomgb,1,1,1,0,{'2019-07-26 11:36:25': 1},1,0
1169,Wichita KS,DefaultDept,(PL)Painting Ops-Bldg 7 TR Shop Booth EU-AEROPB,Blend: M06025 1750465 - CM0830991 - CM0830081 - CM0110944 (4-2-1-1),7/26/2019 13:49,7/26/2019 13:49,0.1875,gal,7/26/2019 13:49,adminbomgb,1,1,1,0,{'2019-07-26 13:49:49': 1},1,0
1170,Wichita KS,DefaultDept,(PL)Painting Ops-Bldg 7 TR Shop Booth EU-AEROPB,Blend: M06025 1750465 - CM0830991 - CM0830081 - CM0110944 (4-2-1-1),7/26/2019 15:15,7/26/2019 15:15,0.125,gal,7/26/2019 15:15,adminbomgb,1,1,1,0,{'2019-07-26 15:15:28': 1},1,0
1171,Wichita KS,DefaultDept,(PL)Painting Ops-Bldg 7 TR Shop Booth EU-AEROPB,Blend: M06025 1750465 - CM0830991 - CM0830081 - CM0110944 (4-2-1-1),7/26/2019 16:18,7/26/2019 16:18,0.25,gal,7/26/2019 16:18,adminbomgb,1,1,1,0,{'2019-07-26 16:18:32': 1},1,0
1172,Wichita KS,DefaultDept,(PL)Painting Ops-Bldg 7 TR Shop Booth EU-AEROPB,Blend: M06025 1750465 - CM0830991 - CM0830081 - CM0110944 (4-2-1-1),7/29/2019 8:19,7/29/2019 8:19,0.1875,gal,7/29/2019 8:19,adminbomgb,1,1,1,0,{'2019-07-29 08:19:00': 1},1,0
1173,Wichita KS,DefaultDept,(PL)Painting Ops-Bldg 7 TR Shop Booth EU-AEROPB,Blend: M06025 1750465 - CM0830991 - CM0830081 - CM0110944 (4-2-1-1),2/7/2020 14:59,2/7/2020 14:59,0.125,gal,5/7/2020 15:00,adminbomry,1,1,1,0,{'2020-05-07 15:00:25': 1},1,0
1174,Wichita KS,DefaultDept,(PL)Painting Ops-Bldg 7 TR Shop Booth EU-AEROPB,Blend: M06025 1750465 - CM0830991 - CM0830081 - CM0110944 (4-2-1-1),2/20/2020 16:41,2/20/2020 16:41,0.125,gal,5/7/2020 16:41,adminbomry,1,1,1,0,{'2020-05-07 16:41:58': 1},1,0
1175,Wichita KS,DefaultDept,(PL)Painting Ops-Bldg 7 TR Shop Booth EU-AEROPB,Blend: M06025 1750465 - CM0830991 - CM0830081 - CM0110944 (4-2-1-1),2/21/2020 16:48,2/21/2020 16:48,0.125,gal,5/7/2020 16:49,adminbomry,1,1,1,0,{'2020-05-07 16:49:38': 1},1,0
1176,Wichita KS,DefaultDept,(PL)Painting Ops-Bldg 7 TR Shop Booth EU-AEROPB,Blend: M06025 1750465 - CM0830991 - CM0830081 - CM0110944 (4-2-1-1),4/8/2020 0:00,4/8/2020 0:00,0.125,gal,6/9/2020 16:00,Kamiander,1,1,1,0,{'2020-06-09 16:00:40': 1},1,0
1177,Wichita KS,DefaultDept,(PL)Painting Ops-Bldg 7 TR Shop Booth EU-AEROPB,Blend: M06025 1750465 - CM0830991 - CM0830081 - CM0110944 (4-2-1-1),6/4/2020 0:00,6/4/2020 0:00,0.125,gal,7/28/2020 15:21,Kamiander,1,1,1,0,{'2020-07-28 15:21:27': 1},1,0
1178,Wichita KS,DefaultDept,(PL)Painting Ops-Bldg 7 TR Shop Booth EU-AEROPB,Blend: M06025 1750465 - CM0830991 - CM0830081 - CM0110944 (4-2-1-1),6/25/2020 0:00,6/25/2020 0:00,0.125,gal,8/25/2020 10:49,Kamiander,1,1,1,0,{'2020-08-25 10:49:31': 1},1,0
1179,Wichita KS,DefaultDept,(PL)Painting Ops-Bldg 7 TR Shop Booth EU-AEROPB,Blend: M06025 1750465 - CM0830991 - CM0830081 - CM0110944 - CM0830080 (4-2-1-1-1),7/1/2019 18:00,7/1/2019 18:00,0.0546875,gal,8/22/2019 12:02,adminbomgb,1,1,1,0,{'2019-08-22 12:02:16': 1},1,0
1180,Wichita KS,DefaultDept,(PL)Painting Ops-Bldg 7 TR Shop Booth EU-AEROPB,Blend: N381-9217 - CM0830081 - CM0830H18 (3-1-0.375),1/25/2019 11:39,1/25/2019 11:39,0.0234375,gal,1/25/2019 11:39,adminbomna,1,1,1,0,{'2019-01-25 11:39:18': 1},1,0
1181,Wichita KS,DefaultDept,(PL)Painting Ops-Bldg 7 TR Shop Booth EU-AEROPB,Blend: N381-9217 - CM0830081 - CM0830H18 (3-1-0.375),1/25/2019 11:48,1/25/2019 11:48,0.01953125,gal,1/25/2019 11:48,adminbomna,1,1,1,0,{'2019-01-25 11:48:31': 1},1,0
1182,Wichita KS,DefaultDept,(PL)Painting Ops-Bldg 7 TR Shop Booth EU-AEROPB,Blend: N381-9217 - CM0830081 - CM0830H18 (3-1-0.375),1/25/2019 14:19,1/25/2019 14:19,0.027344,gal,7/5/2019 13:44,adminbomgb,1,1,1,0,{'2019-07-05 13:44:50': 1},1,0
1183,Wichita KS,DefaultDept,(PL)Painting Ops-Bldg 7 TR Shop Booth EU-AEROPB,Blend: N381-9217 - CM0830081 - CM0830H18 (3-1-0.375),1/25/2019 16:35,1/25/2019 16:35,0.015625,gal,1/25/2019 16:35,adminbomsn,1,1,1,0,{'2019-01-25 16:35:18': 1},1,0
1184,Wichita KS,DefaultDept,(PL)Painting Ops-Bldg 7 TR Shop Booth EU-AEROPB,Blend: N381-9217 - CM0830081 - CM0830H18 (3-1-0.375),1/28/2019 9:50,1/28/2019 9:50,0.01953125,gal,1/28/2019 9:51,adminbomsn,1,1,1,0,{'2019-01-28 09:51:01': 1},1,0
1185,Wichita KS,DefaultDept,(PL)Painting Ops-Bldg 7 TR Shop Booth EU-AEROPB,Blend: N381-9217 - CM0830081 - CM0830H18 (3-1-0.375),1/28/2019 10:47,1/28/2019 10:47,0.02734375,gal,1/28/2019 10:47,adminbomna,1,1,1,0,{'2019-01-28 10:47:55': 1},1,0
1186,Wichita KS,DefaultDept,(PL)Painting Ops-Bldg 7 TR Shop Booth EU-AEROPB,Blend: N381-9217 - CM0830081 - CM0830H18 (3-1-0.375),1/28/2019 11:59,1/28/2019 11:59,0.0234375,gal,1/28/2019 12:00,adminbomna,1,1,1,0,{'2019-01-28 12:00:03': 1},1,0
1187,Wichita KS,DefaultDept,(PL)Painting Ops-Bldg 7 TR Shop Booth EU-AEROPB,Blend: N381-9217 - CM0830081 - CM0830H18 (3-1-0.375),1/28/2019 12:06,1/28/2019 12:06,0.015625,gal,1/28/2019 12:06,adminbomna,1,1,1,0,{'2019-01-28 12:06:39': 1},1,0
1188,Wichita KS,DefaultDept,(PL)Painting Ops-Bldg 7 TR Shop Booth EU-AEROPB,Blend: N381-9217 - CM0830081 - CM0830H18 (3-1-0.375),1/29/2019 10:20,1/29/2019 10:20,0.0234375,gal,1/29/2019 10:20,adminbomna,1,1,1,0,{'2019-01-29 10:20:32': 1},1,0
1189,Wichita KS,DefaultDept,(PL)Painting Ops-Bldg 7 TR Shop Booth EU-AEROPB,Blend: N381-9217 - CM0830081 - CM0830H18 (3-1-0.375),2/1/2019 9:41,2/1/2019 9:41,0.0234375,gal,7/10/2019 9:06,adminbomgb,1,1,1,0,{'2019-07-10 09:06:15': 1},1,0
1190,Wichita KS,DefaultDept,(PL)Painting Ops-Bldg 7 TR Shop Booth EU-AEROPB,Blend: N381-9217 - CM0830081 - CM0830H18 (3-1-0.375),7/9/2019 14:10,7/9/2019 14:10,0.01875,gal,8/21/2019 8:30,adminbomgb,1,1,1,0,{'2019-08-21 08:30:04': 1},1,0
1191,Wichita KS,DefaultDept,(PL)Painting Ops-Bldg 7 TR Shop Booth EU-AEROPB,Blend: N381-9217 - CM0830081 - CM0830H18 (3-1-0.375),7/12/2019 11:20,7/12/2019 11:20,0.01875,gal,8/21/2019 10:38,adminbomgb,1,1,1,0,{'2019-08-21 10:38:27': 1},1,0
1192,Wichita KS,DefaultDept,(PL)Painting Ops-Bldg 7 TR Shop Booth EU-AEROPB,Blend: N381-9217 - CM0830081 - CM0830H18 (3-1-0.375),7/18/2019 13:59,7/18/2019 13:59,0.0234375,gal,7/18/2019 13:59,adminbommg,1,1,1,0,{'2019-07-18 13:59:55': 1},1,0
1193,Wichita KS,DefaultDept,(PL)Painting Ops-Bldg 7 TR Shop Booth EU-AEROPB,Blend: N381-9217 - CM0830081 - CM0830H18 (3-1-0.375),7/18/2019 16:32,7/18/2019 16:32,0.019140625,gal,7/18/2019 16:32,adminbommg,1,1,1,0,{'2019-07-18 16:32:20': 1},1,0
1194,Wichita KS,DefaultDept,(PL)Painting Ops-Bldg 7 TR Shop Booth EU-AEROPB,Blend: N381-9217 - CM0830081 - CM0830H18 (3-1-0.375),7/22/2019 16:23,7/22/2019 16:23,0.0703125,gal,7/22/2019 16:23,adminbommg,1,1,1,0,{'2019-07-22 16:23:21': 1},1,0
1195,Wichita KS,DefaultDept,(PL)Painting Ops-Bldg 7 TR Shop Booth EU-AEROPB,Blend: N381-9217 - CM0830081 - CM0830H18 (3-1-0.375),7/23/2019 9:45,7/23/2019 9:45,0.018554688,gal,7/23/2019 9:45,adminbommg,1,1,1,0,{'2019-07-23 09:45:43': 1},1,0
1196,Wichita KS,DefaultDept,(PL)Painting Ops-Bldg 7 TR Shop Booth EU-AEROPB,Blend: N381-9217 - CM0830081 - CM0830H18 (3-1-0.375),7/23/2019 13:00,7/23/2019 13:00,0.01875,gal,8/21/2019 11:15,adminbomgb,1,1,1,0,{'2019-08-21 11:15:54': 1},1,0
1197,Wichita KS,DefaultDept,(PL)Painting Ops-Bldg 7 TR Shop Booth EU-AEROPB,Blend: N381-9217 - CM0830081 - CM0830H18 (3-1-0.375),7/26/2019 11:09,7/26/2019 11:09,0.018554688,gal,7/26/2019 11:31,adminbomgb,1,1,1,0,{'2019-07-26 11:31:10': 1},1,0
1198,Wichita KS,DefaultDept,(PL)Painting Ops-Bldg 7 TR Shop Booth EU-AEROPB,Blend: N381-9217 - CM0830081 - CM0830H18 (3-1-0.375),7/26/2019 11:26,7/26/2019 11:26,0.018554688,gal,7/26/2019 11:26,adminbomgb,1,1,1,0,{'2019-07-26 11:26:10': 1},1,0
1199,Wichita KS,DefaultDept,(PL)Painting Ops-Bldg 7 TR Shop Booth EU-AEROPB,Blend: N381-9217 - CM0830081 - CM0830H18 (3-1-0.375),7/26/2019 13:21,7/26/2019 13:21,0.037109375,gal,7/26/2019 13:21,adminbomgb,1,1,1,0,{'2019-07-26 13:21:30': 1},1,0
1200,Wichita KS,DefaultDept,(PL)Painting Ops-Bldg 7 TR Shop Booth EU-AEROPB,Blend: N381-9217 - CM0830081 - CM0830H18 (3-1-0.375),7/26/2019 14:11,7/26/2019 14:11,0.019140625,gal,7/26/2019 14:11,adminbomgb,1,1,1,0,{'2019-07-26 14:11:54': 1},1,0
1201,Wichita KS,DefaultDept,(PL)Painting Ops-Bldg 7 TR Shop Booth EU-AEROPB,Blend: N381-9217 - CM0830081 - CM0830H18 (3-1-0.375),7/26/2019 14:39,7/26/2019 14:39,0.01640625,gal,7/26/2019 14:39,adminbomgb,1,1,1,0,{'2019-07-26 14:39:27': 1},1,0
1202,Wichita KS,DefaultDept,(PL)Painting Ops-Bldg 7 TR Shop Booth EU-AEROPB,Blend: N381-9217 - CM0830081 - CM0830H18 (3-1-0.375),7/26/2019 15:08,7/26/2019 15:08,0.01875,gal,7/26/2019 15:08,adminbomgb,1,1,1,0,{'2019-07-26 15:08:47': 1},1,0
1203,Wichita KS,DefaultDept,(PL)Painting Ops-Bldg 7 TR Shop Booth EU-AEROPB,Blend: N381-9217 - CM0830081 - CM0830H18 (3-1-0.375),7/26/2019 15:18,7/26/2019 15:18,0.018359375,gal,7/26/2019 15:18,adminbomgb,1,1,1,0,{'2019-07-26 15:18:50': 1},1,0
1204,Wichita KS,DefaultDept,(PL)Painting Ops-Bldg 7 TR Shop Booth EU-AEROPB,Blend: N381-9217 - CM0830081 - CM0830H18 (3:1:3/8),8/6/2019 8:00,8/6/2019 8:00,0.01875,gal,9/17/2019 16:44,adminbomgb,1,1,1,0,{'2019-09-17 16:44:27': 1},1,0
1205,Wichita KS,DefaultDept,(PL)Painting Ops-Bldg 7 TR Shop Booth EU-AEROPB,Blend: N381-9217 - CM0830081 - CM0830H18 (3:1:3/8),8/8/2019 12:10,8/8/2019 12:10,0.01875,gal,9/17/2019 16:50,adminbomgb,1,1,1,0,{'2019-09-17 16:50:47': 1},1,0
1206,Wichita KS,DefaultDept,(PL)Painting Ops-Bldg 7 TR Shop Booth EU-AEROPB,Blend: N381-9217 - CM0830081 - CM0830H18 (3:1:3/8),8/15/2019 2:00,8/15/2019 2:00,0.01875,gal,9/18/2019 8:46,adminbomgb,1,1,1,0,{'2019-09-18 08:46:37': 1},1,0
1207,Wichita KS,DefaultDept,(PL)Painting Ops-Bldg 7 TR Shop Booth EU-AEROPB,Blend: N381-9217 - CM0830081 - CM0830H18 (3:1:3/8),9/3/2019 8:35,9/3/2019 8:35,0.01875,gal,10/15/2019 13:27,adminbomgb,1,1,1,0,{'2019-10-15 13:27:07': 1},1,0
1208,Wichita KS,DefaultDept,(PL)Painting Ops-Bldg 7 TR Shop Booth EU-AEROPB,Blend: N381-9218 - CM0830081 - CM0110944 - CM0830H18 (2-1-.5-0.375),7/18/2019 16:14,7/18/2019 16:14,0.030273438,gal,7/18/2019 16:14,adminbommg,1,1,1,0,{'2019-07-18 16:14:48': 1},1,0
1209,Wichita KS,DefaultDept,(PL)Painting Ops-Bldg 7 TR Shop Booth EU-AEROPB,CA 8800/F16473 Base Component - CA 8800Z Activator - CA 8800CT2 Thinner Blend,1/25/2019 12:42,1/25/2019 12:42,0.078125,gal,1/25/2019 12:43,adminbomna,1,1,1,0,{'2019-01-25 12:43:01': 1},1,0
1210,Wichita KS,DefaultDept,(PL)Painting Ops-Bldg 7 TR Shop Booth EU-AEROPB,CA 8800/F16473 Base Component - CA 8800Z Activator - CA 8800CT2 Thinner Blend,1/25/2019 15:38,1/25/2019 15:38,0.0625,gal,1/25/2019 15:38,adminbomna,1,1,1,0,{'2019-01-25 15:38:14': 1},1,0
1211,Wichita KS,DefaultDept,(PL)Painting Ops-Bldg 7 TR Shop Booth EU-AEROPB,CA 8800/F16473 Base Component - CA 8800Z Activator - CA 8800CT2 Thinner Blend,1/25/2019 15:51,1/25/2019 15:51,0.03125,gal,1/25/2019 15:51,adminbomsn,1,1,1,0,{'2019-01-25 15:51:05': 1},1,0
1212,Wichita KS,DefaultDept,(PL)Painting Ops-Bldg 7 TR Shop Booth EU-AEROPB,CA 8800/I1024 BASE COMPONENT - CA 8800Z ACTIVATOR - CA8800CT THINNER,11/20/2019 15:31,11/20/2019 15:31,0.0625,gal,1/24/2020 16:31,Kamiander,1,1,1,0,{'2020-01-24 16:31:42': 1},1,0
1213,Wichita KS,DefaultDept,(PL)Painting Ops-Bldg 7 TR Shop Booth EU-AEROPB,CA 8800/I1050 - CA 8800CT - CA 8800Z (2:1:1.5),5/14/2020 0:00,5/14/2020 0:00,0.10546875,gal,8/25/2020 10:21,Kamiander,1,1,1,0,{'2020-08-25 10:21:06': 1},1,0
1214,Wichita KS,DefaultDept,(PL)Painting Ops-Bldg 7 TR Shop Booth EU-AEROPB,CA8800 I2881 - CA8800Z - CA8800CT2 (2:1:1),7/2/2020 0:00,7/2/2020 0:00,0.046875,gal,8/26/2020 12:48,Kamiander,1,1,1,0,{'2020-08-26 12:48:04': 1},1,0
1215,Wichita KS,DefaultDept,(PL)Painting Ops-Bldg 7 TR Shop Booth EU-AEROPB,CA8800 I2881 - CA8800Z - CA8800CT2 (2:1:1),7/9/2020 0:00,7/9/2020 0:00,0.0625,gal,8/26/2020 14:17,Kamiander,1,1,1,0,{'2020-08-26 14:17:12': 1},1,0
1216,Wichita KS,DefaultDept,(PL)Painting Ops-Bldg 7 TR Shop Booth EU-AEROPB,CA8800 i2881 - CA8800Z - CA8800CT,5/11/2020 0:00,5/11/2020 0:00,0.125,gal,8/25/2020 14:01,Kamiander,1,1,1,0,{'2020-08-25 14:01:40': 1},1,0
1217,Wichita KS,DefaultDept,(PL)Painting Ops-Bldg 7 TR Shop Booth EU-AEROPB,CM0110944  1.5 l CM0830991  2 l CM0830081  1 l M06025 1750465  4 l,8/6/2020 0:00,8/6/2020 0:00,0.265625,gal,10/12/2020 10:14,Kamiander,1,1,1,0,{'2020-10-12 10:14:12': 1},1,0
1218,Wichita KS,DefaultDept,(PL)Painting Ops-Bldg 7 TR Shop Booth EU-AEROPB,CM0830080 - CM0830081 - CM0830H18 (3:1:.5),6/4/2020 0:00,6/4/2020 0:00,0.0859375,gal,8/11/2020 10:51,Kamiander,1,1,1,0,{'2020-08-11 10:51:59': 1},1,0
1219,Wichita KS,DefaultDept,(PL)Painting Ops-Bldg 7 TR Shop Booth EU-AEROPB,CM0830080 - CM0830081 - CM0830H18 (3:1:.5),6/12/2020 0:00,6/12/2020 0:00,0.0859375,gal,8/11/2020 10:59,Kamiander,1,1,1,0,{'2020-08-11 10:59:44': 1},1,0
1220,Wichita KS,DefaultDept,(PL)Painting Ops-Bldg 7 TR Shop Booth EU-AEROPB,CM0830080 - CM0830081 - CM0830H18 - CM0110944 (3:1:3/8:1.5),7/11/2020 0:00,7/11/2020 0:00,0.16640625,gal,8/26/2020 16:10,Kamiander,1,1,1,0,{'2020-08-26 16:10:03': 1},1,0
1221,Wichita KS,DefaultDept,(PL)Painting Ops-Bldg 7 TR Shop Booth EU-AEROPB,CM0830080 - CM0830081 - CM0830H18 - CM0110944 (3:1:3/8:1.5),7/14/2020 0:00,7/14/2020 0:00,0.16640625,gal,8/26/2020 16:07,Kamiander,1,1,1,0,{'2020-08-26 16:07:52': 1},1,0
1222,Wichita KS,DefaultDept,(PL)Painting Ops-Bldg 7 TR Shop Booth EU-AEROPB,CM0830080 - CM0830081 - CM0830H18 - CM0110944 (3:1:3/8:1.5),8/6/2020 0:00,8/6/2020 0:00,0.12109375,gal,10/12/2020 11:37,Kamiander,1,1,1,0,{'2020-10-12 11:37:55': 1},1,0
1223,Wichita KS,DefaultDept,(PL)Painting Ops-Bldg 7 TR Shop Booth EU-AEROPB,CM0830080 - CM0830081 - CM0830H18 - CM0110944 (3:1:3/8:1.5),8/7/2020 0:00,8/7/2020 0:00,0.18203125,gal,10/12/2020 11:34,Kamiander,1,1,1,0,{'2020-10-12 11:34:22': 1},1,0
1224,Wichita KS,DefaultDept,(PL)Painting Ops-Bldg 7 TR Shop Booth EU-AEROPB,CM0830080 - CM0830081 - CM0830H18 - CM0110944 (3:1:3/8:1.5),8/14/2020 0:00,8/14/2020 0:00,0.121875,gal,10/12/2020 11:30,Kamiander,1,1,1,0,{'2020-10-12 11:30:40': 1},1,0
1225,Wichita KS,DefaultDept,(PL)Painting Ops-Bldg 7 TR Shop Booth EU-AEROPB,CM0830080 - CM0830081 - CM0830H18 - CM0110944 (3:1:3/8:1.5),9/1/2020 0:00,9/1/2020 0:00,0.121875,gal,10/15/2020 10:21,Kamiander,1,1,1,0,{'2020-10-15 10:21:45': 1},1,0
1226,Wichita KS,DefaultDept,(PL)Painting Ops-Bldg 7 TR Shop Booth EU-AEROPB,CM0830080 - CM0830081 - CM0830H18 - CM0110944 (3:1:3/8:1.5),9/3/2020 0:00,9/3/2020 0:00,0.014609375,gal,10/15/2020 10:24,Kamiander,1,1,1,0,{'2020-10-15 10:24:34': 1},1,0
1227,Wichita KS,DefaultDept,(PL)Painting Ops-Bldg 7 TR Shop Booth EU-AEROPB,CM0830080 - CM0830081 - CM0830H18 - CM0110944 (3:1:3/8:1.5),9/3/2020 0:00,9/3/2020 0:00,0.1328125,gal,10/15/2020 10:27,Kamiander,1,1,1,0,{'2020-10-15 10:27:19': 1},1,0
1228,Wichita KS,DefaultDept,(PL)Painting Ops-Bldg 7 TR Shop Booth EU-AEROPB,CM0830080 - CM0830081 - CM0830H18 - CM0110944 (3:1:3/8:1.5),9/26/2020 0:00,9/26/2020 0:00,0.121875,gal,10/15/2020 10:33,Kamiander,1,1,1,0,{'2020-10-15 10:33:17': 1},1,0
1229,Wichita KS,DefaultDept,(PL)Painting Ops-Bldg 7 TR Shop Booth EU-AEROPB,M06025 - CM0830081 - CM0830991 - CM0110944 (4:2:1:1),6/9/2020 0:00,6/9/2020 0:00,0.125,gal,8/25/2020 10:34,Kamiander,1,1,1,0,{'2020-08-25 10:34:50': 1},1,0
1230,Wichita KS,DefaultDept,(PL)Painting Ops-Bldg 7 TR Shop Booth EU-AEROPB,M06025 - CM0830081 - CM0830991 - CM0110944 (4:2:1:1),6/12/2020 0:00,6/12/2020 0:00,0.125,gal,8/25/2020 10:36,Kamiander,1,1,1,0,{'2020-08-25 10:36:17': 1},1,0
1231,Wichita KS,DefaultDept,(PL)Painting Ops-Bldg 7 TR Shop Booth EU-AEROPB,M06025 - CM0830081 - CM0830991 - CM0110944 (4:2:1:1),6/18/2020 0:00,6/18/2020 0:00,0.125,gal,8/25/2020 10:37,Kamiander,1,1,1,0,{'2020-08-25 10:37:50': 1},1,0
1232,Wichita KS,DefaultDept,(PL)Painting Ops-Bldg 7 TR Shop Booth EU-AEROPB,PG-6-W207-PH-19- SC-10 BLEND (2:1:1),3/5/2020 18:44,3/5/2020 18:44,0.1875,gal,5/13/2020 18:44,adminbomry,1,1,1,0,{'2020-05-13 18:44:37': 1},1,0
1233,Wichita KS,DefaultDept,(PL)Painting Ops-Down Draft Detail Booth (Bld.5D),Blend: 10P30-8 - EC-284 (1:1),12/30/2020 10:00,12/30/2020 10:00,0.1171875,gal,1/5/2021 15:06,dlyon,1,1,1,0,{'2021-01-05 15:06:47': 1},1,0
1234,Wichita KS,DefaultDept,(PL)Painting Ops-Down Draft Detail Booth (Bld.5D),Blend: 10P4-2NF - EC117S (1:1),8/23/2019 8:30,8/23/2019 8:30,0.0234375,gal,9/18/2019 14:09,adminbomgb,1,1,1,0,{'2019-09-18 14:09:30': 1},1,0
1235,Wichita KS,DefaultDept,(PL)Painting Ops-Down Draft Detail Booth (Bld.5D),Blend: 10P4-2NF - EC117S (1:1),1/10/2020 10:15,1/10/2020 10:15,0.046875,gal,4/28/2020 14:10,adminbomjs,1,1,1,0,{'2020-04-28 14:10:17': 1},1,0
1236,Wichita KS,DefaultDept,(PL)Painting Ops-Down Draft Detail Booth (Bld.5D),Blend: 10P4-2NF - EC117S (1:1),7/13/2020 0:00,7/13/2020 0:00,0.03125,gal,8/26/2020 11:30,Kamiander,1,1,1,0,{'2020-08-26 11:30:56': 1},1,0
1237,Wichita KS,DefaultDept,(PL)Painting Ops-Down Draft Detail Booth (Bld.5D),Blend: 10P4-2NF - EC117S (1:1),11/19/2020 8:15,11/19/2020 8:15,0.046875,gal,1/5/2021 14:03,dlyon,1,1,1,0,{'2021-01-05 14:03:06': 1},1,0
1238,Wichita KS,DefaultDept,(PL)Painting Ops-Down Draft Detail Booth (Bld.5D),Blend: 10P4-2NF - EC117S (1:1),11/28/2020 9:30,11/28/2020 9:30,0.125,gal,1/5/2021 14:13,dlyon,1,1,1,0,{'2021-01-05 14:13:16': 1},1,0
1239,Wichita KS,DefaultDept,(PL)Painting Ops-Down Draft Detail Booth (Bld.5D),Blend: 10P4-2NF - EC117S (1:1),11/29/2020 7:00,11/29/2020 7:00,0.125,gal,1/5/2021 14:14,dlyon,1,1,1,0,{'2021-01-05 14:14:56': 1},1,0
1240,Wichita KS,DefaultDept,(PL)Painting Ops-Down Draft Detail Booth (Bld.5D),Blend: 10P8-10NF - EC-283 (1:1),8/13/2019 7:00,8/13/2019 7:00,0.015625,gal,9/18/2019 13:54,adminbomgb,1,1,1,0,{'2019-09-18 13:54:51': 1},1,0
1241,Wichita KS,DefaultDept,(PL)Painting Ops-Down Draft Detail Booth (Bld.5D),Blend: 10P8-10NF - EC-283 (1:1),8/14/2019 2:00,8/14/2019 2:00,0.0234375,gal,9/18/2019 13:57,adminbomgb,1,1,1,0,{'2019-09-18 13:57:12': 1},1,0
1242,Wichita KS,DefaultDept,(PL)Painting Ops-Down Draft Detail Booth (Bld.5D),Blend: 10P8-10NF - EC-283 (1:1),8/20/2019 6:30,8/20/2019 6:30,0.0234375,gal,9/18/2019 13:59,adminbomgb,1,1,1,0,{'2019-09-18 13:59:29': 1},1,0
1243,Wichita KS,DefaultDept,(PL)Painting Ops-Down Draft Detail Booth (Bld.5D),Blend: 10P8-10NF - EC-283 (1:1),9/25/2019 9:30,9/25/2019 9:30,0.03125,gal,10/15/2019 16:03,adminbomgb,1,1,1,0,{'2019-10-15 16:03:10': 1},1,0
1244,Wichita KS,DefaultDept,(PL)Painting Ops-Down Draft Detail Booth (Bld.5D),Blend: 10P8-10NF - EC-283 (1:1),9/30/2019 9:30,9/30/2019 9:30,0.03125,gal,10/15/2019 16:12,adminbomgb,1,1,1,0,{'2019-10-15 16:12:43': 1},1,0
1245,Wichita KS,DefaultDept,(PL)Painting Ops-Down Draft Detail Booth (Bld.5D),Blend: 10P8-10NF - EC-283 (1:1),10/16/2019 12:00,10/16/2019 12:00,0.09375,gal,12/19/2019 16:04,adminbomry,1,1,1,0,{'2019-12-19 16:04:12': 1},1,0
1246,Wichita KS,DefaultDept,(PL)Painting Ops-Down Draft Detail Booth (Bld.5D),Blend: 10P8-10NF - EC-283 (1:1),10/22/2019 12:00,10/22/2019 12:00,0.0625,gal,12/19/2019 16:04,adminbomry,1,1,1,0,{'2019-12-19 16:04:12': 1},1,0
1247,Wichita KS,DefaultDept,(PL)Painting Ops-Down Draft Detail Booth (Bld.5D),Blend: 10P8-10NF - EC-283 (1:1),12/3/2019 7:30,12/3/2019 7:30,0.03125,gal,1/14/2020 8:23,adminbomgb,1,1,1,0,{'2020-01-14 08:23:52': 1},1,0
1248,Wichita KS,DefaultDept,(PL)Painting Ops-Down Draft Detail Booth (Bld.5D),Blend: 10P8-10NF - EC-283 (1:1),12/4/2019 12:00,12/4/2019 12:00,0.03125,gal,1/14/2020 8:26,adminbomgb,1,1,1,0,{'2020-01-14 08:26:41': 1},1,0
1249,Wichita KS,DefaultDept,(PL)Painting Ops-Down Draft Detail Booth (Bld.5D),Blend: 10P8-10NF - EC-283 (1:1),12/13/2019 10:00,12/13/2019 10:00,0.03125,gal,1/14/2020 8:35,adminbomgb,1,1,1,0,{'2020-01-14 08:35:20': 1},1,0
1250,Wichita KS,DefaultDept,(PL)Painting Ops-Down Draft Detail Booth (Bld.5D),Blend: 10P8-10NF - EC-283 (1:1),1/6/2020 8:30,1/6/2020 8:30,0.03125,gal,4/28/2020 13:49,adminbomjs,1,1,1,0,{'2020-04-28 13:49:13': 1},1,0
1251,Wichita KS,DefaultDept,(PL)Painting Ops-Down Draft Detail Booth (Bld.5D),Blend: 10P8-10NF - EC-283 (1:1),1/17/2020 9:15,1/17/2020 9:15,0.046875,gal,4/28/2020 14:21,adminbomjs,1,1,1,0,{'2020-04-28 14:21:12': 1},1,0
1252,Wichita KS,DefaultDept,(PL)Painting Ops-Down Draft Detail Booth (Bld.5D),Blend: 10P8-10NF - EC-283 (1:1),2/6/2020 14:25,2/6/2020 14:25,0.03125,gal,5/7/2020 14:26,adminbomry,1,1,1,0,{'2020-05-07 14:26:04': 1},1,0
1253,Wichita KS,DefaultDept,(PL)Painting Ops-Down Draft Detail Booth (Bld.5D),Blend: 10P8-10NF - EC-283 (1:1),2/10/2020 14:34,2/10/2020 14:34,0.046875,gal,5/7/2020 14:34,adminbomry,1,1,1,0,{'2020-05-07 14:34:34': 1},1,0
1254,Wichita KS,DefaultDept,(PL)Painting Ops-Down Draft Detail Booth (Bld.5D),Blend: 10P8-10NF - EC-283 (1:1),5/12/2020 0:00,5/12/2020 0:00,0.03125,gal,6/18/2020 12:09,Kamiander,1,1,1,0,{'2020-06-18 12:09:49': 1},1,0
1255,Wichita KS,DefaultDept,(PL)Painting Ops-Down Draft Detail Booth (Bld.5D),Blend: 10P8-10NF - EC-283 (1:1),5/20/2020 0:00,5/20/2020 0:00,0.03125,gal,6/18/2020 12:30,Kamiander,1,1,1,0,{'2020-06-18 12:30:27': 1},1,0
1256,Wichita KS,DefaultDept,(PL)Painting Ops-Down Draft Detail Booth (Bld.5D),Blend: 10P8-10NF - EC-283 (1:1),6/11/2020 0:00,6/11/2020 0:00,0.046875,gal,7/27/2020 16:17,Kamiander,1,1,1,0,{'2020-07-27 16:17:37': 1},1,0
1257,Wichita KS,DefaultDept,(PL)Painting Ops-Down Draft Detail Booth (Bld.5D),Blend: 10P8-10NF - EC-283 (1:1),6/17/2020 0:00,6/17/2020 0:00,0.046875,gal,7/27/2020 16:28,Kamiander,1,1,1,0,{'2020-07-27 16:28:30': 1},1,0
1258,Wichita KS,DefaultDept,(PL)Painting Ops-Down Draft Detail Booth (Bld.5D),Blend: 10P8-10NF - EC-283 (1:1),7/9/2020 0:00,7/9/2020 0:00,0.03125,gal,8/26/2020 11:19,Kamiander,1,1,1,0,{'2020-08-26 11:19:29': 1},1,0
1259,Wichita KS,DefaultDept,(PL)Painting Ops-Down Draft Detail Booth (Bld.5D),Blend: 10P8-10NF - EC-283 (1:1),7/13/2020 0:00,7/13/2020 0:00,0.03125,gal,8/26/2020 11:26,Kamiander,1,1,1,0,{'2020-08-26 11:26:56': 1},1,0
1260,Wichita KS,DefaultDept,(PL)Painting Ops-Down Draft Detail Booth (Bld.5D),Blend: 10P8-10NF - EC-283 (1:1),9/2/2020 5:30,9/2/2020 5:30,0.03125,gal,10/27/2020 10:17,dlyon,1,1,1,0,{'2020-10-27 10:17:00': 1},1,0
1261,Wichita KS,DefaultDept,(PL)Painting Ops-Down Draft Detail Booth (Bld.5D),Blend: 10P8-10NF - EC-283 (1:1),9/21/2020 13:45,9/21/2020 13:45,0.03125,gal,1/6/2021 9:26,dlyon,1,1,1,0,{'2021-01-06 09:26:07': 1},1,0
1262,Wichita KS,DefaultDept,(PL)Painting Ops-Down Draft Detail Booth (Bld.5D),Blend: 10P8-10NF - EC-283 (1:1)_old,1/24/2019 10:56,1/24/2019 10:56,0.015625,gal,1/24/2019 10:56,adminbomsn,1,1,1,0,{'2019-01-24 10:56:42': 1},1,0
1263,Wichita KS,DefaultDept,(PL)Painting Ops-Down Draft Detail Booth (Bld.5D),Blend: 10P8-10NF - EC-283 (1:1)_old,1/24/2019 11:52,1/24/2019 11:52,0.03125,gal,1/24/2019 11:52,adminbomcb,1,1,1,0,{'2019-01-24 11:52:46': 1},1,0
1264,Wichita KS,DefaultDept,(PL)Painting Ops-Down Draft Detail Booth (Bld.5D),Blend: 10P8-10NF - EC-283 (1:1)_old,1/24/2019 13:06,1/24/2019 13:06,0.0234375,gal,1/24/2019 13:06,adminbomna,1,1,1,0,{'2019-01-24 13:06:40': 1},1,0
1265,Wichita KS,DefaultDept,(PL)Painting Ops-Down Draft Detail Booth (Bld.5D),Blend: 10P8-10NF - EC-283 (1:1)_old,7/9/2019 12:15,7/9/2019 12:15,0.015625,gal,8/20/2019 15:35,adminbomgb,1,1,1,0,{'2019-08-20 15:35:13': 1},1,0
1266,Wichita KS,DefaultDept,(PL)Painting Ops-Down Draft Detail Booth (Bld.5D),Blend: 10P8-10NF - EC-283 (1:1)_old,7/23/2019 7:30,7/23/2019 7:30,0.0234375,gal,8/20/2019 15:44,adminbomgb,1,1,1,0,{'2019-08-20 15:44:16': 1},1,0
1267,Wichita KS,DefaultDept,(PL)Painting Ops-Down Draft Detail Booth (Bld.5D),Blend: 10P8-10NF - EC-283 (1:1)_old,7/24/2019 16:18,7/24/2019 16:18,0.03125,gal,7/24/2019 16:18,adminbomgb,1,1,1,0,{'2019-07-24 16:18:46': 1},1,0
1268,Wichita KS,DefaultDept,(PL)Painting Ops-Down Draft Detail Booth (Bld.5D),Blend: 10P8-10NF - EC-283 (1:1)_old,7/24/2019 16:51,7/24/2019 16:51,0.015625,gal,7/24/2019 16:51,adminbomgb,1,1,1,0,{'2019-07-24 16:51:59': 1},1,0
1269,Wichita KS,DefaultDept,(PL)Painting Ops-Down Draft Detail Booth (Bld.5D),Blend: 10P8-10NF - EC-283 (1:1)_old,7/25/2019 8:23,7/25/2019 8:23,0.0234375,gal,7/25/2019 8:23,adminbomgb,1,1,1,0,{'2019-07-25 08:23:07': 1},1,0
1270,Wichita KS,DefaultDept,(PL)Painting Ops-Down Draft Detail Booth (Bld.5D),Blend: 10P8-10NF - EC-283 (1:1)_old,7/25/2019 8:30,7/25/2019 8:30,0.015625,gal,7/25/2019 8:30,adminbomgb,1,1,1,0,{'2019-07-25 08:30:30': 1},1,0
1271,Wichita KS,DefaultDept,(PL)Painting Ops-Down Draft Detail Booth (Bld.5D),Blend: 10P8-10NF - EC-283 (1:1)_old,7/25/2019 9:54,7/25/2019 9:54,0.03125,gal,7/25/2019 9:54,adminbomgb,1,1,1,0,{'2019-07-25 09:54:26': 1},1,0
1272,Wichita KS,DefaultDept,(PL)Painting Ops-Down Draft Detail Booth (Bld.5D),Blend: 10P8-10NF - EC-283 (1:1)_old,7/29/2019 10:30,7/29/2019 10:30,0.015625,gal,8/20/2019 15:47,adminbomgb,1,1,1,0,{'2019-08-20 15:47:24': 1},1,0
1273,Wichita KS,DefaultDept,(PL)Painting Ops-Down Draft Detail Booth (Bld.5D),Blend: 10P8-10NF - EC-283 (1:1)_old,10/5/2020 12:45,10/5/2020 12:45,0.03125,gal,1/5/2021 12:43,dlyon,1,1,1,0,{'2021-01-05 12:43:19': 1},1,0
1274,Wichita KS,DefaultDept,(PL)Painting Ops-Down Draft Detail Booth (Bld.5D),Blend: 10P8-10NF - EC-283 (1:1)_old,10/6/2020 12:30,10/6/2020 12:30,0.046875,gal,1/5/2021 12:50,dlyon,1,1,1,0,{'2021-01-05 12:50:46': 1},1,0
1275,Wichita KS,DefaultDept,(PL)Painting Ops-Down Draft Detail Booth (Bld.5D),Blend: 10P8-10NF - EC-283 (1:1)_old,10/20/2020 14:30,10/20/2020 14:30,0.03125,gal,1/5/2021 13:17,dlyon,1,1,1,0,{'2021-01-05 13:17:10': 1},1,0
1276,Wichita KS,DefaultDept,(PL)Painting Ops-Down Draft Detail Booth (Bld.5D),Blend: 10P8-10NF - EC-283 (1:1)_old,11/4/2020 0:00,11/4/2020 0:00,0.03125,gal,1/5/2021 14:27,dlyon,1,1,1,0,{'2021-01-05 14:27:33': 1},1,0
1277,Wichita KS,DefaultDept,(PL)Painting Ops-Down Draft Detail Booth (Bld.5D),Blend: 10P8-10NF - EC-283 (1:1)_old,11/9/2020 9:30,11/9/2020 9:30,0.03125,gal,1/5/2021 13:40,dlyon,1,1,1,0,{'2021-01-05 13:40:15': 1},1,0
1278,Wichita KS,DefaultDept,(PL)Painting Ops-Down Draft Detail Booth (Bld.5D),Blend: 10P8-10NF - EC-283 (1:1)_old,11/19/2020 12:00,11/19/2020 12:00,0.0625,gal,1/5/2021 14:04,dlyon,1,1,1,0,{'2021-01-05 14:04:44': 1},1,0
1279,Wichita KS,DefaultDept,(PL)Painting Ops-Down Draft Detail Booth (Bld.5D),Blend: 10P8-10NF - EC-283 (1:1)_old,12/3/2020 7:30,12/3/2020 7:30,0.03125,gal,1/5/2021 14:24,dlyon,1,1,1,0,{'2021-01-05 14:24:20': 1},1,0
1280,Wichita KS,DefaultDept,(PL)Painting Ops-Down Draft Detail Booth (Bld.5D),Blend: 10P8-10NF - EC-283 (1:1)_old,12/13/2020 10:00,12/13/2020 10:00,0.03125,gal,1/5/2021 14:43,dlyon,1,1,1,0,{'2021-01-05 14:43:38': 1},1,0
1281,Wichita KS,DefaultDept,(PL)Painting Ops-Down Draft Detail Booth (Bld.5D),Blend: 53055GEP - 17036CEH - (3:1),9/9/2020 7:00,9/9/2020 7:00,0.03125,gal,1/6/2021 9:24,dlyon,1,1,1,0,{'2021-01-06 09:24:21': 1},1,0
1282,Wichita KS,DefaultDept,(PL)Painting Ops-Down Draft Detail Booth (Bld.5D),Blend: 53055GEP - 17036CEH - (3:1),10/8/2020 8:45,10/8/2020 8:45,0.03125,gal,1/5/2021 13:02,dlyon,1,1,1,0,{'2021-01-05 13:02:39': 1},1,0
1283,Wichita KS,DefaultDept,(PL)Painting Ops-Down Draft Detail Booth (Bld.5D),Blend: 53055GEP - 17036CEH - (3:1),11/17/2020 12:30,11/17/2020 12:30,0.0625,gal,1/5/2021 13:56,dlyon,1,1,1,0,{'2021-01-05 13:56:19': 1},1,0
1284,Wichita KS,DefaultDept,(PL)Painting Ops-Down Draft Detail Booth (Bld.5D),Blend: Alumigrip 10P30-8 - EC-284 (4:1),1/24/2019 11:57,1/24/2019 11:57,0.0234375,gal,1/24/2019 11:57,adminbomcb,1,1,1,0,{'2019-01-24 11:57:50': 1},1,0
1285,Wichita KS,DefaultDept,(PL)Painting Ops-Down Draft Detail Booth (Bld.5D),Blend: Alumigrip 10P30-8 - EC-284 (4:1),1/24/2019 12:39,1/24/2019 12:39,0.046875,gal,1/24/2019 12:39,adminbomcb,1,1,1,0,{'2019-01-24 12:39:10': 1},1,0
1286,Wichita KS,DefaultDept,(PL)Painting Ops-Down Draft Detail Booth (Bld.5D),Blend: Alumigrip 10P30-8 - EC-284 (4:1),1/24/2019 12:42,1/24/2019 12:42,0.03125,gal,1/24/2019 12:42,adminbomcb,1,1,1,0,{'2019-01-24 12:42:26': 1},1,0
1287,Wichita KS,DefaultDept,(PL)Painting Ops-Down Draft Detail Booth (Bld.5D),Blend: Alumigrip 10P30-8 - EC-284 (4:1),1/24/2019 14:01,1/24/2019 14:01,0.0390625,gal,1/24/2019 14:01,adminbomsn,1,1,1,0,{'2019-01-24 14:01:17': 1},1,0
1288,Wichita KS,DefaultDept,(PL)Painting Ops-Down Draft Detail Booth (Bld.5D),Blend: Alumigrip 10P30-8 - EC-284 (4:1),7/2/2019 7:30,7/2/2019 7:30,0.03125,gal,8/20/2019 15:31,adminbomgb,1,1,1,0,{'2019-08-20 15:31:30': 1},1,0
1289,Wichita KS,DefaultDept,(PL)Painting Ops-Down Draft Detail Booth (Bld.5D),Blend: Alumigrip 10P30-8 - EC-284 (4:1),7/24/2019 15:48,7/24/2019 15:48,0.03125,gal,7/24/2019 15:48,adminbomgb,1,1,1,0,{'2019-07-24 15:48:48': 1},1,0
1290,Wichita KS,DefaultDept,(PL)Painting Ops-Down Draft Detail Booth (Bld.5D),Blend: Alumigrip 10P30-8 - EC-284 (4:1),7/25/2019 8:21,7/25/2019 8:21,0.03125,gal,7/25/2019 8:21,adminbomgb,1,1,1,0,{'2019-07-25 08:21:46': 1},1,0
1291,Wichita KS,DefaultDept,(PL)Painting Ops-Down Draft Detail Booth (Bld.5D),Blend: Alumigrip 10P30-8 - EC-284 (4:1),9/7/2019 6:15,9/7/2019 6:15,0.0390625,gal,10/15/2019 15:15,adminbomgb,1,1,1,0,{'2019-10-15 15:15:32': 1},1,0
1292,Wichita KS,DefaultDept,(PL)Painting Ops-Down Draft Detail Booth (Bld.5D),Blend: Alumigrip 10P30-8 - EC-284 (4:1),9/11/2019 12:30,9/11/2019 12:30,0.0390625,gal,10/15/2019 15:22,adminbomgb,1,1,1,0,{'2019-10-15 15:22:21': 1},1,0
1293,Wichita KS,DefaultDept,(PL)Painting Ops-Down Draft Detail Booth (Bld.5D),Blend: Alumigrip 10P30-8 - EC-284 (4:1),9/30/2019 14:30,9/30/2019 14:30,0.05859375,gal,10/15/2019 16:16,adminbomgb,1,1,1,0,{'2019-10-15 16:16:35': 1},1,0
1294,Wichita KS,DefaultDept,(PL)Painting Ops-Down Draft Detail Booth (Bld.5D),Blend: Alumigrip 10P30-8 - EC-284 (4:1),10/9/2019 12:00,10/9/2019 12:00,0.095703,gal,12/19/2019 16:04,adminbomry,1,1,1,0,{'2019-12-19 16:04:12': 1},1,0
1295,Wichita KS,DefaultDept,(PL)Painting Ops-Down Draft Detail Booth (Bld.5D),Blend: Alumigrip 10P30-8 - EC-284 (4:1),10/22/2019 12:00,10/22/2019 12:00,0.078125,gal,12/19/2019 16:04,adminbomry,1,1,1,0,{'2019-12-19 16:04:12': 1},1,0
1296,Wichita KS,DefaultDept,(PL)Painting Ops-Down Draft Detail Booth (Bld.5D),Blend: Alumigrip 10P30-8 - EC-284 (4:1),10/29/2019 12:00,10/29/2019 12:00,0.097656,gal,12/19/2019 16:04,adminbomry,1,1,1,0,{'2019-12-19 16:04:12': 1},1,0
1297,Wichita KS,DefaultDept,(PL)Painting Ops-Down Draft Detail Booth (Bld.5D),Blend: Alumigrip 10P30-8 - EC-284 (4:1),11/14/2019 11:27,11/14/2019 11:27,0.078125,gal,1/23/2020 12:28,Kamiander,1,1,1,0,{'2020-01-23 12:28:09': 1},1,0
1298,Wichita KS,DefaultDept,(PL)Painting Ops-Down Draft Detail Booth (Bld.5D),Blend: Alumigrip 10P30-8 - EC-284 (4:1),11/20/2019 12:58,11/20/2019 12:58,0.078125,gal,1/27/2020 17:57,adminbomry,1,1,1,0,{'2020-01-27 17:57:48': 1},1,0
1299,Wichita KS,DefaultDept,(PL)Painting Ops-Down Draft Detail Booth (Bld.5D),Blend: Alumigrip 10P30-8 - EC-284 (4:1),12/30/2019 10:00,12/30/2019 10:00,0.1171875,gal,1/14/2020 9:09,adminbomgb,1,1,1,0,{'2020-01-14 09:09:47': 1},1,0
1300,Wichita KS,DefaultDept,(PL)Painting Ops-Down Draft Detail Booth (Bld.5D),Blend: Alumigrip 10P30-8 - EC-284 (4:1),1/7/2020 13:00,1/7/2020 13:00,0.078125,gal,4/28/2020 14:03,adminbomjs,1,1,1,0,{'2020-04-28 14:03:36': 1},1,0
1301,Wichita KS,DefaultDept,(PL)Painting Ops-Down Draft Detail Booth (Bld.5D),Blend: Alumigrip 10P30-8 - EC-284 (4:1),1/27/2020 14:30,1/27/2020 14:30,0.1171875,gal,4/28/2020 14:58,adminbomjs,1,1,1,0,{'2020-04-28 14:58:20': 1},1,0
1302,Wichita KS,DefaultDept,(PL)Painting Ops-Down Draft Detail Booth (Bld.5D),Blend: Alumigrip 10P30-8 - EC-284 (4:1),3/19/2020 0:00,3/19/2020 0:00,0.1171875,gal,5/13/2020 13:53,adminbomry,1,1,1,0,{'2020-05-13 13:53:21': 1},1,0
1303,Wichita KS,DefaultDept,(PL)Painting Ops-Down Draft Detail Booth (Bld.5D),Blend: Alumigrip 10P30-8 - EC-284 (4:1),5/16/2020 0:00,5/16/2020 0:00,0.078125,gal,6/18/2020 12:19,Kamiander,1,1,1,0,{'2020-06-18 12:19:20': 1},1,0
1304,Wichita KS,DefaultDept,(PL)Painting Ops-Down Draft Detail Booth (Bld.5D),Blend: Alumigrip 10P30-8 - EC-284 (4:1),5/28/2020 0:00,5/28/2020 0:00,0.078125,gal,6/19/2020 8:57,Kamiander,1,1,1,0,{'2020-06-19 08:57:29': 1},1,0
1305,Wichita KS,DefaultDept,(PL)Painting Ops-Down Draft Detail Booth (Bld.5D),Blend: Alumigrip 10P30-8 - EC-284 (4:1),6/5/2020 0:00,6/5/2020 0:00,0.1171875,gal,7/27/2020 16:12,Kamiander,1,1,1,0,{'2020-07-27 16:12:20': 1},1,0
1306,Wichita KS,DefaultDept,(PL)Painting Ops-Down Draft Detail Booth (Bld.5D),Blend: Alumigrip 10P30-8 - EC-284 (4:1),7/15/2020 0:00,7/15/2020 0:00,0.078125,gal,8/26/2020 11:48,Kamiander,1,1,1,0,{'2020-08-26 11:48:32': 1},1,0
1307,Wichita KS,DefaultDept,(PL)Painting Ops-Down Draft Detail Booth (Bld.5D),Blend: Alumigrip 10P30-8 - EC-284 (4:1),7/22/2020 0:00,7/22/2020 0:00,0.05859375,gal,8/26/2020 12:04,Kamiander,1,1,1,0,{'2020-08-26 12:04:44': 1},1,0
1308,Wichita KS,DefaultDept,(PL)Painting Ops-Down Draft Detail Booth (Bld.5D),Blend: Alumigrip 10P30-8 - EC-284 (4:1),8/15/2020 0:00,8/15/2020 0:00,0.078125,gal,9/24/2020 10:29,Kamiander,1,1,1,0,{'2020-09-24 10:29:45': 1},1,0
1309,Wichita KS,DefaultDept,(PL)Painting Ops-Down Draft Detail Booth (Bld.5D),Blend: Alumigrip 10P30-8 - EC-284 (4:1),8/20/2020 0:00,8/20/2020 0:00,0.078125,gal,9/24/2020 10:39,Kamiander,1,1,1,0,{'2020-09-24 10:39:16': 1},1,0
1310,Wichita KS,DefaultDept,(PL)Painting Ops-Down Draft Detail Booth (Bld.5D),Blend: Alumigrip 10P30-8 - EC-284 (4:1),9/10/2020 7:30,9/10/2020 7:30,0.078125,gal,10/27/2020 10:44,dlyon,1,1,1,0,{'2020-10-27 10:44:09': 1},1,0
1311,Wichita KS,DefaultDept,(PL)Painting Ops-Down Draft Detail Booth (Bld.5D),Blend: Alumigrip 10P30-8 - EC-284 (4:1),9/16/2020 13:45,9/16/2020 13:45,0.078125,gal,10/27/2020 11:10,dlyon,1,1,1,0,{'2020-10-27 11:10:09': 1},1,0
1312,Wichita KS,DefaultDept,(PL)Painting Ops-Down Draft Detail Booth (Bld.5D),Blend: Alumigrip 10P30-8 - EC-284 (4:1),9/18/2020 9:15,9/18/2020 9:15,0.0390625,gal,10/27/2020 11:21,dlyon,1,1,1,0,{'2020-10-27 11:21:44': 1},1,0
1313,Wichita KS,DefaultDept,(PL)Painting Ops-Down Draft Detail Booth (Bld.5D),Blend: Alumigrip 10P30-8 - EC-284 (4:1),9/23/2020 20:00,9/23/2020 20:00,0.078125,gal,10/27/2020 14:36,dlyon,1,1,1,0,{'2020-10-27 14:36:21': 1},1,0
1314,Wichita KS,DefaultDept,(PL)Painting Ops-Down Draft Detail Booth (Bld.5D),Blend: Alumigrip 10P30-8 - EC-284 (4:1),11/2/2020 7:00,11/2/2020 7:00,0.078125,gal,1/5/2021 13:36,dlyon,1,1,1,0,{'2021-01-05 13:36:39': 1},1,0
1315,Wichita KS,DefaultDept,(PL)Painting Ops-Down Draft Detail Booth (Bld.5D),Blend: Alumigrip 10P30-8 - EC-284 (4:1),11/27/2020 6:45,11/27/2020 6:45,0.078125,gal,1/5/2021 14:09,dlyon,1,1,1,0,{'2021-01-05 14:09:55': 1},1,0
1316,Wichita KS,DefaultDept,(PL)Painting Ops-Down Draft Detail Booth (Bld.5D),Blend: CA7870 - CA8200B (3:1),7/25/2019 11:14,7/25/2019 11:14,0.0234375,gal,7/25/2019 11:14,adminbomgb,1,1,1,0,{'2019-07-25 11:14:55': 1},1,0
1317,Wichita KS,DefaultDept,(PL)Painting Ops-Down Draft Detail Booth (Bld.5D),Blend: CA8211 F37038 - CA8200B (3:1),7/10/2019 6:00,7/10/2019 6:00,0.0234375,gal,8/20/2019 15:36,adminbomgb,1,1,1,0,{'2019-08-20 15:36:50': 1},1,0
1318,Wichita KS,DefaultDept,(PL)Painting Ops-Down Draft Detail Booth (Bld.5D),Blend: CA8211 F37038 - CA8200B (3:1),7/24/2019 16:08,7/24/2019 16:08,0.0234375,gal,7/24/2019 16:08,adminbomgb,1,1,1,0,{'2019-07-24 16:08:10': 1},1,0
1319,Wichita KS,DefaultDept,(PL)Painting Ops-Down Draft Detail Booth (Bld.5D),Blend: CA8211 F37038 - CA8200B (3:1),7/25/2019 8:19,7/25/2019 8:19,0.0234375,gal,7/25/2019 8:19,adminbomgb,1,1,1,0,{'2019-07-25 08:19:16': 1},1,0
1320,Wichita KS,DefaultDept,(PL)Painting Ops-Down Draft Detail Booth (Bld.5D),Blend: CA8211 F37038 - CA8200B (3:1),7/25/2019 9:35,7/25/2019 9:35,0.046875,gal,7/25/2019 9:35,adminbomgb,1,1,1,0,{'2019-07-25 09:35:02': 1},1,0
1321,Wichita KS,DefaultDept,(PL)Painting Ops-Down Draft Detail Booth (Bld.5D),Blend: CA8211 F37038 - CA8200B (3:1),7/29/2019 12:00,7/29/2019 12:00,0.0234375,gal,8/20/2019 15:48,adminbomgb,1,1,1,0,{'2019-08-20 15:48:37': 1},1,0
1322,Wichita KS,DefaultDept,(PL)Painting Ops-Down Draft Detail Booth (Bld.5D),Blend: CA8211 F37038 - CA8200B (3:1),8/12/2019 12:30,8/12/2019 12:30,0.0234375,gal,9/18/2019 13:53,adminbomgb,1,1,1,0,{'2019-09-18 13:53:22': 1},1,0
1323,Wichita KS,DefaultDept,(PL)Painting Ops-Down Draft Detail Booth (Bld.5D),Blend: CA8211 F37038 - CA8200B (3:1),8/20/2019 8:30,8/20/2019 8:30,0.0234375,gal,9/18/2019 14:02,adminbomgb,1,1,1,0,{'2019-09-18 14:02:50': 1},1,0
1324,Wichita KS,DefaultDept,(PL)Painting Ops-Down Draft Detail Booth (Bld.5D),Blend: CA8211 F37038 - CA8200B (3:1),9/6/2019 6:30,9/6/2019 6:30,0.03125,gal,10/15/2019 15:10,adminbomgb,1,1,1,0,{'2019-10-15 15:10:25': 1},1,0
1325,Wichita KS,DefaultDept,(PL)Painting Ops-Down Draft Detail Booth (Bld.5D),Blend: CA8211 F37038 - CA8200B (3:1),9/26/2019 7:45,9/26/2019 7:45,0.041640625,gal,10/15/2019 16:09,adminbomgb,1,1,1,0,{'2019-10-15 16:09:01': 1},1,0
1326,Wichita KS,DefaultDept,(PL)Painting Ops-Down Draft Detail Booth (Bld.5D),Blend: CA8211 F37038 - CA8200B (3:1),9/30/2019 13:00,9/30/2019 13:00,0.041640625,gal,10/15/2019 16:15,adminbomgb,1,1,1,0,{'2019-10-15 16:15:21': 1},1,0
1327,Wichita KS,DefaultDept,(PL)Painting Ops-Down Draft Detail Booth (Bld.5D),Blend: CA8211 F37038 - CA8200B (3:1),10/16/2019 12:00,10/16/2019 12:00,0.020781,gal,12/19/2019 16:04,adminbomry,1,1,1,0,{'2019-12-19 16:04:12': 1},1,0
1328,Wichita KS,DefaultDept,(PL)Painting Ops-Down Draft Detail Booth (Bld.5D),Blend: CA8211 F37038 - CA8200B (3:1),10/23/2019 12:00,10/23/2019 12:00,0.082813,gal,12/19/2019 16:04,adminbomry,1,1,1,0,{'2019-12-19 16:04:12': 1},1,0
1329,Wichita KS,DefaultDept,(PL)Painting Ops-Down Draft Detail Booth (Bld.5D),Blend: CA8211 F37038 - CA8200B (3:1),11/18/2019 12:56,11/18/2019 12:56,0.0625,gal,1/27/2020 17:57,adminbomry,1,1,1,0,{'2020-01-27 17:57:13': 1},1,0
1330,Wichita KS,DefaultDept,(PL)Painting Ops-Down Draft Detail Booth (Bld.5D),Blend: CA8211 F37038 - CA8200B (3:1),12/4/2019 13:00,12/4/2019 13:00,0.03125,gal,1/14/2020 8:27,adminbomgb,1,1,1,0,{'2020-01-14 08:27:59': 1},1,0
1331,Wichita KS,DefaultDept,(PL)Painting Ops-Down Draft Detail Booth (Bld.5D),Blend: CA8211 F37038 - CA8200B (3:1),12/29/2019 6:00,12/29/2019 6:00,0.03125,gal,1/14/2020 9:03,adminbomgb,1,1,1,0,{'2020-01-14 09:03:25': 1},1,0
1332,Wichita KS,DefaultDept,(PL)Painting Ops-Down Draft Detail Booth (Bld.5D),Blend: CA8211 F37038 - CA8200B (3:1),1/2/2020 9:15,1/2/2020 9:15,0.0625,gal,4/28/2020 13:43,adminbomjs,1,1,1,0,{'2020-04-28 13:43:39': 1},1,0
1333,Wichita KS,DefaultDept,(PL)Painting Ops-Down Draft Detail Booth (Bld.5D),Blend: CA8211 F37038 - CA8200B (3:1),1/6/2020 10:00,1/6/2020 10:00,0.03125,gal,4/28/2020 13:52,adminbomjs,1,1,1,0,{'2020-04-28 13:52:20': 1},1,0
1334,Wichita KS,DefaultDept,(PL)Painting Ops-Down Draft Detail Booth (Bld.5D),Blend: CA8211 F37038 - CA8200B (3:1),1/25/2020 6:30,1/25/2020 6:30,0.03125,gal,4/28/2020 14:52,adminbomjs,1,1,1,0,{'2020-04-28 14:52:47': 1},1,0
1335,Wichita KS,DefaultDept,(PL)Painting Ops-Down Draft Detail Booth (Bld.5D),Blend: CA8211 F37038 - CA8200B (3:1),1/30/2020 12:00,1/30/2020 12:00,0.0625,gal,4/28/2020 15:09,adminbomjs,1,1,1,0,{'2020-04-28 15:09:32': 1},1,0
1336,Wichita KS,DefaultDept,(PL)Painting Ops-Down Draft Detail Booth (Bld.5D),Blend: CA8211 F37038 - CA8200B (3:1),2/6/2020 14:30,2/6/2020 14:30,0.03125,gal,5/7/2020 14:31,adminbomry,1,1,1,0,{'2020-05-07 14:31:24': 1},1,0
1337,Wichita KS,DefaultDept,(PL)Painting Ops-Down Draft Detail Booth (Bld.5D),Blend: CA8211 F37038 - CA8200B (3:1),3/17/2020 20:04,3/17/2020 20:04,0.03125,gal,5/13/2020 13:35,adminbomry,1,1,1,0,{'2020-05-13 13:35:35': 1},1,0
1338,Wichita KS,DefaultDept,(PL)Painting Ops-Down Draft Detail Booth (Bld.5D),Blend: CA8211 F37038 - CA8200B (3:1),3/23/2020 13:56,3/23/2020 13:56,0.0625,gal,5/13/2020 13:57,adminbomry,1,1,1,0,{'2020-05-13 13:57:19': 1},1,0
1339,Wichita KS,DefaultDept,(PL)Painting Ops-Down Draft Detail Booth (Bld.5D),Blend: CA8211 F37038 - CA8200B (3:1),5/12/2020 0:00,5/12/2020 0:00,0.03125,gal,6/18/2020 12:12,Kamiander,1,1,1,0,{'2020-06-18 12:12:13': 1},1,0
1340,Wichita KS,DefaultDept,(PL)Painting Ops-Down Draft Detail Booth (Bld.5D),Blend: CA8211 F37038 - CA8200B (3:1),6/2/2020 0:00,6/2/2020 0:00,0.0625,gal,7/27/2020 16:10,Kamiander,1,1,1,0,{'2020-07-27 16:10:38': 1},1,0
1341,Wichita KS,DefaultDept,(PL)Painting Ops-Down Draft Detail Booth (Bld.5D),Blend: CA8211 F37038 - CA8200B (3:1),6/11/2020 0:00,6/11/2020 0:00,0.03125,gal,7/27/2020 16:19,Kamiander,1,1,1,0,{'2020-07-27 16:19:09': 1},1,0
1342,Wichita KS,DefaultDept,(PL)Painting Ops-Down Draft Detail Booth (Bld.5D),Blend: CA8211 F37038 - CA8200B (3:1),6/12/2020 0:00,6/12/2020 0:00,0.03125,gal,7/27/2020 16:20,Kamiander,1,1,1,0,{'2020-07-27 16:20:36': 1},1,0
1343,Wichita KS,DefaultDept,(PL)Painting Ops-Down Draft Detail Booth (Bld.5D),Blend: CA8211 F37038 - CA8200B (3:1),6/23/2020 0:00,6/23/2020 0:00,0.03125,gal,7/27/2020 16:35,Kamiander,1,1,1,0,{'2020-07-27 16:35:08': 1},1,0
1344,Wichita KS,DefaultDept,(PL)Painting Ops-Down Draft Detail Booth (Bld.5D),Blend: CA8211 F37038 - CA8200B (3:1),7/1/2020 0:00,7/1/2020 0:00,0.03125,gal,8/26/2020 11:09,Kamiander,1,1,1,0,{'2020-08-26 11:09:43': 1},1,0
1345,Wichita KS,DefaultDept,(PL)Painting Ops-Down Draft Detail Booth (Bld.5D),Blend: CA8211 F37038 - CA8200B (3:1),7/13/2020 0:00,7/13/2020 0:00,0.03125,gal,8/26/2020 11:28,Kamiander,1,1,1,0,{'2020-08-26 11:28:54': 1},1,0
1346,Wichita KS,DefaultDept,(PL)Painting Ops-Down Draft Detail Booth (Bld.5D),Blend: CA8211 F37038 - CA8200B (3:1),8/11/2020 0:00,8/11/2020 0:00,0.03125,gal,9/24/2020 10:13,Kamiander,1,1,1,0,{'2020-09-24 10:13:43': 1},1,0
1347,Wichita KS,DefaultDept,(PL)Painting Ops-Down Draft Detail Booth (Bld.5D),Blend: CA8211 F37038 - CA8200B (3:1),8/13/2020 0:00,8/13/2020 0:00,0.0625,gal,9/24/2020 10:21,Kamiander,1,1,1,0,{'2020-09-24 10:21:32': 1},1,0
1348,Wichita KS,DefaultDept,(PL)Painting Ops-Down Draft Detail Booth (Bld.5D),Blend: CA8211 F37038 - CA8200B (3:1),8/17/2020 0:00,8/17/2020 0:00,0.03125,gal,9/24/2020 10:36,Kamiander,1,1,1,0,{'2020-09-24 10:36:19': 1},1,0
1349,Wichita KS,DefaultDept,(PL)Painting Ops-Down Draft Detail Booth (Bld.5D),Blend: CA8211 F37038 - CA8200B (3:1),9/15/2020 7:00,9/15/2020 7:00,0.03125,gal,10/27/2020 11:08,dlyon,1,1,1,0,{'2020-10-27 11:08:26': 1},1,0
1350,Wichita KS,DefaultDept,(PL)Painting Ops-Down Draft Detail Booth (Bld.5D),Blend: CA8211 F37038 - CA8200B (3:1),9/17/2020 10:00,9/17/2020 10:00,0.03125,gal,10/27/2020 11:14,dlyon,1,1,1,0,{'2020-10-27 11:14:40': 1},1,0
1351,Wichita KS,DefaultDept,(PL)Painting Ops-Down Draft Detail Booth (Bld.5D),Blend: CA8211 F37038 - CA8200B (3:1),9/21/2020 10:15,9/21/2020 10:15,0.0625,gal,10/27/2020 14:29,dlyon,1,1,1,0,{'2020-10-27 14:29:29': 1},1,0
1352,Wichita KS,DefaultDept,(PL)Painting Ops-Down Draft Detail Booth (Bld.5D),Blend: CA8211 F37038 - CA8200B (3:1),9/22/2020 19:30,9/22/2020 19:30,0.03125,gal,10/27/2020 14:34,dlyon,1,1,1,0,{'2020-10-27 14:34:30': 1},1,0
1353,Wichita KS,DefaultDept,(PL)Painting Ops-Down Draft Detail Booth (Bld.5D),Blend: CA8211 F37038 - CA8200B (3:1),10/20/2020 9:30,10/20/2020 9:30,0.0625,gal,1/5/2021 13:15,dlyon,1,1,1,0,{'2021-01-05 13:15:19': 1},1,0
1354,Wichita KS,DefaultDept,(PL)Painting Ops-Down Draft Detail Booth (Bld.5D),Blend: CA8211 F37038 - CA8200B (3:1),10/21/2020 8:00,10/21/2020 8:00,0.03125,gal,1/5/2021 13:27,dlyon,1,1,1,0,{'2021-01-05 13:27:44': 1},1,0
1355,Wichita KS,DefaultDept,(PL)Painting Ops-Down Draft Detail Booth (Bld.5D),Blend: CA8211 F37038 - CA8200B (3:1),10/22/2020 6:00,10/22/2020 6:00,0.03125,gal,1/5/2021 13:30,dlyon,1,1,1,0,{'2021-01-05 13:30:40': 1},1,0
1356,Wichita KS,DefaultDept,(PL)Painting Ops-Down Draft Detail Booth (Bld.5D),Blend: CA8211 F37038 - CA8200B (3:1),11/17/2020 8:00,11/17/2020 8:00,0.0625,gal,1/5/2021 13:54,dlyon,1,1,1,0,{'2021-01-05 13:54:44': 1},1,0
1357,Wichita KS,DefaultDept,(PL)Painting Ops-Down Draft Detail Booth (Bld.5D),Blend: CA8211 F37038 - CA8200B (3:1),11/18/2020 9:30,11/18/2020 9:30,0.03125,gal,1/5/2021 13:57,dlyon,1,1,1,0,{'2021-01-05 13:57:54': 1},1,0
1358,Wichita KS,DefaultDept,(PL)Painting Ops-Down Draft Detail Booth (Bld.5D),Blend: CA8211 F37038 - CA8200B (3:1),12/4/2020 13:00,12/4/2020 13:00,0.03125,gal,1/5/2021 14:30,dlyon,1,1,1,0,{'2021-01-05 14:30:08': 1},1,0
1359,Wichita KS,DefaultDept,(PL)Painting Ops-Down Draft Detail Booth (Bld.5D),Blend: CA8211 F37038 - CA8200B (3:1),12/29/2020 6:00,12/29/2020 6:00,0.03125,gal,1/5/2021 15:00,dlyon,1,1,1,0,{'2021-01-05 15:00:33': 1},1,0
1360,Wichita KS,DefaultDept,(PL)Painting Ops-Down Draft Detail Booth (Bld.5D),Blend: CA8211 I1355 - CA8200B (3:1),7/24/2019 16:13,7/24/2019 16:13,0.0234375,gal,7/24/2019 16:13,adminbomgb,1,1,1,0,{'2019-07-24 16:13:52': 1},1,0
1361,Wichita KS,DefaultDept,(PL)Painting Ops-Down Draft Detail Booth (Bld.5D),Blend: CA8211 I1355 - CA8200B (3:1),7/25/2019 9:17,7/25/2019 9:17,0.0234375,gal,7/25/2019 9:17,adminbomgb,1,1,1,0,{'2019-07-25 09:17:10': 1},1,0
1362,Wichita KS,DefaultDept,(PL)Painting Ops-Down Draft Detail Booth (Bld.5D),Blend: CA8211 I1355 - CA8200B (3:1),7/25/2019 9:20,7/25/2019 9:20,0.046875,gal,7/25/2019 9:20,adminbomgb,1,1,1,0,{'2019-07-25 09:20:17': 1},1,0
1363,Wichita KS,DefaultDept,(PL)Painting Ops-Down Draft Detail Booth (Bld.5D),Blend: CA8223 F27038 - CA8200B (3:1),7/24/2019 16:05,7/24/2019 16:05,0.0234375,gal,7/24/2019 16:05,adminbomgb,1,1,1,0,{'2019-07-24 16:05:36': 1},1,0
1364,Wichita KS,DefaultDept,(PL)Painting Ops-Down Draft Detail Booth (Bld.5D),Blend: CA8223 F27038 - CA8200B (3:1),7/24/2019 16:46,7/24/2019 16:46,0.046875,gal,7/24/2019 16:46,adminbomgb,1,1,1,0,{'2019-07-24 16:46:45': 1},1,0
1365,Wichita KS,DefaultDept,(PL)Painting Ops-Down Draft Detail Booth (Bld.5D),Blend: CA8223 F27038 - CA8200B (3:1),7/25/2019 8:43,7/25/2019 8:43,0.046875,gal,7/25/2019 8:43,adminbomgb,1,1,1,0,{'2019-07-25 08:43:20': 1},1,0
1366,Wichita KS,DefaultDept,(PL)Painting Ops-Down Draft Detail Booth (Bld.5D),Blend: CA8223 F27038 - CA8200B (3:1),8/3/2019 7:30,8/3/2019 7:30,0.0234375,gal,9/18/2019 13:49,adminbomgb,1,1,1,0,{'2019-09-18 13:49:03': 1},1,0
1367,Wichita KS,DefaultDept,(PL)Painting Ops-Down Draft Detail Booth (Bld.5D),Blend: CA8223 F27038 - CA8200B (3:1),8/9/2019 6:30,8/9/2019 6:30,0.0234375,gal,9/18/2019 13:50,adminbomgb,1,1,1,0,{'2019-09-18 13:50:31': 1},1,0
1368,Wichita KS,DefaultDept,(PL)Painting Ops-Down Draft Detail Booth (Bld.5D),Blend: CA8223 F27038 - CA8200B (3:1),9/17/2019 8:30,9/17/2019 8:30,0.0625,gal,10/15/2019 15:50,adminbomgb,1,1,1,0,{'2019-10-15 15:50:15': 1},1,0
1369,Wichita KS,DefaultDept,(PL)Painting Ops-Down Draft Detail Booth (Bld.5D),Blend: CA8223 F27038 - CA8200B (3:1),10/7/2019 12:00,10/7/2019 12:00,0.0625,gal,12/19/2019 16:04,adminbomry,1,1,1,0,{'2019-12-19 16:04:12': 1},1,0
1370,Wichita KS,DefaultDept,(PL)Painting Ops-Down Draft Detail Booth (Bld.5D),Blend: CA8223 F27038 - CA8200B (3:1),11/7/2019 11:23,11/7/2019 11:23,0.0625,gal,1/27/2020 17:55,adminbomry,1,1,1,0,{'2020-01-27 17:55:31': 1},1,0
1371,Wichita KS,DefaultDept,(PL)Painting Ops-Down Draft Detail Booth (Bld.5D),Blend: CA8223 F27038 - CA8200B (3:1),11/21/2019 13:02,11/21/2019 13:02,0.0625,gal,1/27/2020 17:58,adminbomry,1,1,1,0,{'2020-01-27 17:58:21': 1},1,0
1372,Wichita KS,DefaultDept,(PL)Painting Ops-Down Draft Detail Booth (Bld.5D),Blend: CA8223 F27038 - CA8200B (3:1),12/9/2019 9:15,12/9/2019 9:15,0.0625,gal,1/14/2020 8:30,adminbomgb,1,1,1,0,{'2020-01-14 08:30:22': 1},1,0
1373,Wichita KS,DefaultDept,(PL)Painting Ops-Down Draft Detail Booth (Bld.5D),Blend: CA8223 F27038 - CA8200B (3:1),12/10/2019 6:00,12/10/2019 6:00,0.0625,gal,1/14/2020 8:31,adminbomgb,1,1,1,0,{'2020-01-14 08:31:36': 1},1,0
1374,Wichita KS,DefaultDept,(PL)Painting Ops-Down Draft Detail Booth (Bld.5D),Blend: CA8223 F27038 - CA8200B (3:1),1/9/2020 14:30,1/9/2020 14:30,0.0625,gal,4/28/2020 14:06,adminbomjs,1,1,1,0,{'2020-04-28 14:06:55': 1},1,0
1375,Wichita KS,DefaultDept,(PL)Painting Ops-Down Draft Detail Booth (Bld.5D),Blend: CA8223 F27038 - CA8200B (3:1),1/20/2020 9:15,1/20/2020 9:15,0.0625,gal,4/28/2020 14:27,adminbomjs,1,1,1,0,{'2020-04-28 14:27:13': 1},1,0
1376,Wichita KS,DefaultDept,(PL)Painting Ops-Down Draft Detail Booth (Bld.5D),Blend: CA8223 F27038 - CA8200B (3:1),2/7/2020 14:33,2/7/2020 14:33,0.0625,gal,5/7/2020 14:33,adminbomry,1,1,1,0,{'2020-05-07 14:33:27': 1},1,0
1377,Wichita KS,DefaultDept,(PL)Painting Ops-Down Draft Detail Booth (Bld.5D),Blend: CA8223 F27038 - CA8200B (3:1),3/15/2020 19:56,3/15/2020 19:56,0.0625,gal,5/13/2020 13:34,adminbomry,1,1,1,0,{'2020-05-13 13:34:30': 1},1,0
1378,Wichita KS,DefaultDept,(PL)Painting Ops-Down Draft Detail Booth (Bld.5D),Blend: CA8223 F27038 - CA8200B (3:1),5/18/2020 0:00,5/18/2020 0:00,0.0625,gal,6/18/2020 12:24,Kamiander,1,1,1,0,{'2020-06-18 12:24:06': 1},1,0
1379,Wichita KS,DefaultDept,(PL)Painting Ops-Down Draft Detail Booth (Bld.5D),Blend: CA8223 F27038 - CA8200B (3:1),6/18/2020 0:00,6/18/2020 0:00,0.0625,gal,7/27/2020 16:31,Kamiander,1,1,1,0,{'2020-07-27 16:31:40': 1},1,0
1380,Wichita KS,DefaultDept,(PL)Painting Ops-Down Draft Detail Booth (Bld.5D),Blend: CA8223 F27038 - CA8200B (3:1),7/16/2020 0:00,7/16/2020 0:00,0.0625,gal,8/26/2020 11:52,Kamiander,1,1,1,0,{'2020-08-26 11:52:31': 1},1,0
1381,Wichita KS,DefaultDept,(PL)Painting Ops-Down Draft Detail Booth (Bld.5D),Blend: CA8223 F27038 - CA8200B (3:1),8/17/2020 0:00,8/17/2020 0:00,0.0625,gal,9/24/2020 10:33,Kamiander,1,1,1,0,{'2020-09-24 10:33:26': 1},1,0
1382,Wichita KS,DefaultDept,(PL)Painting Ops-Down Draft Detail Booth (Bld.5D),Blend: CA8223 F27038 - CA8200B (3:1),9/24/2020 9:30,9/24/2020 9:30,0.0625,gal,10/27/2020 14:40,dlyon,1,1,1,0,{'2020-10-27 14:40:38': 1},1,0
1383,Wichita KS,DefaultDept,(PL)Painting Ops-Down Draft Detail Booth (Bld.5D),Blend: CA8223 F27038 - CA8200B (3:1),12/9/2020 9:15,12/9/2020 9:15,0.0625,gal,1/5/2021 14:38,dlyon,1,1,1,0,{'2021-01-05 14:38:49': 1},1,0
1384,Wichita KS,DefaultDept,(PL)Painting Ops-Down Draft Detail Booth (Bld.5D),Blend: CA8223 F27038 - CA8200B (3:1),12/10/2020 6:00,12/10/2020 6:00,0.0625,gal,1/5/2021 14:40,dlyon,1,1,1,0,{'2021-01-05 14:40:12': 1},1,0
1385,Wichita KS,DefaultDept,(PL)Painting Ops-Down Draft Detail Booth (Bld.5D),Blend: CA8273 F36118 - CA8200B (3:1),7/2/2019 13:00,7/2/2019 13:00,0.0234375,gal,8/20/2019 15:33,adminbomgb,1,1,1,0,{'2019-08-20 15:33:33': 1},1,0
1386,Wichita KS,DefaultDept,(PL)Painting Ops-Down Draft Detail Booth (Bld.5D),Blend: CA8273 F36118 - CA8200B (3:1),7/24/2019 16:04,7/24/2019 16:04,0.0234375,gal,7/24/2019 16:04,adminbomgb,1,1,1,0,{'2019-07-24 16:04:06': 1},1,0
1387,Wichita KS,DefaultDept,(PL)Painting Ops-Down Draft Detail Booth (Bld.5D),Blend: CA8273 F36118 - CA8200B (3:1),7/25/2019 8:25,7/25/2019 8:25,0.046875,gal,7/25/2019 8:25,adminbomgb,1,1,1,0,{'2019-07-25 08:25:58': 1},1,0
1388,Wichita KS,DefaultDept,(PL)Painting Ops-Down Draft Detail Booth (Bld.5D),Blend: CA8273 F36118 - CA8200B (3:1),7/25/2019 8:41,7/25/2019 8:41,0.0234375,gal,7/25/2019 8:41,adminbomgb,1,1,1,0,{'2019-07-25 08:41:07': 1},1,0
1389,Wichita KS,DefaultDept,(PL)Painting Ops-Down Draft Detail Booth (Bld.5D),Blend: CA8273 F36118 - CA8200B (3:1),8/22/2019 5:30,8/22/2019 5:30,0.0234375,gal,9/18/2019 14:06,adminbomgb,1,1,1,0,{'2019-09-18 14:06:05': 1},1,0
1390,Wichita KS,DefaultDept,(PL)Painting Ops-Down Draft Detail Booth (Bld.5D),Blend: CA8273 F36118 - CA8200B (3:1),8/24/2019 8:00,8/24/2019 8:00,0.0234375,gal,9/18/2019 14:10,adminbomgb,1,1,1,0,{'2019-09-18 14:10:57': 1},1,0
1391,Wichita KS,DefaultDept,(PL)Painting Ops-Down Draft Detail Booth (Bld.5D),Blend: CA8273 F36118 - CA8200B (3:1),8/26/2019 2:00,8/26/2019 2:00,0.0234375,gal,9/18/2019 14:13,adminbomgb,1,1,1,0,{'2019-09-18 14:13:08': 1},1,0
1392,Wichita KS,DefaultDept,(PL)Painting Ops-Down Draft Detail Booth (Bld.5D),Blend: CA8273 F36118 - CA8200B (3:1),9/7/2019 10:00,9/7/2019 10:00,0.03125,gal,10/15/2019 15:16,adminbomgb,1,1,1,0,{'2019-10-15 15:16:45': 1},1,0
1393,Wichita KS,DefaultDept,(PL)Painting Ops-Down Draft Detail Booth (Bld.5D),Blend: CA8273 F36118 - CA8200B (3:1),9/12/2019 7:30,9/12/2019 7:30,0.0546875,gal,10/15/2019 15:23,adminbomgb,1,1,1,0,{'2019-10-15 15:23:39': 1},1,0
1394,Wichita KS,DefaultDept,(PL)Painting Ops-Down Draft Detail Booth (Bld.5D),Blend: CA8273 F36118 - CA8200B (3:1),10/7/2019 12:00,10/7/2019 12:00,0.0625,gal,12/19/2019 16:04,adminbomry,1,1,1,0,{'2019-12-19 16:04:12': 1},1,0
1395,Wichita KS,DefaultDept,(PL)Painting Ops-Down Draft Detail Booth (Bld.5D),Blend: CA8273 F36118 - CA8200B (3:1),10/9/2019 12:00,10/9/2019 12:00,0.0625,gal,12/19/2019 16:04,adminbomry,1,1,1,0,{'2019-12-19 16:04:12': 1},1,0
1396,Wichita KS,DefaultDept,(PL)Painting Ops-Down Draft Detail Booth (Bld.5D),Blend: CA8273 F36118 - CA8200B (3:1),10/22/2019 12:00,10/22/2019 12:00,0.0625,gal,12/19/2019 16:04,adminbomry,1,1,1,0,{'2019-12-19 16:04:12': 1},1,0
1397,Wichita KS,DefaultDept,(PL)Painting Ops-Down Draft Detail Booth (Bld.5D),Blend: CA8273 F36118 - CA8200B (3:1),10/30/2019 12:00,10/30/2019 12:00,0.0625,gal,12/19/2019 16:04,adminbomry,1,1,1,0,{'2019-12-19 16:04:12': 1},1,0
1398,Wichita KS,DefaultDept,(PL)Painting Ops-Down Draft Detail Booth (Bld.5D),Blend: CA8273 F36118 - CA8200B (3:1),11/14/2019 12:52,11/14/2019 12:52,0.0625,gal,1/27/2020 17:56,adminbomry,1,1,1,0,{'2020-01-27 17:56:08': 1},1,0
1399,Wichita KS,DefaultDept,(PL)Painting Ops-Down Draft Detail Booth (Bld.5D),Blend: CA8273 F36118 - CA8200B (3:1),11/23/2019 13:05,11/23/2019 13:05,0.0625,gal,1/27/2020 17:59,adminbomry,1,1,1,0,{'2020-01-27 17:59:26': 1},1,0
1400,Wichita KS,DefaultDept,(PL)Painting Ops-Down Draft Detail Booth (Bld.5D),Blend: CA8273 F36118 - CA8200B (3:1),11/25/2019 13:06,11/25/2019 13:06,0.0625,gal,1/27/2020 17:44,adminbomry,1,1,1,0,{'2020-01-27 17:44:48': 1},1,0
1401,Wichita KS,DefaultDept,(PL)Painting Ops-Down Draft Detail Booth (Bld.5D),Blend: CA8273 F36118 - CA8200B (3:1),12/31/2019 8:30,12/31/2019 8:30,0.0625,gal,1/14/2020 9:12,adminbomgb,1,1,1,0,{'2020-01-14 09:12:04': 1},1,0
1402,Wichita KS,DefaultDept,(PL)Painting Ops-Down Draft Detail Booth (Bld.5D),Blend: CA8273 F36118 - CA8200B (3:1),1/8/2020 7:30,1/8/2020 7:30,0.0625,gal,4/28/2020 14:02,adminbomjs,1,1,1,0,{'2020-04-28 14:02:08': 1},1,0
1403,Wichita KS,DefaultDept,(PL)Painting Ops-Down Draft Detail Booth (Bld.5D),Blend: CA8273 F36118 - CA8200B (3:1),1/28/2020 7:30,1/28/2020 7:30,0.0625,gal,4/28/2020 15:00,adminbomjs,1,1,1,0,{'2020-04-28 15:00:33': 1},1,0
1404,Wichita KS,DefaultDept,(PL)Painting Ops-Down Draft Detail Booth (Bld.5D),Blend: CA8273 F36118 - CA8200B (3:1),3/20/2020 13:54,3/20/2020 13:54,0.0625,gal,5/13/2020 13:54,adminbomry,1,1,1,0,{'2020-05-13 13:54:40': 1},1,0
1405,Wichita KS,DefaultDept,(PL)Painting Ops-Down Draft Detail Booth (Bld.5D),Blend: CA8273 F36118 - CA8200B (3:1),5/16/2020 0:00,5/16/2020 0:00,0.0625,gal,6/18/2020 12:22,Kamiander,1,1,1,0,{'2020-06-18 12:22:31': 1},1,0
1406,Wichita KS,DefaultDept,(PL)Painting Ops-Down Draft Detail Booth (Bld.5D),Blend: CA8273 F36118 - CA8200B (3:1),5/29/2020 0:00,5/29/2020 0:00,0.0625,gal,6/18/2020 12:28,Kamiander,1,1,1,0,{'2020-06-18 12:28:54': 1},1,0
1407,Wichita KS,DefaultDept,(PL)Painting Ops-Down Draft Detail Booth (Bld.5D),Blend: CA8273 F36118 - CA8200B (3:1),6/6/2020 0:00,6/6/2020 0:00,0.0625,gal,7/27/2020 16:15,Kamiander,1,1,1,0,{'2020-07-27 16:15:56': 1},1,0
1408,Wichita KS,DefaultDept,(PL)Painting Ops-Down Draft Detail Booth (Bld.5D),Blend: CA8273 F36118 - CA8200B (3:1),7/15/2020 0:00,7/15/2020 0:00,0.0625,gal,8/26/2020 11:50,Kamiander,1,1,1,0,{'2020-08-26 11:50:19': 1},1,0
1409,Wichita KS,DefaultDept,(PL)Painting Ops-Down Draft Detail Booth (Bld.5D),Blend: CA8273 F36118 - CA8200B (3:1),7/23/2020 0:00,7/23/2020 0:00,0.0625,gal,8/26/2020 12:06,Kamiander,1,1,1,0,{'2020-08-26 12:06:23': 1},1,0
1410,Wichita KS,DefaultDept,(PL)Painting Ops-Down Draft Detail Booth (Bld.5D),Blend: CA8273 F36118 - CA8200B (3:1),8/24/2020 0:00,8/24/2020 0:00,0.0625,gal,9/24/2020 10:40,Kamiander,1,1,1,0,{'2020-09-24 10:40:53': 1},1,0
1411,Wichita KS,DefaultDept,(PL)Painting Ops-Down Draft Detail Booth (Bld.5D),Blend: CA8273 F36118 - CA8200B (3:1),8/25/2020 0:00,8/25/2020 0:00,0.03125,gal,9/24/2020 10:44,Kamiander,1,1,1,0,{'2020-09-24 10:44:03': 1},1,0
1412,Wichita KS,DefaultDept,(PL)Painting Ops-Down Draft Detail Booth (Bld.5D),Blend: CA8273 F36118 - CA8200B (3:1),9/14/2020 13:00,9/14/2020 13:00,0.0625,gal,10/27/2020 11:06,dlyon,1,1,1,0,{'2020-10-27 11:06:02': 1},1,0
1413,Wichita KS,DefaultDept,(PL)Painting Ops-Down Draft Detail Booth (Bld.5D),Blend: CA8273 F36118 - CA8200B (3:1),9/17/2020 7:30,9/17/2020 7:30,0.0625,gal,10/27/2020 11:12,dlyon,1,1,1,0,{'2020-10-27 11:12:43': 1},1,0
1414,Wichita KS,DefaultDept,(PL)Painting Ops-Down Draft Detail Booth (Bld.5D),Blend: CA8273 F36118 - CA8200B (3:1),9/22/2020 18:00,9/22/2020 18:00,0.0625,gal,10/27/2020 14:32,dlyon,1,1,1,0,{'2020-10-27 14:32:33': 1},1,0
1415,Wichita KS,DefaultDept,(PL)Painting Ops-Down Draft Detail Booth (Bld.5D),Blend: CA8273 F36118 - CA8200B (3:1),9/23/2020 12:30,9/23/2020 12:30,0.0625,gal,10/27/2020 14:38,dlyon,1,1,1,0,{'2020-10-27 14:38:33': 1},1,0
1416,Wichita KS,DefaultDept,(PL)Painting Ops-Down Draft Detail Booth (Bld.5D),Blend: CA8273 F36118 - CA8200B (3:1),11/2/2020 12:30,11/2/2020 12:30,0.125,gal,1/5/2021 13:38,dlyon,1,1,1,0,{'2021-01-05 13:38:41': 1},1,0
1417,Wichita KS,DefaultDept,(PL)Painting Ops-Down Draft Detail Booth (Bld.5D),Blend: CA8273 F36118 - CA8200B (3:1),11/28/2020 7:00,11/28/2020 7:00,0.0625,gal,1/5/2021 14:11,dlyon,1,1,1,0,{'2021-01-05 14:11:24': 1},1,0
1418,Wichita KS,DefaultDept,(PL)Painting Ops-Down Draft Detail Booth (Bld.5D),Blend: CA8273 F36118 - CA8200B (3:1),12/31/2020 8:30,12/31/2020 8:30,0.0625,gal,1/5/2021 15:08,dlyon,1,1,1,0,{'2021-01-05 15:08:11': 1},1,0
1419,Wichita KS,DefaultDept,(PL)Painting Ops-Down Draft Detail Booth (Bld.5D),Blend: CA8273 I1149 - CA8200B (3:1),7/24/2019 16:09,7/24/2019 16:09,0.0234375,gal,7/24/2019 16:09,adminbomgb,1,1,1,0,{'2019-07-24 16:09:58': 1},1,0
1420,Wichita KS,DefaultDept,(PL)Painting Ops-Down Draft Detail Booth (Bld.5D),Blend: CA8273 I1149 - CA8200B (3:1),7/25/2019 8:14,7/25/2019 8:14,0.0234375,gal,7/25/2019 8:14,adminbomgb,1,1,1,0,{'2019-07-25 08:14:45': 1},1,0
1421,Wichita KS,DefaultDept,(PL)Painting Ops-Down Draft Detail Booth (Bld.5D),Blend: CA8273 I1149 - CA8200B (3:1),11/14/2019 12:49,11/14/2019 12:49,0.03125,gal,1/24/2020 13:17,adminbomed,1,1,1,0,{'2020-01-24 13:17:51': 1},1,0
1422,Wichita KS,DefaultDept,(PL)Painting Ops-Down Draft Detail Booth (Bld.5D),Blend: CA8273 I1149 - CA8200B (3:1),2/10/2020 14:43,2/10/2020 14:43,0.0625,gal,5/7/2020 14:43,adminbomry,1,1,1,0,{'2020-05-07 14:43:51': 1},1,0
1423,Wichita KS,DefaultDept,(PL)Painting Ops-Down Draft Detail Booth (Bld.5D),Blend: CA8273 I1149 - CA8200B (3:1),5/16/2020 0:00,5/16/2020 0:00,0.03125,gal,6/18/2020 12:21,Kamiander,1,1,1,0,{'2020-06-18 12:21:09': 1},1,0
1424,Wichita KS,DefaultDept,(PL)Painting Ops-Down Draft Detail Booth (Bld.5D),Blend: CA8273 I1375 - CA8200B (3:1),7/25/2019 10:33,7/25/2019 10:33,0.0234375,gal,7/25/2019 10:33,adminbomgb,1,1,1,0,{'2019-07-25 10:33:35': 1},1,0
1425,Wichita KS,DefaultDept,(PL)Painting Ops-Down Draft Detail Booth (Bld.5D),Blend: CA8273 I1375 - CA8200B (3:1),8/20/2019 1:00,8/20/2019 1:00,0.046875,gal,9/18/2019 14:03,adminbomgb,1,1,1,0,{'2019-09-18 14:03:57': 1},1,0
1426,Wichita KS,DefaultDept,(PL)Painting Ops-Down Draft Detail Booth (Bld.5D),Blend: CA8273 I1375 - CA8200B (3:1),8/21/2019 10:00,8/21/2019 10:00,0.0234375,gal,9/18/2019 14:04,adminbomgb,1,1,1,0,{'2019-09-18 14:04:59': 1},1,0
1427,Wichita KS,DefaultDept,(PL)Painting Ops-Down Draft Detail Booth (Bld.5D),Blend: CA8273 I1375 - CA8200B (3:1),8/29/2019 7:45,8/29/2019 7:45,0.046875,gal,9/18/2019 14:15,adminbomgb,1,1,1,0,{'2019-09-18 14:15:20': 1},1,0
1428,Wichita KS,DefaultDept,(PL)Painting Ops-Down Draft Detail Booth (Bld.5D),Blend: CA8273 I1375 - CA8200B (3:1),9/12/2019 12:30,9/12/2019 12:30,0.046875,gal,10/15/2019 15:47,adminbomgb,1,1,1,0,{'2019-10-15 15:47:07': 1},1,0
1429,Wichita KS,DefaultDept,(PL)Painting Ops-Down Draft Detail Booth (Bld.5D),Blend: CA8273 I1375 - CA8200B (3:1),9/24/2019 14:30,9/24/2019 14:30,0.0625,gal,10/15/2019 16:00,adminbomgb,1,1,1,0,{'2019-10-15 16:00:29': 1},1,0
1430,Wichita KS,DefaultDept,(PL)Painting Ops-Down Draft Detail Booth (Bld.5D),Blend: CA8273 I1375 - CA8200B (3:1),9/27/2019 10:00,9/27/2019 10:00,0.021484375,gal,10/15/2019 16:10,adminbomgb,1,1,1,0,{'2019-10-15 16:10:46': 1},1,0
1431,Wichita KS,DefaultDept,(PL)Painting Ops-Down Draft Detail Booth (Bld.5D),Blend: CA8273 I1375 - CA8200B (3:1),10/9/2019 12:00,10/9/2019 12:00,0.0625,gal,12/19/2019 16:04,adminbomry,1,1,1,0,{'2019-12-19 16:04:12': 1},1,0
1432,Wichita KS,DefaultDept,(PL)Painting Ops-Down Draft Detail Booth (Bld.5D),Blend: CA8273 I1375 - CA8200B (3:1),10/17/2019 12:00,10/17/2019 12:00,0.0625,gal,12/19/2019 16:04,adminbomry,1,1,1,0,{'2019-12-19 16:04:12': 1},1,0
1433,Wichita KS,DefaultDept,(PL)Painting Ops-Down Draft Detail Booth (Bld.5D),Blend: CA8273 I1375 - CA8200B (3:1),10/18/2019 12:00,10/18/2019 12:00,0.082813,gal,12/19/2019 16:04,adminbomry,1,1,1,0,{'2019-12-19 16:04:12': 1},1,0
1434,Wichita KS,DefaultDept,(PL)Painting Ops-Down Draft Detail Booth (Bld.5D),Blend: CA8273 I1375 - CA8200B (3:1),10/22/2019 12:00,10/22/2019 12:00,0.082813,gal,12/19/2019 16:04,adminbomry,1,1,1,0,{'2019-12-19 16:04:12': 1},1,0
1435,Wichita KS,DefaultDept,(PL)Painting Ops-Down Draft Detail Booth (Bld.5D),Blend: CA8273 I1375 - CA8200B (3:1),11/2/2019 11:19,11/2/2019 11:19,0.0546875,gal,1/27/2020 17:54,adminbomry,1,1,1,0,{'2020-01-27 17:54:55': 1},1,0
1436,Wichita KS,DefaultDept,(PL)Painting Ops-Down Draft Detail Booth (Bld.5D),Blend: CA8273 I1375 - CA8200B (3:1),11/15/2019 12:54,11/15/2019 12:54,0.0625,gal,1/27/2020 17:56,adminbomry,1,1,1,0,{'2020-01-27 17:56:41': 1},1,0
1437,Wichita KS,DefaultDept,(PL)Painting Ops-Down Draft Detail Booth (Bld.5D),Blend: CA8273 I1375 - CA8200B (3:1),12/3/2019 8:15,12/3/2019 8:15,0.0625,gal,1/14/2020 8:25,adminbomgb,1,1,1,0,{'2020-01-14 08:25:07': 1},1,0
1438,Wichita KS,DefaultDept,(PL)Painting Ops-Down Draft Detail Booth (Bld.5D),Blend: CA8273 I1375 - CA8200B (3:1),12/14/2019 8:00,12/14/2019 8:00,0.0625,gal,1/14/2020 8:36,adminbomgb,1,1,1,0,{'2020-01-14 08:36:31': 1},1,0
1439,Wichita KS,DefaultDept,(PL)Painting Ops-Down Draft Detail Booth (Bld.5D),Blend: CA8273 I1375 - CA8200B (3:1),12/16/2019 14:30,12/16/2019 14:30,0.0625,gal,1/14/2020 8:38,adminbomgb,1,1,1,0,{'2020-01-14 08:38:58': 1},1,0
1440,Wichita KS,DefaultDept,(PL)Painting Ops-Down Draft Detail Booth (Bld.5D),Blend: CA8273 I1375 - CA8200B (3:1),12/17/2019 12:00,12/17/2019 12:00,0.03125,gal,1/14/2020 8:40,adminbomgb,1,1,1,0,{'2020-01-14 08:40:23': 1},1,0
1441,Wichita KS,DefaultDept,(PL)Painting Ops-Down Draft Detail Booth (Bld.5D),Blend: CA8273 I1375 - CA8200B (3:1),12/30/2019 8:30,12/30/2019 8:30,0.03125,gal,1/14/2020 9:08,adminbomgb,1,1,1,0,{'2020-01-14 09:08:24': 1},1,0
1442,Wichita KS,DefaultDept,(PL)Painting Ops-Down Draft Detail Booth (Bld.5D),Blend: CA8273 I1375 - CA8200B (3:1),1/14/2020 10:30,1/14/2020 10:30,0.0625,gal,4/28/2020 14:17,adminbomjs,1,1,1,0,{'2020-04-28 14:17:20': 1},1,0
1443,Wichita KS,DefaultDept,(PL)Painting Ops-Down Draft Detail Booth (Bld.5D),Blend: CA8273 I1375 - CA8200B (3:1),1/17/2020 12:00,1/17/2020 12:00,0.0625,gal,4/28/2020 14:24,adminbomjs,1,1,1,0,{'2020-04-28 14:24:24': 1},1,0
1444,Wichita KS,DefaultDept,(PL)Painting Ops-Down Draft Detail Booth (Bld.5D),Blend: CA8273 I1375 - CA8200B (3:1),1/29/2020 8:30,1/29/2020 8:30,0.0625,gal,4/28/2020 15:07,adminbomjs,1,1,1,0,{'2020-04-28 15:07:29': 1},1,0
1445,Wichita KS,DefaultDept,(PL)Painting Ops-Down Draft Detail Booth (Bld.5D),Blend: CA8273 I1375 - CA8200B (3:1),8/14/2020 0:00,8/14/2020 0:00,0.03125,gal,9/24/2020 10:23,Kamiander,1,1,1,0,{'2020-09-24 10:23:09': 1},1,0
1446,Wichita KS,DefaultDept,(PL)Painting Ops-Down Draft Detail Booth (Bld.5D),Blend: CA8273 I1375 - CA8200B (3:1),11/9/2020 13:00,11/9/2020 13:00,0.0625,gal,1/5/2021 13:41,dlyon,1,1,1,0,{'2021-01-05 13:41:37': 1},1,0
1447,Wichita KS,DefaultDept,(PL)Painting Ops-Down Draft Detail Booth (Bld.5D),Blend: CA8273 I1375 - CA8200B (3:1),11/12/2020 5:45,11/12/2020 5:45,0.0625,gal,1/5/2021 13:43,dlyon,1,1,1,0,{'2021-01-05 13:43:31': 1},1,0
1448,Wichita KS,DefaultDept,(PL)Painting Ops-Down Draft Detail Booth (Bld.5D),Blend: CA8273 I1375 - CA8200B (3:1),11/16/2020 14:00,11/16/2020 14:00,0.03125,gal,1/5/2021 13:49,dlyon,1,1,1,0,{'2021-01-05 13:49:37': 1},1,0
1449,Wichita KS,DefaultDept,(PL)Painting Ops-Down Draft Detail Booth (Bld.5D),Blend: CA8273 I1375 - CA8200B (3:1),11/24/2020 14:15,11/24/2020 14:15,0.03125,gal,1/5/2021 14:08,dlyon,1,1,1,0,{'2021-01-05 14:08:35': 1},1,0
1450,Wichita KS,DefaultDept,(PL)Painting Ops-Down Draft Detail Booth (Bld.5D),Blend: CA8273 I1375 - CA8200B (3:1),12/3/2020 8:15,12/3/2020 8:15,0.0625,gal,1/5/2021 14:25,dlyon,1,1,1,0,{'2021-01-05 14:25:53': 1},1,0
1451,Wichita KS,DefaultDept,(PL)Painting Ops-Down Draft Detail Booth (Bld.5D),Blend: CA8273 I1375 - CA8200B (3:1),12/14/2020 8:00,12/14/2020 8:00,0.0625,gal,1/5/2021 14:45,dlyon,1,1,1,0,{'2021-01-05 14:45:38': 1},1,0
1452,Wichita KS,DefaultDept,(PL)Painting Ops-Down Draft Detail Booth (Bld.5D),Blend: CA8273 I1375 - CA8200B (3:1),12/16/2020 14:30,12/16/2020 14:30,0.0625,gal,1/5/2021 14:48,dlyon,1,1,1,0,{'2021-01-05 14:48:46': 1},1,0
1453,Wichita KS,DefaultDept,(PL)Painting Ops-Down Draft Detail Booth (Bld.5D),Blend: CA8273 I1375 - CA8200B (3:1),12/17/2020 12:00,12/17/2020 12:00,0.03125,gal,1/5/2021 14:50,dlyon,1,1,1,0,{'2021-01-05 14:50:18': 1},1,0
1454,Wichita KS,DefaultDept,(PL)Painting Ops-Down Draft Detail Booth (Bld.5D),Blend: CA8273 I1375 - CA8200B (3:1),12/30/2020 8:30,12/30/2020 8:30,0.03125,gal,1/5/2021 15:05,dlyon,1,1,1,0,{'2021-01-05 15:05:19': 1},1,0
1455,Wichita KS,DefaultDept,(PL)Painting Ops-Down Draft Detail Booth (Bld.5D),Blend: CA8273 I1376 - CA8200B (3:1),7/24/2019 16:16,7/24/2019 16:16,0.0234375,gal,7/24/2019 16:16,adminbomgb,1,1,1,0,{'2019-07-24 16:16:22': 1},1,0
1456,Wichita KS,DefaultDept,(PL)Painting Ops-Down Draft Detail Booth (Bld.5D),Blend: CA8273 I1376 - CA8200B (3:1),7/24/2019 16:22,7/24/2019 16:22,0.046875,gal,7/24/2019 16:22,adminbomgb,1,1,1,0,{'2019-07-24 16:22:01': 1},1,0
1457,Wichita KS,DefaultDept,(PL)Painting Ops-Down Draft Detail Booth (Bld.5D),Blend: CA8273 I1376 - CA8200B (3:1),7/25/2019 9:43,7/25/2019 9:43,0.0234375,gal,7/25/2019 9:43,adminbomgb,1,1,1,0,{'2019-07-25 09:43:13': 1},1,0
1458,Wichita KS,DefaultDept,(PL)Painting Ops-Down Draft Detail Booth (Bld.5D),Blend: CA8273 I1376 - CA8200B (3:1),7/25/2019 10:39,7/25/2019 10:39,0.046875,gal,7/25/2019 10:39,adminbomgb,1,1,1,0,{'2019-07-25 10:39:26': 1},1,0
1459,Wichita KS,DefaultDept,(PL)Painting Ops-Down Draft Detail Booth (Bld.5D),Blend: CA8273 I1376 - CA8200B (3:1),12/3/2019 6:30,12/3/2019 6:30,0.03125,gal,1/14/2020 8:22,adminbomgb,1,1,1,0,{'2020-01-14 08:22:14': 1},1,0
1460,Wichita KS,DefaultDept,(PL)Painting Ops-Down Draft Detail Booth (Bld.5D),Blend: CA8273 I1376 - CA8200B (3:1),12/3/2020 6:30,12/3/2020 6:30,0.03125,gal,1/5/2021 14:22,dlyon,1,1,1,0,{'2021-01-05 14:22:43': 1},1,0
1461,Wichita KS,DefaultDept,(PL)Painting Ops-Down Draft Detail Booth (Bld.5D),Blend: CA8273 I1381 - CA8200B (3:1),7/25/2019 8:27,7/25/2019 8:27,0.0234375,gal,7/25/2019 8:27,adminbomgb,1,1,1,0,{'2019-07-25 08:27:22': 1},1,0
1462,Wichita KS,DefaultDept,(PL)Painting Ops-Down Draft Detail Booth (Bld.5D),Blend: CA8273 I2235 - CA8200B - (3:1),10/19/2020 7:30,10/19/2020 7:30,0.0625,gal,1/5/2021 13:11,dlyon,1,1,1,0,{'2021-01-05 13:11:22': 1},1,0
1463,Wichita KS,DefaultDept,(PL)Painting Ops-Down Draft Detail Booth (Bld.5D),Blend: CA8273 I2235 - CA8200B - (3:1),10/20/2020 8:30,10/20/2020 8:30,0.03125,gal,1/5/2021 13:13,dlyon,1,1,1,0,{'2021-01-05 13:13:08': 1},1,0
1464,Wichita KS,DefaultDept,(PL)Painting Ops-Down Draft Detail Booth (Bld.5D),Blend: CA8273 I2238 - CA8200B (3:1),7/25/2019 10:14,7/25/2019 10:14,0.0234375,gal,7/25/2019 10:14,adminbomgb,1,1,1,0,{'2019-07-25 10:14:21': 1},1,0
1465,Wichita KS,DefaultDept,(PL)Painting Ops-Down Draft Detail Booth (Bld.5D),Blend: CA8273 I2238 - CA8200B (3:1),3/10/2020 19:49,3/10/2020 19:49,0.0625,gal,5/13/2020 13:33,adminbomry,1,1,1,0,{'2020-05-13 13:33:17': 1},1,0
1466,Wichita KS,DefaultDept,(PL)Painting Ops-Down Draft Detail Booth (Bld.5D),Blend: CA8273 I2238 - CA8200B (3:1),6/1/2020 0:00,6/1/2020 0:00,0.0625,gal,7/27/2020 16:09,Kamiander,1,1,1,0,{'2020-07-27 16:09:00': 1},1,0
1467,Wichita KS,DefaultDept,(PL)Painting Ops-Down Draft Detail Booth (Bld.5D),Blend: CA8273 I2247 - CA8200B (3:1),7/24/2019 16:31,7/24/2019 16:31,0.0234375,gal,7/24/2019 16:31,adminbomgb,1,1,1,0,{'2019-07-24 16:31:00': 1},1,0
1468,Wichita KS,DefaultDept,(PL)Painting Ops-Down Draft Detail Booth (Bld.5D),Blend: CA8273 I2247 - CA8200B (3:1),7/25/2019 11:13,7/25/2019 11:13,0.0234375,gal,7/25/2019 11:13,adminbomgb,1,1,1,0,{'2019-07-25 11:13:07': 1},1,0
1469,Wichita KS,DefaultDept,(PL)Painting Ops-Down Draft Detail Booth (Bld.5D),Blend: CA8273 I2326 - CA8200B (3:1),7/25/2019 10:02,7/25/2019 10:02,0.0234375,gal,7/25/2019 10:02,adminbomgb,1,1,1,0,{'2019-07-25 10:02:10': 1},1,0
1470,Wichita KS,DefaultDept,(PL)Painting Ops-Down Draft Detail Booth (Bld.5D),Blend: CA8273 I2326 - CA8200B (3:1),3/19/2020 13:50,3/19/2020 13:50,0.03125,gal,5/13/2020 13:51,adminbomry,1,1,1,0,{'2020-05-13 13:51:06': 1},1,0
1471,Wichita KS,DefaultDept,(PL)Painting Ops-Down Draft Detail Booth (Bld.5D),Blend: CA8273 I2326 - CA8200B (3:1),8/14/2020 0:00,8/14/2020 0:00,0.03125,gal,9/24/2020 10:37,Kamiander,1,1,1,0,{'2020-09-24 10:37:38': 1},1,0
1472,Wichita KS,DefaultDept,(PL)Painting Ops-Down Draft Detail Booth (Bld.5D),Blend: CA8273 I2326 - CA8200B (3:1),9/3/2020 10:15,9/3/2020 10:15,0.03125,gal,10/27/2020 10:38,dlyon,1,1,1,0,{'2020-10-27 10:38:17': 1},1,0
1473,Wichita KS,DefaultDept,(PL)Painting Ops-Down Draft Detail Booth (Bld.5D),Blend: CA8273 I2335 - CA8200B (3:1),7/24/2019 16:36,7/24/2019 16:36,0.046875,gal,7/24/2019 16:36,adminbomgb,1,1,1,0,{'2019-07-24 16:36:00': 1},1,0
1474,Wichita KS,DefaultDept,(PL)Painting Ops-Down Draft Detail Booth (Bld.5D),Blend: CA8273 I2335 - CA8200B (3:1),7/25/2019 11:11,7/25/2019 11:11,0.0234375,gal,7/25/2019 11:11,adminbomgb,1,1,1,0,{'2019-07-25 11:11:38': 1},1,0
1475,Wichita KS,DefaultDept,(PL)Painting Ops-Down Draft Detail Booth (Bld.5D),Blend: CA8273 I2869 - CA8200B (3:1),7/25/2019 9:13,7/25/2019 9:13,0.0234375,gal,7/25/2019 9:13,adminbomgb,1,1,1,0,{'2019-07-25 09:13:39': 1},1,0
1476,Wichita KS,DefaultDept,(PL)Painting Ops-Down Draft Detail Booth (Bld.5D),Blend: CA8273 I2869 - CA8200B (3:1),7/25/2019 9:57,7/25/2019 9:57,0.046875,gal,7/25/2019 9:57,adminbomgb,1,1,1,0,{'2019-07-25 09:57:10': 1},1,0
1477,Wichita KS,DefaultDept,(PL)Painting Ops-Down Draft Detail Booth (Bld.5D),Blend: CA8273 I7100 - CA8200B (3:1),7/25/2019 8:16,7/25/2019 8:16,0.0234375,gal,7/25/2019 8:16,adminbomgb,1,1,1,0,{'2019-07-25 08:16:11': 1},1,0
1478,Wichita KS,DefaultDept,(PL)Painting Ops-Down Draft Detail Booth (Bld.5D),Blend: CA8273 I7162 - CA8200B (3:1),7/24/2019 16:12,7/24/2019 16:12,0.0234375,gal,7/24/2019 16:12,adminbomgb,1,1,1,0,{'2019-07-24 16:12:04': 1},1,0
1479,Wichita KS,DefaultDept,(PL)Painting Ops-Down Draft Detail Booth (Bld.5D),Blend: CA8273 I7162 - CA8200B (3:1),7/25/2019 8:28,7/25/2019 8:28,0.0234375,gal,7/25/2019 8:28,adminbomgb,1,1,1,0,{'2019-07-25 08:28:46': 1},1,0
1480,Wichita KS,DefaultDept,(PL)Painting Ops-Down Draft Detail Booth (Bld.5D),Blend: CA8273 I7162 - CA8200B (3:1),9/6/2019 7:30,9/6/2019 7:30,0.03125,gal,10/15/2019 15:13,adminbomgb,1,1,1,0,{'2019-10-15 15:13:50': 1},1,0
1481,Wichita KS,DefaultDept,(PL)Painting Ops-Down Draft Detail Booth (Bld.5D),Blend: CA8273 I7162 - CA8200B (3:1),9/30/2019 12:30,9/30/2019 12:30,0.03125,gal,10/15/2019 16:14,adminbomgb,1,1,1,0,{'2019-10-15 16:14:07': 1},1,0
1482,Wichita KS,DefaultDept,(PL)Painting Ops-Down Draft Detail Booth (Bld.5D),Blend: CA8273 I7162 - CA8200B (3:1),10/23/2019 12:00,10/23/2019 12:00,0.020781,gal,12/19/2019 16:04,adminbomry,1,1,1,0,{'2019-12-19 16:04:12': 1},1,0
1483,Wichita KS,DefaultDept,(PL)Painting Ops-Down Draft Detail Booth (Bld.5D),Blend: CA8273 I7162 - CA8200B (3:1),12/30/2019 6:00,12/30/2019 6:00,0.03125,gal,1/14/2020 9:06,adminbomgb,1,1,1,0,{'2020-01-14 09:06:28': 1},1,0
1484,Wichita KS,DefaultDept,(PL)Painting Ops-Down Draft Detail Booth (Bld.5D),Blend: CA8273 I7162 - CA8200B (3:1),1/29/2020 7:30,1/29/2020 7:30,0.03125,gal,4/28/2020 15:04,adminbomjs,1,1,1,0,{'2020-04-28 15:04:31': 1},1,0
1485,Wichita KS,DefaultDept,(PL)Painting Ops-Down Draft Detail Booth (Bld.5D),Blend: CA8273 I7162 - CA8200B (3:1),2/11/2020 14:44,2/11/2020 14:44,0.03125,gal,5/7/2020 14:45,adminbomry,1,1,1,0,{'2020-05-07 14:45:24': 1},1,0
1486,Wichita KS,DefaultDept,(PL)Painting Ops-Down Draft Detail Booth (Bld.5D),Blend: CA8273 I7162 - CA8200B (3:1),5/28/2020 0:00,5/28/2020 0:00,0.03125,gal,6/19/2020 8:55,Kamiander,1,1,1,0,{'2020-06-19 08:55:45': 1},1,0
1487,Wichita KS,DefaultDept,(PL)Painting Ops-Down Draft Detail Booth (Bld.5D),Blend: CA8273 I7162 - CA8200B (3:1),6/23/2020 0:00,6/23/2020 0:00,0.03125,gal,7/27/2020 16:36,Kamiander,1,1,1,0,{'2020-07-27 16:36:45': 1},1,0
1488,Wichita KS,DefaultDept,(PL)Painting Ops-Down Draft Detail Booth (Bld.5D),Blend: CA8273 I7162 - CA8200B (3:1),7/22/2020 0:00,7/22/2020 0:00,0.03125,gal,8/26/2020 12:01,Kamiander,1,1,1,0,{'2020-08-26 12:01:27': 1},1,0
1489,Wichita KS,DefaultDept,(PL)Painting Ops-Down Draft Detail Booth (Bld.5D),Blend: CA8273 I7162 - CA8200B (3:1),10/14/2020 7:15,10/14/2020 7:15,0.03125,gal,1/5/2021 13:07,dlyon,1,1,1,0,{'2021-01-05 13:07:41': 1},1,0
1490,Wichita KS,DefaultDept,(PL)Painting Ops-Down Draft Detail Booth (Bld.5D),Blend: CA8273 I7162 - CA8200B (3:1),11/13/2020 8:15,11/13/2020 8:15,0.03125,gal,1/5/2021 13:48,dlyon,1,1,1,0,{'2021-01-05 13:48:07': 1},1,0
1491,Wichita KS,DefaultDept,(PL)Painting Ops-Down Draft Detail Booth (Bld.5D),Blend: CA8273 I7162 - CA8200B (3:1),12/30/2020 6:00,12/30/2020 6:00,0.03125,gal,1/5/2021 15:03,dlyon,1,1,1,0,{'2021-01-05 15:03:59': 1},1,0
1492,Wichita KS,DefaultDept,(PL)Painting Ops-Down Draft Detail Booth (Bld.5D),Blend: CA8273 I7189 - CA8200B (3:1),8/2/2019 2:00,8/2/2019 2:00,0.0234375,gal,9/18/2019 13:47,adminbomgb,1,1,1,0,{'2019-09-18 13:47:46': 1},1,0
1493,Wichita KS,DefaultDept,(PL)Painting Ops-Down Draft Detail Booth (Bld.5D),Blend: CA8273 I7737 - CA8200B (3:1),8/22/2019 7:30,8/22/2019 7:30,0.046875,gal,9/18/2019 14:07,adminbomgb,1,1,1,0,{'2019-09-18 14:07:10': 1},1,0
1494,Wichita KS,DefaultDept,(PL)Painting Ops-Down Draft Detail Booth (Bld.5D),Blend: CA8273 I7737 - CA8200B (3:1),8/28/2019 2:30,8/28/2019 2:30,0.0234375,gal,9/18/2019 14:14,adminbomgb,1,1,1,0,{'2019-09-18 14:14:20': 1},1,0
1495,Wichita KS,DefaultDept,(PL)Painting Ops-Down Draft Detail Booth (Bld.5D),Blend: CA8273 I7737 - CA8200B (3:1),11/12/2020 14:00,11/12/2020 14:00,0.0625,gal,1/5/2021 13:46,dlyon,1,1,1,0,{'2021-01-05 13:46:43': 1},1,0
1496,Wichita KS,DefaultDept,(PL)Painting Ops-Down Draft Detail Booth (Bld.5D),Blend: CA8273 I7737 - CA8200B (3:1),11/19/2020 18:00,11/19/2020 18:00,0.03125,gal,1/5/2021 13:59,dlyon,1,1,1,0,{'2021-01-05 13:59:43': 1},1,0
1497,Wichita KS,DefaultDept,(PL)Painting Ops-Down Draft Detail Booth (Bld.5D),Blend: CA8273 I8012 - CA8200B (3:1),7/25/2019 9:25,7/25/2019 9:25,0.046875,gal,7/25/2019 9:25,adminbomgb,1,1,1,0,{'2019-07-25 09:25:14': 1},1,0
1498,Wichita KS,DefaultDept,(PL)Painting Ops-Down Draft Detail Booth (Bld.5D),Blend: CA8273 I8012 - CA8200B (3:1),7/25/2019 9:39,7/25/2019 9:39,0.0234375,gal,7/25/2019 9:43,adminbomgb,1,1,1,0,{'2019-07-25 09:43:47': 1},1,0
1499,Wichita KS,DefaultDept,(PL)Painting Ops-Down Draft Detail Booth (Bld.5D),Blend: CA8273/I2255 BASE COMPONENT - CA 8200B M&D ACTIVATOR COMPONENT (6:1),8/14/2020 0:00,8/14/2020 0:00,0.03125,gal,9/24/2020 10:26,Kamiander,1,1,1,0,{'2020-09-24 10:26:11': 1},1,0
1500,Wichita KS,DefaultDept,(PL)Painting Ops-Down Draft Detail Booth (Bld.5D),Blend: CA8273/I2255 BASE COMPONENT - CA 8200B M&D ACTIVATOR COMPONENT (6:1),8/24/2020 0:00,8/24/2020 0:00,0.03125,gal,9/24/2020 10:42,Kamiander,1,1,1,0,{'2020-09-24 10:42:17': 1},1,0
1501,Wichita KS,DefaultDept,(PL)Painting Ops-Down Draft Detail Booth (Bld.5D),Blend: CA8273/I7230 - CA8200B (3:1),3/24/2020 15:06,3/24/2020 15:06,0.03125,gal,5/14/2020 15:07,adminbomry,1,1,1,0,{'2020-05-14 15:07:25': 1},1,0
1502,Wichita KS,DefaultDept,(PL)Painting Ops-Down Draft Detail Booth (Bld.5D),Blend: CA8273/I7230 - CA8200B (3:1),7/10/2020 0:00,7/10/2020 0:00,0.0625,gal,8/26/2020 11:23,Kamiander,1,1,1,0,{'2020-08-26 11:23:43': 1},1,0
1503,Wichita KS,DefaultDept,(PL)Painting Ops-Down Draft Detail Booth (Bld.5D),Blend: CA8273/I7230 - CA8200B (3:1),7/13/2020 0:00,7/13/2020 0:00,0.03125,gal,8/26/2020 11:34,Kamiander,1,1,1,0,{'2020-08-26 11:34:54': 1},1,0
1504,Wichita KS,DefaultDept,(PL)Painting Ops-Down Draft Detail Booth (Bld.5D),Blend: CA8273/I7230 - CA8200B (3:1),7/14/2020 0:00,7/14/2020 0:00,0.0625,gal,8/26/2020 11:38,Kamiander,1,1,1,0,{'2020-08-26 11:38:59': 1},1,0
1505,Wichita KS,DefaultDept,(PL)Painting Ops-Down Draft Detail Booth (Bld.5D),Blend: CA8273/I7230 - CA8200B (3:1),7/16/2020 0:00,7/16/2020 0:00,0.03125,gal,8/26/2020 11:54,Kamiander,1,1,1,0,{'2020-08-26 11:54:26': 1},1,0
1506,Wichita KS,DefaultDept,(PL)Painting Ops-Down Draft Detail Booth (Bld.5D),Blend: CA8273/I7230 - CA8200B (3:1),7/29/2020 0:00,7/29/2020 0:00,0.0625,gal,8/26/2020 12:12,Kamiander,1,1,1,0,{'2020-08-26 12:12:19': 1},1,0
1507,Wichita KS,DefaultDept,(PL)Painting Ops-Down Draft Detail Booth (Bld.5D),Blend: CA8273/I7230 - CA8200B (3:1),10/5/2020 14:15,10/5/2020 14:15,0.03125,gal,1/5/2021 12:45,dlyon,1,1,1,0,{'2021-01-05 12:45:24': 1},1,0
1508,Wichita KS,DefaultDept,(PL)Painting Ops-Down Draft Detail Booth (Bld.5D),Blend: CA8273I2236 - CA8200B (3:1),10/2/2019 12:00,10/2/2019 12:00,0.041406,gal,12/19/2019 16:04,adminbomry,1,1,1,0,{'2019-12-19 16:04:12': 1},1,0
1509,Wichita KS,DefaultDept,(PL)Painting Ops-Down Draft Detail Booth (Bld.5D),Blend: CA8273I2236 - CA8200B (3:1),10/24/2019 12:00,10/24/2019 12:00,0.0625,gal,12/19/2019 16:04,adminbomry,1,1,1,0,{'2019-12-19 16:04:12': 1},1,0
1510,Wichita KS,DefaultDept,(PL)Painting Ops-Down Draft Detail Booth (Bld.5D),Blend: CA8273I2236 - CA8200B (3:1),11/21/2019 13:01,11/21/2019 13:01,0.0625,gal,1/27/2020 17:58,adminbomry,1,1,1,0,{'2020-01-27 17:58:53': 1},1,0
1511,Wichita KS,DefaultDept,(PL)Painting Ops-Down Draft Detail Booth (Bld.5D),Blend: CA8273I2236 - CA8200B (3:1),11/25/2019 13:09,11/25/2019 13:09,0.03125,gal,1/27/2020 18:00,adminbomry,1,1,1,0,{'2020-01-27 18:00:01': 1},1,0
1512,Wichita KS,DefaultDept,(PL)Painting Ops-Down Draft Detail Booth (Bld.5D),Blend: CA8273I2236 - CA8200B (3:1),12/28/2019 9:30,12/28/2019 9:30,0.03125,gal,1/14/2020 9:00,adminbomgb,1,1,1,0,{'2020-01-14 09:00:39': 1},1,0
1513,Wichita KS,DefaultDept,(PL)Painting Ops-Down Draft Detail Booth (Bld.5D),Blend: CA8273I2236 - CA8200B (3:1),12/29/2019 7:30,12/29/2019 7:30,0.0625,gal,1/14/2020 9:04,adminbomgb,1,1,1,0,{'2020-01-14 09:04:45': 1},1,0
1514,Wichita KS,DefaultDept,(PL)Painting Ops-Down Draft Detail Booth (Bld.5D),Blend: CA8273I2236 - CA8200B (3:1),1/21/2020 6:15,1/21/2020 6:15,0.0625,gal,4/28/2020 14:38,adminbomjs,1,1,1,0,{'2020-04-28 14:38:18': 1},1,0
1515,Wichita KS,DefaultDept,(PL)Painting Ops-Down Draft Detail Booth (Bld.5D),Blend: CA8273I2236 - CA8200B (3:1),1/25/2020 7:30,1/25/2020 7:30,0.03125,gal,4/28/2020 14:55,adminbomjs,1,1,1,0,{'2020-04-28 14:55:16': 1},1,0
1516,Wichita KS,DefaultDept,(PL)Painting Ops-Down Draft Detail Booth (Bld.5D),Blend: CA8273I2236 - CA8200B (3:1),12/28/2020 9:30,12/28/2020 9:30,0.03125,gal,1/5/2021 14:59,dlyon,1,1,1,0,{'2021-01-05 14:59:07': 1},1,0
1517,Wichita KS,DefaultDept,(PL)Painting Ops-Down Draft Detail Booth (Bld.5D),Blend: CA8273I2236 - CA8200B (3:1),12/29/2020 7:30,12/29/2020 7:30,0.0625,gal,1/5/2021 15:02,dlyon,1,1,1,0,{'2021-01-05 15:02:23': 1},1,0
1518,Wichita KS,DefaultDept,(PL)Painting Ops-Down Draft Detail Booth (Bld.5D),Blend: CA8273I2255 - CA 8200B - (3:1),9/11/2020 7:30,9/11/2020 7:30,0.0625,gal,1/6/2021 9:26,dlyon,1,1,1,0,{'2021-01-06 09:26:53': 1},1,0
1519,Wichita KS,DefaultDept,(PL)Painting Ops-Down Draft Detail Booth (Bld.5D),Blend: F63TXA 4892-8716 - V66V29 (6:1),7/17/2019 12:30,7/17/2019 12:30,0.046875,gal,9/18/2019 13:26,adminbomgb,1,1,1,0,{'2019-09-18 13:26:09': 1},1,0
1520,Wichita KS,DefaultDept,(PL)Painting Ops-Down Draft Detail Booth (Bld.5D),Blend: F63TXA 4892-8716 - V66V29 (6:1),9/15/2019 7:30,9/15/2019 7:30,0.091796875,gal,10/15/2019 15:48,adminbomgb,1,1,1,0,{'2019-10-15 15:48:22': 1},1,0
1521,Wichita KS,DefaultDept,(PL)Painting Ops-Down Draft Detail Booth (Bld.5D),Blend: F63TXA 4892-8716 - V66V29 (6:1),9/17/2019 11:45,9/17/2019 11:45,0.044921875,gal,10/15/2019 15:51,adminbomgb,1,1,1,0,{'2019-10-15 15:51:48': 1},1,0
1522,Wichita KS,DefaultDept,(PL)Painting Ops-Down Draft Detail Booth (Bld.5D),Blend: F63TXA 4892-8716 - V66V29 (6:1),12/18/2019 8:00,12/18/2019 8:00,0.109375,gal,1/14/2020 8:54,adminbomgb,1,1,1,0,{'2020-01-14 08:54:13': 1},1,0
1523,Wichita KS,DefaultDept,(PL)Painting Ops-Down Draft Detail Booth (Bld.5D),Blend: F63TXA 4892-8716 - V66V29 (6:1),12/19/2019 6:00,12/19/2019 6:00,0.0546875,gal,1/14/2020 8:56,adminbomgb,1,1,1,0,{'2020-01-14 08:56:15': 1},1,0
1524,Wichita KS,DefaultDept,(PL)Painting Ops-Down Draft Detail Booth (Bld.5D),Blend: F63TXA4892-8716 - N381-60258 (6:1),11/4/2019 0:00,11/4/2019 0:00,0.125,gal,1/28/2020 11:12,adminbomry,1,1,1,0,{'2020-01-28 11:12:28': 1},1,0
1525,Wichita KS,DefaultDept,(PL)Painting Ops-Down Draft Detail Booth (Bld.5D),Blend: F63TXA4892-8716 - N381-60258 (6:1),2/3/2020 14:11,2/3/2020 14:11,0.02734375,gal,5/7/2020 14:14,adminbomry,1,1,1,0,{'2020-05-07 14:14:11': 1},1,0
1526,Wichita KS,DefaultDept,(PL)Painting Ops-Down Draft Detail Booth (Bld.5D),Blend: F63TXA4892-8716 - N381-60258 (6:1),3/18/2020 13:30,3/18/2020 13:30,0.0546875,gal,5/13/2020 19:01,adminbomry,1,1,1,0,{'2020-05-13 19:01:20': 1},1,0
1527,Wichita KS,DefaultDept,(PL)Painting Ops-Down Draft Detail Booth (Bld.5D),Blend: F63TXA4892-8716 - N381-60258 (6:1),4/8/2020 0:00,4/8/2020 0:00,0.0546875,gal,6/10/2020 14:29,Kamiander,1,1,1,0,{'2020-06-10 14:29:49': 1},1,0
1528,Wichita KS,DefaultDept,(PL)Painting Ops-Down Draft Detail Booth (Bld.5D),Blend: F63TXA4892-8716 - N381-60258 (6:1),5/13/2020 0:00,5/13/2020 0:00,0.0546875,gal,6/18/2020 12:14,Kamiander,1,1,1,0,{'2020-06-18 12:14:58': 1},1,0
1529,Wichita KS,DefaultDept,(PL)Painting Ops-Down Draft Detail Booth (Bld.5D),Blend: F63TXA4892-8716 - N381-60258 (6:1),7/6/2020 0:00,7/6/2020 0:00,0.0546875,gal,8/26/2020 11:14,Kamiander,1,1,1,0,{'2020-08-26 11:14:07': 1},1,0
1530,Wichita KS,DefaultDept,(PL)Painting Ops-Down Draft Detail Booth (Bld.5D),Blend: F63TXA4892-8716 - N381-60258 (6:1),7/7/2020 0:00,7/7/2020 0:00,0.0546875,gal,8/26/2020 11:16,Kamiander,1,1,1,0,{'2020-08-26 11:16:18': 1},1,0
1531,Wichita KS,DefaultDept,(PL)Painting Ops-Down Draft Detail Booth (Bld.5D),Blend: F63TXA4892-8716 - N381-60258 (6:1),10/12/2020 13:00,10/12/2020 13:00,0.0546875,gal,1/5/2021 13:33,dlyon,1,1,1,0,{'2021-01-05 13:33:51': 1},1,0
1532,Wichita KS,DefaultDept,(PL)Painting Ops-Down Draft Detail Booth (Bld.5D),Blend: F63TXA4892-8716 - N381-60258 (6:1),12/18/2020 8:00,12/18/2020 8:00,0.109375,gal,1/5/2021 14:51,dlyon,1,1,1,0,{'2021-01-05 14:51:38': 1},1,0
1533,Wichita KS,DefaultDept,(PL)Painting Ops-Down Draft Detail Booth (Bld.5D),Blend: F63TXA4892-8716 - N381-60258 (6:1),12/19/2020 6:00,12/19/2020 6:00,0.0546875,gal,1/5/2021 14:54,dlyon,1,1,1,0,{'2021-01-05 14:54:00': 1},1,0
1534,Wichita KS,DefaultDept,(PL)Painting Ops-Down Draft Detail Booth (Bld.5D),Blend: F63TXA5316-8716 - V66V27 - (6:1),7/24/2020 0:00,7/24/2020 0:00,0.02734375,gal,8/26/2020 12:10,Kamiander,1,1,1,0,{'2020-08-26 12:10:05': 1},1,0
1535,Wichita KS,DefaultDept,(PL)Painting Ops-Down Draft Detail Booth (Bld.5D),Blend: F63TXA5316-8716 - V66V27 - (6:1),11/24/2020 12:30,11/24/2020 12:30,0.01953125,gal,1/5/2021 14:06,dlyon,1,1,1,0,{'2021-01-05 14:06:52': 1},1,0
1536,Wichita KS,DefaultDept,(PL)Painting Ops-Down Draft Detail Booth (Bld.5D),Blend: F63TXA5316-8716 - V66V27 - (6:1),12/10/2020 7:30,12/10/2020 7:30,0.02734375,gal,1/5/2021 14:42,dlyon,1,1,1,0,{'2021-01-05 14:42:04': 1},1,0
1537,Wichita KS,DefaultDept,(PL)Painting Ops-Down Draft Detail Booth (Bld.5D),Blend: F63TXA5316-8716 - V66V29 (6:1),12/10/2019 7:30,12/10/2019 7:30,0.02734375,gal,1/14/2020 8:33,adminbomgb,1,1,1,0,{'2020-01-14 08:33:44': 1},1,0
1538,Wichita KS,DefaultDept,(PL)Painting Ops-Down Draft Detail Booth (Bld.5D),Blend: F63TXA8225-8716 - V66V29 (6:1),9/19/2019 13:45,9/19/2019 13:45,0.044921875,gal,10/15/2019 15:57,adminbomgb,1,1,1,0,{'2019-10-15 15:57:44': 1},1,0
1539,Wichita KS,DefaultDept,(PL)Painting Ops-Down Draft Detail Booth (Bld.5D),Blend: F63TXA8375 - N381-60258 (4:1),11/20/2019 0:00,11/20/2019 0:00,0.0390625,gal,1/28/2020 13:58,adminbomry,1,1,1,0,{'2020-01-28 13:58:59': 1},1,0
1540,Wichita KS,DefaultDept,(PL)Painting Ops-Down Draft Detail Booth (Bld.5D),Blend: F63TXA979; N381-60258 (6:1),8/26/2020 0:00,8/26/2020 0:00,0.037109375,gal,9/24/2020 11:03,Kamiander,1,1,1,0,{'2020-09-24 11:03:01': 1},1,0
1541,Wichita KS,DefaultDept,(PL)Painting Ops-Down Draft Detail Booth (Bld.5D),Blend: F63TXB 0014-8716 - V66V29 (6:1),7/11/2019 8:00,7/11/2019 8:00,0.046875,gal,9/18/2019 13:25,adminbomgb,1,1,1,0,{'2019-09-18 13:25:22': 1},1,0
1542,Wichita KS,DefaultDept,(PL)Painting Ops-Down Draft Detail Booth (Bld.5D),Blend: F63TXB 0014-8716 - V66V29 (6:1),12/16/2019 12:00,12/16/2019 12:00,0.109375,gal,1/14/2020 8:37,adminbomgb,1,1,1,0,{'2020-01-14 08:37:44': 1},1,0
1543,Wichita KS,DefaultDept,(PL)Painting Ops-Down Draft Detail Booth (Bld.5D),Blend: F63TXB 0014-8716 - V66V29 - N381-60559 (6:1 + 33%),9/9/2019 9:30,9/9/2019 9:30,0.072916406,gal,10/15/2019 16:40,adminbomgb,1,1,1,0,{'2019-10-15 16:40:34': 1},1,0
1544,Wichita KS,DefaultDept,(PL)Painting Ops-Down Draft Detail Booth (Bld.5D),Blend: F63TXB 0014-8716 - V66V29 - N381-60559 (6:1 + 33%),9/14/2019 12:00,9/14/2019 12:00,0.072916406,gal,10/15/2019 16:49,adminbomgb,1,1,1,0,{'2019-10-15 16:49:45': 1},1,0
1545,Wichita KS,DefaultDept,(PL)Painting Ops-Down Draft Detail Booth (Bld.5D),Blend: F63TXB0014-8716 - N381-60258 (6:1),11/1/2019 0:00,11/1/2019 0:00,0.0546875,gal,1/28/2020 11:08,adminbomry,1,1,1,0,{'2020-01-28 11:08:54': 1},1,0
1546,Wichita KS,DefaultDept,(PL)Painting Ops-Down Draft Detail Booth (Bld.5D),Blend: F63TXB0014-8716 - N381-60258 (6:1),2/3/2020 13:54,2/3/2020 13:54,0.0546875,gal,5/7/2020 14:14,adminbomry,1,1,1,0,{'2020-05-07 14:14:53': 1},1,0
1547,Wichita KS,DefaultDept,(PL)Painting Ops-Down Draft Detail Booth (Bld.5D),Blend: F63TXB0014-8716 - N381-60258 (6:1),2/5/2020 14:20,2/5/2020 14:20,0.02734375,gal,5/7/2020 14:21,adminbomry,1,1,1,0,{'2020-05-07 14:21:11': 1},1,0
1548,Wichita KS,DefaultDept,(PL)Painting Ops-Down Draft Detail Booth (Bld.5D),Blend: F63TXB0014-8716 - N381-60258 (6:1),3/11/2020 19:50,3/11/2020 19:50,0.109375,gal,5/13/2020 13:33,adminbomry,1,1,1,0,{'2020-05-13 13:33:50': 1},1,0
1549,Wichita KS,DefaultDept,(PL)Painting Ops-Down Draft Detail Booth (Bld.5D),Blend: F63TXB0014-8716 - N381-60258 (6:1),3/17/2020 19:58,3/17/2020 19:58,0.0546875,gal,5/13/2020 13:35,adminbomry,1,1,1,0,{'2020-05-13 13:35:00': 1},1,0
1550,Wichita KS,DefaultDept,(PL)Painting Ops-Down Draft Detail Booth (Bld.5D),Blend: F63TXB0014-8716 - N381-60258 (6:1),4/6/2020 0:00,4/6/2020 0:00,0.109375,gal,6/10/2020 14:26,Kamiander,1,1,1,0,{'2020-06-10 14:26:48': 1},1,0
1551,Wichita KS,DefaultDept,(PL)Painting Ops-Down Draft Detail Booth (Bld.5D),Blend: F63TXB0014-8716 - N381-60258 (6:1),5/7/2020 0:00,5/7/2020 0:00,0.109375,gal,6/18/2020 12:05,Kamiander,1,1,1,0,{'2020-06-18 12:05:17': 1},1,0
1552,Wichita KS,DefaultDept,(PL)Painting Ops-Down Draft Detail Booth (Bld.5D),Blend: F63TXB0014-8716 - N381-60258 (6:1),5/11/2020 0:00,5/11/2020 0:00,0.0546875,gal,6/18/2020 12:07,Kamiander,1,1,1,0,{'2020-06-18 12:07:29': 1},1,0
1553,Wichita KS,DefaultDept,(PL)Painting Ops-Down Draft Detail Booth (Bld.5D),Blend: F63TXB0014-8716 - N381-60258 (6:1),7/6/2020 0:00,7/6/2020 0:00,0.0546875,gal,8/26/2020 11:12,Kamiander,1,1,1,0,{'2020-08-26 11:12:17': 1},1,0
1554,Wichita KS,DefaultDept,(PL)Painting Ops-Down Draft Detail Booth (Bld.5D),Blend: F63TXB0014-8716 - N381-60258 (6:1),7/20/2020 0:00,7/20/2020 0:00,0.02734375,gal,8/26/2020 11:59,Kamiander,1,1,1,0,{'2020-08-26 11:59:38': 1},1,0
1555,Wichita KS,DefaultDept,(PL)Painting Ops-Down Draft Detail Booth (Bld.5D),Blend: F63TXB0014-8716 - N381-60258 (6:1),12/16/2020 12:00,12/16/2020 12:00,0.109375,gal,1/5/2021 14:47,dlyon,1,1,1,0,{'2021-01-05 14:47:18': 1},1,0
1556,Wichita KS,DefaultDept,(PL)Painting Ops-Down Draft Detail Booth (Bld.5D),Blend: F63TXH 0651-8716 - V66V29 (6:1),8/25/2019 5:30,8/25/2019 5:30,0.046875,gal,9/18/2019 14:12,adminbomgb,1,1,1,0,{'2019-09-18 14:12:00': 1},1,0
1557,Wichita KS,DefaultDept,(PL)Painting Ops-Down Draft Detail Booth (Bld.5D),Blend: F63TXH 0651-8716 - V66V29 (6:1),9/18/2019 6:00,9/18/2019 6:00,0.109375,gal,10/15/2019 15:55,adminbomgb,1,1,1,0,{'2019-10-15 15:55:17': 1},1,0
1558,Wichita KS,DefaultDept,(PL)Painting Ops-Down Draft Detail Booth (Bld.5D),Blend: F63TXH 0651-8716 - V66V29 (6:1),9/23/2019 13:00,9/23/2019 13:00,0.0546875,gal,10/15/2019 15:58,adminbomgb,1,1,1,0,{'2019-10-15 15:58:45': 1},1,0
1559,Wichita KS,DefaultDept,(PL)Painting Ops-Down Draft Detail Booth (Bld.5D),Blend: F63TXH 0651-8716 - V66V29 (6:1),9/25/2019 12:00,9/25/2019 12:00,0.044921875,gal,10/15/2019 16:05,adminbomgb,1,1,1,0,{'2019-10-15 16:05:10': 1},1,0
1560,Wichita KS,DefaultDept,(PL)Painting Ops-Down Draft Detail Booth (Bld.5D),Blend: F63TXH 0651-8716 - V66V29 (6:1),12/20/2019 12:00,12/20/2019 12:00,0.0546875,gal,1/14/2020 8:59,adminbomgb,1,1,1,0,{'2020-01-14 08:59:14': 1},1,0
1561,Wichita KS,DefaultDept,(PL)Painting Ops-Down Draft Detail Booth (Bld.5D),Blend: F63TXH 0651-8716 - V66V29 (6:1),8/31/2020 0:00,8/31/2020 0:00,0.109375,gal,9/24/2020 10:56,Kamiander,1,1,1,0,{'2020-09-24 10:56:37': 1},1,0
1562,Wichita KS,DefaultDept,(PL)Painting Ops-Down Draft Detail Booth (Bld.5D),Blend: F63TXH 0651-8716 - V66V29 - N381-60559 (6:1 + 33%),9/10/2019 14:30,9/10/2019 14:30,0.072916406,gal,10/15/2019 16:44,adminbomgb,1,1,1,0,{'2019-10-15 16:44:06': 1},1,0
1563,Wichita KS,DefaultDept,(PL)Painting Ops-Down Draft Detail Booth (Bld.5D),Blend: F63TXH 2299-8716 - V66V29 (6:1),7/10/2019 9:30,7/10/2019 9:30,0.046875,gal,9/18/2019 13:24,adminbomgb,1,1,1,0,{'2019-09-18 13:24:31': 1},1,0
1564,Wichita KS,DefaultDept,(PL)Painting Ops-Down Draft Detail Booth (Bld.5D),Blend: F63TXH0651-8716 - N381-60258 (6:1),11/5/2019 0:00,11/5/2019 0:00,0.02734375,gal,1/28/2020 11:13,adminbomry,1,1,1,0,{'2020-01-28 11:13:48': 1},1,0
1565,Wichita KS,DefaultDept,(PL)Painting Ops-Down Draft Detail Booth (Bld.5D),Blend: F63TXH0651-8716 - N381-60258 (6:1),11/13/2019 0:00,11/13/2019 0:00,0.090625,gal,1/28/2020 11:15,adminbomry,1,1,1,0,{'2020-01-28 11:15:34': 1},1,0
1566,Wichita KS,DefaultDept,(PL)Painting Ops-Down Draft Detail Booth (Bld.5D),Blend: F63TXH0651-8716 - N381-60258 (6:1),1/21/2020 13:45,1/21/2020 13:45,0.109375,gal,5/22/2020 10:54,adminbomjs,1,1,1,0,{'2020-05-22 10:54:55': 1},1,0
1567,Wichita KS,DefaultDept,(PL)Painting Ops-Down Draft Detail Booth (Bld.5D),Blend: F63TXH0651-8716 - N381-60258 (6:1),3/30/2020 13:59,3/30/2020 13:59,0.02734375,gal,5/13/2020 14:01,adminbomry,1,1,1,0,{'2020-05-13 14:01:08': 1},1,0
1568,Wichita KS,DefaultDept,(PL)Painting Ops-Down Draft Detail Booth (Bld.5D),Blend: F63TXH0651-8716 - N381-60258 (6:1),3/31/2020 14:03,3/31/2020 14:03,0.109375,gal,5/13/2020 14:03,adminbomry,1,1,1,0,{'2020-05-13 14:03:40': 1},1,0
1569,Wichita KS,DefaultDept,(PL)Painting Ops-Down Draft Detail Booth (Bld.5D),Blend: F63TXH0651-8716 - N381-60258 (6:1),5/30/2020 0:00,5/30/2020 0:00,0.109375,gal,6/18/2020 12:26,Kamiander,1,1,1,0,{'2020-06-18 12:26:55': 1},1,0
1570,Wichita KS,DefaultDept,(PL)Painting Ops-Down Draft Detail Booth (Bld.5D),Blend: F63TXH0651-8716 - N381-60258 (6:1),7/9/2020 0:00,7/9/2020 0:00,0.02734375,gal,8/26/2020 11:21,Kamiander,1,1,1,0,{'2020-08-26 11:21:27': 1},1,0
1571,Wichita KS,DefaultDept,(PL)Painting Ops-Down Draft Detail Booth (Bld.5D),Blend: F63TXH0651-8716 - N381-60258 (6:1),8/27/2020 0:00,8/27/2020 0:00,0.02734375,gal,9/24/2020 10:53,Kamiander,1,1,1,0,{'2020-09-24 10:53:47': 1},1,0
1572,Wichita KS,DefaultDept,(PL)Painting Ops-Down Draft Detail Booth (Bld.5D),Blend: F63TXH0651-8716 - N381-60258 (6:1),10/12/2020 7:00,10/12/2020 7:00,0.0546875,gal,1/5/2021 13:04,dlyon,1,1,1,0,{'2021-01-05 13:04:18': 1},1,0
1573,Wichita KS,DefaultDept,(PL)Painting Ops-Down Draft Detail Booth (Bld.5D),Blend: F63TXH0651-8716 - N381-60258 (6:1),10/21/2020 10:00,10/21/2020 10:00,0.025390625,gal,1/5/2021 13:29,dlyon,1,1,1,0,{'2021-01-05 13:29:14': 1},1,0
1574,Wichita KS,DefaultDept,(PL)Painting Ops-Down Draft Detail Booth (Bld.5D),Blend: F63TXH0651-8716 - N381-60258 (6:1),11/30/2020 7:15,11/30/2020 7:15,0.109375,gal,1/5/2021 14:16,dlyon,1,1,1,0,{'2021-01-05 14:16:44': 1},1,0
1575,Wichita KS,DefaultDept,(PL)Painting Ops-Down Draft Detail Booth (Bld.5D),Blend: F63TXH0651-8716 - N381-60258 (6:1),12/20/2020 12:00,12/20/2020 12:00,0.0546875,gal,1/5/2021 14:57,dlyon,1,1,1,0,{'2021-01-05 14:57:36': 1},1,0
1576,Wichita KS,DefaultDept,(PL)Painting Ops-Down Draft Detail Booth (Bld.5D),Blend: F63TXH0785-8716 - V66V27 - (6:1),10/15/2020 13:00,10/15/2020 13:00,0.01953125,gal,1/5/2021 13:09,dlyon,1,1,1,0,{'2021-01-05 13:09:34': 1},1,0
1577,Wichita KS,DefaultDept,(PL)Painting Ops-Down Draft Detail Booth (Bld.5D),Blend: F63TXH4862-8716 - N381-60258 (6:1),11/7/2019 0:00,11/7/2019 0:00,0.03640625,gal,1/28/2020 13:33,adminbomry,1,1,1,0,{'2020-01-28 13:33:45': 1},1,0
1578,Wichita KS,DefaultDept,(PL)Painting Ops-Down Draft Detail Booth (Bld.5D),Blend: F63TXH8581-7500 - N381-60258 (6:1),1/10/2020 12:00,1/10/2020 12:00,0.0546875,gal,7/6/2020 10:55,adminbomjs,1,1,1,0,{'2020-07-06 10:55:54': 1},1,0
1579,Wichita KS,DefaultDept,(PL)Painting Ops-Down Draft Detail Booth (Bld.5D),Blend: F63TXH8843-8716 - N381-60258 (6:1),3/17/2020 13:27,3/17/2020 13:27,0.0546875,gal,5/13/2020 13:36,adminbomry,1,1,1,0,{'2020-05-13 13:36:02': 1},1,0
1580,Wichita KS,DefaultDept,(PL)Painting Ops-Down Draft Detail Booth (Bld.5D),Blend: F63TXN 1103-8716 - V66V29 (6:1),8/12/2019 7:30,8/12/2019 7:30,0.046875,gal,9/18/2019 13:51,adminbomgb,1,1,1,0,{'2019-09-18 13:51:54': 1},1,0
1581,Wichita KS,DefaultDept,(PL)Painting Ops-Down Draft Detail Booth (Bld.5D),Blend: F63TXW4986-7500 - N381-60258 (6:1),2/3/2020 0:13,2/3/2020 0:13,0.02734375,gal,8/19/2020 0:13,userbomry,1,1,1,0,{'2020-08-19 00:13:48': 1},1,0
1582,Wichita KS,DefaultDept,(PL)Painting Ops-Down Draft Detail Booth (Bld.5D),Blend: F63TXW4986-7500 - N381-60258 (6:1),12/19/2020 10:00,12/19/2020 10:00,0.0546875,gal,1/5/2021 14:56,dlyon,1,1,1,0,{'2021-01-05 14:56:23': 1},1,0
1583,Wichita KS,DefaultDept,(PL)Painting Ops-Down Draft Detail Booth (Bld.5D),Blend: F63TXW4986-8716 - V66V29 (6:1),12/19/2019 10:00,12/19/2019 10:00,0.0546875,gal,1/14/2020 8:57,adminbomgb,1,1,1,0,{'2020-01-14 08:57:28': 1},1,0
1584,Wichita KS,DefaultDept,(PL)Painting Ops-Down Draft Detail Booth (Bld.5D),Blend: F63TXW4986-8716 - V66V29 (6:1),4/8/2020 0:00,4/8/2020 0:00,0.02734375,gal,6/10/2020 14:44,Kamiander,1,1,1,0,{'2020-06-10 14:44:29': 1},1,0
1585,Wichita KS,DefaultDept,(PL)Painting Ops-Down Draft Detail Booth (Bld.5D),Blend: PF-21-BK1 - PH-73 (1:1),6/6/2020 0:00,6/6/2020 0:00,0.0625,gal,8/28/2020 12:28,Kamiander,1,1,1,0,{'2020-08-28 12:28:44': 1},1,0
1586,Wichita KS,DefaultDept,(PL)Painting Ops-Down Draft Detail Booth (Bld.5D),Blend: PF-21-BK1 - PH-73 (1:1),7/1/2020 0:00,7/1/2020 0:00,0.03125,gal,8/28/2020 12:32,Kamiander,1,1,1,0,{'2020-08-28 12:32:19': 1},1,0
1587,Wichita KS,DefaultDept,(PL)Painting Ops-Down Draft Detail Booth (Bld.5D),Blend: PF-21-BK1 - PH-73 (1:1),7/8/2020 0:00,7/8/2020 0:00,0.046875,gal,8/28/2020 12:34,Kamiander,1,1,1,0,{'2020-08-28 12:34:35': 1},1,0
1588,Wichita KS,DefaultDept,(PL)Painting Ops-Down Draft Detail Booth (Bld.5D),Blend: PF-21-BK1 - PH-73 (1:1),7/13/2020 0:00,7/13/2020 0:00,0.046875,gal,8/28/2020 12:36,Kamiander,1,1,1,0,{'2020-08-28 12:36:11': 1},1,0
1589,Wichita KS,DefaultDept,(PL)Painting Ops-Down Draft Detail Booth (Bld.5D),Blend: PF-21-BK1 - PH-73 (1:1),8/25/2020 0:00,8/25/2020 0:00,0.046875,gal,9/24/2020 10:45,Kamiander,1,1,1,0,{'2020-09-24 10:45:23': 1},1,0
1590,Wichita KS,DefaultDept,(PL)Painting Ops-Down Draft Detail Booth (Bld.5D),Blend: PF-21-BK1 - PH-73 (1:1),8/26/2020 0:00,8/26/2020 0:00,0.03125,gal,9/24/2020 10:50,Kamiander,1,1,1,0,{'2020-09-24 10:50:12': 1},1,0
1591,Wichita KS,DefaultDept,(PL)Painting Ops-Down Draft Detail Booth (Bld.5D),CA 8200B M&D ACTIVATOR/CA 8211/F37038 BASE COMPONENT BLEND,1/24/2019 10:43,1/24/2019 10:43,0.0234375,gal,1/24/2019 10:43,adminbomcr,1,1,1,0,{'2019-01-24 10:43:04': 1},1,0
1592,Wichita KS,DefaultDept,(PL)Painting Ops-Down Draft Detail Booth (Bld.5D),CA 8211/F37038 - CA 8200B Activator,1/24/2019 10:58,1/24/2019 10:58,0.0234375,gal,1/24/2019 10:58,adminbomna,1,1,1,0,{'2019-01-24 10:58:36': 1},1,0
1593,Wichita KS,DefaultDept,(PL)Painting Ops-Down Draft Detail Booth (Bld.5D),CA 8211/F37038 - CA 8200B Activator,1/24/2019 11:00,1/24/2019 11:00,0.03125,gal,1/24/2019 11:00,adminbomcb,1,1,1,0,{'2019-01-24 11:00:12': 1},1,0
1594,Wichita KS,DefaultDept,(PL)Painting Ops-Down Draft Detail Booth (Bld.5D),CA 8223/F27038 BASE/ CA 8200B ACTIVATOR BLEND,1/24/2019 10:35,1/24/2019 10:35,0.046875,gal,1/24/2019 10:35,adminbomna,1,1,1,0,{'2019-01-24 10:35:10': 1},1,0
1595,Wichita KS,DefaultDept,(PL)Painting Ops-Down Draft Detail Booth (Bld.5D),CA 8273 I1149 BASE/ CA 8200B Activator Fly Away Kit,1/24/2019 9:50,1/24/2019 9:50,0.03125,gal,1/24/2019 9:50,adminbomry,1,1,1,0,{'2019-01-24 09:50:33': 1},1,0
1596,Wichita KS,DefaultDept,(PL)Painting Ops-Down Draft Detail Booth (Bld.5D),CA 8273 I1149 BASE/ CA 8200B Activator Fly Away Kit,1/24/2019 13:30,1/24/2019 13:30,0.046875,gal,1/24/2019 13:30,adminbomna,1,1,1,0,{'2019-01-24 13:30:54': 1},1,0
1597,Wichita KS,DefaultDept,(PL)Painting Ops-Down Draft Detail Booth (Bld.5D),CA 8273 I1149 BASE/ CA 8200B Activator Fly Away Kit,1/24/2019 13:39,1/24/2019 13:39,0.0234375,gal,1/24/2019 13:39,adminbomna,1,1,1,0,{'2019-01-24 13:39:03': 1},1,0
1598,Wichita KS,DefaultDept,(PL)Painting Ops-Down Draft Detail Booth (Bld.5D),CA 8273/F36118 Base Component - CA 8200B Activator Blend_old,1/24/2019 9:41,1/24/2019 9:41,0.015625,gal,1/24/2019 9:42,adminbomry,1,1,1,0,{'2019-01-24 09:42:00': 1},1,0
1599,Wichita KS,DefaultDept,(PL)Painting Ops-Down Draft Detail Booth (Bld.5D),CA 8273/F36118 Base Component - CA 8200B Activator Blend_old,1/24/2019 10:48,1/24/2019 10:48,0.0234375,gal,1/24/2019 10:48,adminbomcr,1,1,1,0,{'2019-01-24 10:48:37': 1},1,0
1600,Wichita KS,DefaultDept,(PL)Painting Ops-Down Draft Detail Booth (Bld.5D),CA 8273/F36118 Base Component - CA 8200B Activator Blend_old,1/24/2019 10:56,1/24/2019 10:56,0.03125,gal,1/24/2019 10:56,adminbomcb,1,1,1,0,{'2019-01-24 10:56:05': 1},1,0
1601,Wichita KS,DefaultDept,(PL)Painting Ops-Down Draft Detail Booth (Bld.5D),CA 8273/F36118 Base Component - CA 8200B Activator Blend_old,1/24/2019 11:37,1/24/2019 11:37,0.046875,gal,1/24/2019 11:37,adminbomsn,1,1,1,0,{'2019-01-24 11:37:12': 1},1,0
1602,Wichita KS,DefaultDept,(PL)Painting Ops-Down Draft Detail Booth (Bld.5D),CA 8273/I1149 BASE/ CA 8200B M&D ACTIVATOR BLEND,1/24/2019 10:51,1/24/2019 10:51,0.0234375,gal,1/24/2019 10:51,adminbomcr,1,1,1,0,{'2019-01-24 10:51:10': 1},1,0
1603,Wichita KS,DefaultDept,(PL)Painting Ops-Down Draft Detail Booth (Bld.5D),CA 8273/I1149 BASE/ CA 8200B M&D ACTIVATOR BLEND,1/24/2019 11:01,1/24/2019 11:01,0.046875,gal,1/24/2019 11:01,adminbomcr,1,1,1,0,{'2019-01-24 11:01:38': 1},1,0
1604,Wichita KS,DefaultDept,(PL)Painting Ops-Down Draft Detail Booth (Bld.5D),CA 8273/I1375 Base Component- CA8200B Activator Blend,1/24/2019 10:13,1/24/2019 10:13,0.0234375,gal,1/24/2019 10:13,adminbomcb,1,1,1,0,{'2019-01-24 10:13:40': 1},1,0
1605,Wichita KS,DefaultDept,(PL)Painting Ops-Down Draft Detail Booth (Bld.5D),CA 8273/I1375 Base Component- CA8200B Activator Blend,1/24/2019 12:02,1/24/2019 12:02,0.046875,gal,1/24/2019 12:02,adminbomsn,1,1,1,0,{'2019-01-24 12:02:51': 1},1,0
1606,Wichita KS,DefaultDept,(PL)Painting Ops-Down Draft Detail Booth (Bld.5D),CA 8273/I1375 Base Component- CA8200B Activator Blend,1/25/2019 8:57,1/25/2019 8:57,0.0234375,gal,1/25/2019 8:57,adminbomcr,1,1,1,0,{'2019-01-25 08:57:20': 1},1,0
1607,Wichita KS,DefaultDept,(PL)Painting Ops-Down Draft Detail Booth (Bld.5D),CA 8273/I1376 BASE/ CA 8200B Activator Fly away kit,1/24/2019 10:19,1/24/2019 10:19,0.046875,gal,1/24/2019 10:19,adminbomcb,1,1,1,0,{'2019-01-24 10:19:25': 1},1,0
1608,Wichita KS,DefaultDept,(PL)Painting Ops-Down Draft Detail Booth (Bld.5D),CA 8273/I1376 BASE/ CA 8200B Activator Fly away kit,1/24/2019 10:32,1/24/2019 10:32,0.03125,gal,1/24/2019 10:32,adminbomcb,1,1,1,0,{'2019-01-24 10:32:31': 1},1,0
1609,Wichita KS,DefaultDept,(PL)Painting Ops-Down Draft Detail Booth (Bld.5D),CA 8273/I1376 BASE/ CA 8200B Activator Fly away kit,1/24/2019 10:43,1/24/2019 10:43,0.0234375,gal,1/24/2019 10:43,adminbomna,1,1,1,0,{'2019-01-24 10:43:35': 1},1,0
1610,Wichita KS,DefaultDept,(PL)Painting Ops-Down Draft Detail Booth (Bld.5D),CA 8273/I1376 BASE/ CA 8200B Activator Fly away kit,1/25/2019 8:49,1/25/2019 8:49,0.0234375,gal,1/25/2019 8:49,adminbomcr,1,1,1,0,{'2019-01-25 08:49:46': 1},1,0
1611,Wichita KS,DefaultDept,(PL)Painting Ops-Down Draft Detail Booth (Bld.5D),CA 8273/I1412 Base Component - CA 8200B M&D Activator Blend,1/24/2019 15:31,1/24/2019 15:31,0.0234375,gal,1/24/2019 15:31,adminbomsn,1,1,1,0,{'2019-01-24 15:31:55': 1},1,0
1612,Wichita KS,DefaultDept,(PL)Painting Ops-Down Draft Detail Booth (Bld.5D),CA 8273/I2238 Base Component - CA 82000B Activator Blend,1/24/2019 11:18,1/24/2019 11:18,0.0234375,gal,1/24/2019 11:18,adminbomsn,1,1,1,0,{'2019-01-24 11:18:38': 1},1,0
1613,Wichita KS,DefaultDept,(PL)Painting Ops-Down Draft Detail Booth (Bld.5D),CA 8273/I2247 - CA 8200B M&D ACTIVATOR,1/24/2019 11:22,1/24/2019 11:22,0.03125,gal,1/24/2019 11:22,adminbomcb,1,1,1,0,{'2019-01-24 11:22:10': 1},1,0
1614,Wichita KS,DefaultDept,(PL)Painting Ops-Down Draft Detail Booth (Bld.5D),CA 8273/I2247 - CA 8200B M&D ACTIVATOR,1/24/2019 11:33,1/24/2019 11:33,0.0234375,gal,1/24/2019 11:33,adminbomsn,1,1,1,0,{'2019-01-24 11:33:03': 1},1,0
1615,Wichita KS,DefaultDept,(PL)Painting Ops-Down Draft Detail Booth (Bld.5D),CA 8273/I2335 Base Component - CA 8200B Activator Blend,1/24/2019 10:50,1/24/2019 10:50,0.03125,gal,1/24/2019 10:50,adminbomcb,1,1,1,0,{'2019-01-24 10:50:27': 1},1,0
1616,Wichita KS,DefaultDept,(PL)Painting Ops-Down Draft Detail Booth (Bld.5D),CA 8273/I2335 Base Component - CA 8200B Activator Blend,1/25/2019 9:02,1/25/2019 9:02,0.0234375,gal,1/25/2019 9:02,adminbomcr,1,1,1,0,{'2019-01-25 09:02:15': 1},1,0
1617,Wichita KS,DefaultDept,(PL)Painting Ops-Down Draft Detail Booth (Bld.5D),CA 8273/I2958 Base - CA 8200B Activator,1/24/2019 10:52,1/24/2019 10:52,0.0234375,gal,1/24/2019 10:52,adminbomsn,1,1,1,0,{'2019-01-24 10:52:02': 1},1,0
1618,Wichita KS,DefaultDept,(PL)Painting Ops-Down Draft Detail Booth (Bld.5D),CA 8273/I2958 Base - CA 8200B Activator,1/20/2020 12:00,1/20/2020 12:00,0.03125,gal,4/28/2020 14:35,adminbomjs,1,1,1,0,{'2020-04-28 14:35:39': 1},1,0
1619,Wichita KS,DefaultDept,(PL)Painting Ops-Down Draft Detail Booth (Bld.5D),CA 8273/I2958 Base - CA 8200B Activator,5/20/2020 0:00,5/20/2020 0:00,0.0625,gal,6/18/2020 12:32,Kamiander,1,1,1,0,{'2020-06-18 12:32:49': 1},1,0
1620,Wichita KS,DefaultDept,(PL)Painting Ops-Down Draft Detail Booth (Bld.5D),CA 8273/I2958 Base - CA 8200B Activator,6/13/2020 0:00,6/13/2020 0:00,0.0625,gal,7/27/2020 16:22,Kamiander,1,1,1,0,{'2020-07-27 16:22:56': 1},1,0
1621,Wichita KS,DefaultDept,(PL)Painting Ops-Down Draft Detail Booth (Bld.5D),CA 8273/I2958 Base - CA 8200B Activator,6/17/2020 0:00,6/17/2020 0:00,0.03125,gal,7/27/2020 16:26,Kamiander,1,1,1,0,{'2020-07-27 16:26:31': 1},1,0
1622,Wichita KS,DefaultDept,(PL)Painting Ops-Down Draft Detail Booth (Bld.5D),CA 8273/I2958 Base - CA 8200B Activator,6/19/2020 0:00,6/19/2020 0:00,0.0625,gal,7/27/2020 16:33,Kamiander,1,1,1,0,{'2020-07-27 16:33:20': 1},1,0
1623,Wichita KS,DefaultDept,(PL)Painting Ops-Down Draft Detail Booth (Bld.5D),CA 8273/I2958 Base - CA 8200B Activator,7/14/2020 0:00,7/14/2020 0:00,0.03125,gal,8/26/2020 11:46,Kamiander,1,1,1,0,{'2020-08-26 11:46:31': 1},1,0
1624,Wichita KS,DefaultDept,(PL)Painting Ops-Down Draft Detail Booth (Bld.5D),CA 8273/I2958 Base - CA 8200B Activator,8/12/2020 0:00,8/12/2020 0:00,0.0625,gal,9/24/2020 10:18,Kamiander,1,1,1,0,{'2020-09-24 10:18:27': 1},1,0
1625,Wichita KS,DefaultDept,(PL)Painting Ops-Down Draft Detail Booth (Bld.5D),CA 8273/I2958 Base - CA 8200B Activator,8/13/2020 0:00,8/13/2020 0:00,0.0625,gal,9/24/2020 10:20,Kamiander,1,1,1,0,{'2020-09-24 10:20:00': 1},1,0
1626,Wichita KS,DefaultDept,(PL)Painting Ops-Down Draft Detail Booth (Bld.5D),CA 8273/I2958 Base - CA 8200B Activator,8/25/2020 0:00,8/25/2020 0:00,0.0625,gal,9/24/2020 10:48,Kamiander,1,1,1,0,{'2020-09-24 10:48:24': 1},1,0
1627,Wichita KS,DefaultDept,(PL)Painting Ops-Down Draft Detail Booth (Bld.5D),CA 8273/I2958 Base - CA 8200B Activator,9/2/2020 8:30,9/2/2020 8:30,0.0625,gal,10/27/2020 10:35,dlyon,1,1,1,0,{'2020-10-27 10:35:46': 1},1,0
1628,Wichita KS,DefaultDept,(PL)Painting Ops-Down Draft Detail Booth (Bld.5D),CA 8273/I2958 Base - CA 8200B Activator,9/3/2020 6:00,9/3/2020 6:00,0.03125,gal,10/27/2020 10:37,dlyon,1,1,1,0,{'2020-10-27 10:37:34': 1},1,0
1629,Wichita KS,DefaultDept,(PL)Painting Ops-Down Draft Detail Booth (Bld.5D),CA 8273/I2958 Base - CA 8200B Activator,9/9/2020 10:00,9/9/2020 10:00,0.0625,gal,10/27/2020 10:40,dlyon,1,1,1,0,{'2020-10-27 10:40:25': 1},1,0
1630,Wichita KS,DefaultDept,(PL)Painting Ops-Down Draft Detail Booth (Bld.5D),CA 8273/I2958 Base - CA 8200B Activator,9/18/2020 6:00,9/18/2020 6:00,0.0625,gal,10/27/2020 11:19,dlyon,1,1,1,0,{'2020-10-27 11:19:43': 1},1,0
1631,Wichita KS,DefaultDept,(PL)Painting Ops-Down Draft Detail Booth (Bld.5D),CA 8273/I2958 Base - CA 8200B Activator,10/6/2020 9:45,10/6/2020 9:45,0.0625,gal,1/5/2021 12:48,dlyon,1,1,1,0,{'2021-01-05 12:48:48': 1},1,0
1632,Wichita KS,DefaultDept,(PL)Painting Ops-Down Draft Detail Booth (Bld.5D),CA 8273/I2958 Base - CA 8200B Activator,10/8/2020 8:00,10/8/2020 8:00,0.03125,gal,1/5/2021 13:00,dlyon,1,1,1,0,{'2021-01-05 13:00:27': 1},1,0
1633,Wichita KS,DefaultDept,(PL)Painting Ops-Down Draft Detail Booth (Bld.5D),CA 8273/I2958 Base - CA 8200B Activator,10/13/2020 12:45,10/13/2020 12:45,0.03125,gal,1/5/2021 13:06,dlyon,1,1,1,0,{'2021-01-05 13:06:14': 1},1,0
1634,Wichita KS,DefaultDept,(PL)Painting Ops-Down Draft Detail Booth (Bld.5D),CA 8273/I2958 Base - CA 8200B Activator,11/12/2020 8:00,11/12/2020 8:00,0.03125,gal,1/5/2021 13:45,dlyon,1,1,1,0,{'2021-01-05 13:45:01': 1},1,0
1635,Wichita KS,DefaultDept,(PL)Painting Ops-Down Draft Detail Booth (Bld.5D),CA 8273/I7100 Base - CA 8200B Activator,1/24/2019 14:31,1/24/2019 14:31,0.0234375,gal,1/24/2019 14:31,adminbomcr,1,1,1,0,{'2019-01-24 14:31:03': 1},1,0
1636,Wichita KS,DefaultDept,(PL)Painting Ops-Down Draft Detail Booth (Bld.5D),CA 8273/I7162 BASE/ CA 8200B ACTIVATOR BLEND,1/24/2019 11:18,1/24/2019 11:18,0.0234375,gal,1/24/2019 11:19,adminbomna,1,1,1,0,{'2019-01-24 11:19:00': 1},1,0
1637,Wichita KS,DefaultDept,(PL)Painting Ops-Down Draft Detail Booth (Bld.5D),CA 8273/I7177 BASE / CA 8200B ACTIVATOR BLEND,7/20/2020 0:00,7/20/2020 0:00,0.0625,gal,8/26/2020 11:57,Kamiander,1,1,1,0,{'2020-08-26 11:57:03': 1},1,0
1638,Wichita KS,DefaultDept,(PL)Painting Ops-Down Draft Detail Booth (Bld.5D),CA 8273/I7177 BASE / CA 8200B ACTIVATOR BLEND,7/22/2020 0:00,7/22/2020 0:00,0.03125,gal,8/26/2020 12:03,Kamiander,1,1,1,0,{'2020-08-26 12:03:01': 1},1,0
1639,Wichita KS,DefaultDept,(PL)Painting Ops-Down Draft Detail Booth (Bld.5D),CA 8273/I7221 BASE COMPONENT - CA 8200B ACTIVATOR COMPONENT,1/24/2019 11:56,1/24/2019 11:56,0.0234375,gal,1/24/2019 11:56,adminbomsn,1,1,1,0,{'2019-01-24 11:56:19': 1},1,0
1640,Wichita KS,DefaultDept,(PL)Painting Ops-Down Draft Detail Booth (Bld.5D),CA 8273/I7221 BASE COMPONENT - CA 8200B ACTIVATOR COMPONENT,1/24/2019 14:35,1/24/2019 14:35,0.046875,gal,1/24/2019 14:35,adminbomsn,1,1,1,0,{'2019-01-24 14:35:21': 1},1,0
1641,Wichita KS,DefaultDept,(PL)Painting Ops-Down Draft Detail Booth (Bld.5D),CA 8273/I7739 BASE COMPONENT - CA 8200B Activator,1/24/2019 15:14,1/24/2019 15:14,0.0234375,gal,1/24/2019 15:14,adminbomsn,1,1,1,0,{'2019-01-24 15:14:52': 1},1,0
1642,Wichita KS,DefaultDept,(PL)Painting Ops-Down Draft Detail Booth (Bld.5D),CA 8273/I8012 BASE/ CA 8200B ACTIVATOR BLEND,1/24/2019 11:30,1/24/2019 11:30,0.015625,gal,1/24/2019 11:30,adminbomcb,1,1,1,0,{'2019-01-24 11:30:20': 1},1,0
1643,Wichita KS,DefaultDept,(PL)Painting Ops-Down Draft Detail Booth (Bld.5D),CA8273/I2A48 Base Component (3 part) - 8200B Activator (1 part),1/7/2020 6:00,1/7/2020 6:00,0.03125,gal,4/30/2020 16:54,adminbomjs,1,1,1,0,{'2020-04-30 16:54:16': 1},1,0
1644,Wichita KS,DefaultDept,(PL)Painting Ops-Down Draft Detail Booth (Bld.5D),CA8273/I2A48 Base Component (3 part) - 8200B Activator (1 part),3/10/2020 19:46,3/10/2020 19:46,0.0625,gal,5/13/2020 13:31,adminbomry,1,1,1,0,{'2020-05-13 13:31:43': 1},1,0
1645,Wichita KS,DefaultDept,(PL)Painting Ops-Down Draft Detail Booth (Bld.5D),CA8273/I2A48 Base Component (3 part) - 8200B Activator (1 part),3/20/2020 13:55,3/20/2020 13:55,0.0625,gal,5/13/2020 13:55,adminbomry,1,1,1,0,{'2020-05-13 13:55:59': 1},1,0
1646,Wichita KS,DefaultDept,(PL)Painting Ops-Down Draft Detail Booth (Bld.5D),F63TXW1671-7500 - N381-60258 (6:1),7/1/2020 0:00,7/1/2020 0:00,0.02734375,gal,8/26/2020 16:45,Kamiander,1,1,1,0,{'2020-08-26 16:45:01': 1},1,0
1647,Wichita KS,DefaultDept,(PL)Painting Ops-Down Draft Detail Booth (Bld.5D),Fluid Resistant Epoxy 10P4-2NF BLEND -2QT,8/12/2020 0:00,8/12/2020 0:00,0.046875,gal,9/24/2020 10:15,Kamiander,1,1,1,0,{'2020-09-24 10:15:30': 1},1,0
1648,Wichita KS,DefaultDept,(PL)Painting Ops-Down Draft Detail Booth (Bld.5D),"UST-920, USC-902, Red-913 (2:1:.15)",8/13/2020 0:00,8/13/2020 0:00,0.043588388,gal,9/24/2020 11:11,Kamiander,1,1,1,0,{'2020-09-24 11:11:21': 1},1,0
1649,Wichita KS,DefaultDept,(PL)Painting Ops-Down Draft Detail Booth (Bld.5D),"UST-920, USC-902, Red-913 (2:1:.15)",8/18/2020 0:00,8/18/2020 0:00,0.217941942,gal,9/24/2020 11:13,Kamiander,1,1,1,0,{'2020-09-24 11:13:55': 1},1,0
1650,Wichita KS,DefaultDept,003_01_Depainting,Ardrox 2865,1/3/2019 0:00,1/3/2019 0:00,110,gal,1/24/2020 18:46,adminbomed,1,1,1,0,{'2020-01-24 18:46:13': 1},1,0
1651,Wichita KS,DefaultDept,003_01_Depainting,Ardrox 2865,6/18/2019 0:00,6/18/2019 0:00,220,gal,1/24/2020 18:46,adminbomed,1,1,1,0,{'2020-01-24 18:46:04': 1},1,0
1652,Wichita KS,DefaultDept,003_01_Depainting,Ardrox 2865,8/19/2019 0:00,8/19/2019 0:00,106,gal,1/27/2020 11:17,adminbomed,1,1,1,0,{'2020-01-27 11:17:21': 1},1,0
1653,Wichita KS,DefaultDept,003_01_Depainting,Ardrox 2865,10/1/2019 0:00,10/1/2019 0:00,106,gal,1/27/2020 11:18,adminbomed,1,1,1,0,{'2020-01-27 11:18:35': 1},1,0
1654,Wichita KS,DefaultDept,003_01_Depainting,Ardrox 2865,5/4/2020 0:00,5/4/2020 0:00,106,gal,8/6/2020 10:30,dlyon,1,1,1,0,{'2020-08-06 10:30:07': 1},1,0
1655,Wichita KS,DefaultDept,003_01_Depainting,Ardrox 2865,9/17/2020 0:00,9/17/2020 0:00,212,gal,10/26/2020 11:47,dlyon,1,1,1,0,{'2020-10-26 11:47:25': 1},1,0
1656,Wichita KS,DefaultDept,004_01_Cold Solvents,36696,3/4/2019 0:00,3/4/2019 0:00,110,gal,1/27/2020 13:25,adminbomed,1,1,1,0,{'2020-01-27 13:25:10': 1},1,0
1657,Wichita KS,DefaultDept,004_01_Cold Solvents,36696,3/8/2019 0:00,3/8/2019 0:00,110,gal,1/27/2020 13:25,adminbomed,1,1,1,0,{'2020-01-27 13:25:18': 1},1,0
1658,Wichita KS,DefaultDept,004_01_Cold Solvents,36696,9/9/2019 0:00,9/9/2019 0:00,110,gal,1/27/2020 13:25,adminbomed,1,1,1,0,{'2020-01-27 13:25:27': 1},1,0
1659,Wichita KS,DefaultDept,004_01_Cold Solvents,SKD S2 Aerosol,10/13/2020 12:00,10/13/2020 12:00,1.25,gal,12/14/2020 12:27,dlyon,1,1,1,0,{'2020-12-14 12:27:16': 1},1,0
1660,Wichita KS,DefaultDept,004_01_Cold Solvents,WypAll Waterless Cleaning Wipes,12/9/2020 0:00,12/9/2020 0:00,18,gal,1/11/2021 11:35,dlyon,1,1,1,0,{'2021-01-11 11:35:28': 1},1,0
1661,Wichita KS,DefaultDept,005_01_PaintPrimers,A-702 GREEN ZINC PHOSPHATE PRIMER,5/7/2019 0:00,5/7/2019 0:00,0.125,gal,7/9/2019 8:19,adminbomgb,1,1,1,0,{'2019-07-09 08:19:34': 1},1,0
1662,Wichita KS,DefaultDept,005_01_PaintPrimers,A-702 GREEN ZINC PHOSPHATE PRIMER,5/17/2019 0:00,5/17/2019 0:00,3,gal,7/9/2019 8:19,adminbomgb,1,1,1,0,{'2019-07-09 08:19:34': 1},1,0
1663,Wichita KS,DefaultDept,005_01_PaintPrimers,A-702 GREEN ZINC PHOSPHATE PRIMER,11/5/2019 12:00,11/5/2019 12:00,3,gal,1/8/2020 15:58,adminbomry,1,1,1,0,{'2020-01-08 15:58:27': 1},1,0
1664,Wichita KS,DefaultDept,005_01_PaintPrimers,A-A-3165 #17875   Gallon Kit,5/27/2020 12:00,5/27/2020 12:00,1,gal,8/4/2020 15:47,bomamanda,1,1,1,0,{'2020-08-04 15:47:02': 1},1,0
1665,Wichita KS,DefaultDept,005_01_PaintPrimers,AD1158,1/11/2019 0:00,1/11/2019 0:00,9,gal,7/4/2019 11:02,adminbomry,1,1,1,0,{'2019-07-04 11:02:08': 1},1,0
1666,Wichita KS,DefaultDept,005_01_PaintPrimers,AD9037,3/19/2020 12:00,3/19/2020 12:00,12,gal,7/14/2020 19:38,adminbomry,1,1,1,0,{'2020-07-14 19:38:52': 1},1,0
1667,Wichita KS,DefaultDept,005_01_PaintPrimers,BONDERITE M-CR 600RTU AERO known as ALODINE 600 RTU,3/1/2020 0:00,3/31/2020 0:00,107.8437844,gal,8/19/2020 18:03,adminbomed,1,1,1,0,{'2020-08-19 18:03:50': 1},1,0
1668,Wichita KS,DefaultDept,005_01_PaintPrimers,BONDERITE M-CR 600RTU AERO known as ALODINE 600 RTU,3/16/2020 0:00,3/16/2020 0:00,110,gal,8/7/2020 10:23,adminbomry,1,1,1,0,{'2020-08-07 10:23:42': 1},1,0
1669,Wichita KS,DefaultDept,005_01_PaintPrimers,BONDERITE M-CR 600RTU AERO known as ALODINE 600 RTU,4/1/2020 0:00,4/30/2020 0:00,53.92189222,gal,8/19/2020 18:13,adminbomed,1,1,1,0,{'2020-08-19 18:13:54': 1},1,0
1670,Wichita KS,DefaultDept,005_01_PaintPrimers,BONDERITE M-CR 600RTU AERO known as ALODINE 600 RTU,7/1/2020 0:00,7/31/2020 0:00,53.92189222,gal,8/6/2020 8:38,dlyon,1,1,1,0,{'2020-08-06 08:38:13': 1},1,0
1671,Wichita KS,DefaultDept,005_01_PaintPrimers,BONDERITE M-CR 600RTU AERO known as ALODINE 600 RTU,7/28/2020 0:00,7/28/2020 0:00,53.92189222,gal,10/26/2020 11:42,dlyon,1,1,1,0,{'2020-10-26 11:42:20': 1},1,0
1672,Wichita KS,DefaultDept,005_01_PaintPrimers,BONDERITE M-CR 600RTU AERO known as ALODINE 600 RTU,9/1/2020 0:00,9/30/2020 0:00,161.7656767,gal,10/7/2020 9:49,dlyon,1,1,1,0,{'2020-10-07 09:49:15': 1},1,0
1673,Wichita KS,DefaultDept,005_01_PaintPrimers,BONDERITE M-CR 600RTU AERO known as ALODINE 600 RTU,9/18/2020 0:00,9/18/2020 0:00,161.7656767,gal,10/26/2020 11:24,dlyon,1,1,1,0,{'2020-10-26 11:24:28': 1},1,0
1674,Wichita KS,DefaultDept,005_01_PaintPrimers,Blend: 10P8-10NF - EC-283 (1:1),12/15/2020 12:00,12/15/2020 12:00,0.09375,gal,1/8/2021 9:12,dlyon,1,1,1,0,{'2021-01-08 09:12:15': 1},1,0
1675,Wichita KS,DefaultDept,005_01_PaintPrimers,Blend: 10P8-10NF - EC-283 (1:1),12/16/2020 12:00,12/16/2020 12:00,0.15625,gal,1/8/2021 9:12,dlyon,1,1,1,0,{'2021-01-08 09:12:15': 1},1,0
1676,Wichita KS,DefaultDept,005_01_PaintPrimers,Blend: 10P8-10NF - EC-283 (1:1),12/22/2020 12:00,12/22/2020 12:00,0.28125,gal,1/8/2021 9:12,dlyon,1,1,1,0,{'2021-01-08 09:12:15': 1},1,0
1677,Wichita KS,DefaultDept,005_01_PaintPrimers,Blend: SP350 Blend (8:1:1),2/27/2020 12:00,2/27/2020 12:00,18,gal,8/19/2020 15:19,adminbomry,1,1,1,0,{'2020-08-19 15:19:16': 1},1,0
1678,Wichita KS,DefaultDept,005_01_PaintPrimers,Blend: SP350 Blend (8:1:1),4/28/2020 12:00,4/28/2020 12:00,5,gal,8/18/2020 8:47,dlyon,1,1,1,0,{'2020-08-18 08:47:06': 1},1,0
1679,Wichita KS,DefaultDept,005_01_PaintPrimers,Blend: SP350 Blend (8:1:1),7/11/2020 12:00,7/11/2020 12:00,5,gal,9/4/2020 10:06,dlyon,1,1,1,0,{'2020-09-04 10:06:12': 1},1,0
1680,Wichita KS,DefaultDept,005_01_PaintPrimers,Blend: SP350 Blend (8:1:1),9/2/2020 12:00,9/2/2020 12:00,2,gal,10/22/2020 11:43,dlyon,1,1,1,0,{'2020-10-22 11:43:17': 1},1,0
1681,Wichita KS,DefaultDept,005_01_PaintPrimers,Blend: SP350 Blend (8:1:1),9/2/2020 12:00,9/2/2020 12:00,13,gal,10/22/2020 11:43,dlyon,1,1,1,0,{'2020-10-22 11:43:17': 1},1,0
1682,Wichita KS,DefaultDept,005_01_PaintPrimers,Blend: SP350 Blend (8:1:1),12/11/2020 12:00,12/11/2020 12:00,2,gal,"2021-01-08 08:46:53,2021-01-08 08:46:53","dlyon,dlyon",2,2,1,1,{'2021-01-08 08:46:53': 2},1,1
1683,Wichita KS,DefaultDept,005_01_PaintPrimers,Blend: SP350 Blend (8:1:1),12/11/2020 12:00,12/11/2020 12:00,6,gal,1/8/2021 8:46,dlyon,1,1,1,0,{'2021-01-08 08:46:53': 1},1,0
1684,Wichita KS,DefaultDept,005_01_PaintPrimers,Blend: SP350 Blend (8:1:1),12/11/2020 12:00,12/11/2020 12:00,10,gal,1/8/2021 8:46,dlyon,1,1,1,0,{'2021-01-08 08:46:53': 1},1,0
1685,Wichita KS,DefaultDept,005_01_PaintPrimers,CM0120911,2/6/2019 0:00,2/6/2019 0:00,3,gal,7/10/2019 9:06,adminbomgb,1,1,1,0,{'2019-07-10 09:06:14': 1},1,0
1686,Wichita KS,DefaultDept,005_01_PaintPrimers,CM0120911,4/8/2019 0:00,4/8/2019 0:00,4,gal,7/5/2019 11:50,adminbomry,1,1,1,0,{'2019-07-05 11:50:11': 1},1,0
1687,Wichita KS,DefaultDept,005_01_PaintPrimers,CM0483928,2/14/2019 0:00,2/14/2019 0:00,3,gal,7/10/2019 9:06,adminbomgb,1,1,1,0,{'2019-07-10 09:06:14': 1},1,0
1688,Wichita KS,DefaultDept,005_01_PaintPrimers,CM0483928,4/26/2019 0:00,4/26/2019 0:00,5,gal,7/5/2019 11:50,adminbomry,1,1,1,0,{'2019-07-05 11:50:11': 1},1,0
1689,Wichita KS,DefaultDept,005_01_PaintPrimers,Corrosion Resistant Epoxy Primer 10P30-5,5/13/2020 12:00,5/13/2020 12:00,11.50333701,gal,8/10/2020 16:47,bomamanda,1,1,1,0,{'2020-08-10 16:47:49': 1},1,0
1690,Wichita KS,DefaultDept,005_01_PaintPrimers,Corrosion Resistant Epoxy Primer 10P30-5,9/24/2020 12:00,9/24/2020 12:00,11.50333701,gal,10/22/2020 11:43,dlyon,1,1,1,0,{'2020-10-22 11:43:17': 1},1,0
1691,Wichita KS,DefaultDept,005_01_PaintPrimers,D9001 AWL-QUIK,1/28/2020 12:00,1/28/2020 12:00,0.25,gal,7/3/2020 11:56,adminbomry,1,1,1,0,{'2020-07-03 11:56:08': 1},1,0
1692,Wichita KS,DefaultDept,005_01_PaintPrimers,D9001 AWL-QUIK,4/21/2020 12:00,4/21/2020 12:00,0.25,gal,7/17/2020 12:53,dlyon,1,1,1,0,{'2020-07-17 12:53:57': 1},1,0
1693,Wichita KS,DefaultDept,005_01_PaintPrimers,D9001 AWL-QUIK,11/9/2020 12:00,11/9/2020 12:00,1,gal,"2020-12-14 11:13:31,2020-12-14 11:13:31","dlyon,dlyon",2,2,1,1,{'2020-12-14 11:13:31': 2},1,1
1694,Wichita KS,DefaultDept,005_01_PaintPrimers,E90G16,7/19/2019 0:00,7/19/2019 0:00,0.25,gal,8/9/2019 10:06,adminbomry,1,1,1,0,{'2019-08-09 10:06:56': 1},1,0
1695,Wichita KS,DefaultDept,005_01_PaintPrimers,E90G16,7/19/2019 0:00,7/19/2019 0:00,1,gal,8/9/2019 11:21,adminbomry,1,1,1,0,{'2019-08-09 11:21:06': 1},1,0
1696,Wichita KS,DefaultDept,005_01_PaintPrimers,E90G16,7/25/2019 0:00,7/25/2019 0:00,0.25,gal,8/9/2019 10:06,adminbomry,1,1,1,0,{'2019-08-09 10:06:56': 1},1,0
1697,Wichita KS,DefaultDept,005_01_PaintPrimers,E90G16,7/25/2019 0:00,7/25/2019 0:00,1,gal,8/9/2019 11:21,adminbomry,1,1,1,0,{'2019-08-09 11:21:22': 1},1,0
1698,Wichita KS,DefaultDept,005_01_PaintPrimers,Fluid Resistant Epoxy Primer VOC Compliant 10P8-10NF,4/29/2020 12:00,4/29/2020 12:00,4,gal,7/27/2020 18:06,bomamanda,1,1,1,0,{'2020-07-27 18:06:19': 1},1,0
1699,Wichita KS,DefaultDept,005_01_PaintPrimers,Fluid Resistant Epoxy Primer VOC Compliant 10P8-10NF,5/15/2020 12:00,5/15/2020 12:00,1,gal,7/27/2020 18:10,bomamanda,1,1,1,0,{'2020-07-27 18:10:32': 1},1,0
1700,Wichita KS,DefaultDept,005_01_PaintPrimers,Fluid Resistant Epoxy Primer VOC Compliant 10P8-10NF,6/15/2020 12:00,6/15/2020 12:00,4,gal,7/27/2020 18:15,bomamanda,1,1,1,0,{'2020-07-27 18:15:38': 1},1,0
1701,Wichita KS,DefaultDept,005_01_PaintPrimers,Fluid Resistant Epoxy Primer VOC Compliant 10P8-10NF,8/18/2020 12:00,8/18/2020 12:00,4,gal,9/4/2020 11:00,dlyon,1,1,1,0,{'2020-09-04 11:00:35': 1},1,0
1702,Wichita KS,DefaultDept,005_01_PaintPrimers,Fluid Resistant Epoxy Primer VOC Compliant 10P8-10NF,10/13/2020 12:00,10/13/2020 12:00,4,gal,12/2/2020 15:13,dlyon,1,1,1,0,{'2020-12-02 15:13:12': 1},1,0
1703,Wichita KS,DefaultDept,005_01_PaintPrimers,Fluid Resistant Epoxy Primer VOC Compliant 10P8-10NF,10/27/2020 12:00,10/27/2020 12:00,2,gal,12/2/2020 15:13,dlyon,1,1,1,0,{'2020-12-02 15:13:12': 1},1,0
1704,Wichita KS,DefaultDept,005_01_PaintPrimers,Fluid Resistant Epoxy Primer VOC Compliant 10P8-10NF,11/19/2020 12:00,11/19/2020 12:00,4,gal,12/8/2020 9:27,dlyon,1,1,1,0,{'2020-12-08 09:27:32': 1},1,0
1705,Wichita KS,DefaultDept,005_01_PaintPrimers,High Solids Epoxy Primer 10P20-13,11/8/2019 12:00,11/8/2019 12:00,1,gal,1/9/2020 11:17,adminbomry,1,1,1,0,{'2020-01-09 11:17:19': 1},1,0
1706,Wichita KS,DefaultDept,005_01_PaintPrimers,High Solids Epoxy Primer Adduct,1/9/2019 0:00,1/9/2019 0:00,3,gal,7/3/2019 10:37,adminbomry,1,1,1,0,{'2019-07-03 10:37:16': 1},1,0
1707,Wichita KS,DefaultDept,005_01_PaintPrimers,KRYLON Industrial TOUGH COAT Acrylic Enamel OSHA Safety Green,4/10/2019 0:00,4/10/2019 0:00,6,gal,7/5/2019 11:50,adminbomry,1,1,1,0,{'2019-07-05 11:50:11': 1},1,0
1708,Wichita KS,DefaultDept,005_01_PaintPrimers,KRYLON Industrial TOUGH COAT Acrylic Enamel OSHA Safety Green,8/6/2019 0:00,8/6/2019 0:00,1,gal,9/23/2019 10:35,adminbomry,1,1,1,0,{'2019-09-23 10:35:09': 1},1,0
1709,Wichita KS,DefaultDept,005_01_PaintPrimers,KRYLON Industrial TOUGH COAT Acrylic Enamel OSHA Safety Green,2/13/2020 12:00,2/13/2020 12:00,5,gal,7/1/2020 21:12,adminbomry,1,1,1,0,{'2020-07-01 21:12:32': 1},1,0
1710,Wichita KS,DefaultDept,005_01_PaintPrimers,KRYLON Industrial TOUGH COAT Acrylic Enamel OSHA Safety Green,3/21/2020 12:00,3/21/2020 12:00,12,gal,7/1/2020 21:15,adminbomry,1,1,1,0,{'2020-07-01 21:15:03': 1},1,0
1711,Wichita KS,DefaultDept,005_01_PaintPrimers,Loctite SF 7649 Primer known as Loctite 7649 Primer N,12/24/2019 12:00,12/24/2019 12:00,1.0546875,gal,3/24/2020 16:34,adminbomry,1,1,1,0,{'2020-03-24 16:34:07': 1},1,0
1712,Wichita KS,DefaultDept,005_01_PaintPrimers,Loctite SF 7649 Primer known as Loctite 7649 Primer N,3/10/2020 12:00,3/10/2020 12:00,1.0546875,gal,7/3/2020 12:20,adminbomry,1,1,1,0,{'2020-07-03 12:20:34': 1},1,0
1713,Wichita KS,DefaultDept,005_01_PaintPrimers,Loctite SF 7649 Primer known as Loctite 7649 Primer N,7/16/2020 12:00,7/16/2020 12:00,0.3515625,gal,9/4/2020 9:13,dlyon,1,1,1,0,{'2020-09-04 09:13:57': 1},1,0
1714,Wichita KS,DefaultDept,005_01_PaintPrimers,Loctite SF 7649 Primer known as Loctite 7649 Primer N,12/29/2020 12:00,12/29/2020 12:00,1.0546875,gal,1/4/2021 15:42,dlyon,1,1,1,0,{'2021-01-04 15:42:54': 1},1,0
1715,Wichita KS,DefaultDept,005_01_PaintPrimers,PR-1200 RTV PRIME COAT CLEAR,6/18/2019 0:00,6/18/2019 0:00,0.08515625,gal,8/9/2019 13:23,adminbomry,1,1,1,0,{'2019-08-09 13:23:30': 1},1,0
1716,Wichita KS,DefaultDept,005_01_PaintPrimers,SS4004P 01P Primer Solution,12/23/2019 12:00,12/23/2019 12:00,0.062608788,gal,2/17/2020 9:34,adminbomry,1,1,1,0,{'2020-02-17 09:34:31': 1},1,0
1717,Wichita KS,DefaultDept,005_01_PaintPrimers,SS4004P 01P Primer Solution,1/18/2020 12:00,1/18/2020 12:00,0.124953403,gal,7/2/2020 19:10,adminbomry,1,1,1,0,{'2020-07-02 19:10:15': 1},1,0
1718,Wichita KS,DefaultDept,005_01_PaintPrimers,SS4004P 01P Primer Solution,7/27/2020 12:00,7/27/2020 12:00,0.124953403,gal,9/4/2020 10:06,dlyon,1,1,1,0,{'2020-09-04 10:06:12': 1},1,0
1719,Wichita KS,DefaultDept,005_01_PaintPrimers,STRUST SSPR 6PK CLEAR RUST INHIBITOR,1/15/2019 0:00,1/15/2019 0:00,6,gal,7/16/2019 11:57,adminbomgb,1,1,1,0,{'2019-07-16 11:57:39': 1},1,0
1720,Wichita KS,DefaultDept,005_01_PaintPrimers,STRUST SSPR 6PK CLEAR RUST INHIBITOR,2/12/2019 0:00,2/12/2019 0:00,4,gal,7/16/2019 13:30,adminbomgb,1,1,1,0,{'2019-07-16 13:30:40': 1},1,0
1721,Wichita KS,DefaultDept,005_01_PaintPrimers,STRUST SSPR 6PK CLEAR RUST INHIBITOR,2/19/2019 0:00,2/19/2019 0:00,2,gal,7/16/2019 13:30,adminbomgb,1,1,1,0,{'2019-07-16 13:30:40': 1},1,0
1722,Wichita KS,DefaultDept,005_01_PaintPrimers,STRUST SSPR 6PK CLEAR RUST INHIBITOR,7/21/2020 12:00,7/21/2020 12:00,6,gal,9/4/2020 9:13,dlyon,1,1,1,0,{'2020-09-04 09:13:57': 1},1,0
1723,Wichita KS,DefaultDept,005_01_PaintPrimers,STRUST SSPR 6PK CLEAR RUST INHIBITOR,12/22/2020 12:00,12/22/2020 12:00,6,gal,1/4/2021 15:42,dlyon,1,1,1,0,{'2021-01-04 15:42:54': 1},1,0
1724,Wichita KS,DefaultDept,005_02_PaintTopcoats,09W015 Base - 09W015 CAT Curing,1/3/2019 0:00,1/3/2019 0:00,16,gal,7/3/2019 10:37,adminbomry,1,1,1,0,{'2019-07-03 10:37:16': 1},1,0
1725,Wichita KS,DefaultDept,005_02_PaintTopcoats,09W015 Base - 09W015 CAT Curing,1/7/2019 0:00,1/7/2019 0:00,8,gal,"2019-07-03 10:37:16,2019-07-03 10:37:16","adminbomry,adminbomry",2,2,1,1,{'2019-07-03 10:37:16': 2},1,1
1726,Wichita KS,DefaultDept,005_02_PaintTopcoats,09W015 Base - 09W015 CAT Curing,2/18/2019 0:00,2/18/2019 0:00,8,gal,"2019-07-10 09:06:14,2019-07-10 09:06:14","adminbomgb,adminbomgb",2,2,1,1,{'2019-07-10 09:06:14': 2},1,1
1727,Wichita KS,DefaultDept,005_02_PaintTopcoats,09W015 Base - 09W015 CAT Curing,3/5/2019 0:00,3/5/2019 0:00,31,gal,7/5/2019 13:44,adminbomgb,1,1,1,0,{'2019-07-05 13:44:50': 1},1,0
1728,Wichita KS,DefaultDept,005_02_PaintTopcoats,09W015 Base - 09W015 CAT Curing,3/20/2019 0:00,3/20/2019 0:00,8,gal,"2019-07-05 13:44:50,2019-07-05 13:44:50","adminbomgb,adminbomgb",2,2,1,1,{'2019-07-05 13:44:50': 2},1,1
1729,Wichita KS,DefaultDept,005_02_PaintTopcoats,09W015 Base - 09W015 CAT Curing,3/26/2019 0:00,3/26/2019 0:00,31,gal,7/5/2019 13:44,adminbomgb,1,1,1,0,{'2019-07-05 13:44:50': 1},1,0
1730,Wichita KS,DefaultDept,005_02_PaintTopcoats,09W015 Base - 09W015 CAT Curing,4/20/2019 0:00,4/20/2019 0:00,8,gal,"2019-07-05 11:50:11,2019-07-05 11:50:11","adminbomry,adminbomry",2,2,1,1,{'2019-07-05 11:50:11': 2},1,1
1731,Wichita KS,DefaultDept,005_02_PaintTopcoats,09W015 Base - 09W015 CAT Curing,4/20/2019 0:00,4/20/2019 0:00,16,gal,7/5/2019 11:50,adminbomry,1,1,1,0,{'2019-07-05 11:50:11': 1},1,0
1732,Wichita KS,DefaultDept,005_02_PaintTopcoats,09W015 Base - 09W015 CAT Curing,5/10/2019 0:00,5/10/2019 0:00,-16,gal,7/5/2019 12:02,adminbomry,1,1,1,0,{'2019-07-05 12:02:13': 1},1,0
1733,Wichita KS,DefaultDept,005_02_PaintTopcoats,09W015 Base - 09W015 CAT Curing,5/16/2019 0:00,5/16/2019 0:00,8,gal,"2019-07-05 12:02:13,2019-07-05 12:02:13","adminbomry,adminbomry",2,2,1,1,{'2019-07-05 12:02:13': 2},1,1
1734,Wichita KS,DefaultDept,005_02_PaintTopcoats,09W015 Base - 09W015 CAT Curing,6/21/2019 0:00,6/21/2019 0:00,3,gal,7/5/2019 13:18,adminbomry,1,1,1,0,{'2019-07-05 13:18:36': 1},1,0
1735,Wichita KS,DefaultDept,005_02_PaintTopcoats,09W015 Base - 09W015 CAT Curing,6/21/2019 0:00,6/21/2019 0:00,8,gal,7/5/2019 13:18,adminbomry,1,1,1,0,{'2019-07-05 13:18:36': 1},1,0
1736,Wichita KS,DefaultDept,005_02_PaintTopcoats,09W015 Base - 09W015 CAT Curing,7/2/2019 0:00,7/2/2019 0:00,3,gal,8/9/2019 10:06,adminbomry,1,1,1,0,{'2019-08-09 10:06:55': 1},1,0
1737,Wichita KS,DefaultDept,005_02_PaintTopcoats,09W015 Base - 09W015 CAT Curing,7/2/2019 0:00,7/2/2019 0:00,25,gal,8/9/2019 10:06,adminbomry,1,1,1,0,{'2019-08-09 10:06:55': 1},1,0
1738,Wichita KS,DefaultDept,005_02_PaintTopcoats,09W015 Base - 09W015 CAT Curing,7/6/2019 0:00,7/6/2019 0:00,23,gal,8/9/2019 10:06,adminbomry,1,1,1,0,{'2019-08-09 10:06:55': 1},1,0
1739,Wichita KS,DefaultDept,005_02_PaintTopcoats,09W015 Base - 09W015 CAT Curing,7/12/2019 0:00,7/12/2019 0:00,5,gal,8/9/2019 10:06,adminbomry,1,1,1,0,{'2019-08-09 10:06:55': 1},1,0
1740,Wichita KS,DefaultDept,005_02_PaintTopcoats,09W015 Base - 09W015 CAT Curing,7/12/2019 0:00,7/12/2019 0:00,8,gal,"2019-08-09 10:06:55,2019-08-09 10:06:55","adminbomry,adminbomry",2,2,1,1,{'2019-08-09 10:06:55': 2},1,1
1741,Wichita KS,DefaultDept,005_02_PaintTopcoats,09W015 Base - 09W015 CAT Curing,8/12/2019 0:00,8/12/2019 0:00,3,gal,"2019-09-23 10:35:09,2019-09-23 10:35:09","adminbomry,adminbomry",2,2,1,1,{'2019-09-23 10:35:09': 2},1,1
1742,Wichita KS,DefaultDept,005_02_PaintTopcoats,09W015 Base - 09W015 CAT Curing,8/13/2019 0:00,8/13/2019 0:00,25,gal,9/23/2019 10:35,adminbomry,1,1,1,0,{'2019-09-23 10:35:09': 1},1,0
1743,Wichita KS,DefaultDept,005_02_PaintTopcoats,09W015 Base - 09W015 CAT Curing,8/14/2019 0:00,8/14/2019 0:00,5,gal,9/23/2019 10:35,adminbomry,1,1,1,0,{'2019-09-23 10:35:09': 1},1,0
1744,Wichita KS,DefaultDept,005_02_PaintTopcoats,09W015 Base - 09W015 CAT Curing,8/14/2019 0:00,8/14/2019 0:00,6,gal,9/23/2019 10:35,adminbomry,1,1,1,0,{'2019-09-23 10:35:09': 1},1,0
1745,Wichita KS,DefaultDept,005_02_PaintTopcoats,09W015 Base - 09W015 CAT Curing,8/19/2019 0:00,8/19/2019 0:00,2,gal,9/23/2019 10:35,adminbomry,1,1,1,0,{'2019-09-23 10:35:09': 1},1,0
1746,Wichita KS,DefaultDept,005_02_PaintTopcoats,09W015 Base - 09W015 CAT Curing,9/3/2019 12:00,9/3/2019 12:00,1,gal,11/25/2019 9:54,adminbomry,1,1,1,0,{'2019-11-25 09:54:31': 1},1,0
1747,Wichita KS,DefaultDept,005_02_PaintTopcoats,09W015 Base - 09W015 CAT Curing,9/5/2019 12:00,9/5/2019 12:00,-1,gal,11/25/2019 9:54,adminbomry,1,1,1,0,{'2019-11-25 09:54:31': 1},1,0
1748,Wichita KS,DefaultDept,005_02_PaintTopcoats,09W015 Base - 09W015 CAT Curing,9/5/2019 12:00,9/5/2019 12:00,16,gal,11/25/2019 9:54,adminbomry,1,1,1,0,{'2019-11-25 09:54:31': 1},1,0
1749,Wichita KS,DefaultDept,005_02_PaintTopcoats,09W015 Base - 09W015 CAT Curing,9/11/2019 12:00,9/11/2019 12:00,2,gal,11/25/2019 9:54,adminbomry,1,1,1,0,{'2019-11-25 09:54:31': 1},1,0
1750,Wichita KS,DefaultDept,005_02_PaintTopcoats,09W015 Base - 09W015 CAT Curing,9/11/2019 12:00,9/11/2019 12:00,6,gal,11/25/2019 9:54,adminbomry,1,1,1,0,{'2019-11-25 09:54:31': 1},1,0
1751,Wichita KS,DefaultDept,005_02_PaintTopcoats,09W015 Base - 09W015 CAT Curing,9/11/2019 12:00,9/11/2019 12:00,8,gal,11/25/2019 9:54,adminbomry,1,1,1,0,{'2019-11-25 09:54:31': 1},1,0
1752,Wichita KS,DefaultDept,005_02_PaintTopcoats,09W015 Base - 09W015 CAT Curing,9/30/2019 12:00,9/30/2019 12:00,4,gal,11/25/2019 9:54,adminbomry,1,1,1,0,{'2019-11-25 09:54:31': 1},1,0
1753,Wichita KS,DefaultDept,005_02_PaintTopcoats,09W015 Base - 09W015 CAT Curing,10/14/2019 12:00,10/14/2019 12:00,27,gal,12/19/2019 16:04,adminbomry,1,1,1,0,{'2019-12-19 16:04:12': 1},1,0
1754,Wichita KS,DefaultDept,005_02_PaintTopcoats,09W015 Base - 09W015 CAT Curing,10/17/2019 12:00,10/17/2019 12:00,6,gal,12/19/2019 16:04,adminbomry,1,1,1,0,{'2019-12-19 16:04:12': 1},1,0
1755,Wichita KS,DefaultDept,005_02_PaintTopcoats,09W015 Base - 09W015 CAT Curing,10/17/2019 12:00,10/17/2019 12:00,8,gal,12/19/2019 16:04,adminbomry,1,1,1,0,{'2019-12-19 16:04:12': 1},1,0
1756,Wichita KS,DefaultDept,005_02_PaintTopcoats,09W015 Base - 09W015 CAT Curing,10/19/2019 12:00,10/19/2019 12:00,33,gal,12/19/2019 16:04,adminbomry,1,1,1,0,{'2019-12-19 16:04:12': 1},1,0
1757,Wichita KS,DefaultDept,005_02_PaintTopcoats,09W015 Base - 09W015 CAT Curing,10/21/2019 12:00,10/21/2019 12:00,2,gal,12/19/2019 16:04,adminbomry,1,1,1,0,{'2019-12-19 16:04:12': 1},1,0
1758,Wichita KS,DefaultDept,005_02_PaintTopcoats,09W015 Base - 09W015 CAT Curing,10/30/2019 12:00,10/30/2019 12:00,4,gal,12/19/2019 16:04,adminbomry,1,1,1,0,{'2019-12-19 16:04:12': 1},1,0
1759,Wichita KS,DefaultDept,005_02_PaintTopcoats,09W015 Base - 09W015 CAT Curing,11/1/2019 12:00,11/1/2019 12:00,8,gal,"2019-12-19 15:35:45,2019-12-19 15:35:45","ascheufler,ascheufler",2,2,1,1,{'2019-12-19 15:35:45': 2},1,1
1760,Wichita KS,DefaultDept,005_02_PaintTopcoats,09W015 Base - 09W015 CAT Curing,11/2/2019 12:00,11/2/2019 12:00,-4,gal,12/19/2019 15:35,ascheufler,1,1,1,0,{'2019-12-19 15:35:45': 1},1,0
1761,Wichita KS,DefaultDept,005_02_PaintTopcoats,09W015 Base - 09W015 CAT Curing,11/2/2019 12:00,11/2/2019 12:00,4,gal,12/19/2019 15:35,ascheufler,1,1,1,0,{'2019-12-19 15:35:45': 1},1,0
1762,Wichita KS,DefaultDept,005_02_PaintTopcoats,09W015 Base - 09W015 CAT Curing,12/4/2019 12:00,12/4/2019 12:00,8,gal,"2020-01-09 18:22:20,2020-01-09 18:22:20","adminbomry,adminbomry",2,2,1,1,{'2020-01-09 18:22:20': 2},1,1
1763,Wichita KS,DefaultDept,005_02_PaintTopcoats,09W015 Base - 09W015 CAT Curing,12/26/2019 12:00,12/26/2019 12:00,64,gal,1/9/2020 18:22,adminbomry,1,1,1,0,{'2020-01-09 18:22:20': 1},1,0
1764,Wichita KS,DefaultDept,005_02_PaintTopcoats,09W015 Base - 09W015 CAT Curing,1/13/2020 12:00,1/13/2020 12:00,8,gal,"2020-07-01 21:07:35,2020-07-01 21:07:35","adminbomry,adminbomry",2,2,1,1,{'2020-07-01 21:07:35': 2},1,1
1765,Wichita KS,DefaultDept,005_02_PaintTopcoats,09W015 Base - 09W015 CAT Curing,2/9/2020 12:00,2/9/2020 12:00,8,gal,7/1/2020 21:12,adminbomry,1,1,1,0,{'2020-07-01 21:12:32': 1},1,0
1766,Wichita KS,DefaultDept,005_02_PaintTopcoats,09W015 Base - 09W015 CAT Curing,2/10/2020 12:00,2/10/2020 12:00,8,gal,7/1/2020 21:12,adminbomry,1,1,1,0,{'2020-07-01 21:12:32': 1},1,0
1767,Wichita KS,DefaultDept,005_02_PaintTopcoats,09W015 Base - 09W015 CAT Curing,3/16/2020 12:00,3/16/2020 12:00,1,gal,7/1/2020 21:15,adminbomry,1,1,1,0,{'2020-07-01 21:15:03': 1},1,0
1768,Wichita KS,DefaultDept,005_02_PaintTopcoats,09W015 Base - 09W015 CAT Curing,3/16/2020 12:00,3/16/2020 12:00,8,gal,"2020-07-01 21:15:03,2020-07-01 21:15:03","adminbomry,adminbomry",2,2,1,1,{'2020-07-01 21:15:03': 2},1,1
1769,Wichita KS,DefaultDept,005_02_PaintTopcoats,09W015 Base - 09W015 CAT Curing,4/22/2020 12:00,4/22/2020 12:00,10,gal,7/27/2020 18:06,bomamanda,1,1,1,0,{'2020-07-27 18:06:19': 1},1,0
1770,Wichita KS,DefaultDept,005_02_PaintTopcoats,09W015 Base - 09W015 CAT Curing,5/24/2020 12:00,5/24/2020 12:00,8,gal,"2020-07-27 18:10:32,2020-07-27 18:10:32","bomamanda,bomamanda",2,2,1,1,{'2020-07-27 18:10:32': 2},1,1
1771,Wichita KS,DefaultDept,005_02_PaintTopcoats,09W015 Base - 09W015 CAT Curing,6/4/2020 12:00,6/4/2020 12:00,-23,gal,7/27/2020 18:15,bomamanda,1,1,1,0,{'2020-07-27 18:15:38': 1},1,0
1772,Wichita KS,DefaultDept,005_02_PaintTopcoats,09W015 Base - 09W015 CAT Curing,6/4/2020 12:00,6/4/2020 12:00,23,gal,"2020-07-27 18:15:38,2020-07-27 18:15:38","bomamanda,bomamanda",2,2,1,1,{'2020-07-27 18:15:38': 2},1,1
1773,Wichita KS,DefaultDept,005_02_PaintTopcoats,09W015 Base - 09W015 CAT Curing,6/4/2020 12:00,6/4/2020 12:00,25,gal,7/27/2020 18:15,bomamanda,1,1,1,0,{'2020-07-27 18:15:38': 1},1,0
1774,Wichita KS,DefaultDept,005_02_PaintTopcoats,09W015 Base - 09W015 CAT Curing,6/8/2020 12:00,6/8/2020 12:00,1,gal,7/27/2020 18:15,bomamanda,1,1,1,0,{'2020-07-27 18:15:38': 1},1,0
1775,Wichita KS,DefaultDept,005_02_PaintTopcoats,09W015 Base - 09W015 CAT Curing,6/26/2020 12:00,6/26/2020 12:00,2,gal,7/27/2020 18:15,bomamanda,1,1,1,0,{'2020-07-27 18:15:38': 1},1,0
1776,Wichita KS,DefaultDept,005_02_PaintTopcoats,09W015 Base - 09W015 CAT Curing,6/26/2020 12:00,6/26/2020 12:00,7,gal,7/27/2020 18:15,bomamanda,1,1,1,0,{'2020-07-27 18:15:38': 1},1,0
1777,Wichita KS,DefaultDept,005_02_PaintTopcoats,09W015 Base - 09W015 CAT Curing,6/26/2020 12:00,6/26/2020 12:00,8,gal,7/27/2020 18:15,bomamanda,1,1,1,0,{'2020-07-27 18:15:38': 1},1,0
1778,Wichita KS,DefaultDept,005_02_PaintTopcoats,09W015 Base - 09W015 CAT Curing,7/27/2020 12:00,7/27/2020 12:00,8,gal,"2020-09-04 10:46:12,2020-09-04 10:46:12","dlyon,dlyon",2,2,1,1,{'2020-09-04 10:46:12': 2},1,1
1779,Wichita KS,DefaultDept,005_02_PaintTopcoats,09W015 Base - 09W015 CAT Curing,8/3/2020 12:00,8/3/2020 12:00,8,gal,"2020-09-04 11:00:35,2020-09-04 11:00:35","dlyon,dlyon",2,2,1,1,{'2020-09-04 11:00:35': 2},1,1
1780,Wichita KS,DefaultDept,005_02_PaintTopcoats,09W015 Base - 09W015 CAT Curing,8/28/2020 12:00,8/28/2020 12:00,28,gal,9/4/2020 11:00,dlyon,1,1,1,0,{'2020-09-04 11:00:35': 1},1,0
1781,Wichita KS,DefaultDept,005_02_PaintTopcoats,09W015 Base - 09W015 CAT Curing,9/1/2020 12:00,9/1/2020 12:00,2,gal,10/22/2020 11:27,dlyon,1,1,1,0,{'2020-10-22 11:27:27': 1},1,0
1782,Wichita KS,DefaultDept,005_02_PaintTopcoats,09W015 Base - 09W015 CAT Curing,9/2/2020 12:00,9/2/2020 12:00,28,gal,10/22/2020 11:27,dlyon,1,1,1,0,{'2020-10-22 11:27:27': 1},1,0
1783,Wichita KS,DefaultDept,005_02_PaintTopcoats,09W015 Base - 09W015 CAT Curing,9/3/2020 12:00,9/3/2020 12:00,3,gal,10/22/2020 11:27,dlyon,1,1,1,0,{'2020-10-22 11:27:27': 1},1,0
1784,Wichita KS,DefaultDept,005_02_PaintTopcoats,09W015 Base - 09W015 CAT Curing,9/3/2020 12:00,9/3/2020 12:00,5,gal,10/22/2020 11:27,dlyon,1,1,1,0,{'2020-10-22 11:27:27': 1},1,0
1785,Wichita KS,DefaultDept,005_02_PaintTopcoats,09W015 Base - 09W015 CAT Curing,9/3/2020 12:00,9/3/2020 12:00,8,gal,10/22/2020 11:27,dlyon,1,1,1,0,{'2020-10-22 11:27:27': 1},1,0
1786,Wichita KS,DefaultDept,005_02_PaintTopcoats,09W015 Base - 09W015 CAT Curing,10/24/2020 12:00,10/24/2020 12:00,8,gal,"2020-12-02 15:13:12,2020-12-02 15:13:12","dlyon,dlyon",2,2,1,1,{'2020-12-02 15:13:12': 2},1,1
1787,Wichita KS,DefaultDept,005_02_PaintTopcoats,09W015 Base - 09W015 CAT Curing,11/6/2020 12:00,11/6/2020 12:00,20,gal,12/8/2020 9:27,dlyon,1,1,1,0,{'2020-12-08 09:27:32': 1},1,0
1788,Wichita KS,DefaultDept,005_02_PaintTopcoats,09W015 Base - 09W015 CAT Curing,11/9/2020 12:00,11/9/2020 12:00,20,gal,12/8/2020 9:27,dlyon,1,1,1,0,{'2020-12-08 09:27:32': 1},1,0
1789,Wichita KS,DefaultDept,005_02_PaintTopcoats,09W015 Base - 09W015 CAT Curing,11/21/2020 12:00,11/21/2020 12:00,32,gal,12/8/2020 9:27,dlyon,1,1,1,0,{'2020-12-08 09:27:32': 1},1,0
1790,Wichita KS,DefaultDept,005_02_PaintTopcoats,09W015 Base - 09W015 CAT Curing,12/6/2020 12:00,12/6/2020 12:00,1,gal,1/8/2021 8:59,dlyon,1,1,1,0,{'2021-01-08 08:59:12': 1},1,0
1791,Wichita KS,DefaultDept,005_02_PaintTopcoats,09W015 Base - 09W015 CAT Curing,12/6/2020 12:00,12/6/2020 12:00,8,gal,1/8/2021 8:59,dlyon,1,1,1,0,{'2021-01-08 08:59:12': 1},1,0
1792,Wichita KS,DefaultDept,005_02_PaintTopcoats,09W015 Base - 09W015 CAT Curing,12/7/2020 12:00,12/7/2020 12:00,3,gal,1/8/2021 8:59,dlyon,1,1,1,0,{'2021-01-08 08:59:12': 1},1,0
1793,Wichita KS,DefaultDept,005_02_PaintTopcoats,09W015 Base - 09W015 CAT Curing,12/7/2020 12:00,12/7/2020 12:00,7,gal,1/8/2021 8:59,dlyon,1,1,1,0,{'2021-01-08 08:59:12': 1},1,0
1794,Wichita KS,DefaultDept,005_02_PaintTopcoats,8000IM0750CAG11B,5/24/2019 0:00,5/24/2019 0:00,1,gal,7/19/2019 13:24,adminbomry,1,1,1,0,{'2019-07-19 13:24:52': 1},1,0
1795,Wichita KS,DefaultDept,005_02_PaintTopcoats,8000IM0750CAG11B,7/8/2019 0:00,7/8/2019 0:00,1,gal,8/9/2019 10:06,adminbomry,1,1,1,0,{'2019-08-09 10:06:56': 1},1,0
1796,Wichita KS,DefaultDept,005_02_PaintTopcoats,8000IM0906CAG11B,3/10/2020 12:00,3/10/2020 12:00,7,gal,"2020-07-01 22:04:31,2020-07-01 22:04:31","adminbomry,adminbomry",2,2,1,1,{'2020-07-01 22:04:31': 2},1,1
1797,Wichita KS,DefaultDept,005_02_PaintTopcoats,8000IM0911CAG11B,5/24/2019 0:00,5/24/2019 0:00,1,gal,7/19/2019 13:24,adminbomry,1,1,1,0,{'2019-07-19 13:24:52': 1},1,0
1798,Wichita KS,DefaultDept,005_02_PaintTopcoats,8000IM0911CAG11B,7/8/2019 0:00,7/8/2019 0:00,1,gal,8/9/2019 10:06,adminbomry,1,1,1,0,{'2019-08-09 10:06:56': 1},1,0
1799,Wichita KS,DefaultDept,005_02_PaintTopcoats,8000IM0911CAQ11B,5/24/2019 0:00,5/24/2019 0:00,0.25,gal,7/19/2019 13:24,adminbomry,1,1,1,0,{'2019-07-19 13:24:52': 1},1,0
1800,Wichita KS,DefaultDept,005_02_PaintTopcoats,8000IM0911CAQ11B,7/8/2019 0:00,7/8/2019 0:00,0.25,gal,8/9/2019 10:06,adminbomry,1,1,1,0,{'2019-08-09 10:06:56': 1},1,0
1801,Wichita KS,DefaultDept,005_02_PaintTopcoats,8000IM6066CAG11B,12/30/2019 12:00,12/30/2019 12:00,1,gal,1/10/2020 10:07,adminbomry,1,1,1,0,{'2020-01-10 10:07:06': 1},1,0
1802,Wichita KS,DefaultDept,005_02_PaintTopcoats,8273I07181CAY11B,2/21/2019 0:00,2/21/2019 0:00,1,gal,7/19/2019 13:17,adminbomry,1,1,1,0,{'2019-07-19 13:17:17': 1},1,0
1803,Wichita KS,DefaultDept,005_02_PaintTopcoats,8273I07181CAY11B,2/22/2019 0:00,2/22/2019 0:00,1,gal,7/19/2019 13:17,adminbomry,1,1,1,0,{'2019-07-19 13:17:30': 1},1,0
1804,Wichita KS,DefaultDept,005_02_PaintTopcoats,8273I07181CAY11B,2/25/2019 0:00,2/25/2019 0:00,1,gal,7/19/2019 13:17,adminbomry,1,1,1,0,{'2019-07-19 13:17:37': 1},1,0
1805,Wichita KS,DefaultDept,005_02_PaintTopcoats,8273I07181CAY11B,3/7/2019 0:00,3/7/2019 0:00,1,gal,7/19/2019 13:20,adminbomry,1,1,1,0,{'2019-07-19 13:20:19': 1},1,0
1806,Wichita KS,DefaultDept,005_02_PaintTopcoats,8273I07181CAY11B,3/14/2019 0:00,3/14/2019 0:00,1,gal,7/19/2019 13:20,adminbomry,1,1,1,0,{'2019-07-19 13:20:19': 1},1,0
1807,Wichita KS,DefaultDept,005_02_PaintTopcoats,8273I07181CAY11B,3/19/2019 0:00,3/19/2019 0:00,1,gal,7/19/2019 13:20,adminbomry,1,1,1,0,{'2019-07-19 13:20:19': 1},1,0
1808,Wichita KS,DefaultDept,005_02_PaintTopcoats,8273I07181CAY11B,4/3/2019 0:00,4/3/2019 0:00,1,gal,7/19/2019 13:22,adminbomry,1,1,1,0,{'2019-07-19 13:22:18': 1},1,0
1809,Wichita KS,DefaultDept,005_02_PaintTopcoats,8273I07189CAP11B,3/8/2019 0:00,3/8/2019 0:00,0.125,gal,7/19/2019 13:20,adminbomry,1,1,1,0,{'2019-07-19 13:20:19': 1},1,0
1810,Wichita KS,DefaultDept,005_02_PaintTopcoats,8273I07189CAY11B,3/7/2019 0:00,3/7/2019 0:00,1,gal,7/19/2019 13:20,adminbomry,1,1,1,0,{'2019-07-19 13:20:19': 1},1,0
1811,Wichita KS,DefaultDept,005_02_PaintTopcoats,8273I07189CAY11B,4/3/2019 0:00,4/3/2019 0:00,1,gal,7/19/2019 13:22,adminbomry,1,1,1,0,{'2019-07-19 13:22:18': 1},1,0
1812,Wichita KS,DefaultDept,005_02_PaintTopcoats,830 Series - Acry Glo High Solids WHITE,10/13/2020 12:00,10/13/2020 12:00,1,gal,12/14/2020 9:16,dlyon,1,1,1,0,{'2020-12-14 09:16:05': 1},1,0
1813,Wichita KS,DefaultDept,005_02_PaintTopcoats,8800 B00701- CA 8800Z Activator- 8800CT2 THINNER with KICKER,1/24/2019 0:00,1/24/2019 0:00,0.125,gal,"2019-07-03 10:37:16,2019-07-03 10:37:16","adminbomry,adminbomry",2,2,1,1,{'2019-07-03 10:37:16': 2},1,1
1814,Wichita KS,DefaultDept,005_02_PaintTopcoats,8800 B00701- CA 8800Z Activator- 8800CT2 THINNER with KICKER,6/29/2020 12:00,6/29/2020 12:00,0.625,gal,7/27/2020 18:15,bomamanda,1,1,1,0,{'2020-07-27 18:15:38': 1},1,0
1815,Wichita KS,DefaultDept,005_02_PaintTopcoats,8800 B00701- CA 8800Z Activator- 8800CT2 THINNER with KICKER,7/28/2020 12:00,7/28/2020 12:00,0.625,gal,9/4/2020 10:46,dlyon,1,1,1,0,{'2020-09-04 10:46:12': 1},1,0
1816,Wichita KS,DefaultDept,005_02_PaintTopcoats,8800 B00701- CA 8800Z Activator- 8800CT2 THINNER with KICKER,7/29/2020 12:00,7/29/2020 12:00,0.625,gal,9/4/2020 10:46,dlyon,1,1,1,0,{'2020-09-04 10:46:12': 1},1,0
1817,Wichita KS,DefaultDept,005_02_PaintTopcoats,8800 B900 - CA 8800Z Activator- 8800CT1 THINNER,8/1/2019 0:00,8/1/2019 0:00,1,gal,9/23/2019 10:35,adminbomry,1,1,1,0,{'2019-09-23 10:35:10': 1},1,0
1818,Wichita KS,DefaultDept,005_02_PaintTopcoats,8800 B900 - CA 8800Z Activator- 8800CT1 THINNER,8/1/2019 0:00,8/1/2019 0:00,3,gal,9/23/2019 10:35,adminbomry,1,1,1,0,{'2019-09-23 10:35:10': 1},1,0
1819,Wichita KS,DefaultDept,005_02_PaintTopcoats,8800 B900 - CA 8800Z Activator- 8800CT1 THINNER,8/1/2019 0:00,8/1/2019 0:00,5,gal,9/23/2019 10:35,adminbomry,1,1,1,0,{'2019-09-23 10:35:10': 1},1,0
1820,Wichita KS,DefaultDept,005_02_PaintTopcoats,8800 B900 - CA 8800Z Activator- 8800CT1 THINNER,9/14/2019 12:00,9/14/2019 12:00,20,gal,11/25/2019 9:54,adminbomry,1,1,1,0,{'2019-11-25 09:54:31': 1},1,0
1821,Wichita KS,DefaultDept,005_02_PaintTopcoats,8800 B900 - CA 8800Z Activator- 8800CT1 THINNER,10/3/2019 12:00,10/3/2019 12:00,4,gal,12/19/2019 16:04,adminbomry,1,1,1,0,{'2019-12-19 16:04:12': 1},1,0
1822,Wichita KS,DefaultDept,005_02_PaintTopcoats,8800 B900 - CA 8800Z Activator- 8800CT1 THINNER,10/16/2019 12:00,10/16/2019 12:00,4,gal,12/19/2019 16:04,adminbomry,1,1,1,0,{'2019-12-19 16:04:12': 1},1,0
1823,Wichita KS,DefaultDept,005_02_PaintTopcoats,8800 B900 - CA 8800Z Activator- 8800CT1 THINNER,10/16/2019 12:00,10/16/2019 12:00,20,gal,12/19/2019 16:04,adminbomry,1,1,1,0,{'2019-12-19 16:04:12': 1},1,0
1824,Wichita KS,DefaultDept,005_02_PaintTopcoats,8800 B900 - CA 8800Z Activator- 8800CT1 THINNER,10/21/2019 12:00,10/21/2019 12:00,8,gal,12/19/2019 16:04,adminbomry,1,1,1,0,{'2019-12-19 16:04:12': 1},1,0
1825,Wichita KS,DefaultDept,005_02_PaintTopcoats,8800 B900 - CA 8800Z Activator- 8800CT1 THINNER,10/23/2019 12:00,10/23/2019 12:00,-20,gal,12/19/2019 16:04,adminbomry,1,1,1,0,{'2019-12-19 16:04:12': 1},1,0
1826,Wichita KS,DefaultDept,005_02_PaintTopcoats,8800 B900 - CA 8800Z Activator- 8800CT1 THINNER,10/23/2019 12:00,10/23/2019 12:00,20,gal,12/19/2019 16:04,adminbomry,1,1,1,0,{'2019-12-19 16:04:12': 1},1,0
1827,Wichita KS,DefaultDept,005_02_PaintTopcoats,8800 B900 - CA 8800Z Activator- 8800CT1 THINNER,10/30/2019 12:00,10/30/2019 12:00,20,gal,12/19/2019 16:04,adminbomry,1,1,1,0,{'2019-12-19 16:04:12': 1},1,0
1828,Wichita KS,DefaultDept,005_02_PaintTopcoats,8800 B900 - CA 8800Z Activator- 8800CT1 THINNER,11/19/2019 12:00,11/19/2019 12:00,1,gal,12/19/2019 15:35,ascheufler,1,1,1,0,{'2019-12-19 15:35:45': 1},1,0
1829,Wichita KS,DefaultDept,005_02_PaintTopcoats,8800 B900 - CA 8800Z Activator- 8800CT1 THINNER,11/19/2019 12:00,11/19/2019 12:00,4,gal,12/19/2019 15:35,ascheufler,1,1,1,0,{'2019-12-19 15:35:45': 1},1,0
1830,Wichita KS,DefaultDept,005_02_PaintTopcoats,8800 B900 - CA 8800Z Activator- 8800CT1 THINNER,1/15/2020 12:00,1/15/2020 12:00,8,gal,7/1/2020 21:07,adminbomry,1,1,1,0,{'2020-07-01 21:07:35': 1},1,0
1831,Wichita KS,DefaultDept,005_02_PaintTopcoats,8800 B900 - CA 8800Z Activator- 8800CT1 THINNER,2/10/2020 12:00,2/10/2020 12:00,5,gal,7/1/2020 21:12,adminbomry,1,1,1,0,{'2020-07-01 21:12:32': 1},1,0
1832,Wichita KS,DefaultDept,005_02_PaintTopcoats,8800 B900 - CA 8800Z Activator- 8800CT1 THINNER,2/11/2020 12:00,2/11/2020 12:00,7,gal,7/1/2020 21:12,adminbomry,1,1,1,0,{'2020-07-01 21:12:32': 1},1,0
1833,Wichita KS,DefaultDept,005_02_PaintTopcoats,8800 B900 - CA 8800Z Activator- 8800CT1 THINNER,3/12/2020 12:00,3/12/2020 12:00,3,gal,"2020-07-01 21:15:03,2020-07-01 21:15:03","adminbomry,adminbomry",2,2,1,1,{'2020-07-01 21:15:03': 2},1,1
1834,Wichita KS,DefaultDept,005_02_PaintTopcoats,8800 B900 - CA 8800Z Activator- 8800CT1 THINNER,3/12/2020 12:00,3/12/2020 12:00,7,gal,7/1/2020 21:15,adminbomry,1,1,1,0,{'2020-07-01 21:15:03': 1},1,0
1835,Wichita KS,DefaultDept,005_02_PaintTopcoats,8800 B900 - CA 8800Z Activator- 8800CT1 THINNER,3/19/2020 12:00,3/19/2020 12:00,4,gal,7/1/2020 21:15,adminbomry,1,1,1,0,{'2020-07-01 21:15:03': 1},1,0
1836,Wichita KS,DefaultDept,005_02_PaintTopcoats,8800 B900 - CA 8800Z Activator- 8800CT1 THINNER,4/2/2020 12:00,4/2/2020 12:00,3,gal,7/27/2020 18:06,bomamanda,1,1,1,0,{'2020-07-27 18:06:19': 1},1,0
1837,Wichita KS,DefaultDept,005_02_PaintTopcoats,8800 B900 - CA 8800Z Activator- 8800CT1 THINNER,4/7/2020 12:00,4/7/2020 12:00,3,gal,7/27/2020 18:06,bomamanda,1,1,1,0,{'2020-07-27 18:06:19': 1},1,0
1838,Wichita KS,DefaultDept,005_02_PaintTopcoats,8800 B900 - CA 8800Z Activator- 8800CT1 THINNER,5/13/2020 12:00,5/13/2020 12:00,14,gal,7/27/2020 18:10,bomamanda,1,1,1,0,{'2020-07-27 18:10:32': 1},1,0
1839,Wichita KS,DefaultDept,005_02_PaintTopcoats,8800 B900 - CA 8800Z Activator- 8800CT1 THINNER,6/3/2020 12:00,6/3/2020 12:00,7,gal,7/27/2020 18:15,bomamanda,1,1,1,0,{'2020-07-27 18:15:38': 1},1,0
1840,Wichita KS,DefaultDept,005_02_PaintTopcoats,8800 B900 - CA 8800Z Activator- 8800CT1 THINNER,6/3/2020 12:00,6/3/2020 12:00,10,gal,7/27/2020 18:15,bomamanda,1,1,1,0,{'2020-07-27 18:15:38': 1},1,0
1841,Wichita KS,DefaultDept,005_02_PaintTopcoats,8800 B900 - CA 8800Z Activator- 8800CT1 THINNER,6/3/2020 12:00,6/3/2020 12:00,20,gal,7/27/2020 18:15,bomamanda,1,1,1,0,{'2020-07-27 18:15:38': 1},1,0
1842,Wichita KS,DefaultDept,005_02_PaintTopcoats,8800 B900 - CA 8800Z Activator- 8800CT1 THINNER,8/11/2020 12:00,8/11/2020 12:00,0,gal,9/4/2020 11:00,dlyon,1,1,1,0,{'2020-09-04 11:00:35': 1},1,0
1843,Wichita KS,DefaultDept,005_02_PaintTopcoats,8800 B900 - CA 8800Z Activator- 8800CT1 THINNER,8/11/2020 12:00,8/11/2020 12:00,7,gal,9/4/2020 11:00,dlyon,1,1,1,0,{'2020-09-04 11:00:35': 1},1,0
1844,Wichita KS,DefaultDept,005_02_PaintTopcoats,8800I03220CAG11B,5/2/2019 0:00,5/2/2019 0:00,1,gal,7/19/2019 13:24,adminbomry,1,1,1,0,{'2019-07-19 13:24:52': 1},1,0
1845,Wichita KS,DefaultDept,005_02_PaintTopcoats,8800I03220CAG11B,5/14/2019 0:00,5/14/2019 0:00,1,gal,7/19/2019 13:24,adminbomry,1,1,1,0,{'2019-07-19 13:24:52': 1},1,0
1846,Wichita KS,DefaultDept,005_02_PaintTopcoats,8800I03220CAG11B,5/15/2019 0:00,5/15/2019 0:00,1,gal,7/19/2019 13:24,adminbomry,1,1,1,0,{'2019-07-19 13:24:52': 1},1,0
1847,Wichita KS,DefaultDept,005_02_PaintTopcoats,9501025,5/31/2019 0:00,5/31/2019 0:00,1,gal,7/9/2019 9:18,adminbomry,1,1,1,0,{'2019-07-09 09:18:24': 1},1,0
1848,Wichita KS,DefaultDept,005_02_PaintTopcoats,9501025,6/30/2019 0:00,6/30/2019 0:00,1,gal,7/9/2019 9:24,adminbomry,1,1,1,0,{'2019-07-09 09:24:26': 1},1,0
1849,Wichita KS,DefaultDept,005_02_PaintTopcoats,"ACRY GLO HS INTERMIX, FLIGHT RED",4/30/2019 0:00,4/30/2019 0:00,1,gal,7/19/2019 13:22,adminbomry,1,1,1,0,{'2019-07-19 13:22:18': 1},1,0
1850,Wichita KS,DefaultDept,005_02_PaintTopcoats,"ACRY GLO HS Urethane (A-, M-, R- Colors)",4/26/2019 0:00,4/26/2019 0:00,1,gal,7/5/2019 11:50,adminbomry,1,1,1,0,{'2019-07-05 11:50:11': 1},1,0
1851,Wichita KS,DefaultDept,005_02_PaintTopcoats,"ACRY GLO HS Urethane (A-, M-, R- Colors)",8/2/2019 0:00,8/2/2019 0:00,1,gal,9/23/2019 11:14,adminbomry,1,1,1,0,{'2019-09-23 11:14:34': 1},1,0
1852,Wichita KS,DefaultDept,005_02_PaintTopcoats,"ACRY GLO HS Urethane (A-, M-, R- Colors)",6/3/2020 12:00,6/3/2020 12:00,2,gal,7/27/2020 18:15,bomamanda,1,1,1,0,{'2020-07-27 18:15:38': 1},1,0
1853,Wichita KS,DefaultDept,005_02_PaintTopcoats,"ACRY GLO HS Urethane (A-, M-, R- Colors)",7/20/2020 12:00,7/20/2020 12:00,1,gal,9/4/2020 10:46,dlyon,1,1,1,0,{'2020-09-04 10:46:12': 1},1,0
1854,Wichita KS,DefaultDept,005_02_PaintTopcoats,"ACRY GLO HS Urethane (A-, M-, R- Colors)",7/23/2020 12:00,7/23/2020 12:00,1,gal,9/4/2020 10:46,dlyon,1,1,1,0,{'2020-09-04 10:46:12': 1},1,0
1855,Wichita KS,DefaultDept,005_02_PaintTopcoats,ACRY GLO High Solids Activator/Stabilizer,4/26/2019 0:00,4/26/2019 0:00,0.25,gal,7/5/2019 11:50,adminbomry,1,1,1,0,{'2019-07-05 11:50:11': 1},1,0
1856,Wichita KS,DefaultDept,005_02_PaintTopcoats,ACRY GLO High Solids Activator/Stabilizer,4/26/2019 0:00,4/26/2019 0:00,2,gal,7/5/2019 11:50,adminbomry,1,1,1,0,{'2019-07-05 11:50:11': 1},1,0
1857,Wichita KS,DefaultDept,005_02_PaintTopcoats,ACRY GLO High Solids Activator/Stabilizer,6/8/2019 0:00,6/8/2019 0:00,2.5,gal,7/5/2019 13:18,adminbomry,1,1,1,0,{'2019-07-05 13:18:36': 1},1,0
1858,Wichita KS,DefaultDept,005_02_PaintTopcoats,ACRY GLO High Solids Activator/Stabilizer,6/3/2020 12:00,6/3/2020 12:00,1.25,gal,7/27/2020 18:15,bomamanda,1,1,1,0,{'2020-07-27 18:15:38': 1},1,0
1859,Wichita KS,DefaultDept,005_02_PaintTopcoats,ACRY GLO High Solids Activator/Stabilizer,9/25/2020 12:00,9/25/2020 12:00,1.25,gal,10/22/2020 11:27,dlyon,1,1,1,0,{'2020-10-22 11:27:27': 1},1,0
1860,Wichita KS,DefaultDept,005_02_PaintTopcoats,ACRY GLO High Solids Activator/Stabilizer,12/8/2020 12:00,12/8/2020 12:00,1.25,gal,1/8/2021 8:59,dlyon,1,1,1,0,{'2021-01-08 08:59:12': 1},1,0
1861,Wichita KS,DefaultDept,005_02_PaintTopcoats,"ACRY GLO Urethane H-, T-, W-",8/22/2019 0:00,8/22/2019 0:00,1,gal,"2019-09-23 11:14:34,2019-09-23 10:35:10","adminbomry,adminbomry",2,2,2,0,"{'2019-09-23 11:14:34': 1, '2019-09-23 10:35:10': 1}",1,1
1862,Wichita KS,DefaultDept,005_02_PaintTopcoats,"ACRY GLO Urethane H-, T-, W-",7/27/2020 12:00,7/27/2020 12:00,2,gal,9/4/2020 10:46,dlyon,1,1,1,0,{'2020-09-04 10:46:12': 1},1,0
1863,Wichita KS,DefaultDept,005_02_PaintTopcoats,AD7208 - old,4/30/2019 0:00,4/30/2019 0:00,0.5625,gal,7/8/2019 16:10,adminbomry,1,1,1,0,{'2019-07-08 16:10:45': 1},1,0
1864,Wichita KS,DefaultDept,005_02_PaintTopcoats,AD7310_old,7/30/2019 0:00,7/30/2019 0:00,6,gal,10/8/2019 16:55,adminbomry,1,1,1,0,{'2019-10-08 16:55:41': 1},1,0
1865,Wichita KS,DefaultDept,005_02_PaintTopcoats,AD7310_old,9/20/2019 0:00,9/20/2019 0:00,6,gal,10/8/2019 17:32,adminbomry,1,1,1,0,{'2019-10-08 17:32:28': 1},1,0
1866,Wichita KS,DefaultDept,005_02_PaintTopcoats,AD7310_old,10/1/2019 12:00,10/31/2019 12:00,6,gal,12/19/2019 16:04,adminbomry,1,1,1,0,{'2019-12-19 16:04:12': 1},1,0
1867,Wichita KS,DefaultDept,005_02_PaintTopcoats,AD8746 - old,8/13/2019 0:00,8/13/2019 0:00,1.125,gal,9/6/2019 10:58,adminbomgb,1,1,1,0,{'2019-09-06 10:58:59': 1},1,0
1868,Wichita KS,DefaultDept,005_02_PaintTopcoats,ADMS1403K - old,5/14/2019 0:00,5/14/2019 0:00,1.5,gal,7/8/2019 16:28,adminbomry,1,1,1,0,{'2019-07-08 16:28:37': 1},1,0
1869,Wichita KS,DefaultDept,005_02_PaintTopcoats,ADMS1501K - old,4/30/2019 0:00,4/30/2019 0:00,0.5625,gal,7/8/2019 16:10,adminbomry,1,1,1,0,{'2019-07-08 16:10:45': 1},1,0
1870,Wichita KS,DefaultDept,005_02_PaintTopcoats,ADMS1501K - old,9/19/2019 0:00,9/19/2019 0:00,1.125,gal,10/8/2019 17:32,adminbomry,1,1,1,0,{'2019-10-08 17:32:28': 1},1,0
1871,Wichita KS,DefaultDept,005_02_PaintTopcoats,ADMS1501K - old,10/1/2019 12:00,10/31/2019 12:00,1.125,gal,12/19/2019 16:04,adminbomry,1,1,1,0,{'2019-12-19 16:04:12': 1},1,0
1872,Wichita KS,DefaultDept,005_02_PaintTopcoats,ADMS2108K,4/16/2019 0:00,4/16/2019 0:00,0.5625,gal,7/8/2019 16:10,adminbomry,1,1,1,0,{'2019-07-08 16:10:45': 1},1,0
1873,Wichita KS,DefaultDept,005_02_PaintTopcoats,ADMS2108K,7/24/2019 0:00,7/24/2019 0:00,0.5625,gal,8/12/2019 11:08,adminbomgb,1,1,1,0,{'2019-08-12 11:08:52': 1},1,0
1874,Wichita KS,DefaultDept,005_02_PaintTopcoats,ADMS2108K,9/17/2019 0:00,9/17/2019 0:00,1.6875,gal,10/8/2019 17:32,adminbomry,1,1,1,0,{'2019-10-08 17:32:28': 1},1,0
1875,Wichita KS,DefaultDept,005_02_PaintTopcoats,ADMS2108K,10/1/2019 12:00,10/31/2019 12:00,1.6875,gal,12/19/2019 16:04,adminbomry,1,1,1,0,{'2019-12-19 16:04:12': 1},1,0
1876,Wichita KS,DefaultDept,005_02_PaintTopcoats,ADMS2108K,3/30/2020 12:00,3/30/2020 12:00,0.5625,gal,7/14/2020 19:38,adminbomry,1,1,1,0,{'2020-07-14 19:38:52': 1},1,0
1877,Wichita KS,DefaultDept,005_02_PaintTopcoats,ADMS2108K,4/8/2020 12:00,4/8/2020 12:00,0.5625,gal,8/4/2020 17:03,bomamanda,1,1,1,0,{'2020-08-04 17:03:39': 1},1,0
1878,Wichita KS,DefaultDept,005_02_PaintTopcoats,ALODINE 1132 TOUCH-N-PREP COATINGS,2/19/2019 0:00,2/19/2019 0:00,0.042267536,gal,7/16/2019 13:30,adminbomgb,1,1,1,0,{'2019-07-16 13:30:40': 1},1,0
1879,Wichita KS,DefaultDept,005_02_PaintTopcoats,ALODINE 1132 TOUCH-N-PREP COATINGS,3/5/2019 0:00,3/5/2019 0:00,0.042267536,gal,7/16/2019 13:51,adminbomgb,1,1,1,0,{'2019-07-16 13:51:52': 1},1,0
1880,Wichita KS,DefaultDept,005_02_PaintTopcoats,ALODINE 1132 TOUCH-N-PREP COATINGS,3/14/2019 0:00,3/14/2019 0:00,0.65625,gal,7/5/2019 13:44,adminbomgb,1,1,1,0,{'2019-07-05 13:44:50': 1},1,0
1881,Wichita KS,DefaultDept,005_02_PaintTopcoats,ALODINE 1132 TOUCH-N-PREP COATINGS,3/19/2019 0:00,3/19/2019 0:00,0.021133768,gal,7/16/2019 13:51,adminbomgb,1,1,1,0,{'2019-07-16 13:51:52': 1},1,0
1882,Wichita KS,DefaultDept,005_02_PaintTopcoats,ALODINE 1132 TOUCH-N-PREP COATINGS,3/26/2019 0:00,3/26/2019 0:00,0.063401304,gal,7/16/2019 13:51,adminbomgb,1,1,1,0,{'2019-07-16 13:51:52': 1},1,0
1883,Wichita KS,DefaultDept,005_02_PaintTopcoats,ALODINE 1132 TOUCH-N-PREP COATINGS,4/3/2019 0:00,4/3/2019 0:00,0.010566884,gal,7/16/2019 14:13,adminbomgb,1,1,1,0,{'2019-07-16 14:13:28': 1},1,0
1884,Wichita KS,DefaultDept,005_02_PaintTopcoats,ALODINE 1132 TOUCH-N-PREP COATINGS,4/16/2019 0:00,4/16/2019 0:00,0.1248,gal,7/8/2019 15:44,adminbomgb,1,1,1,0,{'2019-07-08 15:44:49': 1},1,0
1885,Wichita KS,DefaultDept,005_02_PaintTopcoats,ALODINE 1132 TOUCH-N-PREP COATINGS,4/23/2019 0:00,4/23/2019 0:00,0.05283442,gal,7/16/2019 14:13,adminbomgb,1,1,1,0,{'2019-07-16 14:13:28': 1},1,0
1886,Wichita KS,DefaultDept,005_02_PaintTopcoats,ALODINE 1132 TOUCH-N-PREP COATINGS,5/8/2019 0:00,5/8/2019 0:00,1.3125,gal,7/5/2019 12:02,adminbomry,1,1,1,0,{'2019-07-05 12:02:13': 1},1,0
1887,Wichita KS,DefaultDept,005_02_PaintTopcoats,ALODINE 1132 TOUCH-N-PREP COATINGS,5/14/2019 0:00,5/14/2019 0:00,0.05283442,gal,7/16/2019 14:41,adminbomgb,1,1,1,0,{'2019-07-16 14:41:30': 1},1,0
1888,Wichita KS,DefaultDept,005_02_PaintTopcoats,ALODINE 1132 TOUCH-N-PREP COATINGS,6/4/2019 0:00,6/4/2019 0:00,0.05283442,gal,7/16/2019 14:58,adminbomgb,1,1,1,0,{'2019-07-16 14:58:36': 1},1,0
1889,Wichita KS,DefaultDept,005_02_PaintTopcoats,ALODINE 1132 TOUCH-N-PREP COATINGS,6/18/2019 0:00,6/18/2019 0:00,0.010566884,gal,7/16/2019 14:58,adminbomgb,1,1,1,0,{'2019-07-16 14:58:36': 1},1,0
1890,Wichita KS,DefaultDept,005_02_PaintTopcoats,ALODINE 1132 TOUCH-N-PREP COATINGS,6/18/2019 0:00,6/18/2019 0:00,0.05283442,gal,7/16/2019 14:58,adminbomgb,1,1,1,0,{'2019-07-16 14:58:36': 1},1,0
1891,Wichita KS,DefaultDept,005_02_PaintTopcoats,ALODINE 1132 TOUCH-N-PREP COATINGS,7/1/2019 0:00,7/1/2019 0:00,0.042267536,gal,9/4/2019 10:15,adminbomgb,1,1,1,0,{'2019-09-04 10:15:40': 1},1,0
1892,Wichita KS,DefaultDept,005_02_PaintTopcoats,ALODINE 1132 TOUCH-N-PREP COATINGS,7/11/2019 0:00,7/11/2019 0:00,2.1875,gal,8/9/2019 10:06,adminbomry,1,1,1,0,{'2019-08-09 10:06:56': 1},1,0
1893,Wichita KS,DefaultDept,005_02_PaintTopcoats,ALODINE 1132 TOUCH-N-PREP COATINGS,8/16/2019 0:00,8/16/2019 0:00,1.859375,gal,9/23/2019 10:35,adminbomry,1,1,1,0,{'2019-09-23 10:35:09': 1},1,0
1894,Wichita KS,DefaultDept,005_02_PaintTopcoats,ALODINE 1132 TOUCH-N-PREP COATINGS,8/20/2019 0:00,8/20/2019 0:00,10.5,gal,9/23/2019 10:35,adminbomry,1,1,1,0,{'2019-09-23 10:35:09': 1},1,0
1895,Wichita KS,DefaultDept,005_02_PaintTopcoats,ALODINE 1132 TOUCH-N-PREP COATINGS,8/21/2019 0:00,8/21/2019 0:00,2.625,gal,9/23/2019 10:35,adminbomry,1,1,1,0,{'2019-09-23 10:35:09': 1},1,0
1896,Wichita KS,DefaultDept,005_02_PaintTopcoats,ALODINE 1132 TOUCH-N-PREP COATINGS,8/27/2019 0:00,8/27/2019 0:00,0.05283442,gal,9/6/2019 13:54,adminbomgb,1,1,1,0,{'2019-09-06 13:54:15': 1},1,0
1897,Wichita KS,DefaultDept,005_02_PaintTopcoats,ALODINE 1132 TOUCH-N-PREP COATINGS,10/7/2019 12:00,10/7/2019 12:00,2.625,gal,12/19/2019 16:04,adminbomry,1,1,1,0,{'2019-12-19 16:04:12': 1},1,0
1898,Wichita KS,DefaultDept,005_02_PaintTopcoats,ALODINE 1132 TOUCH-N-PREP COATINGS,10/15/2019 12:00,10/15/2019 12:00,0.010566884,gal,1/8/2020 15:03,adminbomry,1,1,1,0,{'2020-01-08 15:03:59': 1},1,0
1899,Wichita KS,DefaultDept,005_02_PaintTopcoats,ALODINE 1132 TOUCH-N-PREP COATINGS,10/15/2019 12:00,10/15/2019 12:00,0.05283442,gal,1/8/2020 15:03,adminbomry,1,1,1,0,{'2020-01-08 15:03:59': 1},1,0
1900,Wichita KS,DefaultDept,005_02_PaintTopcoats,ALODINE 1132 TOUCH-N-PREP COATINGS,12/17/2019 12:00,12/17/2019 12:00,0.063401304,gal,1/9/2020 18:18,adminbomry,1,1,1,0,{'2020-01-09 18:18:00': 1},1,0
1901,Wichita KS,DefaultDept,005_02_PaintTopcoats,ATR-1000 Quick Fill A/B BLEND,5/28/2019 0:00,5/28/2019 0:00,0.03125,gal,7/16/2019 14:41,adminbomgb,1,1,1,0,{'2019-07-16 14:41:30': 1},1,0
1902,Wichita KS,DefaultDept,005_02_PaintTopcoats,ATR-1000 Quick Fill A/B BLEND,6/25/2019 0:00,6/25/2019 0:00,0.03125,gal,7/16/2019 14:58,adminbomgb,1,1,1,0,{'2019-07-16 14:58:36': 1},1,0
1903,Wichita KS,DefaultDept,005_02_PaintTopcoats,ATR-1000 Quick Fill A/B BLEND,7/9/2019 0:00,7/9/2019 0:00,0.0625,gal,9/4/2019 10:15,adminbomgb,1,1,1,0,{'2019-09-04 10:15:40': 1},1,0
1904,Wichita KS,DefaultDept,005_02_PaintTopcoats,ATR-1000 Quick Fill A/B BLEND,9/10/2019 12:00,9/10/2019 12:00,0.03125,gal,10/24/2019 17:39,adminbomry,1,1,1,0,{'2019-10-24 17:39:29': 1},1,0
1905,Wichita KS,DefaultDept,005_02_PaintTopcoats,Ardrox AV 8 Aerosol,10/22/2019 12:00,10/22/2019 12:00,0.2109375,gal,1/8/2020 15:03,adminbomry,1,1,1,0,{'2020-01-08 15:03:58': 1},1,0
1906,Wichita KS,DefaultDept,005_02_PaintTopcoats,Ardrox AV 8 Aerosol,11/12/2019 12:00,11/12/2019 12:00,0.52734375,gal,12/16/2019 15:50,adminbomry,1,1,1,0,{'2019-12-16 15:50:03': 1},1,0
1907,Wichita KS,DefaultDept,005_02_PaintTopcoats,Autobase Plus MM Q140 Deep Black,4/1/2019 0:00,4/1/2019 0:00,4,gal,7/19/2019 13:22,adminbomry,1,1,1,0,{'2019-07-19 13:22:18': 1},1,0
1908,Wichita KS,DefaultDept,005_02_PaintTopcoats,BAPAINT-BK-1 (PG-6-BK9) QT KIT  BLACK,8/23/2019 0:00,8/23/2019 0:00,0.25,gal,9/23/2019 11:14,adminbomry,1,1,1,0,{'2019-09-23 11:14:34': 1},1,0
1909,Wichita KS,DefaultDept,005_02_PaintTopcoats,BAPAINT-BK-1 (PG-6-BK9) QT KIT  BLACK,8/26/2019 0:00,8/26/2019 0:00,0.25,gal,9/23/2019 11:14,adminbomry,1,1,1,0,{'2019-09-23 11:14:34': 1},1,0
1910,Wichita KS,DefaultDept,005_02_PaintTopcoats,BAPAINT-BK-1 (PG-6-BK9) QT KIT  BLACK,9/11/2019 12:00,9/11/2019 12:00,0.25,gal,11/25/2019 9:54,adminbomry,1,1,1,0,{'2019-11-25 09:54:31': 1},1,0
1911,Wichita KS,DefaultDept,005_02_PaintTopcoats,BAPAINT-BK-1 (PG-6-BK9) QT KIT  BLACK,10/23/2019 12:00,10/23/2019 12:00,0.5,gal,12/19/2019 16:04,adminbomry,1,1,1,0,{'2019-12-19 16:04:12': 1},1,0
1912,Wichita KS,DefaultDept,005_02_PaintTopcoats,BAPAINT-BK-1 (PG-6-BK9) QT KIT  BLACK,10/26/2019 12:00,10/26/2019 12:00,0.5,gal,12/19/2019 16:04,adminbomry,1,1,1,0,{'2019-12-19 16:04:12': 1},1,0
1913,Wichita KS,DefaultDept,005_02_PaintTopcoats,BAPAINT-BK-1 (PG-6-BK9) QT KIT  BLACK,11/5/2019 12:00,11/5/2019 12:00,0.5,gal,12/19/2019 15:35,ascheufler,1,1,1,0,{'2019-12-19 15:35:45': 1},1,0
1914,Wichita KS,DefaultDept,005_02_PaintTopcoats,BAPAINT-BK-1 (PG-6-BK9) QT KIT  BLACK,11/8/2019 12:00,11/8/2019 12:00,0.25,gal,"2019-12-19 15:35:45,2019-12-19 15:35:45","ascheufler,ascheufler",2,2,1,1,{'2019-12-19 15:35:45': 2},1,1
1915,Wichita KS,DefaultDept,005_02_PaintTopcoats,BAPAINT-BK-1 (PG-6-BK9) QT KIT  BLACK,11/8/2019 12:00,11/8/2019 12:00,0.5,gal,12/19/2019 15:35,ascheufler,1,1,1,0,{'2019-12-19 15:35:45': 1},1,0
1916,Wichita KS,DefaultDept,005_02_PaintTopcoats,BAPAINT-BK-1 (PG-6-BK9) QT KIT  BLACK,11/26/2019 12:00,11/26/2019 12:00,0.5,gal,12/19/2019 15:35,ascheufler,1,1,1,0,{'2019-12-19 15:35:45': 1},1,0
1917,Wichita KS,DefaultDept,005_02_PaintTopcoats,BAPAINT-BK-1 (PG-6-BK9) QT KIT  BLACK,12/1/2019 12:00,12/1/2019 12:00,0.25,gal,1/9/2020 18:22,adminbomry,1,1,1,0,{'2020-01-09 18:22:20': 1},1,0
1918,Wichita KS,DefaultDept,005_02_PaintTopcoats,BAPAINT-BK-1 (PG-6-BK9) QT KIT  BLACK,1/3/2020 12:00,1/3/2020 12:00,0.5,gal,7/1/2020 21:07,adminbomry,1,1,1,0,{'2020-07-01 21:07:35': 1},1,0
1919,Wichita KS,DefaultDept,005_02_PaintTopcoats,BAPAINT-BK-1 (PG-6-BK9) QT KIT  BLACK,1/13/2020 12:00,1/13/2020 12:00,0.25,gal,7/1/2020 21:07,adminbomry,1,1,1,0,{'2020-07-01 21:07:35': 1},1,0
1920,Wichita KS,DefaultDept,005_02_PaintTopcoats,BAPAINT-BK-1 (PG-6-BK9) QT KIT  BLACK,1/25/2020 12:00,1/25/2020 12:00,0.5,gal,7/1/2020 21:07,adminbomry,1,1,1,0,{'2020-07-01 21:07:35': 1},1,0
1921,Wichita KS,DefaultDept,005_02_PaintTopcoats,BAPAINT-BK-1 (PG-6-BK9) QT KIT  BLACK,2/9/2020 12:00,2/9/2020 12:00,0.25,gal,7/1/2020 21:12,adminbomry,1,1,1,0,{'2020-07-01 21:12:32': 1},1,0
1922,Wichita KS,DefaultDept,005_02_PaintTopcoats,BAPAINT-MBE-34 (PG-6-MB23) GAL KIT KOCH BLUE,8/26/2019 0:00,8/26/2019 0:00,1,gal,9/23/2019 11:14,adminbomry,1,1,1,0,{'2019-09-23 11:14:34': 1},1,0
1923,Wichita KS,DefaultDept,005_02_PaintTopcoats,BAPAINT-MBE-34 (PG-6-MB23) GAL KIT KOCH BLUE,9/11/2019 12:00,9/11/2019 12:00,1,gal,11/25/2019 9:54,adminbomry,1,1,1,0,{'2019-11-25 09:54:31': 1},1,0
1924,Wichita KS,DefaultDept,005_02_PaintTopcoats,BAPAINT-MBE-34 (PG-6-MB23) GAL KIT KOCH BLUE,10/26/2019 12:00,10/26/2019 12:00,2,gal,12/19/2019 16:04,adminbomry,1,1,1,0,{'2019-12-19 16:04:12': 1},1,0
1925,Wichita KS,DefaultDept,005_02_PaintTopcoats,BAPAINT-MBE-34 (PG-6-MB23) GAL KIT KOCH BLUE,10/31/2019 12:00,10/31/2019 12:00,2,gal,12/19/2019 16:04,adminbomry,1,1,1,0,{'2019-12-19 16:04:12': 1},1,0
1926,Wichita KS,DefaultDept,005_02_PaintTopcoats,BAPAINT-MBE-34 (PG-6-MB23) GAL KIT KOCH BLUE,11/4/2019 12:00,11/4/2019 12:00,1,gal,12/19/2019 15:35,ascheufler,1,1,1,0,{'2019-12-19 15:35:45': 1},1,0
1927,Wichita KS,DefaultDept,005_02_PaintTopcoats,BAPAINT-MBE-34 (PG-6-MB23) GAL KIT KOCH BLUE,11/26/2019 12:00,11/26/2019 12:00,2,gal,12/19/2019 15:35,ascheufler,1,1,1,0,{'2019-12-19 15:35:45': 1},1,0
1928,Wichita KS,DefaultDept,005_02_PaintTopcoats,BAPAINT-MBE-34 (PG-6-MB23) GAL KIT KOCH BLUE,12/4/2019 12:00,12/4/2019 12:00,1,gal,1/9/2020 18:22,adminbomry,1,1,1,0,{'2020-01-09 18:22:20': 1},1,0
1929,Wichita KS,DefaultDept,005_02_PaintTopcoats,BAPAINT-MBE-34 (PG-6-MB23) GAL KIT KOCH BLUE,1/3/2020 12:00,1/3/2020 12:00,2,gal,7/1/2020 21:07,adminbomry,1,1,1,0,{'2020-07-01 21:07:35': 1},1,0
1930,Wichita KS,DefaultDept,005_02_PaintTopcoats,BAPAINT-MBE-34 (PG-6-MB23) GAL KIT KOCH BLUE,1/13/2020 12:00,1/13/2020 12:00,1,gal,7/1/2020 21:07,adminbomry,1,1,1,0,{'2020-07-01 21:07:35': 1},1,0
1931,Wichita KS,DefaultDept,005_02_PaintTopcoats,BAPAINT-MBE-34 (PG-6-MB23) GAL KIT KOCH BLUE,1/25/2020 12:00,1/25/2020 12:00,2,gal,7/1/2020 21:07,adminbomry,1,1,1,0,{'2020-07-01 21:07:35': 1},1,0
1932,Wichita KS,DefaultDept,005_02_PaintTopcoats,BAPAINT-MBE-34 (PG-6-MB23) GAL KIT KOCH BLUE,2/9/2020 12:00,2/9/2020 12:00,1,gal,7/1/2020 21:12,adminbomry,1,1,1,0,{'2020-07-01 21:12:32': 1},1,0
1933,Wichita KS,DefaultDept,005_02_PaintTopcoats,BAPAINT-MBE-34 (PG-6-MB23) GAL KIT KOCH BLUE,3/9/2020 12:00,3/9/2020 12:00,2,gal,7/1/2020 21:15,adminbomry,1,1,1,0,{'2020-07-01 21:15:03': 1},1,0
1934,Wichita KS,DefaultDept,005_02_PaintTopcoats,BAPAINT-MGD-25 (PG-6-MC26) GAL KIT KOCH OF HEARTS,8/26/2019 0:00,8/26/2019 0:00,1,gal,9/23/2019 11:14,adminbomry,1,1,1,0,{'2019-09-23 11:14:34': 1},1,0
1935,Wichita KS,DefaultDept,005_02_PaintTopcoats,BAPAINT-MGD-25 (PG-6-MC26) GAL KIT KOCH OF HEARTS,9/11/2019 12:00,9/11/2019 12:00,1,gal,11/25/2019 9:54,adminbomry,1,1,1,0,{'2019-11-25 09:54:31': 1},1,0
1936,Wichita KS,DefaultDept,005_02_PaintTopcoats,BAPAINT-MGD-25 (PG-6-MC26) GAL KIT KOCH OF HEARTS,10/26/2019 12:00,10/26/2019 12:00,2,gal,12/19/2019 16:04,adminbomry,1,1,1,0,{'2019-12-19 16:04:12': 1},1,0
1937,Wichita KS,DefaultDept,005_02_PaintTopcoats,BAPAINT-MGD-25 (PG-6-MC26) GAL KIT KOCH OF HEARTS,10/31/2019 12:00,10/31/2019 12:00,2,gal,12/19/2019 16:04,adminbomry,1,1,1,0,{'2019-12-19 16:04:12': 1},1,0
1938,Wichita KS,DefaultDept,005_02_PaintTopcoats,BAPAINT-MGD-25 (PG-6-MC26) GAL KIT KOCH OF HEARTS,11/4/2019 12:00,11/4/2019 12:00,1,gal,12/19/2019 15:35,ascheufler,1,1,1,0,{'2019-12-19 15:35:45': 1},1,0
1939,Wichita KS,DefaultDept,005_02_PaintTopcoats,BAPAINT-MGD-25 (PG-6-MC26) GAL KIT KOCH OF HEARTS,11/26/2019 12:00,11/26/2019 12:00,2,gal,12/19/2019 15:35,ascheufler,1,1,1,0,{'2019-12-19 15:35:45': 1},1,0
1940,Wichita KS,DefaultDept,005_02_PaintTopcoats,BAPAINT-MGD-25 (PG-6-MC26) GAL KIT KOCH OF HEARTS,12/4/2019 12:00,12/4/2019 12:00,1,gal,1/9/2020 18:22,adminbomry,1,1,1,0,{'2020-01-09 18:22:20': 1},1,0
1941,Wichita KS,DefaultDept,005_02_PaintTopcoats,BAPAINT-MGD-25 (PG-6-MC26) GAL KIT KOCH OF HEARTS,1/3/2020 12:00,1/3/2020 12:00,2,gal,7/1/2020 21:07,adminbomry,1,1,1,0,{'2020-07-01 21:07:35': 1},1,0
1942,Wichita KS,DefaultDept,005_02_PaintTopcoats,BAPAINT-MGD-25 (PG-6-MC26) GAL KIT KOCH OF HEARTS,1/13/2020 12:00,1/13/2020 12:00,1,gal,7/1/2020 21:07,adminbomry,1,1,1,0,{'2020-07-01 21:07:35': 1},1,0
1943,Wichita KS,DefaultDept,005_02_PaintTopcoats,BAPAINT-MGD-25 (PG-6-MC26) GAL KIT KOCH OF HEARTS,1/25/2020 12:00,1/25/2020 12:00,2,gal,7/1/2020 21:07,adminbomry,1,1,1,0,{'2020-07-01 21:07:35': 1},1,0
1944,Wichita KS,DefaultDept,005_02_PaintTopcoats,BAPAINT-MGD-25 (PG-6-MC26) GAL KIT KOCH OF HEARTS,2/9/2020 12:00,2/9/2020 12:00,1,gal,7/1/2020 21:12,adminbomry,1,1,1,0,{'2020-07-01 21:12:32': 1},1,0
1945,Wichita KS,DefaultDept,005_02_PaintTopcoats,BAPAINT-MGD-25 (PG-6-MC26) GAL KIT KOCH OF HEARTS,3/9/2020 12:00,3/9/2020 12:00,2,gal,7/1/2020 21:15,adminbomry,1,1,1,0,{'2020-07-01 21:15:03': 1},1,0
1946,Wichita KS,DefaultDept,005_02_PaintTopcoats,BAPAINT-WH-42 (PG-6-W207)  MATTERHORN WHITE,8/26/2019 0:00,8/26/2019 0:00,3,gal,9/23/2019 11:14,adminbomry,1,1,1,0,{'2019-09-23 11:14:34': 1},1,0
1947,Wichita KS,DefaultDept,005_02_PaintTopcoats,BAPAINT-WH-42 (PG-6-W207)  MATTERHORN WHITE,9/11/2019 12:00,9/11/2019 12:00,3,gal,11/25/2019 9:54,adminbomry,1,1,1,0,{'2019-11-25 09:54:31': 1},1,0
1948,Wichita KS,DefaultDept,005_02_PaintTopcoats,BAPAINT-WH-42 (PG-6-W207)  MATTERHORN WHITE,10/26/2019 12:00,10/26/2019 12:00,6,gal,12/19/2019 16:04,adminbomry,1,1,1,0,{'2019-12-19 16:04:12': 1},1,0
1949,Wichita KS,DefaultDept,005_02_PaintTopcoats,BAPAINT-WH-42 (PG-6-W207)  MATTERHORN WHITE,10/31/2019 12:00,10/31/2019 12:00,6,gal,12/19/2019 16:04,adminbomry,1,1,1,0,{'2019-12-19 16:04:12': 1},1,0
1950,Wichita KS,DefaultDept,005_02_PaintTopcoats,BAPAINT-WH-42 (PG-6-W207)  MATTERHORN WHITE,11/4/2019 12:00,11/4/2019 12:00,3,gal,"2019-12-19 15:35:45,2019-12-19 15:35:45","ascheufler,ascheufler",2,2,1,1,{'2019-12-19 15:35:45': 2},1,1
1951,Wichita KS,DefaultDept,005_02_PaintTopcoats,BAPAINT-WH-42 (PG-6-W207)  MATTERHORN WHITE,11/26/2019 12:00,11/26/2019 12:00,6,gal,12/19/2019 15:35,ascheufler,1,1,1,0,{'2019-12-19 15:35:45': 1},1,0
1952,Wichita KS,DefaultDept,005_02_PaintTopcoats,BAPAINT-WH-42 (PG-6-W207)  MATTERHORN WHITE,12/1/2019 12:00,12/1/2019 12:00,3,gal,1/9/2020 18:22,adminbomry,1,1,1,0,{'2020-01-09 18:22:20': 1},1,0
1953,Wichita KS,DefaultDept,005_02_PaintTopcoats,BAPAINT-WH-42 (PG-6-W207)  MATTERHORN WHITE,1/3/2020 12:00,1/3/2020 12:00,6,gal,7/1/2020 21:07,adminbomry,1,1,1,0,{'2020-07-01 21:07:35': 1},1,0
1954,Wichita KS,DefaultDept,005_02_PaintTopcoats,BAPAINT-WH-42 (PG-6-W207)  MATTERHORN WHITE,1/13/2020 12:00,1/13/2020 12:00,3,gal,7/1/2020 21:07,adminbomry,1,1,1,0,{'2020-07-01 21:07:35': 1},1,0
1955,Wichita KS,DefaultDept,005_02_PaintTopcoats,BAPAINT-WH-42 (PG-6-W207)  MATTERHORN WHITE,1/25/2020 12:00,1/25/2020 12:00,6,gal,7/1/2020 21:07,adminbomry,1,1,1,0,{'2020-07-01 21:07:35': 1},1,0
1956,Wichita KS,DefaultDept,005_02_PaintTopcoats,BAPAINT-WH-42 (PG-6-W207)  MATTERHORN WHITE,2/9/2020 12:00,2/9/2020 12:00,3,gal,7/1/2020 21:12,adminbomry,1,1,1,0,{'2020-07-01 21:12:32': 1},1,0
1957,Wichita KS,DefaultDept,005_02_PaintTopcoats,BAPAINT-WH-42 (PG-6-W207)  MATTERHORN WHITE,3/9/2020 12:00,3/9/2020 12:00,6,gal,7/1/2020 21:15,adminbomry,1,1,1,0,{'2020-07-01 21:15:03': 1},1,0
1958,Wichita KS,DefaultDept,005_02_PaintTopcoats,BAPAINT-WH-42 (PG-6-W207)  MATTERHORN WHITE,3/10/2020 12:00,3/10/2020 12:00,3,gal,7/1/2020 21:15,adminbomry,1,1,1,0,{'2020-07-01 21:15:03': 1},1,0
1959,Wichita KS,DefaultDept,005_02_PaintTopcoats,BAPAINT-WH-42 (PG-6-W207)  MATTERHORN WHITE,3/11/2020 12:00,3/11/2020 12:00,4,gal,7/1/2020 21:15,adminbomry,1,1,1,0,{'2020-07-01 21:15:03': 1},1,0
1960,Wichita KS,DefaultDept,005_02_PaintTopcoats,BAPAINT-WH-42 (PG-6-W207)  MATTERHORN WHITE,4/1/2020 12:00,4/1/2020 12:00,1,gal,7/27/2020 18:06,bomamanda,1,1,1,0,{'2020-07-27 18:06:19': 1},1,0
1961,Wichita KS,DefaultDept,005_02_PaintTopcoats,BAPAINT-WH-42 (PG-6-W207)  MATTERHORN WHITE,4/7/2020 12:00,4/7/2020 12:00,1,gal,7/27/2020 18:06,bomamanda,1,1,1,0,{'2020-07-27 18:06:19': 1},1,0
1962,Wichita KS,DefaultDept,005_02_PaintTopcoats,BAPAINT-WH-42 (PG-6-W207)  MATTERHORN WHITE,4/13/2020 12:00,4/13/2020 12:00,4,gal,7/27/2020 18:06,bomamanda,1,1,1,0,{'2020-07-27 18:06:19': 1},1,0
1963,Wichita KS,DefaultDept,005_02_PaintTopcoats,BONDERITE M-CR 600RTU AERO known as ALODINE 600 RTU,3/1/2019 12:00,3/31/2019 12:00,107.8437844,gal,3/24/2020 13:19,adminbomry,1,1,1,0,{'2020-03-24 13:19:41': 1},1,0
1964,Wichita KS,DefaultDept,005_02_PaintTopcoats,BONDERITE M-CR 600RTU AERO_old,5/1/2019 12:00,5/31/2019 12:00,107.8437844,gal,3/24/2020 13:19,adminbomry,1,1,1,0,{'2020-03-24 13:19:40': 1},1,0
1965,Wichita KS,DefaultDept,005_02_PaintTopcoats,BONDERITE M-CR 600RTU AERO_old,8/1/2019 12:00,8/31/2019 12:00,118.6281629,gal,3/24/2020 13:19,adminbomry,1,1,1,0,{'2020-03-24 13:19:40': 1},1,0
1966,Wichita KS,DefaultDept,005_02_PaintTopcoats,Blend: 00333873 - 00333861 (2.33:1),2/7/2020 12:00,2/7/2020 12:00,5.28343955,gal,7/8/2020 17:15,adminbomry,1,1,1,0,{'2020-07-08 17:15:15': 1},1,0
1967,Wichita KS,DefaultDept,005_02_PaintTopcoats,Blend: 00333873 - 00333861 (2.33:1),2/27/2020 12:00,2/27/2020 12:00,5.28343955,gal,7/8/2020 17:15,adminbomry,1,1,1,0,{'2020-07-08 17:15:15': 1},1,0
1968,Wichita KS,DefaultDept,005_02_PaintTopcoats,Blend: 00333873 - 00333861 (2.33:1),3/20/2020 12:00,3/20/2020 12:00,5.28343955,gal,7/8/2020 17:15,adminbomry,1,1,1,0,{'2020-07-08 17:15:15': 1},1,0
1969,Wichita KS,DefaultDept,005_02_PaintTopcoats,Blend: 00333873 - 00333861 (2.33:1),6/22/2020 12:00,6/22/2020 12:00,5.28343955,gal,7/27/2020 18:15,bomamanda,1,1,1,0,{'2020-07-27 18:15:38': 1},1,0
1970,Wichita KS,DefaultDept,005_02_PaintTopcoats,Blend: 00333873 - 00333861 (2.33:1),8/12/2020 12:00,8/12/2020 12:00,5.28343955,gal,9/4/2020 11:00,dlyon,1,1,1,0,{'2020-09-04 11:00:35': 1},1,0
1971,Wichita KS,DefaultDept,005_02_PaintTopcoats,Blend: 00333873 - 00333861 (2.33:1),10/1/2020 12:00,10/1/2020 12:00,5.28343955,gal,12/2/2020 15:13,dlyon,1,1,1,0,{'2020-12-02 15:13:12': 1},1,0
1972,Wichita KS,DefaultDept,005_02_PaintTopcoats,Blend: 00333873 - 00333861 (2.33:1),11/2/2020 12:00,11/2/2020 12:00,5.28343955,gal,12/8/2020 9:27,dlyon,1,1,1,0,{'2020-12-08 09:27:32': 1},1,0
1973,Wichita KS,DefaultDept,005_02_PaintTopcoats,Blend: 10P8-10NF - EC-283 (1:1),10/1/2019 12:00,10/1/2019 12:00,0.78125,gal,12/19/2019 16:04,adminbomry,1,1,1,0,{'2019-12-19 16:04:12': 1},1,0
1974,Wichita KS,DefaultDept,005_02_PaintTopcoats,Blend: 10P8-10NF - EC-283 (1:1)_old,1/3/2019 0:00,1/3/2019 0:00,2,gal,7/3/2019 10:37,adminbomry,1,1,1,0,{'2019-07-03 10:37:16': 1},1,0
1975,Wichita KS,DefaultDept,005_02_PaintTopcoats,Blend: 10P8-10NF - EC-283 (1:1)_old,1/7/2019 0:00,1/7/2019 0:00,0.328125,gal,7/3/2019 10:37,adminbomry,1,1,1,0,{'2019-07-03 10:37:16': 1},1,0
1976,Wichita KS,DefaultDept,005_02_PaintTopcoats,Blend: 10P8-10NF - EC-283 (1:1)_old,1/11/2019 0:00,1/11/2019 0:00,2,gal,7/3/2019 10:37,adminbomry,1,1,1,0,{'2019-07-03 10:37:16': 1},1,0
1977,Wichita KS,DefaultDept,005_02_PaintTopcoats,Blend: 10P8-10NF - EC-283 (1:1)_old,1/30/2019 0:00,1/30/2019 0:00,0.0625,gal,7/3/2019 10:37,adminbomry,1,1,1,0,{'2019-07-03 10:37:16': 1},1,0
1978,Wichita KS,DefaultDept,005_02_PaintTopcoats,Blend: 10P8-10NF - EC-283 (1:1)_old,1/30/2019 0:00,1/30/2019 0:00,0.078125,gal,7/3/2019 10:37,adminbomry,1,1,1,0,{'2019-07-03 10:37:16': 1},1,0
1979,Wichita KS,DefaultDept,005_02_PaintTopcoats,Blend: 10P8-10NF - EC-283 (1:1)_old,1/30/2019 0:00,1/30/2019 0:00,0.359375,gal,7/3/2019 10:37,adminbomry,1,1,1,0,{'2019-07-03 10:37:16': 1},1,0
1980,Wichita KS,DefaultDept,005_02_PaintTopcoats,Blend: 10P8-10NF - EC-283 (1:1)_old,2/1/2019 0:00,2/1/2019 0:00,2,gal,7/10/2019 9:06,adminbomgb,1,1,1,0,{'2019-07-10 09:06:14': 1},1,0
1981,Wichita KS,DefaultDept,005_02_PaintTopcoats,Blend: 10P8-10NF - EC-283 (1:1)_old,2/5/2019 0:00,2/5/2019 0:00,2,gal,7/10/2019 9:06,adminbomgb,1,1,1,0,{'2019-07-10 09:06:14': 1},1,0
1982,Wichita KS,DefaultDept,005_02_PaintTopcoats,Blend: 10P8-10NF - EC-283 (1:1)_old,2/18/2019 0:00,2/18/2019 0:00,0.3125,gal,7/10/2019 9:06,adminbomgb,1,1,1,0,{'2019-07-10 09:06:14': 1},1,0
1983,Wichita KS,DefaultDept,005_02_PaintTopcoats,Blend: 10P8-10NF - EC-283 (1:1)_old,2/20/2019 0:00,2/20/2019 0:00,0.375,gal,7/10/2019 9:06,adminbomgb,1,1,1,0,{'2019-07-10 09:06:14': 1},1,0
1984,Wichita KS,DefaultDept,005_02_PaintTopcoats,Blend: 10P8-10NF - EC-283 (1:1)_old,3/5/2019 0:00,3/5/2019 0:00,2,gal,7/5/2019 13:44,adminbomgb,1,1,1,0,{'2019-07-05 13:44:50': 1},1,0
1985,Wichita KS,DefaultDept,005_02_PaintTopcoats,Blend: 10P8-10NF - EC-283 (1:1)_old,3/6/2019 0:00,3/6/2019 0:00,0.375,gal,7/5/2019 13:44,adminbomgb,1,1,1,0,{'2019-07-05 13:44:50': 1},1,0
1986,Wichita KS,DefaultDept,005_02_PaintTopcoats,Blend: 10P8-10NF - EC-283 (1:1)_old,3/6/2019 0:00,3/6/2019 0:00,60,gal,7/5/2019 13:44,adminbomgb,1,1,1,0,{'2019-07-05 13:44:50': 1},1,0
1987,Wichita KS,DefaultDept,005_02_PaintTopcoats,Blend: 10P8-10NF - EC-283 (1:1)_old,3/14/2019 0:00,3/14/2019 0:00,1,gal,7/5/2019 13:44,adminbomgb,1,1,1,0,{'2019-07-05 13:44:50': 1},1,0
1988,Wichita KS,DefaultDept,005_02_PaintTopcoats,Blend: 10P8-10NF - EC-283 (1:1)_old,3/26/2019 0:00,3/26/2019 0:00,0.3125,gal,7/5/2019 13:44,adminbomgb,1,1,1,0,{'2019-07-05 13:44:50': 1},1,0
1989,Wichita KS,DefaultDept,005_02_PaintTopcoats,Blend: 10P8-10NF - EC-283 (1:1)_old,3/28/2019 0:00,3/28/2019 0:00,0.234375,gal,7/5/2019 13:44,adminbomgb,1,1,1,0,{'2019-07-05 13:44:50': 1},1,0
1990,Wichita KS,DefaultDept,005_02_PaintTopcoats,Blend: 10P8-10NF - EC-283 (1:1)_old,4/2/2019 0:00,4/2/2019 0:00,60,gal,7/5/2019 11:50,adminbomry,1,1,1,0,{'2019-07-05 11:50:11': 1},1,0
1991,Wichita KS,DefaultDept,005_02_PaintTopcoats,Blend: 10P8-10NF - EC-283 (1:1)_old,4/26/2019 0:00,4/26/2019 0:00,2,gal,7/5/2019 11:50,adminbomry,1,1,1,0,{'2019-07-05 11:50:11': 1},1,0
1992,Wichita KS,DefaultDept,005_02_PaintTopcoats,Blend: 10P8-10NF - EC-283 (1:1)_old,5/4/2019 0:00,5/4/2019 0:00,0.3125,gal,"2019-07-05 12:02:13,2019-07-05 12:02:13","adminbomry,adminbomry",2,2,1,1,{'2019-07-05 12:02:13': 2},1,1
1993,Wichita KS,DefaultDept,005_02_PaintTopcoats,Blend: 10P8-10NF - EC-283 (1:1)_old,5/4/2019 0:00,5/4/2019 0:00,0.6875,gal,7/5/2019 12:02,adminbomry,1,1,1,0,{'2019-07-05 12:02:13': 1},1,0
1994,Wichita KS,DefaultDept,005_02_PaintTopcoats,Blend: 10P8-10NF - EC-283 (1:1)_old,5/29/2019 0:00,5/29/2019 0:00,2,gal,7/5/2019 12:02,adminbomry,1,1,1,0,{'2019-07-05 12:02:13': 1},1,0
1995,Wichita KS,DefaultDept,005_02_PaintTopcoats,Blend: 10P8-10NF - EC-283 (1:1)_old,5/31/2019 0:00,5/31/2019 0:00,4,gal,7/5/2019 12:02,adminbomry,1,1,1,0,{'2019-07-05 12:02:13': 1},1,0
1996,Wichita KS,DefaultDept,005_02_PaintTopcoats,Blend: 10P8-10NF - EC-283 (1:1)_old,6/7/2019 0:00,6/7/2019 0:00,1,gal,7/5/2019 13:18,adminbomry,1,1,1,0,{'2019-07-05 13:18:36': 1},1,0
1997,Wichita KS,DefaultDept,005_02_PaintTopcoats,Blend: 10P8-10NF - EC-283 (1:1)_old,6/12/2019 0:00,6/12/2019 0:00,1,gal,7/5/2019 13:18,adminbomry,1,1,1,0,{'2019-07-05 13:18:36': 1},1,0
1998,Wichita KS,DefaultDept,005_02_PaintTopcoats,Blend: 10P8-10NF - EC-283 (1:1)_old,7/8/2019 0:00,7/8/2019 0:00,4,gal,8/9/2019 10:06,adminbomry,1,1,1,0,{'2019-08-09 10:06:55': 1},1,0
1999,Wichita KS,DefaultDept,005_02_PaintTopcoats,Blend: 10P8-10NF - EC-283 (1:1)_old,7/17/2019 0:00,7/17/2019 0:00,2,gal,"2019-08-09 10:06:55,2019-08-09 10:06:55","adminbomry,adminbomry",2,2,1,1,{'2019-08-09 10:06:55': 2},1,1
2000,Wichita KS,DefaultDept,005_02_PaintTopcoats,Blend: 10P8-10NF - EC-283 (1:1)_old,8/14/2019 0:00,8/14/2019 0:00,2,gal,9/23/2019 10:35,adminbomry,1,1,1,0,{'2019-09-23 10:35:09': 1},1,0
2001,Wichita KS,DefaultDept,005_02_PaintTopcoats,Blend: 10P8-10NF - EC-283 (1:1)_old,8/22/2019 0:00,8/22/2019 0:00,4,gal,9/23/2019 10:35,adminbomry,1,1,1,0,{'2019-09-23 10:35:09': 1},1,0
2002,Wichita KS,DefaultDept,005_02_PaintTopcoats,Blend: 10P8-10NF - EC-283 (1:1)_old,9/12/2019 12:00,9/12/2019 12:00,0.78125,gal,11/25/2019 9:54,adminbomry,1,1,1,0,{'2019-11-25 09:54:31': 1},1,0
2003,Wichita KS,DefaultDept,005_02_PaintTopcoats,Blend: 10P8-10NF - EC-283 (1:1)_old,9/27/2019 12:00,9/27/2019 12:00,1.21875,gal,11/25/2019 9:54,adminbomry,1,1,1,0,{'2019-11-25 09:54:31': 1},1,0
2004,Wichita KS,DefaultDept,005_02_PaintTopcoats,Blend: 10P8-10NF - EC-283 (1:1)_old,12/4/2019 12:00,12/4/2019 12:00,0.390625,gal,1/9/2020 18:22,adminbomry,1,1,1,0,{'2020-01-09 18:22:20': 1},1,0
2005,Wichita KS,DefaultDept,005_02_PaintTopcoats,Blend: 10P8-10NF - EC-283 (1:1)_old,12/19/2019 12:00,12/19/2019 12:00,0.390625,gal,1/9/2020 18:22,adminbomry,1,1,1,0,{'2020-01-09 18:22:20': 1},1,0
2006,Wichita KS,DefaultDept,005_02_PaintTopcoats,Blend: 10P8-10NF - EC-283 (1:1)_old,1/3/2020 12:00,1/3/2020 12:00,2,gal,7/1/2020 21:07,adminbomry,1,1,1,0,{'2020-07-01 21:07:35': 1},1,0
2007,Wichita KS,DefaultDept,005_02_PaintTopcoats,Blend: 10P8-10NF - EC-283 (1:1)_old,1/10/2020 12:00,1/10/2020 12:00,0.15625,gal,7/1/2020 21:07,adminbomry,1,1,1,0,{'2020-07-01 21:07:35': 1},1,0
2008,Wichita KS,DefaultDept,005_02_PaintTopcoats,Blend: 10P8-10NF - EC-283 (1:1)_old,1/10/2020 12:00,1/10/2020 12:00,0.3125,gal,7/1/2020 21:07,adminbomry,1,1,1,0,{'2020-07-01 21:07:35': 1},1,0
2009,Wichita KS,DefaultDept,005_02_PaintTopcoats,Blend: 10P8-10NF - EC-283 (1:1)_old,1/20/2020 12:00,1/20/2020 12:00,1.53125,gal,7/1/2020 21:07,adminbomry,1,1,1,0,{'2020-07-01 21:07:35': 1},1,0
2010,Wichita KS,DefaultDept,005_02_PaintTopcoats,Blend: 10P8-10NF - EC-283 (1:1)_old,2/24/2020 12:00,2/24/2020 12:00,2,gal,7/1/2020 21:12,adminbomry,1,1,1,0,{'2020-07-01 21:12:32': 1},1,0
2011,Wichita KS,DefaultDept,005_02_PaintTopcoats,Blend: 10P8-10NF - EC-283 (1:1)_old,3/2/2020 12:00,3/2/2020 12:00,2,gal,7/1/2020 21:15,adminbomry,1,1,1,0,{'2020-07-01 21:15:03': 1},1,0
2012,Wichita KS,DefaultDept,005_02_PaintTopcoats,Blend: 10P8-10NF - EC-283 (1:1)_old,3/28/2020 12:00,3/28/2020 12:00,2,gal,7/1/2020 21:15,adminbomry,1,1,1,0,{'2020-07-01 21:15:03': 1},1,0
2013,Wichita KS,DefaultDept,005_02_PaintTopcoats,Blend: 10P8-10NF - EC-283 (1:1)_old,4/1/2020 12:00,4/1/2020 12:00,2,gal,7/27/2020 18:06,bomamanda,1,1,1,0,{'2020-07-27 18:06:19': 1},1,0
2014,Wichita KS,DefaultDept,005_02_PaintTopcoats,Blend: 10P8-10NF - EC-283 (1:1)_old,6/4/2020 12:00,6/4/2020 12:00,0.15625,gal,7/27/2020 18:15,bomamanda,1,1,1,0,{'2020-07-27 18:15:38': 1},1,0
2015,Wichita KS,DefaultDept,005_02_PaintTopcoats,Blend: 10P8-10NF - EC-283 (1:1)_old,6/15/2020 12:00,6/15/2020 12:00,0.4375,gal,7/27/2020 18:15,bomamanda,1,1,1,0,{'2020-07-27 18:15:38': 1},1,0
2016,Wichita KS,DefaultDept,005_02_PaintTopcoats,Blend: 10P8-10NF - EC-283 (1:1)_old,7/13/2020 12:00,7/13/2020 12:00,0.90625,gal,9/4/2020 10:46,dlyon,1,1,1,0,{'2020-09-04 10:46:12': 1},1,0
2017,Wichita KS,DefaultDept,005_02_PaintTopcoats,Blend: 10P8-10NF - EC-283 (1:1)_old,7/21/2020 12:00,7/21/2020 12:00,0.0625,gal,9/4/2020 10:46,dlyon,1,1,1,0,{'2020-09-04 10:46:12': 1},1,0
2018,Wichita KS,DefaultDept,005_02_PaintTopcoats,Blend: 10P8-10NF - EC-283 (1:1)_old,8/24/2020 12:00,8/24/2020 12:00,0.4375,gal,9/4/2020 11:00,dlyon,1,1,1,0,{'2020-09-04 11:00:35': 1},1,0
2019,Wichita KS,DefaultDept,005_02_PaintTopcoats,Blend: 10P8-10NF - EC-283 (1:1)_old,10/21/2020 12:00,10/21/2020 12:00,0.671875,gal,12/2/2020 15:13,dlyon,1,1,1,0,{'2020-12-02 15:13:12': 1},1,0
2020,Wichita KS,DefaultDept,005_02_PaintTopcoats,Blend: 10P8-10NF - EC-283 (1:1)_old,10/21/2020 12:00,10/21/2020 12:00,2,gal,12/2/2020 15:13,dlyon,1,1,1,0,{'2020-12-02 15:13:12': 1},1,0
2021,Wichita KS,DefaultDept,005_02_PaintTopcoats,Blend: 10P8-10NF - EC-283 (1:1)_old,10/22/2020 12:00,10/22/2020 12:00,0.15625,gal,12/2/2020 15:13,dlyon,1,1,1,0,{'2020-12-02 15:13:12': 1},1,0
2022,Wichita KS,DefaultDept,005_02_PaintTopcoats,Blend: 10P8-10NF - EC-283 (1:1)_old,10/23/2020 12:00,10/23/2020 12:00,0.21875,gal,12/2/2020 15:13,dlyon,1,1,1,0,{'2020-12-02 15:13:12': 1},1,0
2023,Wichita KS,DefaultDept,005_02_PaintTopcoats,Blend: 10P8-10NF - EC-283 (1:1)_old,11/17/2020 12:00,11/17/2020 12:00,0.1875,gal,12/8/2020 9:27,dlyon,1,1,1,0,{'2020-12-08 09:27:32': 1},1,0
2024,Wichita KS,DefaultDept,005_02_PaintTopcoats,Blend: CA8000 IM911 Base - CA8000B Activator - CA8000C Thinner - (2:1:1),8/14/2020 12:00,8/14/2020 12:00,3,gal,"2020-09-15 12:34:38,2020-09-15 12:34:38","dlyon,dlyon",2,2,1,1,{'2020-09-15 12:34:38': 2},1,1
2025,Wichita KS,DefaultDept,005_02_PaintTopcoats,Blend: CA8000 IM923 Base - CA8000B Activator - CA8000C Thinner - (2:1:1),8/14/2020 12:00,8/14/2020 12:00,3,gal,9/15/2020 13:11,dlyon,1,1,1,0,{'2020-09-15 13:11:30': 1},1,0
2026,Wichita KS,DefaultDept,005_02_PaintTopcoats,Blend: CA8000 IM923 Base - CA8000B Activator - CA8000C Thinner - (2:1:1),8/14/2020 12:00,8/14/2020 12:00,4,gal,9/15/2020 13:11,dlyon,1,1,1,0,{'2020-09-15 13:11:30': 1},1,0
2027,Wichita KS,DefaultDept,005_02_PaintTopcoats,Blend: CA8273/I2255 BASE COMPONENT - CA 8200B M&D ACTIVATOR COMPONENT (6:1),6/29/2020 12:00,6/29/2020 12:00,2,gal,8/4/2020 17:06,bomamanda,1,1,1,0,{'2020-08-04 17:06:47': 1},1,0
2028,Wichita KS,DefaultDept,005_02_PaintTopcoats,Blend: CA8273/I2255 BASE COMPONENT - CA 8200B M&D ACTIVATOR COMPONENT (6:1),8/4/2020 12:00,8/4/2020 12:00,1,gal,9/4/2020 11:00,dlyon,1,1,1,0,{'2020-09-04 11:00:35': 1},1,0
2029,Wichita KS,DefaultDept,005_02_PaintTopcoats,Blend: CA8273/I2255 BASE COMPONENT - CA 8200B M&D ACTIVATOR COMPONENT (6:1),8/12/2020 12:00,8/12/2020 12:00,1,gal,9/4/2020 11:00,dlyon,1,1,1,0,{'2020-09-04 11:00:35': 1},1,0
2030,Wichita KS,DefaultDept,005_02_PaintTopcoats,Blend: CA8273I2236 - CA8200B (3:1),7/29/2020 12:00,7/29/2020 12:00,1,gal,9/15/2020 11:15,dlyon,1,1,1,0,{'2020-09-15 11:15:08': 1},1,0
2031,Wichita KS,DefaultDept,005_02_PaintTopcoats,Blend: CA8273I2236 - CA8200B (3:1),10/2/2020 12:00,10/2/2020 12:00,2,gal,12/2/2020 15:13,dlyon,1,1,1,0,{'2020-12-02 15:13:12': 1},1,0
2032,Wichita KS,DefaultDept,005_02_PaintTopcoats,Blend: CA8800 - CA8800Z - CA8800CT (2:1:1),5/28/2020 12:00,5/28/2020 12:00,1,gal,8/11/2020 9:58,dlyon,1,1,1,0,{'2020-08-11 09:58:01': 1},1,0
2033,Wichita KS,DefaultDept,005_02_PaintTopcoats,Blend: CA8800 - CA8800Z - CA8800CT (2:1:1),6/2/2020 12:00,6/2/2020 12:00,1,gal,8/11/2020 9:58,dlyon,1,1,1,0,{'2020-08-11 09:58:01': 1},1,0
2034,Wichita KS,DefaultDept,005_02_PaintTopcoats,Blend: DI-TEX 50 MATTE BASE - DI-TEX HARDENER (4:1),8/30/2020 12:00,8/30/2020 12:00,6,gal,"2020-11-11 11:12:09,2020-11-11 11:12:09,2020-11-11 11:12:09","dlyon,dlyon,dlyon",3,3,1,2,{'2020-11-11 11:12:09': 3},1,2
2035,Wichita KS,DefaultDept,005_02_PaintTopcoats,Blend: M06025 1750465 - CM0830991 - CM0830081 - CM0110944 (4-2-1-1),1/28/2019 12:00,1/28/2019 12:00,0.125,gal,"2020-03-27 11:46:20,2020-03-27 11:46:26","adminbomry,adminbomry",2,2,2,0,"{'2020-03-27 11:46:20': 1, '2020-03-27 11:46:26': 1}",1,1
2036,Wichita KS,DefaultDept,005_02_PaintTopcoats,Blend: XS420 Blend (3:1:1),2/27/2020 12:00,2/27/2020 12:00,1,gal,8/19/2020 15:19,adminbomry,1,1,1,0,{'2020-08-19 15:19:16': 1},1,0
2037,Wichita KS,DefaultDept,005_02_PaintTopcoats,Blend: XS420 Blend (3:1:1),2/27/2020 12:00,2/27/2020 12:00,9,gal,8/19/2020 15:19,adminbomry,1,1,1,0,{'2020-08-19 15:19:16': 1},1,0
2038,Wichita KS,DefaultDept,005_02_PaintTopcoats,Blend: XS420 Blend (3:1:1),4/20/2020 12:00,4/20/2020 12:00,1,gal,8/18/2020 8:44,dlyon,1,1,1,0,{'2020-08-18 08:44:07': 1},1,0
2039,Wichita KS,DefaultDept,005_02_PaintTopcoats,Blend: XS420 Blend (3:1:1),4/28/2020 12:00,4/28/2020 12:00,2,gal,8/18/2020 8:44,dlyon,1,1,1,0,{'2020-08-18 08:44:07': 1},1,0
2040,Wichita KS,DefaultDept,005_02_PaintTopcoats,Blend: XS420 Blend (3:1:1),4/28/2020 12:00,4/28/2020 12:00,8,gal,8/18/2020 8:44,dlyon,1,1,1,0,{'2020-08-18 08:44:07': 1},1,0
2041,Wichita KS,DefaultDept,005_02_PaintTopcoats,Blend: XS420 Blend (3:1:1),7/11/2020 12:00,7/11/2020 12:00,2,gal,9/4/2020 10:06,dlyon,1,1,1,0,{'2020-09-04 10:06:12': 1},1,0
2042,Wichita KS,DefaultDept,005_02_PaintTopcoats,Blend: XS420 Blend (3:1:1),7/11/2020 12:00,7/11/2020 12:00,8,gal,9/4/2020 10:06,dlyon,1,1,1,0,{'2020-09-04 10:06:12': 1},1,0
2043,Wichita KS,DefaultDept,005_02_PaintTopcoats,Blend: XS420 Blend (3:1:1),9/2/2020 12:00,9/2/2020 12:00,2,gal,10/22/2020 11:43,dlyon,1,1,1,0,{'2020-10-22 11:43:17': 1},1,0
2044,Wichita KS,DefaultDept,005_02_PaintTopcoats,Blend: XS420 Blend (3:1:1),9/14/2020 12:00,9/14/2020 12:00,1,gal,10/22/2020 11:43,dlyon,1,1,1,0,{'2020-10-22 11:43:17': 1},1,0
2045,Wichita KS,DefaultDept,005_02_PaintTopcoats,Blend: XS420 Blend (3:1:1),9/14/2020 12:00,9/14/2020 12:00,12,gal,10/22/2020 11:43,dlyon,1,1,1,0,{'2020-10-22 11:43:17': 1},1,0
2046,Wichita KS,DefaultDept,005_02_PaintTopcoats,Blend: XS420 Blend (3:1:1),12/11/2020 12:00,12/11/2020 12:00,20,gal,1/8/2021 8:46,dlyon,1,1,1,0,{'2021-01-08 08:46:53': 1},1,0
2047,Wichita KS,DefaultDept,005_02_PaintTopcoats,CA 1000,1/3/2019 0:00,1/3/2019 0:00,0.09375,gal,7/3/2019 10:37,adminbomry,1,1,1,0,{'2019-07-03 10:37:16': 1},1,0
2048,Wichita KS,DefaultDept,005_02_PaintTopcoats,CA 1000,5/9/2019 0:00,5/9/2019 0:00,0.046875,gal,7/5/2019 12:02,adminbomry,1,1,1,0,{'2019-07-05 12:02:13': 1},1,0
2049,Wichita KS,DefaultDept,005_02_PaintTopcoats,CA 1000,5/14/2019 0:00,5/14/2019 0:00,0.046875,gal,7/5/2019 12:02,adminbomry,1,1,1,0,{'2019-07-05 12:02:13': 1},1,0
2050,Wichita KS,DefaultDept,005_02_PaintTopcoats,CA 1000,5/22/2019 0:00,5/22/2019 0:00,0.046875,gal,7/5/2019 12:02,adminbomry,1,1,1,0,{'2019-07-05 12:02:13': 1},1,0
2051,Wichita KS,DefaultDept,005_02_PaintTopcoats,CA 1000,10/25/2019 12:00,10/25/2019 12:00,0.09375,gal,12/19/2019 16:04,adminbomry,1,1,1,0,{'2019-12-19 16:04:12': 1},1,0
2052,Wichita KS,DefaultDept,005_02_PaintTopcoats,CA 1000,11/4/2019 12:00,11/4/2019 12:00,0.046875,gal,12/19/2019 15:35,ascheufler,1,1,1,0,{'2019-12-19 15:35:45': 1},1,0
2053,Wichita KS,DefaultDept,005_02_PaintTopcoats,CA 7870A BASE COMPONENT GALLON - 910X464 Activator Component Blend,1/11/2019 0:00,1/11/2019 0:00,1,gal,7/3/2019 10:37,adminbomry,1,1,1,0,{'2019-07-03 10:37:16': 1},1,0
2054,Wichita KS,DefaultDept,005_02_PaintTopcoats,CA 7870A BASE COMPONENT GALLON - 910X464 Activator Component Blend,3/27/2019 0:00,3/27/2019 0:00,1,gal,7/5/2019 13:44,adminbomgb,1,1,1,0,{'2019-07-05 13:44:50': 1},1,0
2055,Wichita KS,DefaultDept,005_02_PaintTopcoats,CA 7870A BASE COMPONENT GALLON - 910X464 Activator Component Blend,4/10/2019 0:00,4/10/2019 0:00,1,gal,7/5/2019 11:50,adminbomry,1,1,1,0,{'2019-07-05 11:50:11': 1},1,0
2056,Wichita KS,DefaultDept,005_02_PaintTopcoats,CA 7870A BASE COMPONENT GALLON - 910X464 Activator Component Blend,1/31/2020 12:00,1/31/2020 12:00,1,gal,7/1/2020 21:07,adminbomry,1,1,1,0,{'2020-07-01 21:07:35': 1},1,0
2057,Wichita KS,DefaultDept,005_02_PaintTopcoats,CA 8000 IM908 BASE COMPONENT,9/7/2019 12:00,9/7/2019 12:00,2,gal,11/25/2019 9:54,adminbomry,1,1,1,0,{'2019-11-25 09:54:31': 1},1,0
2058,Wichita KS,DefaultDept,005_02_PaintTopcoats,CA 8000 IM908 BASE COMPONENT,9/27/2019 12:00,9/27/2019 12:00,2,gal,11/25/2019 9:54,adminbomry,1,1,1,0,{'2019-11-25 09:54:31': 1},1,0
2059,Wichita KS,DefaultDept,005_02_PaintTopcoats,CA 8000 IM9092 BASE COMPONENT - CA 8000B ACTIVATOR-CA 8000C THINNER,8/2/2019 0:00,8/2/2019 0:00,0.25,gal,9/23/2019 10:35,adminbomry,1,1,1,0,{'2019-09-23 10:35:10': 1},1,0
2060,Wichita KS,DefaultDept,005_02_PaintTopcoats,CA 8000/IM215 BASE COMPONENT,9/7/2019 12:00,9/7/2019 12:00,2,gal,11/25/2019 9:54,adminbomry,1,1,1,0,{'2019-11-25 09:54:31': 1},1,0
2061,Wichita KS,DefaultDept,005_02_PaintTopcoats,CA 8000/IM215 BASE COMPONENT,9/27/2019 12:00,9/27/2019 12:00,2,gal,11/25/2019 9:54,adminbomry,1,1,1,0,{'2019-11-25 09:54:31': 1},1,0
2062,Wichita KS,DefaultDept,005_02_PaintTopcoats,CA 8000/IM408 BASE COMPONENT,1/31/2020 12:00,1/31/2020 12:00,1,gal,7/3/2020 13:46,adminbomry,1,1,1,0,{'2020-07-03 13:46:19': 1},1,0
2063,Wichita KS,DefaultDept,005_02_PaintTopcoats,CA 8000/IM413 BASE COMPONENT,2/28/2020 12:00,2/28/2020 12:00,1,gal,7/1/2020 21:46,adminbomry,1,1,1,0,{'2020-07-01 21:46:19': 1},1,0
2064,Wichita KS,DefaultDept,005_02_PaintTopcoats,CA 8000/IM904 BASE/CA 8000B ACTIVATOR/ CA 8000C THINNER BLEND,8/2/2019 0:00,8/2/2019 0:00,0.125,gal,9/23/2019 10:35,adminbomry,1,1,1,0,{'2019-09-23 10:35:10': 1},1,0
2065,Wichita KS,DefaultDept,005_02_PaintTopcoats,CA 8000/IM905 BASE COMPONENT,5/16/2019 0:00,5/16/2019 0:00,2,gal,7/5/2019 12:02,adminbomry,1,1,1,0,{'2019-07-05 12:02:13': 1},1,0
2066,Wichita KS,DefaultDept,005_02_PaintTopcoats,CA 8000/IM9092 BASE COMPONENT,9/7/2019 12:00,9/7/2019 12:00,1,gal,11/25/2019 9:54,adminbomry,1,1,1,0,{'2019-11-25 09:54:31': 1},1,0
2067,Wichita KS,DefaultDept,005_02_PaintTopcoats,CA 8000/IM9092 BASE COMPONENT,9/27/2019 12:00,9/27/2019 12:00,1,gal,11/25/2019 9:54,adminbomry,1,1,1,0,{'2019-11-25 09:54:31': 1},1,0
2068,Wichita KS,DefaultDept,005_02_PaintTopcoats,CA 8000/IM922 BASE COMPONENT,8/29/2019 0:00,8/29/2019 0:00,3,gal,9/23/2019 10:35,adminbomry,1,1,1,0,{'2019-09-23 10:35:10': 1},1,0
2069,Wichita KS,DefaultDept,005_02_PaintTopcoats,CA 8200B Activating Compound,1/16/2019 0:00,1/16/2019 0:00,0.25,gal,7/3/2019 10:37,adminbomry,1,1,1,0,{'2019-07-03 10:37:16': 1},1,0
2070,Wichita KS,DefaultDept,005_02_PaintTopcoats,CA 8200B Activating Compound,2/5/2019 0:00,2/5/2019 0:00,0.25,gal,7/10/2019 9:06,adminbomgb,1,1,1,0,{'2019-07-10 09:06:14': 1},1,0
2071,Wichita KS,DefaultDept,005_02_PaintTopcoats,CA 8200B Activating Compound,2/25/2019 0:00,2/25/2019 0:00,0.25,gal,7/10/2019 9:06,adminbomgb,1,1,1,0,{'2019-07-10 09:06:14': 1},1,0
2072,Wichita KS,DefaultDept,005_02_PaintTopcoats,CA 8200B Activating Compound,3/7/2019 0:00,3/7/2019 0:00,0.25,gal,7/5/2019 13:44,adminbomgb,1,1,1,0,{'2019-07-05 13:44:50': 1},1,0
2073,Wichita KS,DefaultDept,005_02_PaintTopcoats,CA 8200B Activating Compound,3/29/2019 0:00,3/29/2019 0:00,0.25,gal,7/5/2019 13:44,adminbomgb,1,1,1,0,{'2019-07-05 13:44:50': 1},1,0
2074,Wichita KS,DefaultDept,005_02_PaintTopcoats,CA 8200B Activating Compound,4/23/2019 0:00,4/23/2019 0:00,0.5,gal,7/5/2019 11:50,adminbomry,1,1,1,0,{'2019-07-05 11:50:11': 1},1,0
2075,Wichita KS,DefaultDept,005_02_PaintTopcoats,CA 8200B Activating Compound,5/22/2019 0:00,5/22/2019 0:00,-2.5,gal,7/5/2019 12:02,adminbomry,1,1,1,0,{'2019-07-05 12:02:13': 1},1,0
2076,Wichita KS,DefaultDept,005_02_PaintTopcoats,CA 8200B Activating Compound,5/22/2019 0:00,5/22/2019 0:00,2.5,gal,"2019-07-05 12:02:13,2019-07-05 12:02:13","adminbomry,adminbomry",2,2,1,1,{'2019-07-05 12:02:13': 2},1,1
2077,Wichita KS,DefaultDept,005_02_PaintTopcoats,CA 8200B Activating Compound,6/10/2019 0:00,6/10/2019 0:00,0.25,gal,7/5/2019 13:18,adminbomry,1,1,1,0,{'2019-07-05 13:18:36': 1},1,0
2078,Wichita KS,DefaultDept,005_02_PaintTopcoats,CA 8200B Activating Compound,6/13/2019 0:00,6/13/2019 0:00,2.5,gal,7/5/2019 13:18,adminbomry,1,1,1,0,{'2019-07-05 13:18:36': 1},1,0
2079,Wichita KS,DefaultDept,005_02_PaintTopcoats,CA 8200B Activating Compound,6/25/2019 0:00,6/25/2019 0:00,0.25,gal,7/5/2019 13:18,adminbomry,1,1,1,0,{'2019-07-05 13:18:36': 1},1,0
2080,Wichita KS,DefaultDept,005_02_PaintTopcoats,CA 8200B Activating Compound,8/2/2019 0:00,8/2/2019 0:00,0.25,gal,9/23/2019 10:35,adminbomry,1,1,1,0,{'2019-09-23 10:35:09': 1},1,0
2081,Wichita KS,DefaultDept,005_02_PaintTopcoats,CA 8200B Activating Compound,8/13/2019 0:00,8/13/2019 0:00,0.25,gal,9/23/2019 10:35,adminbomry,1,1,1,0,{'2019-09-23 10:35:09': 1},1,0
2082,Wichita KS,DefaultDept,005_02_PaintTopcoats,CA 8200B Activating Compound,8/29/2019 0:00,8/29/2019 0:00,0.25,gal,9/23/2019 10:35,adminbomry,1,1,1,0,{'2019-09-23 10:35:09': 1},1,0
2083,Wichita KS,DefaultDept,005_02_PaintTopcoats,CA 8200B Activating Compound,9/12/2019 12:00,9/12/2019 12:00,2.5,gal,11/25/2019 9:54,adminbomry,1,1,1,0,{'2019-11-25 09:54:31': 1},1,0
2084,Wichita KS,DefaultDept,005_02_PaintTopcoats,CA 8200B Activating Compound,9/27/2019 12:00,9/27/2019 12:00,0.25,gal,11/25/2019 9:54,adminbomry,1,1,1,0,{'2019-11-25 09:54:31': 1},1,0
2085,Wichita KS,DefaultDept,005_02_PaintTopcoats,CA 8200B Activating Compound,10/14/2019 12:00,10/14/2019 12:00,0.25,gal,12/19/2019 16:04,adminbomry,1,1,1,0,{'2019-12-19 16:04:12': 1},1,0
2086,Wichita KS,DefaultDept,005_02_PaintTopcoats,CA 8200B Activating Compound,10/24/2019 12:00,10/24/2019 12:00,0.25,gal,12/19/2019 16:04,adminbomry,1,1,1,0,{'2019-12-19 16:04:12': 1},1,0
2087,Wichita KS,DefaultDept,005_02_PaintTopcoats,CA 8200B Activating Compound,11/23/2019 12:00,11/23/2019 12:00,0.25,gal,12/19/2019 15:35,ascheufler,1,1,1,0,{'2019-12-19 15:35:45': 1},1,0
2088,Wichita KS,DefaultDept,005_02_PaintTopcoats,CA 8200B Activating Compound,12/10/2019 12:00,12/10/2019 12:00,0.25,gal,1/9/2020 18:22,adminbomry,1,1,1,0,{'2020-01-09 18:22:20': 1},1,0
2089,Wichita KS,DefaultDept,005_02_PaintTopcoats,CA 8200B Activating Compound,1/14/2020 12:00,1/14/2020 12:00,0.25,gal,7/1/2020 21:07,adminbomry,1,1,1,0,{'2020-07-01 21:07:35': 1},1,0
2090,Wichita KS,DefaultDept,005_02_PaintTopcoats,CA 8200B Activating Compound,1/30/2020 12:00,1/30/2020 12:00,0.25,gal,7/1/2020 21:07,adminbomry,1,1,1,0,{'2020-07-01 21:07:35': 1},1,0
2091,Wichita KS,DefaultDept,005_02_PaintTopcoats,CA 8200B Activating Compound,2/24/2020 12:00,2/24/2020 12:00,0.25,gal,7/1/2020 21:12,adminbomry,1,1,1,0,{'2020-07-01 21:12:32': 1},1,0
2092,Wichita KS,DefaultDept,005_02_PaintTopcoats,CA 8200B Activating Compound,3/20/2020 12:00,3/20/2020 12:00,0.25,gal,7/1/2020 21:15,adminbomry,1,1,1,0,{'2020-07-01 21:15:03': 1},1,0
2093,Wichita KS,DefaultDept,005_02_PaintTopcoats,CA 8200B Activating Compound,4/27/2020 12:00,4/27/2020 12:00,0.25,gal,7/27/2020 18:06,bomamanda,1,1,1,0,{'2020-07-27 18:06:19': 1},1,0
2094,Wichita KS,DefaultDept,005_02_PaintTopcoats,CA 8200B Activating Compound,5/21/2020 12:00,5/21/2020 12:00,0.25,gal,7/27/2020 18:10,bomamanda,1,1,1,0,{'2020-07-27 18:10:32': 1},1,0
2095,Wichita KS,DefaultDept,005_02_PaintTopcoats,CA 8200B Activating Compound,6/15/2020 12:00,6/15/2020 12:00,0.25,gal,7/27/2020 18:15,bomamanda,1,1,1,0,{'2020-07-27 18:15:38': 1},1,0
2096,Wichita KS,DefaultDept,005_02_PaintTopcoats,CA 8200B Activating Compound,7/10/2020 12:00,7/10/2020 12:00,0.25,gal,9/4/2020 10:46,dlyon,1,1,1,0,{'2020-09-04 10:46:12': 1},1,0
2097,Wichita KS,DefaultDept,005_02_PaintTopcoats,CA 8200B Activating Compound,7/21/2020 12:00,7/21/2020 12:00,0.25,gal,9/4/2020 10:46,dlyon,1,1,1,0,{'2020-09-04 10:46:12': 1},1,0
2098,Wichita KS,DefaultDept,005_02_PaintTopcoats,CA 8200B Activating Compound,7/28/2020 12:00,7/28/2020 12:00,1,gal,9/4/2020 10:46,dlyon,1,1,1,0,{'2020-09-04 10:46:12': 1},1,0
2099,Wichita KS,DefaultDept,005_02_PaintTopcoats,CA 8200B Activating Compound,7/28/2020 12:00,7/28/2020 12:00,1.5,gal,9/4/2020 10:46,dlyon,1,1,1,0,{'2020-09-04 10:46:12': 1},1,0
2100,Wichita KS,DefaultDept,005_02_PaintTopcoats,CA 8200B Activating Compound,7/29/2020 12:00,7/29/2020 12:00,0.5,gal,9/4/2020 10:46,dlyon,1,1,1,0,{'2020-09-04 10:46:12': 1},1,0
2101,Wichita KS,DefaultDept,005_02_PaintTopcoats,CA 8200B Activating Compound,8/24/2020 12:00,8/24/2020 12:00,0.25,gal,9/4/2020 11:00,dlyon,1,1,1,0,{'2020-09-04 11:00:35': 1},1,0
2102,Wichita KS,DefaultDept,005_02_PaintTopcoats,CA 8200B Activating Compound,8/28/2020 12:00,8/28/2020 12:00,5,gal,9/4/2020 11:00,dlyon,1,1,1,0,{'2020-09-04 11:00:35': 1},1,0
2103,Wichita KS,DefaultDept,005_02_PaintTopcoats,CA 8200B Activating Compound,9/15/2020 12:00,9/15/2020 12:00,0.25,gal,10/22/2020 11:27,dlyon,1,1,1,0,{'2020-10-22 11:27:27': 1},1,0
2104,Wichita KS,DefaultDept,005_02_PaintTopcoats,CA 8200B Activating Compound,9/24/2020 12:00,9/24/2020 12:00,0.25,gal,10/22/2020 11:27,dlyon,1,1,1,0,{'2020-10-22 11:27:27': 1},1,0
2105,Wichita KS,DefaultDept,005_02_PaintTopcoats,CA 8200B Activating Compound,10/8/2020 12:00,10/8/2020 12:00,0.25,gal,12/2/2020 15:13,dlyon,1,1,1,0,{'2020-12-02 15:13:12': 1},1,0
2106,Wichita KS,DefaultDept,005_02_PaintTopcoats,CA 8200B Activating Compound,11/10/2020 12:00,11/10/2020 12:00,0.25,gal,12/8/2020 9:27,dlyon,1,1,1,0,{'2020-12-08 09:27:32': 1},1,0
2107,Wichita KS,DefaultDept,005_02_PaintTopcoats,CA 8200B Activating Compound,12/2/2020 12:00,12/2/2020 12:00,0.25,gal,1/8/2021 8:59,dlyon,1,1,1,0,{'2021-01-08 08:59:12': 1},1,0
2108,Wichita KS,DefaultDept,005_02_PaintTopcoats,CA 8211/F37038 BASE COMPONENT,2/25/2019 0:00,2/25/2019 0:00,1,gal,7/10/2019 9:06,adminbomgb,1,1,1,0,{'2019-07-10 09:06:14': 1},1,0
2109,Wichita KS,DefaultDept,005_02_PaintTopcoats,CA 8211/F37038 BASE COMPONENT,3/20/2019 0:00,3/20/2019 0:00,2,gal,7/5/2019 13:44,adminbomgb,1,1,1,0,{'2019-07-05 13:44:50': 1},1,0
2110,Wichita KS,DefaultDept,005_02_PaintTopcoats,CA 8211/F37038 BASE COMPONENT,6/13/2019 0:00,6/13/2019 0:00,1,gal,7/5/2019 13:18,adminbomry,1,1,1,0,{'2019-07-05 13:18:36': 1},1,0
2111,Wichita KS,DefaultDept,005_02_PaintTopcoats,CA 8211/F37038 BASE COMPONENT,7/6/2019 0:00,7/6/2019 0:00,2,gal,8/9/2019 10:06,adminbomry,1,1,1,0,{'2019-08-09 10:06:56': 1},1,0
2112,Wichita KS,DefaultDept,005_02_PaintTopcoats,CA 8211/F37038 BASE COMPONENT,12/9/2019 12:00,12/9/2019 12:00,1,gal,1/9/2020 18:22,adminbomry,1,1,1,0,{'2020-01-09 18:22:20': 1},1,0
2113,Wichita KS,DefaultDept,005_02_PaintTopcoats,CA 8211/F37038 BASE COMPONENT,3/11/2020 12:00,3/11/2020 12:00,1,gal,7/1/2020 21:15,adminbomry,1,1,1,0,{'2020-07-01 21:15:03': 1},1,0
2114,Wichita KS,DefaultDept,005_02_PaintTopcoats,CA 8211/F37038 BASE COMPONENT,4/2/2020 12:00,4/2/2020 12:00,1,gal,7/27/2020 18:06,bomamanda,1,1,1,0,{'2020-07-27 18:06:19': 1},1,0
2115,Wichita KS,DefaultDept,005_02_PaintTopcoats,CA 8211/F37038 BASE COMPONENT,6/29/2020 12:00,6/29/2020 12:00,1,gal,7/27/2020 18:15,bomamanda,1,1,1,0,{'2020-07-27 18:15:38': 1},1,0
2116,Wichita KS,DefaultDept,005_02_PaintTopcoats,CA 8211/F37038 BASE COMPONENT,7/27/2020 12:00,7/27/2020 12:00,3,gal,9/4/2020 10:46,dlyon,1,1,1,0,{'2020-09-04 10:46:12': 1},1,0
2117,Wichita KS,DefaultDept,005_02_PaintTopcoats,CA 8211/F37038 BASE COMPONENT,8/24/2020 12:00,8/24/2020 12:00,1,gal,9/4/2020 11:00,dlyon,1,1,1,0,{'2020-09-04 11:00:35': 1},1,0
2118,Wichita KS,DefaultDept,005_02_PaintTopcoats,CA 8211/I1355 BASE COMPONENT,1/15/2019 0:00,1/15/2019 0:00,1,gal,"2019-07-03 10:37:16,2019-07-03 10:37:16","adminbomry,adminbomry",2,2,1,1,{'2019-07-03 10:37:16': 2},1,1
2119,Wichita KS,DefaultDept,005_02_PaintTopcoats,CA 8211/I1355 BASE COMPONENT,2/13/2019 0:00,2/13/2019 0:00,1,gal,7/10/2019 9:06,adminbomgb,1,1,1,0,{'2019-07-10 09:06:14': 1},1,0
2120,Wichita KS,DefaultDept,005_02_PaintTopcoats,CA 8211/I1355 BASE COMPONENT,2/22/2019 0:00,2/22/2019 0:00,1,gal,"2019-07-10 09:06:14,2019-07-10 09:06:14","adminbomgb,adminbomgb",2,2,1,1,{'2019-07-10 09:06:14': 2},1,1
2121,Wichita KS,DefaultDept,005_02_PaintTopcoats,CA 8211/I1355 BASE COMPONENT,3/8/2019 0:00,3/8/2019 0:00,-1,gal,7/5/2019 13:44,adminbomgb,1,1,1,0,{'2019-07-05 13:44:50': 1},1,0
2122,Wichita KS,DefaultDept,005_02_PaintTopcoats,CA 8211/I1355 BASE COMPONENT,1/31/2020 12:00,1/31/2020 12:00,1,gal,7/1/2020 21:07,adminbomry,1,1,1,0,{'2020-07-01 21:07:35': 1},1,0
2123,Wichita KS,DefaultDept,005_02_PaintTopcoats,CA 8211/I1355 BASE/CA 8200B M&D ACTIVATOR BLEND,2/13/2019 0:00,2/13/2019 0:00,0.125,gal,7/10/2019 9:06,adminbomgb,1,1,1,0,{'2019-07-10 09:06:14': 1},1,0
2124,Wichita KS,DefaultDept,005_02_PaintTopcoats,CA 8211/I1355 BASE/CA 8200B M&D ACTIVATOR BLEND,2/22/2019 0:00,2/22/2019 0:00,0.125,gal,7/10/2019 9:06,adminbomgb,1,1,1,0,{'2019-07-10 09:06:14': 1},1,0
2125,Wichita KS,DefaultDept,005_02_PaintTopcoats,CA 8211/I1355 BASE/CA 8200B M&D ACTIVATOR BLEND,8/7/2019 0:00,8/7/2019 0:00,0.125,gal,9/23/2019 10:35,adminbomry,1,1,1,0,{'2019-09-23 10:35:10': 1},1,0
2126,Wichita KS,DefaultDept,005_02_PaintTopcoats,CA 8211/I1355 BASE/CA 8200B M&D ACTIVATOR BLEND,10/2/2020 12:00,10/2/2020 12:00,0.125,gal,12/2/2020 15:13,dlyon,1,1,1,0,{'2020-12-02 15:13:12': 1},1,0
2127,Wichita KS,DefaultDept,005_02_PaintTopcoats,CA 8223/F27038 BASE/ CA 8200B ACTIVATOR BLEND,1/7/2019 0:00,1/7/2019 0:00,0.25,gal,7/3/2019 10:37,adminbomry,1,1,1,0,{'2019-07-03 10:37:16': 1},1,0
2128,Wichita KS,DefaultDept,005_02_PaintTopcoats,CA 8223/F27038 BASE/ CA 8200B ACTIVATOR BLEND,1/10/2019 0:00,1/10/2019 0:00,0.25,gal,7/3/2019 10:37,adminbomry,1,1,1,0,{'2019-07-03 10:37:16': 1},1,0
2129,Wichita KS,DefaultDept,005_02_PaintTopcoats,CA 8223/F27038 BASE/ CA 8200B ACTIVATOR BLEND,1/30/2019 0:00,1/30/2019 0:00,1.25,gal,7/3/2019 10:37,adminbomry,1,1,1,0,{'2019-07-03 10:37:16': 1},1,0
2130,Wichita KS,DefaultDept,005_02_PaintTopcoats,CA 8223/F27038 BASE/ CA 8200B ACTIVATOR BLEND,1/31/2019 0:00,1/31/2019 0:00,1.25,gal,7/3/2019 10:37,adminbomry,1,1,1,0,{'2019-07-03 10:37:16': 1},1,0
2131,Wichita KS,DefaultDept,005_02_PaintTopcoats,CA 8223/F27038 BASE/ CA 8200B ACTIVATOR BLEND,2/5/2019 0:00,2/5/2019 0:00,0.25,gal,7/10/2019 9:06,adminbomgb,1,1,1,0,{'2019-07-10 09:06:14': 1},1,0
2132,Wichita KS,DefaultDept,005_02_PaintTopcoats,CA 8223/F27038 BASE/ CA 8200B ACTIVATOR BLEND,2/18/2019 0:00,2/18/2019 0:00,0.25,gal,7/10/2019 9:06,adminbomgb,1,1,1,0,{'2019-07-10 09:06:14': 1},1,0
2133,Wichita KS,DefaultDept,005_02_PaintTopcoats,CA 8223/F27038 BASE/ CA 8200B ACTIVATOR BLEND,2/20/2019 0:00,2/20/2019 0:00,0.25,gal,7/10/2019 9:06,adminbomgb,1,1,1,0,{'2019-07-10 09:06:14': 1},1,0
2134,Wichita KS,DefaultDept,005_02_PaintTopcoats,CA 8223/F27038 BASE/ CA 8200B ACTIVATOR BLEND,3/20/2019 0:00,3/20/2019 0:00,0.25,gal,7/5/2019 13:44,adminbomgb,1,1,1,0,{'2019-07-05 13:44:50': 1},1,0
2135,Wichita KS,DefaultDept,005_02_PaintTopcoats,CA 8223/F27038 BASE/ CA 8200B ACTIVATOR BLEND,4/3/2019 0:00,4/3/2019 0:00,0.25,gal,7/5/2019 11:50,adminbomry,1,1,1,0,{'2019-07-05 11:50:11': 1},1,0
2136,Wichita KS,DefaultDept,005_02_PaintTopcoats,CA 8223/F27038 BASE/ CA 8200B ACTIVATOR BLEND,4/19/2019 0:00,4/19/2019 0:00,0.25,gal,7/5/2019 11:50,adminbomry,1,1,1,0,{'2019-07-05 11:50:11': 1},1,0
2137,Wichita KS,DefaultDept,005_02_PaintTopcoats,CA 8223/F27038 BASE/ CA 8200B ACTIVATOR BLEND,4/20/2019 0:00,4/20/2019 0:00,0.25,gal,7/5/2019 11:50,adminbomry,1,1,1,0,{'2019-07-05 11:50:11': 1},1,0
2138,Wichita KS,DefaultDept,005_02_PaintTopcoats,CA 8223/F27038 BASE/ CA 8200B ACTIVATOR BLEND,4/26/2019 0:00,4/26/2019 0:00,0.25,gal,7/5/2019 11:50,adminbomry,1,1,1,0,{'2019-07-05 11:50:11': 1},1,0
2139,Wichita KS,DefaultDept,005_02_PaintTopcoats,CA 8223/F27038 BASE/ CA 8200B ACTIVATOR BLEND,5/10/2019 0:00,5/10/2019 0:00,0.25,gal,7/5/2019 12:02,adminbomry,1,1,1,0,{'2019-07-05 12:02:13': 1},1,0
2140,Wichita KS,DefaultDept,005_02_PaintTopcoats,CA 8223/F27038 BASE/ CA 8200B ACTIVATOR BLEND,5/16/2019 0:00,5/16/2019 0:00,0.25,gal,7/5/2019 12:02,adminbomry,1,1,1,0,{'2019-07-05 12:02:13': 1},1,0
2141,Wichita KS,DefaultDept,005_02_PaintTopcoats,CA 8223/F27038 BASE/ CA 8200B ACTIVATOR BLEND,5/24/2019 0:00,5/24/2019 0:00,0.5,gal,7/5/2019 12:02,adminbomry,1,1,1,0,{'2019-07-05 12:02:13': 1},1,0
2142,Wichita KS,DefaultDept,005_02_PaintTopcoats,CA 8223/F27038 BASE/ CA 8200B ACTIVATOR BLEND,6/12/2019 0:00,6/12/2019 0:00,0.25,gal,7/5/2019 13:18,adminbomry,1,1,1,0,{'2019-07-05 13:18:36': 1},1,0
2143,Wichita KS,DefaultDept,005_02_PaintTopcoats,CA 8223/F27038 BASE/ CA 8200B ACTIVATOR BLEND,6/12/2019 0:00,6/12/2019 0:00,0.5,gal,7/5/2019 13:18,adminbomry,1,1,1,0,{'2019-07-05 13:18:36': 1},1,0
2144,Wichita KS,DefaultDept,005_02_PaintTopcoats,CA 8223/F27038 BASE/ CA 8200B ACTIVATOR BLEND,6/13/2019 0:00,6/13/2019 0:00,0.25,gal,7/5/2019 13:18,adminbomry,1,1,1,0,{'2019-07-05 13:18:36': 1},1,0
2145,Wichita KS,DefaultDept,005_02_PaintTopcoats,CA 8223/F27038 BASE/ CA 8200B ACTIVATOR BLEND,6/15/2019 0:00,6/15/2019 0:00,0.5,gal,7/5/2019 13:18,adminbomry,1,1,1,0,{'2019-07-05 13:18:36': 1},1,0
2146,Wichita KS,DefaultDept,005_02_PaintTopcoats,CA 8223/F27038 BASE/ CA 8200B ACTIVATOR BLEND,6/21/2019 0:00,6/21/2019 0:00,0.25,gal,7/5/2019 13:18,adminbomry,1,1,1,0,{'2019-07-05 13:18:36': 1},1,0
2147,Wichita KS,DefaultDept,005_02_PaintTopcoats,CA 8223/F27038 BASE/ CA 8200B ACTIVATOR BLEND,6/21/2019 0:00,6/21/2019 0:00,0.5,gal,7/5/2019 13:18,adminbomry,1,1,1,0,{'2019-07-05 13:18:36': 1},1,0
2148,Wichita KS,DefaultDept,005_02_PaintTopcoats,CA 8223/F27038 BASE/ CA 8200B ACTIVATOR BLEND,6/27/2019 0:00,6/27/2019 0:00,0.25,gal,7/5/2019 13:18,adminbomry,1,1,1,0,{'2019-07-05 13:18:36': 1},1,0
2149,Wichita KS,DefaultDept,005_02_PaintTopcoats,CA 8223/F27038 BASE/ CA 8200B ACTIVATOR BLEND,7/3/2019 0:00,7/3/2019 0:00,2,gal,8/9/2019 10:06,adminbomry,1,1,1,0,{'2019-08-09 10:06:56': 1},1,0
2150,Wichita KS,DefaultDept,005_02_PaintTopcoats,CA 8223/F27038 BASE/ CA 8200B ACTIVATOR BLEND,7/18/2019 0:00,7/18/2019 0:00,0.25,gal,8/9/2019 10:06,adminbomry,1,1,1,0,{'2019-08-09 10:06:56': 1},1,0
2151,Wichita KS,DefaultDept,005_02_PaintTopcoats,CA 8223/F27038 BASE/ CA 8200B ACTIVATOR BLEND,8/19/2019 0:00,8/19/2019 0:00,0.25,gal,9/23/2019 10:35,adminbomry,1,1,1,0,{'2019-09-23 10:35:09': 1},1,0
2152,Wichita KS,DefaultDept,005_02_PaintTopcoats,CA 8223/F27038 BASE/ CA 8200B ACTIVATOR BLEND,9/10/2019 12:00,9/10/2019 12:00,0.25,gal,11/25/2019 9:54,adminbomry,1,1,1,0,{'2019-11-25 09:54:31': 1},1,0
2153,Wichita KS,DefaultDept,005_02_PaintTopcoats,CA 8223/F27038 BASE/ CA 8200B ACTIVATOR BLEND,9/11/2019 12:00,9/11/2019 12:00,0.25,gal,11/25/2019 9:54,adminbomry,1,1,1,0,{'2019-11-25 09:54:31': 1},1,0
2154,Wichita KS,DefaultDept,005_02_PaintTopcoats,CA 8223/F27038 BASE/ CA 8200B ACTIVATOR BLEND,10/17/2019 12:00,10/17/2019 12:00,0.25,gal,12/19/2019 16:04,adminbomry,1,1,1,0,{'2019-12-19 16:04:12': 1},1,0
2155,Wichita KS,DefaultDept,005_02_PaintTopcoats,CA 8223/F27038 BASE/ CA 8200B ACTIVATOR BLEND,10/21/2019 12:00,10/21/2019 12:00,2.5,gal,12/19/2019 16:04,adminbomry,1,1,1,0,{'2019-12-19 16:04:12': 1},1,0
2156,Wichita KS,DefaultDept,005_02_PaintTopcoats,CA 8223/F27038 BASE/ CA 8200B ACTIVATOR BLEND,11/1/2019 12:00,11/1/2019 12:00,0.25,gal,12/19/2019 15:35,ascheufler,1,1,1,0,{'2019-12-19 15:35:45': 1},1,0
2157,Wichita KS,DefaultDept,005_02_PaintTopcoats,CA 8223/F27038 BASE/ CA 8200B ACTIVATOR BLEND,11/7/2019 12:00,11/7/2019 12:00,0.25,gal,12/19/2019 15:35,ascheufler,1,1,1,0,{'2019-12-19 15:35:45': 1},1,0
2158,Wichita KS,DefaultDept,005_02_PaintTopcoats,CA 8223/F27038 BASE/ CA 8200B ACTIVATOR BLEND,11/16/2019 12:00,11/16/2019 12:00,0.25,gal,12/19/2019 15:35,ascheufler,1,1,1,0,{'2019-12-19 15:35:45': 1},1,0
2159,Wichita KS,DefaultDept,005_02_PaintTopcoats,CA 8223/F27038 BASE/ CA 8200B ACTIVATOR BLEND,11/25/2019 12:00,11/25/2019 12:00,0.25,gal,12/19/2019 15:35,ascheufler,1,1,1,0,{'2019-12-19 15:35:45': 1},1,0
2160,Wichita KS,DefaultDept,005_02_PaintTopcoats,CA 8223/F27038 BASE/ CA 8200B ACTIVATOR BLEND,12/4/2019 12:00,12/4/2019 12:00,0.25,gal,1/9/2020 18:22,adminbomry,1,1,1,0,{'2020-01-09 18:22:20': 1},1,0
2161,Wichita KS,DefaultDept,005_02_PaintTopcoats,CA 8223/F27038 BASE/ CA 8200B ACTIVATOR BLEND,12/4/2019 12:00,12/4/2019 12:00,2.5,gal,1/9/2020 18:22,adminbomry,1,1,1,0,{'2020-01-09 18:22:20': 1},1,0
2162,Wichita KS,DefaultDept,005_02_PaintTopcoats,CA 8223/F27038 BASE/ CA 8200B ACTIVATOR BLEND,12/5/2019 12:00,12/5/2019 12:00,2.5,gal,1/9/2020 18:22,adminbomry,1,1,1,0,{'2020-01-09 18:22:20': 1},1,0
2163,Wichita KS,DefaultDept,005_02_PaintTopcoats,CA 8223/F27038 BASE/ CA 8200B ACTIVATOR BLEND,12/10/2019 12:00,12/10/2019 12:00,0.25,gal,1/9/2020 18:22,adminbomry,1,1,1,0,{'2020-01-09 18:22:20': 1},1,0
2164,Wichita KS,DefaultDept,005_02_PaintTopcoats,CA 8223/F27038 BASE/ CA 8200B ACTIVATOR BLEND,1/10/2020 12:00,1/10/2020 12:00,2.5,gal,7/1/2020 21:07,adminbomry,1,1,1,0,{'2020-07-01 21:07:35': 1},1,0
2165,Wichita KS,DefaultDept,005_02_PaintTopcoats,CA 8223/F27038 BASE/ CA 8200B ACTIVATOR BLEND,1/13/2020 12:00,1/13/2020 12:00,0.25,gal,7/1/2020 21:07,adminbomry,1,1,1,0,{'2020-07-01 21:07:35': 1},1,0
2166,Wichita KS,DefaultDept,005_02_PaintTopcoats,CA 8223/F27038 BASE/ CA 8200B ACTIVATOR BLEND,1/14/2020 12:00,1/14/2020 12:00,0.25,gal,7/1/2020 21:07,adminbomry,1,1,1,0,{'2020-07-01 21:07:35': 1},1,0
2167,Wichita KS,DefaultDept,005_02_PaintTopcoats,CA 8223/F27038 BASE/ CA 8200B ACTIVATOR BLEND,2/7/2020 12:00,2/7/2020 12:00,0.25,gal,7/1/2020 21:12,adminbomry,1,1,1,0,{'2020-07-01 21:12:32': 1},1,0
2168,Wichita KS,DefaultDept,005_02_PaintTopcoats,CA 8223/F27038 BASE/ CA 8200B ACTIVATOR BLEND,2/9/2020 12:00,2/9/2020 12:00,0.25,gal,7/1/2020 21:12,adminbomry,1,1,1,0,{'2020-07-01 21:12:32': 1},1,0
2169,Wichita KS,DefaultDept,005_02_PaintTopcoats,CA 8223/F27038 BASE/ CA 8200B ACTIVATOR BLEND,2/20/2020 12:00,2/20/2020 12:00,0.25,gal,7/1/2020 21:12,adminbomry,1,1,1,0,{'2020-07-01 21:12:32': 1},1,0
2170,Wichita KS,DefaultDept,005_02_PaintTopcoats,CA 8223/F27038 BASE/ CA 8200B ACTIVATOR BLEND,3/16/2020 12:00,3/16/2020 12:00,0.25,gal,7/1/2020 21:15,adminbomry,1,1,1,0,{'2020-07-01 21:15:03': 1},1,0
2171,Wichita KS,DefaultDept,005_02_PaintTopcoats,CA 8223/F27038 BASE/ CA 8200B ACTIVATOR BLEND,3/17/2020 12:00,3/17/2020 12:00,0.25,gal,7/1/2020 21:15,adminbomry,1,1,1,0,{'2020-07-01 21:15:03': 1},1,0
2172,Wichita KS,DefaultDept,005_02_PaintTopcoats,CA 8223/F27038 BASE/ CA 8200B ACTIVATOR BLEND,5/13/2020 12:00,5/13/2020 12:00,0.25,gal,7/27/2020 18:10,bomamanda,1,1,1,0,{'2020-07-27 18:10:32': 1},1,0
2173,Wichita KS,DefaultDept,005_02_PaintTopcoats,CA 8223/F27038 BASE/ CA 8200B ACTIVATOR BLEND,5/21/2020 12:00,5/21/2020 12:00,0.25,gal,7/27/2020 18:10,bomamanda,1,1,1,0,{'2020-07-27 18:10:32': 1},1,0
2174,Wichita KS,DefaultDept,005_02_PaintTopcoats,CA 8223/F27038 BASE/ CA 8200B ACTIVATOR BLEND,5/25/2020 12:00,5/25/2020 12:00,0.25,gal,7/27/2020 18:10,bomamanda,1,1,1,0,{'2020-07-27 18:10:32': 1},1,0
2175,Wichita KS,DefaultDept,005_02_PaintTopcoats,CA 8223/F27038 BASE/ CA 8200B ACTIVATOR BLEND,6/9/2020 12:00,6/9/2020 12:00,0.25,gal,7/27/2020 18:15,bomamanda,1,1,1,0,{'2020-07-27 18:15:38': 1},1,0
2176,Wichita KS,DefaultDept,005_02_PaintTopcoats,CA 8223/F27038 BASE/ CA 8200B ACTIVATOR BLEND,6/10/2020 12:00,6/10/2020 12:00,0.25,gal,7/27/2020 18:15,bomamanda,1,1,1,0,{'2020-07-27 18:15:38': 1},1,0
2177,Wichita KS,DefaultDept,005_02_PaintTopcoats,CA 8223/F27038 BASE/ CA 8200B ACTIVATOR BLEND,6/26/2020 12:00,6/26/2020 12:00,0.25,gal,7/27/2020 18:15,bomamanda,1,1,1,0,{'2020-07-27 18:15:38': 1},1,0
2178,Wichita KS,DefaultDept,005_02_PaintTopcoats,CA 8223/F27038 BASE/ CA 8200B ACTIVATOR BLEND,7/27/2020 12:00,7/27/2020 12:00,0.25,gal,9/4/2020 10:46,dlyon,1,1,1,0,{'2020-09-04 10:46:12': 1},1,0
2179,Wichita KS,DefaultDept,005_02_PaintTopcoats,CA 8223/F27038 BASE/ CA 8200B ACTIVATOR BLEND,7/28/2020 12:00,7/28/2020 12:00,2.5,gal,9/4/2020 10:46,dlyon,1,1,1,0,{'2020-09-04 10:46:12': 1},1,0
2180,Wichita KS,DefaultDept,005_02_PaintTopcoats,CA 8223/F27038 BASE/ CA 8200B ACTIVATOR BLEND,7/29/2020 12:00,7/29/2020 12:00,2.5,gal,9/4/2020 10:46,dlyon,1,1,1,0,{'2020-09-04 10:46:12': 1},1,0
2181,Wichita KS,DefaultDept,005_02_PaintTopcoats,CA 8223/F27038 BASE/ CA 8200B ACTIVATOR BLEND,8/3/2020 12:00,8/3/2020 12:00,0.25,gal,9/4/2020 11:00,dlyon,1,1,1,0,{'2020-09-04 11:00:35': 1},1,0
2182,Wichita KS,DefaultDept,005_02_PaintTopcoats,CA 8223/F27038 BASE/ CA 8200B ACTIVATOR BLEND,8/4/2020 12:00,8/4/2020 12:00,0.25,gal,9/4/2020 11:00,dlyon,1,1,1,0,{'2020-09-04 11:00:35': 1},1,0
2183,Wichita KS,DefaultDept,005_02_PaintTopcoats,CA 8223/F27038 BASE/ CA 8200B ACTIVATOR BLEND,8/10/2020 12:00,8/10/2020 12:00,0.25,gal,9/4/2020 11:00,dlyon,1,1,1,0,{'2020-09-04 11:00:35': 1},1,0
2184,Wichita KS,DefaultDept,005_02_PaintTopcoats,CA 8223/F27038 BASE/ CA 8200B ACTIVATOR BLEND,9/3/2020 12:00,9/3/2020 12:00,0.25,gal,10/22/2020 11:27,dlyon,1,1,1,0,{'2020-10-22 11:27:27': 1},1,0
2185,Wichita KS,DefaultDept,005_02_PaintTopcoats,CA 8223/F27038 BASE/ CA 8200B ACTIVATOR BLEND,10/24/2020 12:00,10/24/2020 12:00,0.25,gal,"2020-12-02 15:13:12,2020-12-02 15:13:12","dlyon,dlyon",2,2,1,1,{'2020-12-02 15:13:12': 2},1,1
2186,Wichita KS,DefaultDept,005_02_PaintTopcoats,CA 8223/F27038 BASE/ CA 8200B ACTIVATOR BLEND,11/5/2020 12:00,11/5/2020 12:00,0.25,gal,12/8/2020 9:27,dlyon,1,1,1,0,{'2020-12-08 09:27:32': 1},1,0
2187,Wichita KS,DefaultDept,005_02_PaintTopcoats,CA 8223/F27038 BASE/ CA 8200B ACTIVATOR BLEND,12/7/2020 12:00,12/7/2020 12:00,0.25,gal,1/8/2021 8:59,dlyon,1,1,1,0,{'2021-01-08 08:59:12': 1},1,0
2188,Wichita KS,DefaultDept,005_02_PaintTopcoats,CA 8223/F27038 BASE/ CA 8200B ACTIVATOR BLEND,12/8/2020 12:00,12/8/2020 12:00,0.25,gal,1/8/2021 8:59,dlyon,1,1,1,0,{'2021-01-08 08:59:12': 1},1,0
2189,Wichita KS,DefaultDept,005_02_PaintTopcoats,CA 8223/F27038 BASE/ CA 8200B ACTIVATOR BLEND,12/16/2020 12:00,12/16/2020 12:00,0.25,gal,1/8/2021 8:59,dlyon,1,1,1,0,{'2021-01-08 08:59:12': 1},1,0
2190,Wichita KS,DefaultDept,005_02_PaintTopcoats,CA 8273 I1149 BASE COMPONENT,2/7/2019 0:00,2/7/2019 0:00,1,gal,7/10/2019 9:06,adminbomgb,1,1,1,0,{'2019-07-10 09:06:14': 1},1,0
2191,Wichita KS,DefaultDept,005_02_PaintTopcoats,CA 8273 I1149 BASE COMPONENT,8/28/2020 12:00,8/28/2020 12:00,1,gal,9/4/2020 11:00,dlyon,1,1,1,0,{'2020-09-04 11:00:35': 1},1,0
2192,Wichita KS,DefaultDept,005_02_PaintTopcoats,CA 8273 I1149 BASE/ CA 8200B Activator Fly Away Kit,1/17/2019 0:00,1/17/2019 0:00,0.125,gal,7/3/2019 10:37,adminbomry,1,1,1,0,{'2019-07-03 10:37:16': 1},1,0
2193,Wichita KS,DefaultDept,005_02_PaintTopcoats,CA 8273 I1149 BASE/ CA 8200B Activator Fly Away Kit,1/23/2019 0:00,1/23/2019 0:00,0.125,gal,7/3/2019 10:37,adminbomry,1,1,1,0,{'2019-07-03 10:37:16': 1},1,0
2194,Wichita KS,DefaultDept,005_02_PaintTopcoats,CA 8273 I1149 BASE/ CA 8200B Activator Fly Away Kit,8/28/2020 12:00,8/28/2020 12:00,0.125,gal,9/4/2020 11:00,dlyon,1,1,1,0,{'2020-09-04 11:00:35': 1},1,0
2195,Wichita KS,DefaultDept,005_02_PaintTopcoats,CA 8273 I2221 BASE COMPONENT,8/2/2019 0:00,8/2/2019 0:00,4,gal,9/23/2019 10:35,adminbomry,1,1,1,0,{'2019-09-23 10:35:10': 1},1,0
2196,Wichita KS,DefaultDept,005_02_PaintTopcoats,CA 8273 I2221 BASE COMPONENT,9/12/2019 12:00,9/12/2019 12:00,4,gal,11/25/2019 9:54,adminbomry,1,1,1,0,{'2019-11-25 09:54:31': 1},1,0
2197,Wichita KS,DefaultDept,005_02_PaintTopcoats,CA 8273 I2221 BASE COMPONENT,8/28/2020 12:00,8/28/2020 12:00,4,gal,9/4/2020 11:00,dlyon,1,1,1,0,{'2020-09-04 11:00:35': 1},1,0
2198,Wichita KS,DefaultDept,005_02_PaintTopcoats,CA 8273 I2221 BASE COMPONENT,11/28/2020 12:00,11/28/2020 12:00,1,gal,12/8/2020 9:27,dlyon,1,1,1,0,{'2020-12-08 09:27:32': 1},1,0
2199,Wichita KS,DefaultDept,005_02_PaintTopcoats,CA 8273 I7100 BASE COMPONENT,2/28/2020 12:00,2/28/2020 12:00,1,gal,7/1/2020 21:46,adminbomry,1,1,1,0,{'2020-07-01 21:46:19': 1},1,0
2200,Wichita KS,DefaultDept,005_02_PaintTopcoats,CA 8273 I7100 BASE COMPONENT,8/28/2020 12:00,8/28/2020 12:00,1,gal,9/4/2020 11:00,dlyon,1,1,1,0,{'2020-09-04 11:00:35': 1},1,0
2201,Wichita KS,DefaultDept,005_02_PaintTopcoats,CA 8273 I8012 BASE COMPONENT,2/12/2019 0:00,2/12/2019 0:00,1,gal,7/10/2019 9:06,adminbomgb,1,1,1,0,{'2019-07-10 09:06:14': 1},1,0
2202,Wichita KS,DefaultDept,005_02_PaintTopcoats,CA 8273 I8012 BASE COMPONENT,2/14/2019 0:00,2/14/2019 0:00,1,gal,7/10/2019 9:06,adminbomgb,1,1,1,0,{'2019-07-10 09:06:14': 1},1,0
2203,Wichita KS,DefaultDept,005_02_PaintTopcoats,CA 8273/2247 BASE / CA 8200B ACTIVATOR BLEND,6/24/2019 0:00,6/24/2019 0:00,0.25,gal,7/5/2019 13:18,adminbomry,1,1,1,0,{'2019-07-05 13:18:36': 1},1,0
2204,Wichita KS,DefaultDept,005_02_PaintTopcoats,CA 8273/F36118 BASE COMPONENT,4/25/2019 0:00,4/25/2019 0:00,1,gal,7/5/2019 11:50,adminbomry,1,1,1,0,{'2019-07-05 11:50:11': 1},1,0
2205,Wichita KS,DefaultDept,005_02_PaintTopcoats,CA 8273/F36118 BASE COMPONENT,7/3/2019 0:00,7/3/2019 0:00,2,gal,8/9/2019 10:06,adminbomry,1,1,1,0,{'2019-08-09 10:06:56': 1},1,0
2206,Wichita KS,DefaultDept,005_02_PaintTopcoats,CA 8273/F36118 BASE COMPONENT,9/12/2019 12:00,9/12/2019 12:00,2,gal,11/25/2019 9:54,adminbomry,1,1,1,0,{'2019-11-25 09:54:31': 1},1,0
2207,Wichita KS,DefaultDept,005_02_PaintTopcoats,CA 8273/F36118 BASE COMPONENT,9/13/2019 12:00,9/13/2019 12:00,1,gal,11/25/2019 9:54,adminbomry,1,1,1,0,{'2019-11-25 09:54:31': 1},1,0
2208,Wichita KS,DefaultDept,005_02_PaintTopcoats,CA 8273/F36118 BASE COMPONENT,3/20/2020 12:00,3/20/2020 12:00,1,gal,7/1/2020 21:15,adminbomry,1,1,1,0,{'2020-07-01 21:15:03': 1},1,0
2209,Wichita KS,DefaultDept,005_02_PaintTopcoats,CA 8273/F36118 BASE COMPONENT,8/28/2020 12:00,8/28/2020 12:00,2,gal,9/4/2020 11:00,dlyon,1,1,1,0,{'2020-09-04 11:00:35': 1},1,0
2210,Wichita KS,DefaultDept,005_02_PaintTopcoats,CA 8273/F36118 BASE COMPONENT,9/14/2020 12:00,9/14/2020 12:00,1,gal,10/22/2020 11:27,dlyon,1,1,1,0,{'2020-10-22 11:27:27': 1},1,0
2211,Wichita KS,DefaultDept,005_02_PaintTopcoats,CA 8273/F36118 BASE COMPONENT,9/14/2020 12:00,9/14/2020 12:00,2,gal,10/22/2020 11:27,dlyon,1,1,1,0,{'2020-10-22 11:27:27': 1},1,0
2212,Wichita KS,DefaultDept,005_02_PaintTopcoats,CA 8273/I1149 BASE/ CA 8200B M&D ACTIVATOR BLEND,1/24/2019 0:00,1/24/2019 0:00,0.25,gal,"2019-07-03 10:37:16,2019-07-03 10:37:16","adminbomry,adminbomry",2,2,1,1,{'2019-07-03 10:37:16': 2},1,1
2213,Wichita KS,DefaultDept,005_02_PaintTopcoats,CA 8273/I1149 BASE/ CA 8200B M&D ACTIVATOR BLEND,4/30/2019 0:00,4/30/2019 0:00,0.25,gal,7/5/2019 11:50,adminbomry,1,1,1,0,{'2019-07-05 11:50:11': 1},1,0
2214,Wichita KS,DefaultDept,005_02_PaintTopcoats,CA 8273/I1376 BASE COMPONENT,6/27/2019 0:00,6/27/2019 0:00,1,gal,7/5/2019 13:18,adminbomry,1,1,1,0,{'2019-07-05 13:18:36': 1},1,0
2215,Wichita KS,DefaultDept,005_02_PaintTopcoats,CA 8273/I1376 BASE/ CA 8200B Activator Fly away kit,5/13/2019 0:00,5/13/2019 0:00,0.125,gal,7/5/2019 12:02,adminbomry,1,1,1,0,{'2019-07-05 12:02:13': 1},1,0
2216,Wichita KS,DefaultDept,005_02_PaintTopcoats,CA 8273/I1376 BASE/ CA 8200B Activator Fly away kit,6/24/2019 0:00,6/24/2019 0:00,0.125,gal,7/5/2019 13:18,adminbomry,1,1,1,0,{'2019-07-05 13:18:36': 1},1,0
2217,Wichita KS,DefaultDept,005_02_PaintTopcoats,CA 8273/I1377 - CA 8200B M&D ACTIVATOR,10/31/2019 12:00,10/31/2019 12:00,0.125,gal,12/19/2019 16:04,adminbomry,1,1,1,0,{'2019-12-19 16:04:12': 1},1,0
2218,Wichita KS,DefaultDept,005_02_PaintTopcoats,CA 8273/I2238 BASE COMPONENT,4/2/2019 0:00,4/2/2019 0:00,1,gal,7/5/2019 11:50,adminbomry,1,1,1,0,{'2019-07-05 11:50:11': 1},1,0
2219,Wichita KS,DefaultDept,005_02_PaintTopcoats,CA 8273/I2238 BASE COMPONENT,4/10/2019 0:00,4/10/2019 0:00,1,gal,7/5/2019 11:50,adminbomry,1,1,1,0,{'2019-07-05 11:50:11': 1},1,0
2220,Wichita KS,DefaultDept,005_02_PaintTopcoats,CA 8273/I2238 BASE COMPONENT,4/11/2019 0:00,4/11/2019 0:00,1,gal,7/5/2019 11:50,adminbomry,1,1,1,0,{'2019-07-05 11:50:11': 1},1,0
2221,Wichita KS,DefaultDept,005_02_PaintTopcoats,CA 8273/I2238 BASE COMPONENT,5/7/2019 0:00,5/7/2019 0:00,-1,gal,7/5/2019 12:02,adminbomry,1,1,1,0,{'2019-07-05 12:02:13': 1},1,0
2222,Wichita KS,DefaultDept,005_02_PaintTopcoats,CA 8273/I2238 BASE COMPONENT,4/2/2020 12:00,4/2/2020 12:00,1,gal,7/27/2020 18:06,bomamanda,1,1,1,0,{'2020-07-27 18:06:19': 1},1,0
2223,Wichita KS,DefaultDept,005_02_PaintTopcoats,CA 8273/I2247 - CA 8200B M&D ACTIVATOR,5/13/2019 0:00,5/13/2019 0:00,0.125,gal,7/5/2019 12:02,adminbomry,1,1,1,0,{'2019-07-05 12:02:13': 1},1,0
2224,Wichita KS,DefaultDept,005_02_PaintTopcoats,CA 8273/I2247 - CA 8200B M&D ACTIVATOR,9/3/2019 12:00,9/3/2019 12:00,0.125,gal,11/25/2019 9:54,adminbomry,1,1,1,0,{'2019-11-25 09:54:31': 1},1,0
2225,Wichita KS,DefaultDept,005_02_PaintTopcoats,CA 8273/I2247 Base Component,11/18/2020 12:00,11/18/2020 12:00,1,gal,"2020-12-08 11:57:25,2020-12-08 11:57:25","dlyon,dlyon",2,2,1,1,{'2020-12-08 11:57:25': 2},1,1
2226,Wichita KS,DefaultDept,005_02_PaintTopcoats,CA 8273/I2326 BASE COMPONENT,12/21/2019 12:00,12/21/2019 12:00,1,gal,1/9/2020 18:22,adminbomry,1,1,1,0,{'2020-01-09 18:22:20': 1},1,0
2227,Wichita KS,DefaultDept,005_02_PaintTopcoats,CA 8273/I2326 BASE COMPONENT,2/7/2020 12:00,2/7/2020 12:00,1,gal,7/1/2020 21:12,adminbomry,1,1,1,0,{'2020-07-01 21:12:32': 1},1,0
2228,Wichita KS,DefaultDept,005_02_PaintTopcoats,CA 8273/I2326 BASE/ CA 8200B ACTIVATOR  BLEND,4/2/2019 0:00,4/2/2019 0:00,0.25,gal,7/5/2019 11:50,adminbomry,1,1,1,0,{'2019-07-05 11:50:11': 1},1,0
2229,Wichita KS,DefaultDept,005_02_PaintTopcoats,CA 8273/I2326 BASE/ CA 8200B ACTIVATOR  BLEND,4/24/2019 0:00,4/24/2019 0:00,0.25,gal,7/5/2019 11:50,adminbomry,1,1,1,0,{'2019-07-05 11:50:11': 1},1,0
2230,Wichita KS,DefaultDept,005_02_PaintTopcoats,CA 8273/I2326 BASE/ CA 8200B ACTIVATOR  BLEND,4/26/2019 0:00,4/26/2019 0:00,0.25,gal,7/5/2019 11:50,adminbomry,1,1,1,0,{'2019-07-05 11:50:11': 1},1,0
2231,Wichita KS,DefaultDept,005_02_PaintTopcoats,CA 8273/I2326 BASE/ CA 8200B ACTIVATOR  BLEND,6/25/2020 12:00,6/25/2020 12:00,0.25,gal,7/27/2020 18:15,bomamanda,1,1,1,0,{'2020-07-27 18:15:38': 1},1,0
2232,Wichita KS,DefaultDept,005_02_PaintTopcoats,CA 8273/I2326 BASE/ CA 8200B ACTIVATOR  BLEND,7/15/2020 12:00,7/15/2020 12:00,0.25,gal,9/4/2020 10:46,dlyon,1,1,1,0,{'2020-09-04 10:46:12': 1},1,0
2233,Wichita KS,DefaultDept,005_02_PaintTopcoats,CA 8273/I2326 BASE/ CA 8200B ACTIVATOR  BLEND,8/4/2020 12:00,8/4/2020 12:00,0.25,gal,9/4/2020 11:00,dlyon,1,1,1,0,{'2020-09-04 11:00:35': 1},1,0
2234,Wichita KS,DefaultDept,005_02_PaintTopcoats,CA 8273/I2326 BASE/ CA 8200B ACTIVATOR  BLEND,8/12/2020 12:00,8/12/2020 12:00,0.25,gal,9/4/2020 11:00,dlyon,1,1,1,0,{'2020-09-04 11:00:35': 1},1,0
2235,Wichita KS,DefaultDept,005_02_PaintTopcoats,CA 8273/I2335 Base Component - CA 8200B Activator Blend,5/13/2019 0:00,5/13/2019 0:00,0.125,gal,7/5/2019 12:02,adminbomry,1,1,1,0,{'2019-07-05 12:02:13': 1},1,0
2236,Wichita KS,DefaultDept,005_02_PaintTopcoats,CA 8273/I2335 Base Component - CA 8200B Activator Blend,6/24/2019 0:00,6/24/2019 0:00,0.25,gal,7/5/2019 13:18,adminbomry,1,1,1,0,{'2019-07-05 13:18:36': 1},1,0
2237,Wichita KS,DefaultDept,005_02_PaintTopcoats,CA 8273/I2869 - CA 8200B M&D ACTIVATOR COMPONENT,10/31/2019 12:00,10/31/2019 12:00,0.125,gal,12/19/2019 16:04,adminbomry,1,1,1,0,{'2019-12-19 16:04:12': 1},1,0
2238,Wichita KS,DefaultDept,005_02_PaintTopcoats,CA 8273/I2869 BASE COMPONENT,4/2/2019 0:00,4/2/2019 0:00,1,gal,7/5/2019 11:50,adminbomry,1,1,1,0,{'2019-07-05 11:50:11': 1},1,0
2239,Wichita KS,DefaultDept,005_02_PaintTopcoats,CA 8273/I2869 BASE COMPONENT,4/10/2019 0:00,4/10/2019 0:00,1,gal,7/5/2019 11:50,adminbomry,1,1,1,0,{'2019-07-05 11:50:11': 1},1,0
2240,Wichita KS,DefaultDept,005_02_PaintTopcoats,CA 8273/I2869 BASE COMPONENT,4/11/2019 0:00,4/11/2019 0:00,1,gal,7/5/2019 11:50,adminbomry,1,1,1,0,{'2019-07-05 11:50:11': 1},1,0
2241,Wichita KS,DefaultDept,005_02_PaintTopcoats,CA 8273/I7100 BASE/ CA 8200B Activator Fly Away Kit,1/17/2019 0:00,1/17/2019 0:00,0.125,gal,7/3/2019 10:37,adminbomry,1,1,1,0,{'2019-07-03 10:37:16': 1},1,0
2242,Wichita KS,DefaultDept,005_02_PaintTopcoats,CA 8273/I7100 BASE/ CA 8200B Activator Fly Away Kit,1/23/2019 0:00,1/23/2019 0:00,0.125,gal,7/3/2019 10:37,adminbomry,1,1,1,0,{'2019-07-03 10:37:16': 1},1,0
2243,Wichita KS,DefaultDept,005_02_PaintTopcoats,CA 8273/I7100 BASE/ CA 8200B Activator Fly Away Kit,6/2/2020 12:00,6/2/2020 12:00,0.125,gal,7/27/2020 18:15,bomamanda,1,1,1,0,{'2020-07-27 18:15:38': 1},1,0
2244,Wichita KS,DefaultDept,005_02_PaintTopcoats,CA 8273/I7100 BASE/ CA 8200B Activator Fly Away Kit,8/28/2020 12:00,8/28/2020 12:00,0.125,gal,9/4/2020 11:00,dlyon,1,1,1,0,{'2020-09-04 11:00:35': 1},1,0
2245,Wichita KS,DefaultDept,005_02_PaintTopcoats,CA 8273/I7100 Base - CA 8200B Activator,1/24/2019 0:00,1/24/2019 0:00,0.25,gal,"2019-07-03 10:37:16,2019-07-03 10:37:16","adminbomry,adminbomry",2,2,1,1,{'2019-07-03 10:37:16': 2},1,1
2246,Wichita KS,DefaultDept,005_02_PaintTopcoats,CA 8273/I7100 Base - CA 8200B Activator,4/30/2019 0:00,4/30/2019 0:00,0.25,gal,7/5/2019 11:50,adminbomry,1,1,1,0,{'2019-07-05 11:50:11': 1},1,0
2247,Wichita KS,DefaultDept,005_02_PaintTopcoats,CA 8273/I7162 BASE COMPONENT,8/17/2019 0:00,8/17/2019 0:00,1,gal,9/23/2019 10:35,adminbomry,1,1,1,0,{'2019-09-23 10:35:10': 1},1,0
2248,Wichita KS,DefaultDept,005_02_PaintTopcoats,CA 8273/I7162 BASE COMPONENT,8/19/2019 0:00,8/19/2019 0:00,-1,gal,9/23/2019 10:35,adminbomry,1,1,1,0,{'2019-09-23 10:35:10': 1},1,0
2249,Wichita KS,DefaultDept,005_02_PaintTopcoats,CA 8273/I7162 BASE COMPONENT,9/11/2019 12:00,9/11/2019 12:00,1,gal,11/25/2019 9:54,adminbomry,1,1,1,0,{'2019-11-25 09:54:31': 1},1,0
2250,Wichita KS,DefaultDept,005_02_PaintTopcoats,CA 8273/I7162 BASE COMPONENT,10/4/2019 12:00,10/4/2019 12:00,2,gal,12/19/2019 16:04,adminbomry,1,1,1,0,{'2019-12-19 16:04:12': 1},1,0
2251,Wichita KS,DefaultDept,005_02_PaintTopcoats,CA 8273/I7162 BASE COMPONENT,2/28/2020 12:00,2/28/2020 12:00,0.125,gal,7/1/2020 21:12,adminbomry,1,1,1,0,{'2020-07-01 21:12:32': 1},1,0
2252,Wichita KS,DefaultDept,005_02_PaintTopcoats,CA 8273/I7162 BASE COMPONENT,3/7/2020 12:00,3/7/2020 12:00,0.125,gal,7/1/2020 21:15,adminbomry,1,1,1,0,{'2020-07-01 21:15:03': 1},1,0
2253,Wichita KS,DefaultDept,005_02_PaintTopcoats,CA 8273/I7162 BASE COMPONENT,6/11/2020 12:00,6/11/2020 12:00,0.125,gal,7/27/2020 18:15,bomamanda,1,1,1,0,{'2020-07-27 18:15:38': 1},1,0
2254,Wichita KS,DefaultDept,005_02_PaintTopcoats,CA 8273/I7162 BASE COMPONENT,6/16/2020 12:00,6/16/2020 12:00,1,gal,7/27/2020 18:15,bomamanda,1,1,1,0,{'2020-07-27 18:15:38': 1},1,0
2255,Wichita KS,DefaultDept,005_02_PaintTopcoats,CA 8273/I7162 BASE COMPONENT,7/29/2020 12:00,7/29/2020 12:00,1,gal,9/4/2020 10:46,dlyon,1,1,1,0,{'2020-09-04 10:46:12': 1},1,0
2256,Wichita KS,DefaultDept,005_02_PaintTopcoats,CA 8273/I7162 BASE COMPONENT,8/28/2020 12:00,8/28/2020 12:00,1,gal,9/4/2020 11:00,dlyon,1,1,1,0,{'2020-09-04 11:00:35': 1},1,0
2257,Wichita KS,DefaultDept,005_02_PaintTopcoats,CA 8273/I7162 BASE COMPONENT,10/2/2020 12:00,10/2/2020 12:00,2,gal,12/2/2020 15:13,dlyon,1,1,1,0,{'2020-12-02 15:13:12': 1},1,0
2258,Wichita KS,DefaultDept,005_02_PaintTopcoats,CA 8273/I7162 BASE COMPONENT,11/2/2020 12:00,11/2/2020 12:00,1,gal,12/8/2020 9:27,dlyon,1,1,1,0,{'2020-12-08 09:27:32': 1},1,0
2259,Wichita KS,DefaultDept,005_02_PaintTopcoats,CA 8273/I7162 BASE COMPONENT,11/3/2020 12:00,11/3/2020 12:00,0.125,gal,12/8/2020 9:27,dlyon,1,1,1,0,{'2020-12-08 09:27:32': 1},1,0
2260,Wichita KS,DefaultDept,005_02_PaintTopcoats,CA 8273/I7162 BASE COMPONENT,11/12/2020 12:00,11/12/2020 12:00,1,gal,12/8/2020 9:27,dlyon,1,1,1,0,{'2020-12-08 09:27:32': 1},1,0
2261,Wichita KS,DefaultDept,005_02_PaintTopcoats,CA 8273/I7162 BASE/ CA 8200B ACTIVATOR BLEND,1/17/2019 0:00,1/17/2019 0:00,0.125,gal,7/3/2019 10:37,adminbomry,1,1,1,0,{'2019-07-03 10:37:16': 1},1,0
2262,Wichita KS,DefaultDept,005_02_PaintTopcoats,CA 8273/I7162 BASE/ CA 8200B ACTIVATOR BLEND,1/23/2019 0:00,1/23/2019 0:00,0.125,gal,7/3/2019 10:37,adminbomry,1,1,1,0,{'2019-07-03 10:37:16': 1},1,0
2263,Wichita KS,DefaultDept,005_02_PaintTopcoats,CA 8273/I7162 BASE/ CA 8200B ACTIVATOR BLEND,1/24/2019 0:00,1/24/2019 0:00,0.25,gal,"2019-07-03 10:37:16,2019-07-03 10:37:16","adminbomry,adminbomry",2,2,1,1,{'2019-07-03 10:37:16': 2},1,1
2264,Wichita KS,DefaultDept,005_02_PaintTopcoats,CA 8273/I7162 BASE/ CA 8200B ACTIVATOR BLEND,3/8/2019 0:00,3/8/2019 0:00,0.125,gal,7/5/2019 13:44,adminbomgb,1,1,1,0,{'2019-07-05 13:44:50': 1},1,0
2265,Wichita KS,DefaultDept,005_02_PaintTopcoats,CA 8273/I7162 BASE/ CA 8200B ACTIVATOR BLEND,3/15/2019 0:00,3/15/2019 0:00,0.125,gal,7/5/2019 13:44,adminbomgb,1,1,1,0,{'2019-07-05 13:44:50': 1},1,0
2266,Wichita KS,DefaultDept,005_02_PaintTopcoats,CA 8273/I7162 BASE/ CA 8200B ACTIVATOR BLEND,6/2/2020 12:00,6/2/2020 12:00,0.125,gal,7/27/2020 18:15,bomamanda,1,1,1,0,{'2020-07-27 18:15:38': 1},1,0
2267,Wichita KS,DefaultDept,005_02_PaintTopcoats,CA 8273/I7162 BASE/ CA 8200B ACTIVATOR BLEND,10/2/2020 12:00,10/2/2020 12:00,0.125,gal,12/2/2020 15:13,dlyon,1,1,1,0,{'2020-12-02 15:13:12': 1},1,0
2268,Wichita KS,DefaultDept,005_02_PaintTopcoats,CA 8273/I7177 BASE COMPONENT,2/17/2020 12:00,2/17/2020 12:00,1,gal,7/1/2020 21:12,adminbomry,1,1,1,0,{'2020-07-01 21:12:32': 1},1,0
2269,Wichita KS,DefaultDept,005_02_PaintTopcoats,CA 8273/I7177 BASE COMPONENT,5/11/2020 12:00,5/11/2020 12:00,1,gal,7/27/2020 18:10,bomamanda,1,1,1,0,{'2020-07-27 18:10:32': 1},1,0
2270,Wichita KS,DefaultDept,005_02_PaintTopcoats,CA 8273/I7177 BASE COMPONENT,6/16/2020 12:00,6/16/2020 12:00,1,gal,7/27/2020 18:15,bomamanda,1,1,1,0,{'2020-07-27 18:15:38': 1},1,0
2271,Wichita KS,DefaultDept,005_02_PaintTopcoats,CA 8273/I7230 BASE COMPONENT,2/17/2020 12:00,2/17/2020 12:00,1,gal,7/1/2020 21:46,adminbomry,1,1,1,0,{'2020-07-01 21:46:19': 1},1,0
2272,Wichita KS,DefaultDept,005_02_PaintTopcoats,CA 8273/I7230 BASE COMPONENT,3/24/2020 12:00,3/24/2020 12:00,1,gal,7/1/2020 22:02,adminbomry,1,1,1,0,{'2020-07-01 22:02:01': 1},1,0
2273,Wichita KS,DefaultDept,005_02_PaintTopcoats,CA 8273/I7230 BASE COMPONENT,5/11/2020 12:00,5/11/2020 12:00,1,gal,7/27/2020 18:10,bomamanda,1,1,1,0,{'2020-07-27 18:10:32': 1},1,0
2274,Wichita KS,DefaultDept,005_02_PaintTopcoats,CA 8273/I7230 BASE COMPONENT,6/16/2020 12:00,6/16/2020 12:00,1,gal,7/27/2020 18:15,bomamanda,1,1,1,0,{'2020-07-27 18:15:38': 1},1,0
2275,Wichita KS,DefaultDept,005_02_PaintTopcoats,CA 8273/I7230 BASE COMPONENT,11/12/2020 12:00,11/12/2020 12:00,1,gal,12/8/2020 9:27,dlyon,1,1,1,0,{'2020-12-08 09:27:32': 1},1,0
2276,Wichita KS,DefaultDept,005_02_PaintTopcoats,CA 8273/I7427 BASE COMPONENT,1/29/2019 0:00,1/29/2019 0:00,1,gal,7/3/2019 10:37,adminbomry,1,1,1,0,{'2019-07-03 10:37:16': 1},1,0
2277,Wichita KS,DefaultDept,005_02_PaintTopcoats,CA 8273/I7427 BASE COMPONENT,1/29/2019 0:00,1/29/2019 0:00,3,gal,7/3/2019 10:37,adminbomry,1,1,1,0,{'2019-07-03 10:37:16': 1},1,0
2278,Wichita KS,DefaultDept,005_02_PaintTopcoats,CA 8273/I8012 BASE/ CA 8200B ACTIVATOR BLEND,2/12/2019 0:00,2/12/2019 0:00,0.125,gal,7/10/2019 9:06,adminbomgb,1,1,1,0,{'2019-07-10 09:06:14': 1},1,0
2279,Wichita KS,DefaultDept,005_02_PaintTopcoats,CA 8273/I8012 BASE/ CA 8200B ACTIVATOR BLEND,2/14/2019 0:00,2/14/2019 0:00,0.125,gal,7/10/2019 9:06,adminbomgb,1,1,1,0,{'2019-07-10 09:06:14': 1},1,0
2280,Wichita KS,DefaultDept,005_02_PaintTopcoats,CA 8273/I8012 BASE/ CA 8200B ACTIVATOR BLEND,8/2/2019 0:00,8/2/2019 0:00,0.125,gal,9/23/2019 10:35,adminbomry,1,1,1,0,{'2019-09-23 10:35:10': 1},1,0
2281,Wichita KS,DefaultDept,005_02_PaintTopcoats,CA 8273/I8012 BASE/ CA 8200B ACTIVATOR BLEND,8/7/2019 0:00,8/7/2019 0:00,0.125,gal,9/23/2019 10:35,adminbomry,1,1,1,0,{'2019-09-23 10:35:10': 1},1,0
2282,Wichita KS,DefaultDept,005_02_PaintTopcoats,CA 8273/I8012 BASE/ CA 8200B ACTIVATOR BLEND,10/31/2019 12:00,10/31/2019 12:00,0.5,gal,12/19/2019 16:04,adminbomry,1,1,1,0,{'2019-12-19 16:04:12': 1},1,0
